addr1,addr2,areacode,booktour,cat1,cat2,cat3,contentid,contenttypeid,createdtime,firstimage,firstimage2,mapx,mapy,mlevel,modifiedtime,readcount,sigungucode,tel,title,zipcode,overview
전북 장수군 계남면 장안리,장수읍 덕산리 일대,37,0,A01,A0101,A01010300,126258,12,20031204090000,http://tong.visitkorea.or.kr/cms/resource/73/2705873_image2_1.jpg,http://tong.visitkorea.or.kr/cms/resource/73/2705873_image3_1.jpg,127.5441871386,35.6253259956,6,20211216234543,29377,11,,장안산군립공원,"597-830,1","높이 1,237m의 장안산은 1986년에 군립공원으로 지정되었다. 덕산용소와 방화동, 지지계곡 지구로 나뉘어져 있다. 기암괴석과 원시수림이 울창하고 심산유곡에 형성된 연못과 폭포가 절경을 이루는 관광지로 덕산계곡을 비롯한 크고 작은 계곡 26개소 및 윗용소, 아랫용소 등 7개의 연못, 지소반석 등 14개의 기암괴석, 5군데의 약수터 등 주요경관이 울창한 수림과 어울려 수려함을 이루고 있다. 특히, 장안산의 또 하나의 비경은 산등에서 동쪽 능선으로 등산로를 따라 펼처진 광활한 억새밭이다. 흐드러지게 핀 억새밭에 만추의 바람이 불면, 온 산등선이 하얀 억새의 파도로 춤추는 듯한 풍경은 장관을 이루며 등산객들을 경탄케 한다. 

 덕산계곡
장수읍에서 논개사당 뒤로 6km쯤 가파른 덕산고개를 넘어가면 몇 채의 집이 있는 덕산마을이 나온다. 영화 '남부군' 에서 6.25 때 회문산에서 철수한 전북도당이 덕유산에서 이현상 부대인 남부군과 합류, 빨치산 오백명이 1년 만에 처음으로 옷을 벗고 목욕하는 인상적인 장면이 바로 이 계곡이다. 그만큼 덕산계곡은 깊고, 은밀하며 물은 맑고 깨끗하다.

 방화동 가족휴가촌
장안산 상류에서부터 죽산리까지 30리 골짜기 중간 쯤에 물길이 S자를 그리며 흘러가는 편편한 곳에 방화동이 있다. 주변 자연수림과 물길이 어우러져 천혜의 경관을 이루는 곳에 가족 휴양을 위한 휴가촌을 조성해 놓았다. 진입도가 말끔히 포장되어 접근하기가 쉬우며 휴가촌에는 체육광장, 자동차 야영장, 넓은
주차장 등의 시설이 들어서 있고 가족호텔과 휴양콘도미니엄 등도 건설되고 있다.

 지지계곡
장안산과 백운산 사이의 무룡고개를 상류로 서남쪽에 장장 오십리를 감돌아 번암면 소재지로 나오는 골짜기를 지지계곡이라 한다. 88고속도로에서 진입할 수도 있고 남원에서 국도로 장수 가는 길목으로 가다가 번암 소재지가 나오면 여기서 오른쪽 골짜기로 꺾어 올라가면 여기서부터 지지계곡이 시작된다. 번암교를 건너 동화초등학교가 있는 동화리와 길다란 동화댐을 끼고 오르면 군데군데 마을이 형성되어 있는 지지리를 거쳐 3거리 청옥마을에 당도하면 하늘이 보이지 않는 수림 속에 4줄기 물줄기가 내려 쏟아지는 청옥폭포를 만난다."
전라북도 장수군 장수읍 석천리,,37,0,A02,A0201,A02010200,127902,12,20031120090000,,,127.4699137045,35.6045853774,6,20220616174953,16933,11,,합미성(장수),55644,"논개의 고장이기도 한 장수군의 장수읍 대성리, 팔공산(1,151m) 중턱에는 합미성이 있다. 후백제시대의 산성으로 둘레 400m, 높이 7m의 석성이다. 당시 군량미를 이곳에 모아두었다 하여 합미성(合米城)이라 부른다. 이 성은 최근 고고학자들의 고증에 의하면 백제 때 축조한 성이라고 하니 백제가 강성해지면서 마한을 병합할 때나, 아니면 백제 근초고왕 때 전방기지로  축성된 성인 듯하고 1천 5백년 전이나 1천 6백년 전의 축성이라고 보는데 현재까지 성의 형태가 온전하게 유지되어 그 시대의 축성기술을 알 수 있다."
전라북도 장수군 천천면 신광길 31,,37,0,A02,A0201,A02010800,127123,12,20031114090000,http://tong.visitkorea.or.kr/cms/resource/78/1605378_image2_1.jpg,http://tong.visitkorea.or.kr/cms/resource/78/1605378_image3_1.jpg,127.4949032902,35.7050660889,6,20221020171021,19597,11,,신광사(장수),55610,"신광사는 830년(신라 흥덕왕 5년)에 무주 무염이 창건했다.  무염은 충남 보령 성주사에서 구산선문의 하나인 성주산문을 일으켜 학도들을 지도하다가 이 지방에는 그럴만한 절이 없는 것을 안타깝게 여기고 이 절을 짓게 되었다. 절 이름은 항상 새로운 인재가 자라나라는 뜻에서 신광사라고 했다. 신광사가 창건된지 733년이 되는 정유재란 때 화재로 소실되었다.그후 51년이 지난 1549년(조선조 인조 27년)에 전해선사에 의하여 중건되었다. 신광사 대웅전은 지방유형문화재로 지정하였고 전면3칸, 측면 2칸 목조  맞배집으로 지붕은 너새라는 돌로 이어있다.신광사는 대웅전, 명부전, 요사채, 산신각, 객사 등으로 이루어져 있다."
전북 장수군 번암면 지지리 438-3,,37,0,A01,A0101,A01010900,127066,12,20030925090000,,,127.6056323037,35.6024991068,6,20220915150809,38264,11,,지지계곡,"597-814,3","번암면 지지리와 장계면 대곡리의 경계를 이루는 계곡으로 맑은 물은 성난 소리를 내며 높고 깊은 바위를 치고 달린다. 장안산 군립공원 북쪽의  영취산(1,075.6m)에서 뻗은 산줄기 하나는 경남 함양군 백전면을 거쳐 지리산으로 가고, 다른 하나는 장안산으로 이어진 협곡을 향해 내달린다. 이곳에 지지계곡이 자리한다. 지지리, 동화리를 거쳐 동화댐저수지로 물이 모여든다. 길이는 장장 10km이다.  울창한 수림과 청류수가 조화를 이뤄 사시사철 아름답지만 특히 만추의  계곡은 온통 붉어져 탄성이 저절로 나온다. 가까이에 있는 바위목이라는 곳은 단군대도(檀君大道)를 신봉하는 교도들이 살았다는 곳이다. 옛 은사나  처사가 바위에 새겨 남긴 글씨를 찾아볼 수 있다. 지금은 길이 잘 닦여 번암면에서 장계면이나 장수읍으로 통하는 도로가 나 있다. 또한, 울창한 수림 중의 하나인 고로쇠 나무에서 23월에는 고로쇠 물을 채취해 농가의 소득을 높이고 있으며 두릅, 더덕, 도라지, 취나물, 고사리, 표고 버섯, 한봉 등이 채취되고 있다."
전라북도 장수군 장수읍 덕산리 772,,37,0,A01,A0101,A01010900,127067,12,20030925090000,,,127.5433850427,35.6021341648,6,20210715023128,44292,11,,덕산계곡,55639,"장안산 군립공원 제일 계곡인 덕산은 울창한 원시림과 맑은 물, 기암괴석이 조화되어 절경을 이루고 있어  용이 살았다는  용소가 2개소, 민들바위, 용바위, 신선바위, 정승바위 등 20여 개의 기암과 은골, 절골, 감골 등 헤아릴 수 없는 골짜기와 맑은 물이 흐르는 크고 작은 소가 10여 군데나 있다.

 장수읍에서 논개 사당 뒤로 6km쯤 가파른 덕산고개를 넘어가면 몇 채의 집이 있는 마을(덕산마을)이 나오는데, 영화 남부군에서 6.25때 회문산에서 철수한 전북도당이 덕유산에서 이현상부대인 남부군과 합류한  빨치산 오백명이 1년만에 처음으로 옷을 벗고 목욕하는 인상적인 장면이 바로 이 계곡이다. 그만큼 덕산계곡은 깊고, 은밀하며, 물이 맑고 깨끗하다."
전라북도 장수군 계북면 양악리 1,,37,0,A01,A0101,A01010900,127068,12,20030925090000,http://tong.visitkorea.or.kr/cms/resource/33/798833_image2_1.jpg,http://tong.visitkorea.or.kr/cms/resource/33/798833_image3_1.jpg,127.6595111326,35.8017607968,6,20211014192559,38669,11,,토옥동계곡,55601,"북덕유산과 남덕유산 사이의 골짜기이다. 웅장하고 수려한 계곡으로 역사적으로 유서깊은 곳이며 경관이 수려한 유흥지로 고산식물의 채집 연구에도 빼놓을 수 없는 명승지이다. 주변에는 축탑 연대는 확실치 안으나 심상사라는 절에 세워졌던 5층 석탑으로 현재는 4층만 남아 있는 지방유형 문화재 양악탑과  의병대장 문태서, 박춘실 전적비, 정인승 선생 유허비가 있다. 토옥동 깊은 골짜기에서 흘러내려온 맑은 물에서 양식한 송어회를 맛보며 내려다보는  계곡의 비경은 과연 대자연의 선물이라 아니할 수 없이 아름답다."
"전라북도 장수군 천천면 비룡로 (632, 와룡자연휴양림)",,37,0,A01,A0101,A01010600,126964,12,20030908090000,,,127.4772111731,35.6762995971,6,20220120113315,50804,11,,와룡자연휴양림,55610,"와룡자연휴양림은 1996년 6월에 개장한 삼림 휴양공원으로서 삼림욕과 자연관찰, 학습탐방, 그리고 가족단위 휴양이나 단체 수련 등을 위해 제몫을 톡톡히 하는 장수군의 명소로 자리잡고 있다. 일일 수용인원은 약 1,200명 정도이며 연중무휴로 개방한다. 시설물로는 야영객을 위한 야영장과 야영데크 및 평상, 그리고 일반단체 방문객들을 위한 연수의 집, 복합 산막, 숲속의 집 등 각종 시설과 숙사를 갖추어 놓았다. 아이들을 위한 사계절 눈썰매물썰매장, 야외수영장과 천연 물놀이장 등의 시설도 구비해 놓고 있다. 휴양림으로서 자연학습장과 체련단련장 등의 시설도 잘 갖추어져 있으며, 단체객들을 위한 야외무대도 마련되어 있는 종합적인 숲속 휴양공간이자 문화공간이라 할 수 있다."
