addr1,addr2,areacode,booktour,cat1,cat2,cat3,contentid,contenttypeid,createdtime,firstimage,firstimage2,mapx,mapy,mlevel,modifiedtime,readcount,sigungucode,tel,title,zipcode,overview
전라북도 김제시 백구면 황토로 1074-30,(백구면),37,0,A02,A0201,A02010800,1599564,12,20120411012511,,,126.9558049935,35.8790952573,6.0,20220715145609,15168,3,,부용사,54331,"1936년 창건된 대한불교 태고종 소속 사찰이다. 김제시 백구면 월봉리에 자리하고 있다. 부용사는 중요무형문화재 제48호 단청기능보유자 김일섭이 창건했다. 1961년 대웅전을 새로 지으면서 칠성각, 산신각, 요사 등을 함께 올리고 사세를 확장했다. 1968년에는 명부전을 지었다. 대웅전에 아미타불 좌우로 관세음보살과 대세지보살을 협시로 배치하였다. 절 마당에는 칠층석탑과 미륵불, 사사자오층석탑 등이 있다. 이곳의 미륵부처가 속세에 용하다고 소문났다. 이 부처에게 치성을 드리면 원하는 바가 이루어진다고 해서 많은 사람들이 찾는다. 부용사에는 백련지가 있는데, 여름이면 연꽃이 만발해 장관을 이룬다."
전라북도 김제시 금구면 오봉2길 474,(금구면),37,0,A02,A0201,A02010800,1599550,12,20120411011820,,,127.0711168832,35.7746452479,6.0,20220818092610,16166,3,,봉황사(김제),54341,"1968년 창건된 대한불교 태고종 소속의 사찰이다. 김제시 금구면 오봉리 봉황산에 자리하고 있다. 김제에서 전주 방향으로 가다보면 금천호수가 나온다. 호수를 지나면 오른쪽으로 봉황사 가는 길이 나온다. 봉황사는 규모만으로 따지면 사찰이라기보다 암자에 가깝다. 당우로 대웅전, 삼성각, 요사가 있다. 대웅전은 정면 3칸의 목조건물로 일반 주택 형태를 띠고 있다. 요사 옆에는 1991년 조각한 석조미륵불이 있다. "
전라북도 김제시 향교길 89-16,(교동),37,0,A02,A0201,A02010700,1599509,12,20120411004344,,,126.8796499138,35.8012028192,6.0,20220817102822,15457,3,,벽성서원,54387,"김제시 교동에 있는 벽성서원은 1965년에 이곳 김해김씨 종친들에 의해 창건되었다. 이 사당은 정면 3칸, 측면 2칸에 맞배지붕에 강당이 있으며 봄과 가을 두 차례 제사를 지낸다. 이곳에는 신라 김유신을 주벽으로 고운 최치원, 죽강 김보, 도산 김선, 모암 김극일(慕庵 金克一), 숙재 허주, 점필재 김종직, 안경공 김영정, 탁영 김일손, 갑봉 김우항(甲捧 金宇杭) 등을 배향했다. 벽성서원은 외삼문인 어덕문(御德門), 정면 4칸, 측면 3칸 규모의 팔작지붕 구조의 강당, 내삼문인 경의문(敬義門), 정면 3칸, 측면 1칸의 맞배지붕 구조인 사당 충인묘(忠仁廟)로 구성되어 있다."
전라북도 김제시 금구면 선비로 1126-26,,37,0,A02,A0201,A02010800,1599474,12,20120411002240,,,127.0376695273,35.787445992,6.0,20211202024728,15459,3,,법인정사(김제),54341,"김제에서 금구 경유 전주로 가다 금천저수지 조금 못 가서 오른쪽 편에 대화리 삼받실 마을 초입에 있는 법인정사는 1991년 6월 김진영 스님이 마을 초가집을 사서 개조해 불당을 모시고 창건했다. 포교당처럼 큰 법당에 석가모니 부처님과 대세지보살, 약사여래, 관세음보살을 모시였다."
전라북도 김제시 범득골길 187-22,(갈공동),37,0,A02,A0201,A02010700,1599399,12,20120410234156,http://tong.visitkorea.or.kr/cms/resource/41/2724141_image2_1.jpg,http://tong.visitkorea.or.kr/cms/resource/41/2724141_image2_1.jpg,126.8637038912,35.809796012,6.0,20220811144624,15450,3,,백석서원,54370,"백석서원은 1652년(효종 3) 유집(柳楫)의 학문과 덕행을 추모하기 위해 승방산에 세워졌던 하나의 사당이었다. 1696년(숙종 22)조속(趙涑)을 추가배향하고, 그 뒤 유도(柳棹)를 모셨다. 1868년(고종 5)에 대원군의 서원훼철령으로 철폐되고 1902년 지금의 자리에 단(壇)을 설치하였으며 1946년 복원하여 오늘에 이르고 있다. "
전라북도 김제시 백산면 하정로 163-73,,37,0,A01,A0101,A01011800,1599383,12,20120410232232,,,126.8939558126,35.8459840763,6.0,20211210022806,17961,3,,백산저수지,54324,"전라북도 김제시 백산면 하정리에 있는 저수지로 전라북도 김제시에서 익산시 쪽으로 6㎞ 떨어진 곳에 위치하고 있다. 백산저수지는 흐르는 물을 담수하는 담수호가 아닌, 양수저수지다. 섬진강댐에서 방류된 물이 김제간선을 타고 흐르는 것을 호남양수장의 펌프를 이용해 퍼 올려 저수지에 모으는 형식이다. 백산저수지 주변을 관광지로 개발 야산을 깎아 평야를 만드는 호남야산개발과 함께 축조된 저수지이다. 이렇게 만들어진 백산 저수지를 통해서 평야에 농업용수를 공급할 저수지가 만들어지면서 이 일대 농민들은 본격적으로 벼농사를 지을 수 있게 되었고, 질 좋은 쌀을 생산함으로써 농가소득 증대는 물론 생계유지에도 큰 보탬이 됐다. 백산저수지에서는 붕어, 잉어, 향어 등 대어들이 많이 나와 낚시꾼의 발길이 끊이지 않고 있으며, 아름다운 서해의 낙조와 자연농원지구와 만경평야를 한눈에 바라볼 수 있는 곳이기도 하다."
전라북도 김제시 입석7길 73-21,(입석동),37,0,A02,A0201,A02010700,1599347,12,20120410223909,,,126.8666736049,35.7891150841,6.0,20220420112002,15503,3,,모덕사(김제),54416,"토헌 박초의 영정을 모신 사당이다. 김제시 입석동에 자리하고 있다. 박초는 어려서 정몽주의 문하에서 학문을 익혔다. 그는 15살에 문과에 급제할 정도로 재능을 보였고 이조정랑, 사헌부장령, 우부승지, 대사간, 병조참의 등의 요직을 두루 거쳤다. 조선 개국 직후에는 전라도수군도절제사를 지내기도 했다. 당시 무엇보다 벽골제를 만들어 고향에 지대한 공헌을 했다. 1421년(세종3)에는 전라도관찰사 장윤화가 벽골제를 없애고 그것을 토지로 돌려 농사를 지으면 어떻겠냐고 강력히 주장했지만, 박초에 의해 무산되었다. 벽골제 사적비문 역시 박초가 지었다. 그만큼 고향에 대한 애정이 깊었던 인물이라 하지 않을 수 없다. 모덕사는 정면 3칸, 측면 3칸 규모의 맞배지붕 형태로 지어졌다."
전라북도 김제시 만경읍 두내산1길 25-10,,37,0,A02,A0201,A02010700,1599284,12,20120410221939,http://tong.visitkorea.or.kr/cms/resource/52/1603952_image2_1.jpg,http://tong.visitkorea.or.kr/cms/resource/52/1603952_image3_1.jpg,126.8210759876,35.8543318756,6.0,20220922163332,15710,3,,만경향교,54307,"1407년(태종 7)에 현유(賢儒)의 위패를 봉안, 배향하고 지방민의 교육과 교화를 위해 창건되었다. 처음에는 동헌(東軒) 서편에 있는 송전리에 설립되었으나 1620년(광해군 12)에 소실되었으며, 1637년(인조 15) 현재의 위치로 옮겨 중건하였다. 1971년에 동재와 서재를, 1975년에 대성전과 명륜당을 보수하였다. 현존하는 건물로는 정면 3칸과 측면 2칸의 맞배지붕으로 된 대성전, 정면 5칸과 측면 2칸의 팔작지붕으로 된 명륜당, 정면 4칸과 측면 2칸의 우진각지붕으로 된 동재, 정면 3칸과 측면 2칸의 우진각지붕으로 된 서재 등이 있다. 대성전에는 5성(五聖), 송조2현(宋朝二賢), 우리나라 18현(十八賢)의 위패가 봉안되어 있다. 조선시대에는 국가로부터 토지와 전적·노비 등을 지급받아 교관이 교생을 가르쳤으나, 갑오경장 이후 신학제 실시에 따라 교육적 기능은 없어지고, 봄·가을에 석전(釋奠)을 봉행(奉行)하며, 초하루·보름에 분향을 하고 있다. 대성전은 전라북도 문화재자료 제114호로 지정되어 있으며, 소장 전적으로는 사서삼경과 집해류 등 180여권이 있다. 현재 전교(典校) 1명과 장의(掌議) 수명이 운영을 담당하고 있다."
전라북도 김제시 진봉면 심포9길 31,(진봉면),37,0,A02,A0201,A02010700,1599227,12,20120410202207,,,126.7157575558,35.8564798314,6.0,20220712112350,15353,3,,두곡서원(김제),54300,"1634년(인조 12)에 지방유림의 공의로 정몽주(鄭夢周), 강원기(康元紀), 함부림(咸傅霖)의 충절과 덕행을 추모하기 위해 창건하여 위패를 모셨다. 선현배향과 지방교육의 일익을 담당하여오던 중 흥선대원군의 서원철폐령으로 1872년(고종 9)에 훼철되었다. 1901년 유림에 의하여 제단을 마련하고 향사를 지내오다가 1970년에 복원하였다. 복원·중건할 때 함부림은 봉안에서 제외되었고 별도의 서원건립이 추진 중에 있다."
전라북도 김제시 동헌4길 46-1,(교동),37,0,A02,A0201,A02010100,1599176,12,20120410200021,,,126.881766397,35.8010056559,6.0,20210818231848,15833,3,,김제동헌,54385," 고을의 공무를 수행하던 관아건물    전라북도 김제시 교동에 있는 조선시대의 관아로 전라북도유형문화재이다. 조선시대 고을의 공무를 수행하던 관아건물로서 현종 8년(1667)에 외아와 함께 지어진 것으로 추정되며, 숙종 25년(1699)에 수리한 것으로 전해진다. 여러 차례의 수리와 개축을 거쳐 최근 원형에 가깝게 복원되었다.    일반 민가보다는 격식을 차리고 있는 건축양식    원래는 안채, 안행랑채, 안측간 등의 건물이 있었으나, 지금은 안채만이 복원되어 있다. ㄷ자형의 평면으로 조선시대 일반적인 중, 상류 계층의 주택건축과 거의 차이가 없다. 다만 대청마루 등에 굵은 두리기둥을 사용하고 있는 점이 일반 민가보다는 격식을 차리고 있는 점으로 두드러진다. 한단의 낮은 기단 위에 자연석 주초를 놓고, 네모기둥과 두리기둥을 섞어서 세웠으며 홑처마의 소로수장집이다. 거의 모든 주간(柱間)에 두 짝의 세살문을 달았다. 전체적으로 간결한 외관을 갖추었으며, 동헌의 내아 건물로는 얼마 남아 있지 않은 유구 중의 하나이다. 내아의 바로 앞 남쪽에 외아가 있다.   위엄 있는 건축형태를 갖추고 있는 조선시대 관아건축   앞면 7칸, 옆면 4칸 규모이며，지붕 옆면이 여덟 팔(八)자 모양인 팔작지붕집이다. 가운데의 오른쪽 6칸에 대청이 있고 왼쪽 4칸은 온돌방이다. 외벽은 사방 전체에 같은 형태의 문이 달려있으며, 앞면 가운데 1칸과 뒷면 왼쪽에 출입문을 달았다. 전체적으로 간결하면서도 앞면을 7칸으로 꾸며 위엄있는 건축형태를 갖추고 있어 조선시대 관아건축의 성격을 잘 나타내고 있다. "
전라북도 김제시 후신길 4-27,(연정동),37,0,A02,A0205,A02050200,1599009,12,20120410183627,,,126.866851105,35.7992583767,6.0,20220923154523,15164,3,,대제복구비,54370," 저수지를 복구한 이들의 공적을 기리기 위한    김제시 연정동 후신마을에 위치하고 있는 '대제복구비'는 1848년(현종14년)7월에 세운 것으로 대제복구비는 김제에서 가장 큰 대제 저수지를 복구한 이들의 공적을 기리기 위해 세워진 공적비 이다. 비의 앞면에는 대제 복구 당시 총위사 ,전라도 관찰사, 어사 및 김제군수의 대제 복구에 대한 공을 기린 비문이 새겨져 있고 후면에는 대제 복구하게 된 경위를 적고 있다. 대제방죽은 일명 ""돼지 방죽""또는 ""큰 방죽'이라고 불려 졌으며 대제 방죽의 위치는 연정동과 교동동 중간지점 도로 좌측에 평평한 농경지가 보이는데 이곳이 대제방죽이 있었던 자리이다.   김제에서 가장 큰 저수지   대제는 김제동헌에서 서쪽으로 2리 정도 떨어진 곳에 있었으며 그 둘레가 8384척으로 조선후기인  당시에는 김제에서 가장 큰 저수지로 많은 주민들은 이 저수지 물을 이용하여 농사를 짓게 되었다. 그런데 1847년(조선 헌종13년 봄) 총위영 둔감으로 부임하여 온 김상준이라는 사람이 그 저수지를 폐기하고 다른 곳에 저수지를 신축케 하였다. 폐기된 저수지는 논으로 만들었고 저수지의 물을 사용할 수 없게 되자 주민들의 원성이 높아지게 되었다. 그 사실을 알게된 왕은 그 잘못을 바로 잡으라는 전교를 내렸다. 이리하여 대제가 다시 원래대로 복구 되었고 복구된 후 그 공을 기리고 경위를 밝히기 위해 1848년에 대제복구사적비를 세우게 되었다. 이 대제는 일제강점기 초까지 남아 있었으나  그 후 폐기하여 지금은 남아 있지 않고 그 때 세운 비만 월촌 연정동 후신마을에 세워져 있다."
전북 김제시 금산면 청도리,,37,0,A01,A0101,A01011800,1598378,12,20120410025430,,,127.0186146058,35.7212920752,5.0,20220518173757,18988,3,,금평저수지,"576-962,1","김제시 금산면 금산리와 청도리에 걸쳐 있는 금평저수지는 1961년에 축조되었으며 모악산에서 내려오는 맑은 물로 아무리 가뭄이 들어도 마르지 않는다고 한다. 일명 오리알 터로도 불리는데 풍수지리에 밝았던 도선이 장차 오리가 알을 낳는 곳이 될 것이라는 예언에 따라 붙여진 이름이다. 산 정상에 어미가 어린아이를 안고 있는 형태의 바위가 있어 이름이 붙여진 모악산은 전주와 완주, 김제 시민 등 많은 사람들의 사랑을 받는 산이다. 이곳에서 흘러든 물들이 모여 호남평야의 젖줄 구실을 하는 여러 개의 저수지가 있다. 금평저수지는 주변에 오염원이 적어 수질이 깨끗하고, 겨울철 우리나라를 찾는 철새 도래지로도 유명하다.

 호남평야의 젓줄 역할  
전주시내에서 불과 30여분, 김제 시내에서 20여분 거리에 위치해 봄이면 저수지 주변으로 벚꽃이, 가을이면 곱게 물든 단풍나무 등이 아름다운 자연경관 때문에 휴식을 위해 많이 찾는 곳이다. 금평저수지 일대는 모악산 명산 만들기 사업의 일환으로 새롭게 탈바꿈하여 볼거리는 물론 휴식 공간으로 각광을 받고 있다. 수변 문화 체험 숲을 조성한 저수지 일대는 가로수가 터널을 이루어 특별한 운치를 자아내고 있는 곳으로 산책과 드라이브 코스로도 각광받고 있다."
전라북도 김제시 금구면 청운4길 87-3,(금구면),37,0,A02,A0201,A02010700,1598258,12,20120410023102,,,126.9800434801,35.8114533776,6.0,20220714165629,16081,3,,낙양사,54338,"낙양사는 송정기, 송정구, 송정모 등 3형제의 위패를 봉안한 조선시대 사당으로 김제시 금구면 청운리 불로마을에 있다. 이 마을은 여산송씨의 집성촌으로 그 시조는 고려 때 진사를 지낸 송유익이다. 김제에는 여산송씨가 두 개의 파로 나뉜다. 금구면 입향조인 송윤 후손의 불로파와 청하면과 백산면 일대에 주로 거주하는 여꾸다리파다.낙양사 외에 불로파와 관련된 문화재로는 금구면 낙성리 하사마을에 송윤유허비와 절부문화유씨정려가 있다. 여꾸다리파 관련 문화재로는 백산면 상리 자학동에 병암서원이 있다. 낙양사는 1910년(순조 4) 지어졌으나 그 역사는 훨씬 깊다. 본래 1675년부터 동도면 상학리 학천사에 위패를 모시다가 화재 소실 후, 수류면 거야마을 육송사로 옮겨 배향한 바 있다. 그러나 흥선대원군의 서원철폐령 탓에 다시 육송사에서 옮길 수밖에 없게 됐고, 마침내 지금의 낙양사에 배향하게 되었다.낙양사에 배향된 3형제는 모두 효자인 데다가 성품이 올곧기로 유명했다. 첫째인 송정기는 호랑이도 감복할 정도였다고 전한다. 부모가 돌아가시자 초막을 짓고 무덤 곁에서 생활했는데 호랑이가 그를 보호했다고 한다. 둘째 송정기는 형을 부모와 같이 따르고 섬기며 집안을 일으켜 세웠다. 막내 송정모는 효와 우애가 깊었을 뿐만 아니라 학문에 뛰어났고 그 성정이 대나무와 같았다고 한다. 현재 봄가을로 낙양사에서는 3형제를 기리는 제사를 지내고 있다."
전라북도 김제시 향교길 89-3,(교동),37,0,A02,A0201,A02010700,1598192,12,20120410020038,http://tong.visitkorea.or.kr/cms/resource/31/1603931_image2_1.jpg,http://tong.visitkorea.or.kr/cms/resource/31/1603931_image3_1.jpg,126.8795082765,35.8005751109,6.0,20210818183746,16707,3,,김제향교,54387,"1404년(태종 4)에 현유(賢儒)의 위패를 봉안, 배향하고 지방의 중등교육과 지방민의 교화를 위해 창건되었다. 정유재란 때 소실되었다가 1635년(인조 13)에 중건하였으며, 그 뒤 몇 차례의 중수를 거쳐 오늘에 이르고 있다. 현존하는 건물로는 대성전·명륜당·동무(東廡)·서무(西廡)·동재(東齋)·서재(西齋)·만화루(萬化樓)·교직사(校直舍)·내삼문(內三門) 등이 있다. 명륜당은 임진왜란 때에 소실된 것을 1842년에 보수하고 1879년에 중수하였으나 6·25사변 때 다시 소실된 것을 1958년에 복구하였으며, 정면 5칸, 측면 3칸의 고주(高柱)집으로 되어 있다. 동재는 정면 3칸, 측면 1칸의 맞배지붕이며, 만화루는 2층 누각인데 임진왜란 때에 소실된 것을 1635년에 복원하고 1964년에 중수한 정면 5칸, 측면 2칸의 팔작지붕이다. 조선시대에는 국가로부터 전답과 노비·전적 등을 지급받아 교관이 교생을 가르쳤으나, 현재는 교육적 기능은 없어지고 봄·가을에 석전(釋奠)을 봉행(奉行)하고 초하루·보름에 분향을 하고 있으며, 전교(典校) 1명과 장의(掌議) 수명이 운영을 담당하고 있다. 1973년 향교 일원에 대한 보수가 있었으며, 소장 전적은 18종 25책으로 주로 경서의 낙질본이고, ≪향안 鄕案≫ 등은 보존되어 있지 않다."
전라북도 김제시 금구면 금구3길 12,,37,0,A02,A0201,A02010700,1598165,12,20120410014935,,,127.0112444754,35.7730499516,6.0,20220811095826,15704,3,,금구향교,54351,"1390년(공양왕 2)에 현유(賢儒)의 위패를 봉안, 배향하고 지방의 중등교육과 지방민의 교화를 위하여 창건되었다. 1404년(태종 4)에 중창하고 임진왜란 때 소실된 것을 1635년(인조 13) 양시산(楊翅山) 아래에 중건하였으며, 1675년(숙종 1)에 현재의 위치로 이건하였다. 그 뒤 6·25남침 등을 거치면서 계속 퇴락하여 소장 전적 등이 대부분 유실되었으며, 1954년에는 유림의 공의로 고등공민학교를 설립하여 지방청소년들의 교육기관으로 활용하였다. 명륜당은 정면 4칸, 측면 2칸의 팔작지붕으로 되어 있으며, 만화루는 2층 누각형식의 건물로 정면 3칸, 측면 2칸의 맞배지붕으로 되어 있다. 조선시대에는 국가로부터 전답과 노비·전적 등을 지급받아 교관이 교생을 가르쳤으나, 현재는 교육적 기능은 없어지고 봄·가을에 석전(釋奠)을 봉행(奉行)하고 초하루·보름에 분향을 하고 있으며, 전교(典校) 1명과 장의(掌議) 수명이 운영을 담당하고 있다."
전라북도 김제시 용지면 용지로 443-16,,37,0,A02,A0201,A02010700,1597980,12,20120410004405,,,126.9541613753,35.8529565405,6.0,20220818110400,15223,3,,구암서원,54332,"구암서원은 1827년(순조 27)에 창건했다가 1868년(고종 5)에 철폐된 것을 1902년(광무 6) 지금의 자리에 단을 설치하였으며, 1967년 단이 있던 자리에 사당을 지어 오늘에 이르고 있다. 이곳에는 황거중(黃居中)을 중심으로 황응청(黃應淸), 정홍면(鄭弘溟),황극호(黃克孝), 정복환(鄭福煥) 등이 모셔져 있다 "
전라북도 김제시 금구면 선비로 1354-42,,37,0,A02,A0201,A02010800,1597967,12,20120410002904,,,127.0574815933,35.7897238525,6.0,20220826141457,15363,3,,관응사(김제),54341,"대한불교 관음종 소속으로 김제시 금구면 오봉리에 자리한 사찰이다. 대웅전, 삼성각, 미륵불, 요사 등의 당우를 갖추고 있다. 1936년 창건되었다고는 전하나 누가 창건했는지에 대해서는 알려진 바가 없다. 관음은 현세구복적인 부처이다. 뭇 중생은 관음에 의탁해 바라는 바를 이루고자 한다. 김제의 관응사 역시 치성을 올리는 사람들의 발길이 잦다. 이 사찰이 자리한 곳은 각시골이라고 불리는데, 관응사의 창건설화와 연결되어 흥미를 자아낸다. 심심산골로 한 아리따운 각시가 들어가는 것이 기이해 마을사람들이 따라 가보았는데, 그 자취를 찾을 수 없었다는 것이다. 그래서 마을사람들이 그 각시를 부처의 현신으로 여기고 관응사를 지었다고 한다. 관응사는 오봉산 고깔봉을 마주보고 있다. 주변의 자연경관이 무척 빼어나다."
