addr1,addr2,areacode,booktour,cat1,cat2,cat3,contentid,contenttypeid,createdtime,firstimage,firstimage2,mapx,mapy,mlevel,modifiedtime,readcount,sigungucode,tel,title,zipcode,overview
전라북도 김제시 승반길 103,,37,0,A02,A0201,A02010800,488345,12,20080226004832,http://tong.visitkorea.or.kr/cms/resource/62/1603962_image2_1.jpg,http://tong.visitkorea.or.kr/cms/resource/62/1603962_image3_1.jpg,126.906802339,35.82865016,6.0,20220729112510,19316,3,,흥복사(김제),54366,"흥복사는 전북지역 근대 불교계의 정화운동을 이끌었던 중심사찰이다. 흥복사가 본격적으로 발전하기 시작한 것은 1943년 법운(法雲) 스님이 극락전과 관음전 등을 중수하면서부터이다. 흥복사는 1954년 불교정화운동 때 임시 조계종 전북종무원으로 되어 약 1년간 교단의 행정본부가 되었으며, 1961년에는 월주(月珠) 스님이 금산사와 흥복사의 주지를 겸임하면서 전라북도 지역 불교정화운동의 핵심역할을 했다. 곧 이어서 1965년에는 전강(田岡) 스님을 강사로 하여 선원(禪院)을 개설하는 등 많은 발전을 이루었다. 이렇게 이 지역의 승려들의 정신적인 구심점 역할을 하던 흥복사는 1969년에 도영스님이 주석하여, 1976년부터 1979년까지 3년간 대대적인 중창불사를 거행하면서 절의 면모가 일신되었다. 현재에도 절에는 대웅전을 비롯해서 미타전, 미륵전, 삼성각, 사천왕전, 정혜원(요사), 요사 및 수각(水閣)인 불유각(佛乳閣) 등 여러 채의 건물이 널찍널찍하게 자리잡고 있어 절의 규모를 짐작하게 한다.  더구나 선원 내에는 수도에 열심인 스님들이 계심을 섬돌 위에 가지런히 놓인 고무신에 의해 느낄 수 있다. 스님들의 용맹정진을 방해할까봐 경내를 다니면서도 독경소리보다 발걸음소리를 적게 내려고 조심조심 다니곤 했다. 새들도 조용히 스님들의 수도에 동참하는 곳이 바로 흥복사이다. 넓은 경내에 시원스럽게 배치된 전각과 그 내부에 모셔진 불보살상과 불화 등이 서로 어우러져 부처님의 법력을 웅변으로 증명하는 곳이다. 앞쪽에 자연스럽게 조성해 놓은 연꽃밭조차 넓고 시원하여 사찰의 규모와 원력이 느껴지는 그런 곳이다.    역사  흥복사는 650년(의자왕 10) 고구려에서 온 보덕이 창건하여 승가사라 하였다. 한때는 이 곳에서 도교가 성행하였다고 하는데, 아마도 당시 고구려가 중국으로부터 도교를 도입해 한창 숭상하던 때였으므로 그 영향을 받았는지도 모른다. 그러나 절은 곧이어 불교도량으로서의 기반이 확고해지면서 많은 고승들이 이곳에서 수도했다고 전한다. 아쉬운 것은 창건 이후 조선중기까지의 연혁이 거의 전하지 않는다는 점이다. 그러나 뒷날 많은 불교 고승이 배출되었다. 그 뒤 여러 차례 중건과 중수를 거듭하였으나 현재로서는 알 수 없고, 1597년(선조 30) 정유재란 때 절은 완전히 불타버려 절은 폐허가 되어 버렸다.  그러나 얼마 안 있어 1625년(인조 3) 김제에 살던 흥복(興福)처사가 부처님의 감응을 받아 이 절을 기원도량으로 삼아 극락전을 중건하면서 다시 법등을 잇게 되었고, 절의 이름을 흥복사(興福寺)라 불렀다. 그 뒤 절은 다시 퇴락하였는데 근대에 들어와서는 1943년 법운(法雲) 스님이 극락전과 관음전 등을 중수하면서 본격적으로 발전하기 시작하였다. 1954년 불교정화운동 때는 흥복사가 임시 조계종 전북종무원으로 되어 약 1년간 교단의 행정본부가 되었으며, 1961년에는 월주(月珠) 스님이 금산사와 흥복사의 주지를 겸임하면서 전라북도 지역 불교정화운동의 핵심역할을 했다. 이어서 1965년에는 전강(田岡) 스님을 강사로 하여 선원(禪院)을 개설하는 등 많은 발전을 이루었다.  근래에는 1969년에 도영스님이 주지로 부임한 이래 19761979년에 걸쳐서 대대적 중창불사가 거행되어 절의 면모가 일신되었다. 본래의 절터에서 산쪽으로 올라간 곳에 새롭게 터를 잡고 여기에 대웅전, 삼성각을 따로 지었는데, 옛터에는 미륵전, 사천왕문, 요사 등을 지었다. 1974년부터 중창을 시작하여 1976년 정면 4칸, 측면 2칸의 대웅전과 육각형의 건물인 미륵전, 삼성각, 사천왕문, 요사 등을 중건하였다. 특히 1996년에는 1979년의 중창불사 때 지었던 시멘트로 된 요사를 헐고 그 자리에 지금의 요사를 새로 늘려 지었으며, 별도의 식당건물을 새로 지었다. 또 이 기간동안 관음전과 정혜원(定慧院)을 보수했으며, 각 법당에 11폭의 탱화를 모시는 등 여러 성보문화재를 봉안하였다. 즉 현존하는 당우 중 극락전과 정혜원은 1920년대에 건립된 건물이다. 사찰 경내에는 부도옥개석 2점이 있을 뿐 특별한 문화재가 없으나 수령 600년 가량의 신단수와 설천이라는 우물이 있다."
전라북도 김제시 금구면 양시로 142-13,,37,0,A02,A0201,A02010800,486531,12,20080225215033,,,127.0064172241,35.7693308475,6.0,20220808112200,17621,3,,혜봉사,54351,"혜봉사는 아름다운 꽃밭과 같다. 그곳에 가면 언제라도 아름다운 꽃을 만날 수 있기에 더욱 그렇다. 양지 바른 곳에 위치한 혜봉사는 볕이 잘 들어서 사시사철 늘 아름다운 꽃이 피었다가 지기 때문에 흔히 꽃밭댕이절이라는 이름으로 불리기도 했다고 한다. 혜봉사에 가 보면 그 말을 실감하게 한다. 하지만 혜봉사의 꽃들은 사람의 손이 닿아 인위적으로 꽃을 가꾼 것이 아니라, 이 절이 자리한 위치가 워낙 양지 바르고 햇살이 좋아 자연적으로 꽃이 잘 자라는 것이라 여겨진다.   꽃밭댕이절 혜봉사를 더욱 아름답게 하는 것은 대웅전이다. 대웅전은 뜨락에서 피는 꽃을 닮은 모습으로 만들어 놓았다. 혜봉사 대웅전의 문살은 한 바탕 꽃밭처럼 문살마다 아름다운 꽃무늬를 새겨 꽃창살로 만들어 놓았다. 게다가 대웅전의 외부를 장엄한 벽화로 사군자를 그려 놓아, 마치 절집 마당의 한 모퉁이에 활짝 핀 꽃을 시샘하는 듯하다.   이처럼 혜봉사에 가면 언제나 꽃향기에 취할 수 있다. 마당의 꽃밭이 멋진 이 절집에서는 대웅전 안의 부처님도 밖으로 나와 양지바른 곳에 한 송이 들꽃으로 머물 것 같은 느낌이다. 인위적이지 않고 자연스럽게 피었다 지는 꽃으로 가득한 절집, 바로 혜봉사이다.    창건배경 및 역사  100년 전에 청정월 보살이 시작을 했고, 일심화보살은 그분 따님으로 계속 여기서 태어나 지금까지 여기서 살고 있다. 600여년전 고승 석덕(碩德)이 가람을 창건하고 불상과 불탑을 건립하였다. 이후 퇴락하였다가 1936년 병자 3월 20일에 청신녀 전주 이씨 청정월 (본명 화월) 보살이 인동 장씨 종중의 땅을 헌사하면서 불사가 시작되었다. 이후 며느리 연안 차씨가 심화 복례보살로서 담양에서부터 공양드렸고, 둘째 딸인 전정옥 보살이 태어나 김제 원각사에서 하연당 강교민화상과 춘명당 대종사에게 율사를 배웠다. 임자 4월에 당시 법당을 앞면, 측면 각 3칸씩 총 건평 12평의 목조 기와집으로 신축하였으며, 이 건물은 현재는 명부전으로 사용하고 있다. 기미년에는 덕운당 강재묵 큰 스님을 조실로 모셔 법회를 열었다. 임술년 11월에는 범종각을 세웠으며, 정묘년 3월에는 대웅전을 전후 3칸에 3포집으로 건평 총 21평으로 건립하였다. 염불원은 앞면 4칸에 건평 19평으로 지었고, 경오년 3월에는 명부전의 단청을 올리고 시왕상을 봉안하였다."
전라북도 김제시 금산면 구성3길 522,,37,0,A02,A0201,A02010800,485690,12,20080225183652,,,127.0216915184,35.7441145337,6.0,20220805111848,18146,3,,학선암,54343,"학선암은 고고한 사찰이다. 우리나라 산지사찰이 그러하듯 학선암도 그리 만만하게 찾아갈 수 있는 절은 아니다. 그것은 학선암이 그다지 높지 않은 구성산 중턱에 위치해 있음에도 불구하고, 대개의 우리나라 산지가 낮으면서도 가파르고 험하기 때문인 것이다. 이렇게 학선암 또한 다른 산지사찰과 마찬가지로 큰맘 먹고 가야 갈 수 있는 그런 곳이다. 학선암을 가는 길은 진리를 찾아나선 길과 같다고 할 수 있다. 낮은 평지에서 시작해서 점차 경사 70도 이상의 험한 산길을 오르락내리락 하길 몇 차례 거듭한다. 차를 가지고 가면 그래도 쉽게 갈 것이라 생각하면 그 또한 틀린 생각이다. 자동차로는 그 좁고 비탈진 길을 미끄러지지 않고 제대로 오르기 어렵다.  주지스님께 미리 전화를 드리고 짚차나 타고 가야 갈 수 있게 되어있다. 진리란 아무나 크게 노력을 하지 않아도 쉽게 얻어지는 것이 아니듯이, 학이나 신선과 같이 고매한 인격이 머물렀을 법한 학선암 또한 아무나 쉽게 받아들이지 않는 것이다. 이렇게 어려운 발걸음을 옮겨 도착한 학선암은 가기 전에 상상했던 것 이상으로, 하도 가파라서 거꾸로 미끄러질까 두려워하던 마음보다 훨씬 더 멋진 풍광을 지니고 있다. 바로 학선암이 거기에 있기에 가고 싶었던 그 생각과 함께 하게 된다. 힘들여 수고한 보람은 학선암에 도착하게 되면 알게 될 것이다.    역사 학선암의 창건은 분명하지 않지만 통일신라시대 말에 함월(含月)스님에 의해 이루어졌다거나 혹은 고려 초기인 988년(성종 7)에 창건되었다고 전하는데, 그에 관한 확실한 문헌기록은 남아있지 않다. 조선중기에는 진묵 일옥(1562  1633)스님이 머물렀다고 한다. 근대에는 1913년에는 윤문주(尹文周) 스님이 중창했고, 최근에는 1980년 도웅(道雄) 스님이 주석하면서 수행도량으로서 모습을 갖추었다. 1992년에 인법당을 고쳐 지었고, 이듬해에는 요사를 중건하고 칠성각을 중수하여 오늘에 이른다."
전라북도 김제시 청하면 청공로 185-55,,37,0,A02,A0201,A02010800,482172,12,20080223011133,http://tong.visitkorea.or.kr/cms/resource/03/1604003_image2_1.jpg,http://tong.visitkorea.or.kr/cms/resource/03/1604003_image3_1.jpg,126.8483337103,35.89125869,6.0,20220408172232,22938,3,,청운사(김제),54311,"청운사에는 드넓은 연꽃밭이 길 떠나 지친 나그네를 위로해준다. 더운 여름날, 진흙 속 연꽃밭에서는 이슬을 머금은 맑고 깨끗한 연꽃이 행여 남이 볼세라 살포시 피어나기 때문이다. 청운사의 연꽃밭은 김제시를 통틀어 제일 크고 넓기 때문에 이곳에서 한여름밤의 무더위를 식힐 연꽃축제도 펼쳐지고 있다. 여름밤의 산사는 어느새 본래의 고즈넉한 적막을 벗어버리고 젊은이들이 환호하고 그들이 내뿜는 숨결과 함께 기쁨이 충만한 축제의 한마당이 되는 것이다. 이렇게 연꽃 축제를 베풀어 속인들의 발길을 절집으로 향하게 하는 것은 주지스님의 공력이라 할 수 있다. 게다가 청운사 도원스님은 자연의 연꽃을 그림으로 표현할 줄 아는 탱화장, 즉 전라북도의 인간문화재인 것이다. 때문에 청운사에 가면 연꽃밭에서 보았던 연꽃이 스님이 펼쳐놓은 화폭 위에서, 스님의 붓꽃에 의해 한송이 꽃으로 피어나는 환희의 순간을 만날 수 있는 흔치 않은 기회를 갖게 된다. 기도하는 마음으로 쉬지 않고 탱화를 그리는 탱화장 스님. 청운사에 가면 주지스님을 한번 뵙길 바란다. 목탁을 두드려 독경을 하는 스님이 아닌, 그림을 그리는 스님을 만나게 될 것이기 때문이다. 다른 절집에서 경험할 수 없는 독특한 느낌을 받게 될 것이다.    역사  절은 19세기에 보천 스님이 단칸의 초가집을 짓고 주석한 것에서 시작된다. 이후 사람들이 이곳의 샘물이 좋다하여 많이 찾았다고 한다. 그 뒤의 연혁을 살펴보면 1927년에 월인(月印) 스님이 초가법당을 3칸으로 늘리고 지금의 대웅전 자리에 요사도 지었다. 1931년에는 초가법당을 허물고 그 자리에 법당을 새로 지으면서 절을 중창했는데, 이 법당이 곧 지금의 관음전이다. 1938년 벽운(碧雲)스님이 아미타불과 관음보살과 세지보살을 봉안했으며, 1959년에는 현재의 염불원 오른쪽에 있는 요사를 새로 지었다. 1970년에는 1927년에 지었던 요사를 헐고 그 자리에다 옛 만경현 동헌에 있던 건물을 매입해 옮겨와 대웅전을 삼았다고 한다. 1973년에는 종각과 범종을 봉안했고, 1990년 요사로도 사용되는 염불원을, 그리고 1992년에 미륵불을 봉안하면서 현재에 이른다."
전라북도 김제시 금산면 모악15길 80-122,,37,0,A02,A0201,A02010800,482151,12,20080222235401,,,127.0652882849,35.7192569999,6.0,20220623100234,20976,3,,청룡사(김제),54343,"청룡사는 원래 모악산 금산사의 40여 암자 중 하나이다. 사적지는 60여년 전에 토굴의 형태이던 것을 현재의 주지스님이 1974년 대웅전을 세웠으며, 완주 봉서사에서 진묵스님이 350여년 전의 관세음보살이 1950년에 소실될 위기에 있을 때 가져와서 모셨다. 내부의 복장기를 보면 목불이고 관은 수리한 것이다. 순치12년(1635) 효종 6년의 작품이다.   나무로 만든 관음보살 좌상    전라북도 김제시 금산면 청룡사에 모셔져 있는 높이 45㎝의 나무로 만든 보살상 이다. 최근 보살상 속에서 불상에 관한 기록을 비롯하여 법화경, 다라니경 등의 유물이 발견되었다. 관음보살은 머리에는 화려한 보관을 쓰고 고개를 약간 앞으로 숙인 채 앉아 있는 모습으로, 어깨 폭에 비하여 무릎 폭이 약간 좁기는 하지만 전반적으로 안정된 자세를 취하고 있다. 얼굴은 이마부분이 넓어 사다리꼴에 가까운 모습이며, 평면적으로 처리되어 입체감이나 생동감은 보이지 않는다.   전체적으로 소박하게 표현한 보살상    양 어깨를 감싸고 입은 옷은 가슴을 따라 거의 직선으로 내려오고 있는데, 발목 부분에서 모아진 옷자락은 아래로 넓게 퍼지면서 부챗살과 같은 모습을 보여준다. 보살상에서 자주 나타나는 화려한 구슬장식 같은 것은 없이 전체적으로 소박하게 표현한 보살상이다. 청룡사 관음보살상은 17세기 중엽의 불상 양식을 잘 전하고 있는 작품이며, 특히 보살상 안에서 만든 시기, 만든 사람, 시주자 등을 자세히 밝힌 기록이 발견되어 가치가 크다. 1997년 봄, 이 보살상에서 복장물(腹藏物)이 발견되었는데, 1655년(효종6) 천승스님이 조성한 것으로 전하고 있다.
 청룡사 관세음보살 좌상 전라북도 유형문화재 제156호(1997년 7월 18일 지정)   인자하고 원만한 얼굴의 특징은 조선 후기 불상의 특징   이 보살상은 원래는 완주 봉서사에 봉안되어 있었는데 사찰화재로 인해 1974년 월정스님이 관음전을 복원하고 사찰이름도 원래의 용천암을 청룡사로 개명하면서 현재의 위치로 옮겨온 것이라 한다. 불상의 조각 기법으로 미루어 보아 소박하면서도 세련된 양상이 돋보이며 특히 상호 및 손가락의 표현 기법이 매우 섬세하여 보존의 가치가 뛰어나다. 특히 조선 후기 불교의 대중화의 단면을 보여주는 인자하고 원만한 얼굴의 특징이 뛰어나며 조선 후기 불상의 특징을 잘 보여준다."
전라북도 김제시 만경읍 화포3길 63-12,(만경읍),37,0,A02,A0201,A02010800,479920,12,20080220201044,,,126.8037711396,35.88670289,6.0,20220414145001,18068,3,,조앙사,54308,"조앙사는 불교계의 거목으로서 전북지역의 고승이던 진묵대사가 태어났던 곳으로서 그를 모시는 사찰이다. 이곳 조앙사에는 진묵조사전이라는 전각을 마련하여 진묵대사를 모실 뿐 아니라 영전을 세워 그의 어머니와 누이의 영정까지 모시고 숭앙하고 있다. 한편 조앙사는 진묵대사와 함께 근대기에 대화교의 본산이었던 중요한 사찰이다. 이곳 조앙사에는 일제강점기 때 대화교의 포교당이 있어 현세에서 고통 받는 이들이 미래에는 희망을 밝혀줄 미륵불을 신앙하고 전파하였던 것이다. 그렇기에 이곳 조앙사에는 근대기 한국 불교계에서 활발한 활동을 전개했던 증거로서 당시에 제작된 포교문을 비롯하여 불화와 불탑 등 여러 성보문화재가 남아 전하고 있다. 그만큼 근대기에 의미 있는 활동을 전개하였던 절집이 조앙사임을 알게 된다.  조앙사는 조선시대의 진묵대사와 일제강점기 때 대화교 본산으로서뿐 아니라, 현재는 멀리 만경강이 내 손에 닿을 듯 가까이 위치한 아름다운 사찰이다. 멋진 풍광을 따라 이 곳에 온 사람들이 마음 먹은 것을 성취할 수 있는 곳이라고도 한다. 그것은 부처님의 진리에 용맹 정진한 주지스님이 쉬지 않고 끊임없이 말하는, 스님의 장기인 타고난 달변을 발휘하여 일반인에 대한 포교가 강하고 설법을 잘하기 때문인 듯하다. 주지스님은 멀리서 힘들게 찾아온 나그네를 위로하고 그들과 더불어 부처님의 불법을 탐구하고 논하길 좋아하는 듯하다. 만약 무언가 답답하여 누군가 긴 시간동안 이야기를 나누고 싶다면 조앙사에 들러 주지스님과 함께 이야기를 나누도록 해보자.    역사  조앙사는 1562년 진묵조사가 탄생한 지역이어서 진묵사라 하여 조사전에 진묵대사의 영정을 모시고 있다.조앙사의 절은 1915년 진묵조사를 숭앙하기 위하여 절 이름을 조앙사라고 하면서 창건되었다. 당시는 대웅전만 있었으나 1925년에 요사를 짓고 1928년에는 칠층석탑을 세웠다. 1958년 종각을 짓고 이어서 1962년에 삼성전을 새로 지었는데, 삼성전을 허물어지고 지금은 남아 있지 않다. 그리고 1977년에는 그전의 대웅전을 헐고 새로 지었다.  한편 절 근처인 화포리 385번지에는 진묵조사의 영정을 모신 진묵사가 있다. 이 절은 실질적으로 조앙사의 조사전 역할을 하고 있으며, 현판도 진묵조사전으로 되어 있다. 진묵사는 처음 1928년에 창건되었고 그뒤 19301940년대에 만경현의 동헌 건물을 이곳으로 옮겨다가 지었다. 또한 화포리 388번지에도 조앙사와 관련 깊은 성모암(聖母庵)이 자리하고 있다. 성모암에서 전하기로는 절은 진묵조사의 어머니 조의씨(調意氏)를 모시기 위해 1917년에 창건되었다고 한다. 그 뒤 절의 부전 스님들을 따로 모실 목적으로 1928년에 앞서의 진묵사를 지었으며, 여기에서 조앙사가 독립되었다고 한다. 현재 성모암에는 진묵조사와 어머니의 영정을 봉안하고 있으며, 절 부근에 조의씨의 묘역이 있다."
전라북도 김제시 사정거리1길 20,,37,0,A02,A0201,A02010800,346909,12,20071221191934,,,126.8835884362,35.8018028184,6.0,20211210190803,18790,3,,원각사(김제),54385,"원각사는 전라북도 김제시 요촌동 415번지 벽성산 아래에 자리한 한국불교태고종 사찰이다. 원각사는 시장 모퉁이에 위치하여 속인들의 출입이 쉬운 사찰이다. 사찰을 찾으려면 시장을 찾으면 된다. 사찰 바로 앞에 있는 재래시장은 인간의 삶이 축소된 작은 마당이다. 여느 시장과 마찬가지로 물건을 하나라도 더 팔려는 상인들과 조금이라도 싸게 물건을 사려는 사람들의 목소리가 항상 떠돌아 소란스럽기까지 하다. 하지만 삶이란 다 그런 것이며, 이러한 인간이 살면서 겪어내야 하는 삶의 편린이 느껴지는 아주 가까운 곳에 원각사가 있다. 하지만 막상 원각사는 경내에 들어서면 청량감이 느껴지고, 언제 시장의 북새통을 지나왔는지 금새 잊게 해주는 그런 곳이다. 게다가 경내에는 대웅전과 종각,안심암이라는 인법당 및 요사채가 조촐하게 배치되어 있으며, 5층석탑과 석증 1쌍 및 종각 뒤쪽의 원각사사적기와 춘명당 대선사의 부도탑 및 3기의 부도탑이 위치해 있을 뿐이다.  아담하지만 경내가 깔끔하게 잘 정돈되어 있는 원각사에서는 조용한 가운데 독경소리만이 은은하게 울려 퍼진다. 경내에 들어간 우리를 맞아주는 대웅전조차 멀리서 깨달음을 배우러 온 이들을 친근하게 맞아준다.더욱이 그 안에 들어가보면 일본인들과 인연이 닿아있는 지장보살이 잘 차려진 감실 안에 모셔져 있어 독특한 분위기를 더해 준다. 게다가 하나의 연꽃에서 비롯하여 세 갈래로 나뉘어 연화화생(蓮花化生)의 존상으로서 피어오르는 치성광여래상과 일광, 월광보살의 모습도 새록새록하다. 꼼꼼하게 불화들을 바라보면 탱화도 있고, 벽화도 있고, 목각탱도 있어서 여러 가지 다양한 형식에도 불구하고 서로 어우러져 부처님의 불력을 증명하고 있다. 아담하고 작지만 갖출 것은 다 갖추어 모자람이 없는 그런 곳이 바로 원각사이다."
전라북도 김제시 용지면 봉의로 205,,37,0,A02,A0201,A02010800,346632,12,20071220222822,http://tong.visitkorea.or.kr/cms/resource/87/1603987_image2_1.jpg,http://tong.visitkorea.or.kr/cms/resource/87/1603987_image3_1.jpg,126.9652625889,35.8750431047,6.0,20211208004940,19295,3,,용봉사(김제),54331,"용봉사는 김제시 용지면 봉의산에 자리한 한국불교태고종 사찰이다.용봉사는 풍수지리상 좋은 텃자리에 자리잡고 있다. 전통시대에 왕과 왕비를 상징하는 용과 봉황이 자리잡았음직한 사찰, 용봉사(龍鳳寺)는 그 이름조차 범상치 않다. 이울러 용봉사가 위치한 산 또한 봉황이 깃들어 있었기에 가능한 봉의산인 것이다.  이처럼 용봉사는 왕실의 원찰에나 가능할 듯한 큰 뜻을 지니고 있는데, 그것은 조선시대 정조 때 풍수지리에 능한 스님이 좋은 절터라 여겨 창건했기 때문일 것이다. 원래의 절집은 동학난의 영향으로 불타 없어졌다가 대한제국 시대인 1897년에 김창배(金昌培) 거사 등이 수행을 위해 초암(草庵)을 지어 법등을 잇게 되었다. 이후 근래에 청암(淸庵)스님이 주석하면서 미타전과 대웅전과 삼성각을 새로 짓거나 중수하였고, 이후 그 분의 제자인 법전스님이 뒤를 이어 범종 및 범종각 및 미륵존불과 석조불탑을 봉안하면서 오늘까지 법등이 이어오고 있다.  현재 사찰의 규모는 이름만큼 번성하지 못하다. 하지만 좁은 경내의 구석구석에는 대웅전과 미타전, 삼성각(영산전), 종각, 요사 등의 건물이 알맞은 크기로 아담하게 배치되어 있다. 그리고 이들 전각들 사이와 그 앞쪽에는 여백을 두지 않고 석조미륵입상이나 석조지장보살입상, 석조약사불좌상 및 사사자 삼층석탑 등 각종 석물이 요소요소에 봉안되어 있다. 언뜻 경내에 들어서면 빽빽하게 들어선 석물에 의해 우람하고 큰 규모의 사찰을 연상시키기도 한다."
전라북도 김제시 금산면 금산사1길 70-11,,37,0,A02,A0201,A02010800,337410,12,20071217222722,,,127.0048630472,35.721444599,6.0,20220613142631,19174,3,,쌍용사(김제),54346,"쌍룡사는 전라북도 김제시 쌍용리 396번지에 자리한 한국불교태고종사찰이다. 쌍룡사는 돌로 만든 조각이 많은 사찰이다. 그만큼 쌍룡사에서 볼만한 것이 있다면 그것은 바로 석조 조각품들인 것이다. 따라서 돌로 만든 조각들에 어떤 것이 있는지 알고 싶다면 쌍룡사에 가길 권한다. 쌍룡사에 도착하자마자 우리를 먼저 반기는 것이 여러 석물이다. 눈을 어디에 두어야 할지 알 수 없을 정도로 빈 공간없이 빽빽하게 각종 조각이 들어서 있기 때문이다. 천왕문을 들어서면 비록 크지 않지만 용과 두꺼비가 맞아줄 것이다. 곧이어 보살형 약사불 1쌍이 서 있고, 이어서 김석남 스님 자신의 자소상이 세워져 있다. 여기에 크기도 큰 석등형 부도와 용비, 배 모양으로 만든 쌍용호 조각이 있다. 그리고 용왕님이나 땅신 혹은 대왕지조당신 남녀 1쌍 등 매우 다양하다. 너무 많아서 나중에는 무엇이 무엇인지 기억하기조차 어렵다. 그래도 다른 사찰과 무척 색다른 새로운 느낌을 주는 곳이다. 이처럼 쌍룡사는 주지스님의 소원을 담아 여러 조각들을 조성해 놓은 일종의 석조각공원이다. 물론 세워놓은 각종 서원을 담고 있고 상징을 지니고 있어서 석물들마다는 나름대로 의미를 부여되어 있다."
