addr1,addr2,areacode,booktour,cat1,cat2,cat3,contentid,contenttypeid,createdtime,firstimage,firstimage2,mapx,mapy,mlevel,modifiedtime,readcount,sigungucode,tel,title,zipcode,overview
서울특별시 송파구 잠실로 148,,1,0,A02,A0205,A02050200,231897,12,20071004090000,http://tong.visitkorea.or.kr/cms/resource/00/934100_image2_1.jpg,http://tong.visitkorea.or.kr/cms/resource/00/934100_image3_1.jpg,127.1011836669,37.5102657658,6,20220519100157,31630,18,,서울 삼전도비,5608.0,"병자호란 때 청에 패배해 굴욕적인 강화협정을 맺고, 청태조의 요구에 따라 그의 공덕을 적은 비석이다. 조선 인조17년(1639)에 세워진 비석으로 높이 3.95m, 폭 1.4m이고, 제목은 대청황제공덕비(大淸皇帝功德碑)로 되어있다. 조선 전기까지 조선에 조공을  바쳐오던 여진족은 명나라가 어지러운 틈을 타 급속히 성장하여 후금을 건국하고, 더욱더 세력을  확장하여 조선을 침략하는 등 압력을 행사하면서 조선과의 관계가 원만하지 못하였다.  나라의 이름을 청으로 바꾼 여진족이 조선에게 신하로서의 예를 갖출 것을 요구하자 두 나라의 관계가 단절되었다.  결국 인조 14년(1636) 청나라  태종은 10만의 군사를 이끌고 직접 조선에 쳐들어와 병자호란을 일으켰다.  남한산성에 머물며 항전하던 인조가 결국 청나라의 군대가 머물고 있는 한강가의 삼전도 나루터에서 항복을 하면서 부끄러운 강화협정을 맺게 되었다. 병자호란이  끝난 뒤 청태종은 자신의  공덕을 새긴 기념비를 세우도록 조선에 강요했고 그 결과 삼전도비가 세워졌다. 비문은 이경석이 짓고 글씨는 오준이 썼으며, 대청황제 공덕비라는 제목은 여이징이 썼다.  비석 앞면의 왼쪽에는 몽골 글자, 오른쪽에는 만주 글자, 뒷면에는 한자로 쓰여져 있어 만주어 및 몽골어를 연구하는데도 중요한 자료이다.   면적  2,850㎡"
서울특별시 송파구 신천동,,1,0,A02,A0205,A02050100,250131,12,20060728090000,http://tong.visitkorea.or.kr/cms/resource/08/629608_image2_1.jpg,http://tong.visitkorea.or.kr/cms/resource/08/629608_image3_1.jpg,127.1053604352,37.532416047,6,20220613151842,24027,18,,올림픽대교,5505.0,"대한민국 세계화의 시발점인 제24회 서울올림픽을 영구히 기념하고 올림픽 경기장 주변 교통처리를 위해 건설된 특별시도502호선으로 국내 최초의 콘크리트 사장교이며 길이는 1.5km에 이른다. 88서울올림픽을 뜻하는 높이 88m의 주탑 4개가 서 있으며, 주탑은 올림픽 성화대 모양을 형상화하였다. 4개의 주탑은 연·월·일·시의 4주와 4계절, 4방향을 의미하며, 케이블 24개는 제24회 서울 올림픽 경기를 의미하며 그 예술성이 우수하다.올림픽대교 건설과 함께 남단 고수부지에는 2,500평 규모의 도로공원과  지구촌의 화합을 상징하는 지름 6m의 5륜과 24개의 기념조형물이 조성되었다."
서울특별시 송파구 올림픽로35다길 33,(신천동),1,0,A02,A0202,A02020600,126489,12,20031106090000,http://tong.visitkorea.or.kr/cms/resource/99/755799_image2_1.jpg,http://tong.visitkorea.or.kr/cms/resource/99/755799_image3_1.jpg,127.1017390089,37.5160067765,6,20220615132126,48628,18,,신천 어린이교통공원,5510.0,"어린이교통공원은 교통시설 및 유희 시설, 휴식시설 등을 갖추어 자라나는 어린이들에게 즐겁게 뛰어놀면서 자연스럽게 교통 질서와 교통 도덕을 익히도록 각종 시설(신호등, 교통표지판, 횡단보도, 육교, 지하도, 터널, 고가차도)등을 마련해 놓은 곳이다. 이곳은 현재 유치원생을 비롯해 초등학생들이 많이 찾고 있으며 산 교육의 장소로 활용되고 있다. 또한, 이 공원에서는 서울지방경찰청에서 마련한 어린이 교통 시설로 경찰관의 도움을 받아 어린이들이 직접 자전거를 타고 다양한 도로를 돌아다니면서 실습을 통해 교통 학습을 받을 수 있다."
서울특별시 송파구 올림픽로 240,,1,0,A02,A0202,A02020600,126498,12,20031105090000,,,127.0979006014,37.5113516917,6,20221027140452,69226,18,,롯데월드,5554.0,"롯데그룹이 국민들의 여가 선용과 외국인 관광객 유치를 위해 설립하고 운영하고 있는 테마파크이다. 롯데월드는 모험과 신비를 주제로 한 실내 주제공원인 롯데월드 어드벤처, 호수공원인 매직아일랜드, 쇼핑몰, 민속박물관, 아이스링크, 호텔, 백화점 등으로 구성되어 관광, 레저, 쇼핑, 문화를 한곳에서 해결할 수 있는 대단위 복합생활공간이다. 롯데월드 어드벤처에서는 최첨단 탑승시설을 비롯하여, 환상적인 퍼레이드, 각종 영상 시스템, 레이져쇼, 공연, 각국의 음식을 연중무휴로 즐길 수 있다. 롯데월드 어드벤처는 세계에서 가장 큰 실내 테마파크이다. 민속박물관에는 한국의 오천년 역사와 민속 문화가 역사전시관, 모형촌, 놀이마당, 저자거리로 나누어져 쉽고 재미있게 재현되어 있다. 롯데월드 가든스테이지는 롯데월드 공연의 중심무대로 각종 시즌 뮤지컬 쇼, 공개방송 등의 다양한 이벤트가 진행된다. 롯데월드 스타에비뉴는nsp;한류스타 조성거리로 체험형 엔터테인먼트 시설이다.u놓치지 말 것u수용 인원 최대 1000명인 롯데월드 아이스링크는 낮에는 천장의 어드벤처 유리돔 가득 비추는 자연광 아래서, 밤에는 테마파크의 화려한 조명과 퍼레이드의 흥겨운 분위기에서 스케이팅을 즐길 수 있다. 아이스링크와 탈의실 사이에는 고무 매트를 설치해 안전성을 높였다. 안전모와 장갑 등 안전 장비 착용은 기본, 시계 반대 방향 활주 등의 수칙을 준수한다면 안전하고도 짜릿한 시간을 보낼 수 있다. 롯데월드 민속박물관은 구석기부터 일제강점기까지 시대별 역사 유물과 생활상을 전시한 역사전시관, 모형촌 등으로 나뉘며 전통공예체험 같은 전통문화 교육 프로그램을 운영한다."
서울특별시 송파구 올림픽로 424,(방이동),1,0,A02,A0202,A02020700,126532,12,20031105090000,http://tong.visitkorea.or.kr/cms/resource/39/2650439_image2_1.jpg,http://tong.visitkorea.or.kr/cms/resource/39/2650439_image3_1.jpg,127.1224425827,37.5194456386,6,20220929105713,39144,18,,올림픽공원,5540.0,"올림픽공원은 백제 시대의 유적과 현대적 감각의 최신식 경기장이 공존하면서 숲과 잔디밭 또한 훌륭한 여가 공간이다. 88서울올림픽의 유산인 올림픽공원은 도시민의 생활 수준 향상으로 건강 증진에 대한 욕구가 높아지면서 도시 안에 마땅한 휴식공간이 없는 시민들에게 단순한 휴식처 뿐만 아니라 국내 최대의 스포츠 마당으로 부각되고 있다. 올림픽 공원은 체육공간, 문화예술공간, 역사와 교육의 장소, 휴식공간 등 다양한 용도를 갖춘 만능공원으로 자리매김하고 있다. 또한 백제 초기의 유적인 몽촌토성과 몽촌해자(인공호수)를 중심으로 43만평의 대지 위에 조성되어 있고, 세계적인 조각작품들, 기념조형물, 88놀이마당, 산책로, 올림픽스포츠센터 등이 들어서 있다. 이 외에도 각종 유료, 무료 공연이 수시 개최되고 있어 시민들을 위한 다목적 휴식공간의 역할을 담당하고 있다.  서울올림픽을 치른 수영장, 체조경기장, SK핸드볼경기장, 우리금융아트홀, 테니스장을 비롯, 벨로드롬등이 있으며, 각종 스포츠교실은 쾌적한 공간에서 저렴한 가격으로 이용할 수 있다. 또한 88서울올림픽대회를 기념하는 유명 작가들의 조각품들이 야외에 전시 돼있어서 문화예술공간으로도 한 몫을 다한다. 올림픽공원 내에 있는 몽촌토성은 백제가 고대국가의 터전을 마련한 한성시대, 즉 3세기4세기때 만들어진 거성의 하나이다. 하남 위례성으로 추정된다. 사적 제 297호로 지정되어 있다. 올림픽공원은 걸어서 한 바퀴 도는데 약 3시간 이상이 걸릴 정도로 넓은 공간이기 때문에 진입로와 동선을 미리 익혀둬야 관람이 편하고 시간을 절약하려면 평화의 광장 옆에서 호돌이열차(Road Tain)를 탑승하면 된다."
서울특별시 송파구 가락로7길 21,(석촌동),1,1,A02,A0201,A02010700,127466,12,20030630090000,http://tong.visitkorea.or.kr/cms/resource/89/203889_image2_1.jpg,http://tong.visitkorea.or.kr/cms/resource/89/203889_image3_1.jpg,127.1028309684,37.502194511,6,20220527113557,40366,18,,서울 석촌동 고분군,5682.0,"이곳의 적석총은 잠실지구 개발사업의 목적으로 발굴 조사되었는데, 파괴가 심하여 전체적인 규모는 확인할 수 없었으나 제3호분은 기원 전후부터 나타나는 고구려 무덤형식인 기단식 적석총이다. 이 무덤은 약간 높은 지형을 평탄하게 정지작업을 하고 밑 테두리에는 매우 크고 긴 돌을 두르고 자연석으로 층단을 이루면서 쌓아 올려 3단으로 되었는데, 옛 고구려지역이었던 만주 통구에 있는 장군총에 버금가는 큰 것으로, 크기는 동서 길이 49.6m, 남북 길이 43.7m, 높이 4m이다. 따라서 이 무덤은 고구려 사람들이 남쪽으로 내려와 한강유역에 백제를 세웠을 때의 초기 권력자의 무덤인 것으로 보인다.
제4호분은 정방형으로, 3호분과 그 축조 방법이 매우 비슷한 적석총인데 이 에서도 백제 초기의 연질토기 조각들이 많이 출토되었으며, 이 고분 주위에서는 금으로 만든 세환식 귀고리도 한 점 발견되었다. 제5호분은 완전하게 발굴, 조사되지 않아 묘각의 구조와 유물에 관해서는 확실히 알 수 없으나, 대개 가락동 제1·2호분과 같은 구조로 추정된다. 이중 사적으로 지정된 것은 3호와 4호 적석총이다. 백제 시대 초기 무덤으로 추정되는 이 적석총은 백제가 가장 왕성했던 4세기경의 대외관계 혹은 삼국시대의 문화 연구에 매우 귀중한 위치를 차지하고 있는 고분이다. 특히, 고구려의 적성 총과 비교하면 그 규모나 완성도에서 그리 차이가 나지 않음을 알 수 있으므로, 삼국 시대 초기 백제의 성세를 짐작할 수 있다. 동시에 백제의 지배층이 고구려 계통이라는 것도 추측할 수 있다."
서울특별시 송파구 올림픽로 424,,1,1,A02,A0201,A02010200,127525,12,20030627090000,http://tong.visitkorea.or.kr/cms/resource/14/1567814_image2_1.jpg,http://tong.visitkorea.or.kr/cms/resource/14/1567814_image3_1.jpg,127.1229758237,37.5209871362,6,20220519182945,43230,18,,서울 몽촌토성,5540.0,"올림픽공원 내 자리해 있는 몽촌토성은 백제의 토성으로 한강 지류를 끼고 있는 이곳의 자연 지형을 이용, 진흙을 다져 쌓아 성벽을 만들었다. 특히 북벽의 단을 이룬 곳에서 목책을 세웠던 흔적이 발견되어 나무울타리로 방비했음을 알 수가 있다. 올림픽공원 내에 있는 '몽촌토성'은 백제가 고대국가의 터전을 마련한 한성시대, 즉 34세기 때 만들어진 거성의 하나이다. 하남 위례성으로 추정된다. 사적으로 지정되어 있다. 남한산성에서 뻗어내린 구릉지를 이용하여 외성과 내성으로 중첩된 구조로 지어진 성이다. 성 안에는 몽촌토성에서 발굴된 백제유물(세발토기, 긴 목 항아리, 계란모양 항아리, 원통형 그릇받침 등 생활용구)이 보존 전시되어 있으며, 움집터와 저장구덩이 등을 발굴 당시 모습 그대로 전시되어 있다."
서울특별시 송파구 오금로 219,(방이동),1,0,A02,A0201,A02010700,126515,12,20020510090000,http://tong.visitkorea.or.kr/cms/resource/11/1567811_image2_1.jpg,http://tong.visitkorea.or.kr/cms/resource/11/1567811_image3_1.jpg,127.1178488772,37.5081579775,6,20220826153130,43438,18,,서울 방이동 고분군,5644.0,"이곳은 1975년 잠실지구 토지구획정리사업을 하다가 발견된 고분 유적이다. 이곳에서 1976년까지 8기의 고분이 조사되었고 1983년에 복원공사를 시행하여 공원으로 만들었다. 고분이 있는 방이동 일대는 원래 해발 3050m 가량의 나지막한 구릉이었으나 개발로 인해 지금은 평지가 되었다. 16호 무덤은 같은 구릉에 있고 7호와 8호 무덤은 조금 떨어진 구릉에 있다. 모든 무덤의 봉분은 원형이다. 무덤의 내부에는 생토면 위에 다듬은 돌을 이용해 방형 또는, 장방형의 널방을 쌓고 널길을 만들었으나, 세부적으로는 무덤마다 조금씩 차이가 있다. 대부분의 무덤은 도굴 당하였으나, 일부 무덤에서 회청색경질의 굽접시와 항아리 등이 출토되었다. 발굴될 당시 이들 유물을 백제시대의 것으로 추정하여 백제 고분군으로 이름 지었으나, 지금은 통일신라시대의 것으로 보고 있다."
서울특별시 송파구 풍납동,,1,0,A02,A0201,A02010200,126520,12,20020402090000,http://tong.visitkorea.or.kr/cms/resource/13/566413_image2_1.jpg,http://tong.visitkorea.or.kr/cms/resource/13/566413_image3_1.jpg,127.1209255392,37.5375629524,6,20220331101905,62418,18,,서울 풍납동 토성,5512.0,"백제의 시조인 온조가 처음 정착한 곳이 하남 위례성이다. 그러나 현재까지 그 정확한 위치는 알려져 있지 않다. 그러나 풍납토성이나 몽촌토성, 방이동 백제고분군, 석촌동 백제 초기 적석총 등이 백제의 한성시대 흔적임에는 분명하다. 풍납토성은 서쪽으로는 한강이 면해 있고 남쪽으로는 몽촌토성으로 통한 길이 나 있다. 그리고 서북쪽으로는 한강을 사이에 두고 아차산성을 바라보며 동남쪽으로는 멀리 남한산성이 보인다. 한강의 천호대교 남단 옆에 있는 풍납토성은 백제 초기의 유적이다. 원래는 둘레가 4km에 달하는 큰 규모의 토성이었으나 1925년 한강의 대홍수로 일부가 유실되고 현재는 약 2.7km 가량만 남아 있다. 동편에는 출입문 터로 여겨지는 흔적 4곳이 남아 있으며 특히 선사시대부터 삼국시대에 이르는 유적이 출토되어 백제시대 전부터 사람이 살았던 곳임을 알 수 있다. 최근에 활발한 발굴 작업이 이루어져 이곳이 백제 왕성이었다는 견해도 제시되고 있다."
