addr1,addr2,areacode,booktour,cat1,cat2,cat3,contentid,contenttypeid,createdtime,firstimage,firstimage2,mapx,mapy,mlevel,modifiedtime,readcount,sigungucode,tel,title,zipcode,overview
충청남도 공주시 명탄서원길 48,(월송동),34,0.0,A02,A0201,A02010700,1956330,12,20141015201510,http://tong.visitkorea.or.kr/cms/resource/05/2738805_image2_1.jpg,http://tong.visitkorea.or.kr/cms/resource/05/2738805_image2_1.jpg,127.1562855811,36.458854718,6,20210901233935,2326,1,,명탄서원,32593,"1490년(성종 21)에 지방유림의 공의로 이명성(李明誠)과 이명덕(李明德)의 충절과 덕행을 추모하기 위해 연기군 금남면에 창건하여 위패를 모셨다. 창건과 동시에 명탄(鳴灘)이라고 사액되어 선현배향과 지방교육의 일익을 담당하였다. 임진왜란 때 소실되었다가 1731년(영조 7)에 현재의 위치로 옮겨 복원하였다. 그 뒤 대원군의 서원철폐령으로 1871년(고종 8)에 훼철되었으며, 광복 후 1955년 후손들이 복원하였다. 경내의 건물로는 3칸의 사우, 8칸의 재실 겸 강당, 6칸의 수호사, 중앙의 신문(神門)과 양옆 협문으로 된 정문 등이 있다. 사우에는 이명성과 이명덕의 위패가 봉안되어 있고, 재실 겸 강당은 유생들의 회합과 제향시 제관들의 숙소로, 수호사는 제구의 보관 및 관리인의 숙소로 사용하고 있다. 매년 3월 5일과 9월 5일에 향사를 지내고 있으며, 제품(祭品)은 7변(籩) 7(豆)이다. 재산으로는 논 1,800여 평, 대지 1,300여 평 등이 있다."
충청남도 공주시 사곡면 능계길 60-67,(사곡면),34,0.0,A02,A0201,A02010700,1956304,12,20141015193858,,,127.0224573019,36.5109630539,6,20220901165826,1192,1,,고로서원,32523,"우의정으로 단종을 보필하다가 계유정난(癸酉靖難)으로 사사(賜死)된 정분과 그의 양자 정지산을 배향하는 사당으로서 1808년(순조 8)에 건립되었다. 1924년 제각(祭閣)인 경모재(敬慕齋)가 지어졌고, 1931년 중수하면서 부여의 외산(外山)에서 발견된 정분의 영정을 모사하여 봉안하였다. 1982년 정분의 충절과 정지산의 효행을 기린다는 뜻에서 충효사라고 명명하였고, 공주시에서 사당 전방에 정려(旌閭)를 짓고 사당에 걸려 있던 명정을 이전하였다. 정려는 1997년 공주시 향토문화유적 제18호로 지정되었다.1994년 공주 지역의 유림(儒林)과 후손들이 사우와 삼문(三門)을 세워 고로서원(古老書院)이라 명명하고 정분을 주향으로 하여 정지산을 함께 배향하고 있다. 사당은 정면 3칸, 측면 2칸의 맞배지붕 구조이고, 30칸의 담장이 둘러져 있다. 삼문에는 의재문(義在門), 사당에는 충효사(忠孝祠) 현판이 걸려 있다. 사당 안의 왼쪽에 정분의 영정이 있고, 중앙에 정분과 정지산의 신위가 봉안되어 있다. 사곡면의 진주정씨 문중에서 관리하고 있으며, 고로사(古老寺)라는 절을 고쳐 재실(齋室)로 이용하고 있다."
충청남도 공주시 향교1길 26,(교동),34,0.0,A02,A0201,A02010700,1954463,12,20141008012715,,,127.1168863516,36.4583568588,6,20221124162915,3209,1,,공주향교,32542,"창건연대는 미상이나 조선 초기 현유(賢儒)의 위패를 봉안, 배향하고 지방의 중등교육과 지방민의 교화를 위해 창건되었다. 원래 웅진동 숭산 기슭에 있던 것을 1623년 순찰사 신감(申鑑)과 목사 송흥주(宋興周)가 현재의 위치로 이건하였다. 1710년 관찰사 한배하(韓配夏)가 명륜당을 중수하였고, 1751년 판관 서흥보(徐興輔)가 다시 명륜당을 보수하였으며, 1813년 관찰사 원재명(元在明)이 향교 전체를 중수하였다. 1822년 관찰사 이석규(李錫奎)가 대성전을, 1831년 관찰사 박제문(朴齊聞)이 강학루를, 1839년 관찰사 조기영(趙冀永)이 대성전을, 1846년 판관 권영규(權永奎)가 강학루를, 1870년 관찰사 민치상(閔致庠)이 명륜당을, 1873년 판관 조명교(趙明敎)가 대성전을 각각 중수하였으며, 1954년 문묘·명륜당·동재·존경각 등을 전면 보수하여 현재에 이르고 있다. 대성전에는 5성(五聖)·10철(十哲), 송조6현(宋朝六賢)의 위패가, 동무·서무에는 우리 나라 18현(十八賢)의 위패가 봉안되어 있다. 조선시대는 국가로부터 전답과 노비, 전적 등을 지급받아 교관이 교생을 가르쳤으나, 현재는 교육적 기능은 없어지고 봄·가을에 석전(釋奠)을 봉행(奉行)하고 초하루·보름에 분향을 올리고 있다. 이 향교는 현재 지역유림들의 모성계(慕聖契)에서 기금을 마련하여 운영하고 있으며, 소장도서는 89종 337책이 있다. 1978년 충청남도 유형문화재로 지정되었다."
충청남도 공주시 반포면 상하신길 396,,34,0.0,A02,A0203,A02030100,1938262,12,20140731013912,,,127.21959024,36.3847448812,6,20210811193245,3827,1,,계룡산상신농촌체험휴양마을,32625," 그릇 만들고 만두도 빚고, 계룡산상신체험휴양마을   공주에는 전통 마을 행사와 다양한 볼거리, 풍성한 체험거리를 가진 체험마을이 여럿 있다.계룡산 상신 농촌체험휴양마을은 전통문화가 살아 숨쉬는 마을로, 도자기체험, 만두만들기, 두부만들기, 인절미 만들기 등 연중 다양한 체험을 할 수 있는 곳이다."
충청남도 공주시 신풍면 충의로 2358,,34,0.0,A02,A0203,A02030600,1859903,12,20131118232024,,,126.9400429862,36.4923581907,6,20220321141935,6307,1,,공주치즈스쿨,32525,"공주치즈스쿨은 폐교를 재활용해 학생들이 즐겁게 배우고 놀며 친환경 먹거리를 접할 수 있는 공간으로 임실치즈마을의 대전충남지사다.공주치즈스쿨에 들어서면 대룡초교 운동장이 보이고 왼쪽으로 체험장과 뒤편의 송아지 곳간이 있으며 운동장 끝 쪽으로 썰매장과 물놀이장 그리고 우측으로 민속 체험장이 자리한다.
학교건물 1층에는 예약접수실과 더불어 피자 체험장이 있다. 조별로 녹차 가루가 들어가 녹색을 띄는 도우가 놓여있다. 검은 깨가 드문드문 박혀있는 도우를 밀대로 밀고 소스를 바른 후 조원들이 상의해 햄과 양파·올리브·파프리카·옥수수 등으로 예쁘게 장식한 후 피자치즈를 듬뿍 뿌리면 피자가 완성된다. 이것을 오븐에 구워 스파게티와 함께 점심으로 먹는다. 2층에는 치즈 체험장이 있다. 치즈는 유목민들이 목축을 하면서 자연스레 발견한 음식으로 우유가 효소의 작용, 산도의 변화 등 여러 조건에 의해 응고되어 만들어진다.
공주치즈스쿨에서는 목장에서 가져온 신선한 우유를 저온살균하고 유산균을 첨가한 후 동물성 응고효소인 레넷을 첨가한 후 커드커팅을 하고 치즈가 잘 늘어나도록 발효 시키는 과정을 퀴즈와 체험을 통해 배우게 된다. 운동장에 설치된 썰매장은 레일을 깔아 다른 친구들과 부딪치지 않으면서도 스릴을 느낄 수 있다. 체험장 뒤 송아지 곳간에서는 송아지에게 커다란 젖병으로 우유주기를 해 볼 수 있고 민속 체험장에서는 뻥튀기 체험이 진행되고 운동장 한쪽에는 동물농장이 마련되어 있다."
충청남도 공주시 반포면 공암장터길 28-6,,34,0.0,A02,A0201,A02010700,1626449,12,20120509233523,http://tong.visitkorea.or.kr/cms/resource/03/1598603_image2_1.jpg,http://tong.visitkorea.or.kr/cms/resource/03/1598603_image3_1.jpg,127.249745516,36.397921682,6,20220718112107,16938,1,,충현서원,32622,"1581년(선조 14) 서기(徐起)에 의하여 주자(朱子)를 비롯, 이존오(李存吾)·성제원(成悌元)·이목(李穆)의 학문과 덕행을 추모하기 위해 창건하여 위패를 모셨다. 임진왜란 때 소실되었다가 1610년(광해군 2)에 복원하고 1624년(인조 2) 조헌(趙憲)을 추가 배향하였다. 1625년 충현(忠賢)이라 사액되었으며, 그 뒤 김장생(金長生)·송준길(宋浚吉)·송시열(宋時烈)을 추가 배향하여 선현배향과 지방교육의 일익을 담당하여 왔다. 1871년(고종 8)에 대원군의 서원철폐령으로 훼철된 뒤 서원터에 설단(設壇)하고 향사를 지내오다가 1976년에 복원하였다. 경내의 건물로는 3칸의 사우(祠宇), 중앙의 신문(神門)과 양옆 협문(夾門)으로 된 삼문(三門), 6칸의 재실(齋室), 충현서원 사적비, 충현서원 사실 및 송우암추향비, 하마비(下馬碑) 등이 있다."
충청남도 공주시 우성면 연미산고개길 98,(우성면),34,0.0,A02,A0202,A02020100,1170335,12,20110114012824,http://tong.visitkorea.or.kr/cms/resource/20/2720420_image2_1.jpg,http://tong.visitkorea.or.kr/cms/resource/20/2720420_image2_1.jpg,127.1026011129,36.4735465325,6,20220329173401,32607,1,,연미산 자연미술공원,32530,연미산자연미술공원은 자연미술로 특성화된 국내 유일의 친환경 생태미술공원이다. (사)한국자연미술가협회야투가 주관하는 금강자연미술비엔날레와 야투자연미술국제레지던스프로그램 등을 통해 조성되며 국내외 작가들의 야외 설치작품 100여점을 만나볼 수 있다. 설치 작품들은 자연과 조화를 이루며 그 수명의 한계에 따라 지속적으로 교체되어 매번 새로운 감동으로 감상할 수 있는 특징이 있다.
충청남도 공주시 반포면 수목원길 25,(반포면),34,0.0,A01,A0101,A01010700,433027,12,20080129011348,,,127.1994826837,36.4227012896,6,20220418141021,34425,1,,이안숲속,32620,"이안숲속은 우리나라 자생식물종의 현지보존과 산림에  대한 자연 학습 교육 및 목적으로 충청남도 공주에 총 1,118ha의 면적에 목본식물  1,836종류와 초본식물 1,418종류 모두 3,344 종류로 1999년부터 조성하기 시작하여  열대 식물관을 비롯한 각종 전시관과 하늘마루 등과 같은 테마별 공간을 조성으로  2006년 완공되었다. 이안숲속은 성장하는 우리의 자녀에게는 사계절  내내 자연학습장으로 지친 현대인들에게는 도시를 떠나 자연의 편안함과 호젓함 속으로  마음의 안식을 찾아 가는데 휴식의 쉼터 역할을 하고자 하며 다양한 현지 식물자원의  보존과 연구 개발을 하고자 한다.
또한 이안숲속에는 펜션 및 오토캠핑장이 있어 숙박이  가능하기 때문에 가족 단위나 단체 여행에 좋은 곳이다."
충청남도 공주시 의당면 동혈사길 77,,34,0.0,A02,A0201,A02010800,304692,12,20071129184034,http://tong.visitkorea.or.kr/cms/resource/32/1405932_image2_1.jpg,http://tong.visitkorea.or.kr/cms/resource/32/1405932_image3_1.jpg,127.1600270815,36.555182623,6,20220622132939,17633,1,,동혈사,32518," 천태산의 고풍스러운 사찰, 동혈사   동혈사는 충청남도 공주시 의당면 월곡리 해발 392m 높이의 천태산에 중턱에 자리하고 있으며, 대한불교조계종 제6교구 본사 마곡사의 말사이다.천태산 동혈사는 백제시대에 창건되었다고 전해지는 사찰이다. 동서남북의 혈(穴)에 위치하여 서혈사, 남혈사 등과 함께 우리나라에 풍수사상이 널리 유행하면서 세워졌을 법한 그런 사찰이다. 지금 그러한 흔적은 현재의 사찰 아래쪽 동혈사터(銅穴寺址)에 남아 있다. 더욱이 단청을 하지 않은 대웅전의 모습은 사찰을 더욱 고풍스럽게 만들어 주어 인상적이었다.  동혈사의 모습을 한 눈에 바라보기 위해 맞은편 능선을 따라 10분여 가다보면 겨울산 답지 않게 나무들이 제법 잎사귀를 지니고 있어서 시각적으로 절집을 풍요롭게 만들어 준다. 맞은편 산꼭대기에 오르면 군용 헬기장이 있는데, 이곳에서는 천태산 주위의 풍광 뿐 아니라 동혈사의 전체를 한 눈에 조망할 수 있는 곳이다. 헬리콥터가 오고갈 때마다 수행에 방해가 되어 주지스님이 다니지 못하게 하였다고 한다.이렇게 인위적인 것을 배제했기 때문인지 최근의 동혈사에는 자연의 오묘한 기운과 주지스님의 용맹정진이 넘치고 있다.    동혈사의 이름에 대하여    동혈사라는 명칭에 있어서는 동녘 동(東)자와 구리 동(銅)이 혼용되고 있다. 천태산 동혈사는 백제시대에 창건되었다고 전해지는 사찰이다. 동서남북의 혈(穴)에 위치하여 서혈사, 남혈사 등과 함께 우리나라에 풍수사상이 널리 유행하면서 세워졌을 법한 그런 사찰이다. 지금 그러한 흔적은 현재의 사찰 아래쪽 동혈사터(銅穴寺址)에 남아 있다."
충청남도 공주시 반포면 동학사1로 462,,34,0.0,A02,A0201,A02010700,250297,12,20071019090000,,,127.2180550965,36.3539511573,6,20220616140001,17828,1,,숙모전,32626," 단종과 충신들의 위패를 모신 사당, 숙모전   충청남도 공주시 계룡산 자락이 자리잡은 동학사(東鶴寺) 경내에 있다. 단종(14411457)과 단종의 죽음을 막기 위해 노력한 충신들의 위패를 모신 사당이다.숙모전에는 매월당 김시습의 충절과 애통함이 서려 있다.1455년 세조가 조카인 단종을 쫓아내고 왕위에 오르자, 김시습은 머리를 깎고 동학사에 와 통곡을 하였다. 다음 해 사육신이 참수를 당한 뒤에는 시신을 거두어 노량진 언덕에 매장하고 동학사로 다시 돌아와 단을 만들고 제사하였다. 2년 뒤 세조가 동학사에 들렸다가 이 내력을 듣고 자신으로 인해 억울하게 죽은 280명을 위해 초혼각을 짓고 초혼제를 지냈다. 이 초혼각은 1728년(영조 4)에 불에 타 1827년(순조 27)에 다시 세웠으며, 1904년(고종 41)에 중건하면서 숙모전이라는 이름을 받았다. 현재 매년 봄과 가을에 추모제를 지낸다. 숙모전 내부에는 단종과 단종비 정순왕후를 비롯해 동무에는 엄홍도를 비롯해 47위를 모시고, 서무에는 사육신을 비롯해 47위를 모시고 있다.   숙모전의 의의   신라, 고려, 조선 삼대의 충절인이 배향되어 있어 일반적인 서원 사우의 특징에서 벗어나 새로운 모습을 볼 수 있는 중요한 자료이며, 유교와 불교가 한자리에 있는 모습을 엿볼 수 있는 자료이다."
충청남도 공주시 금성동,,34,0.0,A02,A0201,A02010700,250257,12,20071017090000,http://tong.visitkorea.or.kr/cms/resource/79/2734979_image2_1.jpg,http://tong.visitkorea.or.kr/cms/resource/79/2734979_image2_1.jpg,127.1175998755,36.4695139254,6,20220616095803,20175,1,,공주 정지산 유적,32535," 백제사 연구에 중요한 유적, 공주 정지산 유적   1998년 7월 28일 충청남도기념물로 지정되었다가 국립공주박물관의 발굴조사 실시 결과 국가차원의 제의시설로 추정되는 중요 유적으로 평가되어 2006년 11월 6일 사적으로 지정되었다. 백제의 왕실제사유적으로 공주 송산리 고분군(公州宋山里古墳群:사적)과 인접한 곳에 있다. 시설물은 기존의 가옥을 모두 철거한 후 능선을 깎아내고 넓고 평탄한 대지에 만들어졌으며 공산성이 바라보이는 남동쪽으로는 약 세겹 내지 다섯겹의 나무울타리를 돌리고 송산리 고분군쪽으로 연결되는 능선에는 약 1m 내외의 좁은 출입구만 남긴채 너비 5m, 깊이 2m 이상의 넓고 깊은 도량을 파고 내부에 몇채의 건물을 축조하였다. 또한, 이곳에서 화려한 장식이 부착된 장고형 그릇받침 등 국자세자와 관련된 유물이 수집되었다.   정지산 유적의 의의   유적은 인접한 송산리고분군과 매우 밀접한 관련이 있는 웅진시기 백제의 국가적 제사시설일 가능성이 높으며, 내부 시설물도 국내에서 최초로 조사된 특수한 구조물이어서 자료가 지극히 부족한 백제사연구에 매우 귀중한 자료이다.   면적  11,775㎡  소유자  건교부 및 사유(김해김씨종중)"
충청남도 공주시 제민1길 15,,34,0.0,A02,A0201,A02010800,231954,12,20071016090000,,,127.1226193499,36.4516966118,6,20210928200248,17467,1,,공주 반죽동당간지주,32549," 백제시대의 두 돌 기둥, 공주 반죽동당간지주   백제시대의 대통사(大通寺) 절터라고 하는 현재의 반죽동 민가에 있다. 당간지주는 서로 마주보는 안쪽 면에는 아무런 조각이 없으나, 바깥쪽 면은 가장자리를 따라 굵은 띠 모양을 도드라지게 새겼다. 기둥머리 부분은 안쪽에서 바깥쪽으로 모를 둥글게 깎았으며, 안쪽 위·아래 2곳에 당간을 고정시키기 위해 네모난 구멍을 파 놓았다. 한국전쟁 때 폭격을 맞아 지주의 받침돌과 한쪽 기둥의 아래부분이 많이 손상되었으나, 전체적으로 소박하고 형태가 간결하다. 이 일대의 다른 유물들과 함께 백제의 유물로 생각할 수도 있으나, 받침돌에 새겨진 안상(眼象)을 조각한 수법으로 보아 통일신라시대에 만들어진 것으로 짐작된다.내면 외의 3면에 각 변을 따라 똑같은 너비로 테두리를 도드라지게 하였다. 양 지주의 머리부분은 내면상단에서 외면으로 반쯤 평평하다가 포물선을 그리며 내려와 외부로 깎여 1m쯤 사선을 이루고, 양변의 가장자리는 그대로 조각·장식되어 있다. 그러므로 외측면에서 보면 머리부분은 양 세로띠뿐이나, 앞뒤쪽에서는 머리부분의 외측이 포물선을 그리며 1m쯤까지 비껴 내려와 마치 유선형 형태를 보인다. 당간을 고정시키는 간(杆)은 상하 2곳에 간구(杆溝)를 마련하였다.   당간지주란   기도나 법회 등 절에 행사가 있을 때 사찰의 입구에 세워 부처와 보살의 성덕을 표시하는 기를 당(幢)이라 하며, 이를 달아매는 장대를 당간(幢竿)이라 하고, 이 장대를 양옆에서 지탱하는 두 돌기둥을 당간지주라 한다."
충청남도 공주시 시어골2길 96-9,(웅진동) 부근,34,0.0,A02,A0201,A02010700,231955,12,20071016090000,,,127.1102373343,36.444022274,6,20220915134514,16755,1,,공주서혈사지,32544," 백제시대의 사찰터, 공주서혈사지   공주서혈사지는 공주 웅진동 우뚝 솟은 망월산의 동쪽에 자리잡고 있다. 이곳에서 발견된 서혈사(西穴寺)라 적힌 기와와 백제의 전형적인 연꽃무늬 와당과 통일신라와 고려시대의 각종 기와류, 석탑부재, 초석들로 보아 백제 때 지은 사찰로 추정된다. 서혈사터는 완만하게 경사진 밭을 3단계로 구분하여,석축을 쌓고 지었던 것으로 보인다. 조사된 내용에 의하면 불도를 닦던 곳의 배치가 지형과는 관계없이 남쪽을 향해 탑, 불당과 함께 직선상에 놓았음을 알 수 있다. 이 절터와 관련이 있는 석굴사원은 자연적인 동굴을 이용하여 승려의 수도장으로 만든 것인데 크기는 길이 8m, 높이 4.5m, 폭 17m의 규모이다. 북쪽 벽에는 불상을 안치하였던 것으로 보이는 층대가 있다. 여기에서 발견된 통일신라시대 작품인 3구의 석조불상으로 미루어 보아 통일신라시대에 다시 지어진 것으로 보인다.서혈사지 석굴은 석굴 내에 불상을 안치하는 석굴사원의 수법을 백제가 남조로부터 도입하였을 것이라는 당시 상황을 추측하게 한다.  문화재 정보 문화재지정현황 : 충청남도기념물 지정일 : 1982년 12월 31일 면적 : 2,628㎡"
충청남도 공주시 금성동,,34,0.0,A02,A0205,A02050200,129571,12,20070702090000,http://tong.visitkorea.or.kr/cms/resource/47/216647_image2_1.jpg,http://tong.visitkorea.or.kr/cms/resource/47/216647_image3_1.jpg,127.1294657258,36.4602957467,6,20220727103641,18484,1,,명국삼장비,32555," 정유재란 당시 장군의 업적을 기린 비, 명국삼장비(明國三將碑)   충남 유형문화재로 정유재란 이듬해인 선조 31년(1598)가을 공주에 주둔하면서 공주민을 왜(倭)로부터 보호해주고 생업에 종사할 수 있도록 보살펴준 명(明)나라의 3장수 제독 이공(提督 李公),위관 임제(委官 林濟), 유격장 남방위(遊擊將 藍芳威)의 업적을 기린 사은송덕비(謝恩頌德碑)이다.본래는 공주 금강변 남안에 세워졌던 것을 공산성으로 옮겨왔었는데, 일제(日帝)때 일인(日人)들이 공주읍사무소 뒤뜰에 매립하였던 것을 해방 후 다시 이곳으로 이전한 것이다. 비석은 선조(宣祖) 37년(1655)에 건립된 것이며, 3개의 비석으로 되어 있다. 삼장비의 내용은 명나라의 3장수는 정유년 이듬해인 선조31년 가을 공주에 이르러 군기를 엄히 다스리는 한편 주민들을 정성껏 보살펴, 공주민은 왜구의 위협하에서도 안전할 수 있었고 임진년에 비로소 생업에 종사할 수 있었다라고 기록되어 있다.   명국삼장비의 형태   비의 지붕돌은 옥개(屋蓋) 모양이나 대형의 보주(寶珠)를 올려 높게 처리하였다. 비신(碑身)은 박리 현상으로 인해 비문이 선명하지 않다. 일제강점기에 일본인들이 왜구(倭寇) 등의 글자를 훼손하였다. 일제강점기의 흔적으로 비면에 탄흔의 흔적이 남아 있다. 망일사은비(忘日謝恩碑)의 규모는 총 높이 172㎝, 비신의 높이 163㎝, 너비 60㎝, 두께 32㎝, 자경 3×4㎝이다. 위관임제비(衛官林濟碑)의 규모는 총 높이 173㎝, 비신의 높이 154㎝, 너비 48㎝, 자경 3×4㎝이다. 유격장 남공종덕비(遊擊將 藍公種德碑)의 규모는 총 높이 168㎝, 비신의 높이 157㎝, 두께 15㎝, 너비 70㎝, 자경 3×4㎝이다."
충청남도 공주시 공산성길 59-22,(금성동) 부근,34,0.0,A02,A0205,A02050200,129572,12,20070702090000,http://tong.visitkorea.or.kr/cms/resource/46/1600046_image2_1.jpg,http://tong.visitkorea.or.kr/cms/resource/46/1600046_image3_1.jpg,127.1256076876,36.4621954615,6,20220729135745,21942,1,,쌍수정사적비,32555," 공산성 서측에 위치한 비, 쌍수정사적비(雙樹亭史蹟碑)   공산성 진남루 서측에 위치한다. 조선 인조 2년(1624)에  왕이 이괄의 난을 피해 공주성에 머물렀던 장소에 사실을 기록하여 숙종 34년(1708)에  석비를 건립하였다. 이괄의 반란과 인조의 남천(南遷)에 대한 내력을 쓰고 공산성에  머물렀던 10일 동안의 행적, 그리고 왕이 머물렀던 공산성에 대한 내용 등이 적혀  있다. 비신은 방형의 오석이며 너비와 두께는 거의 같은 크기이다. 4면에 걸쳐 각자하였고,  비머리 위에는 보주가 있다. 비문은 우의정 신흠이 찬하고 중추부사 남구만이 서(書)하였으며, 영의정 최석정이 두전하였는데 후에 송시열의 음기(陰記)가 있다.   공산성에 대하여   공주 시내 산성동에 있는 공산성은 백제 문주왕  1년(475)에 한산성에서 웅진으로 천도하였다가 성왕 16년(538)에 부여로 천도할 때까지  5대 64년 간의 도읍지인 공주를 수호하기 위하여 축조한 성이다. 공산성은  총 연장 2,660m의 고대 성곽으로 해발 110m의 능선에 위치하고 있는 자연의 요지이다."
