addr1,addr2,areacode,booktour,cat1,cat2,cat3,contentid,contenttypeid,createdtime,firstimage,firstimage2,mapx,mapy,mlevel,modifiedtime,readcount,sigungucode,tel,title,zipcode,overview
충청남도 공주시 반포면 동학사1로 462,(반포면),34,0.0,A02,A0201,A02010800,125893,12,20030527090000,http://tong.visitkorea.or.kr/cms/resource/83/2365483_image2_1.jpg,http://tong.visitkorea.or.kr/cms/resource/83/2365483_image3_1.jpg,127.2200577134,36.3532762699,6,20220516142638,59402,1,,동학사(공주),32626,"동학사는 공주에서 약 25km, 대전에서 8km 정도 떨어진 반포면 학봉리에 자리잡고 있다. 계룡산 동쪽 골짜기에 싸여 있는 천년고찰 '동학사'는 우리나라에서 가장 오래된 최초의 비구니 강원(일명:승가대학)으로서,150 여명의 비구니 스님들이 부처님의 일대시교 및 수행과 포교에 필요한 제반교육을 받으며 정진하고 있는 유서깊은 도량이다. 또한 동학사는 문필봉(文筆峰)이 있어서 대강백들이 많이 배출된 곳으로도 유명하며 비구니 스님들의 경 읽는 소리는 맑은 계곡에 흐르는 물소리와 하나로 어우러져 고즈넉한 산사에 그 청아함을 더해준다. 주변에는 많은 볼거리가 있고 교통이 편리해 계룡산의 관광지 중에서도 가장 많은 사람들이 찾아온다. 특히 박정자삼거리에서 동학사에 이르는 약 3km 거리의 가로수는 벚나무로 이루어져 봄이면 벚꽃터널이 장관을 이룬다. 93년부터 매년 동학사 봄꽃축제가 개최된다.   동학사의 역사  신라 성덕왕 23년(724)에 상원조사가 이곳에 암자를 짓고 수행하던 곳에 회의화상이 창건 하였다. 당시에는 문수보살이 강림한 도량이라 하여 절 이름을 청량사라 했었다. 고려 태조 3년(920)에 도선국사가 왕명을 받아 중창하였는데, 국사가 원당을 건립하고 국운을 기원했다해서 '원당'이라고도 불리우다가 그 후 영조 4년(1728) 신천영의 병화로 사원이 전소되어 80여년 동안 빈 절터인 채로 내려오다 이조 순조 14년(1814)에 금봉화상이 옛 원당터에 실상암을 짓고 절을 중건하여 절 이름을 개칭하되, 진인출어동방(眞人出於東方)이라하여 ""동""자를 따고 사판국청학귀소형(寺版局靑鶴歸巢形)이라 하여 ""학""자를 따서 동학사라 명명했다는 설도 있고, 또 계룡산 동쪽 사찰 입구에 청학이 깃들었다는 학암(鶴岩)을 위주로 하여 동학이라는 절 이름이 붙여졌다는 설도 있다. 그 뒤 고종 원년(1864)에 만화화상이 개창하였고, 그의 제자인 경허성우 스님이 고종 8년(1871)에 강의를 열었으며 1879년에는 이 곳에서 큰 깨달음을 얻어 한국의 선풍을 드날렸다. 근대에서는 1950년의 한국전쟁으로 절의 건물이 전부 불타 없어졌다가1960년 이후 서서히 중건되었으며, 지금도 일주문 불사 및 상원암(옛 계명장사로 남매탑이 있는 곳) 복원불사가 진행중이다. 현재 전각으로는 대웅전, 삼성각, 범종각을 비롯하여 조사전, 육화당, 강설전, 화경헌, 엽화실, 실상료, 숙모전 등이 있다. 신내암자로는 미타암, 길상암, 관음암, 문수암, 심우정사, 상원암 등이 있다.   동학사의 문화재   동학사 삼성각 (문화재자료 제 57호) 칠성, 산신,독성의 삼성을 모신 곳이다. 가운데 칠성, 왼쪽에 산신, 오른쪽에 독성탱화를 모셨다. 칠성은 북두칠성을 말하는데 별나라의 주군으로 인간의 복과 수명을 맡고 있으며, 독성은 인연의 이치를 홀로 깨닫고 성인이 되어 말세 중생에게 복을 내리는 존재이다. 산신은 우리 민족 고유의 산악 신앙의 토속신으로, 호랑이와 더불어 나타나는데 재물을 담당한다. 각각 도교, 불교, 토속신앙의 한 표현으로, 불교가 토착화하는 과정에서 여러 신앙요소가 합쳐진 형태이다. 불교 이외의 신앙대상을 모셨으므로 건물이름을 전이라 하지 않고 각이라 하였다. 건축물  동학사에는 다른절에서 볼 수 없는 독특한 특색이 있는 건축물이 있다. 동학사 경내에 들어서려면 두 기둥이 우뚝한 홍삼문을 볼수 있는데, 이는 궁궐, 관아, 능, 묘, 원 앞에 세우는 문으로 사찰과는 어울리지 않는 30자 이상의 홍살문이다. 이것은 동학사가 사원이면서도 경내에 유신의 사당인 동계사, 그리고 삼은각과 숙모전이 있는 점들과 상호 연관된 인연들이 어우러져 세워진 것이다. 1) 동계사 : 신라 멸망 후 고려 개국공신 유차달이 태조19년(936)에 이곳에 와서 신라의 시조와 박제상의 충렬을 기리기 위해 동계사를 짓고 제사를 지내다 병화를 만나 전소되었다가 1956년 다시 중건되었다. 2) 삼은각 : 이태조 3년(1394)에 야온 길재가 동학사에 와서 박제상을 모신 동계사 전에 단을 설치하여 포은 정몽주를 위해 제사지내고 5년후(1399) 유방택이 목은 이색을 모시고, 후에 야은을 모신 곳이다. 3) 숙모전 : 매월당 김시습의 충절과 애통함이 깃들인 곳이다. 매월당은 당대 걸승으로서 생육신 한 분이다. 세조 1년 거지꼴의 한 승려가 삼온각에 엎드려 통곡을 하고 있었는데, 이 거지 승려 매월당은 단종이 숙부(세조)에게 왕위를 박탈당했다는 소식을 듣고 머리를 깎고 승려가 된 후 여기에와 그들의 혼백을 붙들고 통곡을 했던 것이다. 그는 세조2년 사육신이 참수를 당하자 시신을 거두어 노량진 언덕에 매장하고 동학사로 다시 돌와와 초혼각을 짓고 충정를 기렸다. 세조는 그 후 우연히 이곳에 들렀다가 그러한 내력을 전해 듣고 자기로 인하여 죽음을 당한 280명의 이름을 열거해 초혼각에 모시도록 했다. 이 초혼각은 영조 때 전소되어 혼기를 잃어 58위만 봉안하고 고종때 중건하여 고종으로부터 숙모전이란 사액을 받았다. 그 후 26위를 추가해 현재 89위만 봉안되어 있고 음력 3월 보름과 10월24일에 추모제를 올리고 있다."
충청남도 공주시 고마나루길 51-12,(웅진동),34,0.0,A02,A0202,A02020300,127850,12,20030515090000,http://tong.visitkorea.or.kr/cms/resource/65/757565_image2_1.jpg,http://tong.visitkorea.or.kr/cms/resource/65/757565_image3_1.jpg,127.107523183,36.4627950745,6,20220323175229,39281,1,,금강온천,32535,"금강온천은 지하 1300m 암반수에서 용출하는 양질의 온천수로 약칼리성 단순천이며 수질은 무색, 무미, 무취의 성질을 지니고 있다. 게르마늄 성분이 함유되어 피부노화 방지, 만성 신경계통 류마티스 관절염, 당뇨병, 부인병 및 성인병 예방과 치료에 효과가 있다고 알려져 있다. 강온천은 대형 온천 시설과 숙박 시설이 함께 있어 공주를 관광하는 가족 단위의 손님이 많이 있다."
충청남도 공주시 사곡면 마곡사로,,34,0.0,A01,A0101,A01010600,126849,12,20030411090000,http://tong.visitkorea.or.kr/cms/resource/55/2519955_image2_1.jpg,http://tong.visitkorea.or.kr/cms/resource/55/2519955_image2_1.jpg,127.0123513592,36.559043468,6,20220331143939,27877,1,,마곡사 천연송림욕장,32520," 기와 건강을 유지하는 송림욕, 마곡사 천연 송림욕   대한불교 조계종 제6교구 본사로 천년 고찰인 마곡사 태화산에 개설된 송림욕장이다. 수고 5∼10년 된 적송의 사이를 따라 마곡사를 둘러싸고 있는 태화산의 능선에 개설된 등산로의 길이는 무려 5km에 달하며 약 2시간 30분이 소요된다. 마곡사 대웅전 앞 은적암 입구를 기점으로 하여 해발 423m의 활인봉, 417m의 나발봉을 따라 마곡사 경내를 기고 한바퀴 도는 이 등산로는 경사가 완만하여 어린이와 노인 등 노약자가 등산하기에도 적당하다.   활인봉에는 죽어가는 사람도 살린다는 생명수 샘터가 위치해 있으며 사람에게 기와 건강을 유지시켜 주는 송림욕 중에서도 가장 으뜸이 된다는 적송림은 등산객들에게 건강나무로서 많은 사랑을 받을 것으로 기대되고 있으며 인근에 유황성분의 마곡 온천이 자리잡고 있어 등산 후의 흘린 땀과 피로를 유황온천에서 시원하게 풀 수 있는 최적의 조건을 가지고 있다.   여러 시대의 불교 유산이 있는 곳, 마곡사   마곡사 사적입안(事蹟立案)의 기록에 따르면, 640년(신라 선덕여왕 9)에 자장(慈藏)이 창건하였으며, 고려 명종(明宗) 때 1172년 보조국사(普照國師)가 중수하고, 범일(梵日)이 재건하였으며, 다시 도선국사(道詵國師)가 중수하고, 순각(淳覺)이 보수하였다. 조선시대에도 세조가 이 절에 들려 영산전(靈山殿)이라고 사액(賜額)을 한 일이 있다.  창건 당시에는 30여 칸의 대사찰이었는데, 현재는 대웅보전(보물)·대광보전(大光寶殿:보물)·영산전(보물)·사천왕문·해탈문(解脫門) 등이 있을 뿐이다. 이 밖에 사보(寺寶)로는 5층 석탑(보물)·범종(梵鐘:지방유형문화재), 괘불(掛佛) 1폭, 목패(木牌), 세조가 타던 연(輦), 청동 향로(지방유형문화재)가 있고, 《감지금니묘볍연화경(紺紙金泥妙法蓮華經) 제6권(보물) 및 《감지은니묘법연화경제1권(보물)이 있다."
충청남도 공주시 계룡면 신원사동길 1,(계룡면),34,0.0,A02,A0201,A02010800,125889,12,20030207090000,http://tong.visitkorea.or.kr/cms/resource/72/1406072_image2_1.jpg,http://tong.visitkorea.or.kr/cms/resource/72/1406072_image3_1.jpg,127.1839253154,36.3355165551,6,20220825125103,25070,1,,신원사,32619," 백제 시절의 고찰, 신원사   신원사(新元寺)는 동학사 갑사와 함께 계룡산 3대 사찰로 공주시 계룡면 양화리에 소재한다. 이 절은 백제 의자왕 11년(651)에 보덕화상이란 고승이 창건하고 그 뒤에 여러번의 중창을 거쳐 1876년 보련화상이 고쳐 짓고 1946년 만허화상이 보수하여 오늘에 이르고 있다. 현재의 신원사는 임진왜란 때 소실된 후 현재의 위치로 옮긴 것으로 전해지며 원래의 건물지는 신원사와 중악단 남쪽에 전개된 넓은 밭으로 추정되고 있다.   이곳은 금당지를 중심으로 신원사의 원건물지가 있을 것으로 믿어지나 조사의 결여로 자세하지 않다. 그러나 이 금당지로 믿어지는 지역을 중심으로 오층의 석탑이 세워져 있어 이곳이 본래의 사역이었음을 쉽게 알게 한다. 이와 같은 원금당지를 중심으로 석탑이 있는 이외의 현재의 신원사는 대웅전을 비롯하여 대웅전의 우측에 독성각이 좌측에는 영원전이 있는데, 이들은 최근에 신축 혹은 개수가 이루어져 있다. 한편 대웅전에는 전내에아미타불을 주존불로 하여 우측에 대세지보살을 좌측에 관음보살을 모시고 있다.   신원사의 유적 및 유물   대웅전은 충청남도 유형문화재, 신라 말 고려 초기의 석탑양식인 5층석탑은 충청남도 유형문화재이다. 이 밖에 대웅전에서 약 50여m 거리에 한국산악신앙의 제단으로 중요한 의미가 있는 '계룡산중악단'이 있는데 보물이다. 주변의 암자로는 고왕암, 등운암, 선광원, 소림원, 불이암, 금용암 등이 있다."
충청남도 공주시 우성면 성곡길 371,,34,0.0,A02,A0201,A02010800,126546,12,20030128090000,http://tong.visitkorea.or.kr/cms/resource/50/216650_image2_1.jpg,http://tong.visitkorea.or.kr/cms/resource/50/216650_image3_1.jpg,127.0716696457,36.5073226694,6,20221018132101,24386,1,,성곡사,32531,"성곡사는 1983년부터 불사를 시작하여 1995년 회향식을 가진 사찰로 뒤로는 고불산(갈마봉)이 웅장한 위용을 자랑하고 있고 좌우로는 천마산과 문필봉으로에워싸인 빼어난 풍광을 자랑하는 곳이다.성곡사 천불전에 모셔진 청동좌불은 국내에서 가장 큰 좌불로 높이만 해도 12.5m이며, 대리석으로 만든 좌대를 포함할 경우 18m에 이르러 보는 이로 하여금 저절로 환희심이 나오게 한다.
또 석가모니 부처님을 둘러싸고 반원형으로는 부처님의 상수 10대 제자상이 모셔져 있으며, 그 뒤로는 동판에 새긴 금강경이 병풍처럼 둘러져 있다.또한, 전체길이 210m에 이르는 말굽 모양의 계단 10개에는 1,000 불상이 있는데 이 불상들도 높이가 1.9m로 높다. 그뒤로는 개인의 소원을 담는 원불로 야광여래 333,333 불상이 있는데, 이는 석가가 이세상의 중생을 직접 교화할 때 영취산에서 1,250여 명의 비구승을 모아놓고 대승의 참진리인 《묘법연화경을 설법하던 모습을 그대로 재현한 것이다.그 밖에는 대웅전, 팔부신장, 명부전, 영산전, 삼성각, 아미타불, 지장보살, 종각, 탑, 포화대상, 무심돌, 십일면관음 등이 있다."
충청남도 공주시 왕릉로 118,(금성동),34,0.0,A02,A0201,A02010900,127240,12,20030122090000,http://tong.visitkorea.or.kr/cms/resource/86/2518286_image2_1.jpg,http://tong.visitkorea.or.kr/cms/resource/86/2518286_image2_1.jpg,127.120083137,36.4639201663,6,20211019223847,27372,1,,공주 황새바위 순교성지,32541,"충청감영이 있던 공주에서는 천주교 박해 때마다 각처에서 체포된 천주교도들이 와서 문초와 형벌을 받았다. 그중에서 끝까지 천주 신앙을 버리지 않은 순교자들 가운데 일부가 공주의 처형지에서 순교했는데, 그 순교지가 바로 황새바위이다.황새바위 천주교도 순교지 천주교 박해가 극심했던 18세기 100여 년 동안(17971879) 수많은 천주교 신자들이 공개 처형된 사형터이다. 즉, 유교를 통치이념으로 했던 조선조 시대에 충청도의 감영이 있던 공주로 압송된 천주교 신도 수백 명의(기록된 이름 248명) 순교를 당한 곳이다. 죄인들의 공개 처형지였던 이곳 황새바위는 황새도 서식했던 곳이기에 황새바위라고도 하고, 이곳에 있던 바위가 죄수들의 목에 씌우는 칼인 황새 모양으로 생겼고, 목에 큰 칼을 쓴 죄인들이 이 언덕 바위 앞으로 끌려나와 죽어 갔으므로 황새바위라고도 한다.

 황새바위 순교지의 역사 
황새바위 천주교도 순교지 성지 조성 사업이 시작된 것은 1980년 12월 공주중동본당에서 대전교구의 후원으로 현재의 부지 6.6116m² 을 매입하면서였다. 이어 1982년에는 성지 관할권이 공주교동본당으로 이관되었고, 1984년 3월에는 황새바위성역화사업추진위원회가 결성되었다.그 결과 다음해 11월 7일에는 황새바위 순교탑과 경당이 완공되었으며, 이어 12사도 석조 기둥 건립, 성모자상 안치, 십자가의 길 조성 사업, 피정의 집 겸 성당 건립 등이 이루어졌다. 또, 2003년에는 옛 공주 향옥 자리와 인접해 있는 공주 교동성당 내에 순교 현양비가 건립되기도 하였다. 황새바위 천주교도 순교지는 2008년 1월에 교동본당에서 분리되어 독립 성지가 되었다."
충청남도 공주시 반포면 도예촌길 71-25,,34,0.0,A02,A0201,A02010600,126725,12,20020607090000,http://tong.visitkorea.or.kr/cms/resource/44/757544_image2_1.jpg,http://tong.visitkorea.or.kr/cms/resource/44/757544_image3_1.jpg,127.2151154996,36.3899747586,6,20220519192417,38296,1,,계룡산도예촌,32625," 철화분청사기의 맥을 잇는 계룡산도예촌   상신리는 마을 중간에 위치한 규모가 큰 당간지주를 통해 이곳이 통일신라에 지어졌던 구룡사지라는 것을 알 수 있으며 아직도 돌담길이 잘 보존되어 있다. 상신리 주변의 반경 7km 이내에는 도자사에 있어 역사적인 의의를 갖는 일본의 도조 이삼평공의 비가 세워져 있고 조선 초에서 중기까지 오직 이곳에서만 생산된 계룡산 철화분청사기의 생산가마인 가마터(사적)가 있다. 도예촌 형성은 전승복원을 목적으로 하여 전통과 미래가 공존하는 도자 문화 창출지로서 발전시키기 위해 추진되었다. 1993년 5월부터 입주자가 도자기를 생산하기 시작하여 현재 12명의 도예가가 모여 작품활동을 하고 있다. 계룡산 도예촌은 자연발생지가 아닌 동시 일괄적으로 입주한 전국 최초의 도예촌이 된 것이다.   계룡산도자예술촌은 5천여평 규모에 대학에서 도예를 전공한 30대에서 40대 초반의 젊은 도예인 18명이 뜻과 힘을 모아 형성한 공동체 마을이다. 1993년 입촌한 이후 꾸준한 작품활동과 도자기 캠프를 운영하면서 점차 계룡산의 명소로 자리잡고 있다.  계룡산 도예촌의 작가들은 지역의 대표적 문화유산인 철화분청사기의 전승복원에 힘쓰고 있다.  어린이들의 교육산실의 현장으로 자라나는 새싹에게 정신적인 문화와 우리지역의 자긍심을 심어주는 교육 프로그램과 기업체나 단체의 문화활동으로서의 도예문화 보급에 앞장서고 있다. 계룡산도예촌은 옛 것을 그대로 만드는 것이 아니고 새로운 조형개념을 도입하여 개인의 작품 및 교육활동을 하고 있다. 이곳의 주생산품은 항아리, 다기도구일체, 화병, 벽걸이, 물잔, 목걸이, 손도장찍기, 인형만들기, 필통, 촛대, 연적 등이다."
충청남도 공주시 계룡면 갑사로 225,,34,0.0,A01,A0101,A01010900,125833,12,20020603090000,http://tong.visitkorea.or.kr/cms/resource/76/1600076_image2_1.jpg,http://tong.visitkorea.or.kr/cms/resource/76/1600076_image3_1.jpg,127.1822106747,36.3691793379,6,20220315161011,58637,1,,갑사계곡,32615," 계룡산 계곡 중 가장 빼어난, 갑사계곡   계룡산국립공원에 있는 7개의 계곡 중 가장 빼어난 갑사계곡은 한여름에도 서늘하게 느껴질 만큼 시원하다. 가을에는 ""춘마곡 추갑사""라고 할 정도로 가을 단풍이 아름답다. 특히 5리숲이라고 불리는 갑사 진입로는 가을이면 단풍으로 벌겋게 달아올라 장관을 이룬다. 사찰 입구에 철당간지주, 부도, 동종 등 문화 자원이 많이 있다. 용추교에서 용문폭포 구간은 탐방로와 계곡이 인접해 있어 산행 시 즐거움을 더해 주고 있어 1일 산행코스로 가장 각광을 받고 있다.   하늘과 땅과 사람 가운데서 가장 으뜸가는 사찰, 갑사   노송과 느티나무 숲이 우거진 계룡산의 서북쪽 기슭에 위치한 절이다. 공주에서 19km 떨어져 있고, 동학사에서 도보로 3시간 정도면 갈수 있는 거리에 있다.춘마곡, 추갑사라는 말이 암시해주듯이 갑사의 가을 단풍은 더없이 아름답다. 삼국시대 초기 백제 구이신왕 원년(420)에 고구려에서 온 아도화상이 창건하였다. 갑사는 계룡갑사,갑사,갑사,갑사사, 계룡사 등으로 불리워 왔으며, 통일신라 화엄종 십대사찰의 하나였던 명찰이다."
충청남도 공주시 금벽로 990,(석장리동),34,0.0,A02,A0201,A02010700,127237,12,20020513090000,http://tong.visitkorea.or.kr/cms/resource/76/2439676_image2_1.jpg,http://tong.visitkorea.or.kr/cms/resource/76/2439676_image3_1.jpg,127.1894301333,36.4476510306,6,20220520101346,32271,1,,공주 석장리 유적,32591," 구석기 시대의 생활상을 만난다, 석장리 구석기유적지  공주 석장리 구석기 유적은 공주시로부터 직선거리 약 6㎞, 장기면 석장리의 금강 북안 하안단구에 위치한 우리나라 구석기시대의 대표적 유적지이다. 현재 사적으로 지정, 보호되고 있는 이 유적에 대한 조사는 1964년부터 1974년까지 10차에 걸쳐 연세대학교 박물관이 실시하였다. 그 결과 지층은 27개의 층위로 형성되어 있고 유물을 포함하고 있는 문화층도 11개 층위나 있다는 사실을 알게 되었다. 이후 1990년과 1993년에 다시 구체적 발굴조사가 실시되어, 보다 다양한 문화유적이 확인됨에 따라 이 유적의 분명한 성격이 확인되었다. 지질층은 강바닥, 강가, 비탈 쌓임층으로 나뉘며 아래 쌓임층들은 두 개의 다른 간빙기와 제4빙기에 쌓인 것으로 밝혀졌다. 강가 쌓임층의 맨 위층에서 나온 나무뿌리테가 따뜻한 기후에서 이루어진 것임을 알려주며, 나무숯은 방사선 연대로 5만 270년보다 앞서는 것으로 밝혀졌다. 또한, 비탈 쌓임층의 1호 집터에서 나온 화덕의 재는 2만 830년 전의 것임을 알려주었으며, 맨 밑의 강바닥층은 3050 만년 전으로 올라가는 것으로 추측되었다. 1214개의 문화층은 아래층으로부터 돌감(石材)과 석기 만드는 수법이 발달되어온 과정을 보여준다. 석기의 특징으로 볼 때 전기의 곧선사람들은 차돌과 편마암을 거칠게 떼어내 외날찍개, 안팎날찍개의 무거운 석기를 만들었고 중기의 슬기사람들은 이 밖에 반암도 떼어 좀 더 발달한 긁개, 찌르개, 자르개, 홈날, 톱날석기를 몸돌과 격지석기로 만들고 돌려때기 수법도 쓰게 되었다. 후기의 슬기슬기 사람들은 아주 발달한 간접떼기돌날떼기 수법을 썼으며, 돌날자르개, 돌날긁개, 돌날밀개, 돌날새기개 등을 만들어 세밀하고 정밀한 작업을 하게 되었다. 돌감도 흑요석과 수정을 멀리서 가져다 쓴 것을 알 수 있다.   구석기유적지를 통해본 구석기인의 생활상   구석기인들은 집을 짓고 불을 피우며 살았는데, 여름철에는 화덕을 집밖에 겨울철에는 집 안에 마련하였음을 알 수 있다. 집터 안에서 나온 머리털을 분석한 결과, 지금 인간의 머리카락과 같았음을 알게 되었고 땅바닥과 벽에 홈을 파서 새겨놓은 고래상과 돌을 떼어내 아가미, 눈, 비늘들을 새겨 만든 물고기상이 나왔다. 이들은 둥글납작한 자갈돌에 새기개 끝으로 선을 그어 그림을 그린 것을 통해 슬기슬기 사람들의 예술성을 볼 수 있다. 이 밖에도 모래돌을 여러차례 문지르고 그어서 불을 피우는데 썼던 돌도 나왔다. 이 위층에 중석기 시대의 얇은 층이 덮여 있는데 세석인, 세석인핵, 잔새기개, 잔글개들이 출토되어 중석기시대의 문화가 발달되었음을 보여주었다. "
충청남도 공주시 계룡면 신원사동길 1,(계룡면),34,0.0,A02,A0201,A02010900,127239,12,20020513090000,http://tong.visitkorea.or.kr/cms/resource/21/2518221_image2_1.jpg,http://tong.visitkorea.or.kr/cms/resource/21/2518221_image2_1.jpg,127.1839669782,36.3355276659,6,20220825125813,23171,1,,공주 계룡산 중악단,32619,"1394년(조선 태조 3년)에 창건한 신원사(新元寺)의 산신각이다. 산신은 원래 산하대지(山河大地)의 국토를 수호하는 신이며 산신제는 민족 정기의 고양과 모든 백성의 합일(合一) 및 번영을 기원하던 팔관회(八關會)를 후에 기우제, 산신제라 부르게 된 것이다.제단의 명칭은 계룡산신 제단이라는 뜻에서 계룡단(鷄龍壇)이라고 하였으나 고종 때 모향산과 지리산 산신각을 각각 상악단(上嶽壇)과 하악단(下嶽壇)이라 하고 두 산의 사이에 있는 계룡산 산신각을 중악단(中嶽壇)이라 한 것이다. 1651년(효종2년)에 철거되었다가 1879년(고종16년)에 명성황후가 다시 건립하여 오늘에 이르고 있다. 궁궐 양식을 그대로 축소하여 만든 건물의 안에는 산신도(山神圖)가 모셔져 있다. 산신제는 옛부터 내려온 산악신앙인 바, 현재 상악단과 하악단은 소실되었고 이 제단만 유일하게 남아있다.   백제 시절의 고찰, 신원사   신원사(新元寺)는 동학사 갑사와 함께 계룡산 3대 사찰로 공주시 계룡면 양화리에 소재한다. 이 절은 백제 의자왕 11년(651)에 보덕화상이란 고승이 창건하고 그 뒤에 여러번의 중창을 거쳐 1876년 보련화상이 고쳐 짓고 1946년 만허화상이 보수하여 오늘에 이르고 있다. 현재의 신원사는 임진왜란 때 소실된 후 현재의 위치로 옮긴 것으로 전해지며 원래의 건물지는 신원사와 중악단 남쪽에 전개된 넓은 밭으로 추정되고 있다. 이곳은 금당지를 중심으로 신원사의 원건물지가 있을 것으로 믿어지나 조사의 결여로 자세하지 않다. 그러나 이 금당지로 믿어지는 지역을 중심으로 오층의 석탑이 세워져 있어 이곳이 본래의 사역이었음을 쉽게 알게 한다. "
