addr1,addr2,areacode,booktour,cat1,cat2,cat3,contentid,contenttypeid,createdtime,firstimage,firstimage2,mapx,mapy,mlevel,modifiedtime,readcount,sigungucode,tel,title,zipcode,overview
충청남도 공주시 금성동,58,34,,A02,A0201,A02010700,2916020,12,20221123125802,http://tong.visitkorea.or.kr/cms/resource/15/2916015_image2_1.jpg,http://tong.visitkorea.or.kr/cms/resource/15/2916015_image3_1.jpg,127.1284823825,36.4639258691,6,20221123125819,1,1,,공산성연지,32555,"공산성연지는 충청남도 공주시 금성동에 있는 연못터다. 1982년 12월 31일 충청남도 기념물 제42호로 지정되었다. 영은사 앞에 있는 연못터에 단을 둔 석축을 정연하게 쌓았다. 백제시대부터 계속하여 이용되어 왔음을 시사하고 있는 이 연지는 산성의 구조를 연구하는 데 중요한 자료다. 백제문화를 둘러 보기 좋은 곳으로 공주IC에서 가깝고, 주변에 금강신관공원과 미르섬이 있다."
충청남도 공주시 고마나루길 30,,34,,A02,A0210,A02100700,2855106,12,20220919144108,,,127.1112645204,36.4625673887,6,20220919144133,0,1,,백제오감체험관,32535,"백제오감체험관은 곰과 인간에 얽힌 전설이 내려오는 유서 깊은 명승지인 고마나루 명승길에 자리하고 있다.
인근의 송산리고분군, 국립공주박물관에서 눈과 귀로 배운 역사를 손끝으 로 직접 체험할 수 있는 다양한 콘텐츠를 갖췄다.
지하 1층과 지상 1·2층에 8개의 테마관을 갖춘 이곳 체험관은 탁본문양체험, 야광스탬프 등 오감을 자극하는 체험형 놀이 및 게임 프로그램을 설계해 관람객이 자연스럽게 웅진백제 문화 와 역사를 배우고 즐길 수 있도록 했다. 주목할 만한 공간은 1층 로비에 자리한 공감의 창으로 소리와 터치로 색상이 변하는 2층 높이의 압도적인 규모의 패널이다. 이 패널에는 관람객이 체험 관에서 찍은 사진을 해시태그와 함께 SNS에 올린 콘텐츠를 화면으로 보여줘 모바일 세대의 관심이 높을 것으로 기대된다. 또 한 같은 층에 자리한 창조의 창에서는 백제시대 유물을 크레파스로 예쁘게 채색한 후 스캐너로 통해 그래픽 맵핑 영상으로 벽면에 띄울 수 있어 색다른 체험을 할 수 있다.

(공주 문화관광 홈페이지 발췌)"
충청남도 공주시 정안마곡사로 396 월산초등학교,소랭이 마을,34,,A02,A0203,A02030100,2827450,12,20220712112952,,,127.0835847656,36.6275535183,6,20220816150705,3,1,041-850-8250,소랭이마을,32510,"전국 최대의 밤꽃군락지이자 최고 품질의 밤을 생산하는 곳으로, 마을의 80가 산으로 이루어진 전형적인 농산촌으로 임야에는 빼곡히 밤나무가 심어져 있는데,
이 나무들이 바로 전국적인 명성을 얻고 있는 정안 밤을 생산한다.
폐교되었던 월산초등학교를 연수시설과 체험시설로 새생명을 불어넣어 새로운 도농교류의 중심센터로 발전을 꾀하여
동창회 모임등을 할 수 있는 공간과 추억을 떠올릴 수 있는 프로그램을 제공하고 있으며, 일반 농촌프로그램과는 차별화하여 운영하고 있다."
충청남도 공주시 유구읍 시장길 34-5,,34,0.0,A02,A0203,A02030600,2784730,12,20211201225253,http://tong.visitkorea.or.kr/cms/resource/42/2784842_image2_1.jpg,http://tong.visitkorea.or.kr/cms/resource/42/2784842_image2_1.jpg,126.9520152684,36.55349027,6,20221028101945,0,1,,유구벽화거리,32506,"유구벽화거리는 충남 공주시 유구읍에 자리 잡고 있다. 유구 전통시장과 맞닿아 있어 시장 구경을 겸해 둘러보기 좋다. 벽화거리는 1970년대부터 운영된 섬유공장을 중심으로 조성돼 있다. 공장 담장에는 베 짜는 할머니의 모습을 담은 벽화 등이 시선을 붙든다. 아울러 공주의 섬유산업을 엿볼 수 있는 독특한 벽화가 발길을 멈춰 세운다. 유구벽화거리는 유구IC에서 가깝다. 주변에는 유구 색동수국정원, 섬유 역사전시관이 있다."
충청남도 공주시 수원지공원길 74,(금학동),34,0.0,A01,A0101,A01010500,2770295,12,20211109014358,http://tong.visitkorea.or.kr/cms/resource/81/2771981_image2_1.jpg,http://tong.visitkorea.or.kr/cms/resource/81/2771981_image2_1.jpg,127.1238669409,36.4338570122,6,20221202162641,1,1,,금학생태공원,32602,"금학동주민센터 앞에 다다르면 생태공원을 알리는 곰 가족의 친근한 이정표가 보인다. 금학생태공원 주차장의 아래에는 습지가 조성되어 있고, 위에는 두 개의 수원지가 있다. 주차장에서 가까운 곳에 작은 야외무대가 있는데, 이곳에서는 다양한 문화 나눔이 이루어지고 있다. 전망대에 오르면 주미산을 조망할 수 있다. 금학생태공원에서 두리봉과 봉화대로 오르는 공주대간 트래킹 코스도 있다."
충청남도 공주시 백제큰길 2110-16,(웅진동),34,0.0,A02,A0202,A02020200,2756160,12,20211013192531,,,127.1117031619,36.4702609582,6,20221205111526,0,1,,곰나루국민관광단지,32535,"곰나루국민관광단지는 충남 공주시 웅진동에 자리 잡고 있다. 1987년 국민관광지로 지정됐다. 관광단지에는 충청남도 개도 100주년 웅비탑을 비롯해 어린이 놀이터, 산책로 등이 갖춰져 있다. 특히 매년 78월에 개장하는 어린이 수영장은 무료로 개방한다. 관광단지는 공주IC에서 가깝고, 주변에는 국립공주박물관, 공산성, 미르섬이 위치해 있다."
충청남도 공주시 금벽로 368,(신관동),34,0.0,A02,A0202,A02020700,2756156,12,20211013192312,,,127.1274545269,36.4702612354,6,20220411110422,0,1,,금강신관공원,32573,"금강신관공원은 충남 공주시 신관동에 자리 잡고 있다. 공원은 매년 개최되는 백제문화제의 중심지이기도 하다. 공원에는 3.7km의 산책로, 농구장 등 체육시설, 여러 가지 형태의 포토존이 갖춰져 있다. 더불어 1인용, 2인용, 4인용, 아동용 자전거를 빌릴 수 있는 자전거 대여소가 있어 자전거를 타며 즐기기 좋다. 공원은 공주IC와 가깝고, 주변에 미르섬, 공산성이 위치해 있다."
충남 공주시 반포면 마암리 산 4-4,,34,0.0,A01,A0101,A01010400,2755172,12,20211008222346,,,127.2209361575,36.4285676628,6,20211008222346,0,1,,청벽산,32620,"청벽산은 공주시 반포면과 세종시 도남리 사이에 있는 산으로 충남에서 금강의 가장 아름다운 일몰 모습을 볼 수 있는 곳이다. 여름이면 태양이 강 바로 위로 떨어지는 모습을 볼 수 있다. 조망이 탁 트이는 곳에 도착하면, 눈앞에 보이는 청벽대교와 그 아래를 굽이치듯 반짝이는 금강, 명덕산 너머로 지는 해를 볼 수 있다."
충청남도 공주시 계룡면 기산리,,34,0.0,A01,A0101,A01011800,2753914,12,20211006223245,,,127.1317537529,36.381529814,6,20221124164013,0,1,,기산저수지,,"기산저수지는 충남 공주시 계룡면에 자리 잡고 있다. 사방이 산으로 둘러싸여 있어 경관이 수려하다. 낚시객들 사이에서는 배스가 많기로 소문난 노지 낚시터다. 저수지에서 낚시 포인트를 찾기 위해 자동차를 운행하다 보면 간혹 교행이 불가능한 도로가 나오므로 주의해야 한다. 저수지는 남공주IC와 가깝다. 북쪽 방향으로 나가면 충청남도역사박물관을 비롯해 박찬호기념관, 공산성, 미르섬이 있다."
충청남도 공주시 대통1길 56-7,(반죽동),34,0.0,A02,A0203,A02030600,2751166,12,20210929185629,,,127.1229192668,36.453779712,6,20210929185629,0,1,,나태주 골목길,32546,나태주 골목길은 나태주 시인의 테마를 담은 시와 그림으로 마음의 선물을 선사하는 감성의 골목길이다. 그리고 넓게 펼쳐진 제민천을 건너 도심 속 자연과 여유로움을 느낄 수 있는 골목 정원도 조성되어 있다. 현실에 지친 마음에 도심 속 문화와 자연을 느끼며 여유를 담아 힐링하기 좋은 곳이다.
충청남도 공주시 무령로 201,(교동),34,0.0,A01,A0101,A01011800,2750146,12,20210928012611,,,127.1223609038,36.4567376964,6,20210928012611,0,1,,제민천,32542,제민천은 공주시 금학동에서 발원하여 금성동에서 금강으로 유입되고 도심지역을 가로지르는 하천이다. 현재는 생태하천 조성사업으로 산책로 및 실사타일 등 친환경적인 살아있는 생태하천으로 보호(복원)시키고 수변녹지 및 휴식공간을 확보하여 공주 시민들과 여행객들이 편안하게 쉴 수 있는 곳으로 인기가 많은 곳이다.
충청남도 공주시 우성면 한천리 75,,34,0.0,A01,A0101,A01011800,2738732,12,20210901215631,http://tong.visitkorea.or.kr/cms/resource/57/2740757_image2_1.jpg,http://tong.visitkorea.or.kr/cms/resource/57/2740757_image2_1.jpg,127.0876401253,36.518741085,6,20221013145439,0,1,,한천저수지,,"한천저수지는 공주 여행 시에 드라이브 삼아 잠시 들러 쉬어가기 좋은 곳이다. 자전거 레포츠를 즐기는 사람들도 한천저수지 앞에서 기념 사진을 남기기도 한다. 한국농어촌공사 충청남도본부 공주지사에서 관리하고 있는 한천저수지는 수심이 깊어 빙어가 서식하고 있으며, 인근에 공장이나 축산 농가도 거의 없어 오래 전부터 청정 저수지와 낚시터로 유명했다. 그러나 2021년 8월 현재 낚시 금지 구역으로 지정하기 위한 행정절차가 진행 중이다."
충청남도 공주시 의당면 의당로 216,,34,0.0,A02,A0202,A02020700,2736857,12,20210826235110,http://tong.visitkorea.or.kr/cms/resource/77/2737177_image2_1.jpg,http://tong.visitkorea.or.kr/cms/resource/77/2737177_image2_1.jpg,127.1345588717,36.4914589296,6,20220412152137,4,1,,메타세콰이어길,32589,의당면 청룡리 정안천 생태공원 일원에 조성된 메타세콰이어길은 2011년 조성됐다. 이후 많은 관광객이 방문하면서 공주 녹색 관광 명소로 자리 잡았다. 500m 구간에 심은 192그루의 메타세콰이어가 선사하는 풍경은 사계절 내내 방문객들의 사랑을 받는다.
충청남도 공주시 유구읍 창말길 44,,34,0.0,A01,A0101,A01010700,2736822,12,20210826233359,http://tong.visitkorea.or.kr/cms/resource/06/2737206_image2_1.jpg,http://tong.visitkorea.or.kr/cms/resource/06/2737206_image2_1.jpg,126.9562843028,36.554448568,6,20210903190834,0,1,,유구색동수국정원,32507,"유구천 1km 구간에 수국 약 22종, 16,000본을 심은 중부권 최대 수국 정원이다. 애나멜수국, 목수국 등 다양한 수국을 만나볼 수 있으며 포토존 곳곳에서 인생샷 촬영이 가능하다. 또한 능수벚나무, 작약, 수선화 등 계절 꽃이 4계절 내내 피어 있어 수국과 함께 관람이 가능하다. 수국은 꽃이 진 상태로도 아름다운 자태를 뽐낸다. 수국 절정기에는 각종 문화, 예술 공연과 버스킹을 정기적으로 진행한다. 수국정원에서 도보 3분 거리에 있는 유구전통시장은 연계 관광지로 삼기 좋다."
충청남도 공주시 정안면 인풍태성길 12,,34,0.0,A02,A0202,A02020600,2736764,12,20210826231218,http://tong.visitkorea.or.kr/cms/resource/98/2737198_image2_1.jpg,http://tong.visitkorea.or.kr/cms/resource/98/2737198_image2_1.jpg,127.1201394674,36.640194378,6,20211207222652,0,1,,노라쥬,32511,"80종 이상의 다양한 동물들이 있다. 숙련된 사육사의 통제에 따라 안전하게 동물 체험, 먹이 주기 체험을 할 수 있다. 동물들과 교감하며 학습까지 할 수 있는 일석이조의 동물원이다."
충청남도 공주시 반포면 동월1길 238,,34,0.0,A01,A0101,A01010900,2736734,12,20210826224305,http://tong.visitkorea.or.kr/cms/resource/72/2737172_image2_1.jpg,http://tong.visitkorea.or.kr/cms/resource/72/2737172_image2_1.jpg,127.2599767835,36.3376065453,6,20221026113602,2,1,,동월계곡,32626,"동월계곡은 매년 여름철이면 많은 사람이 찾는다. 공주에 사는 사람들은 물론, 인근 대전 지역에 사는 사람들도 많이 찾는다. 시원한 물에 발을 담그고만 있어도 한여름 무더위를 날릴 수 있기 때문이다."
충청남도 공주시 월미동길 219,(월미동),34,0.0,A02,A0202,A02020600,2736733,12,20210826224127,http://tong.visitkorea.or.kr/cms/resource/15/2737215_image2_1.jpg,http://tong.visitkorea.or.kr/cms/resource/15/2737215_image2_1.jpg,127.0989147707,36.4943774117,6,20221208173309,1,1,,로보카폴리안전체험공원,32528,"전국 최초 로보카 폴리 어린이 캐릭터를 활용한 안전체험공원이다. 2017년 3월 개원하여 유치원 및 초등학교 저학년을 대상으로 어린이 안전사고 유형을 교육할 수 있는 공간으로 조성하였다. 2021년 8월 현재, 약 40억 원의 공사비를 추가 투입하여 로보카 폴리 캐릭터별 놀이, 체험 시설을 추가하여 더욱 더 친근하게 안전의식을 체감할 수 있는 교육장으로 조성될 예정이다."
충청남도 공주시 유구읍 유구리 497-21,,34,0.0,A01,A0101,A01010500,2736665,12,20210826191914,http://tong.visitkorea.or.kr/cms/resource/86/2736786_image2_1.jpg,http://tong.visitkorea.or.kr/cms/resource/86/2736786_image2_1.jpg,126.9564482909,36.5502129466,6,20211105184004,0,1,,유구천핑크뮬리,32508,"유구천의 시원한 바람을 느낄 수 있는 데이트 명소이다. 수도권에서 1시간 거리인 곳에 친구, 가족과 함께 와서 일상의 지루함을 벗어나 잠시 쉬어갈 수 있는 공간이다. 핑크뮬리와 함께 코키아를 보며 어린이들과 자연을 느낄 수 있는 가족 친화적인 장소다. 찰랑거리는 가을 바람과 팔랑거리는 핑크뮬리에 근심 걱정을 실어 보낼 힐링 장소로 유명하다."
충청남도 공주시 금벽로 368,,34,0.0,A02,A0202,A02020700,2732468,12,20210810201950,,,127.1274545269,36.4702612354,6,20221212151017,0,1,,미르섬,32573,"미르섬은 다양하고 아름다운 꽃들이 펼쳐져있는 모습을 볼 수 있다. 코스모스부터 시작해 핑크뮬리, 댑싸리, 수크렁 등을 만나볼 수 있다. 가장 인기 많은 것은 핑크뮬리로 금강 주변을 따라 조성된 핑크뮬리 길이 있어 촬영장소로 좋다. 공주대교 방면으로 깊숙이 들어갈수록 아름다운 퐁경을 마주할 수 있다."
충청남도 공주시 성당길 6,(중동),34,0.0,A02,A0201,A02010900,2613461,12,20190729230510,,,127.1277076887,36.4551824131,6,20221027110152,0,1,,공주 중동성당,32562,"중동성당은 공주 지역 최초의 천주교 성당으로 1897년 설립됐다. 초대 신부로 프랑스 선교사 기낭이 부임했으며 1921년 제5대 주임으로 부임한 최종철 신부가 새 성당 건립을 계획해 1937년 현재의 모습을 갖췄다. 이후 강당 천사의 집, 새사제관과 수녀원을 완공했고, 1997년 설립 100주년을 기념해 성당 건물을 대대적으로 보수했으며 1998년 충청남도 기념물로 지정됐다.중동성당은 전통 목조 건축에서 현대건축으로 넘어가는 시기의 고딕양식의 건축물로 평가된다. 본당의 평면은 라틴 십자형, 건물 외관은 붉은 벽돌로 마감했다. 중앙 현관 꼭대기에는 높은 종탑이 있으며, 현관 출입구와 창의 윗부분은 뾰족한 아치로 장식돼 있다. 인근에 국고개 문화거리와 충남역사박물관 등 볼거리가 풍부해 당일치기 코스로 좋다."
충청남도 공주시 쪽지골길 18-13,(중학동),34,0.0,A02,A0201,A02010400,2613459,12,20190729224558,http://tong.visitkorea.or.kr/cms/resource/17/2393817_image2_1.jpg,http://tong.visitkorea.or.kr/cms/resource/17/2393817_image3_1.jpg,127.1264579543,36.449491377,6,20221214141802,0,1,,구 선교사가옥,32563,"공주 중학동에 자리한 구 선교사가옥은 미국 감리교회 소속 선교사 사택으로 건립됐다. 20세기 초부터 현재에 이르기까지 공주에서 선교사들이 선교 사업을 벌인 것은 물론이고 개교 100주년을 맞이한 영명학교가 교육을 시작한 상징적인 건물이기도 하다. 3층짜리 붉은 벽돌 건물로 계단실과 각층 공간이 스킵플로어 형식으로 연결돼 있다.구 선교사가옥은 등록문화재로 지정됐으며 공주 기독교 역사위원회에서 지정한 유관순의 길에 포함돼 있기도 하다. 열사가 다니던 영명학교, 태극기를 인쇄해 독립운동을 했던 공주제일감리교회를 방문하는 것은 독립운동가 유관순 열사의 발자취를 따라갈 수 있는 좋은 기회가 될 것이다."
충청남도 공주시 제민1길 18,(봉황동),34,0.0,A02,A0201,A02010900,2613458,12,20190729224016,http://tong.visitkorea.or.kr/cms/resource/07/2393807_image2_1.jpg,http://tong.visitkorea.or.kr/cms/resource/07/2393807_image3_1.jpg,127.1225249329,36.4509911363,6,20221110112002,2,1,,공주제일교회,32549,"공주제일교회는 1903년 미국 감리교 선교사인 맥길이 설립했다. 건물은 1931년 한국 초기 교회양식을 띠고 세워졌다. 한국전쟁 때 건물 상당 부분이 파손됐지만 신축을 하지 않고 복원함으로써 건립 당시의 시대상을 보여준다. 특히, 개축 당시의 종탑 일부의 타일 처리, 증축 당시 장식된 화가 이남규의 스테인드글라스 작품, 로마시대의 카타콤을 연상시키는 반지하층의 개인 기도실 등은 건축학적으로 중요한 가치가 있어 2011년 등록문화재로 지정됐다.공주제일교회는 충청 지역의 선교 거점이었으며 독립운동을 지원한 곳으로 유관순 열사와 조병옥 박사가 이 교회를 다녔다. 또한, 이곳은 교회의 역할뿐만 아니라, 학교, 병원, 유치원 등을 운영하며 근대화의 선구적 역할을 했다."
충청남도 공주시 반포면 왕흥장악로 837,,34,0.0,A02,A0203,A02030600,2613456,12,20190729223533,http://tong.visitkorea.or.kr/cms/resource/66/2393766_image2_1.jpg,http://tong.visitkorea.or.kr/cms/resource/66/2393766_image3_1.jpg,127.2021461657,36.4289311787,6,20220331131053,0,1,,금강아트센터,32620,"공주의 아름다운 자연경관과 함께 어우러진 금강아트센터는 갖가지 도자기 공예를 체험할 수 있는 곳이다. 이곳은 철화분청연구회가 도, 시비를 지원받아 2004년에 건립한 단아한 2층 건물로 다양한 전시가 열리는 금강갤러리, 도자기체험을 할 수 있는 도자기체험학습관, 작품을 만들어낼 수 있는 시스템을 갖춘 금강도예공방 등이 상시 운영돼 수준 높은 체험 교육을 경험할 수 있다.금강아트센터는 흙으로 직접 도자기를 만들어 문양을 넣거나 초벌 된 머그컵, 접시 등에 문양을 넣어 도자기를 직접 만들어 볼 수 있어 아이를 동반한 가족단위 관광객에게 인기다. 제작된 도자기는 유약을 바른 뒤 구워 본인에게 전달된다. 인근에 산림박물관, 계룡산, 갑사 등 공주의 명소가 인접해 있어 함께 방문하기 좋다."
충청남도 공주시 의당면 서당길 144-13,,34,0.0,A02,A0206,A02061400,2613455,12,20190729223141,http://tong.visitkorea.or.kr/cms/resource/31/2393731_image2_1.jpg,http://tong.visitkorea.or.kr/cms/resource/31/2393731_image3_1.jpg,127.1411398684,36.5559460907,6,20211119021556,0,1,,도령서당,32519,"공주시 의당면 깊은 산골짜기에 자리 잡은 도령서당은 서당교육을 통해 아이들에게 예절, 인성, 한문, 전통문화 등을 익히고 체험할 수 있게 하는 곳이다. 아빠와 함께 하는 한 예능 프로를 통해 널리 알려졌으며 특히 효와 예의를 익혀 웃어른을 공경하는 마음과 부모님에 대한 효심을 깨우치게 한다.도령서당에는 글공부, 예절교육, 다도예절, 한학교육, 서예쓰기 등 다양한 인성 예절 프로그램을 비롯해 텃밭 가꾸기, 벼 타작하기, 감자 캐기, 계절별 별자리 관찰 등으로 아이들이 자연과 하나가 될 수 있는 특별한 추억을 마련해준다."
충청남도 공주시 반포면 제석골길 67,,34,0.0,A02,A0201,A02010800,2551130,12,20180618223329,http://tong.visitkorea.or.kr/cms/resource/32/2551132_image2_1.bmp,http://tong.visitkorea.or.kr/cms/resource/32/2551132_image2_1.bmp,127.2474466119,36.3649865241,6,20220419153631,1103,1,,학림사(공주),32626,"학림사에는 물질문명을 극복하고 평화로운 세계 창조를 위한 유일한 대안으로 선(禪) 사상을 널리 펴고자 개원된 오등시민선원이 있다. 또한 백용성 스님의 선맥을 이은 윤고암 전 종정스님의 전법제자이신 학산 대원 조실스님이 주석하고 계신다. 대선지식이신 큰스님은 오로지 참선을 대중화, 생활화하고, 참선공부에 대한 정확한 지도와 점검 및 경책을 해주신다. 학림사의 뒷산은 계룡이 날개를 펴고 승천하는 듯하며, 좌측에는 장군봉, 임금봉이 위엄 있게 나란히 있다. 전면의 갑하산은 학이 나래를 펴고 학림사를 향하여 날아오는 듯하고, 동남간에는 연화봉이 솟아서 제석천왕이 연꽃을 바치는 형국이며, 남쪽에는 문필봉이 우백호를 맡고 있다. 좌측의 청룡계곡에는 사시사철 마르지 않는 청량옥수가 흐르고 어두운 밤에는 별빛이 총총한 곳으로 청정한 기운이 가득하여 템플스테이와 참선수행 도량으로는 모든 조건을 완비하고 있다."
충청남도 공주시 수원지공원길 222,(금학동),34,0.0,A02,A0203,A02030100,2524982,12,20170831090001,http://tong.visitkorea.or.kr/cms/resource/06/2690606_image2_1.jpg,http://tong.visitkorea.or.kr/cms/resource/06/2690606_image3_1.jpg,127.1193231588,36.4244107932,6,20220414151507,1579,1,,공주 산림휴양마을,32602,충청남도 공주시의 금학동과 주미동의 경계부에 있는 주미산에 위치한 공주산림휴양마을은 울창한 산림속에 다양한 산림휴양시설을 갖추고 자연속에서 여유로운 휴식을 취할 수 있는 장소로 숙박시설 및 숲체험 등 다양한 관광거리를 제공하고 있다.
충청남도 공주시 의당면 정안천자전거길 252,,34,0.0,A01,A0101,A01010500,2407328,12,20160902005740,,,127.1350532797,36.4911756373,6,20210727202843,3,1,,정안천생태공원,32589,"정안천생태공원은 공주의 신관동부터 강가에 조성된 자전거길, 걷기 길을 따라 정안천을 거슬러 오르면, 청안천 생태공원의 백미인 메타세콰이어길을 볼 수 있다. 또한 메타세콰이어길 아래로 펼쳐진 연지에 진흙을 뚫고 나온 연꽃들이 여름의 싱그러움을 느끼게 해주는 공원이다."
충청남도 공주시 백제큰길 2045,,34,0.0,A02,A0202,A02020700,2035859,12,20151028013737,http://tong.visitkorea.or.kr/cms/resource/38/1807738_image2_1.jpg,http://tong.visitkorea.or.kr/cms/resource/38/1807738_image3_1.jpg,127.1063453516,36.4687082638,6,20220923134942,4139,1,,고마나루,32535,"고마나루는 무성한 솔밭 금강 가에 위치하고 있는 옛 강나무 이름이자 공주시의 옛 지명이기도 하다. 공주시 웅진동 북쪽을 휘감아 도는 강나루의 솔밭, 연미산이 마주보이는 강 쪽으로 웅진수신지단이 마련되어 있다. 고마나루 솔밭 강변에 설치된 웅신단은 춘추의 제향뿐 아니라 중요한 행사가 있을 때도 고유제를 지내고 산천의 신령에게 가호를 기원했던 곳이었다."
충청남도 공주시 사곡면 마곡사로 1065,(사곡면),34,0.0,A02,A0206,A02060700,1966992,12,20141121192434,,,127.0101319181,36.5662981517,6,20220809111150,10692,1,,한국문화연수원,32520,한국문화연수원은 전통문화와 불교문화의 체험을 할 수 있는 교육연수시설이다. 심신을 편안하게 하는 자연속에서 전통문화체험을 통해 자신을 돌아보고 휴식과 여유를 느낄 수 있는 기회를 제공한다.
충청남도 공주시 중동골길 54-12,(상왕동),34,0.0,A02,A0201,A02010700,1956390,12,20141015223714,,,127.1696348098,36.4430734285,6,20220826142128,2505,1,,용문서원,32597,"1663년(현종 4) 이유태(李惟泰)가 중동(지금의 상왕동)으로 이주한 뒤 후학을 양성하기 위하여 사송서재(四松書齋)와 함께 세운 사립교육기관으로서 이곳에서 수백 명의 문인(門人)을 육성하였다고 한다. 원래 명칭은 용문서재(龍門書齋)이며, 지금의 용문서원은 1977년 국가의 지원을 받아 고택(古宅)과 함께 복원한 것이다. 사우 6칸, 신문 1칸, 좌우 협문 각 1칸, 장서각 6칸, 동재 6칸, 유물 전시관 8 칸, 강당 8칸, 고사 1칸, 대문 3칸 등으로 이루어져 있다. 용문서원을 중심으로 왼쪽에 고택이 있고, 오른쪽에는 용문서원의 전통을 잇기 위하여 부설로 세운 공주전통문화교육원이 있다. 사단법인 이초려기념사업회(초려는 이유태의 호) 소유이며, 이유태의 문중인 경주이씨 문헌공파 종가에서 관리한다."
