addr1,addr2,areacode,booktour,cat1,cat2,cat3,contentid,contenttypeid,createdtime,firstimage,firstimage2,mapx,mapy,mlevel,modifiedtime,readcount,sigungucode,tel,title,zipcode,overview
충청남도 공주시 공산성길 59-22,(금성동),34,0.0,A02,A0201,A02010800,129574,12,20070702090000,http://tong.visitkorea.or.kr/cms/resource/77/216677_image2_1.jpg,http://tong.visitkorea.or.kr/cms/resource/77/216677_image3_1.jpg,127.1282324252,36.4632009477,6,20211014020405,21047,1,,영은사(공주),32555,"19세기에 편찬된 《공산지(公山誌)에 따르면 백제시대에 창건되었다고 한다. 그러나 절 주변에 흩어져 있는 석탑 재료가 고려 초기의 유물이므로 그때 창건되었을 것으로 추정된다. 또 일설에는 1458년(조선 세조 4) 세조의 명으로 창건되었다고도 한다. 세조 때에는 묘은사(妙隱寺)라고 하였다.1592년(선조 25) 임진왜란이 일어나자 승병들이 모여 훈련을 받고 승병장 영규(靈圭)의 지휘 아래 금산전투에 참여하였다. 1616년(광해군 8) 이 절에 승병장을 두고 도내 사찰을 관리하게 하였다. 특히 1624년(인조 2) 이괄(李适)이 난을 일으켰을 때 인조가 이 절로 피난을 오기도 하였다. 이때 절 이름을 영은사로 고쳤으며, 인조가 이 절이 국방의 요지임을 깨닫고 승병을 계속 주둔하게 함으로써 호서의 대표적 호국사찰이 되었다.건물로 원통보전과 관일루(觀日樓) 등이 있다. 이중 원통보전은 충청남도문화재자료 제51호로 지정된 전각이다. 정면 3칸, 측면 2칸의 맞배지붕 건물로 내부에 관세음보살좌상이 봉안되어 있다. 불상 뒤에는 후불탱화와 칠성탱화·신중탱화·산신탱화·독성탱화가 걸려 있다. 이중 후불탱화는 1888년(고종 25) 약효(若效)가 그린 것이고, 나머지는 최근 제작된 것이다. 관일루는 ㄷ자형 맞배지붕 건물로, 임진왜란 당시 승병들의 합숙소로 쓰이던 건물이다. 여러 차례 보수를 거쳐 옛 모습을 찾아보기가 어렵다.  유물로 1715년(숙종 41) 서산의 문수사(文殊寺)에서 제작된 동종이 전해진다. 경내에는 석탑 부재와 초석·장대석 등이 남아 있다.이중 석탑 부재는 옥개석으로 가로 80cm, 세로 80cm, 높이 21cm 규모이며, 우물의 뚜껑으로 사용되고 있다. 장대석은 요사 기단부와 관일루 기단부, 원통보전 계단 등에 끼어 있다."
충청남도 공주시 백제큰길 2104,(웅진동),34,0.0,A02,A0205,A02050200,129575,12,20070702090000,http://tong.visitkorea.or.kr/cms/resource/78/216678_image2_1.jpg,http://tong.visitkorea.or.kr/cms/resource/78/216678_image3_1.jpg,127.1108032291,36.4707858821,6,20210914201109,20321,1,,웅비탑,32535," 도민의 염원이 담긴 탑 웅비탑   충남의 역사, 문화를 바탕으로 충남, 새로운  출발을 조형적으로 표현한 이 탑은 충청남도 개도100주년을 기념하고, 밝고 희망찬  21세기를 향하여 웅비하려는 도민의 염원을 담도록 상징화하여 건립하였다. 조형물의  구성은 탑신부,기단부, 조각상으로 분할 합성하였다.   탑신부의 구조  좌우대칭형 주 조형물  백제의 치미, 당간지주의  이미지합성  탑신상단  발전하는 16개시군, 출장소를 봉황의  날개와 태양의 빛으로 형상화  벽면 산경문양  백제인의 예술성을 현대적으로  감각화  전면 중앙  개도 100주년 로고, 무령왕의 왕관장식  배치    기단부의 구조  20세기의 디딤돌 위에 웅비탑 본신이 자리하도록  20계단 설치  지하에 100주년을 기념하여 100평 규모의 다용도  공간 마련  중심기둥에 무령왕비 관식 부조 음각   조각상의 구조  인물군상  새로운 충남인의 상 을 형상화  좌우 백제금동대향로  충남인의 염원이 하늘에  닿음을 상징  후면 백제문화형상물  뛰어난 백제문화를 청동조각으로  이미지화"
충청남도 공주시 계룡면 갑사로 567-3,,34,0.0,A02,A0201,A02010800,129557,12,20070518090000,http://tong.visitkorea.or.kr/cms/resource/13/2518213_image2_1.jpg,http://tong.visitkorea.or.kr/cms/resource/13/2518213_image2_1.jpg,127.1873630896,36.3655131816,6,20220906105216,20365,1,,공주 갑사 철당간,32615,"보물인 갑사 철당간·지주는 당을 다는 철깃대와 기둥이다. 당간은 절 앞에 세우는 깃대인데 부처나 보살의 위신과 공덕을 표시하고 사악한 것을 내쫓는 기능을 가진 당이라는 깃발을 달기 위한 깃대이며, 당간지주는 당간을 좌우에서 지탱하기 위한 버팀 기둥을 말한다. 갑사 철당간은 지름 50센티미터의 철통 24개를 이어 놓은 것으로 당간의 높이는 약 15미터이다. 그러나 1893년에 4개의 철통이 부러져 처음보다 낮아졌다.이 철당간·지주가 만들어진 시기는 갑사가 신라 의상대사가 일으킨 화엄종 10대 사찰 중 하나였다는 점과 받침돌 측면에 새겨진 안상조각으로 미루어 통일신라 시대로 추정된다. 갑사의 철당간 지주는 온전한 모습으로 남아 있어 당간 형태를 연구하는데 귀중한 자료가 되고 있다.  노송과 느티나무 숲이 우거진 계룡산의 서북쪽 기슭에 위치한 절이다. 공주에서 19km 떨어져 있고, 동학사에서 도보로 3시간 정도면 갈수 있는 거리에 있다.춘마곡, 추갑사라는 말이 암시해주듯이 갑사의 가을 단풍은 더없이 아름답다. 삼국시대 초기 백제 구이신왕 원년(420)에 고구려에서 온 아도화상이 창건하였다. 갑사는 계룡갑사,갑사,갑사,갑사사, 계룡사 등으로 불리워 왔으며, 통일신라 화엄종 십대사찰의 하나였던 명찰이다."
충청남도 공주시 반포면,,34,0.0,A01,A0101,A01010900,129558,12,20070518090000,http://tong.visitkorea.or.kr/cms/resource/10/490310_image2_1.jpg,http://tong.visitkorea.or.kr/cms/resource/10/490310_image3_1.jpg,127.2254377646,36.3541012703,6,20220310161225,35878,1,,동학사계곡,32626,"동학사계곡의 야생화는 동학사계곡의 신록이라하여, 계룡팔경(제5경)에 포함된다.  학바위 앞에서 관음봉고개에 이르기까지 약 3.5km의  동학사계곡은 언제나 푸른숲에 둘러싸여 맑은 물소리, 새소리가 청량하다. 계곡의 입구 노거수속을 신선처럼 걷노라면 비구니의 강원이 있는 동학사에 이르고, 바로 그 아래 신라의 시조와 충신 박재상을 모신 삼은각 숙모전이 자리하고 있다. 동학사 앞에서 눈을 높이면, 저 멀리 쌀개능선과  서북능선이 시계에 다가서며,계곡을 1.5km쯤 거슬러 오르면 산수의 조화미를 자랑하는  은선폭포에 이른다. 은선폭포를 지나, 관음봉까지 다소 가파르나, 잡목으로 우거진  숲속의 삼림욕이 상쾌하다. 동학사의 계곡은 항상 아름다우나, 신록이 피어나는 봄의  계곡이 으뜸이며, 예로부터 춘 동학, 추 갑사로 널리 알려져 있어, 계룡산의 제5경으로  일컫는다.  동학사는 공주에서 약 25km, 대전에서 8km정도 떨어진  반포면 학봉리에 자리잡고 있다. 계룡산 동쪽 골짜기에 싸여 있는 천년고찰 '동학사'는  우리나라에서 가장 오래된 최초의 비구니 강원(일명:승가대학)으로서,150 여명의  비구니 스님들이 부처님의 일대시교 및 수행과 포교에 필요한 제반교육을 받으며  정진하고 있는 유서깊은 도량이다. 또한, 동학사는 문필봉(文筆峰)이 있어서 대 강  백들이 많이 배출된 곳으로도 유명하며 비구니 스님들의 경 읽는 소리는 맑은 계곡에  흐르는 물소리와 하나로 어우러져 고즈넉한 산사에 그 청아함을 더해준다. 주변에는  많은 볼거리가 있고 교통이 편리해 계룡산의 관광지 중에서도 가장 많은 사람들이  찾아온다. 특히 박정자삼거리에서 동학사에 이르는 약 3km 거리의 가로수는 벚나무로  이루어져 봄이면 벚꽃터널이 장관을 이룬다. 1993년부터 매년 동학사 봄꽃축제가 개최된다."
충청남도 공주시 신풍면 원골예술길 94,,34,0.0,A02,A0203,A02030100,129345,12,20061108090000,http://tong.visitkorea.or.kr/cms/resource/21/1961121_image2_1.jpg,http://tong.visitkorea.or.kr/cms/resource/21/1961121_image3_1.jpg,126.9616067637,36.5277683917,6,20220617154422,18051,1,,공주 원골마을,32525,"마을에 원님이 사셨다하여 원골마을이라 불리는데,동네 가운데 있는 탑 위에 금새 금으로 된 새가 있었는데 그 앉아 있던 금새가 날아가고 난 뒤에 원님은 죽었다는 전설이 있다. 32번 국도에서 바라보는 원골마을 전면에는 경지정리가 잘된 논이 좌우로 펼쳐지며, 大자궁형의 형태로 포근한 마을임을 한눈에 볼 수 있으며, 마을 앞뒤로 서 있는 정주(느티나무)가 걸작이며, 교통편으로는 공주에서 25km지점에 유구읍까지는 3km지점에 위치한다. 마을에는 가장 웅장하고 아름다운 나무라고 하는 정주나무가 마을을 300년 넘게 지켜주고 있으며, 마을곳곳의 예술작품들이 여러분의 눈을 즐겁게 해 준다. 또한, 다른 농촌마을처럼 사계절 내내 즐기실 수 있는 농사체험, 여름이면 시원하게 보낼 수 있는 물놀이장, 우리 마을에서 재배한 정겨운 시골밥상을 즐길 수 있을 뿐만 아니라, 마을의 남다른 예술 사랑을 느낄 수 있다. 원골마을에서는 예즉농 농즉예 즉 농사가 예술이고, 예술이 농사라는 말이 있을 젇로 마을 주민들 모두 예술에 대한 사랑이 남다르며, 예술과 마을이라는 예술제""를 벌써 9년째 마을민들이 주체가 되어서 개최하고 있다."
충청남도 공주시 금학동,,34,0.0,A02,A0201,A02010700,128113,12,20040419090000,,,127.1122013476,36.4328569221,6,20220615160918,19009,1,,공주 우금치 전적,32602,"우금치 전적지는 공주시 금학동, 공주에서 부여로 넘어가는 길목인 견준산 기슭 우금치 일대로 제2차 동학농민전쟁의 최후 격전지이다. 이곳에는 1973년 동학혁명군 위령탑 건립위원회에서 동학혁명군 전적비를 세워 당시를 기리고 있다. 전봉준이 지휘하는 농민군은 1894년 9월 재봉기 이후, 논산에 머물며 공주를 첫번째 주요 공격 목표로 설정하는 작전을 세웠다. 당시의 공주는 충청도 감영이 소재하는 중부 지역의 거점으로서 전략상 공주를 확보하는 것은 향후 전쟁의 승패를 가름하는 중요한 관건이 되었다. 또 우금치는 공주의 치소에서 부여 방면으로 넘어가는 높은 고개이며, 일단 우금치를 장악하면 공주 점령의 기선을 잡을 수 있는 중요한 곳이다. 약 3만을 헤아린 농민군은 일본군 200명을 포함한 약 2,500명의 관군과 1894년 10월 23일부터 이인, 효포, 웅치에서의 싸움에 이어 11월 8일 드디어 우금치에서 결전을 벌이게 되었다.그러나 수적으로 우세한 농민군은 고개 위로 진격하다가 연합군의 일제 사격에 겹겹이 쓰러져, 고개로의 진격 후퇴를 무려 4050차례를 거듭한 끝에 거의 전멸하였다. 이 날 우금치 전투에 대해서 전봉준도 ""2차 접전 후 1만여 명의 군병을 점고하니 남은 자는 3천 여명을 넘지 않았으며, 그 후 다시 2차로 접전한 후 점고하니 5백여명을 넘지 아니하였다."" 하여 장렬한 싸움이었음을 회상하였다. 이 싸움 후, 재기를 노린 전봉준은 체포되어 이듬해 3월 처형됨으로써 1년 동안 전개된 동학농민운동은 실패로 끝났다."
충청남도 공주시 관광단지길 30-8,,34,0.0,A02,A0201,A02010100,128115,12,20040419090000,http://tong.visitkorea.or.kr/cms/resource/89/216689_image2_1.jpg,http://tong.visitkorea.or.kr/cms/resource/89/216689_image3_1.jpg,127.1097229,36.4659891914,6,20220526134110,22013,1,,선화당(공주),32535," 관찰사의 행정청, 선화당  
선화당은 충청도 관찰사의 행정청으로 사용되었던 건물이다. 처음에는 감영지에 자리하였는데 국립공주박물관 안으로 옮겼다가 최근 다시 공주 웅진동으로 옮겨와 복원하였다. 충청도 관찰사는 처음 충청북도 충주에 있다가 1598년(선조 31)에 공주로 옮겼는데, 1646년(인조 24)에 큰 장마로 인하여 선화당이 떠내려 가서 금성동 성안으로 옮겼다가 1653년(효종 4)에 당시의 관찰사 강상연이 반죽동 공주사대 부속고등학교 자리로 옮겼으며, 1910년 국치를 당한 후 충청남도청이 되어 오다가 1931년에 도청을 대전으로 옮겨가고, 건물은 1938년 중동으로 그대로 이전하여 국립공주박물관 진열실로 이용되어 왔었다. 건물은 정면 8칸 측면 4칸의 평면으로 이루어져 있는데 이는 초창의 건물이 정면 9칸이었던 것을 이전 복원하면서 원형이 변경되어 정면 8칸으로 변화되었다. 건물의 내부는 통칸으로 넓은 공간을 두었고 기둥은 내진칸을 두도록 배치하면서 주위에 외진 칸을 만들어 퇴칸 형식을 취하고 있다. 공포는 무출목 이익공 계통으로 시설하였고, 창방이 있는 주칸에는 운공이 있는 화반을 3구씩 배치하여 장설을 받쳐 주어 관아 건축의 장엄을 유지하고 있다 (문화재지정일 : 1980. 12. 29). 건물의 내부는 통칸으로 넓은 공간을 두었고,기둥은 내진주를 두면서 주위에 외진주를 두어 퇴칸 형식을 취하고 있다. 공포는 무출목 이익공계통으로 시설하였고,창방이 있는 주칸에는 운공이 있는 화반을 3구씩 배치하여, 장설을 받쳐 주어 관아 건축의 장엄을 유지하고 있다.  
 충남 감영   
고려대부터 공주목이 설치된 이후 지방행정 중심지로서 그 이전시기 (삼국,통일신라)의 웅주, 능천 도호부를 이어받은 공주 건치가 비롯되었다. 조선시대에 들어 정삼품의 공주목사는 세조때 시행된 진관체계 수립에 따른 첨절제사를 겸하게 되고, 예하의2군(임천한산), 10현을 통치하게 되었다. 따라서 공주목관아는 동헌을 비롯한 정청들과 중앙기관인 객사 외에 진관에 소속된 여러 건물과 창고건물들이 지금의 공주시 중동 도립병원 주변 일대에 산재해 있었다. 여지도서에 나타난 공주목소속공해는 객사32간(웅주지관), 아사 26간(혜의당), 향소청, 향사당 13간, 군관청7간, 작청10간, 진무청7간, 지인방 3간, 우영15간, 토포군관청 8간, 기청 9간, 작청6간이었다. 창고시설로는 대동고 20간, 보역고5간, 관청고 6간이 주내에 있었고, 사창 16간이 산성내에 그리고 동· 서· 남· 북·유창이 주외현에 배치되었다. 공주목 동헌 건물이 도립병원 건립 당시 대책없이 철거되어 후일(1980년대 중반) 금성동 산기슭 (황새바위 밑)에 복원되었는데, 또다시 요실됨으로서 곰나루변「문화단지」선화당 앞마당에 새롭게 이전되었다. 
 포정사문루 
포정사는 공주 감영에 부속되었던 건물로 감영이 철회되면서 구 공주군청 곁으로 이건하였다. 한동안 공주제일감리교회로 사용되다가, 다시 군보건소로 이용하였다. 그 후, 1980년대에 교동으로 옮겨 중수하였으나 1985년 화재로 전소하였다. 지금은 무령왕릉과 금강사이의 곰나루에 위치하고 있다. 건물은 정면5칸, 측면2칸의 익공식팔작지붕이다. 
 동헌 
장대석 두벌대로 기단을 쌓은 위에 각 초석에 각주를 세워 정면 8칸, 측면 4칸의 평면을 보성했다. 8.2척 주간으로 등간격을 준 7칸 내진의 전후로 반간퇴마루를 돌리고 동측면에도 같은 퇴간을 둠으로서 정면 8간이 되었다. 전퇴 부분은 창호없이 개방되고 안쪽 중앙3칸은 우물 마루깔은 대청 우측편은 온돌방 2칸이다. 중앙 대청 우측의 2칸은 마루바닥이나 4面창호 구획되고 대청을 중심한 양옆 측변면도 모두 4분합으로 접어서 들어 열 수 있는 구조이다. 납도리, 홑처마로 2고주 2중량 7가연의 단출한 목조 팔작 지붕집이다. 선화당과 포정사등 감영건물에 비해서는 너무나 섬약한 용재쓰임 등 단조로운 관어건물이다. 정삼품 관원이 주재하는 공주목의 치호 품계로 보아서는 동헌 건물이 너무 왜소할뿐 아니라 각주, 무익공, 납도리,처마등이 평범한 전각구조와 다를 바 없어 동헌 중심건물 로서의 위풍이 없는 듯 느껴졌으나 감영(관찰사영)앞에 존재하는 겸양함이 발휘된 것으로 사려된다. 
 금영측우기(錦營測雨器) 
1) 국보 
2) 제작연대  조선 헌종 3년(1837) 빗물을 그릇에 받아 강우량을 재는 측우기는 조선 세종 23년 (1441)에 만들어진 후 여러 차례 다시 만들어졌으나, 현재 남아 있는 것은 헌종 3년(1837)에 만들어진 금영측우기가 유일하다. 높이 31.5㎝, 지름 29.4㎝의 이 측우기는 원통형의 표면 3곳에 대나무처럼 도드라진 마디가 눈에 띤다. 동그란 통은 빗물을 받는 그릇으로 여기에 주척(周尺)이라 부르는 자가 있어 측우기에 고인 빗물의 깊이를 쟀다. 화강석 받침에 새겨진 글에는 조선 영조 46년(1770)에 만들었다는 기록이 있지만, 이 받침대는 원래 대구에 있던 것으로 측우대와는 별도의 것이다. 금영측우기는 1910년 당시 공주감영에 있던 것으로, 그 뒤 주척과 함께 일본 기상청으로 옮겨졌다가,1971년 3월에 반환되어 지금은 기상청에 보관되어 있다. 2006년 5월 금영측우기가 본래 있었던 공주에 금형측우기 모형을 제작하여 여기에 설치하였다. 2020년 2월 27일 국보로 지정되었다. 
 금영(錦營)  조선시대 충청도감영(忠淸道監營)을 달리 이르던 말"
충청남도 공주시 반포면 동학사1로 327-6,,34,1.0,A01,A0101,A01010100,125817,12,20040217090000,http://tong.visitkorea.or.kr/cms/resource/77/1600077_image2_1.jpg,http://tong.visitkorea.or.kr/cms/resource/77/1600077_image3_1.jpg,127.2324620609,36.356873299,6,20220519141253,79887,1,,계룡산국립공원,32626," 동학사와 갑사로 유명한, 계룡산국립공원   1968년 12월 31일에 국립공원으로 지정된 계룡산은  대전광역시, 공주시, 논산시에 걸쳐있는 충남 제일의 명산이다. 차령산맥과 노령산맥  사이에 이룩된 산지로 능선이 닭의 볏을 머리에 쓴 용의 모습과 닮았다고 하여 계룡이라는  이름이 붙여지게 되었으며, 풍수지리에서도 명산이며, 무속신앙과 관계깊은 신비스러운  산이다. 주봉인 천황봉 (845.1M)을 비롯하여 삼불봉, 연천봉, 관음봉 등 열댓개의  봉우리, 기암괴석과 서쪽에 용문폭포, 동쪽에 은선폭포, 남쪽에 암용추, 숫용추폭포를  어우르고 있는 명산명소이다. 봄에는 동학사 진입로변의 벚꽃터널, 여름에는 동학사  계곡의 신록, 가을에는 갑사와 용문폭포 주위의 단풍, 겨울에는 삼불봉과 자연성능의  설경이 장관을 이룬다. 계룡산에는 유서 깊은 절과 전설이 담긴 유적들이 도처에  많다. 동쪽의 동학사, 서북쪽의 갑사, 서남쪽에 신원사, 동남쪽에 용화사가 있고  갑사삼신괘불탱 등 국보 2점, 쇠로 된 당간과 당간지주 등 보물 7점과 신원사 오층석탑  등 지방문화재 9점이 있다."
충청남도 공주시 반포면,,34,0.0,A02,A0201,A02010800,126990,12,20040114090000,,,127.2180070562,36.3844532202,6,20220616174852,21623,1,,공주상신리 당간지주,32625," 공주 상신리 당간지주   공주시 반포면 상신리의 구룡사지 입구에 위치하고 있는 당간지주로, 유형문화재이다. 구룡사지에 위치하여 구룡사지 당간지주라고 불리기도 한다. 마을 입구의 민가 뒷돌담에 있는 당간지주로, 원래부터 이 자리에 있던 것으로 추정된다. 현재 당간은 없고 지주만 남아 있는데 전체적으로 상태가 좋지 않으며 1주는 절단되어 떨어져 있고 서 있는 1주도 파손 정도가 심하다. 지주 아래에는 여러 개의 돌로 조립한 기단이 있고 지주의 안쪽 상단에 직사각형의 간구(竿構)가 있고 하부에는 당간이 놓였던 자리가 둥글게 부조되어 있다.전체 높이는 360cm로 화강석으로 조성하였는데 기단면에는 장방형으로 구획한 내구에 연화문이 장식되었고 지주 사이에는 원형의 철통을 세웠던 간좌석이 남아있다. 전체적으로 상태는 양호하지 않다. 2개의 지주 중에 하나는 절단되어 떨어져 있고 남아있는 하나도 파손이 있다. 지주는 수매로 조립된 기단 위에 세워져 내면 상단과 하부에 장방형의 횡착공이 있다. 지주의 양쪽면은 윤곽선을 음각하였고, 지주의 뒷면 중앙에는 융기된 돌대가 음각되어 있기도 하다. 이 당간지주는 백제 말기나 통일신라 초에 세워졌을 것으로 추정되는 구룡사지 입구에 위치한 것으로 추측되므로 당간지주만 볼 게 아니라 마을과 마을 뒷편을 돌아다니며 옛 절터의 흔적을 더듬어보는 것도 좋을 것이다.   당간지주란   기도나 법회 등 절에 행사가 있을 때 사찰의 입구에 세워 부처와 보살의 성덕을 표시하는 기를 당(幢)이라 하며, 이를 달아매는 장대를 당간(幢竿)이라 하고, 이 장대를 양옆에서 지탱하는 두 돌기둥을 당간지주라 한다."
