addr1,addr2,areacode,booktour,cat1,cat2,cat3,contentid,contenttypeid,createdtime,firstimage,firstimage2,mapx,mapy,mlevel,modifiedtime,readcount,sigungucode,tel,title,zipcode,overview
경북 경산시 하양읍 부호리 592-6,,35,0,A01,A0101,A01010500,2782874,12,20211129232227,http://tong.visitkorea.or.kr/cms/resource/70/2795270_image2_1.jpg,http://tong.visitkorea.or.kr/cms/resource/70/2795270_image2_1.jpg,128.7985523267,35.8985510708,6,20221130105016,0,1,,대부잠수교해바라기밭,38428.0,"경산 하양 환상리 묘목단지와 하양 대경로를 잇는 지름길 역할을 하는 대부잠수교는 교량 높이가 낮아 금호강 수위가 상승하면 물에 잠긴다고 해서 잠수교라는 이름이 붙었다. 해바라기밭은 대부 잠수교 둔치 근방에 있는 꽃밭으로, 봄에는 유채꽃, 여름이면 해바라기, 가을이면 코스모스가 피는 꽃놀이 명소이다. 대부 잠수교 둔치 앞 주차 공간에 주차할 수 있다. 몇 년 전부터 시민들을 위해 계절마다 꽃을 심기 시작해 이제는 아름다운 장관을 연출하는 장소가 되어 많은 사람이 찾는다.  넓은 부지 안에 가득 핀 꽃과 함께 인생 최고의 장면을 찍을 수 있는 사진 명소이기도 하다."
경상북도 경산시 계양동,,35,0,A01,A0101,A01011800,2780010,12,20211125234847,http://tong.visitkorea.or.kr/cms/resource/52/2795252_image2_1.jpg,http://tong.visitkorea.or.kr/cms/resource/52/2795252_image2_1.jpg,128.7467256176,35.8248417799,6,20221125101321,0,1,,남매지,,"경상북도 경산 시내에 자리한 저수지이다. 남매지라는 이름에 얽힌 슬픈 이야기가 전해져 오고 있는데 조선시대 때 부모를 잃은 가난한 오누이가 있었다고 한다, 아버지의 빚을 갚기 위해 오빠가 한양으로 떠난 사이 여동생은 심보 고약한 빚쟁이의 첩이 되고 말았다. 자신의 처지를 비관한 여동생이 저수지에 몸을 던졌고, 이 소식을 들은 오빠도 함께 자결하면서 이들 오누이가 목숨을 잃은 저수지 이름이 남매지가 되었다고 한다. 비극적인 전설과 달리 지금의 남매지는 경산 시민들이 즐겨 찾는 휴식처이자 도심 야경 명소로 사랑받는 데이트 코스가 되고 있다. 다. 매일 저녁 7시가 되면 저수지의 동쪽과 서쪽을 잇는 가교에 알록달록한 조명이 켜지는데, 저수지 둘레를 따라 가로등까지 불을 밝히며 화려하게 변신한다.  저수지를 따라 산책 삼아 걷기 좋다"
경상북도 경산시 하양읍 대조리,,35,0,A01,A0101,A01010500,2780006,12,20211125234659,http://tong.visitkorea.or.kr/cms/resource/20/2796620_image2_1.jpg,http://tong.visitkorea.or.kr/cms/resource/20/2796620_image2_1.jpg,128.7985248157,35.8891438017,6,20221125104747,1,1,,대부잠수교,,"대구에서 경산으로 들어가는 길목에 자리한 대부 잠수교는 계절의 정취를 만끽할 수 있는 산책코스가 잘 가꿔져 있어 인기다. 넓게 펼쳐진 공간에 4월 초까지는 파릇파릇한 보리 새싹들이 보는 이들의 마음을 설레게 하고, 5월 말이 되면 싱그러운 청보리가 반갑게 맞아준다. 강변을 타고 부는 바람과 청보리가 부딪히며 화음을 이루는 자연의 소리도 귀는 물론 마음까지 맑아진다. 여름이 되면 대부 잠수교는 다시 황금빛 해바라기가 물결을 이룬다. 고흐의 그림을 연상시키는 낭만적인 해바라기 옆으로는 화려한 꽃 칸나 가 붉은 열정을 자랑하며 끝없이 펼쳐진다. 단, 햇빛을 피할 수 있는 공간이 따로 마련되어 있지 않아, 오전에 방문하거나 양산과 모자를 미리 챙기는 것이 좋다. 가을에는 알록달록 코스모스가 시민들의 발길을 멈추게 한다. 산책과 휴식 그리고 인생 샷을 남길 수 있는 곳으로 유명하다"
경북 경산시 중산동 674,,35,0,A02,A0202,A02020600,2773390,12,20211111193855,,,128.7151810522,35.8290629402,6,20211118013607,0,1,,중산지,,"중산지는 경상북도 경산시 중산동 중산 제1 근린공원과 맞닿아 있다. 산책로는 모두 이어져 있고 중산지 진입 광장엔 간단한 운동기구들이 설치돼 있다. 공원에는 잘 정비된 산책로를 비롯해 정자, 쉼터 등이 마련돼 있어 어디서든 손쉽게 중산지의 경치를 감상할 수 있다. 긴 미끄럼틀을 포함해 아이들의 놀이 시설도 갖추어져 있다. 야경 명소로도 유명한 중산지는 분수 공연 때 점등되는 형형색색의 조명이 주변 아파트의 불빛과 어우러져 멋진 풍경을 연출한다."
경상북도 경산시 와촌면 팔공로 237-14,,35,0,A02,A0202,A02020300,2766542,12,20211102214645,http://tong.visitkorea.or.kr/cms/resource/63/2766863_image2_1.jpg,http://tong.visitkorea.or.kr/cms/resource/63/2766863_image2_1.jpg,128.7691781212,35.9622433137,6,20211103010156,0,1,,갓바위워터피아온천,38403.0,"갓바위워터피아는 경북 경산시 와촌면 음양리에 있다.팔공산 지하 1,200m에서 발원한 섭씨 33.5도의 약알칼리성 온천수로 심신의 피로와 스트레스를 한 번에 풀어주는 온천탕과 함께 찜질방, 워터파크 등의 시설이 마련되어 있는 휴양공간이다."
경상북도 경산시 자인면 계정길 68,,35,0,A01,A0101,A01010400,2745623,12,20210916000812,http://tong.visitkorea.or.kr/cms/resource/63/2746063_image2_1.jpg,http://tong.visitkorea.or.kr/cms/resource/63/2746063_image2_1.jpg,128.8190222342,35.8178883523,6,20221110132531,0,1,,자인계정숲(경산 자인의계정숲),38549.0,"경산 시내에서 자인 간 국도변에 위치한 계정 숲은 구릉지에 남아있는 천연 숲이다. 숲은 이팝나무가 주종을 이루며, 말채나무, 느티나무, 참느릅나무 등의 낙엽수와 활엽수가 섞여 자라고 있다. 계정 숲 안에는 한장군놀이 전수회관이 있고, 조선 시대의 전통 관아인 자인 현청의 본관이 보존되어 있다. 과거 경산시 일대에 어떤 나무들이 울창하였는지 보여주는 자연 유적지이다.본 저작물은 '경산시'에서 '2018년' 작성하여 공공누리 제4유형으로 개방한 '저작물명 자인계정숲'을 이용하였으며, 해당 저작물은 '경산시, https:www.ggs.go.kopen_contenttouindex.do'에서 무료로 다운받으실 수 있습니다."
경상북도 경산시 남산면 반곡리,,35,0,A01,A0101,A01011800,2704119,12,20210118231529,http://tong.visitkorea.or.kr/cms/resource/06/2726206_image2_1.jpg,http://tong.visitkorea.or.kr/cms/resource/06/2726206_image3_1.jpg,128.8066632546,35.7805145683,6,20220525135809,1,1,,반곡지,38571.0,"사진찍기 좋은 녹색명소 남산 반곡지는 1903년에 만든 농업용 저수지로 유역 면적은 79ha, 저수량은 3만9300톤에 이른다.  수백년 된 왕버들 20여 거루가 줄지어 선 150m 가량의 나무터널 흙길을 걷다보면 한적한 농촌마을의 정취와 삶의 여유를 느낄 수 있다. 2011년 3월에 문화체육관광부의 「사진찍기 좋은 녹색명소」로 선정되었으며, 2013년 10월에는 안전행정부의 「우리마을 향토자원 Best 30선」에 선정되기도 했으며,  드라마 아랑사또전 대왕의 꿈, 영화 허삼관 등을 촬영지로 유명하기도 하다."
경상북도 경산시 화랑로 94,(갑제동),35,0,A02,A0204,A02040800,2469053,12,20161222194726,,,128.7671044268,35.823214564,6,20220826102148,1558,1,,한국한의약진흥원,38540.0,"stong우리의 한약, 쉽게 이해하자 stong  한국한의약진흥원은 한의약의 과학화, 표준화, 산업화를 통하여 우리 생활 가까이로 한의약을 끌어들였다. 누구나 편하게 한약에 대해 이해하고, 그 효능을 누릴 수 있도록 견학 프로그램을 운영한다. "
경상북도 경산시 남산면 성산로 262,,35,0,A02,A0201,A02010700,1959170,12,20141023011126,,,128.8135601804,35.7694215055,6,20211215202413,2127,1,,조곡서원,38572.0,"자인의 유림과 탐진 안씨 후손이 그 선조 오성군(鰲城君) 안우(安祐)와 그 4세손인 문정공(文靖公) 안지 (安止)를 배향하기 위해 정조 18년(1794년)에 건립한 서원으로, 경산시 남산면 조곡리 분도등에 위치하고 있다. 서원의 산형대문(山形大門)을 들어서면 마당 건너편에 강당(講堂)인 상경재(尙敬齋)가 자리 잡고 있다. 팔작기와집인 강당의 좌우에는 동재(東齋)와 서재(西齋)가 있고, 강당 뒤쪽으로는 사당인 충현사(忠賢祠)가 있다. 음력 2월 중정(中丁)에 배향한다."
경상북도 경산시 하양읍 대곡로 543-4,,35,0,A02,A0201,A02010700,1958270,12,20141022013009,,,128.7622908788,35.9252557077,6,20220825173443,977,1,,백곡서원,38406.0,"조선 선조 조에 의병장인 희성당 허응길 선생을 봉향하는 서원이다. 선생은 현풍 현감으로 임진왜란때 의병을 일으켜 망우당 곽재우와 화왕산 전투에서 대승을 거두는 등 의병장으로서 혁혁한 공을 세웠다. 선조 37년(1604) 공신록에 등재되었고, 선생을 표창하여 절충장군 대구진마절제사를 제수하였다. 이 서원은 1938년 창건하여 재호를 선생의 호를 따서 희성당이라 하고 2월과 8월의 하정에 향사하다가 1977년 전국 유림에서 백곡서원으로 추증하였다."
경상북도 경산시 남천면 남천로 780-15,(남천면),35,0,A02,A0201,A02010700,1958226,12,20141022002805,,,128.7322279651,35.7864041904,6,20220330165629,1442,1,,동산서원,38695.0,"동산서당(東山書堂)은 원래 동산사(東山祠)가 그 전신이다. 동산사는 경산시 상방동에 자리하여 팔천군(八川君) 양헌공(良獻公) 정연(鄭珚)을 향사(享祀)하기 위하여 1813년(순조 13)에 창건되었으나, 1868년(고종 5)의 서원철폐령으로 훼철된 후 남천면 협석리에 1938년에 이건하였다. 이건 당시 건립된 건물은 서당, 사주문 및 비각이며 1988년에 사당인 상례사(尙禮祠) 일곽을 건립하였으며, 향사일은 음력 3월중정(中丁)이다. ｢장산지｣에 의하면 현령 이집로(李集老, 부임기간: 18111846)가 강당 상량문(上樑文)을 썼다는 기록으로 보아 창건 시는 사당만 세우고 30여년 뒤에 강당을 세운 것으로 보인다. 이렇게 하여 동산사는 명실 공히 향사와 강학의 기능을 겸비한 서원의 체제를 갖추게 되었다."
경상북도 경산시 하양읍 남하새마을길5길 59-13,,35,0,A02,A0201,A02010700,1958135,12,20141021203144,,,128.7685747095,35.8878461697,6,20220830094303,1228,1,,남호서원,38426.0,"병자호란때 많은 공을 세워 가선대부에 오른 김시성(金是聲)을 향사하기 위해 건립한 서원이다. 남호서당은 김시성의 위패를 봉안하기 위해 1786년(정조 10)에 남호사(南湖祠)를 세운데서 비롯되는데, 1855년(철종 6)에 남호서원으로 승격되었으나 1868년(고종 5) 대원군의 서원철폐령으로 훼철된 후 1928년에 남호서당으로 다시 복원하였다."
경상북도 경산시 하양읍 가마실길2길 32-1,,35,0,A02,A0201,A02010700,1958090,12,20141021194427,,,128.8032850952,35.9038422272,6,20220926170551,1766,1,,금호서원,38428.0,"조선 세종조의 좌의정 문경공(文敬公) 허조(許稠)선생의 위패를 모시고 해마다 2월중정(中丁)에 향사를 받든다. 금호서원은 1653년(효종 4)에 금호동에 창건한 뒤 1724년(경종 4)에 사이동(四而洞, 현 서사동)으로 이건, 1790년(정조 14)에 금호라는 사액을 받아 사액서원으로 승격되었다. 1923년(고종 8년)에 훼철되었다가 그곳에 유허비를 세우고 단향(單享)으로 배향하여 왔으며 1923년 현 위치에 서원을 다시 세웠다."
경상북도 경산시 용성면 서원천로 268-21,,35,0,A02,A0201,A02010700,1957989,12,20141021182709,,,128.8571307064,35.7925752543,6,20221007133058,1763,1,,관란서원,38569.0,"관란(觀瀾) 이선생(李先生:諱 承會) 문집에 금학산 아래에 맹구대(盟鷗臺)와 삼회당(三會堂)의 옛터가 있으니 이는 관란 이선생이 강론하던 곳이라고 전하여 오고 있다.고 기록되어 있으나 이곳이 지금의 관란서원 터인지는 확실하지 않다. 관란서원은 1660년(현종 1)에 지방유림들의 공의로 이언적(李彦迪)의 도덕과 학문을 추앙하여 창건하였다. 그 뒤 1715년(숙종 41)과 1743년(영조 19)에 사당을 중수하였다. 1868년(고종 5)에 서원철폐령으로 훼철되었다가, 1910년 맹구대와 삼화당이 있던 자리에 건물을 복원하여 서당으로 활용하였다. 언제부터 서원으로 승격되었는지도 잘 모르나 유림에서 단비(檀碑)를 세우고 해마다 중구일(重九日: 9월 9일)에 회재(晦齋) 이언적(李彦迪)선생의 향사를 받들고 있다."
경상북도 경산시 하양읍 교리길20길 12-5,,35,0,A02,A0201,A02010700,1955163,12,20141010234512,,,128.814016779,35.9288784826,6,20220826142929,2098,1,,하양향교,38408.0,"1985년 8월 5일 경상북도문화재자료로 지정되었다. 향교는 문묘와 어진 유학자의 위패를 모시고, 유학(儒學)을 가르쳐 인재를 양성하는 조선시대의 지방교육기관이었다. 하양향교는 1580년(선조 13)에 창건되었으며, 현재 대성전(大成殿), 명륜당(明倫堂), 전사청(典祀廳), 동재(東齋), 서재(西齋), 기물고(器物庫) 등의 건물이 남아 있다."
경상북도 경산시 자인면 교촌길9길 14,,35,0,A02,A0201,A02010700,1955133,12,20141010231307,,,128.8264686661,35.8227490524,6,20210901234401,2026,1,,자인향교,38554.0,"1985년 8월 5일 경상북도문화재자료로 지정되었다. 창건 시기는 현존하는 자료에서 확인할 수 없으나 고려 공민왕 때 창건된 것으로 추정된다. 1562년(명종 17) 경주 부윤 이정(李楨)이 고려 때 문묘를 지은 터에 다시 지었는데 임진왜란 때 불타버리고 후에 이춘복(李春馥) 등이 상소하여 1728년(영조 4)에 이건하였다. 1900년에 대성전을 짓고 1924년에 명륜당, 1926년에 다시 대성전을 중수하였다. 건물은 대성전, 명륜당, 모성루, 동재(측면 3칸, 측면 1칸), 내삼문으로 이루어져 있다. 전체적으로 남향한 경사면을 3단으로 층을 이루어 아래로부터 외삼문과 우측에 동·서재를 두고 정면에 명륜당을 두었으며, 그 뒤쪽에 대성전으로 들어가는 내삼문을 설치하였다. 대성전 왼쪽에는 서무가, 대성전 뒤로는 화계(花階)가 있다. "
경상북도 경산시 향교길 14-19,,35,0,A02,A0201,A02010700,1955012,12,20141010195935,,,128.7417567092,35.8213031993,6,20220826143035,2974,1,,경산향교,38636.0,"1390년에 현유(賢儒)의 위패를 봉안, 배향(配享)하고, 지방의 중등교육과 지방민의 교화를 위해서 창건되었다. 1550년에는 현령 박세린(朴世麟)이 중수하였고 임진왜란 때 소실된 것을 1633년에 현령 박창(朴敞)이 중수하였으며, 1681년에 현령 홍처공(洪處恭)이 감사 이수언(李秀彦)에게 건의하여 교궁(校宮)을 현 위치로 이건하였다. 현존하는 건물은 박공지붕 겹처마인 5칸의 대성전과 5칸의 명륜당, 삼문·중문과 최근에 새로 지은 4칸의 모성당 등이 있다. 대성전에는 5성(五聖)·송조4현(宋朝四賢), 우리나라 18현(十八賢)의 위패가 봉안되어 있다. 조선시대에는 국가로부터 전답과 노비·전적 등을 지급받아 교관이 교생을 가르쳤으나, 현재는 교육적 기능은 없어지고 봄·가을에 석전(釋奠：공자에게 지내는 제사)을 봉행하고 초하루·보름에 분향을 올리고 있으며, 전교 1명과 장의(掌議) 수명이 운영을 담당하고 있다."
경상북도 경산시 장산로24길 7,(삼북동),35,0,A02,A0201,A02010800,485750,12,20080225200935,http://tong.visitkorea.or.kr/cms/resource/64/1968364_image2_1.jpg,http://tong.visitkorea.or.kr/cms/resource/64/1968364_image3_1.jpg,128.7377543829,35.8177396396,6,20220404164714,20779,1,,혜광사(경산),38641.0,"혜광사가 자리한 곳이 연화부수(蓮花浮水), 곧 연꽃이 물에 떠 있는 형국의 명당자리라고 한다. 비록 도심의 자그마한 도량이지만 부처님 진리자리가 화현한 곳임에 틀림없어 보인다. 부처님의 가르침을 듣고 해탈문이 열리듯 혜광사는 눈 먼 중생들을 위한 포근한 안식처이자 기도처로 손색이 없다. 더군다나 경내 이곳 저곳에 꼼꼼히 가꾸어 놓은 금낭화, 유채꽃, 쑥부쟁이 등으로 단장한 화사한 화단은 마치 연화장 장엄을 해놓은 듯 방문객을 반갑게 맞고 있어 마치 산사의 어느 절에 있는 듯한 착각이 들 정도여서 이곳에서 정진하는 스님들의 고운 마음 씀씀이를 읽는 듯 하다.   창건배경 및 역사  대한불교 법화종에 소속된 혜광사는 1931년 창건됐다. 혜광사의 사찰 건물은 조선시대 자인현 객사(客舍)로 쓰던 건물을 일제강점기 투현(透玄)이라는 일본승려가 일본불교를 포교하기 위해 현 위치로 이건해 일본식 사찰로 건축해 운영해왔다고 전한다. 일본승려가 이 곳에 터를 정한 것은 이 곳이 당시 경산의 중심지였으며 풍수적으로 연꽃이 물 위에 떠있는 형상인 연화부수형국(蓮花浮水形局)의 명당자리였다고 알려져 있다. 해방 후 일본에 거주했던 한국스님인 혜광(慧光) 스님이 이 곳에서 주석하면서 왜색불교를 타파하고 대한불교 법화종단에 사찰을 등록하게 됐다.   이 때부터 주지스님의 법명을 따 혜광사라 사명을 짓고 지금의 대웅전에 봉안된 후불탱화를 국내 모 사찰에서 모셔와 명실공히 한국불교 법화종 사찰로 사격을 일신하게 된다. 그러나 시간이 지남에 혜광사는 점차 쇠락해져가 거의 폐사직전에 놓였던 것을 1975년 사찰의 주지로 새로이 부임해 지금까지 주석하고 있는 법화종 원로 혜문(慧門) 스님이 인근 부지를 매입해 지금의 대웅전을 중창하고 지금의 사찰 모습으로 변모시키고 오늘에까지 이르고 있다. 혜광사는 지난 1962년 전통사찰로 등록 지정됐다."
경상북도 경산시 하양읍 도리3길 12,,35,0,A02,A0201,A02010800,485683,12,20080225174327,http://tong.visitkorea.or.kr/cms/resource/52/1968352_image2_1.jpg,http://tong.visitkorea.or.kr/cms/resource/52/1968352_image3_1.jpg,128.8178556259,35.9183852966,6,20220721171844,19365,1,,하양포교당(경산),38410.0,"예로부터 우리는 정토 신앙을 뿌리 삼아 불국정토를 이루어 우리가 소망하는 원을 빌어왔다. 그러나 번뇌와 욕망으로 뒤엉킨 업에서 헤어나오지 못해 수많은 뭇 중생들이 현세의 행복과 내세의 정각을 이루지 못하고 있다. 아미타 부처님은 한량없는 광명을 지니시고 이러한 중생의 번뇌로부터 일어나는 무명과 무지를 일깨워 나고 죽음이 없는 열반의 세계로 중생을 인도하고자 큰 원력을 세운 불보살이다. 더욱이 말법시대의 근기를 가진 중생들에게 그 명호를 수없이 되뇌이게 만들어 중생들이 정토에 나도록 해주는 부처님이다.  경북 경산의 여여한 아미타도량인 은해사 하양포교당은 포교당으로는 그 터가 전국에서 다섯손가락에 들 만큼 1천여평의 드넓은 도심분지에 자리해 이 곳을 찾는 지역불자들에게 환희심을 불러일으키기에 충분한 기도처를 제공하고 있다. 하양포교당은 지난 1971년 은해사가 일타스님 문중으로 발돋움하면서 경산 하양지역 포교의 최적지가 경산포교당이라는 판단 하에 말사로 편입시켜 지금까지 팔공산 장엄화장세계 미타도량으로 그 명맥을 유지해오고 있다. 최근에는 극락전을 비롯한 여러 불사를 통해 사격을 일신하고 있으며, 특히 꾸준히 이어온 어린이법회와 경북불교대학 등을 통해 지역불자들과도 호흡을 함께 하고 있다. ""사람들 중에서 가장 높으신 이시여 삼계(三界)에 비할 바 없으리이다. 그의 복되심을 찬양하고 그대를 따라 가까이 가리이다""『관음경에 아미타부처님을 찬탄한 이 같은 게송처럼 하양포교당은 아미타부처님을 모시고 현세를 극락정토로 하루빨리 앞당기는데 정진을 다하는 도량으로 자리매김하고 있다.   창건배경 및 역사  조계종 제10교구 본사 은해사 말사인 하양포교당은 창건시기나 창건자에 대한 정확한 기록이 어디에도 없다. 다만 조선 초기에 창건된 사찰로서 조선시대 숭유억불 정책으로 인해 사찰로서의 본연의 임무를 상실한 채 유생들의 객사(客舍)로 함께 쓰여져 오다가 1927년 지석담(池石潭) 스님이 사찰의 재건을 위해 중수했다는 사실만 전해져 온다. 지석담 스님은 사찰의 중수와 아울러 은해사에서 부처님을 모셔와 봉안한 것이 지금까지 극락전 본존불로 이어져 내려오고 있다. 따라서 예전의 기록이 전무한 관계로 하양포교당의 창건주라고 하면 중창주인 지석담 스님이 보통 일컬어지고 있다. 이후 주지로서 알려진 고승으로는 고봉, 현고, 보원, 동관, 유곡스님 등이 주석했으며 지난 2001년 주지로 부임한 성본스님이 쇠락한 사역(寺域)을 정비하고자 5평 남짓한 극락전을 34평으로 신축하고, 칠성각 중보수, 설법전 부처님 봉안, 공양간 건립 등 사격을 일신하고 포교에 매진하고 있다."
경상북도 경산시 와촌면 갓바위로 216-111,,35,0,A02,A0201,A02010800,482086,12,20080222222614,http://tong.visitkorea.or.kr/cms/resource/05/1968305_image2_1.jpg,http://tong.visitkorea.or.kr/cms/resource/05/1968305_image3_1.jpg,128.7756326172,35.9796720152,6,20220519171745,18985,1,,천성암(경산),38400.0,"팔공산은 예부터 민족의 성산이다. 수많은 선지식을 비롯한 선각자들의 인연처로, 오랜 세월 동안 정신적 귀의처로 여겨져 왔다. 그리하여 시대를 초월해 갖가지 설화와 전설이 육화되고 기록되어져 역사라는 이름으로 팔공산 곳곳에서 그 명맥을 이어나가고 있다. 그럼에도 불구하고 아직도 팔공산에는 옛 선사들의 발자취가 적요로움 속에 담담히 묻혀 있다. 팔공산의 조그만 암자 천성암은 그래서인지 새롭기도 하고, 신비스러워 보이기도 하다. 눈이 번쩍 뜨일만한 요란한 성보나 특별한 역사의 기록은 남아있지 않지만, 곳곳에 스며있는 작은 이야기들이 내내 순례자의 발길을 붙잡는다.  지금처럼 세상이 급속도로 발전하고 변화하는 시대에도 천성암은 아직 도로가 없다. 천성암으로 오르려면 4륜구동 승용차 또는 비지땀을 흘리며 도보로 한참을 걸어 올라가야 절에 닿을 수 있을 만큼 길이 험하다. 전기가 공급되기 시작한지도 이제 10년 밖에 되지 않는 은찰(隱刹)이다. 그러나 그만큼의 수고는 천성암에 올라 아름다운 전망과 기암괴석에 둘러싸인 사찰의 정취를 접하고 비로소 보상받는다. 천성암은 그 이름 그대로 그야말로 하늘이 만들어놓은 절묘한 자리에 위치해 있다. 팔공산 어디에 이렇게 묘한 구석에 절이 있을까 하는 생각이 들 정도로 너럭바위와 암벽이 조화를 이루며 기기묘묘하게 틀어 앉아 있다. 특이한 것은 천성암의 너럭바위의 갈라진 틈이 만(卍)자 모양을 이루고 있어 이 곳이 불연(佛緣)이 깊은 곳을 암시하고 있기도 하다.  또한, 천성암에서 바라보는 아침 일출은 그야말로 신세계를 알리는 듯한 장엄함이 옷깃을 여미게 만들며 의상대사가 당나라에서 들여온 천도복숭아나무가 베어져도 지금도 꿋꿋하게 자라나 열매를 맺는 광경은 순례자를 더욱 환희심으로 인도하기에 충분하다. 비록 천성암이 지금은 초라한 전각을 지니고 있긴 하지만 이와 같은 사연들을 조금씩 알아가다 보면 자그마하고 찾아가기 힘들지언정, 인근에서 가장 찾는 이가 많았다는 사찰이라는 사실이 수긍이 가기도 한다."
