addr1,addr2,areacode,booktour,cat1,cat2,cat3,contentid,contenttypeid,createdtime,firstimage,firstimage2,mapx,mapy,mlevel,modifiedtime,readcount,sigungucode,tel,title,zipcode,overview
경상북도 고령군 다산면 다산로 1244-9,,35,0,A02,A0203,A02030100,2766582,12,20211102221259,http://tong.visitkorea.or.kr/cms/resource/62/2766962_image2_1.jpg,http://tong.visitkorea.or.kr/cms/resource/62/2766962_image2_1.jpg,128.4162763838,35.844927866,6,20221129154933,0,3,,다산딸기조합농원,40100,"다산딸기조합농원은 경북 고령군 다산면 노곡리에 있다.농원에서는 딸기 따기 체험과 딸기 모종 심기 등 딸기와 관련된 각종 체험을 진행한다. 농원에서 직접 재배한 딸기를 현장에서 구입할 수 있으며, 택배 주문도 할 수 있다.
농원은 남성주 IC에서 가깝고 남쪽으로 내려가면 대구광역시가 있어 연계 여행에 나서기 쉽다."
경상북도 고령군 대가야읍 중화리,,35,0,A02,A0202,A02020100,2753922,12,20211006223937,http://tong.visitkorea.or.kr/cms/resource/72/2754072_image2_1.jpg,http://tong.visitkorea.or.kr/cms/resource/72/2754072_image2_1.jpg,128.2425223023,35.7422418833,6,20221121104907,0,3,,중화유원지(중화지),40131,못 둘레가 4km가 넘는 중화유원지는 고령 군청에서 북서쪽으로 약 2km 떨어진 곳에 있다. 일명 낫질못이라고도 일컫는다. 낫질은 대가야 마지막 왕의 아들 월광태자와 그의 아내인 무후황후가 피난한 길이라는 데서 유래되었다. 이곳은 트레킹 명소로 소문난 곳이다. 유원지의 수려한 주변 경관을 따라 2.6km가량의 우륵생태둘레길이 있다.
경상북도 고령군 덕곡면 노리 481,,35,0,A02,A0202,A02020700,2753903,12,20211006222801,http://tong.visitkorea.or.kr/cms/resource/50/2754050_image2_1.jpg,http://tong.visitkorea.or.kr/cms/resource/50/2754050_image2_1.jpg,128.1955442343,35.8029897079,6,20221121154956,0,3,,미천공원,40126,"미천공원은 작은 규모지만 알찬 공간이다. 간단한 물놀이가 가능한 자그마한 하천, 잘 정비된 산책로 등이 있다. 이곳은 과거 차박 등을 즐기는 캠퍼가 많았다. 하지만 일부 몰지각한 캠퍼들이 무단으로 쓰레기를 투기하는 등 부작용이 발생했다. 이 때문에 2021년 8월 현재, 야영을 금지하고 있다."
경상북도 고령군 쌍림면 신촌길 39-5,,35,0,A02,A0202,A02020100,2753892,12,20211006222455,http://tong.visitkorea.or.kr/cms/resource/56/2754056_image2_1.jpg,http://tong.visitkorea.or.kr/cms/resource/56/2754056_image2_1.jpg,128.1855486214,35.6741679994,6,20221117164858,0,3,,신촌숲(신촌유원지),40166,"신촌숲은 자연적으로 형성된 유원지다. 이곳에는 주변 2㎞에 걸쳐 전망과 관찰이 가능한 데크를 비롯해 산책로, 지압로, 기타 체육 시설 등이 마련되어 있다. 특히 산책로는 자연적으로 자생하고 있는 수목을 관찰하며 걸을 수 있다. 특히 신촌숲은 주차 공간과 야영지가 넓어 캠핑하기에 안성맞춤이다. 야영지 앞에는 안림천이 흐르고 있어 여름마다 물놀이 장소로도 인기가 높다."
경상북도 고령군 대가야읍 성산로 46,,35,0,A01,A0101,A01010700,2753886,12,20211006222122,http://tong.visitkorea.or.kr/cms/resource/42/2754042_image2_1.jpg,http://tong.visitkorea.or.kr/cms/resource/42/2754042_image2_1.jpg,128.2872603976,35.7285636871,6,20221116114012,0,3,,대가야수목원,40134,"대가야수목원은 식민지 수탈과 전쟁으로 황폐해졌던 산림을 푸른 산으로 가꾼 산림녹화 사업의 업적을 기념하고자 건립됐다. 이곳에서는 숲이 우리에게 주는 혜택과 환경의 중요성에 대하여 종합적으로 배울 수 있다. 대표 시설로는 숲의 역할과 혜택, 산림 자원의 조성 과정, 낙동강 유역 산림의 녹화 과정을 그래픽과 영상물로 전시 연출한 산림문화전시실이 있다. 이 밖에 전국의 수석 수집가들이 기증한 수석을 전시한 수석 전시실, 기념숲과 금산재를 연결하는 산림 등산로 등이 있다."
경상북도 고령군 다산면 사문나루1길 17,,35,0,A02,A0202,A02020100,2745629,12,20210916001215,http://tong.visitkorea.or.kr/cms/resource/80/2746080_image2_1.jpg,http://tong.visitkorea.or.kr/cms/resource/80/2746080_image2_1.jpg,128.4667587425,35.8196483197,6,20221103173229,2,3,,다산 문화공원,40102,"다산문화공원은 낙동강 변에 자리 잡고 있다. 이 덕분에 연중 수려한 풍경을 감상할 수 있다. 특히 초여름 무렵에는 활짝 핀 금계꽃이 장관을 연출한다. 이곳은 낙동강 자전거 종주길이 통과하는 지점이기도 하다. 이 때문에 자전거 라이딩을 즐기다가 이곳에 머물다 가는 사람이 많다. 공원에는 농구장, 축구장 등의 부대시설도 마련되어 있다."
경상북도 고령군 대가야읍 신남로 81,,35,0,A02,A0201,A02010600,2732615,12,20210811004327,http://tong.visitkorea.or.kr/cms/resource/18/2732618_image2_1.JPG,http://tong.visitkorea.or.kr/cms/resource/18/2732618_image2_1.JPG,128.269265216,35.7118958019,6,20220927100916,0,3,,대가야생활촌,40140,"역사적 고증과 현대적 상상을 바탕으로 대가야의 역사와 문화의 과거, 현재, 미래의 모습을 볼 수 있도록 재현한 대가야생활촌입니다. 대가야생활촌에는 1500년 전 대가야시대로 안내해주는 인트로영상관, 대가야 의식주 생활상을 재현한 인줄마을, 대가야를 대표하는 철기문화를 직접 체험할 수 있는 불묏골, 대가야의 토기문화와 교역물품을 알아볼 수 있는 골안마을, 아름다운 경관을 감상할 수 있는 상가라도못, 짚라인을 즐길 수 있는 놀이터가 있는 메나릿골, 여름철 시원한 물놀이가 가능한 물놀이장, 대가야 철의 원정대 일원이 되어 원정선 하지호에 승선할 수 있는 주산성전시관, 기와마을과 초가마을로 이루어진 숙박시설 한기촌 등이 있어 학습체험과 관광숙박을 한 곳에서 즐길 수 있다."
경상북도 고령군 다산면 좌학리 969,,35,0,,,,2674946,12,20201007042953,http://tong.visitkorea.or.kr/cms/resource/43/2674943_image2_1.jpeg,http://tong.visitkorea.or.kr/cms/resource/43/2674943_image2_1.jpeg,128.4366338678,35.8106487864,6,20210324001808,1,3,,고령은행나무숲,,은행나무숲에 둘러싸여 잠시나마 답답함을 내려놓고 가슴 깊숙이 맑은 공기를 마실 수 있는 곳이다. 키크고 가을 색감을 띈 은행나무들은 마치 비밀의 숲에 온듯한 기분을 선사한다. 또한 낙동강을 끼고 있어 수변의 억새 또한 장관이다.
경상북도 고령군 덕곡면 덕운로 816,,35,0,A02,A0203,A02030100,2629770,12,20191024022819,http://tong.visitkorea.or.kr/cms/resource/62/2629762_image2_1.bmp,http://tong.visitkorea.or.kr/cms/resource/62/2629762_image2_1.bmp,128.213434589,35.7931939199,6,20220421163348,0,3,,고령예마을,40126,"수려한 자연과 풍성한 즐길 거리와 특색 있는 체험들로해마다 많은 관광객들이 찾고 있다. 예마을에 들어서면 조형미가 느껴지는 예마을 건축의 아름다움이가장 먼저 우리의 시선을 사로잡는다. 고급 유럽풍의 아늑한 건물과 넓은 잔디광장이 어우러져 다양한시설에 설레면서도 동시에 아늑함이 느껴진다. 총 면적 16500㎡, 2개의 센터건물과 숙박시설, 야외물놀이장, 잔디광장, 카라반,오토캠핑장, 체험장, 마방 등을 고루 갖춘 가족형 리조트이다.예마을은 체험휴향마을과 농어촌인성학교로 지정된 곳으로우리 아이들이 올바른 성장을 할 수 있도록 지역에서 재배한건강한 농산물과 재료들로 다양한 체험학습을 진행하고 있으며, 아이들이 깨끗하고 쾌적한 공간에서 안전하고 재미있게 소중한 추억을 만들 수 있도록 예마을 체험장을 신설하여 운영하고 있다."
경상북도 고령군 덕곡면 원앞길 7,,35,0,A02,A0201,A02010700,1958263,12,20141022012403,,,128.2443074734,35.7709192246,6,20220826141436,1911,3,,반암서원,40128,"반암서원은 본래 정종(鄭種)의 별묘(別廟)였다. 정구(鄭矩)는 1777년(정조 1)에 안의 정충사(靖忠祠)에 김문기(金文起)와 함께 모셔져 있다가 1794년(정조 18) 그곳 화림에서 다른 분을 추향하게 되어 동년 9월에 문중어른들이 성주 사림과 논의하여 장손(長孫)의 향리인 반성촌 정종의 별묘로 이봉(移封)하면서 반암서원이라 현판(懸板)하였다. 1868(고종5)년에 서원(書院)은 철폐(撤廢)되었으며, 반암서당으로 현판 하였다가 그 후 건물이 퇴폐하여 1994(갑술)년에 확대 개축하였다."
경상북도 고령군 쌍림면 송림2길 54-7,,35,0,A02,A0201,A02010700,1958233,12,20141022003911,,,128.2241838262,35.6844425348,6,20220923164849,2292,3,,매림서원,40164,이 서원은 곽수강(郭壽岡)과 오선기(吳善基)를 추모하여 유림에서 1707년(숙종33)에 건립하였다. 1868(고종 5)에 서원훼철령에 의해 훼철되고 매림재(梅林齋)로 존속하였다. 1985년 현풍곽씨와 고창오씨 양 문중의 후손들이 중수하면서 서원이 복원되었다. 매년 3월 중정(中丁)에 두 배향인의 향사를 지내고 있다. 최근 입구확장 및 담장설치 공사를 하였다.
경상북도 고령군 쌍림면 칠등길 138,,35,0,A02,A0201,A02010700,1958207,12,20141021235117,,,128.2466948663,35.7162060158,6,20220812144200,2371,3,,도암서원,40159,1666년(현종 7) 사림에 의하여 시임 조봉원(趙逢源) 현감의 협조를 얻어 고령읍내에 시창(始創)하여 송암 김선생(沔)과 옥산 이선생(起春)을 제향하였다. 1789년(정조 13) 서원주변에 시장이 있어서 번잡하고 불리하여 소암 김선생의 선산 아래인 현위치(고곡동)로 이전하다.
경상북도 고령군 대가야읍 대가야로 1216,,35,1,A02,A0202,A02020200,1067369,12,20100803025445,http://tong.visitkorea.or.kr/cms/resource/84/2493484_image2_1.jpg,http://tong.visitkorea.or.kr/cms/resource/84/2493484_image2_1.jpg,128.2596852822,35.720086368,6,20220519175710,26131,3,,대가야 역사테마관광지,40140,"대가야의 도읍지였고, 우리나라 최초의 토기와 철기, 가야금 문화를 찬란하게 꽃 피웠던 대가야의 역사를 테마로 하여 조성되는 관광지이다. 고대문화를 첨단시설로 보고 느끼고, 체험할 수 있도록 4D영상관, 유물 및 신비한 나라 대가야 체험관, 대가야 탐방 숲 길 등의 볼거리가 있다. 가야는 기원 전후부터 대가야가 신라에 흡수된 562년까지 존재했던 연맹체로서 우수한 철기 문화를 바탕으로 독자적인 대외 교류를 추진하였으며, 가야금과 같은 훌륭한 문화유산을 남겼다. 최근 가야에 대한 관심이 증대되면서 고구려, 백제, 신라 등의 '3국 시대'가 아닌 가야를 포함한 '4국 시대' 사관에 대한 연구 조사가 활발히 진행되고 있다. 고령군은 가야 문화권에 속해있었으며, 더 나아가 대가야의 중심 도읍지로서 가야시대의 유물과 유적이 많이 출토 되어지고 있다. 대가야의 도읍지로서 가야 문화의 중심 지주적 역할을 하였고, 나아가 가야문화제 행사교류 및 학술적, 사료적 가치 가야문화권의 재정비, 가야문화의 복원 및 전파를 하고자 대가야의 중심 도읍 고령군에 '대가야 역사 테마 관광지'를 설립하게 되었다."
경상북도 고령군 대가야읍 주산순환길 147,,35,0,A02,A0201,A02010800,297986,12,20071127184658,http://tong.visitkorea.or.kr/cms/resource/43/1967243_image2_1.jpg,http://tong.visitkorea.or.kr/cms/resource/43/1967243_image3_1.jpg,128.266445445,35.7329933639,6,20220613164119,19675,3,,관음사(고령),40136," 번화한 주택 속에 자리 잡은 사찰, 관음사   번화한 주택이 즐비한 속세의 한 공간, 그 자리에 구고구난의 관세음보살도량으로서 세속의 번잡함을 모두 포용할 듯 자리한 고령지역의 포교당 관음사. 시끌벅적한 도시속의 각종 소음을 뒤로 하며 조심조심 입구를 들어서다 종각 너머 아이들의 재잘거리는 소리에 흠칫 놀란다.그곳엔 천불전이란 현판과 선재유치원이란 간판이 함께 걸려 있다. 고령지역의 일반인들을 위한 포교활동을 펼치면서 아이들의 교육도 겸하고 있다고 했다. 천불전에서 쏟아져 나오는 아이들의 천진난만한 얼굴에서 관음보살의 모습을 찾는다. 1911년에 합천 해인사의 포교당으로 창건되었으며, 당시에는 봉두동에 있었다. 그 뒤 1956년에 동화사 말사로 등록하였고, 1990년대 초에 종운스님이 천불전 등을 지어 오늘에 이르고 있다.   관음사의 보유 문화재에 대하여   관음사의 경내에는 관음보살을 주불로 봉안하고 있는 관음전을 중심으로 칠성각과 산신각, 천불전 겸 유치원, 종각 그리고 요사 2동이 있다. 관음전 안에는 아미타후불탱과 신중탱 그리고 칠성각에는 칠성탱이 있다. 이들 불화들은 모두 해인사 산내암자인 백련암과 국일암에서 옮겨온 것이다. 그 외에 역사를 알만한 기록은 따로 없으며 현재 주지는 지선스님이 주석하고 있다."
경상북도 고령군 쌍림면 신촌길 39-5,,35,0,A03,A0302,A03021700,250434,12,20071029090000,http://tong.visitkorea.or.kr/cms/resource/32/1967232_image2_1.jpg,http://tong.visitkorea.or.kr/cms/resource/32/1967232_image3_1.jpg,128.1966089872,35.665688603,6,20210826225035,20153,3,,고령 신촌숲,40166," 가족 단위의 휴양지로 좋은 신촌숲 
신촌숲은 신촌리에 위치한 휴양지이다. 아름드리나무가 무성한 신촌숲은 주차공간과 야영지가 넓어 캠핑을 하기에 안성맞춤이다. 마을 뒤쪽으로는 산이 있으며, 야산에서 흐르는 내와 경남 합천군 묘산에서 흘러오는 내가 서로 합류하여 안림천을 이룬다. 앞에는 깊지 않은 강이 흐르고 있기 때문에 가족단위의 물놀이 장소로도 좋다.
 신촌숲이 아름다운, 신촌리에 대하여 
자연마을로는 새나리, 송정 등이 있다. 새나리는 마을 주민들이 내왕하기 위하여 나루터를 만들려고 하는데 큰 새(봉)가 날아와 울어 이 나루 이름을 봉나루, 봉진이라 부르다가 새나루, 새나리로 바뀌면서 붙여진 동명이다. 송정은 해인사로 가는 국도변 산기슭에 위치한 작은 마을이다. 10여 가구가 있으며 이곳에 벽송정이라는 정자가 있어 송정이라고 부르게 되었다."
경상북도 고령군 쌍림면,안화리 산1,35,0,A02,A0201,A02010700,231926,12,20071012090000,,,128.2613384112,35.7018190201,6,20220609133910,18534,3,,고령안화리암각화,40161," 선사시대의 문화를 접할 수 있는 문화재  안화리 암각화는 선사시대의 사람들이 암벽에 새긴 바위그림을 말한다. 가로 115㎝, 세로 90㎝의 바위 면에 쪼기 수법으로 3개의 그림을 새겨 놓았다. 먼저 U자형 반원을 기본으로, 좌우에 활모양의 선을 대칭되도록 그렸으며, 오른쪽 그림에는 작은 구멍을 팠다. 그림의 윗쪽 절벽의 바위 면에도 같은 종류의 그림이 2∼3개 더 있는데, 영일 칠포리 암각화와 유사한 점으로 미루어 해안에 살았던 사람과 내륙에 살았던 사람이 같은 의식을 가졌던 것으로 보인다.   안화리 암각화의 역사적 의의   안화리 암각화는 고령 양전동 암각화 및 영일 칠포리(七浦里) 암각화와 수법이 유사한 점으로 보아 선사시대 이 지방의 해안인과 내륙인의 의식구조가 비슷했던 것으로 추정된다. 이곳에 살던 선사인들이 신앙과 관련된 제의나 풍요다산을 기원하던 장소였기 때문에 그와 관계되는 내용을 암벽에 새긴 것으로 본다. 이 암각화는 선사인의 의식과 표현기법, 신앙연구에 귀중한 자료이다.  문화재 정보 지정종목 : 시도기념물 소재지 : 경상북도 고령군 쌍림면 안화리 산 1 종류 : 석조문화재 크기 : 면적 99㎡, 가로 115cm, 세로 90cm"
경상북도 고령군 쌍림면 개실1길 29,(쌍림면),35,0,A02,A0203,A02030100,128474,12,20050509090000,http://tong.visitkorea.or.kr/cms/resource/14/2629214_image2_1.bmp,http://tong.visitkorea.or.kr/cms/resource/14/2629214_image2_1.bmp,128.2274589909,35.6677222637,6,20211220185550,44889,3,,개실마을,40165,"조선중엽 영남사림학파의 종조인 점필재 김종직(14311492) 선생의 후손들의 집성촌으로 350여년간 전통을 이어오고 있으며, 점필재종택(민속자료), 도연재(문화재자료), 유점필재의 문적유품(유형문화재) 등의 문화재가 있다.현재 개실마을은 아름마을가꾸기 사업을 통해 도시민에게는 건전한 여가선용과 농촌체험의 기회를 제공하고, 지역민에게는 소득과 삶의 질을 향상시키는 한편 전통문화를 후세에 물려주기 위한 운동을 전개하고 있다.마을 안길을 흙담으로, 주민이 공동 식수로 사용하던 우물과 한옥 등을 보수복원하여 옛고향의 모습을 갖추었다.
또한 상하수도, 경로당, 마을회관 등 생활편의시설을 갖추고 주민이 함께 사용할 수 있는 인터넷카페와 등산로 개설 등 편리하고 쾌적한 주거환경을 마련하였다.주민들의 소득증대를 위해 채소, 버섯, 부추, 오이 등을 유기농으로 재배하고 이를 체험할 수 있는 벤처농장을 운영하고 있으며, 마을 브랜드 개발, 민박, 일선김씨 종가에 전승되는 한과, 안주 등 전통음식과 충효, 예절, 한문, 서예, 관혼상제 등의 전통문화의 상품화에도 최선을 다하고 있다.그 외에도 전국 각지의 도시 주민들을 대상으로 하는 농산물재배, 전통예절 및 놀이 등 각종 체험프로그램 개발을 통해 도농교류를 활성화시키고 있습니다."
경상북도 고령군 대가야읍 향교길 29-18,,35,0,A02,A0201,A02010700,128077,12,20040319090000,http://tong.visitkorea.or.kr/cms/resource/56/1001956_image2_1.jpg,http://tong.visitkorea.or.kr/cms/resource/56/1001956_image3_1.jpg,128.2651512209,35.7290993365,6,20220915104716,18534,3,,고령향교,40137,"창건연대는 미상이나 현유(賢儒)의 위패를 봉안, 배향하고, 지방의 중등교육과 지방민의 교화를 위하여 군의 서쪽에 창건되었다. 임진왜란으로 소실되었을 때 위패만을 옮겨 매안(埋安)하였다. 1676년 위패를 매안하였던 장소에 중건하였고, 1702년 현감 구문유(具文遊)가 당시의 향교 위치가 불길하다 하여 현 위치로 이건하였다. 1917년 빈흥재(賓興齋)를 건립하였고, 1974년 교궁(校宮)을 전면 보수하였으며, 1983년 내삼문(內三門)을 신축하여 오늘에 이르고 있다. 현재의 향교에는 사찰에서 사용 한듯한 석재가 많이 있어서 향교를 이건하기 전에 사찰이 있었던 것으로 추정된다. 현존하는 건물로는 5칸의 대성전과 8칸의 명륜당 및 빈흥재·서무(西廡)·주사(廚舍)·내삼문·외삼문 등이 있다. 대성전에는 5성(五聖)·송조2현(宋朝二賢)과 우리나라 18현(十八賢)의 위패가 봉안되어 있다. 조선시대에는 국가로부터 전답과 노비·토지 등을 지급받아 교관이 교생을 가르쳤으나, 현재는 교육적 기능은 없어지고 봄·가을에 석전(釋奠)을 봉행하고 초하루·보름에 분향을 올리고 있으며, 전교(典校) 1명과 장의(掌議) 수명이 운영을 담당하고 있다."
경상북도 고령군 대가야읍 고아리,,35,0,A02,A0201,A02010700,128078,12,20040319090000,http://tong.visitkorea.or.kr/cms/resource/72/2493172_image2_1.jpg,http://tong.visitkorea.or.kr/cms/resource/72/2493172_image2_1.jpg,128.2702622351,35.7161231193,6,20220715144639,19809,3,,고령 고아리 벽화 고분,40140,"6세기초 대가야시대에 축조된 가야지역 유일의 벽화고분. 1963년 당시 도굴된 상태로 발견되었으며, 남북길이 20m. 동서길이 25m. 높이 3.1m의 크기를 갖추고 있다. 현실과 연도를 갖춘 횡혈식 석실의 구조를 하고 있으며, 현실은 동서로 터널형을 이루고 있고, 연도는 현실 남벽 동편에 나 있다.원래 네 개의 벽면에 모두 벽화가 그려진 것으로 추정되지만, 지금은 천장에 그린 연꽃만 남아 있다. 천장 벽화는 벽면에 회를 바르고, 그 위에 백(白) ·적(赤) ·녹(綠) ·갈색 등으로 그린 연꽃은 겹꽃 모양이다. 꽃잎은 적색, 중심 꽃술은 녹색, 꽃술 주위는 백색, 꽃잎 내부는 갈색이다.  국립중앙박물관에 소장된 금동마안금구(金銅馬鞍金具)가 이 고분 출토라는 설도 있다. 이 고분은 고구려벽화고분의 영향을 받은 것이며, 백제 벽화고분과도 통한다. 가야시대 말기의 고분으로 가야문화를 연구하는 데 중요한 유적이다."
경상북도 고령군 고령읍 중화리,,35,0,A02,A0201,A02010200,128079,12,20040319090000,http://tong.visitkorea.or.kr/cms/resource/03/1004703_image2_1.jpg,http://tong.visitkorea.or.kr/cms/resource/03/1004703_image3_1.jpg,128.260345896,35.736159561,6,20220913111250,18691,3,,고령 주산성,40131," 대가야시대의 산성, 고령 주산성   고령의 서쪽에 있는, 이산(耳山)이라고 불리기도 하는 주산(主山, 311m)에 있는 성으로 가야 시대의 산성이다. 정상부에서 6부 능선까지 내려오면서 능선상에 내. 외 이중으로 축조된 테뫼식으로 성(城) 전체의 길이가 1,351m로 토석으로 견고히 석축한 성벽의 일부가 남아 있다. 당시 신라군에 대항하기 위해 대가야 시대에 축조된 산성으로 추정하고 있으며 지표 조사 결과 성내에는 망대 8개소, 건물지 2개소, 연못지 1개소가 있고 삼국시대의 석곽 1기가 확인되었다. 읍내에서 산성으로 올라가는 산책로가 당시 성내로 통하는 통행로가 아닌가 추정하고 있으며, 주위의 지산동고분군과 연조리 추정 궁성지 등과 연결되는 대가야시대의 핵심적인 산성이다.   고령주산성과 가야시대의 고분군의 의의   성보에서부터 남쪽으로 이어지는 능선 위에 큰 고분 5기가 한 줄로 늘어서 있고, 부근에 대가야시대 고분군들이 흩어져 있다. 성내에는 인근의 지산동 고분군에서 출토된 것과 같은 가야시대의 각종 토기 조각과 통일신라 및 고려·조선시대의 유물들이 출토된 것으로 보아 이 산성이 오랜 세월 이 지역의 중심 요새 역할을 하였던 것으로 짐작된다.  문화재 정보 지정번호 : 사적 지정연도 : 1963년 1월 21일 시대 : 삼국시대 크기 : 면적 895,171㎡ 종류 : 성곽유적"
경상북도 고령군 개진면 개경포로 681,(개진면),35,0,A02,A0202,A02020700,128080,12,20040319090000,http://tong.visitkorea.or.kr/cms/resource/98/1001698_image2_1.jpg,http://tong.visitkorea.or.kr/cms/resource/98/1001698_image3_1.jpg,128.3502165172,35.7082171326,6,20220525135614,19994,3,,개경포공원,40148,"개경포기념공원은 낙동강을 끼고 있는 고령군 개경포의 역사적 의미를 되돌아보기 위해 2001년 조성되었다. 공원에는 깔끔하게 손질된 넓은 잔디에 개경포의 유래를 적은 유래비와 표석, 팔각정·벤치 등의 휴식공간, 음수대 등의 시설이 갖추고 있다. 개경포는 조선시대까지 경상도 내륙지역의 곡식과 소금을 운송하던 커다란 포구였다. 즉, 경상도 삶을 이루던 곳이었다고 할 수 있는데 배를 타고 가는 길이 너무 아름다워 낙강칠현이라 불리던 송암 김면, 옥산 이기춘, 청휘당 이승 등이 뱃놀이를 즐기며 시를 읊은 곳이기도 했다. 그리고 1592년 임진왜란 때에는 의병장으로 활약하던 송암 김면이 궁중보물을 탈취해 운반하던 왜적 1,600여 명을 수장시키고 보물을 되찾은 현장이기도 하다.   팔만대장경과 개경포의 이야기   개포는 옛날 개산포라 불리웠다. 팔만대장경이 강화도로부터 운반될 때 서해와 남해를 거쳐 낙동강을 거슬러 온 배가 도착한 곳이 개산포였다. 영남 일대의 승려들이 이곳에 도착한 경판을 머리에 이고 열뫼재, 고령읍, 낫질신동재를 거쳐 해인사까지 운반했다 하여, 이후 경전이 도착한 곳이라 하여 개경포(開經浦)라 부르기 시작하였다. 일제강점기에 개포로 이름을 바꾸었으나, 예전의 역사를 의의를 되살리기 위하여 개경포로 바꾸었다."
