addr1,addr2,areacode,booktour,cat1,cat2,cat3,contentid,contenttypeid,createdtime,firstimage,firstimage2,mapx,mapy,mlevel,modifiedtime,readcount,sigungucode,tel,title,zipcode,overview
경상북도 문경시 문경읍,,35,0.0,A01,A0101,A01010400,126036,12,20040213090000,http://tong.visitkorea.or.kr/cms/resource/14/1893614_image2_1.jpg,http://tong.visitkorea.or.kr/cms/resource/14/1893614_image3_1.jpg,128.1013917542,36.7883673235,6.0,20220525142403,41275,7,,주흘산,36919," 문경을 지켜주는 영산, 주흘산 
주흘산은 조령산, 포암산, 월악산 등과 더불어 소백산맥의 중심을 이루며 높이 1108.4m로 산세가 아름답고 문경새재 등의 역사적 전설이 담겨 있다. 또한 예로부터 나라의 기둥이 되는 큰 산(中嶽)으로 우러러 매년 조정에서 향과 축문을 내려 제사를 올리던 신령스런 영산(靈山)으로 받들어 왔다. 문경의 진산(鎭山)이기도 한 주흘산은 우두머리 의연한 산이란 한자 뜻 그대로 문경새재의 주산이다. 남쪽의 중부내륙고속도로나 3번 국도를 타고 진남교반을 지나 마성면 너른 들판에 들어서면 앞쪽으로 기세 당당한 산이 하나 버티고 있다. 한눈에 비범한 산이 아님을 알 수 있으며 바라보는 것만으로도 가슴 속이 후련할 정도다. 양쪽 귀를 치켜세우고 조화롭게 균형미를 갖춘 산세에 주변의 모든 사물이 이 산의 기세에 그만 압도당하고 만다.
옛 기록에는 영남(嶺南)이니 교남(嶠南)이니 하는 명칭이 다 이 산과 관련된 것이라 적고 있다. 영남(嶺南) 지방이라 할 때 영남이란 충청도와 경상도를 나누는 조령(鳥嶺)을 기준으로 영(嶺)의 남쪽에 있다하여 영남이라 불렀다. 또한 교남(嶠南)이란 중악(中嶽)인 주흘산 남쪽의 지방을 일컬어 교남이라 불렀다. 조령과 주흘산이 큰 산줄기에 함께 위치하고 있어 영남이나 교남이나 같은 의미로 영남지방을 뜻하는 말로 보면 된다. 옛 기록에는 주흘산은 돌산이 치솟아 그 기세가 웅장하고 뛰어나며, 영남의 산천은 성질이 중후하여 명현(名賢)을 배출한 동방인재의 부고(府庫)라고 말했다.
 주흘산의 다양한 볼거리 
주흘산의 동쪽과 서쪽에서 물줄기가 발원하여 신북천과 조령천으로 흘러드는데, 이 물줄기들은 곳곳에 폭포를 형성한다. 그중 유명한 것이 발원높이 10m의 여궁폭포와 파랑폭포이다. 산기슭에는 혜국사(惠國寺)가 있고, 주흘산과 조령산 가운데에 난 계곡을 따라서는 문경관문(聞慶關門)이 세워져 있다. 그리고 해발 520m에 위치하는 혜국사는 신라 문성왕 8년(846) 보조국사 체징(體澄)이 개창한 고찰로 고려 말 홍건적이 쳐들어왔을 때 공민왕이 난을 피해 이곳에 머물었다는 일화로 유명한 절이다."
경상북도 문경시 산북면 김용길 372,,35,0.0,A02,A0201,A02010800,126168,12,20040213090000,http://tong.visitkorea.or.kr/cms/resource/54/2367654_image2_1.jpg,http://tong.visitkorea.or.kr/cms/resource/54/2367654_image3_1.jpg,128.2233072542,36.7394279679,6.0,20220316132601,33165,7,,김룡사(문경),36906,"김룡사는, 운달산김룡사사적서에 따르면, 신라 진평왕 10년(588) 운달 조사가 개선하여 사명을 운봉사라 하였다고 되어 있다. 따라서 본래의 절 이름인 운봉사라 사명이 조선시대 후기까지도 그대로 사용되었다고 생각되는 것은 사중에 전해지는 괘불화기에도 운봉사라 기록하고 있기 때문이다. 그러나 김룡사로 이름이 바뀌었다. 지금의 김룡사가 큰절의 초창은 인조2년에 수행 공덕으로 고명했던 혜총선사가 제자들과 힘을 모아 이룩하였으며 그 후 소실된 것을 의윤, 무진,대휴의 세분 대사가 옛모습을 되살려 놓아 번창시에는 48동에 건평 1,188평이나 되었으나 현재는 대소 전각 30여 채가 남아있다. 험상한 모습의 사천왕 신장상이 방문객을 압도하고 대웅전을 위시한 고색 창연한 전각들이 그 옛날의 창성을 말해주고 있다. 그 중에서도 경흥 강원 건물은 국내 최대 강원건물의 하나로 300명을 동시에 수용 할 수 있는 온돌방으로서 그 부엌아궁이는 어린 학생들이 걸어 들어갈 수 있을 만큼 크다.
인조 27년 설잠대사가 조성한 대웅전의 불상은 그 규모가 웅대하며 기예 또한 현묘하고 성균대사가 만든 후불 탱화가 유명하다. 고종26년에 사증대사가 조성한 거대한 쾌불탱화를 비롯한 죽은 사람의 생,전사가 기록 영화처럼 비쳐진다는 거울 등 수많은 문화유산을 소장하였으며 석탑과 석상을 절뒤에 세운것은 그 선익을 진압한다는 뜻이며 혹은 산혈의 촉맥을 보우하는 뜻이라 한다. 김용사에서 특이한 것은 절 입구에 지은 지 300여년 된 해우소 (근심을 해소시키는 장소라는 의미의 화장실) 가 있는데 토속적인 목조 건물로 꼭 한번 확인하기를 권하는 특별한 장소다.

 운봉사에서 김룡사가 된 이야기 
김룡사의 사명은 원래 운봉사였는데 김룡사로 바뀐 연유는 여러 가지로 전해지고 있으나, 그 중에서 가장 믿을 만한 것은 김씨 성을 가진 사람이 죄를 지어 이곳 운봉사 아래에 피신하여 숨어 살면서 신녀가를 만나 매양 지극한 정성으로 불전에 참회하더니 한 아들을 낳아 이름을 용이라 하였다. 그 이후부터 가운이 크게 부유해져 사람들은 그를 김장자라 하였고, 이로 인하여 동리 이름 또한 김룡리라 하였으며, 운봉사 역시 김룡사로 개칭하였다는 기록이 전해지고 있다. 그러므로 이 절은 최소한 18세기 이후 김룡사란 이름으로 되었다고 생각된다."
경상북도 문경시 산북면 대승사길 283,(산북면),35,0.0,A02,A0201,A02010800,126169,12,20040213090000,http://tong.visitkorea.or.kr/cms/resource/95/1967495_image2_1.jpg,http://tong.visitkorea.or.kr/cms/resource/95/1967495_image3_1.jpg,128.2720887078,36.7498971181,6.0,20220322172201,32487,7,,대승사(문경),36905,"사불산 대승사는 아름다운 창건설화와 함께 비교적 풍부한 사적을 보우하고 있다. 창건 이후의 사적에 대하여는 자세하지 않으나 대승사사적기에 따르면 선조 37년(1604) 서총대사가 대웅전 서쪽의 승당을 중창하였고, 다시 효종 2년(1651 경묵 대사가 대웅전 동쪽의 선당을 중창하였다고 하였다.이후에도 인조 8년(1630)에서부터 숙종 29년(1703)에 이르는 사이에는 계담 대사, 각인 대사, 선림 대사, 혜탄 대사, 종수 대사, 원응 대사, 등 역대제사의 중수가 있었다. 당시 건물의 명칭은 대웅전, 응진전, 관음전, 시왕전, 금당, 요사, 종각, 일주문, 누각, 수각, 주고, 문랑 등 전각이 사불산 내에 가득하여 교남의 대가림이 되었다고 하였다. 고종 12년(1875) 목각후불탱을 부석사로부터 이안하여 계속 시비가 일기도 하였으나, 결국 대승사에 귀속되었다. 그리고 1922년 여름 뜻하지 않은 화재로 여러 건물이 불타버리고 말았다. 이에 의운, 취월, 덕산 대사 등이 정재를 모아 1927년에 옛모습대로 복구하였다. 그러나 1956년 1월에 다시 화재를 입어 극락전, 명부전, 산신각 등을 남기고 불타버리자 남인, 대휴, 설월, 정암 대사 등이 힘을모아 대웅전, 응진전, 대방, 일주문 등을 중창하였다.

 대승사의 창건 설화 
사불산의 본래 산명은 공덕산이었다. 그러나 삼국유사권3 사불산, 굴불산, 만불산의 내용에 따르면 죽령 독쪽 백여 리 지점에 높이 솟은 산봉우리가 있는데, 진평왕 9년 갑신년에 홀연히 사면 10자 정도되는 큰 돌이 사방에 불상을 새겨 붉은 비단에 싸여 하늘로부터 산의 꼭대기에 내려왔다. 왕이 이 사실을 듣고 수레를 타고 가서 예경하고 그 바위 곁에 절을 지어 대승사라 하였으며, 법화경을 독송하는 망명(이름을 밝히지 않은) 비구를 청하여 절을 주관케 하였더니, 그 주변을 깨끗이 청소하고 돌에 공양하여 향화가 끊이지 않았다. 산을 덕산, 또는 사불산이라 하였다. 비구가 죽자 장사지냈더니 무덤 위에서 연꽃이 나왔다고 하였다. 그러므로 이 절은 천강사불하고 지용쌍련의 설화로서 더욱 잘 알려져 있다."
경상북도 문경시 가은읍 용추길 31-35,,35,0.0,A01,A0101,A01010400,126569,12,20040213090000,http://tong.visitkorea.or.kr/cms/resource/31/1893631_image2_1.jpg,http://tong.visitkorea.or.kr/cms/resource/31/1893631_image3_1.jpg,127.9619992227,36.6709532203,6.0,20220329163609,57266,7,,대야산,36993," 문경의 산 중 명성이 높은 산, 대야산 
대야산은 백두대간에 자리잡고 있으면서 문경의 산들 중에서도 그 명성을 높이 사고 있는 명산이다. 경북 문경시 가은읍 완장리에 속한 대야산은 대간 마루금을 경계로 충북 괴산군 청천면 삼송리와 접하고 있다. 내·외선유동을 거느리고 있는 대야산은 2002년 세계 산의 해를 맞아 문경의 주흘산, 황장산, 희양산과 함께 산림청에서 선정한 한국 100대 명산에 올라서 있다. 
예로부터 명산으로 받들어 온 대야산은 여러 기록들에 대야산(大耶山)으로 적고 있으며 특히 철종 조의 대동지지(大東地志(1861년 이후 추정) 에는「大耶山 曦陽山南支上峯曰毘盧爲仙遊洞主山西距淸州華陽洞三十里(희양산남지상봉왈비로위선유동주산서거청주화양동삼십리: 대야산은 희양산의 남쪽 갈래로 제일 높은 봉우리가 비로봉이고, 선유동의 주산이다. 서쪽의 청주 화양동이 30리다)라고 기록하고 있어 대야산 정상을 비로봉(毘盧峯)으로 부르고 있음을 알 수가 있다. 

 대야산에서 유명한 계곡, 용추계곡 
경북 문경시와 충북 괴산군의 경계에 있는 대야산 자락을 흐르는 계곡과 폭포이다. 울창한 숲으로 둘러싸인 암반 위를 사시사철 옥처럼 맑은 물이 흘러내리는 계곡에는 무당소, 용추폭포, 월영대 등의 아름다운 비경이 숨어 있다. 특히 용추폭포는 2단 폭포로, 다른 폭포처럼 물이 높은 위치에서 시원스레 떨어지는 것은 아니지만 위쪽에 하트 모양의 깊게 파인 소(沼)가 있어 보는 이로 하여금 신비로움을 느끼게 해준다. 이곳은 두 마리의 용이 승천했다는 전설이 서려있는 곳으로 폭포 양쪽의 바위에는 용이 승천할 때 떨어뜨렸다고 전하는 용의 비늘 자국이 아직도 남아있다. 소(沼)에서 머물던 푸른빛이 도는 맑은 물은 좁은 홈을 타고 아래 용소로 흘러내리며, 그 아래에는 용이 승천하기 전 알을 품었다고 하는 살짝 파인 웅덩이가 있다.
용추폭포 아래에 있는 무당소는 수심이 3m 정도로, 100여 년 전 물 긷던 새댁이 빠져 죽은 후 그를 위해 굿을 하던 무당마저 빠져 죽었다고 한다. 용추폭포 위의 넓은 암반을 지나 대야산 정상으로 오르는 등산로를 따라 20분 정도 오르면, 밤에 계곡의 맑은 물에 비친 달을 볼 수 있다는 월영대(月影臺)가 있다."
경상북도 문경시 마성면 신현리,,35,0.0,A01,A0101,A01010500,126570,12,20040213090000,http://tong.visitkorea.or.kr/cms/resource/34/2352634_image2_1.jpg,http://tong.visitkorea.or.kr/cms/resource/34/2352634_image2_1.jpg,128.1264681092,36.6620739267,6.0,20220516130212,28686,7,,진남교반,36923,"문경은 경상북도 북쪽의 울타리이다. 태백산에서 이어진 대미산, 주흘산, 희양산 같은 고봉들이 충북과 경북의 경계를 이루고 있다. 기암괴석과 깎아지른 듯한 층암절벽이 이어지고 강 위로 철교·구교·신교 등 3개의 교량이 나란히 놓여 있어 자연과 인공의 조화를 이루며, 이 절경으로 경북팔경 중 제1경으로 꼽힌다. 또한 영강의 기암괴석과 원삼국시대의 성으로 추정되는 고모산성, 고부산성이 어우러져 빼어난 경치를 자랑하고 있다.1933년 1월 대구일보사 주최 경상북도 내 명승지 결정에서 1등으로 지정되어 ""경북 팔경 중 제1""이라는 비석이 있는 곳이다. 고모산성 아래에 강변 따라 솟아오른 층암 절벽 허리깨를 감아도는 옛 사다리길이 불정역 동변 기슭까지 희미하게 이어져 있는데 이 길이 관갑천 또는 토천이라 한다.

현재에는 낙동강 지류인 가은천과 조령천이 영강에 합류하였다가 돌아나가는 지점으로, 아름드리 노송이 우거진 숲 앞으로 넓은 모래사장이 펼쳐지고 주차장·휴게소·인공폭포 등이 마련되어 있어 여름철 휴양지로 사람들이 많이 찾는 곳이다. 영강은 함창읍 동쪽에서 낙동강으로 흘러들어간다. 문경선 철교가 주변 풍치의 멋을 더해주고 있다."
경상북도 문경시 농암면 내서리 쌍룡계곡,,35,0.0,A01,A0101,A01010900,126571,12,20040213090000,http://tong.visitkorea.or.kr/cms/resource/13/1958813_image2_1.jpg,http://tong.visitkorea.or.kr/cms/resource/13/1958813_image3_1.jpg,127.9558835002,36.5581465823,6.0,20220324164201,75060,7,,쌍룡계곡,37003,"문경시 도장산(828m) 자락을 흐르는 계곡으로 약 4㎞에 걸쳐 아름다운 경관이 펼쳐져 있다. 상주시 화북면을 연결하는 쌍용터널이 있어 바로 근처로 도로가 통과하고 있으나, 도장산의 기암괴석과 층암절벽으로 둘러싸인 계곡으로 흘러내리는 옥계수는 심산유곡에 들어온 듯한 비경을 연출한다. 청룡과 황룡이 살던 곳이라 하여 쌍룡계곡이라 이름 지었다고 한다.
특히 이중환의 택리지에서는 청화산을 가리켜 병화가 미치지 못하는 땅이라 했다. 문경시에서도 한참을 가 농암면 깊숙이 자리잡고 있어 그 어느 곳보다 문명에 오염이 되지 않아 맑고 깨끗함을 간직하고 있다. 계곡 입구에서 맑은 계곡물과 주변 산세를 즐기며 한참 가면 산은 점점 깊어지고 물소리며 바람소리, 새소리는 더욱 커진다.

 쌍룡계곡과 인근의 볼거리 
곳곳에 선녀들이 달 밝은 밤에 내려와 목욕을 하였다는 선녀탕과 20m 높이에서 물안개를 피워 올리며 떨어지는 심원폭포, 명주실 한 타래가 들어간다는 깊은 용소 등이 있다. 내서 2교를 지나 조금 더 가면 몸 한자락을 계곡물에 담근 바위 위에 정자 하나가 앉아 있다. 사우정이다. 도장산에 있는 전통사찰 심원사는 수도처로 스님이 정진하는 곳이다."
경상북도 문경시 문경읍 온천2길 24,,35,0.0,A02,A0202,A02020300,126647,12,20040213090000,http://tong.visitkorea.or.kr/cms/resource/84/1958784_image2_1.jpg,http://tong.visitkorea.or.kr/cms/resource/84/1958784_image3_1.jpg,128.1091343918,36.7300491533,6.0,20220527153155,35182,7,,문경종합온천,36918,문경종합온천은 1995년말 경상북도로부터 온천지구로 지정 고시되어 지난 2001년 3월 24일 개장한 종합온천이다. 또한 지하 900m 화강암층과 석회암층사이에서 분출한 칼슘중탄산천과 지하 750m 화강암층에서 분출한 알칼리성 온천수를 공급하여 한 번의 입장으로 두 가지 온천을 즐길 수 있는 전국 유일의 복합보양온천이다.
경상북도 문경시 가은읍,,35,0.0,A01,A0101,A01010900,127913,12,20030918090000,http://tong.visitkorea.or.kr/cms/resource/69/2367669_image2_1.jpg,http://tong.visitkorea.or.kr/cms/resource/69/2367669_image3_1.jpg,127.9514866237,36.6585600035,6.0,20220310134243,108158,7,,대야산 용추계곡,36993,"문경팔경 중 으뜸인 대야산 용추는 충북 괴산군과 경계를 이루고 있으며, 깍아지른 암봉과 온갖 형상의 기암괴석으로 둘러싸인 대야산 자락에 있다. 많은 비경 가운데 2단으로 이루어진 용추폭포의 장관이야 말로 명소 중의 명소로 유명하다. 암수 두 마리의 용이 하늘로 오른 곳이라는 전설을 증명이라도 하듯이 용추 양쪽 거대한 화강암 바위에는 두 마리의 용이 승천을 할 때 용트림하다 남긴 용비늘 흔적이 신비롭게도 선명하게 남아 있고, 아무리 가물어도 이곳의 물은 마르는 일이 없어 옛부터 극심한 가뭄이 들면 이곳에서 기우제(祈雨祭)를 올리기도 하였다고 한다. 용추의 형상을 보면 위아래 두 개의 용추가 이어졌으며 수 만 년 기나긴 세월을 쉼없이 흘러 내려 마침내 떨어지는 폭포아래에는 천하에 보기드문 신비스런 하트형(♡)으로 깊게 파인 소(沼)가 윗 용추로, 절묘한 형태는 보는 이마다 미소를 머금게 한다.
윗 용추에서 잠시 머물던 물이 다시금 매끈한 암반을 미끄럼 타듯 흘러내려 부드럽게 이루어 놓은 것이 아래 용추로 하절기에는 개구쟁이 꼬마들의 미끄럼틀로 이용되기도 하는 곳이다. 용추폭포 위의 넓디 넓은 암반지대를 지나 20분쯤 올라가면 월영대가 있다. 휘영청 밝은 달이 중천(中天)에 높이 뜨는 밤이면 희디 힌 바위와 계곡을 흐르는 맑디맑은 물위에 어린 달 그림자가 더할 나위없이 낭만적이라 하여 월영대라 한다. 대야산은 백두대간에 자리잡고 있으면서 문경의 산들 중에서도 그 명성을 높이 사고 있는 명산이다. 경북 문경시 가은읍 완장리에 속한 대야산은 대간 마루금을 경계로 충북 괴산군 청천면 삼송리와 접하고 있다. 내·외선유동을 거느리고 있는 대야산은 2002년 세계 산의 해를 맞아 문경의 주흘산, 황장산, 희양산과 함께 산림청에서 선정한 한국 100대 명산에 올라서 있다. 
예로부터 명산으로 받들어 온 대야산은 여러 기록들에 대야산(大耶山)으로 적고 있으며 특히 철종 조의 대동지지(大東地志(1861년 이후 추정) 에는「大耶山 曦陽山南支上峯曰毘盧爲仙遊洞主山西距淸州華陽洞三十里(희양산남지상봉왈비로위선유동주산서거청주화양동삼십리: 대야산은 희양산의 남쪽 갈래로 제일 높은 봉우리가 비로봉이고, 선유동의 주산이다. 서쪽의 청주 화양동이 30리다)라고 기록하고 있어 대야산 정상을 비로봉(毘盧峯)으로 부르고 있음을 알 수가 있다."
경상북도 문경시 가은읍 완장리,,35,0.0,A01,A0101,A01010900,126056,12,20030917090000,http://tong.visitkorea.or.kr/cms/resource/64/2367664_image2_1.jpg,http://tong.visitkorea.or.kr/cms/resource/64/2367664_image3_1.jpg,127.9564217492,36.6778467727,6.0,20220316163407,50165,7,,선유동계곡(문경),36993,"문경 선유동계곡은 백두대간의 대야산(931m)을 가운데 두고 10km 거리에 있는 괴산 선유동 계곡보다 길고 화려하다. 계곡미가 빼어나 문경팔경의 하나로 꼽히는 곳이다. 아직 널리 알려지지 않아 무척 깨끗하다.
계곡의 시작 지점에 학천정, 끝 지점에 칠우정이 있으며, 계곡의 양 옆에 펼쳐진 깊은 숲과 계류를 덮어버리는 오랜 소나무들이 많아 운치를 한층 더해주고 있다.

 선유동계곡의 볼거리 
용추동에는 이재가 지은 둔산정사와 이재를 추모하는 후학들이 그를 기려 1906년에 세운 학천정이, 계곡의 하류 끝지점에는 의친왕이 이름을 지어 주었다는 칠우정이 주변 경관과 조화를 이루고 있다. 곳곳에 석각 글씨가 새겨져 있는데 그 가운데 최치원이 쓴 선유구곡이 유명하다. 선유구곡은 옥하대, 영사석, 활청담, 세심대, 관란담, 영규암, 난생뢰, 옥석대 등이다."
경상북도 문경시 산북면,,35,0.0,A01,A0101,A01010400,127819,12,20030624090000,http://tong.visitkorea.or.kr/cms/resource/40/1893640_image2_1.jpg,http://tong.visitkorea.or.kr/cms/resource/40/1893640_image3_1.jpg,128.2113941714,36.7484350484,6.0,20220527134541,29446,7,,운달산,36906," 예로부터 교통의 요지였던, 운달산 
운달산(1,097m)은 계곡의 흐르는 물이 맑고 차갑기가 얼음 같아 일명 ""냉골""이라 불리워진다. 용암산(龍岩山)이라고 부르기도 하는 이 산은 문경읍 동북쪽 8km 지점에 위치한다.

산 능선은 길게 동서로 10여km에 걸쳐 뻗었으며, 그 사이의 마전령(馬轉嶺:627m)·조항령(鳥項嶺:673m) 등 안부(鞍部)가 예로부터 문경과 다른 지방을 연결하는 교통의 요지로서 유명했다. 금선대(金仙臺)를 비롯하여 많은 기암괴석으로 덮여 경치가 아름다움을 뽐내고 있다.

 운달산 산행을 즐겁게 하는 다양한 볼거리 
운달산의 남동사면 일대에 화장암(華藏庵)·양진암(養眞庵)·대성암(大成庵)·금룡사(金龍寺) 등 고찰이 있어 많은 관광객이 찾아든다. 특히 수령 300년 이상 수고 30여 미터의 전나무 숲속에 고목이 조각품마냥 운치를 더해주고 겨울철 눈꽃은 내방객의 넋을 잃게 하고 여름철에는 조용한 곳을 찾는 피서객들이 찾아온다."
경상북도 문경시 불정길 180,(불정동),35,0.0,A01,A0101,A01010600,125407,12,20030616090000,http://tong.visitkorea.or.kr/cms/resource/83/1070183_image2_1.jpg,http://tong.visitkorea.or.kr/cms/resource/83/1070183_image3_1.jpg,128.1342658631,36.618826244,6.0,20220407145139,130263,7,,불정자연휴양림,36987,"불정자연휴양림은 경북 문경의 불정동 마을 안쪽에 위치한 나트막한 봉우리인 수정봉 (해발 487m, 약수산)과 조봉 사이에 자리잡고 있다. 불정자연휴양림 부근은 물맛이 좋기로도 유명한데, 휴양림 부근의 운암사 약수나 휴양림 입구의 마지막골 약수도 물맛이 좋아 찾는 이들의 쉼터가 되기도 한다. 
천연 활엽수림으로 이루어진 휴양림 입구부터 산막으로 이어지는 길가에는 야생화단지의 꽃과 나무들이 뚜렷한 사계절의 향기를 담고 정겨움을 준다. 산 정상에서부터 맑은 물은 산막들 사이로 흐르고 계곡 중간 중간 보를 막아 만든 물놀이장이 길을 따라 이어져 있으며 나무 그늘 아래 놓인 통나무 데크와 벤치가 시원한 산바람과 함께 여유로운 휴식을 더한다. 휴양림 내 쉼터는 숲속의 집과 카라반 시설이 있으며 나무 사이사이 지어진 숲속의 집은 11동의 통나무집과 1동의 황토집이며, 카라반 시설 14동 포함 총 26동이 연중 운영된다.
또한 휴양림 내 설치된 (주)짚라인 코리아에서 운영하는 9개의 다이나믹한 짚라인 코스는 푸른 자연과 함께 즐기는 최고의 레포츠로 무한한 감둥을 준다.

 불정자연휴양림의 즐길거리 
불정자연휴양림은 산악자전거 도로를 조성해 놓고  산악자전거를 대여해 주고 있으며 또한 근처에 클레이 사격장도 있다. 청소년수련관에서부터  출발하여 산악자전거 도로를 통과하여 클레이사격장까지 이용할 수 있는 코스가 마련되어  있다. 주변 관광지로는 휴양림 건너편 계곡에 신라 때 창건했다는 춘암사와 문경온천, 문경새재, 가은석탄박물관 등이 있어 일일 코스로 다녀올 수 있다."
