addr1,addr2,areacode,booktour,cat1,cat2,cat3,contentid,contenttypeid,createdtime,firstimage,firstimage2,mapx,mapy,mlevel,modifiedtime,readcount,sigungucode,tel,title,zipcode,overview
경상북도 영덕군 영덕읍 화개서길 15,(영덕읍),35,0.0,A02,A0201,A02010700,1955053,12,20141010221439,,,129.3660846496,36.4165641848,6,20211220193047,1754,12,,영덕향교,36429,"조선시대에 현유(賢儒)의 위패를 봉안, 배향하고 지방민의 교육과 교화를 위하여 창건되었다. 창건 시기는 알려져 있지 않다. 1914년 향교 자리에 영덕공립보통학교를 신설하면서 향교의 대성전과 명륜당을 교실로 사용하게 되자 화개리 개인 집에 위패를 봉안하였다. 1924년 영덕공립보통학교가 신축되자 군수 홍의식(洪義植) 등의 주선으로 구 향교를 보수하여 위패를 이안(移安)시켰다. 1944년 1군1향교 방침에 따라 같은 군에 있던 영해향교(寧海鄕校)를 폐쇄하고 그 위패를 영덕향교에 이안하였으며, 영덕향교의 위패는 땅에 묻었다. 그 뒤 6·25전쟁으로 불에 타 없어졌다가 1965년 전교(典校) 신수원(申壽元)과 유림의 노력으로 현재의 터를 매입, 후임 전교 박종대(朴鍾大)의 주선으로 대성전과 명륜당·동재(東齋)를 개축하여 1967년에 완공하고 위패를 봉안하였다. 1970년 전교 김우영(金羽英)의 주선에 따른 군비 보조와 장의(掌議) 방도원(房道源) 및 유림의 성금으로 대성전·명륜당을 개축하고 정문·서재(西齋)를 신축, 동재 수리 등 대대적인 중수작업을 1981년까지 실시하였다. 조선시대에는 국가에서 토지와 전적·노비 등을 지급해 교관 1명이 정원 30명의 교생을 가르쳤으나, 갑오개혁 이후 신학제 실시에 따라 교육 기능은 없어지고 봄·가을에 석전(釋奠：공자에게 지내는 제사)을 봉행하며 초하루·보름에 분향을 하고 있다. 현재 전교 1명과 장의 수명이 운영을 하고 있다."
경상북도 영덕군 축산면 축산항5길,,35,0.0,A01,A0101,A01011400,1804600,12,20130416013543,,,129.4481025033,36.5074943211,6,20220525154035,19619,12,,축산항,36421,"축산항은 1924년 3월 조성되어 영덕의 대표적인 어항으로 대게 위판이 열리는 전국 5개항 중 한 곳이다. 또한, 축산항은 태백산에서 뻗어 나온 산봉우리의 산세가 해안까지 밀려 내려와 만처럼 쌓인 아름다운 해안선을 이뤄낸 곳이다. 인근의 여러 항으로부터 배들이 유입, 집하, 고기의 입찰 등을 총괄하며, 대게원조마을과 함께 최고의 영덕대게 서식지를 자랑한다.
영덕 강구면의 강구항을 출발하여 축산항을 거쳐 고래불 해수욕장에 이르는 약 50km의 길로 도보여행을 위한 블루로드 B코스와 C코스로 지정되어 있다."
경상북도 영덕군 축산면 영덕대게로 1726,,35,0.0,A01,A0101,A01011200,1621219,12,20120503191345,http://tong.visitkorea.or.kr/cms/resource/48/1614848_image2_1.jpg,http://tong.visitkorea.or.kr/cms/resource/48/1614848_image3_1.jpg,129.4330268106,36.4820413681,6,20220627172723,22971,12,,경정해수욕장,36422,"번잡하지 않고 일상의 자연스러움과 활기를 맛볼 수 있는 곳이다. 물이 맑고 파도가 잔잔한것이 특징이며 해변의 남쪽은 바위지대이다. 이곳은 해삼, 전복, 멍게등을 양식하기 때문에 수영은 피하도록 해야한다. 바다에 바짝 붙은 길은 드라이브코스로 좋으며 어부들의 모습은 향수를 불러 일으킬 것이다. "
경상북도 영덕군 강구면 강구리 253-51,,35,0.0,A01,A0101,A01011400,988459,12,20100330033830,http://tong.visitkorea.or.kr/cms/resource/24/2648724_image2_1.jpg,http://tong.visitkorea.or.kr/cms/resource/24/2648724_image3_1.jpg,129.3900036722,36.3592989277,6,20220517134654,43647,12,,강구항,36459,"경상북도 영덕군에서 가장 큰 항구이자 대게로 유명한 곳이다. 11월부터 이듬해 45월까지의 대게 철에는 수많은 대게잡이 어선들이 이곳에 집결한다. 대게 위판장이 운영되며, 일명 대게 거리로 불리는 식당가가 3km에 이른다. 은어낚시로 이름난 영덕의 주요 하천 오십천(五十 川)이 강구항 남쪽을 통해 바다로 빠져나간다. '그대 그리고 나' 드라마가 촬영되었던 촬영지로 유명해지면서부터 사시사철 관광객들로 북적이는 관광명소가 되었다."
"경상북도 영덕군 강구면 영덕대게로 (55, 강구면노인회)",,35,0.0,B02,B0201,B02011000,969044,12,20100306015633,http://tong.visitkorea.or.kr/cms/resource/17/1801817_image2_1.jpg,http://tong.visitkorea.or.kr/cms/resource/17/1801817_image3_1.jpg,129.3847180103,36.3598515409,6,20220506132319,28199,12,054-730-6682,영덕대게마을,36454,"영덕 대게 마을은 예부터 학문과 예(禮)를 소중히 여기는 유서 깊은 선비의 고장으로서 경상북도 동해안에 위치하고 있으며, 거침없는 산세(山勢)와 동해가 이루어낸 천혜의 비경을 간직하고 있는 전형적인 어촌마을이다. 이 어촌마을은 고려 시대 태조 때부터 유명한 '영덕대게'의 본고장이자 동해안 최고의 관광명소인 강구항(江口港)을 따라 100여 개의 대게 상가가 밀집해 세계에서 가장 큰 규모의 대게 거리가 형성된 곳이기도 하다.
매년 11월부터 5월까지 7개월간 이어지는 대게 철이 돌아오면 이 마을에는 영덕대게를 맛보기 위해 몰려드는 국내국외 관광객들로 북적된다. 또한, 한국의 가장 아름다운 해안도로를 자랑하는 영덕군 해안도로의 출발점으로 곳곳에 형성된 바다 낚시터와 10여 개에 달하는 해수욕장, 수상레저장이 있어서 레저와 휴양까지 즐기기에 좋을 뿐만 아니라 어촌의 낭만과 다양한 문화를 체험할 수 있다."
경상북도 영덕군 영해면 예주8길 14-5,(영해면),35,0.0,A02,A0201,A02010700,252544,12,20071031090000,,,129.4135518574,36.5383818059,6,20220715152059,17991,12,,영해향교,36414,"1346년(충목왕 2)에 장서기(掌書記)·이천년(李天年)이 향중의 노소들과 협의하여 현재의 위치에 대성전과 동무(東廡)·서무(西廡)를 창건하고 영해향교라 하였다. 그 뒤 1529년(중종 24)에 부사 공서린(孔瑞麟)이 명륜당과 태화루(太和樓)를 건립하여, 현유(賢儒)의 위패를 봉안, 배향(配享)하고 지방민의 교육과 교화를 담당하였다. 1590년(선조 23)에 대대적으로 보수하였으며, 임진왜란 때 소실되었다가 1671년(현종 12)에 명륜당을 중수하고, 1706년(숙종 32)에 대대적으로 중건하였다. 1800년(순조 즉위년)에 향원(鄕員)과 유생들이 중수하고 1838년(헌종 4)에 다시 중수하였다. 1940년대 초에 영덕 군수 임경선(任景善)이 1군 1향교제에 따라 관내 영해향교를 철폐시키고 영덕향교에 통합하였다. 그 뒤 6·25전쟁으로 영덕향교가 소실되어 영해 주민들을 중심으로 향교 복설을 추진, 1979년에 대성전을 비롯한 건물을 중건하고 영해향교라 하였다. 조선시대에는 국가로부터 토지와 전적·노비 등을 지급받아 교관이 교생 70명을 가르쳤으나, 갑오경장 이후 신학제 실시에 따라 교육적 기능은 없어지고 봄·가을에 석전(釋奠：공자에게 지내는 제사)을 봉행하며 초하루·보름에 분향하고 있다. 현재 전교(典校) 1명과 장의(掌議) 수명이 운영을 담당하고 있다."
경상북도 영덕군 축산면 도곡리 산 20,,35,0.0,A02,A0201,A02010200,252545,12,20071031090000,,,129.4318980645,36.5180372527,6,20220608174515,20460,12,,영덕 대소산 봉수대,36421,"봉수대는 횃불과 연기를 이용하여 급한 소식을 전하던 옛날의 통신수단을 말하며, 높은 산에 올라가서 불을 피워 낮에는 연기로 밤에는 불빛으로 신호를 보냈다. 영덕 대소산 봉수대는 영덕 축산포 방면의 상황을 서울 남산까지 전하던 곳의 하나였다. 남쪽으로 별반 봉수대, 북으로 평해의 후리산 봉수대, 서로는 광산 봉수대를 거쳐 진보의 남각산 봉수대로 연락을 취하도록 되어있다. 산의 꼭대기에는 방어벽을 쌓고, 성 안에는 직경11m, 높이 3.5m로 봉돈(烽燉)을 쌓았다. 봉수대의 형태가 비교적 뚜렷하게 남아있어, 조선시대의 통신수단을 알아볼 수 있는 좋은 자료로 평가된다.   수량면적  2,826㎡"
경상북도 영덕군 축산면 도곡길 17-4,,35,0.0,A02,A0201,A02010400,252546,12,20071031090000,,,129.4091391964,36.510140489,6,20221115175812,19125,12,,무안박씨무의공파종택,36419,"가마골의 북방에 있는 야산을 뒤로 하고 들을 내려다 보는 위치에 지은 옛 집이다. 임진왜란 때 경주성 전투에서 공을 세운 무의공 박의장(1555∼1615)의 넷째 아들 박선이 큰형 박유를 위하여 지었다고 한다. 대문채, 정침, 내삼문, 사당으로 구성되어 있다. 정침은 ㅁ자형으로 앞면 10칸·옆면 7칸 규모이다. 안채는 지붕 옆면이 사람 인(人)자 모양인 간결한 맞배지붕집이고, 사랑채는 지붕 옆면이 여덟 팔(八)자 모양인 팔작지붕집이다. 정침의 오른쪽 뒤에는 박의장의 위패를 모시는 사당이 있다."
경상북도 영덕군 축산면,,35,0.0,A01,A0102,A01020200,129628,12,20070720090000,http://tong.visitkorea.or.kr/cms/resource/22/218722_image2_1.jpg,http://tong.visitkorea.or.kr/cms/resource/22/218722_image3_1.jpg,129.4418369728,36.4878186592,6,20210727005218,28706,12,,차유돔바위,36422,경북 영덕군 일대에는 유명한 낚시터들이 많고 그중에서 노물에서 경정 일대의 갯바위 구석구석은 낚시의 핵심 구간으로 잘 알려졌으며 동해안을 대표하는 감성돔 낚시터라고도 불릴 만큼 유명한 곳이다.그러나 경정리에 있는 차유마을 일대의 갯바위는 아직 잘 알려지지 않은 낚시 포인트가 대부분이라 갯바위의 처음 모습 그대로 잘 보존되어 있다. 차유 마을에서 북쪽으로 걸어가면 나오는 첫 번째 갯바위가 바로 차유 돔바위이다. 유명한 여서도 돔바위와 통영 국도 돔바위와 견주어도 모자라지 않을 만큼 차유돔 바위에서는 50cm가 넘는 큰 감성돔이 많이 잡혀 낚시꾼들을 놀라게 한다. 차유돔바위 외에도 차유 마을 일대의 다른 갯바위 곳곳에서도 감성돔이 많이 잡힌다. 비교적 잘 알려지지 않은 곳이라 붐비지 않아 한산하고 편안하게 낚시를 즐길 수 있는 것이 장점이다.
경상북도 영덕군 창수면 인량길 178,,35,0.0,A02,A0210,A02100700,129372,12,20061113090000,,,129.3713690739,36.5517572459,6,20220518151821,29042,12,,인량전통테마마을,36401,"350년400년 된 8성씨 12종가 한 농촌마을에 옹기종기 모여 살고 있는 전형적인 농촌한옥마을이다. '어질인 仁' '어질량 良'자로 어진이들이 많이 배출되었다 하여 불리우고 있는 ""인량리""는 다른 농촌마을에서는 잘 볼수 없는 자연과 한옥들이 잘 어우려진 마을이다. 또한 마을을 둘러싸고 있는 뒷산 형국이 한마리의 학이 날개를 펼쳐 감싸안고 있는 형상을 하고 있다 하여 비개동, 나래골, 익동으로 불리우다 현재는 나라골로 불리우고 있다. 인량리는 서고동저의 형태를 보이고 있고, 마을 앞으로 반변천이 흐르고 있어 동쪽으로 넓게 소규모의 평야를 형성하고 있다.특히 토질은 점토인 사질토의 양질이 대부분을 차지하고 있어 품질이 우수한 농작물이 생산된다. 또한, 풍수 지리적으로 인량리는 마을의 터가 명당으로 알려졌으며, 현재 여러 종가의 종택이 보전되어 내려오고 있다."
경상북도 영덕군 창수면 창수4길,,35,0.0,A01,A0101,A01010700,129190,12,20060731090000,http://tong.visitkorea.or.kr/cms/resource/19/2689619_image2_1.jpg,http://tong.visitkorea.or.kr/cms/resource/19/2689619_image3_1.jpg,129.2507832612,36.6201832385,6,20220530132108,18047,12,,창수전시림,36402,"치산녹화 1차 계획에 당시 조림권장 수종(가래나무외 13수종)을 영해영양간 918도로변(창수령) 일대에 구역면적 433ha 중 170ha를 시범 조림(19751981)하여 일대 임지를 기술적으로 더욱 알차게 보육 관리하고 각종사업지에 안내판을 설치하여 국유림 경영시범과 대국민홍보를 위한 종합적인 전시림교육장을 목적으로 조성하였다. 가래나무, 소나무, 리기테다, 잣나무, 아까시나무 등 총 14개 수종이 조림되어 있으며, 하늘 높이 뻗은 웅장한 나무들은 지나는 이들에게 인사를 할 듯이 일렬로 줄을 서 있다.  이곳을 지나면서 자연의 선물,  피톤치드가 발생되어  심신의 안정을 주는 산림욕을 즐길 수 있다. 또한 낯선 나무들의 이름들을 안내판을 보며 생소한 나무의 이름을 하나 하나 알아가는 재미와 숲에 관한 설명도 들으며 필요한 장비를 대여해 숲을 직접 가꾸어 보는 체험의 기회도 가져볼 수 있다. 창수령의 도로변 공한지에는 봄을 더욱 느끼게 하는 각종 야생화와 꽃들이 지나는 이들의 눈길을 사로잡아 발길을 유혹하고 있다.  뒤로는 창수령 고개의 깎아지른  경사지에  나무들이 병풍처럼 줄을 서 있으며 앞으로는 야생화와 꽃들이 활짝 피어 오고가는 이들에게 멋진 추억의 사진을 남길 것이다."
경상북도 영덕군 창수면 장육사길 363,,35,0.0,A02,A0201,A02010400,129010,12,20060619090000,,,129.32189431,36.5975288568,6,20220609140511,18745,12,,갈천동초가까치구멍집,36402,"까치구멍집은 화수루와 같은 시기에 지은 것으로 추정되는 초가집으로 건물관리를 하는 사람들이 살도록 지은 집이다. 강원도 산간 등지에서 볼 수 있는  열 손실을 최대로 줄이기 위한 겹집으로 지었으며, 방과 방이 붙어 평면이 田자 구조를 하고 있다. 까치구멍집이란 이름은 용마루 양쪽 끝 바로 아래에 취사와 난방시 나는 연기가 배출되도록 구멍이 나 있어서 붙은 이름이며, 정면 3칸, 측면 2칸으로 되어 있다.  대체로 산간지역에는 기온이 낮고 눈이 많기 때문에 집안을 하나의 닫힌 공간으로 꾸며서 열손실을 최소로 줄이고 동선을 짧게 하는 집구조가 발달했는데 그러한 모습은 강원도와 경북 산간에서 많이 볼 수 있다."
경상북도 영덕군 병곡면 고래불로,,35,0.0,A01,A0101,A01011200,129011,12,20060619090000,http://tong.visitkorea.or.kr/cms/resource/54/187354_image2_1.jpg,http://tong.visitkorea.or.kr/cms/resource/54/187354_image3_1.jpg,129.4233029061,36.5675870048,6,20220830095734,34737,12,,덕천해수욕장,36406,"일곱가지 보물을 간직한 칠보산 중턱길에서 보는 덕천해수욕장의 초록색 파도는 다른 곳에서는 볼 수 없는 소중한 경치다. 넉넉한 인심과 파란 하늘, 하얗게 펼쳐진 넓은 백사장, 파랗다 못해 초록색으로  빛나는 바다, 그리고 넉넉한 살을 자랑하는 영덕 대게를 모두 즐길 수 있는 곳이다. 이쪽의 덕천리 마을에서는 민박도 저렴하다."
경북 영덕군 영덕읍 창포리,산70 일원,35,0.0,A02,A0204,A02040400,128765,12,20060125090000,http://tong.visitkorea.or.kr/cms/resource/20/2043620_image2_1.jpg,http://tong.visitkorea.or.kr/cms/resource/20/2043620_image2_1.jpg,129.4167328924,36.4189260036,6,20211222011455,40411,12,,영덕풍력발전단지,"766-805,4","stong영덕의 떠오르는 일출 명소stong 
영덕풍력발전단지는 해안을 끼고 있어서 사계절 내내 바람이 많은 곳에 건설된 풍력발전단지로, 영덕의 유명 관광지인 해맞이공원 위쪽 언덕에 조성되어 있다. 영덕에서 일출을 보기 좋은 곳으로 보통 창포말 등대가 있는 해맞이 공원을 말하는데, 풍력발전단지 정상부에 있는 전망대도 이에 못지않다. 오히려 낯선 모습으로 서 있는 발전기와 함께 바라보는 일출은 이국적이다. 발전기의 최대 높이는 80m로, 위풍당당한 발전기들 앞에 서면 규모에 압도당한다. 파란하늘을 배경으로 서 있는 하얀 거인들을 멀리서 바라보면 누구라도 사진이 찍고 싶을 것이다."
경상북도 영덕군 영덕읍 창포리,,35,0.0,A02,A0206,A02060300,128718,12,20051227090000,http://tong.visitkorea.or.kr/cms/resource/02/1968202_image2_1.jpg,http://tong.visitkorea.or.kr/cms/resource/02/1968202_image3_1.jpg,129.4176132816,36.4219312349,6,20220517164729,22316,12,,영덕조각공원,36427,"영덕군민들의 체력단련과 휴식공간인 9,900㎡의 기존 레포츠공원에 영덕조각공원이 조성되었다. 이 조각공원은 국내.외 작은 조각공원과 달리 이 지방의 수려한 자연경관과 잘 어우러지는 문화공간으로 레포츠 기능과 동시에 예술적 체험을 제공하면서 여가 생활을 즐길 수 있는 특징과 기능성을 지니게 되었다. 자연, 인간, 꿈의 만남을 주제로 최만린, 박석원, 이종빈 등 국내 유수 조각가 10여 명이 창조한 조각들이 전시되어 있다."
경상북도 영덕군 영해면 성내리,,35,0.0,A02,A0205,A02050200,128719,12,20051227090000,,,129.40408348,36.5305963975,6,20220408165758,19759,12,,영해 3.1 의거탑,36409,"1918년 3월 18일 영해 장날, 독립만세 운동을 하다 숨져간 애국선열들의 숭고한 뜻과 넋을 기리고 후세들의 구국 정신 함양을 위한 교육장으로 활용하기 위해 1983년에 건립했다. 7번 국도를 따라가다 보면  영해면 소재지 입구 남·서편 방향에 순국선열들의 얼을 기리기 위해 건립된 3.1의거 탑이 있다. 이 탑은 1919년 3월 18일 (음력으로는 2월 19일) 장날에 영해를 중심으로  축산, 병곡, 창수면 수만 군중들이 일제에 항거하여 죽음을 무릅쓰고 독립만세를 외쳤던 의사, 열사들의 얼을 기리기 위하여 1983년 3월 기공식을 커져 1983년 11월 제막식을 거행하였으며 3월 1일 영해면 여러 선열의 애국정신을 기리기 위한 삼일절 행사가 거행된다."
경상북도 영덕군 창수면 장육사길 353,,35,0.0,A02,A0201,A02010700,128720,12,20051227090000,,,129.3220081939,36.5973566567,6,20220616153506,17872,12,,영덕 안동권씨 옥천재사,36402,"조선 단종의 외숙부인 권자신이 세조에게 화를 당하고, 그의 조카 권책이 유배되어 여생을 보낸 곳으로, 지어진 연대는 확실히 알지 못한다. 숙종 때 단종이 복위되자 대봉서원이 지어졌는데, 고종때 흥선대원군의 서원 철폐령으로 화수루와 청간정만 남았다. 화수루는 앞면 5칸·옆면 2칸의 규모의 누마루 집으로 양쪽 1칸씩은 방으로 꾸몄고 가운데 3칸만이 누마루로 되어있다. 지붕 옆면이 사람 인(人)자 모양인 맞배지붕집이다. 소박한 꾸밈새로 고건축물의 중후함이 엿보인다. 현재 주위는 민가와 경작지로 둘러싸여 있으며, 뒤쪽의 낮은 언덕에 오래된 무덤 1기가 있는데 이 누각에 딸린 것으로 보인다."
경상북도 영덕군 영해면 공수진길 73-1,,35,0.0,A02,A0203,A02030100,128608,12,20050926090000,http://tong.visitkorea.or.kr/cms/resource/10/575910_image2_1.jpg,http://tong.visitkorea.or.kr/cms/resource/10/575910_image3_1.jpg,129.4288442081,36.5634042544,6,20220613162635,27127,12,,대진1리 어촌체험마을,36417,"전국 최고의 수질을 자랑하는 대진해수욕장이 있는 대진1리는 2001년 해양수산부의 '어촌체험관광마을' 조성사업으로 이루어진 해양레포츠 등 기반시설을 겸비한 어촌마을이다. 백사장을 가로질러 흐르는 폭 200m의 송천천이 있어 담수욕도 즐길 수 있고, 소나무 군락을 형성한 해송림과 자연경관이 가히 장관이다. 특히, 송천천 제방 및 구로(10km)에는 갈대를 중심으로 부들, 물억새, 달뿌리풀, 붕어, 미꾸라지 등 민물낚시도 가능하다."
경상북도 영덕군 차유길 12-4,,35,0.0,B02,B0201,B02011000,127711,12,20040224090000,http://tong.visitkorea.or.kr/cms/resource/15/2014115_image2_1.jpg,http://tong.visitkorea.or.kr/cms/resource/15/2014115_image3_1.jpg,129.4438394978,36.4904128475,6,20220418172435,28815,12,,대게원조 차유어촌체험마을,36422,"어촌부락으로 죽도산이 보이는 이 곳 앞바다에서 잡은 게의 다리 모양이 대나무와 비슷하다고 하여 대게로 불리워왔다. 마을 내력을 따라 영덕대게원조마을로 명명되었으며 기념표식을 세웠다.『경정리 동명의 유래는 긴 모래불이 있으므로 뱃불 또는 경정이라 하였다. 경정 2리인 수구너미 마을은 11세기 중기(1060년경)에 영해 부사(寧海府使)가 마을을 순시하던 중 말을 타고 재를 넘으면서 이 마을의 형국을 보고 우마차(牛馬車) 길마 같이 생겼다고 하여 우차의 차(車)와 넘을 유(踰)자를 따서 차유(車踰)라 명명하였다 하며, 마을의 형성은 어느 때 누구에 의해서 되었는지 미상이다.  조선시대에는 영해부(寧海府) 남면(南面) 지역이었는데 갑오개혁(甲午改革) 뒤인 1895년(高宗 32년) 5월 26일 칙령(勅令) 제98호로 지방 관제 개정을 할 때 영해부가 영해군(寧海郡)이 되었는데, 이때 경정리는 영해군에 속했으며, 1914년 3월 1일 일제(日帝)는 부령(府令) 제111로 행정구역을 자의로 폐합할 때 오매동·차유동의 일부 지역을 병합하여 경정동이라 하고 영덕군 축산면에 편입되었으며, 그 뒤 1988년 5월 1일 군조례(郡條例) 제972호로 동(洞)을 리(里)로 개칭할 때 경정동은 경정리가 되어 오늘에 이르며, 현재 행정구역상 경정 1,2,3리로 분동되어 있다.  마 쪽 : 뱃불 남쪽에 있는 마을 수구너미(車踰洞) : 달부고개 너머에 있는 마을 오매(烏梅) : 뱃불 남쪽에 있는 마을"
경상북도 영덕군 창수면 장육사1길 172,,35,0.0,A02,A0201,A02010800,126187,12,20040210090000,http://tong.visitkorea.or.kr/cms/resource/24/201924_image2_1.jpg,http://tong.visitkorea.or.kr/cms/resource/24/201924_image3_1.jpg,129.3018349355,36.5987755505,6,20220722154821,28310,12,,장육사,36402,"장육사는 고려말 공민왕 때의 나옹선사가 1355년에 창건한 고찰로서 운서산 기슭에 자리잡고 있다. 대웅전은 조선 중기 때의 건물로 여겨지는데 정면 3칸, 측면 3칸의 맞배지붕집으로 벽에는 재미있는 벽화들이 많이 그려져 있다. 홍연암, 산신각, 흥원루, 요사채가 있다. 또 장육사에는 보물 건칠보살좌상 (조선 초기)이 모셔져있다. 이 건칠상이라는 것은 기본틀 위에 종이를 여러 겹 덧붙여 형태를 만들고 그 위에 다시 금물을 올린 불상이다. 주요문화재  대웅전(지방유형문화재), 건칠보살좌상(보물)"
경상북도 영덕군 병곡면 유금길 213-26,(병곡면),35,0.0,A02,A0201,A02010800,126188,12,20040210090000,http://tong.visitkorea.or.kr/cms/resource/68/183168_image2_1.jpg,http://tong.visitkorea.or.kr/cms/resource/68/183168_image3_1.jpg,129.366297271,36.6461325119,6,20220613165634,21527,12,,유금사(영덕),36403,"칠보산(해발 810m) 기슭에 자리 잡은 유금사는 신라 선덕여왕때 왕명에 따라 자장율사가 창건한 사찰이다. 조선 중기 이전까지는 대웅전, 종각, 장화부인 신령각 등을 갖추고 있었고, 승려도 수십명 기거했다. 그런데 어느날 주지가 불국사 법회를 마치고 돌아오는 도중에 절 앞 용소에서 두 마리 용이 교미하는 것을 보고  고약하게 여겼는데, 절에 도착하기도 전에 폭우가 쏟아져 산사태로 절이 무너졌다고 한다. 그 뒤 여러차례의 중창을 거쳐  현재에 이르렀다. 이 고장에서는 가장 오래된 고찰로서,  경내에는 3층석탑과 대웅전, 향로전, 산신각 등의건물이 있다."
