addr1,addr2,areacode,booktour,cat1,cat2,cat3,contentid,contenttypeid,createdtime,firstimage,firstimage2,mapx,mapy,mlevel,modifiedtime,readcount,sigungucode,tel,title,zipcode,overview
경상북도 영덕군 남정면 장사리 1-1,,35,,A01,A0101,A01011200,2912266,12,20221118105930,http://tong.visitkorea.or.kr/cms/resource/55/2912255_image2_1.jpg,http://tong.visitkorea.or.kr/cms/resource/55/2912255_image3_1.jpg,129.3744793209,36.2891315923,6,20221118110003,0,12,,부흥해변,36463,"부흥해변은 경상북도 영덕군 남정면 장사리에 있다. 주변에 서핑 관련 상점이 들어서면서 서핑을 즐기고자 이곳을 찾는 사람이 많다. 서핑뿐만 아니라 여름 휴가지로도 손색이 없고, 특히 당일 캠핑을 만끽하기 좋다는 소문에 캠퍼들의 방문도 줄을 잇는다. 영덕IC에서 가깝고, 주변에 장사해수욕장과 장사상륙작전 전승기념관이 있어 연계 여행에 나서기 수월하다."
경상북도 영덕군 축산면 축산항길 90,,35,0.0,A02,A0205,A02050600,2782863,12,20211129231857,http://tong.visitkorea.or.kr/cms/resource/92/2794592_image2_1.jpg,http://tong.visitkorea.or.kr/cms/resource/92/2794592_image2_1.jpg,129.4508633403,36.5085248126,6,20211214030706,2,12,,죽도산전망대,36421,"죽도산 전망대는 영덕의 걷고 싶은 길인 블루로드 중 B 코스인 푸른 대게의 길에서 만날 수 있다. 내비게이션에는 축산등대라고 검색하면 찾을 수 있다. 길이 좁아 차량 통행 금지 지역으로 조금은 걸어서 올라가야 한다. 7층 건물로 1층은 로비, 6층은 기계실, 2층과 5층은 전망대 그리고 7층은 등대로 운영 중이다.  5층 전망대에서는 축산항을 중심으로 펼쳐지는 영덕의 모습을 360도로 둘러볼 수 있다. 한쪽에는 망원경도 설치되어 있다.  2층은 야외전망대로 간단한 스낵과 음료를 판매하고 있다."
경상북도 영덕군 영덕읍 해맞이길 254-70,,35,0.0,A02,A0202,A02020100,2782636,12,20211129194149,http://tong.visitkorea.or.kr/cms/resource/99/2795399_image2_1.jpg,http://tong.visitkorea.or.kr/cms/resource/99/2795399_image2_1.jpg,129.4190743615,36.4186233054,6,20220506131635,0,12,,산림생태문화공원,36425,"영덕 풍력발전단지 내에 위치한 산림생태문화공원은 울창한 숲길 너머 풍력발전기가 쉴 새 없이 돌아가는 풍경이 이채롭다. 이곳은 1997년 대형 산불이 일어났던 장소를 7년 동안 복원하여 생태 근린공원으로 조성했다. 지금은 산불이 났던 곳이라고는 믿기지 않을 만큼 짙푸른 자연을 만날 수 있다. 산책로 대부분 완만한 평지여서 누구든 부담 없이 걷기 좋고 한여름에도 시원한 바람이 분다. 공원 초입에 자리한 연못에는 연을 심어 한여름이면 고혹적인 자태의 연꽃도 감상할 수 있다. 연못 주변으로는 걸음을 쉬어갈 수 있는 나무 의자들이 자리하는데, 영덕의 상징인 게 모양으로 디자인한 것이 눈길을 끈다. 빨간색 게 모양 의자 너머로 나무와 연못, 하늘과 풍력발전기가 어우러진 풍경이 절로 감탄을 자아낸다."
경상북도 영덕군 영해면 영덕대게로 2740,,35,0.0,A01,A0101,A01011400,2773405,12,20211111195136,,,129.4325162538,36.5584243366,6,20211124222434,1,12,,대진항 (영덕),36417,"대진항은 경상북도 영덕군 영해면 대진리에 위치해 있는 항구로  1971년 12월 국가어항으로 지정된 이후 항구의 정취를 감상하려는 관광객의 방문이 많은 곳이다. 항구에 정박한 어선과 등대를 배경으로 사진을 찍는 사람이 많다. 항구는 낚시를 즐기는 사람들 사이에서도 유명한 곳으로 방파제나 갯바위에서 미끼를 던지면 감성돔, 노래미, 붕장어가 올라온다. 대진항에서 북쪽으로 가면 고래불해수욕장이 있고, 남쪽 방향에는 경정 해변이 나온다. 바다를 배경으로 천천히 산책을 하기에도 좋다"
경상북도 영덕군 지품면 오천길 45-13,,35,0.0,A02,A0202,A02020100,2762547,12,20211026194906,,,129.32791275,36.4256013125,6,20221122182942,0,12,,오천솔밭유원지,36446,"오천솔밭유원지는 경북 영덕군 지품면에 자리 잡고 있다. 차박이나 노지 캠핑을 즐기는 캠퍼들 사이에서 유명한 공간이었다. 하지만 2021년 9월 현재 캠핑장이 조성되어 무료 캠핑을 불가능하다. 소나무 숲을 비롯해 캠핑장, 화장실, 개수대 등이 갖쳐줘 있다. 영덕역과 영덕IC에서 가깝고, 인근에 영덕 복숭아 정보화 마을이 있다."
경상북도 영덕군 병곡면 고래불로 330,,35,0.0,A01,A0101,A01011200,2756138,12,20211013191528,,,129.4091839521,36.5929893951,6,20220622150920,0,12,,영리해수욕장,36404,"영리해수욕장은 경북 영덕군 병곡면에 자리 잡고 있다. 백사장 모래가 곱고, 수심이 얕은 것이 특징이다.
대규모 주차장을 비롯해 화장실, 샤워장, 해안 산책로, 소나무숲 등이 갖춰져 있다.
도보로 이동이 가능한 거리에 고래불해수욕장과 병곡방파제가 있다. 남쪽 방향으로 내려가면 덕천해수욕장, 대진해수욕장, 대진항 등이 있다."
경상북도 영덕군 강구면 강구해안길 195-2,,35,0.0,A01,A0101,A01011200,2756132,12,20211013191328,,,129.384773571,36.3595099143,6,20220623165455,0,12,,오포해수욕장,36459,"오포해수욕장은 경북 영덕군 강구면에 자리 잡고 있다. 1997년 MBC 드라마 '그대 그리고 나'의 촬영지로 유명하다.
해수욕장이지만 여름철 피서지보다는 낚시 명소로 이름 높다. 이곳을 방문한 낚시객들은 하얀 등대 주변과 백사장에서 낚시를 즐긴다. 
영덕IC와 강구역에서 가깝고, 주변에 강구항을 비롯해  강구항영덕대게거리, 해파랑공원이 있다."
경상북도 영덕군 축산면 영덕대게로 1735,,35,0.0,A01,A0101,A01011400,2756064,12,20211013183332,,,129.4258691115,36.481946796,6,20211105234222,0,12,,경정항,36422,"경정항은 경북 영덕군 축산면에 자리 잡은 어항이다. 1972년 지방어항으로 지정되었으며, 동방파제, 남방파제, 물양장, 선양장이 갖춰져 있다.
방파제에서 낚시를 할 수 있으며, 낚시 어선을 타고 연안으로 나갈 수도 있다. 주요 어종은 가자미, 오징어, 꽁치 등이다.
주변에 낚시 용품점을 비롯해 숙박업소, 음식점 등의 편의시설이 있으며, 관광지로는 경정 해변이 있다."
경상북도 영덕군 남정면 동해대로 3560,,35,0.0,A02,A0202,A02020100,2732159,12,20210809195332,,,129.3789819656,36.2801354767,6,20221103145339,0,12,,장사상륙작전 전승기념공원,36463,"장사상륙작전 전승기념공원은 한국전쟁 당시 장사상륙작전에 참전한 학도병들의 넋을 기리고자 건립됐다. 공원은 장사상륙작전 기념관과 장사해수욕장 사이에 있다. 이 때문에 공원과 해수욕장의 풍경을 동시에 조망할 수 있다. 모래사장 위에는 학도병들의 상륙 모습을 담은 조형물이 있다. 10인의 학도병을 형상화한 조형물은 바다에서 육지로 돌진하는 실감 나는 모습이다. 공원 중앙에는 솔숲을 배경으로 장사상륙작전 전몰 용사 위령탑이 있다. 위령탑 뒤편엔 장사상륙작전에 참전한 학도병들의 이름이 빼곡하게 적혀 있다.자가용을 이용하는 관광객은 장사상륙작전 기념관 주차장에 주차할 수 있다. 대형 주차장이라 주차에 어려움이 없으며, 주차장과 공원의 거리는 약 100m다."
경북 영덕군 달산면 옥산리 515,,35,0.0,A01,A0101,A01010500,2715732,12,20210510232815,http://tong.visitkorea.or.kr/cms/resource/27/2715727_image2_1.jpg,http://tong.visitkorea.or.kr/cms/resource/27/2715727_image2_1.jpg,129.2764167274,36.3501977802,6,20220429151101,0,12,,산성계곡 생태공원,,산성계곡 생태공원은 팔각산 인근의 산성계곡과 옥계계곡이 만나는 지점에 조성되어 수려한 자연경관과 체험시설인 어드벤처 시설을 접목한 가족 모두가 함게 즐길 수 있는 공원으로 산성계곡 생태공원은 자연적으로 조성된 숲과 버려진 농지를 자연친화적으로 복원한 시설이다. 원내에서는 가벼운 산책을 하거나 어드벤처 시설을 이용해 다양한 체험을 즐길 수 있다. 산성계곡 생태공원에 설치한 네트어드벤처 시설은 안전장비를 착용하고 체험해야 하는 기존의 시설과는 달리 맨몸으로 체험할 수 있어 더더욱 다이나믹하게 즐길 수 있다는 것이 특징이다.
경상북도 영덕군 영해면,,35,0.0,A01,A0101,A01010500,2661431,12,20200629233713,http://tong.visitkorea.or.kr/cms/resource/28/2661428_image2_1.jpg,http://tong.visitkorea.or.kr/cms/resource/28/2661428_image2_1.jpg,129.3841769119,36.5303349319,6,20220217103859,3,12,,벌영리 메타세콰이어길,36408,"벌영리 메타세콰이어 숲길은 개인이 정성스레 심어 기른 메타세콰이어가 아담한 숲을 이룬다. 입구부터 쭉쭉 뻗은 나무를 바라보면, 모든 일이 잘 풀릴 것 같은 기분이 든다. 측백나무와 편백의 향기는 그 느낌을 더욱 배로 만든다. 일반인에게 무료로 개방하고 있어 삼림욕을 즐기며 휴식을 취하기에 매우 좋다."
경상북도 영덕군 창수면 장육사1길 203,,35,0.0,A02,A0203,A02030600,2660968,12,20200625000309,,,129.2991491051,36.5973201084,6,20220518174502,0,12,,인문힐링센터여명,36402,"인문 힐링센터 여명은 영덕의 천혜의 자연속에 조성된 한옥시설로 웰니스 관광객 유치와 힐링, 명상, 명소가 되기 위해 조성된 곳이다. 스트레스가 많은 현대사회 인의 마음단련과 명상, 기체조, 건강 음식체험 등 마음 치유에 필요한 프로그램들로 구성되어 있다. 웰니스 관광 수요 증가에 맞춰 각 분야의 전문가들이 체계적인 프로그램을 통하여 건강한 몸과 마음을 지속할 수 있도록 도와준다."
경상북도 영덕군 강구면 금진리,,35,0.0,A01,A0101,A01010500,2616062,12,20190820013746,,,129.4003273021,36.3749390171,6,20220225133438,0,12,,영덕 해안도로 드라이브,36453,"영덕 해안도로는 영덕대게로라고도 불리고 있으며, 강구항축산항고래불해수욕장에 이르는 약 33km의 도로 구간이다. 영덕 해안도로는 옆쪽으로 동해의 푸른 바다가 끝없이 펼쳐져 드라이브를 하며 감상할 수가 있다. 영덕 해안도로가 시작되는 강구항은 대게로 유명하며, 해안도로 중간에는 영덕 해맞이공원이 있어 같이 연계하여 관광하기 좋다. 강구항에서 축산항까지의 도로 구간을 영덕 사람들은 별도로 강축해안도로라고 부르고 있다. 축산항의 해안도로 옆으로는 기암절벽과 바다가 어울려 펼쳐지기 때문에 강구항과는 또 다른 아름다운 풍경을 자아낸다. 해안도로의 끝은 고래가 하얀 분수를 뿜으며 놀았다고 전해지는 고래불해수욕장이다."
경상북도 영덕군 강구면 영덕대게로 132,,35,0.0,A02,A0202,A02020700,2616061,12,20190820013443,,,129.3926700578,36.3608543575,6,20220412143501,0,12,,해파랑공원,36454,영덕 강구항에 위치한 해파랑공원은 영덕대게축제 등 넓은 공간이 필요한 다양한 행사를 진행하기 위한 장소 조성과 함께 시민과 관광객들에게 휴식 공간을 제공하기 위해 만든 공원이다. 해파랑공원 옆에는 대게거리가 있고 공원에서 바닷길을 따라 영덕 블루로드길을 걸을 수 있는 산책로가 있어 식사 후 동해안의 눈부신 바다를 보며 산책하기에 알맞다.
경상북도 영덕군 창수면 인량길 178,,35,0.0,A02,A0203,A02030600,2616058,12,20190820012245,,,129.3713135087,36.5522571878,6,20220408143803,0,12,,나라골보리말체험학교,36401,"인량전통테마마을 내에 위치한 나라골보리말체험학교는 마을이 2004년 농촌전통테마마을로 선정된 후 2005년에 폐교된 인량초등학교를 주민들이 자부담하여 구입 후 행정 지원을 받아 콘도형 시설로 리모델링 하였다. 체험학교에서는 주로 보리수확, 보리짚공예, 보리방앗간 등의 체험이 가능하며 그 밖에 문화유산탐방, 동해안해맞이, 마당놀이체험 등이 있다."
경상북도 영덕군 병곡면 백석리,,35,0.0,A01,A0102,A01020200,2614555,12,20190808011844,http://tong.visitkorea.or.kr/cms/resource/51/2614551_image2_1.bmp,http://tong.visitkorea.or.kr/cms/resource/51/2614551_image2_1.bmp,129.405255752,36.618816934,6,20221206110120,0,12,,철암산 화석산지 (경북 동해안 국가지질공원),36403,"철암산의 5.5km 등산로 코스는 우리나라에서는 드물게 약 2300만 년 전(신생대)의 굴, 가리비 화석이 잘 발견된다는 점 때문에 화석 등산로라 불리며, 체험학습의 장으로 활용하고 있다. 철암산을 이루고 있는 암석은 큰 자갈들이 박힌 암석인 역암이다. 화석들은 주로 이 역암에 분포하는데 특히 범바위와 솥바위 주변에서 가장 명확하게 나타난다. 철암산에서 관찰되는 화석은 생물체의 잔해가 묻힐 때 껍데기와 같은 단단한 부분에 찍혀 오목하게 남은 모양이나, 반대로 오목한 부분을 채운 볼록한 모양으로 발견된다.  산 정상에 얹혀 있는 거대한 둥근 바위인 솥바위는 과거 암석층이 땅속 깊은 곳에서 둥근 덩어리로 나뉘어 부서진 이후, 주변을 둘러싼 흙이 제거되며 지표에 드러나게 된 것이다. 뿐만 아니라 솥바위가 바다생물의 화석을 포함하고 있다는 점을 볼 때, 이 바위는 과거 동해 바다 속에 있었다가 오랜 시간을 거쳐 솟아올라 마침내는 산꼭대기까지 올라가게 되었다는 사실을 알 수 있다. 화석산지 곳곳에서는 역암에 박혀있던 자갈이나 화석이 빠져나가고 남은 구멍이 비바람에 깎여나가면서 크기가 커지고, 그 커진 구멍들이 모인 지형인 타포니를 관찰할 수 있다.   역암: 2 mm 보다 큰 크기의 자갈이 쌓여 만들어진 암석"
경상북도 영덕군 축산면 축산항길 86-1,,35,0.0,A01,A0101,A01010500,2614549,12,20190808011123,http://tong.visitkorea.or.kr/cms/resource/43/2614543_image2_1.bmp,http://tong.visitkorea.or.kr/cms/resource/43/2614543_image2_1.bmp,129.4504939211,36.5087719999,6,20221208163622,0,12,,죽도산 퇴적암 (경북 동해안 국가지질공원),36421,"죽도산은 조선시대까지만 해도 육지와 동떨어져 있는 섬이었으며, 섬이 거의 발달하지 않는 동해안에서 특별한 의미를 지녀왔다. 이러한 죽도산은 시간이 지남에 따라 모래둔덕이 점점 쌓이면서 육지와 연결된 육계도가 되었다. 특히 강 하구의 모래가 쌓여 만들어진 육계사주는 우리나라에서 흔하지 않은 지형으로, 비록 일제의 매립공사에 의해 원형이 파괴되었으나 생성 당시의 전체적인 형태는 보존되어있다.
죽도산은 과거의 모래와 진흙, 자갈로 만들어진 암석으로 되어 있어 퇴적암과의 관련이 매우 깊은 곳이다. 죽도산 둘레를 따라 이어진 해안산책로에는 퇴적암 해안이 잘 발달해 있고, 해안산책로 앞 강 하구에서는 강물을 타고 내려온 모래와 자갈이 펼쳐져 있다. 따라서 퇴적암의 시작인 모래, 자갈에서부터 온전한 퇴적암, 시간이 지나 깎여 나가거나 갈라져 나가는 퇴적암까지 다양한 퇴적암의 양상을 관찰하기에 최적의 장소이다.
 육계도: 육지와 모래로 이어진 섬
 육계사주: 육지와 육계도를 잇는 모래둔덕
 퇴적암: 암석 또는 생물 조각이 쌓여 눌리고 다져져 만들어진 암석"
경상북도 영덕군 영해면 영덕대게로 2660,,35,0.0,A01,A0101,A01010500,2614541,12,20190808010238,http://tong.visitkorea.or.kr/cms/resource/36/2614536_image2_1.bmp,http://tong.visitkorea.or.kr/cms/resource/36/2614536_image2_1.bmp,129.4367632131,36.554658181,6,20221208163705,0,12,,원생대 변성암 (경북 동해안 국가지질공원),36417,"건물을 지을 때 건물을 받치기 위해 땅 위에 기초를 세우듯이 한반도도 기초가 되는 지층들 위로 여러 암석들이 쌓이면서 하나의 땅이 되었다. 이런 기초가 되는 지층의 덩어리를 육괴라고 부르는데, 한반도에는 낭림육괴, 경기육괴, 영남육괴가 존재하며 이러한 육괴는 한반도에서 가장 오래된 지층들이다. 이곳은 영덕지역에서 유일하게 영남육괴의 일부분인, 편마암이 동해 바다에 의해 깎여 드러나 있다.  편마암은 지하 깊은 곳에서 아주 높은 열과 압력을 받아 변형되어 만들어진 암석으로 줄무늬(얼룩말 무늬) 구조가 잘 발달한다. 이 줄무늬 구조는 높은 열로 인해 원래 암석을 구성하고 있던 흰 광물과 검은 광물이 서로 분리되고, 동시에 강한 압력에 의해 눌리면서 만들어졌다. 이곳에서 관찰되는 줄무늬는 복잡하게 휘어져 있는데 이는 지하 깊이 뜨거운 곳에서 지표보다 무른 상태로 존재하던 편마암이 여러 방향으로 눌리면서 휘어진 것이다. 또한 해안에서 관찰되는 편마암에서는 마치 칼로 흠집을 낸 것처럼 줄무늬 중 흰색 부분만 도드라져 보이며, 이는 편마암의 검은 부분이 덜 단단하기 때문에 파도에 의해 더 쉽게 깎여 나가면서 형성된 것이다.   편마암: 땅속 깊은 곳에서 아주 높은 열과 압력을 받아 변형된 암석"
경상북도 영덕군 영덕읍 창포리,,35,0.0,A01,A0101,A01011100,2614528,12,20190808004143,http://tong.visitkorea.or.kr/cms/resource/23/2614523_image2_1.bmp,http://tong.visitkorea.or.kr/cms/resource/23/2614523_image2_1.bmp,129.434656132,36.425045099,6,20221208163754,0,12,,영덕 화강섬록암 해안 (경북 동해안 국가지질공원),36425,"이곳은 선명하고 멋진 일출로 매년 수많은 관광객이 찾아오는 동해안의 대표적인 일출 명소이다. 영덕 화강섬록암 해안에는 동해 바닷물에 의해 지속적으로 깎여 생긴 다양한 침식지형이 발달해 있다. 바닷가의 낭떠러지인 해식애, 바닷물에 의해 평평하게 깎인 땅인 파식대지, 그리고 서로 부딪혀서 둥글게 된 돌들이 모인 몽돌해변과 같은 경관은 이곳의 암석이 땅 위에 드러난 이후부터 오랜 시간 동안 파도에 의해 만들어졌으며, 이러한 과정은 현재에도 계속 진행 중이다. 이곳의 흰 암석은 약 2억 년 전(중생대)에 땅 속 깊은 곳에서 마그마가 굳어져만들어진 화강섬록암이다. 이 화강섬록암에서 관찰되는 크고 작은 얼룩(포유암)은 오래 전 땅 속에서 화강섬록암의 마그마에 반쯤 섞인 검은 마그마로, 물에 섞인 기름방울처럼 대부분 둥근 모양을 가지고 있다. 이곳의 한 바위 면에는 손등이 보이게 새끼손가락을 편 왼손 주먹모양의 약속바위가 있다. 약속바위는 바위 면에 볼록하게 조각된 듯한 형태를 보이고 있는데 이는 오랜 시간에 걸쳐 바위가 힘을 받아 갈라지면서 자연적으로 만들어진 것이다.
 화강섬록암: 화강암과 섬록암의 중간 정도 화학성분을 가진 암석
 포유암: 마그마가 굳어 만들어진 암석 안에 포함된 다른 성분의 물질"
경상북도 영덕군 영해면 사진리,,35,0.0,A01,A0101,A01011100,2614522,12,20190808002942,http://tong.visitkorea.or.kr/cms/resource/17/2614517_image2_1.bmp,http://tong.visitkorea.or.kr/cms/resource/17/2614517_image2_1.bmp,129.4438414174,36.5192984517,6,20221208163722,0,12,,영덕 대부정합 (경북 동해안 국가지질공원),36417,"부정합은 서로 나이 차이가 크게 나는 암층이 맞닿아 있는 구조를 의미하며, 지구의 역사를 해석하는데 핵심적인 역할을 한다. 이곳에는 각각 약 17억 년의 시간 차이를 가지는 부정합이 존재한다. 한반도는 여러 조각의 땅덩어리가 이동하다 충돌하여 만들어졌고, 가장 마지막 땅덩어리가 충돌한 시기가 약 2억 3천만 년 전 인 것으로 알려져 있다. 따라서 이 부정합의 한쪽 암층인 편암층은 한반도가 존재하지도 않았던 시기에 만들어져 있었고, 다른 한쪽 암층인 역암층은 한반도가 형태를 갖춘 이후에 쌓인 것으로, 매우 큰 시간 차이를 보인다고 볼 수 있다.
 편암: 편마암보다 낮은 열과 압력을 받아 만들어진 암석
 역암: 2 mm 보다 큰 크기의 자갈이 쌓여 만들어진 암석"
경상북도 영덕군 병곡면 병곡리,,35,0.0,A01,A0101,A01011200,2614464,12,20190807224530,http://tong.visitkorea.or.kr/cms/resource/59/2614459_image2_1.bmp,http://tong.visitkorea.or.kr/cms/resource/59/2614459_image2_1.bmp,129.4109336045,36.5994609142,6,20221208163740,0,12,,고래불 해안 (경북 동해안 국가지질공원),36404,"고래불 해안은 길이가 약 4.6km, 폭은 30100m에 달하여, 오목하고 길쭉한 초승달모양의 해빈으로 경북 동해안에서 가장 큰 규모를 보인다. 고래불이라는 이름은 고려 말 학자 이색이 동해 바다에서 고래가 하얀 분수를 뿜으며 노는 것을 보고 고래가 노는 불이라 한 데에서 유래하였다.  고래불 해안을 따라 분포하는 염습지와 해안사구는 지형학적, 생물학적으로 높은 가치를 지닌다. 염습지는 바닷물과 강물이 만나 섞여서 염도 변화가 큰 습지를 말하는데, 이곳에서는 바다나 육지에서 보기 힘든 식물들이 많이 자라며 조류, 어류 등 다양한 생물들의 산란지가 된다. 고래불 해안에는 육지 쪽에 모래가 언덕모양으로 쌓인 지형인 해안사구 또한 대규모로 발달하고 있는데, 이 해안사구는 해안선을 보호하는 자연제방 역할을 하며. 사구에 저장된 지하수는 해수의 침입으로부터 육지를 보호하고 사구 식물의 성장을 돕는다.   불 : 영덕지역 방언으로 모래해안을 뜻 함"
경상북도 영덕군 축산면 경정리,,35,0.0,A01,A0101,A01010500,2614455,12,20190807223156,,,129.4418758582,36.4878492121,6,20221208163642,0,12,,경정리 백악기 퇴적암 (경북 동해안 국가지질공원),36422,"차유마을과 경정마을 사이의 해안가에는 약 1억 년 된 백악기의 이암과 사암이 파식대지를 이루고 있으며, 붉은 이암이 동해바다 앞에 펼쳐진 흔하지 않은 풍경을 볼 수 있다. 차유마을 쪽에서는 붉은 이암이 관찰되고, 경정마을 쪽에서는 붉은 이암과 흰 사암이 함께 펼쳐져 있다. 보통 얕은 바다 속에서 만들어지는 파식대지가 해수면 위에 있다는 점을 통해 동해안 지역의 땅이 솟아올랐다는 것을 알 수 있다.
붉은 이암과 흰 사암이 편평하게 펼쳐져 있는 것은 이 암석들의 알갱이들이 편평하게 쌓여있는 것에 영향을 받았기 때문이다. 북쪽의 차유마을 해안가에서는 과거 강이 흘렀던 흔적과 조개가 굴을 파고 들어간 흔적이 나타난다. 남쪽의 경정마을 해안가에 분포하는 사암층에는 사암을 이루는 모래 알갱이 크기가 위로 갈수록 점점 작아지는 점이층리가 있으며 사암층에 포함된 석회암 조각에서는 과거에 살았던 생물의 일부분을 발견할 수 있다.
 파식대지: 파도에 의해 깎여 해저에 생긴 평탄면
 이암: 116 mm 보다 작은 크기의 진흙이 쌓여 만들어진 암석
 사암: 1162 mm 크기의 모래가 쌓여 만들어진 암석"
경상북도 영덕군 병곡면 원황길 110-14,,35,0.0,A02,A0201,A02010700,1959069,12,20141022234214,,,129.3898946702,36.5701166257,6,20210914025208,2196,12,,운산서원,36405,"1812년(순조 12)에 지방유림의 공의로 백문보(白文寶)와 백현룡(白見龍)의 학문과 덕행을 추모하기 위하여 창건하여 위패를 모셨다. 당시의 경내건물로는 경덕사(景德祠)·운산당(雲山堂)·신문(神門)·직방재(直方齋)·박약재(博約齋)·입도문(入道門)·전사청(典祀廳)·주소(厨所) 등이 있었다. 선현배향과 지방교육의 일익을 담당하여 오던 중 대원군의 서원철폐령으로 1868년(고종 5)에 훼철되었으며, 지금은 운산서당(雲山書堂)으로 개편되었다. 운산서원의 강당이 2005년 6월 경상북도 문화재자료로 지정된 바 있다."
경상북도 영덕군 병곡면 거무역2길 22,(병곡면),35,0.0,A02,A0201,A02010700,1959065,12,20141022233624,,,129.396710284,36.5852650327,6,20220420130537,2565,12,,운계서원(영덕),36405,"1824년(순조 24년) 창건했다. 대원군의 서원철폐령에 의거 1868년(고종 5년) 철폐하였고, 1887년 후손 박내덕 박동진 재실로 건립하여 추원재라 칭하였다. 1987년 丁卯 거무역리에 중건하며 봉송정을 같이 중건하였다."
