addr1,addr2,areacode,booktour,cat1,cat2,cat3,contentid,contenttypeid,createdtime,firstimage,firstimage2,mapx,mapy,mlevel,modifiedtime,readcount,sigungucode,tel,title,zipcode,overview
경상북도 영천시 화북면 별빛로 122,(화북면),35,0.0,A02,A0201,A02010700,126935,12,20040218090000,http://tong.visitkorea.or.kr/cms/resource/05/2005705_image2_1.jpg,http://tong.visitkorea.or.kr/cms/resource/05/2005705_image3_1.jpg,128.948041373,36.1146682758,6.0,20220527113006,18148,15,,옥간정,38813.0,"이 건물은 조선 숙종때 성리학자이신 훈수 정만양선생과 지수 정규양 선생 형제가 후학을 양성하기 위하여 세운 정자이다. (숙종 42년, 1716년) 훈수와 지수 형제는 임진왜란 때 선비의 몸으로 의병을 일으키신 호수 정세아 장군의 5세손이다. 양수선생(훈수,지수를 일컬음)은 형제가 한 곳에서 학문연구에 힘쓰면서 육유재와 태고와(후에 모고와로 고침)를 지을때 정각선에 살던 승려한테 어린 향나무 두 그루를 얻어 그중 한그루를 태고와에 심었는데 오늘날까지 자라고 있다. 이곳에 있는 나무 한 그루 돌 하나에도 양수선생의 의지를 담아 이름을 붙이기 시작했다. ""횡계구곡""이 바로 그것이다.  시전에 나오는 ""맏형은 흙으로 만든 나팔을 불고 동생은 대나무로 만든 피리를 분다""에서 나온 ""훈수""로 형제간의 우의를 표상하여 두 분 선생의 저술을 ""훈지록""이라 한다. 양수선생의 우애와 굳은 의지는 자손의 이름도 ""훈지"" 두 글자의 변과 머리를 따서 짓도록 유언하여 지금까지 시행되고 있는 것에서 엿볼 수 있다.   양수 선생은 나라의 기둥을 길러내기 위해, 1716년 봄에 옥간정을 짓고, 가을에 진수재를 횡계리에 지어 1720년 2월부터 매달 강의를 실시하니, 향내의 제자가 100여 명에 이른다. 그 제자 중에서 매산 정중기, 풍원부원군 조현명, 명고 정간, 이유, 신준 등 수많은 명현달사를 배출하였으며 나라에서 몇 차례 관직을 제수하였으나 끝까지 사양하고, 이곳에서 은거하여 살았다. 훌륭한 스승에 현명한 제자, 아름다운 산수가 한데 어울려 자그마한 산골 횡계마을은 교육의 전당으로 전국에 알려지게 되었다. 이 정자는 정면 3칸, 측면 4칸 반의 ""ㄱ""자형 누각 건물로 창호 구성방법 등 특징을 잘 간직하고 있는 건물이다."
경상북도 영천시 임고면 우항리 1044-5,,35,0.0,A02,A0205,A02050200,127248,12,20040211090000,,,128.9855022782,36.0061979371,6.0,20220608151907,18304,15,,포은정몽주유허비,38819.0,"유허비란 한 인물의 옛 자취를 밝혀 후세에 알리고자 세우는 비로, 이 비는 포은 정몽주 선생의 효행을 기리고 있다.정몽주 선생은 고려 후기의 문신이자 학자이며 삼은(三隱)의 한사람이다. 공민왕 5년(1355) 부친상을 당하여 묘 곁에서 3년상을 치르고, 그후 공민왕 14년(1365) 모친상까지 당하여 역시 3년상을 지내였다. 이토록 지극하였던 그의 효성이 조정에 보고 되자, 출생지인 이곳 우항리 마을에 비를 세워두도록 하였다.비는 반듯하고 널찍한 사각받침돌 위에 비몸을 세운 모습이다. 앞면에는 효행을 행한 마을이라는 뜻의 효자리(孝子里)라는 글귀를 세로로 큼직하게 새겼다. 공양왕 원년(1389)에 세운 것으로, 그후 잃어버렸던 것을 조선 성종 18년(1487) 땅속에서 찾아내어 비각을 세워 모시고 있다."
경상북도 영천시 화북면 정각길 475,,35,0.0,A02,A0202,A02020600,127293,12,20031113090000,http://tong.visitkorea.or.kr/cms/resource/42/1614942_image2_1.jpg,http://tong.visitkorea.or.kr/cms/resource/42/1614942_image3_1.jpg,128.9769096287,36.1643492953,6.0,20211125203616,58437,15,,보현산 천문대,38812.0,"보현산(1,124m)은 경북 대구와 포항 사이에 있는 영천시의 진산이나 다름없다. 이곳 정상에는 누구나 쉽게 들러볼 수 있는 보현산 천문대가 서 있다.  한국천문연구원 소속으로 충북 단양의 소백산천문대,대전의 대덕 전파천문대와 함께 우리나라 3대 천문관측소 중 하나다. 천체에 대한 관심을 가진 이들에게는 더없이 좋은 볼거리를 제공하는  나들이 명소로 한번쯤 찾아볼 만하다.  천문전시관과 대형 광학망원경 주위로 동쪽 멀리는 포항 앞바다가 보이고 서쪽으로는 대구 팔공산과 군위 일원의 산군들, 그리고 남쪽으로는 영천 기룡산과 북쪽의 청송,  안동 등 경북 내륙의 상쾌한 산줄기가 한없이 펼쳐진다. 

이처럼 일대에서는 가장 높은 산이기에 장엄한 일출의 장면과 아름다운 낙조의 광경도 빼어나다. 일출과 일몰광경이 알려지기 시작하면서 해마다 연말연시면 해돋이와 함께 새롭게 각오를 다지려는 관광객들이 늘고 있다고 한다. 1996년 4월 문을 연 보현산천문대는 국내 최대 규모의 직경 1.8m 반사망원경, 태양의 생생한 모습을 볼 수 있는 태양플레어 망원경 등을 가동하고 있다.일반 탐방객을 위해서는  방문객 센터(전시관)을 운영하고 있는데 주말에도 열려 있으며  각종 별자리사진 등을 감상하고  관련서적이나 천체사진, 간단한 기념품 
등도 구입할 수 있다."
경상북도 영천시 신녕면 치산리,,35,0.0,A01,A0101,A01010900,126929,12,20030917090000,http://tong.visitkorea.or.kr/cms/resource/28/2671628_image2_1.jpg,http://tong.visitkorea.or.kr/cms/resource/28/2671628_image3_1.jpg,128.7179887845,36.0396724758,6.0,20220224142438,54726,15,,치산계곡,38800.0,"팔공산 주봉 북쪽 자락에 들어앉은 계곡이다. 치산 저수지에서 약 1km 올라가면 신라 선덕여왕 14년에 원효대사와 자장율사가 창건한 천년 고찰 수도사가 있으며 상류에는 신령재와 고려 문종시대에 흥암 혼수대사가 창건한 진불암을 만날 수 있다. 수도사에서 계곡을 따라  약 1.6km 올라가면 치산폭포가 자리잡고 있는데 이 폭포는 팔공산에 산재해 있는 폭포 가운데 가장 낙차가 크고 낙수율이 풍부하다. 팔공산 남쪽과 서쪽으로부터 에워싸고 있는 광활한 일대의 원시림지대에서 흘러내리는 폭포는 3단을 이루고 있어 장관을 이룬다.온갖 형상의 기암석과 울창한 숲으로 풍치미 또한 뛰어나며,  여름의 녹음, 가을의 단풍, 겨울의 설경을 자랑한다. 계곡의 맑은 물과 호수는 주변의 산세와 조화를 이루에 경관이 좋다.  또한 주변 관광지로는 제 2석굴암, 팔공산 순회도로와 연결되어 있으며, 등산로는 수도사  치산폭포  동봉  동화사  갓바위로 연결되어 있다."
경상북도 영천시 금호읍,,35,0.0,A02,A0205,A02050200,127457,12,20030630090000,,,128.9410640421,35.925125724,6.0,20220530143139,17713,15,,영천 청제비,38899.0,"영천 청제라는 저수지의 건립 경위와 그 과정을 기록한 신라 시대의 비석이다. 이 비(碑)는 자연판석(自然板石)으로 윗쪽이 넓어, 흡사 부채꼴 모양이다. 비수(碑首)는 본래 없고, 비의 받침의 유무도 알 수 없다. 비 전면에는 청못을 축조할 때의 사연이 적혀 있다. 이 비의 서남쪽 5m에 청제 중(重)립비가 서있는데, 청제비가 여기에 세워진 사연을 다음과 같이 말하고 있다. ""영천의 남쪽에 청제(보통 ""청못""이라 함)가 있는데 이 못의 북쪽에 비가 있다. 그글에 ""당나라 정원14년(798)에 임금이 양내사(兩內史)를 보내서 인부 14,800여명을 시켜 못을 막고 비를 세워 전말(顚末)을 기록했다""고 말하고 있다. 대개 이 못의 관개(灌漑)는 300여석이라 지금도 이익을 보고있는데 지난 순치(順治) 계사년(1653년)에 어떤 사람이 절단한 바가 되어 흙속에 묻혀, 그 고적(古跡)이 부전(不傳)함을 애석해 하지 않는 사람이 없었다. 이제 여기에 고쳐세워 이같이 기록한다. ""아 후인이 이 비로 말미암아, 이 못을 폐(廢)해서 안되는 까닭을 생각하게 된다면 이 비가 이못에 있어서 도움이 되지 않을 것이다. 강희(康熙) 27년(1688) 9월""삼국 및 통일신라 양시대에 걸쳐 양면비(兩面碑)는 이것이 처음이고농업수리비(農業水利碑)로서 제자리에 1200여년이 넘도록 서있는 것도 이 비가 처음이다. 이 청제비가 노천에 방치되어 있던 것을 1980년에 비각을 세움으로써 보존할 수가 있었다."
경상북도 영천시 청통면 거조길,(왕산리 등) 일대,35,0.0,A01,A0101,A01010200,126018,12,20030424090000,,,128.7388235392,36.0226136864,6.0,20220915142846,27947,15,,팔공산도립공원(은해사지구),38867.0,"대구 도심에서 동쪽으로 22km거리에 대구시와 경상북도 4개 시군에 걸쳐있는 팔공산은 비로봉(1192.3m)을  가운데로 동봉(1,155m)과 서봉(1,041m)으로 줄기를 뻗고 있다. 천년이 넘은 동화사를 비롯한 수십개의 사찰과 암자가 있으며, 울창한 수림, 맑은 물이 흐르는 수 갈래의 계곡 속에 이른 봄의 진달래, 늦봄의 영산홍, 여름엔 후박 등이 청초하게 피어나고, 가을에는 단풍과 활엽수, 겨울의 설경 등이 신비의 경지를 이룬다.동편에 영천 은해사가 위치하고 있는데 이 절은 조계종 제10교구의 본산으로 혜철국사가 신라 헌덕왕 원년(809)에 이곳 해안평에 창건하였고 조선 명종 원년(1546)에 천교화상이 이곳으로 이건하여 은해사라 하였다. 은해사에는 거조암, 백흥암, 운부암, 중암암 등 8개의 암자와 국보 영산전과 보물 3점이 지정되어 있고 건들바위와 기기암의 장군수 및 안흥폭포가 있는 명승지다.  주요문화재거조암 영산전(국보), 백흥암 극락전수미단(보물), 운부암 청동보살좌상(보물), 백흥암 극락전(보물), 괘불탱화(보물)"
경상북도 영천시 북안면 내서로 139-14,,35,0.0,A02,A0201,A02010800,126934,12,20021217090000,http://tong.visitkorea.or.kr/cms/resource/56/732856_image2_1.jpg,http://tong.visitkorea.or.kr/cms/resource/56/732856_image3_1.jpg,129.0306205411,35.9081682094,6.0,20220520101522,29516,15,,만불사(영천),38907.0,"경북 영천 만불산 만불사는 우리나라에서 가장 많은 부처님이 모셔진 사찰이다. 전각, 탑, 범종, 대불 그리고 도로에까지 나투신 수십만의 부처님들이 참배객들을 자비로운 미소로 반겨주고 있다. 만불보전에는 원불로,  인등대탑에는  인등으로, 황동범종에는 만불로, 대불 앞에는 부처님동산으로 나투신 부처님들은 우리들을 부처님 나라로  인도하고 있다.만불산 만불사에서는 부처님과 함께 다양한 신행 체험을 할 수 있는데, 세계 최초로 황동으로 조성된 황동만불대범종을 직접 타종할 수 있으며, 황동와불열반상의 부처님  발바닥과 만불보전의 수정유리광여래불을 직접 만지면서 소원을 발원할 수도 있다. 만불사는 생과 사를 함께하는 사찰이다.  살아있는 사람들에게는 효를 돌아가신 영가에게는  극락왕생을 기원하는 만불사에서는 스님들만 모실 수 있었던 부도를 일반인도 이용할  수  있도록 부도탑묘와 왕생납골단을 조성하여 새로운 불교식 장례 문화를 선도하고 있다.또한 만불사 대웅전에서 시작하여 황동와불열반상, 영천 아미타대불로  이어지는  숲속 길은 자연의 소리를 들으며 명상과 산책을 하기에 좋은 코스이며, 만불보전과 인등대탑의 야경, 석양이 지는 용천지 방생장 등은 일몰 후의 전경 또한 아름다운 곳이다.   문화재 33m 영천 아미타대불, 황동와불열반상, 황동만불대범종, 인등대탑, 만불보전, 관음전,대웅전, 법성게 법륜, 수정유리광여래불, 복주머니, 부처님 진신사리 5과, 유자영가,노천 아미타불, 보리수나무, 부도탑묘"
경상북도 영천시 북안면 신평탑골길 93-57,,35,0.0,A02,A0201,A02010700,126936,12,20020514090000,,,129.0226467885,35.8888813514,6.0,20220527102858,22288,15,,도계서원,38909.0,"도계서원은 경북 영천시 북안면 도천리 383번지에 위치하며, 조선 중기 대표적 문인인 노계 박 인로(15611642)의 위패를 모신 사당으로 가사문학의 선구자 이며 임진왜란때 수군으로 종군. 해안지방의 만호(萬戶)까지 역임한 노계 박인로(朴仁老)를 향사 하기위해 1707년(숙종33)에 서원을 창건하였다."
