addr1,addr2,areacode,booktour,cat1,cat2,cat3,contentid,contenttypeid,createdtime,firstimage,firstimage2,mapx,mapy,mlevel,modifiedtime,readcount,sigungucode,tel,title,zipcode,overview
경상북도 영천시 완산동,933-3,35,,A02,A0203,A02030600,2912274,12,20221118110543,http://tong.visitkorea.or.kr/cms/resource/69/2912269_image2_1.jpg,http://tong.visitkorea.or.kr/cms/resource/69/2912269_image3_1.jpg,128.9392326518,35.9603078197,6.0,20221205111226,0,15,,영천역 광장,38894.0,"영천역 광장은 경상북도 영천시 완산동에 있다. 역사 출구 시점 부에 동판 시가지 안내도와 12좌 별자리를 형상화해 배치했다. 이 밖에 분수 조형물, 공연장, 경관 조경수 등을 설치해 도심 속 휴식 공간의 역할을 하고 있다. 또한 영천 시민과 영천 여행객들의 만남의 장소로도 이름 높다. 영천IC에서 가깝고, 주변에 영천전투메모리얼 파크 체험권과 우로지 자연 생태공원이 있다."
경상북도 영천시 대창면 금박로 1021,블루썸와이너리,35,0.0,A02,A0203,A02030600,2775344,12,20211117193901,,,128.8923474968,35.8757665072,6.0,20221201095408,0,15,,지구마을산책,38911.0,"지구마을산책은 영천의 매력에 풍덩 빠진다는 뜻으로 지역의 문화와 색깔, 자연, 예술 자원을 유기적으로 연계하여 영천의 숨겨진 매력을 느낄 수 있는 로컬 여행상품을 기획⦁개발 중인 지역 로컬 공정여행사이다. 현재 블루썸와이너리와 연계한 소규모 와인핑커푸드 피크닉 나들이 체험 상품과 각종 농촌 체험을 예약제로 운영 중이다."
경상북도 영천시 청통면 거조길 400-67,,35,0.0,A02,A0201,A02010800,2758318,12,20211019001625,http://tong.visitkorea.or.kr/cms/resource/09/2758509_image2_1.jpg,http://tong.visitkorea.or.kr/cms/resource/09/2758509_image2_1.jpg,128.7646046699,36.0201338921,6.0,20211112204128,0,15,,거조사,38867.0,"은해사에서 신녕면 쪽으로 8km 정도 가다 보면 거조사를 만난다.  거조사라는 이름은 팔공산 동쪽 기슭에 위치하여, 아미타불이 항상 머문다는 뜻이다. 원효대사가 거조암을 창건한 뒤 진평왕 13년에 혜림법사와 법화화상이 영산전을 건립하여 오백나한을 모시게 되면서 영험한 나한 기도도량으로 유명하다. 거조사 영산전은 1962년 국보로 지정되었고,  2021년 3월 은해사 부속 암자인 거조암에서 거조사로 명칭이 바뀌었다.
우리나라 목조건축물은 고려시대 이전의 것은 없으며, 남아있는 고려시대의 목조건축물로 안동 봉정사 극락전, 강릉 객사문, 영주 부석사 무량수전, 예산 수덕사 대웅전, 부석사 조사당 그리고 이곳 거조암 영산전 6곳뿐이라는 점에서 중요하게 평가받고 있다.사진 출처: 새영천 알리미단 정동찬 기자"
경상북도 영천시 임고면 포은로 842-3,,35,0.0,A02,A0202,A02020100,2758262,12,20211018235207,http://tong.visitkorea.or.kr/cms/resource/20/2758520_image2_1.png,http://tong.visitkorea.or.kr/cms/resource/20/2758520_image2_1.png,128.9917061406,36.0464518283,6.0,20220411174114,0,15,,임고강변공원,38816.0,"임고강변공원은 경북 영천시 임고면에 자리 잡고 있다. 임고면 자호천 주변 약 5만㎡의 하천 부지에 수변 공원을 조성했다. 광장, 물놀이장, 분수, 정자, 농구장, 족구장, 산책로 등의 편의 시설과 바라만 봐도 시원한 인공 폭포를 갖추고 있다. 모든 시설은 무료로 이용할 수 있으며, 친환경적인 야외 공간이라 가족 단위의 피서나 운동, 산책하기에 좋은 수변 공원이다.사진 출처: 새영천 알리미단 손미혜 기자"
경상북도 영천시 임고면 신방로 19,,35,0.0,A02,A0202,A02020700,2756071,12,20211013183913,,,129.0112930174,36.0565482753,6.0,20211106000728,1,15,,영천댐하류공원,38816.0,"영천댐하류공원은 경북 영천시 임고면에 자리 잡고 있다. 높이 42m, 제방 길이 300m의 영천댐이 인접해 있다.
공원에는 영천댐공원 오토캠핑장, 물놀이장인 영천수변테마파크 등이 갖춰져 있다. 봄이 되면 공원 주변에 벚꽃이 만발해 장관을 이룬다.
공원은 임고IC와 가깝고, 주변에 영천CC, 운주산승마자연휴양림, 임고강변공원이 위치해 있다."
경상북도 영천시 화북면 천문로 2610,,35,0.0,A02,A0205,A02050600,2753588,12,20211006185057,,,128.9527683797,36.1270697361,6.0,20211108200901,0,15,,보현산댐 전망대,38812.0,"보현산 댐 전망대는 경북 영천시 화북면에 자리 잡고 있다. 1층에는 독도 실시간 영상관이 있으며, 엘리베이터를 타고 3층으로 올라가면 보현산 댐과 주변 경관을 조망할 수 있는 전망대가 있다. 전망대에는 영천 한의 마을의 대표 캐릭터인 약곰이 조형물이 설치돼 있다.주변에는 영천 댐 하류 공원을 비롯해 영천 CC, 운주산승마자연휴양림이 있다."
경상북도 영천시 화산면 가래실로 364,,35,0.0,A02,A0201,A02010600,2753576,12,20211006184631,,,128.8892738816,36.0328070074,6.0,20221130101023,0,15,,가래실 문화마을,38808.0,"가래실 문화마을은 경북 영천시 화산면에 자리 잡고 있다. 2011년 행복 프로젝트 신몽유도원다섯 갈래 행복길을 통해 문화 생산 지역이자 문화 소비 지역으로 거듭났다. 다섯 갈래 행복길은 걷는 길, 바람 길, 스무 골 길, 귀호마을 길, 도화원 길로 이뤄져 있으며 마을 역사와 이야기를 담아낸 여러 가지 예술작품이 설치돼 있다.주변에는 옛 동화초등학교에 터를 잡은 시안미술관이 있다."
경상북도 영천시 언하공단로 91-12,(망정동),35,0.0,A01,A0101,A01010500,2721931,12,20210618001312,,,128.953941762,35.9852413838,6.0,20220502171504,0,15,,우로지 자연생태공원,38830.0,"우로지 자연생태공원은 대구와도 가까워 대구시민들도 찾는 힐링 공간으로  평범했던 저수지를 생태공원으로 조성해 많은 사람들이 찾는 휴식공간으로 재탄생했다. 특히 철마다 다른 수생식물과 산책길, 팔각정자, 관찰 데크 등이 어우러져 도심 속 자연을 만끽하기 좋다. 봄에는 흩날리는 벚꽃을 볼 수 있으며, 여름이면 연꽃 단지에 아름다운 연꽃이 피어난다."
경상북도 영천시 임고면 승마휴양림길 62-16,,35,0.0,A02,A0203,A02030600,2714276,12,20210423001616,,,128.9985698736,36.0307481803,,20221005131356,0,15,,말문화체험관,38819.0,"운주산승마조련센터에 자리잡은 말문화체험관은 새로운 승마 콘텐츠 개발과 보급을 위해 2019년 말산업육성지원사업으로 건립되었으며, 말을 매개로 다양한 체험과 문화를 경험할 수 있는 복합문화 공간이다. 馬 누리카페, 유아놀이방, 야외 테라스, 전시,교육실, 말문화체험시설, 어린이승마장, 포니레일마차, 말문화승마숲길, 가족쉼터 꽃동산 등 다양한 체험공간으로 구성되어 있어 가족단위 관광객들에게 많은 사랑을 받고 있다."
경상북도 영천시 금호읍 거여로 426-5,,35,0.0,A02,A0203,A02030600,2674000,12,20200923232402,,,128.9224989148,35.9284333356,6.0,20220421162331,0,15,,영천 화랑설화마을,38875.0,"신라 천연동안 만들어 온 이야기, 천년동안 입에서 입으로 전해 온 우리 고유의 이야기
천년의 역사, 천년의 시공간을 넘나드는 판타지 테마파크이다. 화랑설화마을은 단순하게 예스러움을 재현해 놓은 곳이 아닌 우리 고유의 설화들이 가득한 곳이다."
경상북도 영천시 화북면 입석리 산 49-25,,35,0.0,A02,A0203,A02030600,2638521,12,20191125201801,http://tong.visitkorea.or.kr/cms/resource/39/2639439_image2_1.JPG,http://tong.visitkorea.or.kr/cms/resource/39/2639439_image2_1.JPG,128.9786490304,36.1410880778,6.0,20220913095847,1,15,,영천 목재문화체험장,,"영천시 보현산 자연휴양림 내에 위치한 목재문화체험장은 단순한 산림휴양의 장소에서 벗어난 산림 생태 및 교육, 문화기능 등을 종합적으로 체험할 수 있는 산림문화 체험공간을 제공한다. 체험 프로그램이 다양하여 남녀노소 누구나 체험할 수 있으며, 가족이 함께 친환경적인 목재를 이용하여 생활에 필요한 물건을 손쉽게 만들 수 있다. 유아 및 어린이는 나무망치를 이용하여 만들 수 있는 제품이 다양해 망치 체험도 가능하며, 14세 이상은 채색도 가능하여 나만의 개성 있는 제품을 만들 수 있다."
경상북도 영천시 호국영웅길 15,,35,0.0,A02,A0203,A02030400,2606219,12,20190613010306,http://tong.visitkorea.or.kr/cms/resource/74/2611274_image2_1.JPG,http://tong.visitkorea.or.kr/cms/resource/74/2611274_image2_1.JPG,128.9269500245,35.9735283152,6.0,20221214111403,0,15,,영천전투메모리얼파크,38844.0,"영천전투메모리얼파크는 한국전쟁 당시 영천전투를 배경으로 한 전시, 추모, 체험장으로 호국안보를 테마로 한 추모·전시·영상물과 전투체험시설의 조화로운 운영으로 이뤄지고 있다."
경상북도 영천시 천문로 485,(화룡동),35,0.0,A02,A0203,A02030600,2606217,12,20190613010053,http://tong.visitkorea.or.kr/cms/resource/21/2609921_image2_1.JPG,http://tong.visitkorea.or.kr/cms/resource/21/2609921_image2_1.JPG,128.9222919774,35.9778860679,6.0,20220328135942,0,15,,영천한의마을,38839.0,"영천한의마을은 우리 몸에 생명력을 불어넣고 순환과 소통을 주관하는 '오장육부(五臟六腑)'를 형상화한 아름다운 한옥단지 속 전시체험공간이다. 유의기념관은 유의들의 삶과 지혜, 그리고 본초의 역사를 통하여 우리나라 한의학의 발전과정을 이해하고 4D돔 영상을 통해 더욱 즐겁고 생생하게 관람할 수 있다. 한방테마거리는 우리나라 약령시 발전사 속 한약재 유통의 중심지로 자리 잡아온 영천을 소개하며, 자가진단을 통해 나의 체질을 알아볼 수 있다. 그외에도 야외전시물, 스카이워크 전망대, 산책로 등 많은 볼거리들이 있다."
경상북도 영천시 천문로 622-13,(오미동),35,0.0,A02,A0204,A02040600,2554513,12,20180719200423,,,128.9259523967,35.9909263269,,20220906163445,345,15,,영천와인사업단,38823.0,"stong영천포도로 명품와인을 만들어볼까stong  영천와인사업단은 영천의 자랑인 포도로 고품질의 와인생산을 위한 클러스터산업을 영천시와 함께 수행하고 있다. 와인학교를 운영하여 기초반, 심화반, 소믈리에반 교육을 진행하고 있다. 또한 농가형 10개소와 마을형 3개소, 총 13개 와이너리 중 1개소를 선택하여 와이너리 투어와 체험이 가능한 프로그램을 운영 중이다. "
경상북도 영천시 한방로 10,,35,0.0,A02,A0204,A02040800,2469220,12,20161223021420,,,128.9305089256,35.9424096818,6.0,20220826135321,1819,15,,영천한약재전시관,38896.0,"stong한약재 냄새만 맡아도 건강해지는 곳 stong  영천생약한약유통단지에 있는 영천 한약재 전시관은 지역 한방산업의 역사성과 한방도시의 위상을 홍보하고 한약재에 대한 이해증진과 관광 자원화를 도모하기 위해 건립했다.  전국 한약재 유통시장의 30를 차지하는 한방도시 영천을 대표하는 한약재전시관에서는 한의학의 역사와 우수성, 한약재의 효능과 효과, 한방산업의 현황과 미래가치를 한자리에서 볼 수 있다. 또한 향기체험, 사상체질분류, 약재감별법 등 여러 가지 체험도 해 볼 수 있다. "
경상북도 영천시 화북면 정각리,,35,0.0,A01,A0101,A01010400,1997570,12,20150416002638,http://tong.visitkorea.or.kr/cms/resource/95/2005695_image2_1.jpg,http://tong.visitkorea.or.kr/cms/resource/95/2005695_image3_1.jpg,128.9732989152,36.1615856517,6.0,20220826140253,2979,15,,보현산(영천),38812.0,"보현산은 경상북도 영천시 화북면에 위치한 산으로 정각동에서 바라보면 아이를 안고 있는 어머니의 형상이라 '모자산'이라고도 부르며, 최고봉은 현재 삼각점이 있는 1124.4m봉이 아니라 그 북동쪽에 있는 상봉이다. 보현산에 가면 보현산 천문대와 보현산천문과학관을 이용할 수 있다.   주요 야생화  나도바람꽃, 큰앵초, 왜미나리아재비, 노랑무늬붓꽃, 회리바람꽃, 노랑제비꽃"
경상북도 영천시 창대서원1길 9-18,(과전동),35,0.0,A02,A0201,A02010700,1959198,12,20141023015107,http://tong.visitkorea.or.kr/cms/resource/62/2770362_image2_1.jpg,http://tong.visitkorea.or.kr/cms/resource/62/2770362_image2_1.jpg,128.9306693652,35.9656376118,6.0,20220826111745,2385,15,,창대서원,38847.0,"임진왜란이 일어나자 의병을 모집하여 신령, 하양, 추평 전투를 비롯하여 영천 복성에 큰 공적을 세운 정대임 장군의 충절을 기려 위패를 봉안하기 위해 후손과 향내 유림들이 1697년(숙종 23) 영천시 녹전동에 창대서원을 건립하였다. 그러나 1868년(고종 5) 대원군의 서원 철폐령에 따라 철거하고 1955년에 다시 현 위치에 복원하였다. 그런데 이것도 2004년 화재로 소실되었다가 다시 복원하였다."
경상북도 영천시 신녕면 연정큰길 67,,35,0.0,A02,A0201,A02010700,1959009,12,20141022203901,,,128.8142493709,36.0527727854,6.0,20220421165318,2589,15,,연계서원,38802.0,"연계서원은 2004년 봄에 세워졌다. 본래 이 자리는 한덕련이 군위군 고로면과 산성면 영천군 임고면 매호리 등 여러 곳을 전전하다 마지막으로 정착하여 후진양성을 계속하던 심락서당 자리다. 문인과 후손들로 주축이 되어 1995년 6월 송계선생추모사업회를 구성하여 영천문화원에서 창립총회를 가졌으며, 그 후 회원들의 성금 등으로 모금 된 사업회 자금 6억5천 만원과 국비 1억5천 만원 도합 8억원으로 영천시 신녕면 연계리 옛 서당터에 서원을 짓고, 2004년 5월 준공식을 가졌다."
경상북도 영천시 청통면 애련길 174,,35,0.0,A02,A0201,A02010700,1958935,12,20141022193347,,,128.8029518503,36.0003174082,6.0,20221005173842,2774,15,,송곡서원,38867.0,"1702년(숙종 28)에 지방유림의 공의로 유방선(柳方善)과 곽순(郭珣)의 학문과 덕행을 추모하기 위하여 묘우(廟宇) 경현원(景賢院)을 창건하여 위패를 모셨다. 그 뒤 원호를 송곡으로 고치고 1712년(숙종 38) 이현보(李賢輔) · 심지원(沈之源)을 모시고, 그 뒤 이보흠(李甫欽)과 윤봉오(尹鳳五)를 추가로 배향하였다. 선현배향과 지방교육의 일익을 담당하여 오던 중, 대원군의 서원철폐령으로 1868년(고종 5)에 훼철되었으며, 1965년 유림의 공의로 복원하여 유방선과 이보흠만 배향하였다."
경상북도 영천시 신녕면 치산효령로 152-26,,35,0.0,A02,A0201,A02010700,1958240,12,20141022004928,,,128.7723225785,36.0504056044,6.0,20221020110632,1319,15,,무원서원,38804.0,"1630년(인조 8)에 영천유림에 의해 창건되었으나, 1868년(고종 5)에 훼철되었다가 지금으로부터 대략 70년쯤 전에 복원하였다. 하연(河演)과 정경부인(貞敬夫人) 성주 이씨의 부부 영정을 봉안하였다."
경상북도 영천시 대창면 영지길 399,,35,0.0,A02,A0201,A02010700,1958212,12,20141021235839,,,128.9451047447,35.848342815,6.0,20211013005705,1643,15,,도잠서원,38913.0,"이 서원은 1612년(광해군 4)에 조호익(曺好益)을 제향하기 위해 세운 서원이다. 창건 당시에는 지봉서원(芝峰書院)이라고 하였다가 1653년(효종4) 현 위치로 이건하였다. 1678년(숙종 4)에 용호리로 이건(移建)하면서 도잠이라는 현판을 나라에서 받아 사액(賜額)되었으며, 흥선대원군의 서원철폐령으로 1868년(고종 5)에 훼철(毁撤)되었으나 1914년에 복원하였으며, 1981년에 보수하였다."
경상북도 영천시 화산면 신화로 933-16,,35,0.0,A02,A0201,A02010700,1958151,12,20141021222612,http://tong.visitkorea.or.kr/cms/resource/49/1958149_image2_1.jpg,http://tong.visitkorea.or.kr/cms/resource/49/1958149_image2_1.jpg,128.865450392,36.0535403225,6.0,20220422132517,1905,15,,덕강서원,38805.0,"양효지(楊孝智)를 배향하는 서원이다. 1621년(광해군 13)에 지역사림의 공의에 의해 창건되었으며, 1871년(고종 8) 서원훼철령에 의해 훼철되었다. 1921년 후손들이서당에서 향례를 올리다가 이듬해 후학과 사림에서 수계(修契)를 하여 사당인 경절사(景節祠)를 창건하고 덕강서원을 복원하였다. 1998년 후손들이 자비를 들여 중수하였다."
경상북도 영천시 임고면 고천길 64-4,,35,0.0,A02,A0201,A02010700,1957981,12,20141021182041,,,128.9905237497,36.0170495804,6.0,20210904003407,1602,15,,고천서원,38819.0,"고천서원은 1592년(선조 25) 임진왜란 때에 의병을 일으켜 자인전투, 영천성 전투 등에 참여하여 전공을 세우고 경주성 전투에 참여하였다가 순국했던 영천지역의 의병들을 제향하고 있는 서원으로서 이곳에 배향된 인물은 모두 영천 지역 출신의 중견관료 및 사림으로 인근 지역의 농민들을 이끌고 왜군의 격파에 노력 하였으나 모두 일시에 순국 했다. 1705년(숙종 31)에 사당을 건립하고 1797년(정조 21)에 강당을 건립하였으며 대원군의 훼철령으로 훼철되었으나 1916년 유림이 십충현(十忠賢)을 복향하고 매년 제향을 올리고 있다."
경상북도 영천시 신녕면 큰골길 30-7,,35,0.0,A02,A0201,A02010700,1955174,12,20141011000153,,,128.7913265101,36.048603385,6.0,20221129093758,1420,15,,신녕향교,38803.0,"조선시대 현유(賢儒)의 위패를 봉안, 배향하고 지방민의 교육과 교화를 위해 창건되었다. 창건연대는 미상이며 1592년에 회신되었다가 1615년(광해군 7) 중건하였고, 1686년(숙종 12)에 현재의 위치로 이건하였다. 1970년 대성전을 중수하고 1974년과 1976년에 대대적인 보수가 있었다. 현존하는 건물로는 6칸의 겹처마 맞배지붕으로 된 대성전, 7칸의 겹처마 팔작지붕으로 된 명륜당, 동재(東齋)·서재(西齋) 등으로 구성되어 있으며, 대성전에는 5성(五聖), 송조4현(宋朝四賢), 우리 나라 18현(十八賢)의 위패가 봉안되어 있다. 조선시대에는 국가로부터 토지와 전적·노비 등을 지급받아 교관이 교생을 가르쳤으나, 갑오개혁 이후 신학제 실시에 따라 교육적 기능은 없어지고 봄·가을에 석전을 봉행하며 초하루 보름에 분향을 하고 있다. 명륜당은 지방유형문화재, 대성전은 경상북도 문화재자료로 지정되어 있으며, 전교(典校) 1명과 장의(掌議) 수명이 운영을 담당하고 있다."
경상북도 영천시 화산면 가래실로 364,,35,0.0,A02,A0203,A02030600,1839077,12,20130820011239,,,128.8892544399,36.0327708997,6.0,20220518164008,9301,15,,영천 별별미술마을,38808.0,"별별미술마을은 문화체육관광부가 주최한 2011마을미술프로젝트 공모사업에 선정된 마을로 50여 명의 작가가 참여하여 경북 영천시 화산면과 화남면 일원 마을 곳곳의 문화유산과 자연풍광, 주민의 일상과 연계한 총 45점의 작품을 설치, 평범하던 농촌마을이 지붕없는 미술관으로 바뀐 곳이다. 버스 정류장, 마을 안길 담벼락, 마을 저수지, 버려진 폐가, 낡은 정미소 등 우리가 무심히 지나치는 곳곳에 수준 높은 예술작품들이 숨겨져 있다. 걷는길, 바람길, 스무골길, 귀호마을길, 도화원길 등 총 다섯 갈래의 행복길을 도보나 자전거트래킹을 통해 감상할 수 있다.  시안미술관 별별미술마을이 속한 경북 영천시 화산면 가상리에는 폐교건물을 전면 리노베이션하여 잔디 조각공원, 야외 음악당 등의 주변공간과 함께 삼각지붕의 유럽풍 3층 건물로 새롭게 태어난 시안미술관이 자리하고 있다. 정부 등록 제1종 미술관인 시안미술관은 3개의 층에 각 4개의 전시관을 갖추고 있으며, 자료실, 수장고, 영상 세미나실 등 다양한 시설과 관람객의 편의를 위한 아름다운 카페도 준비되어 있다."
경상북도 영천시 임고면 승마휴양림길 105,,35,0.0,A01,A0101,A01010600,1839066,12,20130820005840,,,128.9968671126,36.0354170643,6.0,20220324090515,24967,15,,운주산승마자연휴양림,38819.0,"운주산 승마자연휴양림은 별의 수도 별의 도시인 천혜의 청정지역 경상북도 영천시에 위치하고 있다. 산림욕과 승마를 동시에 즐길 수 있는 승마자연휴양림으로 73ha(733,932㎡)면적의 울창한 리기다 소나무 숲 속에 아름답게 꾸며진 휴양림은 숲속의 집, 다목적구장, 숲속놀이터, 산책로, 수변관찰데크, 주말농장, 야외 물놀이장 등의 휴양림지구와, 실내·외승마장, 산악승마로, 외승로 등의 다양한 승마체험을 할 수 있는 승마체험지구로 구성되어 산림휴양과 레저를 동시에 즐길 수 있다. 또한, 휴양림 인근에는 포은 정몽주 선생의 탄생지이며 선생을 모신 임고서원, 영천댐, 동양최대의 보현산천문대, 천문과학관 보현산 일대에 조성된 웰빙숲과 영천댐 하류에 조성된 강변공원 등이 위치해 있어 가족들의 주말 나들이 장소로 매우 각광 받고 있다."
경상북도 영천시 자양면 원각길 49-6,,35,0.0,A02,A0201,A02010700,1621425,12,20120503221554,,,129.0352149591,36.0898699508,6.0,20220706144845,16036,15,,용계서원,38814.0,"용계서원(龍溪書院)은 조선초기의 문신으로 생육신의 한 사람인 이맹전(李孟專)의 학덕과 충의를 추모하기 위하여 1684년(숙종 10)에 건립되었다. 1759년(영조 35)에 생육신 조려 · 원호 · 김시습 · 성담수 · 남효온을 추가배향하였으며, 1786년(정조 10)에 용계(龍溪)라고 사액되었다. 흥선대원군의 서원철폐령으로 1871년(고종 8)에 훼철(毁撤)되었으나, 노항동(魯巷洞)으로 옮겨 서당으로 사용되었다. 1945년 유림에 의해 복원되면서 이맹전을 독향으로 봉안하였으며, 1976년 7월 영천댐 건설공사로 인하여 현 위치로 이건(移建)하였다."
경상북도 영천시 사일로 458-64,,35,0.0,A02,A0202,A02020300,615022,12,20080826232608,,,128.8705827645,35.9734661565,6.0,20220831135513,25891,15,,사일온천,38821.0,"사일 온천은 산 정상의 자연 속에 위치한, 하늘과 가장 가까운 온천이다. 또한 사계절 팔공산 절경을 감상할 수 있는 빼어난 자연 경관을 자랑한다. 
최신형의 스파 월풀 욕조가 구비된 호텔식 가족탕과 대중탕에서 바로 연결된 노천탕은 기존의 온천에서는 체험할 수 없었던 뉴패러다임 온천욕의 새로운 경험을 제공할 것이다."
