addr1,addr2,areacode,booktour,cat1,cat2,cat3,contentid,contenttypeid,createdtime,firstimage,firstimage2,mapx,mapy,mlevel,modifiedtime,readcount,sigungucode,tel,title,zipcode,overview
경상북도 경산시 자인면 북사안길 18,,35,0,A02,A0201,A02010800,479915,12,20080220195759,http://tong.visitkorea.or.kr/cms/resource/70/1968270_image2_1.jpg,http://tong.visitkorea.or.kr/cms/resource/70/1968270_image3_1.jpg,128.8211997097,35.8218462786,6,20210831222830,20118,1,,제석사(경산),38555.0,"우리나라에 불교 성지는 헤아릴 수 없이 많으나 원효성사(元曉聖師, 617686) 성지(聖地)가 으뜸이다. 원효성사 성지 중에서도 스님이 태어난 곳인 제석사(帝釋寺)가 특별하다. 원효스님은 신라 진평왕 39년(617년)에 현재 경상북도 경산시 자인면, 서라벌 압량군 자인땅 불지촌에서 태어난다. 스님이 태어난 곳은 집안이 아니라 집이 있는 불지촌(佛地村) 북쪽 밤나무골의 밤나무 아래였다. 밤나무에 남편의 옷을 걸어 가리고 그 속에 누워 해산하여 그 밤나무를 사라수(娑羅樹)라 하고 그 나무 열매를 사라율(娑羅栗)이라 했다. 그런데 이 사라율의 열매는 보통 밤나무와는 달리 그 밤 알 한 톨이 바루에 가득 찰 만큼 컸다고 한다.   스님은 자기가 태어난 곳과 자기가 살던 집에 절을 지었다. 출가한 뒤에 살던 집을 희사(喜捨)하여 초개사(初開寺)를 짓고, 태어났던 밤나무가 있는 곳에 사라사(娑羅寺)를 지었다. 제석사(帝釋寺)는 사라사의 후신이라고 한다. 제석사에 남아 있는 석조좌불과 부서진 탑신, 석등 연화대석 등이 신라말기의 것으로 보여지고 있어 사라사의 후신이 제석사임을 짐작케 한다.사라사(娑羅寺)의 사라(娑羅)는 신라의 국호인 사로(斯盧)와 같은 음과 뜻으로 사라사는 부처님의 재생(再生)을 이어받은 신라의 절이라는 의미로 해석되기도 한다.  제석사는 신라시대 원효대사가 출가한 후 생가 곁에 지어졌던 사라사가 폐사되었다가 400여 년 전 밭갈이하던 농부가 불상과 탑신을 발견하고 사찰을 복원했다는 설화가 있다. 원효스님은 제석사에서 태어나 한 번도 울지 않았다고 하며, 태어난지 100일이 되자 눈동자가 밖을 보는 시선이 전혀 없고 내관극념(內觀極念)의 자세라 그 누구도 접근하기 어려운 모습이였다고 한다. 한 살이 되자 몸에서 풍기는 자태가 마치 영웅호걸 장부의 태도라서 감히 함부로 대할 수 없는 기상을 지녔고, 일곱 살이 되자 산에 가서 있기를 좋아해서 조부가 햇빛과 비를 피하기 위해서 초막(草幕)을 지어 주었는데 초계사(草係寺)라 불렀다고 한다."
경상북도 경산시 와촌면 갓바위로 386-73,,35,0,A02,A0201,A02010800,347226,12,20071222013019,http://tong.visitkorea.or.kr/cms/resource/44/1968244_image2_1.jpg,http://tong.visitkorea.or.kr/cms/resource/44/1968244_image3_1.jpg,128.7670944715,35.9799940419,6,20220617154910,19952,1,,원효암(경산),38400.0,"원효암은 경산시 와촌면 대한리 382번지 팔공산 자락에 위치한 대한불교조계종 제10교구 본사 은해사의 말사이다. 민족의 영산인 팔공산은 갓바위 부처님을 위시한 영험있는 기도처를 비롯해 골골마다 불타의 혜명을 이어나가는 도량이 산재해 있다. 그러나 원효암의 경우, 오랜 역사에도 불구하고 팔공산 한 켠에서 단지 조용한 기도도량으로써 맥을 이어나가고 있다.팔공산의 뻑적지근한 사찰에 비하면야 조그만 암자에 지나지 않지만 원효암은 다부진 불사를 거듭해와 지난 1986년의 대화재 이후 사격을 바로 세우고 있다. 대화재는 팔공산 인근 예비군 훈련장에서의 실화로 그 화마가 산을 타고 원효암까지 넘어와 사찰을 전소시킨 안타까운 사건이었다. 더군다나 40여년 전만해도 대처승 주석사찰로 정화대상 사찰 중 하나였다는 원효암은 청정비구 수행처로서의 면모를 일신해 가려 절차탁마하고 있다.  그러나 이와같이 거듭된 과거의 악몽은 이미 벗어던지고 지금은 팔공산의 물맛 좋은 조용한 기도처로 거듭나고 있는 중이다. 원효암의 물맛은 이미 동쪽 계곡에 자리한, 사계절 내내 온도가 변하지 않는다는 샘물과 함께 경내 수각에 흘러내리는 약수 맛이 일품이라는 정평이 나있다. 또한 원효암 극락전 뒤편에는 통일신라시대 마애불이 모셔져 있어 원효암이 천년 고찰이라는 역사를 다시 한번 대변해 주고 있다. 현재 신도도 크게 없고 단지 노스님 몇 분만이 기거하고 있는 원효암은 사자루와 요사채 불사를 앞두고 있어 곧 새로운 사격을 또 한번 다듬게 된다. 서기 668년(문무왕 8년) 원효대사가 창건했으니 이제 1300여 성상이 넘는 세월이 원효암을 스치고 지나갔다. 극락전에 홀로 앉아 계신 아미타부처님께 시공을 초월하여 원효암 뿐 만 아니라 팔공산 일대가 다시는 화마와 같은 큰 상처를 입지 않기를 빌어본다."
경상북도 경산시 남매로 86,(상방동),35,0,A02,A0201,A02010800,337417,12,20071217232149,http://tong.visitkorea.or.kr/cms/resource/63/1967963_image2_1.jpg,http://tong.visitkorea.or.kr/cms/resource/63/1967963_image3_1.jpg,128.7438288331,35.8182869117,6,20220615112540,20200,1,,안흥사(경산),38638.0,경산 안흥사는 경북 경산시 상방동 71번지에 자리한 대한불교조계종 제10교구 본사 은해사의 말사이다. 사찰이 어려움에 처해 부득이 옮겨야할 경우가 있다면 전란의 피해 또는 풍수적인 이유에서일 것이다. 그것은 사찰만이 가지는 종교적 영속성을 버리지 못하기 때문이다. 경산(慶山)의 안흥사(安興寺) 역시 그러하다. 사찰이 퇴락하고 없어지더라도 이처럼 불가의 인연은 놓지 않아 그 이름을 이어가는 사찰 중 하나이다. 안흥사의 지금 자리는 창건과는 거리 먼 곳이다. 절을 3번 옮겼는데 그것도 한국전쟁 이후에 옮겼다. 그것도 부득이한 여러 이유로 인해 가람을 옮겨나갔던 것이다. 그런데 그러다보면 사격이나 사찰의 재정이 떨어지고 신도들도 차츰 떠나가게 마련인데 지금도 안흥사는 불법홍포와 경산지역 포교의 고삐를 늦추지 않고 있다. 최근에는 경산불교회관을 신축해 불자들을 위한 문화공간과 교육공간을 활용해 포교에 앞장서고 있다. 신라고찰로 알려져 있지만 3번의 이건으로 인해 특별한 자료나 흔적이 남아있지 않은 안흥사지만 과거의 불행했던 기억을 접고 새로운 불국정토 건설에 이바지하는데 노력해 나가고 있다.
경상북도 경산시 용성면 용전1길 60,(용성면),35,0,A02,A0201,A02010800,309304,12,20071130201900,http://tong.visitkorea.or.kr/cms/resource/21/1967521_image2_1.jpg,http://tong.visitkorea.or.kr/cms/resource/21/1967521_image3_1.jpg,128.9295415771,35.7725177573,6,20220620181230,18592,1,,반룡사(경산),38568.0,"반룡사는 경북 경산시 용전면 구룡산 자락(반룡산)에 위치한 사찰로 대한불교조계종 제10교구 본사 은해사의 말사이다. 설총 키워낸 원효스님 주석처, 구룡산(九龍山) 반룡사(盤龍寺) 그 옛날 신라는 삼국을 통일할 즈음 경세(經世)를 실천해 나갈 이념적 토대와 이를 전파해나갈 새로운 기능, 즉 문자가 필요했다. 설총이 우리 고유의 이두(吏讀)를 만들기 전까지 아직도 신라는 어려운 중국의 문자를 쓰고 있었으며 이를 타파할 새로운 문자의 창안이 시급했던 것이다. 이러한 상황에서 원효스님과 요석공주의 아들로 잘 알려진 설총이 이두를 고안해내어 신라가 불교 뿐 아니라 유학까지 깊이 연구하게 돼 국가의 기틀을 잡아나가는데 크게 일조했으며 우리 선인들의 문자생활을 비롯한 우리 문화의 발전을 한층 앞당겼다. 이는 원효스님이 요석공주를 만나기 전 저자거리를 돌며 어느 누가 자루 없는 도끼를 내게 주려는가. 내가 하늘을 떠받칠 기둥을 찍으리라.며 노래했던 그 의미가 아마도 설총을 생산함을 예견해 나라의 기둥을 삼고자 했던 것은 아닐까. 또 훗날 설총이 저 유명한 화왕계를 지어 스스로 백두옹을 자처하고 임금에게 간하고자 했던 것도 원효스님의 그러한 뜻과 맞닿아 있기 때문이 아닐까.   국가의 동량인 설총을 키워낸 반룡사도 원효스님과의 깊은 인연 때문에 설총의 유년을 여기에서 보내게 되었지만, 정신적 귀의처인 일개 사찰이 얼마나 국가에 이바지할 수 있는지 여실히 보여주는 대목이기도 하다.더구나 신라의 임금과 왕후가 인근 왕재(王峙)를 넘어 이 곳에서 설총 모자와 함께 불공을 드릴 정도로 열과 성을 다했으니 반룡사가 차지하는 위상도 상당했을 것으로 사료된다. 그러나 반룡사는 조선시대로 내려오면서 억불정책과 화재로 인해 쇠락을 거듭해 왔다. 일제 격변기 속에서 거의 멸실되다시피 한 반룡사가 다시 제3의 중창기를 맞이하게 된 것이다. 사하촌인 인근 용전마을까지 모두 사역에 해당되던 반룡사는 고작 480여평 정도의 경내지만 남아있으나 가람을 하나둘 중건하고 구룡산 자락에 작은 길도 내어 해동 3반룡사(평양, 고령, 경산)라는 명성을 이어가는 토대를 닦아가고 있는 것이다."
경상북도 경산시 남천면 모골길 196-55,(남천면),35,0,A02,A0201,A02010800,294526,12,20071127023044,http://tong.visitkorea.or.kr/cms/resource/30/1967230_image2_1.jpg,http://tong.visitkorea.or.kr/cms/resource/30/1967230_image3_1.jpg,128.7056168101,35.7722303004,6,20220616133343,18550,1,,경흥사(경산),38695.0,"예로부터 무병장생를 의미했던십장생(十長生)은 우리네 일상생활에 깊숙이 관여해 왔다. 특히 그 중 학(鶴)은 우리의 풍수와 접합해 사찰의 배치조건과도 깊은 연관성을 지니게 되었다. 학이 의미하는 것이 바로 도도한 기상과 높은 생존력을 의미한다고 하니 학이 지닌 풍수와 관계된 사찰은 그 사세와 밀접한 관련성를 가지고 있다 하겠다. 동학산 경흥사는 이러한 학과 연관된 풍수를 지니고 있는 사찰이다. 동학산은 학의 형상을 하고 있으며 경흥사는 학의 부리에 해당하는 자리에 위치해 있다. 거기다 학의 서기(瑞氣)를 막기 위한 병풍산이 건너편에 있어 경흥사는 외부와도 차단된 지형적인 특성도 아울러 가지고 있다.  특히 경흥사는 학의 도도한 기상을 닮아서인지 임진왜란 당시 의승군(義僧軍)들이 이 곳에서 최초로 훈련해 전장에 나가 용감히 싸웠으며, 또 사찰의 규모 역시 대단했다고 한다.현재 경흥사에 남아있는 고승의 부도들이 이를 묵묵히 증명하고 있으며 동학산 언저리에 잔존하고 있는 경흥사의 광활한 옛 절터에서도 초석과 석축 등이 곳곳에서 발견되고 있어 이 곳이 결코 미미한 사세가 아니었음을 역시 반증하고 있다. 그러나 일제강점기 때 경흥사가 임란 때 승병을 훈련시켰다는 이유로 탄압하고 한국전쟁 전후의 극심한 도굴 등으로 인해 절은 점차 피폐해졌다. 그러나 예전의 사세를 회복하려는 스님들의 노력으로 현재 경흥사는 대웅전, 명부전, 독성전, 산령각, 종각 등 대부분의 불사가 모두 마무리되어 동학산 기슭에서 경산시청법우회 등의 법찰로 지역포교에 매진하고 있다."
경상북도 경산시 장산로26길 20,,35,0,A02,A0201,A02010800,294518,12,20071127022324,http://tong.visitkorea.or.kr/cms/resource/20/1967220_image2_1.jpg,http://tong.visitkorea.or.kr/cms/resource/20/1967220_image3_1.jpg,128.7393653767,35.8168592129,6,20220908104836,20201,1,,경산포교당(보문사),38640.0,"도심사찰의 어려움은 한두가지가 아니다. 더구나 전통사찰일 경우 포교와 연관되는 불사의 어려움도 함께 수반된다. 그럼에도 가없는 정진과 함께 포교의 원(願)을 놓지 않는 까닭은 부처님의 자비원력에 대한 숭고한 종교적 약속을 지키기 위함일 것이다.경산 보문사(普門寺)라는 이름을 함께 쓰고 있는 경산포교당은 전통사찰임에도 열악한 환경을 극복하려 많은 방법을 모색하며 안간힘을 쓰고 있는 사찰이다. 하양포교당과 함께 조계종 제10교구본사 은해사의 포교당으로는 단 2곳인 이 곳 경산포교당은 도심 빌라 숲에 가리워 신음하고 있다. 또한 하양포교당과 달리 매우 협소한 장소에 위치해 있어 전통사찰이라는 이름이 부끄러워질 정도로 안타깝다는 생각이 든다.  여기에 주석하고 있는 스님도 전통사찰이라 불사도 제대로 하지 못하고 어느새 좁은 골목길을 사이에 두고 다가선 주택건물로 인해 전통사찰로서 보호받지 못하고 있는 실정이다.경산시 삼북동 어느 동네 골목에 자리한 경산포교당은 지하1층 지상 2층의 단촐한 주택식 건물이다. 입지적으로 갖추어지지 않아서 그렇지 여느 사찰과 마찬가지로 경산포교당은 포교당으로서의 역할을 충분히 수행해나가고 있으며 어느 누가 사찰을 찾아와도 가족같은 분위기를 만끽할 수 있다. 아마도 공간이 협소한 까닭도 일조했으리라 여겨진다.이러한 이점을 살려 지난 20년간 어린이법회를 거르지 않고 봉행해와 미래불교의 새싹인 지역 어린이 포교에도 선두를 점하고 있다. 경산포교당은 앞으로도 사찰을 벗어나 지역주민들과 함께 복지사업, 자원봉사 등 뜻깊은 실천운동을 통해 부처님의 가르침을 실천해 나갈 예정이다."
경상북도 경산시 청운2로9길,(조영동),35,0,A02,A0201,A02010700,128173,12,20040615090000,http://tong.visitkorea.or.kr/cms/resource/89/1615489_image2_1.jpg,http://tong.visitkorea.or.kr/cms/resource/89/1615489_image3_1.jpg,128.7536716999,35.8437675465,8,20220810093643,19687,1,,경산 임당동과 조영동 고분군,38515.0,"경산분지의 중앙에 남북 방향으로 놓여 있는 압량 구릉의 말단부에 해당되는 경산시의 동북방 영남대학교 앞 구릉(해발 5075m)에 봉토분들이 밀집해 있다. 이들 대형분들은 가장 서쪽의 임당동 고분군, 중앙의 조영동 고분군, 동쪽의 부적리 고분군으로 나누어진다. 이 가운데 임당동 고분군은 영남대학교 앞 구릉의 주능선에서 서남으로 뻗는 지맥의 능선이 경산들과 만나는 곳에 위치한 것으로  능선의 상부를 따라 조영된  7기의 대형 봉토분이 분포하고 있는데, 이들은 단일의 원형분으로 보이는 것들도 있으나  몇 기의 무덤을 가진 각 봉토들이 연결되어 하나의 커다란 동산과 같은 형태를 취하게 된 것도 있다.임당동 고분군 가운데 4기(2,57호분)의 봉토분이 영남대학교 박물관에 의하여 1982년 발굴조사되었다. 조사결과 2호분은 남분과 북분으로 구성된 표형분이고, 57호분은  6개의 봉분이 이어져 하나의 동산과 같이 거대한 봉분으로 보이게 된 다곽식이었다. 각 단일 묘곽에 씌어진 봉분의 크기는 지름이 1720m, 높이 45m 정도였다.  묘제는 암광 목곽묘가 중심으로 이 곳의 기반암인 청석암반층을 파서 묘광을 만들고 거기에 목곽을 설치한 것이다. 이것들은 단곽식도 있었으나 장방형의 주곽과 방형의 부곽을 창자형으로 배치한 주부곽식이 대부분이었다. 또 지상에 할석과 천석으로 쌓아 올린 횡구식 석실묘도 1기 조사되었다. 매장주체부의 크기는 주곽이 길이 4m, 너비 2m, 깊이 2m,  부곽은 길이 4m, 너비 4m, 길이 1.5m 정도였고 주곽에는 장대석으로 뚜껑을 하였다.  여기에서는 금동관과 관식, 금제 귀고리, 은제 허리띠, 금동제 신발,금·은제 반지 등의 화려한 장신구와 금동제 고리자루 큰칼, 은장식 철투겁창, 금동제 화살통장식 등의 무구류, 금동제와 철제의 각종 마구류, 삼두마 굽다리 접시를 비롯한 각종 토기류 등 약 4,000여 점의 유물이 출토되었다. 특이한 것은 각 무덤에는 피장자의 인골들이 고스란히 남아 있었는데, 대형의 무덤들에는 주곽과 부곽에 각각 13인이 순장된 것이  밝혀졌다. 출토된 유물과 묘제로 보아 발굴된 것들은 46세기에 조성된 것으로 「삼국사기」등에 전하는 압독국(압량소국) 지배자들의 무덤으로 추정된다. 그리고 출토 유물이 모두 신라문화권의 양식을 충실하게 따르고 있으나, 질적인 측면에서 경주의 대형분들에는 미치지 못하는 것으로 보아 압독국은 신라의 지배를 받던 소국의 형태로 이 때까지 남아 있었던 것을 알 수 있다. 조사된 고분들 가운데 일부를 복원하고, 영남대학교박물관에 전시실을 마련하여 그 무덤의 구조를 알아 볼 수 있도록 하였다."
경상북도 경산시 와촌면 갓바위로 699,,35,0,A02,A0201,A02010800,128093,12,20040324090000,http://tong.visitkorea.or.kr/cms/resource/39/2671639_image2_1.jpg,http://tong.visitkorea.or.kr/cms/resource/39/2671639_image3_1.jpg,128.7391522829,35.9873149153,6,20220831171153,26441,1,,선본사(경산),38400.0,"대한불교조계종 직영사찰이다. 491년(소지왕 13)에 극달(極達)이 창건하였으며, 1641년(인조 19)에 수청(秀廳)이 중창하였다.현존하는 당우로는 극락전을 비롯하여 산신각·요사채 등이 있다. 중요문화재로는 보물 관봉석조여래좌상(冠峰石造如來坐像)을 비롯하여 경상북도 유형문화재인 3층 석탑, 석등대석(石燈臺石) 등이 있다.이 중 갓바위 부처라고도 불리는 약사여래좌상은 원광의 제자 의현(義玄)이 돌아가신 어머니를 위하여 638년(선덕여왕 7)에 이 여래상을 조성하였다고 한다."
경상북도 경산시 와촌면 불굴사길 205,(와촌면),35,0,A02,A0201,A02010800,128039,12,20040219090000,http://tong.visitkorea.or.kr/cms/resource/62/1967562_image2_1.jpg,http://tong.visitkorea.or.kr/cms/resource/62/1967562_image3_1.jpg,128.7792471603,35.9451593251,6,20211113015237,24925,1,,불굴사(경산),38405.0,"불굴사는 팔공산 남쪽 기슭에 있으며 자연으로 이루어진 석굴 안에 부처님을 모셨다고 하여 불리워진 이름이다.신라 신문왕 10년(690)에 창건한 것으로  흥성기에는 50여동의 와가(瓦家) 12개의 부속암자, 8대의 물방아를 갖춘 대사찰이었다고 전해 온다. 조선 영조 12년(1739년)에 홍수로 떠내려가 없어지게 되었으나, 그뒤 전라도 송광사 노스님이 다시 세웠다고 한다. 경내에는 보물로  지정된 불굴사 3층석탑과 부처님의 진신사리를 모신 적멸보궁, 약사여래입상 부도 등이 있으며, 원효대사가 수도한 석굴이라 전하는 굴이 있는데 이를 ""원효굴""이라 부르며, 석굴속의 약수터는 신라시대에 조성된 것으로 아동제일약수(我東第一藥水) 라는 글귀가 뚜렷하게 새겨져 있다.  구전에 의하면 이 약수는 장군수라고도 하는데, 김유신 장군이 이 물을 마시면서 삼국통일의 염원을 기도하였던 장소로도 알려져 있다.특이한 것은 불굴사 주변 일대에 우기가 있으면 불상의 얼굴 부분에 땀이 나고 특히 큰비가 오기 전에는 불상의 온몸이 흠뻑 젖는다고 하는데  지금도 비가 온다는 일기예보가 있거나 하면 반드시 석불의 몸에 습기가 가득 찬다고 한다."
경상북도 경산시 와촌면 갓바위로81길 716-64,(와촌면),35,0,A01,A0101,A01010200,126019,12,20031028090000,http://tong.visitkorea.or.kr/cms/resource/34/655734_image2_1.jpg,http://tong.visitkorea.or.kr/cms/resource/34/655734_image3_1.jpg,128.7397133654,35.9865761206,6,20211231221016,46285,1,,팔공산도립공원(갓바위지구),38400.0,"팔공산은 경산시의 북쪽에 위치한 해발 1192.3 m의 높은 산으로 신라시대에는 중악, 부악으로 알려진 명산이다. 이곳에는 관봉석조여래좌상(갓바위), 원효사, 천성사, 불굴사 등 신라 고찰과 문화유적이 많다.
 전체면적  95.687㎢(9,569ha)
 공원구역  91.487㎢(9,149ha)
 공원보호구역  4.2㎢(420ha)"
