addr1,addr2,areacode,booktour,cat1,cat2,cat3,contentid,contenttypeid,createdtime,firstimage,firstimage2,mapx,mapy,mlevel,modifiedtime,readcount,sigungucode,tel,title,zipcode,overview
경상북도 영천시 화북면 천문로 2149-368,,35,0.0,A02,A0201,A02010800,317077,12,20071204013412,,,128.8978565855,36.1259632734,6.0,20211214020759,19362,15,,봉림사(영천),38813.0,경상북도 영천시 화북면 자천리 2372번지 학서산(鶴棲山)에 자리한 대한불교조계종 제10교구 본사인 은해사의 말사이다. 얼마나 많은 길들이 우리 앞에 놓여 있었던가. 얼마나 많은 길들을 내가 걸어갈 수 있다고 믿었던가. 얼마나 많은 길들을 결국 밟아보지 못하고 잊어 버렸던가. 영천시 화북면 자천리 학가산에 자리한 봉림사(鳳林寺)는 조선 영조 18년(1742)에 징월스님이 세웠다는 절이다. 경내에는 현재 대웅전과 산신각 그리고 경상북도 유형문화재로 지정된 대웅전의 오래된 불화 석가모니후불탱이 남아 있다. 원래 봉림사는 징월스님은 신라 문무왕 때에 창건한 보현산의 법화사를 옮겨 지어 이 절을 세웠다고 전하고 있다. 봉림사의 주불전인 대웅전은 징월스님이 창건할 당시의 건물로 추정되는데 앞면과 옆면이 모두 3칸짜리의 맞배지붕 건물이다.
경상북도 영천시 자양면 용화길 499,,35,0.0,A02,A0201,A02010800,304806,12,20071129232850,,,129.0090193257,36.1149332832,6.0,20220610104741,19078,15,,묘각사(영천),38814.0,"경상북도 영천시 자양면 용화리 산9번지 기룡산(騎龍山)에 자리한 대한불교조계종 제10교구 본사 은해사의 말사이다. 기룡산(騎龍山) 묘각사는 지금으로부터 1300여년 전 신라시대 선덕여왕 당시 의상스님이 창건한 것으로 전해지는 유서 깊은 사찰로, 영천시 자양면 용화리에 자리하고 있다. 1999년부터 대대적인 불사에 들어가 아미타삼성전을 복원하고 관세음보살상도 새로 제작하였다. 이 절의 부근은 예로부터 불보성지(佛寶聖地)로 널리 알려졌다. 그래서인가 절의 뒷산은 보현보살이 머무른다는 보현산(普賢山)이며, 산 아래 동네는 마을입구부터 미륵불(彌勒佛)의 상주처(常住處)임을 암시하듯 미륵불의 용화삼회법회의 의미를 상징하는 용화동(龍華洞)이다. 이어 삼매동(三昧洞) 덕연동 선원동(禪院洞) 원각동(圓覺洞) 공덕동(功德洞) 정각동(正覺洞) 등 수많은 지명이 마치 화장세계(華藏世界) 불국정토를 표현한 듯한 마을 이름들이 많다. 이렇듯 10만억 국토를 지닌 서방정토는 이곳 기룡산에 유연찰토를 정하며 바로 이 사바에 시현되고 있다."
경상북도 영천시 사곡길 77-81 거동사,,35,0.0,A02,A0201,A02010800,294489,12,20071127015135,,,129.0267250873,36.1502240595,6.0,20220617174003,19295,15,,거동사,38814.0,"거동사(巨同寺)는 경북 영천시 자양면 보현산(普賢山) 남쪽에 자리한 천년 고찰이다. 영천시를 지나 안강 방면으로 나가 조교동 삼거리에서 임고를 따라가면 영천댐으로 가는 길이 나온다. 산허리를 감고 굽이굽이 이어져있는 영천댐을 따라 보현산 쪽으로 약 20km 올라가면 보현산 청소년 야영장 안내 표지판이 보인다. 일명 약초 마을이라 불리는 마을 안길을 따라 약 2km 더 가면 거동사가 보인다. 유난히 저수지가 많은 산길과 맑은 물이 흐르는 계곡 길, 나무마다 주렁주렁 풍성한 열매를 매달아 놓아 마음의 풍요로움을 안겨주는 곳이다. 주변에 남아있는 암자의 유허지를 보아 대찰(大刹)이 있었음이 추측이 되나, 애석하게도 지금은 대웅전과 승방, 요사채 하나와 산신각만 남아있다. 신라 고찰이라고 보기에는 여느 절과 다름없는 평범한 절이지만, 한 때는 건물이 100여채가 자리한 대찰이었다고 마을 주민들에 의해 입으로만 전해올 뿐, 번창했던 시절의 흔적을 확인할 수 없다.거동사가 한참 융성할 당시에는 아침밥을 짓기 위해 쌀을 씻으면 쌀뜨물이 계곡을 따라 흘러내려 3㎞ 아래인 영천댐 상류인 지금의 충효사까지 내려올 정도로 신도가 많았다고 한다.   너무 많이 찾아드는 신도를 감당하기 어려워 한번은 주지스님이 유명한 대사를 찾아가 신도의 발길을 줄일 수 있는 방법을 묻자, 이 대사는 절에 있는 부도군의 위치를 옮기면 된다고 말했다고 한다. 다음날 스님은 부도탑을 지금의 거동사가 정면으로 보이는 산기슭으로 옮겼고 이때부터 거짓말처럼 신도의 발길이 줄어들었다고 한다. 사찰건물도 하나 둘 없어지고 쇠퇴해 지금의 거동사만 남아있게 됐다는 것이다. 최근 이곳으로 부임한 혜휴 주지스님은 그동안 찾지 못했던 부도탑을 수맥연구가의 도움으로 다시 찾았다고 한다. 절 맞은편에 있던 3기의 부도군을 거동사 인근에서 찾아내 지난 4월 지금의 자리로 옮겼다. 이전에 묻혀있던 부도탑에서 엄청난 기운을 느낄 수 있어 곧바로 찾아낼 수 있었다고 한다. 그리고 그동안 신도의 발길이 거의 끊어지다시피 한 이곳에 신기하게도 부도군을 옮긴 후 이번 초파일에는 마을 진입로가 막힐 정도로 많은 신도가 찾아들었다고 한다. 주지 혜휴스님과 거동사 신도님들은 부도군이 옮겨진 후 번창했던 시절의 옛 영광을 다시 찾을 수 있을지도 모른다는 기대감에 차있다."
경상북도 영천시 금호읍 금호로 360-29,,35,0.0,A02,A0205,A02050200,252601,12,20071105090000,,,128.8989035168,35.9373152226,6.0,20220722162614,17258,15,,영천 신월리 삼층석탑,38874.0,"신월동삼층석탑은 9세기 통일신라시대의 석탑으로 높이가 4.75m이다. 이중기단(二重基壇) 위에 3층의 탑신을 쌓아올린 것으로 전형적인 신라석탑의 양식을 잘 지니고 있다. 윗기단부의 면석(面石)에는 8부중상(八部重像)이 양각되어 있고 탑신부는 옥신과 옥개석이 하나의 돌로 조성되었다. 옥개석(屋蓋石) 받침은 4층이고 추녀 밑은 수평을 이루었다. 상륜부는 파손되고 남은 것이 없지만, 오히려 파괴된 상륜부가 전체적인 균형미를 조화롭게 만들고 있으며 화려함이 강조된 무늬는 마모되어 초기의 모습을 잃지 않은 것이 오히려 세월의 풍상을 느낄 수 있게 해준다.   소유자  신흥사"
경상북도 영천시 금호읍 종동길 25,,35,0.0,A02,A0201,A02010400,252602,12,20071105090000,,,128.89089398,35.9065185574,6.0,20220921103336,17721,15,,영천 만취당,38882.0,"만취당은 건물은 조선 선조 때 성리학자인 지산(芝山)조호익(曺好益) 선생의 7세손이며 정조5년(1781년) 전라도 병마절도사를 지낸 조학신(曺學臣, 17321800) 선생이 살던 집으로 만취당은 사랑채에 붙인 이름이다. 조선시대의 유교사상은 주택에도 영향을 미쳐 한 집안 내에서도 남녀의 처소를 안채와 사랑채로 분리하였으며 조상에 대한 제례를 중시하여 사당을 갖추도록 하였다. 이 집은 안채와 중사랑채 및 사랑채가 ㅁ자형을 이루고 있으며, 사당 뒤쪽에는 신주를 모셔다 제사드리는 별묘(別廟) 및 보본재(報本齋) 등이 배치되어 사대부 저택의 면모를 갖추고 있다. 집 뒤의 마을을 감싸고 있는 울창한 소나무 숲은 선생이 손수 심어 이루어낸 것으로 전한다.   수량  목조와가  소유자  조익현  치재 선적(善迪)의 아들로 태어남에 도량과 사람됨이 뛰어나다. 1759년에 영조의부름에 나아가 칼 쓰는 시합을 보였더니 임금님이 장하다고 크게 칭찬하여 사복(司僕) 내승(內乘)으로 임명하였다. 내직으로는 국가의 중요직책을 맡았고, 밖으로는 여러 골의 목사(牧使)로 지냈다. 선생이 백성을 다스림에 정성을 다하니 정조께서도 높이 칭찬하여 규장각지(奎章閣誌)와 대전통편(大典通偏)등을 각각 1부와 말 한필을 하사하였다. 세상을 하직함에 임금으로부터 부조와 제문이 내려졌다."
경상북도 영천시 서당길 25-34,(도남동),35,0.0,A02,A0201,A02010700,252603,12,20071105090000,,,128.9351114627,35.9366270889,6.0,20211013002118,16603,15,,완귀정,38898.0,"완귀정은 조선 중종(15061544)때의 학자이며 시강원 사서설서(司書說書)를 역임한 완귀 인종이 등극(登極)한 지 1년도 못되어 승하하자 스스로 사직하고 낙향하여 학문을 연구하고 후학을 가르치던 곳으로 명종 원년(1546) 전립되었다. 완귀정은 숙종21년(1695) 성재 안후정(安后靜)이 중수하였고, 식호와(式好窩)는 영조 40년(1764) 후손들이 세웠다고 한다. 정침(正寢)은 안채에 해당되며 완귀정은 사랑채로서 전면은 단층으로 되었으나, 후면은 누사(樓舍)로 호계천(虎溪川)을 향하여 누(樓)를 두었고, 기둥머리는 익공(翼工)으로 장식하였다. 식호와(式好窩)는 좌·우에 누를 두었는데, 그 꾸밈을 달리하여 계절에 따라 선택하여 사용하였던 것으로 보인다. 소박하게 꾸민 선비의 집으로 지방적인 특색을 나타내고 있다.   수량  2.159㎡  소유자  고천서원  안증(安 14941533)  안증은 남원부사를 역임한 구()의 둘째 아들로 태어났다. 그의 호는 완구(玩龜)이며 아버지가 김종직의 문인이었기 때문에 그의 영향을 많이 받았다. 그는 처음부터 벼슬에는 뜻이 없고 학문에만 심취하여 성리학의 이론을 깊이 터득하였다. 후일에는 성리학의 이론이 실지 생활과는 유리되는 점이 많음을 지적하고 실학사상에 심취하였다. 1540년 별시문과에 급제하여 형조좌랑을 거쳐 세자 시강원 사서설서(司書設書)가 되었다. 이때부터 후일 인종이 된 세자에게 학문보다는 정치문제에 큰 비중을 두고 강론하였다. 그러나 인종이 승하하자 모든 백성은 빈상의 관계없이 엄격한 평등을 지향하는 민본사상을 주창한 그의 이상은 무산되었으며, 또한 을사사화로 많은 사람들이 죽어가는 현장을 목격하고 스스로 관직에서 물러나 평소 보아둔 영천으로 내려와 평생을 학문에만 전념하였다."
경상북도 영천시 고경면 호국로 1720,,35,0.0,A02,A0201,A02011000,252604,12,20071105090000,,,129.1115558126,35.9806393146,6.0,20211015230834,22723,15,,국립영천호국원,38902.0,"나라와 민족을 위해 고귀한 목숨을 바친 호국 영령을 추모하며 그분들의 희생과 애국애족의 숭고한 정신을 기리기 위해 세워진 곳이다. 현재는 추모뿐만 아니라 전후 세대의 호국 안보교육장으로 활용되고 있다. 영천은 나라가 위기에 봉착했을 때 굳건히 이겨낸 영광스러운 역사의 현장으로 곳곳에 선인들의 자취가 남아 있다. 특히 민족의 비극이었던 한국전쟁 당시 신녕전투는 낙동강 방어선의 최후보루로서 총반격의 도화선이 되었으며, 나라의 운명을 되살린 전투로 기억되고 있다."
경상북도 영천시 교촌길 34,(교촌동),35,0.0,A02,A0201,A02010700,231941,12,20071016090000,,,128.9282444586,35.9698759751,6.0,20220922172214,18313,15,,영천향교,38844.0,"조선시대에 현유(賢儒)의 위패를 봉안, 배향(配享) 하고 지방민의 교육과 교화를 위하여 창건되었다. 1435년(세종 17)에 대성전을 건립하고, 1513년(중종 8)에 군수 김흠조(金欽祖)가 중수하였으며, 임진왜란 때 사인(士人) 이현남(李顯男)이 대성전에 봉안되어 있던 5성의 위패를 자양면 기룡산(騎龍山)의 성혈암(聖穴巖)으로 옮겨 난을 피하였다가 환안(還安：다시 제자리에 모시는 것)하였다. 1622년(광해군 14)에 군수 황효의(黃孝儀)가 중건하였으며, 명륜당은 1546년(명종 1)에 군수 이중량(李仲樑)이 창건하였는데, 1570년(선조 3)에 소실되었다. 임진왜란 뒤 1619년 군수 조명운(曺明鄖)이 중건하였다가 1782년(정조 6) 화재로 일부 건물이 소실되어 2년 뒤인 1784년 군수 심진(沈鎭)이 다시 수축하였다. 그 뒤 현종∼숙종 때 군수 한명원(韓明遠)이 전사청(典祀聽)을 신축하였고 고종 때 군수 남필우(南泌佑)가 보수하였다. 1970년에는 서재(西齋), 1972년에는 동재(東齋), 그리고 1973년에 전사청을 보수하였다. 현존하는 건물로는 5칸의 대성전, 10칸의 명륜당을 비롯하여 동재·서재·삼일재(三一齋)·전사청·내삼문(內三門)·외삼문(外三門) 등이 있다."
경상북도 영천시 숭렬당길 1,(성내동),35,0.0,A02,A0201,A02010700,231935,12,20071015090000,,,128.9289167177,35.9664680399,6.0,20210817231347,21066,15,,영천 숭렬당,38846.0,조선 세종 때 대마도와 여진 정벌에 공을 세운 이순몽 장군의 집으로 세종 15년(1433)에 중국식으로 지은 건물이다. 1970년 문화재로 지정된 뒤 복원공사를 한 건물로 지금은 장군의 위패를 모시고 제사를 드리는 사당으로 쓰고 있다. 규모는 앞면 5칸·옆면 3칸이며 지붕은 옆면에서 볼 때 사람 인(人)자 모양인 맞배지붕인데 그 양쪽 끝 칸에 날개를 단 듯 지붕을 덧달았다. 따라서 전체로 보면 옆면이 여덟 팔(八)자 모양과 비슷한 팔작지붕으로 볼 수 있다. 이 같은 모양은 맞배지붕이 팔작지붕으로 변하는 과정을 보이고 있는 지붕 형식이다. 지붕 처마를 받치기 위해 기둥 위부분에 장식하여 짜은 구조는 새부리 모양으로 뻗쳐 나왔다. 평면은 가운데 3칸보다 양쪽 끝 칸이 한 자씩 좁으며 건물 안쪽의 천장은 가구가 훤히 보이는 연등천장으로 꾸미고 있다. 구조가 조선 전기의 수법을  보이고 있지만 일부 재료의 정교하고 아름다운 조각들이 조선 후기의 수법을 나타내고 있다. 조사 결과 몇 차례 수리가 있었던 것으로 보이는데 대체로 검소하고 건실하게 지은 집이다.   소유자  이수채 외 13명
경상북도 영천시 청통면 보성리,,35,0.0,A02,A0201,A02010700,231928,12,20071012090000,,,128.8411542169,35.9940966038,6.0,20220622095000,16492,15,,영천보성리암각화,38870.0,"암각화는 선사시대 사람들이 바위나 동굴벽에 기호나 물건, 동물 등의 그림을 새겨놓은 것을 말하는데, 주로 농사의 풍요와 생산을 기원하던 주술행위의 결과물로 보인다. 이 암각화는 거북이 모양으로 생긴 바위 한 쪽 옆면에 7개의 그림을 새겨 놓았다. 그림을 새긴 면의 넓이는 최대 길이 337㎝, 최대 폭 130㎝이다. 포항 칠전리와 고령 양전동, 영주 가흥리에 있는 암각화와 비슷한 것으로 보아 같은 문화유형으로 추정되나, 각 그림의 세부형식이 조금씩 달라, 서로 시대가 달랐거나 혹은  지역이 다르기 때문인 것으로 보인다. 연대를 정확하게 규명하기는 어렵지만 청동기 후기나  철기시대 초기 단계의 것으로 보이며, 선사시대 경북지방에 살았던 사람들의 생활방식과 정신세계를 이해하는데 중요한 자료이다."
경상북도 영천시 청통면 청통로 951,(청통면),35,0.0,A02,A0201,A02010800,128155,12,20040531090000,http://tong.visitkorea.or.kr/cms/resource/22/702622_image2_1.jpg,http://tong.visitkorea.or.kr/cms/resource/22/702622_image3_1.jpg,128.7897032565,35.9918431212,6.0,20220627150046,42076,15,,은해사(영천),38866.0,"은해사는 조선 31본산, 경북 5대 본산, 현재는 대한불교 제 10교구 본사의 자리를 지키는 경북지방의 대표적 사찰이다. 그리고 교구 본사 중 본존불로 아미타불을 모시는 미타도량으로도 유명하다. 신라 41대 헌덕왕 1년(809년) 혜철국사가 해안평에 창건한 사찰이 해안사인데 이 해안사로부터 은해사의 역사가 시작된다. 현존하는 암자만도 여덟개가 있고 말사 숫자가 50여 개에 이르고 한국 불교의 강백들을 양성, 교육하는 ""종립 은해사 승가 대학원""이 있는 사찰이기도 하다. 불, 보살, 나한 등이 중중무진으로 계신 것처럼 웅장한 모습이 마치 은빛 바다가 춤추는 극락정토 같다 하여 붙여진 이름이 은해사이다. 또 은해사 주변에 안개가 끼고 구름이 피어날 때면 그 광경이 은빛 바다가 물결치는 듯 하다고 해서 은해사라고도 한다. 은해사는 현재 말사 39개소, 포교당 5개소, 부속암자 8개소를 관장하고 있는 대본사이다. 1943년까지만 하더라도 은해사에는 건물이 35동  245칸에 이르러 대사찰의 위용을 자랑했지만, 현재 은해사 본사 내에는 19개 건물만이 자리를 지키고 있다.  은해사는 조선시대 대부분의 산지가람처럼 단탑단금당식 (單塔單金堂式)으로 가람배치가 되어있다. 대웅전 앞에 있던 오층석탑은 최근 보존을 위해서 부도전으로 이전하였다. 대웅전 앞에는 보화루가 있고 보화루 좌우로 심검당과 설선당이 있으며 그 가운데 장방형의 정원이 있는 중정식 가람배치 구조이다. 중정은 장방형이지만 중간부분에 계단을 축대를 만들어 놓아서 보화루로 들어오는 참배객이 볼 때,  정방형에 가깝게 보여서 대웅전이 더 웅장하게 다가오는 느낌을 준다.   은해사의 성보문화재 은해사 내에는 보물인 은해사 괘불 탱화, 대웅전 아미타 삼존불, 후불탱화, 괘불신장탱화. 쇠북 등 수많은 문화재가 있다.   주요문화재  거조암 영산전(국보),백흥암 극락전수미단(보물),운부암 청동보살좌상(보물),백흥암 극락전(보물)"
경상북도 영천시 임고면 포은로 447,(임고면),35,0.0,A02,A0201,A02010700,126925,12,20040218090000,http://tong.visitkorea.or.kr/cms/resource/16/2005716_image2_1.jpg,http://tong.visitkorea.or.kr/cms/resource/16/2005716_image3_1.jpg,128.9734335998,36.0166076426,6.0,20211026003111,30993,15,,임고서원,38817.0,"이 서원은 고려 말기의 충신 정몽주를 추모하기 위하여 1553년(명종 8)에 노수(盧遂), 김응생(金應生), 정윤량(鄭允良), 정거(鄭琚) 등 향내 유림들이 임고면 고천리 부래산(浮來山) 아래 창건을 시작하였다. 1554년(명종 9)에는 명종으로부터 사서오경과 많은 위전(位田)을 하사받아 사액서원이 되었다. 최초의 사액서원인 백운동서원이 사액 된지 불과 5년 만에 사액되었으므로 초기 서원에 해당함을 알 수 있다. 이 때 역사가 깊은 이 서원이 훼철된 것은 개경에 있는 숭양서원(崧陽書院)에서 포은 선생을 향배하고 있었기 때문이다. 1919년 존영각을 건립하여 포은 선생의 영정만 모시고 향사를 지내오다 1965년에 다시 복원하여 위패를 모셨으며, 1980년에 보수정화 하였다. 이곳에 임고서원이 들어서게 된 것은 포은 선생의 부모 묘가 서원 뒤편 부래산에 있기 때문이다. 부래산 기슭에는 포은 선생의 부 일성부원군 운관(云瓘) 묘와 어머니변한국부인 영천 이씨 묘가 함께 있다. 그리고 서원 바로 옆에 묘소를 지키는 계현재(啓賢齋)가 있다."
경상북도 영천시 자양면 포은로 1792,(영천댐관리소),35,0.0,A02,A0205,A02050600,126930,12,20040218090000,,,129.0136259452,36.0635725234,6.0,20220224172629,26208,15,,영천댐,38814.0,"영천에서 국도를 따라 포항방면으로 5분쯤 가다보면 왼쪽으로 뚫린 지방도로가 있다. 이 길을 따라 20분쯤 가면 눈 앞이 탁 트이는 바다 같은 영천댐이 보인다. 댐의 높이는 42m, 제방의 길이는 300m이고, 총 저수량은 9,640만톤으로 1974년에 착공해서 1980년에 준공되었으며, 포항과 영천의 식수와 공업용수로 활용하고 있다. 이 댐의 건설로 자양면의 6개 법정동이 수몰되기도 했지만 어디서 보아도 물과 산이 어우러진 절경이다. 댐으로 가기 전에 주위의 문화재를 살펴보면, 임고면 양항리에 임고서원이 있고, 선원리에 정용준 가옥, 선원동철불좌상, 환구세덕사, 함계정사 등이 있으며, 선원동을 지나면 삼매리에 정재영가옥 및 산수정, 자양서당, 동인각 등이 있다. 또한  댐 주위를 돌아보면 자양면 성곡리에 강호정, 오회공종택, 하천재, 사의당, 삼휴정, 오회당이 있고, 조금 가다보면 생육신 이경은선생을 기리는 용계서원과 제단, 부조묘 등이 있으며, 댐을 지나 보현쪽으로 가면 충효재가 있다.한편, 면사무소 뒤 기룡산에는 천년고찰인 묘각사와 거동사가 자리잡고 있다."
경상북도 영천시 화북면 자천리,1421-1,35,0.0,A01,A0102,A01020100,126931,12,20040218090000,,,128.9149390346,36.1041660665,6.0,20220906141938,26514,15,,영천 자천리 오리장림,38813.0,"이 숲은 길이가 5리(2km)에 달해 옛부터 오리장림이라고 불리워 왔는데 근래에 와서는 자천숲으로 널리 알려져 있다.특히 옛날 도로가 나기 이전에 자천리 일대 좌우 5리에 걸쳐 울창한 숲을 이루고 있다 해서 붙여진 이름이다. 그후 국도가 개설되면서 숲이 좌우로 갈리고 그 후 학교설립, 도로확장, 사라호 태풍 등으로 많은 부분이 유실되어 지금은 자천 마을 앞 군락지 등 몇곳에서만 옛  향취를 더듬어 볼 수 있어 아쉬움이 크지만 차량통행이 뜸한 국도를 따라가는 호젓함도 느낄 수 있다. 오리장림은 마을의 바람막이, 제방보호 및 홍수방지를 위해 만들어진 숲으로 현재 굴참나무 등 12종 280여 그루가 숲을 이루고 있으며, 우리 민족의 자연애호사상과 관련하여 귀중한 자료로 천연기념물로 지정하여 보호하고 있다."
경상북도 영천시 문화원길 6,(창구동),35,0.0,A02,A0201,A02010700,126932,12,20040218090000,http://tong.visitkorea.or.kr/cms/resource/32/1614932_image2_1.jpg,http://tong.visitkorea.or.kr/cms/resource/32/1614932_image3_1.jpg,128.9329385699,35.9670541602,6.0,20210831203153,19348,15,,영천조양각,38853.0,"명원루 혹은 서세루라고 불리는 조양각은 고려 공민왕 17년(1368)에 당시 부사이던 이용, 그리고 향내 유림들과 합심하여 지은 건물로서 영남 7루의 하나다. 원래는 조양각을 중심으로 좌우에 청량당과 쌍청당 등, 여러 개의 건물이 있었는데 임진왜란 때 모두 소실되었다고 한다. 현재 조양각은 정면 5칸, 측면 3칸으로 되어 있으며, 이 고장을 거쳐 간 수많은 명현, 풍류객들의 시구가 조각된 80여 개의 현판이 걸려있다. 조양각 경내에는 산남의진비와 영천지구 전승비, 백신애 문학비와 황성옛터 노래비 등의 기념물이 있다."
경상북도 영천시 북안면 돌할매로 484,(북안면),35,0.0,A01,A0102,A01020200,126933,12,20040218090000,,,129.0459238524,35.939873245,6.0,20221109133942,32873,15,,돌할매(영천),38906.0,"무게 약 10kg, 직경 25cm의 화강암을 들면서 자신의 운세를 점친다고 해서 '돌할매'라 부른다. 두손으로 돌을 들어올릴때 돌이 들리면 자신의 염원이 이루어지지 않고, 돌이 꼼짝도 안하면 소원을 이룰 수 있다고 한다. 즉, 염원하는 바에 대해 가부결정을 해 준다는 것이다. 이 돌이 화제를 모으는 것은 예언능력에 대한 신통력 여부보다는 사람에 따라 혹은 염원하는 바에 따라 돌이 들리기도 하고 안들리기도 하기 때문이다. 돌을 드는 요령은 처음에는 아무 생각없이 들어보는 것이다. 정성이 없으면 쉽게 들리는 것을 직접 확인하는 절차이다. 다음에는 본인의 생년월일과 주소, 나이, 성명 등을 말하고 소원이나 애로사항을 이야기 하면 돌이 들리는지 안들리는지를 통해 그 가부를 알려 준다고 한다. 이 돌의 역사는 약 350여년이 되며 마을주민들이 길흉화복이 있을 때마다 돌을 찾아다 제(祭)를 지내왔다고 한다. 또한 마을에 전염병이 돌거나 흉사가 생기면 ""돌할매 다지러 간다""며 참배를 했고 매월 음력 보름이 되면 동민제(洞民祭)를 지내왔다고 한다."
