addr1,addr2,areacode,booktour,cat1,cat2,cat3,contentid,contenttypeid,createdtime,firstimage,firstimage2,mapx,mapy,mlevel,modifiedtime,readcount,sigungucode,tel,title,zipcode,overview
경상북도 영덕군 축산면 신돌석장군길 218,,35,0.0,A02,A0201,A02010500,127227,12,20040210090000,http://tong.visitkorea.or.kr/cms/resource/35/201835_image2_1.jpg,http://tong.visitkorea.or.kr/cms/resource/35/201835_image3_1.jpg,129.4039393798,36.519417111,6,20221013173450,30188,12,,신돌석장군 생가 및 유적지,36419,"조선 말기에 기울어가는 나라를 구하려고 일어선 의병장들은 많지만 신돌석 장군(18781908)처럼 약관의 나이에 평민으로서 의병대장이 되어 활약한 예는 찾아보기 어렵다.  신돌석 장군은 을사조약 다음해인 1906년에 의병을 일으켜 영해,영덕, 평해에서부터 삼척, 양양, 강릉, 원주, 안동, 영양 등 경북 북동부와 강원도 일대까지 신출귀몰하며 왜군에 저항했던 의병장이다. 이 초가집은 '태백산 호랑이'라는 별칭을 얻을 만큼 큰 활약을 벌인 장군의 구국 정신을 기리기 위해 1995년에 복원되었다. 학생들의 문화 유적 탐방 코스로 사랑받고 있다.   신돌석 장군 약력  본관은 평산(平山), 자(字)는 순경(蕣卿)이고, 호(號)는 장산(壯山) 본명은 태호(泰鎬)이다.이명(異名)은 돌석(乭石), 태홍(泰洪), 태을(泰乙), 대호(大浩)이며, 태백산호랑이라는 별명으로 널리 알려져 있다.  1878년(고종 5년) 11월 3일 영덕군 축산면 도곡리(당시는 영해군 남면 복평리)에서 출생하여 퇴계(退係)의 방계인 육이당(六怡堂)이중립(李中立)에게 학문을 배웠다.1895년 명성황후 시해와 단발령으로 전국에서 의병이 봉기하자 10여명의 동지를 규합하여 영해 의병진을 창군, 활약하다 1896년 고종황제의 명으로 해산했다.1905년 11월 을사조약이 일제에 의해 강제체결되어, 전국에서 의병이 봉기하자 1906년3월 장군도 영릉의병진(暎陵義兵陳)이라는 기치를 내걸고 다시 창군하니 각처에서 모여든 동지가 300명이 넘었다 한다.  그 때 장군의 나이 29세였다. 장군은 최고 3000여 명의 의병을 거느리고  경상남북도, 강원도, 충청도에 걸친 넓은 지역에서 항쟁한 의병장이기도 했으나, 일월산, 백암산, 대둔산 등지에 요새를 두고 소수정예로 적을 섬멸하는 게릴라전에도 능했다.1907년  이인영(李麟榮) 13도창의총대장으로부터 경상남북도를 합친  교남창의대장으로 추대되어 서울 공략전에 참여했으나 평민이란 이유로 배제되었다. 1908년 11월 18일 엄동설한을 앞두고 굳게 믿었던 부하의 손에 무참히 살해되어 31세의 나이로 순국하였다. 1962년 건국훈장 대통령장에 추서되었으며, 1971년 장군의 유해가 국립묘지유공자 묘역으로 이장되었다. 1995년 도곡리에 생가가 복원되었고 1999년 장군의 혼이 어린 자리에 장군의 항일 정신을 길이 후대에 남기고 빛내기 위해 성역화 공원과 기념관이 세워졌다."
경상북도 영덕군 창수면 인량길 178,,35,0.0,A02,A0201,A02010600,128026,12,20040114090000,http://tong.visitkorea.or.kr/cms/resource/58/2037158_image2_1.jpg,http://tong.visitkorea.or.kr/cms/resource/58/2037158_image3_1.jpg,129.3712746237,36.5522294128,6,20220523180051,23693,12,,인량리 전통테마마을,36401,"상고시대에 우시국이라는 부족국가가 있어  나라골이라 불리다 조선초기에는 마을형상이 양쪽 날개를 펼쳐 놓은 것 같은 산세에 그 날개깃에 마을이 달린 듯하다고 해 나래골(翼洞)이라 불렸으며,  조선 광해군때부터는 어질고 인자한 현인들이 많이 배출되는 마을이라 해 인량리(仁良里)라 불리는 마을이다. 이 마을에는 1400년대부터 1700년대 사이에 지어진 □자형, ㅡ자형 전통가옥이 20여채나 있고, 이 지방에서는 독특한 ㄷ자형 가옥도 있다. 그 뿐 아니라 6개의 문화재가 있고, 5대성 8종가가 거주하면서 고려시대 이후 현재에 이르기까지 유명한 석학과 인물을 많이 배출한 전통있는 양반 마을이다. 이 마을은 또  안동에서 이 마을 재령이씨 문중에 시집 온 장씨부인이란 여인이 주인공으로 등장하는 이문열의 선택이라는 소설의 배경마을이기도 하다."
경상북도 영덕군 남정면 동해대로 3592,,35,0.0,A01,A0101,A01011200,126097,12,20031222090000,http://tong.visitkorea.or.kr/cms/resource/61/2021961_image2_1.jpg,http://tong.visitkorea.or.kr/cms/resource/61/2021961_image3_1.jpg,129.375582198,36.2824379283,6,20220623135506,52223,12,,장사해수욕장,36463,"영덕읍에서 남쪽으로 16km 떨어진 장사해수욕장은 백사장 길이 900m, 폭 80m, 평균 수심 1.5m의 자그마한 해수욕장으로 인근 사람들이 많이 찾는다. 백사장 뒤로 소나무숲이 우거져 있으며, 탈의장, 샤워장, 주차장 등도 갖추고 있다. 2km의 넓은 백사장과 편리한 교통(7번 국도 인접), 1.3m 얕은 수심 등 여건이 좋은 편이다. 또한, 누구나 조개를 잡을 수 있으며, 레저시설(수상스키, 바나나보트, 제트스키)과 가자미, 광어, 우럭 등이 잡히는 바다 낚시터로도 유명하다."
경상북도 영덕군 병곡면 고래불로 394,,35,0.0,A01,A0101,A01011200,126103,12,20031222090000,,,129.4103503413,36.5988498611,6,20220222110302,106963,12,,고래불해수욕장,36404,"영덕에서 북방으로 24km를 중심으로 영해면 대진해수욕장과 이웃한 해수욕장이다. 울창한 송림에 에워싸여 있으며, 금빛 모래는 굵고 몸에 붙지 않아 예로부터 여기에서 찜질을 하면 심장 및 순환기 계통 질환에 효험이 있다는 이야기가 전해져 내려온다. 해변 길이가 8km에 이르는 긴 백사장 덕분에 대진해수욕장과 함께 동해의 명사 20리로 불리며 길고 긴 백사장, 얕은 수심, 깨끗한 에메랄드빛 바닷물, 울창한 송림이 만들어주는 시원한 그늘로 가족 피서지로 적합하다. 또 해수욕장내에 샤워장, 화장실, 급수대, 매점, 주차장 등의 편의시설이 잘 갖추어져 있어 이용하는데 불편함이 없다.  주변에 위정약수터와 고려후기 명승 나옹선사가 창건한 장육사가 있으며,  영해면 괴시리에는 고건축물이 산재해 있고, 해안도로를 따라 200년된 고가옥이 30여 동이나 있는 전통마을이 있다. 맑고 깨끗한 청정바다로 해안도로의 해맞이공원과 인근방파제 어느 곳이던 낚시를 드리우면 우럭, 학공치, 고등어, 돔 등이 심심찮게 낚인다. 강구에서 고래불까지의 해안도로는 그 경치가 절경으로 해안 드라이브코스로서 제격이며, 영덕의 특산물인 대게와 맑고 깨끗한 청정해역에서 잡힌 신선한 생선회는 식도락가들의 입맛을 돋운다. 해안도로를 따라 즐기는 해안절경과 고래불 해수욕장에서 7번국도를 타고 북쪽으로 쭈욱 달리면 동해안의 유명한 관광지는 거의 다 돌아볼 수 있는 하나의 드라이브 코스가 된다."
경상북도 영덕군 영덕읍 영덕대게로 1213,,35,0.0,A01,A0101,A01011200,127161,12,20031222090000,http://tong.visitkorea.or.kr/cms/resource/67/786067_image2_1.jpg,http://tong.visitkorea.or.kr/cms/resource/67/786067_image3_1.jpg,129.4311837414,36.4410876537,6,20220623165904,31771,12,,오보 해수욕장,36424,"전형적인 갯마을의 간이해수욕장으로 백사장의 길이는 600m쯤 된다. 근처에 영덕군에서 조성한 해맞이 산책길이 꾸며져 있으며, 강구축산 간 해안도로변에 있어 찾아가기도 수월하다. 또한, 주변의 갯바위들은 감성돔, 보리멸, 광어, 가지미 등이 잘 잡히는 바다낚시터이다."
경상북도 영덕군 달산면 팔각산로,,35,0.0,A01,A0101,A01010900,127441,12,20031222090000,http://tong.visitkorea.or.kr/cms/resource/21/2716521_image2_1.jpg,http://tong.visitkorea.or.kr/cms/resource/21/2716521_image3_1.jpg,129.2589466431,36.3297469901,6,20220519093445,96773,12,,옥계계곡,36449,"태백산 줄기의 끝자락인 달산면 옥계계곡은 천연림으로 뒤덮인 팔각산과 동대산의 기암절벽이 이루어낸 깊은 계곡이다. 인적이 없는 바위 틈 사이를 지나 오십천으로 흘러내리는  옥같이 맑고 투명한 물은 그 이름에 전혀 손색이 없을 만큼 맑고 깨끗하며, 기암괴석과  어우러져 하얀 물보라를 일으키며 돌아드는 풍경은 장관을 이루어 이곳을 찾는 사람들의 마음을 사로잡는다. 또 침수정(경상북도 문화재) 아래를 굽이쳐 흐르는 맑고 깨끗한 물은 50여개의 작은 내와 어우러져 영덕의 젖줄인 오십천을 이룬다. 주말마다 많은 사람들이  즐겨찾는 이곳은 맑은 계곡과 등산로가 있어서 가족을 동반한 야영에도 아주 좋다."
경상북도 영덕군 영덕읍 영덕대게로 968,,35,0.0,A02,A0202,A02020700,127710,12,20031222090000,http://tong.visitkorea.or.kr/cms/resource/09/2043609_image2_1.jpg,http://tong.visitkorea.or.kr/cms/resource/09/2043609_image3_1.jpg,129.4330813563,36.4221481757,6,20220519185024,48009,12,,영덕해맞이공원,36425,"전국 제일의 청정해역과 울창한 해송림으로 둘러쌓여 있던 창포리 동해안 일대가 1997년 2월 대형 산불로 페허가 되어 방치되다 4년간의 노력으로 수려한 해안절경과 무인등대를 활용한 인공공원을 조성하였다. 산불피해목으로 침목계단을 만들어 산책로를 조성하였으며, 사진촬영과 시원한 조망을 위한 전망데크와 휴식공간을 위해 파고라를 만들었고, 어류조각품 18종을 실시간 방송되는 음악과 어우러지도록 조성하였으며, 야생화와 향토수종으로 자연학습장을 조성하였는데, 수선화·해국·벌개미취 등 야생화 15종 30만본을 식재하였고, 해당화·동백·모감주나무 등 향토수종 8종 7만 본을 식재하였다.
64km 청정해역이 펼쳐지는 강축도로변에 위치하고 있어 교통이 편리하며 전면의 푸른 바다와 뒷면 넓은 초 지, 해송조림지로 열린 공간이 형성되어 있다.
해맞이공원 전면에는 야생꽃 2만 3천여 포기와 향토수종 꽃나무 900여 그루가 심어져 아름다움을 더하고 1천 500여개의 나무계단이 파고라와 파고라를, 해안도로와 바다까지를 얼기 설기 엮어 멋진 산책로를 이루고 있다.
산책로를 따라 걷는 도중에는 전망테크가 두군데 설치돼 동해바다를 한눈에 관망하면서 사진을 촬영하기에 최적의 장소이며, 자연경관과 조화롭게 랜드마크적인 등대  창포말 조형등대가 1개소 있고, 특히 가장 선명 하고 멋진 일출 광경을 볼 수 있다는 매력 때문에 새해에는 물론 평일에도 일출의 장관을 보려는 사람들과 여유로운 휴식을 취하기 위해 찾아드는 사람들의 발길이 계속이어지고 있다."
경상북도 영덕군 영해면 호지마을1길 16-1,,35,0.0,A02,A0201,A02010600,127714,12,20031222090000,http://tong.visitkorea.or.kr/cms/resource/10/1967610_image2_1.jpg,http://tong.visitkorea.or.kr/cms/resource/10/1967610_image3_1.jpg,129.4165708929,36.5431729856,6,20220516145246,38320,12,,괴시리 전통마을,36416,"200여년 된 고가옥들이 30여 동이나 즐비한 괴시리 전통마을은 영양 남씨 집성촌으로 400여 년간 세거를 누리며 살고 있는 팔자 형국의 마을이다. 마을 전면에는 영해 평야가 광활하게 전개되어 있고, 옛날에 호지가 있었다고 하여 호지골이라 부르게 되었는데 일명 호지마을로도 불리워지고 있다. 그리고 괴시라는 현마을 명칭은 고려 공민왕 8년 때 목은 이색 선생과 교분이 두터운 중국 사신 래왕 시가 마을을 방문하다 마을 형상이 괴시리 수구 풍면의 호지촌과 비슷하다하여 괴시리라 칭하게 되었다. 도내에서도 보기 힘든 고가옥들로  남씨 괴시파종택외 6점의 고택이 지정되어 문화재로 관리되고 있다."
경상북도 영덕군 강구면 해상공원길 120-7,,35,0.0,A02,A0202,A02020100,126143,12,20031219090000,http://tong.visitkorea.or.kr/cms/resource/28/2651028_image2_1.jpg,http://tong.visitkorea.or.kr/cms/resource/28/2651028_image3_1.jpg,129.3858070637,36.3509970113,6,20220217111750,51311,12,,삼사해상공원 (삼사해상산책로),36460,"아래로는 포항시, 위로는 울진군과 맞닿아 있는 영덕군은 영덕대게와 평민 의병장 신돌석으로 유명한 고장이다. 드라마의 무대로 강구항이 알려지면서 영덕의 관광산업은 크게 발전했다. 강구항 남쪽, 동해바다가 시원하게 내려다보이는 곳에  자리잡은 삼사 해상공원은 주위의 경치가 아름다워 주말이면 가족단위로 많이 찾는 공원이다. 경북 100주년을 기념하여 만들어진 29t의 경북 대종과 공연장, 테마랜드와 방갈로, 해피랜드와 기타공원 내 식당, 매점 등이 20t 규모의  천하제일 화문석과 인공폭포, 동해바다 경관과 어우러져 가족휴양지로 좋다. 이북의 고향을 그리는 마음으로 세워진 망향탑과 매년 1월 1일 전국에서 오는 분들과의 해맞이 축제시 벌이는 제야의 타종은 경북의 대표관광지로 자리잡고 있다."
경상북도 영덕군 병곡면 칠보산길 587,(병곡면),35,0.0,A01,A0101,A01010600,127712,12,20031028090000,http://tong.visitkorea.or.kr/cms/resource/13/2026513_image2_1.jpg,http://tong.visitkorea.or.kr/cms/resource/13/2026513_image3_1.jpg,129.370367394,36.611278228,6,20220519172738,124227,12,,국립 칠보산자연휴양림,36404,"태백산맥의 끝 부분이 영덕군의 서쪽으로 이어져 서쪽이 높고 동쪽으로 갈수록 점차 낮아져 해안 끝에 다다른다. 이 산은 일곱가지 보배를  거느렸던 동해의 명산으로 칠보산이라고도 한다. 옛날 이 산에서 일곱가지 보배가 났다하여 붙여진 이름이다. 즉 돌옷, 더덕, 산삼, 황기, 멧돼지, 구리, 철 등 일곱가지이며, 산세가 수려하여 정상에 오르면 동해의 푸른 바다가 한눈에 들어온다. 산의 중턱에는 신라 때부터 있었던 유금사라는 절이 있어 지금도 스님의  독경소리가 속세를 잊게 한다. 또 이산의 초입에는 각종 편의 시설과 휴양림을 갖춘 칠보산 자연휴양림이 있어서 여름철에는 피서객들로 만원을 이룬다. 준비물은 텐트, 간단한 식사도구 등이 필요하다."
경상북도 영덕군 영해면 영덕대게로 2840,,35,0.0,A01,A0101,A01011200,126104,12,20030718090000,http://tong.visitkorea.or.kr/cms/resource/65/2021965_image2_1.jpg,http://tong.visitkorea.or.kr/cms/resource/65/2021965_image3_1.jpg,129.4266915867,36.5645374176,6,20221122152307,54278,12,,대진해수욕장,36417,"영덕군 영해면 해안마을인 대진리를 중심으로 펼쳐진 대진해수욕장은 어디 내놓아도 손색이 없을 만큼 해수욕장으로서의 조건을 두루 갖추고 있다.  맑고 깨끗한 바닷물이 그대로 간직되어 있으며, 길이 8km, 폭 100m의 백사장 뒤로는 송림이 병풍처럼 둘러쳐져 있어 장관을 이루고 있다. 또한, 수심이 12m 정도로 깊지 않고 경사도 완만하여 어린이를 동반한 가족단위 피서지로 적당하다. 백사장의 모래는 알이 굵고 질이 좋아 모래찜질에는 그만이며 몸에 잘 붙지 않는 것이 특징이다. 대진해수욕장의 가장 큰 자랑거리는 백사장을 가로질러 흐르는 폭 200m의 송천천이다. 이곳에서는 담수욕을 즐길 수 있어서 천연 샤워장으로도 안성맞춤이다. 또한, 민물과 바닷물이 만나는 곳이라 민물낚시와 바다낚시를 한꺼번에 즐길 수 있고 어족도 풍부한 편이다. 일반적으로 동해안의 해안선을  단조로운 것으로 알고 있지만 축산면 해안만은 예외이다. 산지가 해안에 인접해 있으며, 죽도산 등이 바다로 튀어나와 복잡한 해안선을 그리고 있다. 그 중 대나무 숲이 무성한 죽도산과 동해바다가 어우러진 풍경은 한 폭의 동양화를 떠올릴 만큼 그윽하다. 또한, 축산1리에서 대진해수욕장에 이르는 해안도로는 드라이브를 즐기기에 아주 좋고, 금빛 백사장 위로 하얀 파도가 밀려드는 풍경은 눈부실 정도로 아름답다. "
경상북도 영덕군 남정면 동해대로 4142,,35,0.0,A01,A0101,A01011200,127159,12,20030703090000,http://tong.visitkorea.or.kr/cms/resource/86/201786_image2_1.jpg,http://tong.visitkorea.or.kr/cms/resource/86/201786_image3_1.jpg,129.3799415934,36.3278661912,6,20220622172013,29356,12,,남호해수욕장,36461,"모래결 고운 백사장이 1km의 해안선을 따라 길게 이어져 있어 분위기가 아늑한 해수욕장이다. 수심은 1.5m 내외로 경사가 완만해서 가족 피서지로 제격이다. 삼사해상공원과 강구항에서 가까워 각종 편의시설 이용이 편리하며, 7번 국도변에 있어 찾아가기 편리하다."
경상북도 영덕군 강구면 하저리,,35,0.0,A01,A0101,A01011200,127160,12,20030703090000,http://tong.visitkorea.or.kr/cms/resource/94/183194_image2_1.jpg,http://tong.visitkorea.or.kr/cms/resource/94/183194_image3_1.jpg,129.4079234165,36.3898346941,6,20220902153334,28829,12,,하저해수욕장 (하저리 해수욕장),36453,"1km의 백사장이 해안선을 따라 길게 이어져 있으며 수심은 1.3m 안팎이고 경사가 완만하여 가족휴양지로서 아주 좋다. 가자미, 보리멸, 우럭 등이 잘 낚여서 바다낚시터로도 인기가 있다."
