addr1,addr2,areacode,booktour,cat1,cat2,cat3,contentid,contenttypeid,createdtime,firstimage,firstimage2,mapx,mapy,mlevel,modifiedtime,readcount,sigungucode,tel,title,zipcode,overview
전라남도 영광군 낙월면 안마도,(낙월면),38,0.0,A01,A0101,A01011300,1382503,12,20110908222056,http://tong.visitkorea.or.kr/cms/resource/73/2497473_image2_1.jpg,http://tong.visitkorea.or.kr/cms/resource/73/2497473_image2_1.jpg,126.0277789301,35.3463597205,6,20220308144915,25144,16,,안마도,57069,"안마도는 전남 영광군 낙월면에 위치한 섬으로 법성포에서 39km 떨어진 서쪽 해상에 자리하고 있다. 섬모양이 말의 안장 같다고 하여 안마도라 불리는 이섬은 석만도, 죽도, 횡도, 오도 등의 부속섬과 함께 안마군도를 이룬다. 안마도 근해는 영광굴비로 알려진 마른조기가 주로 잡히는 곳이며 그밖에 멸치. 갈치, 고등어, 넙치, 가자미, 민어, 도미, 장어, 낙지 등도 많이 잡힌다. 또한 이곳에는 해식애와 절리 층이 발달되어 말코바위, 흔들바위 등 웅장한 기암괴석이 경관을 이루는 해안과 300400년된 팽나무와 느티나무가 있으며 길이 813m 폭 6m 규모의 방파제가 있다."
전라남도 영광군 낙월면 송이리,(낙월면),38,0.0,A01,A0101,A01011300,1382445,12,20110908221120,http://tong.visitkorea.or.kr/cms/resource/88/2387488_image2_1.bmp,http://tong.visitkorea.or.kr/cms/resource/88/2387488_image2_1.bmp,126.1449561434,35.283063265,6,20220422173959,21820,16,,송이도,57068,"전남 영광군 낙월면에 위치하고 있는 송이도는 낙월면의 가장 중앙에 있는 섬이며 낙월면 섬 가운데 두번째로 큰 섬이다. 섬 주변에는 각이도를 비롯한 대노인도, 소노인도 등 작은 섬이 자리하며 칠산바다를 끼고있다. 섬에 소나무가 많고 섬의 형태가 사람의 귀와 같다하여 송이도라 한다. 송이도에서는 우럭이 많이 잡히며, 부근의 수역에서 참조기, 새우, 고등어 등이 많이 잡히고 미역과 꽃게는 이 섬의 특산물이다.  관광자원으로는 세계적인 희귀조 노랑부리백로(천연기념물 361)와 수달(천연기념물 330)이 집단 서식하고 있고, 전국 최대 규모로 알려진 왕소사나무군락 등이 있다. 4km에 이르는 몽돌(조약돌) 해수욕장은 주변 경관이 뛰어나며, 해변에는 도자기 제작원료인 규석이 깔려있다.  특히 마을 앞에 위치한 조약돌 (몽돌) 해수욕장은 오랜 세월 동안 파도가 깎아낸 부드럽고 동글동글한 모양의 조약돌이 약 1km 정도 이어져 색다른 풍경을 연출하고 있다. 또한 송이도에서 각이도 사이에는 바닷물이 갈라지는 '모세의 기적'이 나타난다. 바닷길이 열리면 각이도까지 도보로 왕복할 수 있으며, 물이 빠지면 새우, 참새우, 참조개 등이 많이 잡혀 갯벌체험장으로 각광을 받고 있다."
전라남도 영광군 백수읍 대신길3길 33-7,,38,0.0,B02,B0201,B02011000,756327,12,20090623021758,http://tong.visitkorea.or.kr/cms/resource/98/2480098_image2_1.jpg,http://tong.visitkorea.or.kr/cms/resource/98/2480098_image2_1.jpg,126.4038589369,35.3623029957,6,20220802105138,20505,16,,대초마을,57025,"법성포항에서 굴비 정식으로 식사를 한 뒤 백수해안도로로 접어든다. 법성포항을 나오면서 백수 해안도로로 진입하는 길은 길 오른쪽에 있는데 이정표가 작아 잘 안 보인다. 차를 천천히 달리며 유심히 봐야 하는데 그 길을 달려 가다보면 모래미해수욕장을 지나 대초마을이 나온다. 이름 없는 백사장이 길 옆에 나란히 펼쳐져 있고  마을 안쪽에는 바다와 강이 만나는 곳이 있으며 그 위에 다리가 하나 놓여 있다. 물이 차면 다리 밑으로 배가 드나들고 물 빠지면 강 바닥이 드러난다. 강의 끝과 바다의 시작, 그 지점에서 뻘에 구멍을 파 집을 짓고 사는 칠게의 군무를 볼 수 있다."
전라남도 영광군 낙월면 상낙월리,(낙월면),38,0.0,A01,A0101,A01011300,577708,12,20080620015837,,,126.1437720739,35.203480601,6,20220921112501,22497,16,,낙월도,57068,"백제시대에는 무시이군의 고록차현, 통일신라시대에는 염해현, 고려시대부터 조선시대까지는 임치현에 속했으며 진달이섬, 반월도, 대낙월도, 진원도라는 이름으로 불렀다. 조선시대에는 반월도 국영목장을 설치 40필의 말을 방목한 기록이 있다. 1895년 지도군에 편입되었다가 1914년 행정구역 개편으로 영광군에 편입되었다. 현풍곽씨가 16세기 말경 처음으로 입도하여 14대째 살다가 1988년 모두 외지로 나갔다.   달이 지는 쪽에 있다하여 진달이라는 이름이 유래되었으며 한자어로 표기하면서 낙월도가 되었다. 1895년 지도군에 편입되면서 윗쪽에 있는 섬이라 하여 상낙월도라 부르게 되었다. 구비전승으로는 큰애기고랑, 농바위와 널바위 등 설화와 노젓는 소리, 장모채비소리, 상여소리, 등당애타령 등의 민요가 내려온다. 산신제, 풍어제, 액맥이굿, 초분 등의 민간신앙이 있었으나 지금은 모두 중단되었다.   이 지역에서 잡히는 새우와 꽃게는 맛이 좋기로 유명하며 특히 새우젓은 한때 전국 생산량의 50를 점유했었다. 1987년 셀마태풍으로 해선망어선(일명 멍텅구리)6척이 난파되면서 선원 24명이 익사하기도 하였다. 해선망어선은 전통적인 방법으로 새우를 잡는 어선으로 이 섬의 주요 소득원이었으나 1995년 6월 정부의 어업구조 조정사업으로 모두 폐선되고 1척만이 목포에 있는 국립해양 유물전시관 해변광장에 옛 유물로서 전시되고 있다.   섬구성 :    본섬 1, 부속섬 2  면적  : 9,769,144㎡(부속섬 포함 면적)"
전라남도 영광군 군남면 육창로 2,(군남면),38,0.0,A02,A0201,A02010800,337512,12,20071218200012,,,126.427619646,35.1803823327,6,20220518174954,17531,16,,연흥사,57061,"연흥사는 영광군 군남면 용암리 890번지 위치하며, 용암저수지 앞에 있는 서당 마을에서 남서쪽 계곡의 포장된 자동차 한 대가 다닐 수 있는 소로를 따라가면 일명산(현지 주민들은 서운산으로 더 잘 알려져 있다)의 중턱에 자리하고 있다. 연흥사 앞에는 군유산(403.2cm)이 있고 서쪽에 일명산이 있어서 완전히 이들 산속에 묻혀 있다.  보통의 사찰은 앞이 터진 전경을 하고 있는데, 연흥사는 앞까지 산으로 막혀 연화부수(蓮花浮水)형의 터라고 한다. 그러나 연흥사는 답답한 느낌이 없이 매우 아담하고 아늑한 감을 주는 수양처이다. 연흥사를 찾아가는 버스도 사찰에서 2km 정도 떨어진 아랫마을까지만 있을 뿐이다. 마을에서부터 차량이 한 대가 지나갈 수 있는 소로를 따라 올라가면 산 중턱에서 사찰을 만날 수 있다. 산속에 위치하는 것에 비하면 비교적 넓은 대지 위에 자리 잡고 있다. 대웅전 마당에 있는 백일홍과 동백나무는 수령이 500여년이 넘는다고 전하는데 고목이 되어 패인 나무의 줄기가 역사의 유구함을 느끼게 한다.  사찰의 창건주라고 전하는 각진국사(覺眞國師, 12701348)는 백양사, 월남사지, 불갑사 등지에서 수행하였다. 대웅전은 최근에 신축하였지만 전체적으로 균형미가 느껴진다. 단청이나 문창살의 문양도 아름답다. 대웅전 계단 옆 우측의 작은 연못에는 딱 한 그루의 연꽃이 피고, 만개한 수국이 심어져있는데 연흥사의 전체적인 느낌과 잘 어울린다. 마을 주민들의 구전에는 불갑사는 작은 집이고, 연흥사가 큰 집이라고 한다. 이것은 현재 불갑사가 규모면에서 연흥사보다 훨씬 크지만 과거에는 연흥사가 크고 번성하였음을 설명하는 것이다.  연흥사에는 새로이 조성한 대웅전과 선방, 그리고 과거에 대웅전으로 사용하였던 삼성각 등이 있다. 성보문화재로는 전라남도 유형 문화재 제175호 묘법연화경 6종 14책, 전라남도 유형문화재 제258호 목조삼신불좌상, 석탑 1기, 부도 1기, 탱화 5점, 다라니경 목판 1점, 시방삼보자존패 1점 등이 있다. 그리고 사찰에서 500m 떨어진 곳에 마애불 2상이 있다."
전라남도 영광군 백수읍 해안로 847-8,,38,0.0,A02,A0201,A02010700,129222,12,20060911090000,http://tong.visitkorea.or.kr/cms/resource/49/195349_image2_1.jpg,http://tong.visitkorea.or.kr/cms/resource/49/195349_image3_1.jpg,126.38893014,35.344888056,6,20211015192823,18793,16,,영광정유재란열부순절지,57025,"정유재란 당시(1597) 왜적의 참화가 절정에 이른 9월(음) 호남의 서남단일대가 그들의 손아귀에서 신음하고 있을때 함평군 월야면 월악리등에 거주한 동래·진주 양정씨문중 부녀자들은 각기 남편들이 전사 또는 피로(披虜)되자 화를 피해 현위치인 묵방포 앞 칠산바다에 몸을 던져 순절하였다.정려는 두개의 비각이 나란히 서 있다. 두 곳 모두 8각 석주를 세우고 그 위에 팔작지붕형 옥개석을 올려 놓았는데,우측에 8열부비,좌측에는 박씨부인(정박의 처)의 비가 바다를 뒤로하여 배치되었다. 8열부비(총고 170cm)는 전면에「동래 진주정씨팔열부도해순절소」(東萊晋州鄭氏八烈婦蹈海殉節所) 자경(字徑 11cm)과 해서음각(楷書陰刻)하고 뒷면은 8열부의 이름을 밝히고 있다.비측면은 「숙묘칠년신유유월일명정 임오이월일수(肅廟七年辛酉六月日命旌壬午二月日竪)」이라 하여 건립연대(1942)를 기록하였다. 좌측에 있는 비(총고 174cm)는 전면에 「열부박씨순절소( 烈婦朴氏殉節所)」라 해서 음각하고 뒷면에는 열부박씨정려기를 명기하였다. 말미에는 「순종후이십년 병술사월일 근수」라 하여 역시 건립연대(1946)를 기록하였다.   규모  비각 일원  시대  조선시대 "
전라남도 영광군 홍농읍 홍농로 708-28,,38,0.0,A02,A0201,A02010700,129221,12,20060908090000,http://tong.visitkorea.or.kr/cms/resource/00/190300_image2_1.jpg,http://tong.visitkorea.or.kr/cms/resource/00/190300_image3_1.jpg,126.4448205048,35.4208859194,6,20220617153740,17164,16,,영광 성산리지석묘군,57003,"고인돌 45기가 4열을 이루면서 배치되어 있는 이곳은 기둥형 받침돌을 사용한 고인돌들로 전북 고창과 영광, 함평, 장성 등 전남 서북부 지역에서만 보이는 특색있는 형식에 주목할 만하다. "
전라남도 영광군 법성면 법성리,진내리,38,0.0,A01,A0101,A01011400,129217,12,20060907090000,http://tong.visitkorea.or.kr/cms/resource/55/2480055_image2_1.jpg,http://tong.visitkorea.or.kr/cms/resource/55/2480055_image2_1.jpg,126.445321954,35.3607816351,6,20221018110209,21980,16,,법성포,57012,"법성에 조창이 개설된 것은 1천여년 전 고려초엽이다. 유형원(16221673)이 쓴 반계수록에 보면 서기 992년(고려 성종 11년)에 개경이남 12개 조창 가운데 전남에 영광 부용창(법성창), 나주 해육창, 영암 장흥창, 승주 해룡창 4곳이었고 1035년(고려정종원년)에 법성창에는 1,000석을 싣는 초마선 1척과 각선(배) 6척을 배치하였다.  조선 초기에는 영산창과 함께 전라도 이대조창이었는데 그때 법성조창 관할에 속한 고을은 영광, 흥덕, 부안, 함평, 무장, 장성, 정읍, 고부, 고창, 옥과, 담양, 진원, 창평, 순창, 곡성 등 15개 고을을 관할했고1397년(태조 6년)에는 호남곡창의 전세중 전남 전역의 전세를 법성포에 모으면서 그 창고의 방비를 위해서 진량진 수군만호를 배치했으며 조선이 38척 조군만도 1,344명이 되었다. 법성에 수군이 배치되고 영산창의 곡식까지 모두 이곳으로 옮기게 되어 처음에 만 호장이 지휘자로 배치되었던 법성진은 1708년(숙종 34년)검사진으로 승격되었고, 1789년(정조 13년) 수군절제사가 배치되었다.  이때 수군절제사는 진월도(낙월도 : 진달이섬)과 안마도(안마도)의 목장 감독관을 겸했고 경성까지의 조운선 감독책임을 겸했으며 법성창 수곡의 계량을 감독해 일급지로 평가를 받았다. 이때는 법성창의 규모가 설진 초창기보다 줄어 12개 고을 전세만을 받아 들였다. 한말 폐진 직전 이곳에는 병선 8척 외에 조운선 21척이 있었으며 수군만 3백여명이 배치되었고, 이때 동헌자리는 진내리 205번지 (이인상가)에 5칸의 집이었고 뒤쪽에 아사 10칸이 있었다.  법성은 칠산 앞바다에서 조기가 많이 잡혀 칠산해에 파시가 섰을 뿐 아니라 12개 고을 곡식이 모두 실려오고 다시 내가는 창고가 있었던 곳이어서 살기좋은 곳으로 알려져 1895년에는 민호가 715호나 되어 영광읍보다 큰 동네를 이루었다. 성안에는 향교와 3개의 문루(동문, 서문, 홍문)와 동조루(조세검사장), 군기고, 진창, 환상고, 조복고, 빙허정, 복고창(현 파출소), 군기창 등이 즐비했던 이곳은 동학, 임란 등 숱한 난을 겪어오는 동안 불타버리고 남은 것이라고는 진내리 마을 뒤를 두른 성 흔적과 선창가 군기고 지붕과 샘 2개 뿐이다.  성안 서쪽 객사터 밑에 있던 제월정 자리에는 1957년 이곳 주민들이 다시 월량대, 제월정을 복구했었으나 그것마저 1974년 화재로 소실되어 지금은 주춧돌만 남아 있다. 법성은 이처럼 조선때 수군 겸 조운 및 조세수납의 요충이었거니와 이에 앞서도 많은 역사적 사실을 갖고 있다."
전라남도 영광군 법성면 백제문화로 203,(법성면),38,0.0,A02,A0201,A02010800,129218,12,20060907090000,http://tong.visitkorea.or.kr/cms/resource/22/1607922_image2_1.jpg,http://tong.visitkorea.or.kr/cms/resource/22/1607922_image3_1.jpg,126.4314037163,35.3620118202,6,20220519165204,44631,16,,백제불교최초도래지,57009,"한반도 불교 전파는 삼국시대 고구려(소수림왕 2년 전진의왕 부견)와 신라(눌지마립간때 묵호자)의 경우는 불교의 전래경로와 초전 법륜지가 분명하나 백제불교의 전래는 전해진 경로와 최초도래지가 불확실하였으나 인도의 명승 마라난타 존자가 영광의 법성포로 들어와 불법을 전하고 불갑사를 개창하여 백제 불교가 시작되었다고 구전되어 왔다. 1998년 영광군의 학술고증(동국대학교)을 통하여 영광땅이 백제불교의 최초 도래지라는 사실을 밝혀내게 되었다. 법성포 좌우두는 인도승 마라난타가 A.D 384년에 중국 동진을 거쳐 백제에 불교를 전하면서 최초로 발을 디딘 곳으로 이를 기념하기 위해 관광명소로 개발하고 있다. 법성포의 법(法)은 불교를, 성(聖)은 성인인 마라난타를 가리킨다.  부지면적  45,439㎡ (13,745평) "
전라남도 영광군 법성면 진내리,,38,0.0,A02,A0201,A02010200,129219,12,20060907090000,http://tong.visitkorea.or.kr/cms/resource/36/190236_image2_1.jpg,http://tong.visitkorea.or.kr/cms/resource/36/190236_image3_1.jpg,126.4425998711,35.3648922351,6,20220916151527,18299,16,,영광법성진성,57009,"법성진성은 남쪽으로 바다와 접한 구릉의 남사면에 있으며, 평면상 직사각형의 형태를 이루고 있다. 법성진성은 돌로 쌓은 석성으로, 동서 너비 약 200m, 잔존 최대 높이 300㎝ 내외, 성벽의 너비 700㎝ 내외의 규모이다. 남벽이 모두 파괴되어 남북의  길이를 정확히 알 수 없으나 동서의 길이는 250m이다. 현재 남아 있는 성벽의 길이는 동벽 75m, 북벽 250m, 서벽 125m, 남벽 10m로 총 길이는 460m인데 밖으로 돌출된 치부분을 포함하면 더 길어진다. 성벽은 외벽을 돌을 쌓아 올리고 그 안쪽으로는 잡석과 흙을 섞어 채워 넣은 형태이다. 법성진성의 성벽은 잔존상태가 비교적 양호한 편이다. 동벽은  북쪽의 성벽이 잘 남아 있으며, 동벽과 북벽이 만나는 모서리 부분은 광주이동통신 중계탑이 설치되면서 파괴되었다.  북벽은 대부분 흙으로 덮여 있는데, 북벽의 중간에서 동쪽으로 약간  치우친 지점에 반원형을 이루면서 돌출된 치(雉)가 설치되어 있다.  서벽은 남쪽 일부를 제외하고는 비교적 잘 남아 있다. 서벽의 중간지점에는 문터로 추정되는 부분이 있고 이 문터를 중심으로 북쪽과 남쪽에 각각 치가 설치되어 있다.성 안에서 출토된 기와류·자기류·토기류 등의 유물이 모두 조선시대에 해당하는 유물인 것으로 볼 때 조선시대에 사용된 성으로 추정된다.한편 성벽에는 성을 쌓기 위해 동원된 전라도 관내의 군현명과 쌓은 척(尺), 그리고 감관(監官)·도색(都色) 등의 이름이 새겨져 있다. 글에 나타난 내용으로 보아 인원 동원은 물론 성의 축조와 관련한 당시의 제도 등을 파악하는 데 좋은 자료로 판단된다.법성진성은 성벽이 비교적 잘 남아 있고, 성벽에 새겨진 글 등 조선시대 진성을 연구하는데 매우 귀중한 자료로서 역사적·학술적 가치가 크다."
전라남도 영광군 법성면 법성리 821-1,,38,0.0,A01,A0101,A01010400,129220,12,20060907090000,http://tong.visitkorea.or.kr/cms/resource/40/195140_image2_1.jpg,http://tong.visitkorea.or.kr/cms/resource/40/195140_image3_1.jpg,126.4341255757,35.3668863124,6,20220526162134,21044,16,,영광 법성진 숲쟁이,57011,"법성에서 홍농으로 넘어 가는 산 허리의 능선에 조성된 느티나무를 위주로 하는 인공적인 숲을 말한다. 법성리 산 8211번지, 진내리 산 281번지에는 느티나무, 개서어나무, 팽나무가 자라고 있다. 전체적으로 볼 때는 느티나무가 90를 차지하고 있다. 
나무의 높이는 19m23m에 이르고, 줄기의 가슴 높이 둘레는 0.65m4.20m에 이르고 있으나 1m2.5m에 이르는 것이 가장 많아 71를 차지하고 있다. 3m 이상인 것은 23이며, 4m가 넘는 것은 2주에 지나지 않는다. 이러한 결과에서 볼때 10년생으로부터 300여년생에 이르기까지 다양하지만 100여년 생이 가장 많은 것은 1800년대의 보식을 많이 했기 때문이라 생각된다. 이 수림은 중종 9년(1514) 법성진성을 축조할 때 심었다고 전해지고 있지만 나무의 크기로 볼 때 그 후에 심었던 것으로 생각된다.

  규모 : 8,829㎡
  수령 : 100300년
 느티나무, 팽나무, 개서어나무 등은 모두 우리 나라에 자생하고 있는 낙엽활엽교목으로서 법성포 앞바다(서쪽)에서 불어 오는 센 바람을 막기 위해 집단적으로 심었던 것으로 보여진다. 이 수림은 일명 「숲쟁이」라고도 하는데 지금은 법성면민의 휴양림으로 이용되고 있으며, 매년 음력 5월 5일 단오날에 민속행사 장소로 이용되고 있다. 느티나무는 크게 자라고 장수하기 때문에 정자목과 당산목으로 심어 보호하는 일은 적지 않으나 산지에 이처럼 많은 나무를 집단적으로 심는 예는 찾아 보기 어렵다."
전남 영광군 염산면,,38,0.0,A01,A0101,A01011800,129214,12,20060906090000,http://tong.visitkorea.or.kr/cms/resource/59/194959_image2_1.jpg,http://tong.visitkorea.or.kr/cms/resource/59/194959_image3_1.jpg,126.3412224375,35.2659573244,6,20220607141954,20768,16,,천일염전,"513-861,2","영광의 무공해 천일염은 매년 3만 2천톤(594ha)이 생산되어 전국 생산량의 10를 차지하고 있다. 영광군의 염전 총 면적은 7,240,825㎡이며 백수읍과 염산면에서만 생산된다. 바둑판처럼 반듯하게 나눠진 천일염전은 태양 아래 은빛으로 빛나는 새하얀 소금 알갱이에 눈이 부시는 장관이 연출된다. "
전라남도 영광군 염산면 향화로5길 34-30,,38,0.0,A02,A0201,A02010900,129215,12,20060906090000,http://tong.visitkorea.or.kr/cms/resource/70/194970_image2_1.jpg,http://tong.visitkorea.or.kr/cms/resource/70/194970_image3_1.jpg,126.3767928179,35.2123001016,6,20220719104125,19788,16,,기독교인 순교지,57066,"6.25 당시 북한군의 교회 탄압에 항거하며 신앙을 지키려다 많은 신자들이 순교(염산교회:77명, 야월교회: 65명)한 곳이다. 여기에 이르면 이름없이 사라져간 순교자들의 깊은 신앙심에 숙연해지기까지 한다."
전라남도 영광군 백수읍 해안로 1389,,38,0.0,A01,A0101,A01011200,129216,12,20060906090000,http://tong.visitkorea.or.kr/cms/resource/81/2716381_image2_1.jpg,http://tong.visitkorea.or.kr/cms/resource/81/2716381_image3_1.jpg,126.413952472,35.3627531121,6,20220623105556,29913,16,,모래미 해변,57025,"모래미라는 이름은 한시마을의 옛날 지명이며 해수욕장 규모가 작고 해안선도 길지 않으나, 백사장의 모래가 고우며 주변의 때 묻지 않은 경치가 아름다운 곳이다."
전라남도 영광군 낙월면 송이길 26,,38,0.0,B02,B0201,B02011000,129023,12,20060621090000,,,126.1520640376,35.275128171,6,20220509163400,38518,16,,송이도마을,57068,조약돌해수욕장에서는 맨발로 부드러운 조약돌을 걸으며 해수욕을 할 수 있다. 썰물 때 들어나는 모래등에서는 다양한 갯벌체험이 가능하며 옛날 매장방식의 하나인 초분은 학생들의 체험학습장으로도 유용하다. 조약돌 해수욕장 주변에서는 야영도 가능하다.
전라남도 영광군 홍농읍 홍농로7길 24,(홍농읍),38,0.0,A02,A0202,A02020700,129013,12,20060620090000,,,126.4266859323,35.4239436036,6,20220908131253,27751,16,,한마음공원,57003,"한마음공원은 환경친화적인 녹지 및 휴게공간을 확보하여 원자력발전소 및 주변 지역의 이미지 향상과 지역사회와의 화합의 장소를 마련하고자 2002년도에 조성되었다. 영광원자력본부 인근에 위치한 한마음공원은 호남 최대의 규모인 약 327㎡으로 조성되었으며, 공원 내에는 각종 체육시설, 문화시설 및 전통공원 등이 마련되어 있어 휴양과 체력단련을 위한 장소로 활용되고 있다.또한 국내에서 보이는 많은 야생화가 식재된 야생화동산이 있어 자연생태 체험장으로 활용되고 있으며, 서해안 낙조를 즐길 수 있는 전통 정자가 있어 그 운치가 뛰어나다. 한마음공원은 휴식과 체력단련을 위하여  조성된 공원이므로 이용하는 사람은 주인의식을 가지고 모든 시설과 환경을 아끼고 보호하도록 한다."
