addr1,addr2,areacode,booktour,cat1,cat2,cat3,contentid,contenttypeid,createdtime,firstimage,firstimage2,mapx,mapy,mlevel,modifiedtime,readcount,sigungucode,tel,title,zipcode,overview
전라남도 구례군 토지면 송정리,,38,0.0,A02,A0201,A02010700,1186170,12,20110127002712,http://tong.visitkorea.or.kr/cms/resource/89/1117489_image2_1.jpg,http://tong.visitkorea.or.kr/cms/resource/89/1117489_image3_1.jpg,127.5649770262,35.1971497486,6.0,20220826144545,28097,5,,구례 석주관 칠의사묘,57623,"석주관 칠의사묘는 정유재란 때 구례지방으로 침입하여 왜구를 막기 위해 석주관성에서 적을 맞서 싸우다 장렬히 순절한 구례현감 이원춘을 비롯 왕득인, 이정익, 한호성, 양응록, 고정철, 오종 등의 정신을 기리기 위하여 가꾸어진 유적으로 사적 제106호로 지정되어 있다. 현재 석주관 칠의사단에는 높이 77㎝, 폭 29.5㎝, 두께 12㎝의 똑같은 규모의 칠의사 단비(壇摳)가 세워져 있는데 왼쪽으로부터 이원춘, 왕득인, 왕의성, 이정익, 한호성, 양응록, 고정철, 오종의 순서로 모셔져 있다. 한편 석주관 칠의사 유적의 입구 우측에는 새로이 칠의사의 정신을 기리고자 기념관을 건립하였는데 사당으로 보이는 건물은 정면 3칸, 측면 2칸의 팔작와가로 되어있고 내삼문 밖에는 동·서재(東·西濟)의 건물로 정면 3칸, 측면 2칸의 규모인데 동재는 팔작지붕이고 서재는 맞배지붕이며 그외 외삼문 등이 갖추어져 있다."
전라남도 구례군 문척면 사성암길 303,,38,0.0,A02,A0201,A02010800,317559,12,20071204230005,http://tong.visitkorea.or.kr/cms/resource/83/1917883_image2_1.jpg,http://tong.visitkorea.or.kr/cms/resource/83/1917883_image3_1.jpg,127.4806237802,35.1801668652,6.0,20220516131459,37101,5,,사성암(구례),57632,"사성암四聖庵은 아직 덜 알려진 작은 암자로 거대하지도 웅장하지도 않지만 멋스러움만큼은 으뜸이다. 연기조사가 처음 세운 것으로 전해지는 사성암은 바위 사이에 박혀 있다. 바위를 뚫고 나온 듯한 '약사전'과 바위 위에 살짝 얹어 놓은 듯 단아한 '대웅전' 등 모든 구조물이 산과 하나되어 고운 자태를 뽐낸다. 대웅전 옆으로 난 좁은 길을 돌면 아래로 섬진강이 돌아 흐르고 구례읍과 지리산 노고단이 한눈에 들어온다. 
 사성암은 백제 성왕 22년(544년)에 연기조사가 본사 화엄사를 창건하고 이듬해 사성암을 건립했다. 기록에 의하면 4명의 고승, 즉 원효대사, 의상대사, 도선국사, 진각국사가 수도한 곳이어서 사성암이라고 불리운다.암자 뒤편으로 돌아서면 우뚝 솟은 절벽이 전개되는데, 풍월대·망풍대·신선대 등 12비경으로 절경이 뛰어나다. 사성암에 이르면 높이 20m의 암벽에 독특한 건축기법으로 지어진 약사전 건물이 한눈에 들어온다.  마애여래입상이 약사전 건물 내 암벽에 새겨져있으며 원효 대사가 손톱으로 새겼다는 전설이 전해지고 있다. 오산 사성암은 정상에서 바라보는 아름다운 구례 전경으로 유명하다. 굽이치며 흐르는 섬진강과 넓은 평야, 그 너머 웅장하게 솟은 지리산의 연봉들을 한눈에 볼 수 있다."
전라남도 구례군 구례읍 섬진강로 1234,(구례읍),38,0.0,A02,A0202,A02020600,250345,12,20071023090000,,,127.3692074052,35.2267152442,6.0,20220513171148,34864,5,,곡성섬진강천문대,57662,"곡성섬진강천문대는 아름답고 깨끗한 섬진강이 흐르는 강변에 위치하고 있으며, 한국천문연구원에서 우리나라 순수 과학기술로 제작한 600mm 천체망원을 설치한 주관측실을 비롯하여 정밀도를 자랑하는 다양한 망원경들이 설치되어 있는 보조관측실, 8m 원형돔 스크린을 갖춘 천체투영실, 그리고 각종 천문자료 등을 전시해 놓은 학습공간으로 구성되어 있어, 별에 대한 옛 추억을 되새기고 미래 우주시대 주인공이 되기 위한 꿈과 미래를 찾아 떠나는 우주여행의 길잡이 역할을 하고 있다. 그리고 곡성섬진강천문대는 정확하고 신속한 천문정보 제공을 위해 한국천문연구원과 업무협약을 체결하고 다양한 천문과학문화체험 프로그램을 함께 운영한다. 아름다운 섬진강변에 위치한 천문대는 인접한 곡성 기차마을에서 추억의 증기기관차를 타고, 호젓한 강촌의 멋을 향수하며 즐기는 강변 자전거 하이킹, 스릴을 즐기는 섬진강 래프팅 등 각종 체험 프로그램을 즐길 수 있는 곳으로 사계절 내내 가족과 함께하는 테마여행 코스로 아주 좋은 곳이다.   규모  부지 2,283㎡, 건물 424㎡ "
전라남도 구례군 광의면 월곡길 22-3,,38,0.0,A02,A0201,A02010700,231912,12,20071005090000,,,127.4622707481,35.2528833468,6.0,20220720160944,18195,5,,매천사,57615,"매천 황현(18551910) 선생의 위패를 모신 사당이다.  황현 선생은 한말의 순국지사이자 시인이며 문장가이다. 전라남도 광양에서 태어났으며 어려서부터 시를 잘 짓고 재질이 뛰어났다.  1894년 동학농민운동·갑오경장·청일전쟁이 연이어 일어나자 위기감을 느끼고, 경험과 견문한 바를 기록한『매천야록(梅泉野錄) ·『오하기문(梧下記聞)을 지어 후손들에게 남겨 주었다. 1905년 11월 일제가 강제로 을사조약을 체결하여 국권을 박탈하자  김택영과 국권회복 운동을 시도하였으나 실패하였다. 1910년 8월 일제에게 강제로 나라를 빼앗기자, 절명시 4편과 유서를 남기고 아편을 먹어 자결하였다.1962년 건국훈장 국민장이 추서되었으며 이건창, 김택영과 함께 한 말삼재(韓末三才)라고 불린다.  생전에 살았던 곳에 그의 후손과 지방 유림들이 1955년에 세운 이 사당은 앞면 3칸·옆면 1칸 규모로, 지붕은 옆면에서 볼 때 사람 인(人)자 모양을 한 맞배지붕이다. "
전라남도 구례군 구례읍 동산1길 32,,38,0.0,A02,A0206,A02060300,129447,12,20070305090000,http://tong.visitkorea.or.kr/cms/resource/66/608766_image2_1.jpg,http://tong.visitkorea.or.kr/cms/resource/66/608766_image3_1.jpg,127.4605056649,35.1974034627,6.0,20220315163522,32660,5,,농업기술센터 자연생태학습장,57660,"지리산은  우리나라 야생화의 30인 1,323종을 보유한 야생화의 보고이다. 구례군 농업기술센터는 1988년부터 용담꽃을 시작으로 분화재배 기술, 노고단 향수, 구례소리 전통향, 캐릭터 상품 개발 등 야생화 관련 연구를 지속해 온 야생화의 메카로서 전국 유일의 야생화 압화 전시관, 잠자리 생태 전시관, 농경유물 전시관, 전통 작물 전시관, 야생화 자연학습원, 야생화 재배학습원 등으로 구성되어 있다."
전라남도 구례군 마산면 화엄사로 402-31,,38,0.0,A02,A0206,A02060300,129446,12,20070302090000,http://tong.visitkorea.or.kr/cms/resource/34/1198634_image2_1.jpg,http://tong.visitkorea.or.kr/cms/resource/34/1198634_image3_1.jpg,127.4904990866,35.2423739112,6.0,20220519152551,28833,5,,국립공원공단 종복원기술원,57616,"국립공원공단 종복원기술원은 우리 곁에서 사라져가는 야생동물을 보호하고 복원하는 전문기관으로 우리나라에서 처음으로 중대형 포유류인 반달가슴곰과 산양 복원 등을 진행하고 있다.국립공원공단 종복원기술원의 생태학습장은 복원 프로젝트 과정 중 지리산에 적응하지 못하여 회수된 개체를 증식하는 시설로 탐방객에게 반달가슴곰의 의미와 중요성을 전달하기 위한 시설이며 해설가의 설명을 들으면서, 반달가슴곰의 생태를 직접 관찰할 수 있다."
전라남도 구례군 상위길 3,,38,0.0,A02,A0203,A02030100,129318,12,20061106090000,http://tong.visitkorea.or.kr/cms/resource/66/2516766_image2_1.jpg,http://tong.visitkorea.or.kr/cms/resource/66/2516766_image2_1.jpg,127.488594193,35.3307222399,6.0,20220617175754,19543,5,,위안 산촌마을,57605,"위안마을은 지리산 노고단 만복대 아래 해발 450m의 고지대에 위치하고 있으며, 여름에는 서늘하고 겨울에는 눈이 많이 내리며, 산수유, 고로쇠수액, 지리산 산채 등 특산물이 풍부한 천혜의 관광지이다. 1996년 개장된 지리산온천지구 개발에 따라 연중 약 2만명의 관광객과 등산객이 찾아오는 관광 휴양 연계형 산촌마을이다.지리산 자락에 아늑하게 자리 잡고 산수유나무숲에 묻혀 정겨움을 더해주는 마을을 관통하여 지리산 심산유곡의 청정한 계곡물이 사철 흐르고 있어 관광지로서 좋은 여건을 갖추고 있다. 고향 같은 정감 있는 마을로 가족과 오붓이 하루쯤 묵어가면 딱 좋을 것이다.  위안리 산촌마을은 상위와 하위, 월계마을로 나뉜다. 큰길로 곧장 따라 즐어가면 상위마을이 나오고 널찍한 주차장이 있어 사람들이 그곳을 많이 찾는다.상위마을은 마을 이름에서 알 수 있듯이 과거 벼슬길에 올랐던 사람이 많이 살았던 살기좋은 마을이었다. 10월에 산수유가 열매를 맺기 시작하면 온 마을이 붉게 타올라 옛날의 영화를 아쉬워 하는듯 하다. 이 마을이 산수유마을이 된 것은 멋 옛날 중국 산동성의 한 처녀가 지리산에 시집을 오면서 산수유나무 한 그루를 가져와 심은 것이 오늘날에 이르러 번창하게 되었다고 한다. 구례 산동과 중국의 산동은 그 의미를 다르지만 양쪽 모두 산수유 주산지라는 점에서 전설을 무지할 수 만도 없다고 한다. 이 마을을 중심으로 매월 3월이면 '산수유꽃 축제'를 개최하고 있는데 올해로 벌써 9회에 접어들어 명실상부한 지역축제로 자리잡았다. 모습 또한 정겹다."
전라남도 구례군 토지면 운조루길 59,,38,0.0,A02,A0201,A02010400,128994,12,20060612090000,http://tong.visitkorea.or.kr/cms/resource/43/1606843_image2_1.jpg,http://tong.visitkorea.or.kr/cms/resource/43/1606843_image3_1.jpg,127.515442268,35.2061200991,6.0,20221018161206,30399,5,,구례 운조루 고택,57624,"류이주는 그가 처음 이사와 살았던 구만들(九萬坪)의 지명을 따 호를 귀만(歸晩)이라 했으며 이 집을 귀만와 (歸晩窩)라고도 불렀다. 운조루라는 택호는 구름속의 새처럼 숨어사는 집이란 뜻과 함께 구름위를 나르는 새가 사는 빼어난 집이란 뜻도 지니고 있다.  그러나 본디 이집의 이름은 중국의 도연명(陶淵明)이 지은 귀거래혜사(歸去來兮辭)에서 따온 글이다. 구름은 무심히 산골짜기에 피어 오르고, 새들은 날기에 지쳐 둥우리로 돌아 오네의 문구에서 첫머리 두 글자를 취해  이름을 지었다고 전해진다.   구례 운조루 고택은 좌청룡 우백호의 산세와  함께 내수구(앞 도랑)와 외수구(섬진강)가 제대로 되어 있는 명당터에 자리잡고 있다. 집 앞의 오봉산은 신하들이  엎드려 절하는 형국이라고하며, 연당은 남쪽의 산세가 불의 형세를 하고 
있어  화재를 예방하기 위하여 조성한 것이라고 한다. 풍수지리설에 의하면 이 일대는 금귀몰니(金龜沒泥), 금환락지(金環落地), 오보교취(五寶交聚), 혹은 오봉귀소(五鳳歸巢)의 명당이 있는 곳이라고 하며, 이 집터에서 거북이의 형상을한 돌이 출토되었기에 금귀몰니의 명당으로서 남한의 3대 길지로 알려져 있다.  구례 운조루 고택에는 바깥사랑채, 안사랑채, 아랫사랑채 등으로 각각 누마루가 있었으나 지금은 아쉽게도 안사랑채와 아랫사랑채의 누마루는 남아 있지 아니하다. 현재 이 집은 건평 426.45m²(129평)으로 一 자형 행랑채와 북동쪽의 사당채를 제외하고 T자형의 사랑채와 ㄷ자형의 안채, 안마당의 곡간채가 팔작지붕, 박공지붕, 모임지붕으로 연결되어 있는 일체형 구조를 보이고 있다. 이 집에 있는 목독(나무로된 쌀독의 마개에 lt;他人能解gt;라는 글귀를 써두었음)은 가난한 이웃 사람이 쌀을 꺼내 끼니를 이어나갈 수 있도록 허용함으로써  음덕을 베풀고 적선을 하는 것이 돈을 가진 자의 도리임을 보여 주었던 류씨 문중의 상징물이다.  200년이 지나도록 망하지 아니하고 오늘날까지 가문이 번창한 것은 오로지 분수를 지키며 생활하고, 이웃을 돌보았던 마음이 전승되어 내려왔기 때문이라고 본다. 류이주의 5세손인 류제양(柳濟陽)은 일만여편의 시(詩)를 쓰고 손자 류형업(柳瀅業)에 이르기까지 80년간 하루도 빠지지않고 생활일기와 농가일기를 썼다는 점이다.  이러한 기록문화는 우리가 본받아야 할 위대한 선조들의 유업이라 아니할 수 없다. 구례에서 연고사, 쌍계사,  하동 방면으로  가는 버스를 타고 토지면 소재지에 내리면 이 일대가 금환락지의 들판이다. 구례 운조루 고택은 이곳 여러 마을 중 오미동에 있다.  창건주 유이주 무덤은 운조루 뒤편 베틀봉이라는 산등성이에 있고 시목나루는  구만리 들판과 섬진강 건너 문척면 회정리를 오고 가던 나루터다. 지금은 나루터의 흔적이 보이지 않고  강변에는 봉소대(鳳巢臺)라는 정자가 있다. 구례 운조루 고택과 함께 답사할 곳은 화엄사와 천은사, 장수마을 사도리, 매천사당 등이 있다."
전라남도 구례군 구례읍 중유길 64,,38,0.0,A02,A0203,A02030100,128314,12,20050311090000,http://tong.visitkorea.or.kr/cms/resource/26/2516226_image2_1.jpg,http://tong.visitkorea.or.kr/cms/resource/26/2516226_image2_1.jpg,127.4070408866,35.1991940027,6.0,20220223133814,39277,5,,섬진강 다무락마을 [녹색관광마을],57662,"지리산을 끼고 있는 구례는 공기가 말고 물이 좋아 장수촌으로도 유명하다. 전남 구례군 구례읍 계산리에 위치한 다무락마을도 지리산의 혜택을 받아 산나물과 밤, 감, 약초 등 풍부한 농산물이 생산되고 있으며, 풍요로운 지리산 산간 마을의 특징이 그렇듯 다무락마을 또한 인심 좋기로 유명하다.다무락마을은 어느쪽으로 가던 섬진강을 끼게되어 상유, 중유, 하유로 나뉘어 옹기종기 자리 잡은 마을이다. 섬진강 상유, 중유, 하유는 표정이 조금씩 달라 돌아보는 맛이 있다. 섬상유는 산간 오지 마을의 느낌이 남아 있고, 중유는 과수나무로 덮여 있으며, 하유는 섬진강을 마당처럼 거느리고 있다.산간을 개간해 노을 만들 때 축대를 쌓게 되는데, 그 돌 축대를 다무락이라 한다. 예부터 에는 이와 같은 논과 밭이 많았으며, 그런 연유로 다무락마을이라는 이름이 붙었다고 한다. 다무락마을은 강과 산, 맑은 계곡이 두루 어우러진 농촌 전통 테마 마을이다. 마을에 들어가기 위해서는 남쪽이든 북쪽이든 간에 반드시 섬진강을 끼고 흐르는 강변의 도로를 따라 가야만 한다.  이곳은 계절마다 얼굴이 달라져, 봄부터 여름까지는 매화, 배, 밤꽃의 아름다움이 절정을 이루고, 가을에는 풍요로운 열매가 온 마을을 붉게 물들인다. 그림 같은 자연풍광도 풍광이지만 50여 년 전의 시골 촌집이 그대로 보존된 마당 너른 집에서 가마솥과 장작불에 대통밥을 지어 먹고 대나무 공예 체험, 닥나무를 이용한 한지 제작 체험, 섬진강 강태공 체험 등 다양한 프로그램을 경험할 수 있다.다무락마을은 과수원이 특히 많은 마을이다. 봄이면 매화와 배꽃이 꽃잎을 흩날리고, 여름이면 다칠세라 조심스레 열매에 종이옷을 입히는 농부들의 손길이 바쁘기 그지없다. 또 가을이면 따사로운 햇볕을 받아 더욱 달콤해진 배와 매실, 감 등을 수확한다. 발길이 닿는 들마다 피어 있는 아름다운 야생화들 또한 아름다움을 더해준다. 마을에서는 일곱 곳의 민박을 운영하고 있다. 현대화되어 이미 사라져버린 농촌 풍경이 아직도 많이 남아 있어, 마을 걷다 보면 이러한 모습에 걸음을 멈추게 된다. 골목과 골목, 집과 집들이 정겹게 어깨를 마주 하고 있는 모습 또한 정겹다."
전라남도 구례군 마산면 화엄사로 539,(마산면),38,0.0,A02,A0201,A02010800,127923,12,20040227090000,http://tong.visitkorea.or.kr/cms/resource/94/2713794_image2_1.jpg,http://tong.visitkorea.or.kr/cms/resource/94/2713794_image3_1.jpg,127.4971648255,35.2555586505,6.0,20220302102426,63590,5,,화엄사,57616,"화엄사는 구례읍에서 동쪽으로 5.4km 떨어진 곳, 민족의 영산인 지리산 자락에 위치하고 있는 천년 고찰로 544년(백제 성왕22년)에 연기조사가 창건하였다하여 절의 이름을 화엄경(華嚴經)의 화엄 두글자를 따서 붙였다고 한다.  처음에는 해회당과 대웅상적광전만  세워졌고 그후 643년(선덕여왕 12년) 자장율사에 의해 증축되었고 875년(신라 헌강왕1년)에 도선국사가 또 다시 증축하였다.  임진왜란 때 불타 없어진 것을 1630년(인조 8년)에 벽암선사가 절을 다시 세우기 시작하여 7년만인 인조 14년(1636년)에 완성하였다.  사찰 내에는 각황전을 비롯하여 국보 4점, 보물 5점, 천연기념물 1점, 지방문화재 2점등 많은 문화재와 20여동의 부속 건물이 배치되어 있다.  특히 건물의 배치에 있어서는 일주문을 지나 약 30˚꺽어서 북동쪽으로 들어가면 금강역사, 문수, 보현의 상을 안치한 천왕문에 다다르는데 이 문은 금강문과는 서쪽 방향으로 빗겨 놓은 것이 독특한 특징이다. 이 천왕문을 지나 다시 올라가면 보제루에 이르고 보제루는 다른 절에서 그  밑을 통과하여 대웅전에 이르는 방법과는 다르게 누의 옆을 돌아가게 되어 있다. 절내에서는 동.서 두개의 탑이 사선 방향으로 보이며 동측탑의 윗부분보다 한단 높은 더위에 대웅전이 있고 서쪽탑의  윗부분에는 각황전이 위치하고 있다.  경내 건물중 각황전은 국보로 지정된 매우 유명한 건물이며 현존하는 목조건물로는 국내 최대 규모로 그 웅장한 외양이 보는 이의 시선을 압도한다. 각황전 앞 뜰에 서있는 석등은 높이 6.3m, 직경 2.8m 로 국내 최대 규모이며, 통일 신라시대 불교 중흥기의 찬란한 조각예술을 보여주는 작품으로 국보 제 12호로 지정되어 있다.각황전 왼편 효대라는 언덕에 자리하고 있는 4사자 3층석탑은 화엄사를 창건한  연기조사가 어머니의 명복을 빌며 세운 탑으로 특이한 의장과 세련된 조각솜씨를 자랑하는 걸작으로 국보이다. 각황전 내부 후편에 위치하고 있는 영산회 괘불탱은 국보로 1997년도에 지정되었다.  화엄사 경내 보물 가운데서도 대웅전 양편에 서있는 5층탑은 뛰어난 조형성과  섬세한 장식이 눈길을 끄는 신라시대 작품으로 보물로 지정돼 있다. 또한 이곳의 대웅전은(보물) 조선시대의 우수한 예술성이 잘 나타나 있으며, 국립공원인 지리산의 훌륭한 경관을 배경으로 곳곳에 명소와 절경이 산재해 있다. 한편 하동에서 화엄사에 이르는 19번국도변(약 35㎞) 에는 가로수로 벚꽃나무가 심어져  매년 4월 벚꽃이 만개할 때면 환상적인 드라이브 코스로 인근에는 섬진강매화마을, 고소성 군립공원, 지리산국립공원, 쌍계사등 많은 관광지가 있어 수많은 상춘객이 몰리는 곳이다.   문화재 화엄사 각황전 앞 석등(국보), 화엄사 4사자 3층석탑 (국보 ),화엄사 각황전(국보),화엄사 영산회괘불탱(국보),화엄사 동,서 5층석탑(보물),화엄사 대웅전(보물),화엄사 원통전 앞 사자탑(보물), 화엄사 화엄석경(보물),화엄사의 올벚나무(천연기념물), 화엄사 보제루(전라남도 유형문화재),화엄사 구층암 석등(전라남도 유형문화재)"
전라남도 구례군 마산면 화엄사로 356,,38,0.0,A01,A0101,A01010100,127590,12,20040213090000,http://tong.visitkorea.or.kr/cms/resource/85/2028685_image2_1.jpg,http://tong.visitkorea.or.kr/cms/resource/85/2028685_image3_1.jpg,127.5328707526,35.334183731,6.0,20221205094450,63200,5,,지리산국립공원(지리산 노고단),57616,"지리산국립공원은 3개 도 1개 시 4개 군 15개 읍·면에 광대하게 펼쳐져 있다. 수십여 개가 넘는 높고 낮은 산봉우리들이 굽이굽이 이어지며 부드럽게 펼쳐내는 산의 실루엣은 어머니의 품속처럼 포근함과 따스함을 느끼게 한다. 또한, 아름다운 계곡과 폭포, 징, 담, 소 등이 계절별로  독특함을 보여주고 있으며, 지리산을 따라 남해로 이어지는 섬진강의 멋스러운 풍광도 지리산의 아름다움을 더해 주는데 큰 역할을 하고 있다.반달가슴곰을 비롯한 다양한 생명들을 품어 키워내는 생명의 산이기도 하다. 산자락마다 담겨 있는 세월의 흔적들을 통해 다양한 문화와 역사를 만나 볼 수 있다. 광대하게 펼쳐져 있고  다양한 탐방꺼리가 있는 지리산국립공원을 탐방하려면 꼼꼼한 여행계획과 어느 정도의 충분한 시간 투자가 필요하다. 조급한 맘으로 무작정 지리산을 찾게 되면 겉만 보게 되거나  위험스런 상황에 처하게 될 수도 있어 진정한 지리산의 면모를 제대로 볼 수 없게 된다.지리산은 사계절별 특징들이 달라 다양한 느낌의 탐방이 가능하다.  그러나 여름과 겨울철에는 많은 비와 눈이 많이 내리기도 하며, 급작스러운 일기변화와 기온차가 심한 경우 탐방이 제한되기도 한다. 지리산을 비교적 수월하게 탐방할 수 있는 계절은 봄철과 가을철을 들 수 있으나,  건조기로 인한 산불발생 우려가 높아  일정기간 일부구간의 산행이 제한되기도 한다. 지리산 탐방계획을 세우려면 국립공원관리공단 홈페이지나 3개의 지리산관리사무소에 문의한 후 계획을 세우는 것이 효과적이다. 주요 야생화  물매화, 동자꽃, 산오이풀, 히어리"
