addr1,addr2,areacode,booktour,cat1,cat2,cat3,contentid,contenttypeid,createdtime,firstimage,firstimage2,mapx,mapy,mlevel,modifiedtime,readcount,sigungucode,tel,title,zipcode,overview
전라남도 영암군 구림로 50-1,,38,,A02,A0203,A02030200,2932871,12,20221214150940,http://tong.visitkorea.or.kr/cms/resource/52/2932852_image2_1.jpg,http://tong.visitkorea.or.kr/cms/resource/52/2932852_image3_1.jpg,126.6270150037,34.7619967236,6,20221214151307,1,17,,한복입고 유유자적,58434,"한복입고 유유자적은 전통한복을 전공한 고영박사님이 고향인 구림한옥마을로 귀향하여, 
전통문화의 아름다움을 소중하게 생각하는 지인들과 함께, 다음과 같은 체험과 프로그램이 있다. 
영암의 고택인 삼성당에서 한복공유공간에서 즐기는 다도의 즐거움과 깊은맛, 우리 한복의 멋을 즐길수 있는 전통바느질체험, 한복입기 체험은 2200년의 역사와 아름다움이 가득한 구림마을의 이야기와 함께 잊을 수 없는 행복한 추억을 선물한다. 

1. 한복공유공간 : 한복입고 즐기는 카페, 교육 · 체험프로그램 운영 등
2. 한옥스테이 치유 바느질 : 아이 한복(손주, 첫아이 선물), 혼례복, 수의 등
3. 교육 · 체험(1day class) : 한복입고 차마시기, 전통바느질(조각보, 보자기 등) 등
4. 한옥스테이 스몰웨딩(전통혼례), 돌잔치 : 혼례, 리마인드 웨딩, 재혼식, 돌잔치 등
(한복문화를 통한 행복한 가족모임)
5. 한복입고 유유자적 : 토크콘서트, 성인식, 구림마을 투어 등
6. 제작 : 체험한복, 재현한복, 특수한복 등"
전라남도 영암군 기찬랜드로 41,,38,,A02,A0203,A02030400,2932828,12,20221214135402,http://tong.visitkorea.or.kr/cms/resource/24/2932824_image2_1.jpg,http://tong.visitkorea.or.kr/cms/resource/24/2932824_image3_1.jpg,126.6849592028,34.790475035,6,20221214135622,1,17,,우리술과힐링,58420,"영암 우리술과 힐링은, 술익는 마을 영암을 찾아 떠나는 치유여행을 제공한다. 
영암의 특산물인 고구마를 활용한 빛깔도 고운 전통주 보라와 함께 남도미식의 세계로 초대하는 주안상과 며칠이라도 아름다운 월출산과 둘레길인 기찬묏길이 펼쳐진 수려한 자연속에서 몸과 마음이 쉬어가는 한옥체험도 가능하다. 전통주 만들기 체험, 전통주와 페어링 안주만들기, 전통주 소믈리에 프로그램으로 아름다운 영암에서의 특별한 추억을 만들어볼 수 있다."
전라남도 영암군 왕인로 710-25,,38,,A02,A0203,A02030400,2932810,12,20221214133853,http://tong.visitkorea.or.kr/cms/resource/01/2932801_image2_1.jpg,http://tong.visitkorea.or.kr/cms/resource/01/2932801_image3_1.jpg,126.6472434502,34.7754233257,6,20221214133934,0,17,,예담은 규방문화원,58434,"예담은 규방문화원은 전통천연염색 체험과 천연염색 전문가 양성 교육, 천연염색 판촉물을 생산과 판매하는 곳이다. 천연염색을 활용한 영암의 전통과 상징을 대표할 이미지로 굿즈 제작과 천연 염색 제품을 만들고 난 자투리 천을 활용한 미니 굿즈를 제작 및 판매하고 있다. 
체험프로그램은 섬유아트, 블루아트, 규방공예 및 생활용품 만들기 등 다양한 체험프로그램이 있다. 스카프와 티셔츠, 키링, 애착인형 등을 만들어 보는 체험이 있으며, 천연염색 전문가 양성 프로그램 및 천연염색 자격증과 창업 프로그램도 준비되어 있다."
전라남도 영암군 왕인로 710-30,,38,,A02,A0203,A0203,2891349,12,20221031101240,http://tong.visitkorea.or.kr/cms/resource/42/2876342_image2_1.jpg,http://tong.visitkorea.or.kr/cms/resource/42/2876342_image3_1.jpg,126.6467879439,34.7750122529,6,20221107101947,0,17,,미술관아래협동조합,58434,None
전라남도 영암군 군서면 도갑사로 306,,38,0.0,A01,A0101,A01010100,2759617,12,20211020190928,http://tong.visitkorea.or.kr/cms/resource/29/2759829_image2_1.JPG,http://tong.visitkorea.or.kr/cms/resource/29/2759829_image2_1.JPG,126.6747581245,34.7575896758,6,20221115154552,2,17,,월출산국립공원천황사지구,58434,"월출산은 달 뜨는 산이라는 이름에 걸맞게 아름다운 자연경관과 문화자원, 그리고 남도의 향토적 정서가 골고루 조화를 이루는 한반도 최남단의 산악형 국립공원이다. 적은 면적에 (56.220㎢)에 암석과 경사가 급한 계곡이 많지만 식물 약 700종, 동물 약 800종이 서식하고 있다. 오랜 세월 암석으로 된 지형에 적응해 온 생태의 독특성과 난대림과 온대림이 혼생하는 위치 여건으로 그 보전 중요성은 매우 크다고 할 수 있다.
등산로를 따라 올라가다 보면 천황사 야외 조각공원과 야영장이 있다. 월출산 천황계곡의 시원한 물소리는 하산하는 등산객들에게 시각적, 청각적으로 많은 위안을 준다."
전라남도 영암군 영암읍 기찬랜드로 19-10,,38,0.0,A02,A0203,A02030400,2657848,12,20200601224931,http://tong.visitkorea.or.kr/cms/resource/44/2639044_image2_1.jpg,http://tong.visitkorea.or.kr/cms/resource/44/2639044_image3_1.jpg,126.6853535853,34.791588805,6,20221212104040,0,17,,한국트로트가요센터,58420,"월출산기찬랜드에 문을 연 한국트로트가요센터는 1930년대부터 2000년대까지의 한국트로트의 흐름을 한눈에 볼 수 있다. 1층에는 트로트역사관, 명예의 전당, 2층에는 하춘화 전시관이 있다. 하춘화의 아버지 하종오 씨는 딸이 데뷔한 1961년부터 50년 남짓 트로트 관련 자료와 음반 등을 기증하며 한국트로트가요센터를 건립하는 토대를 마련했다."
전라남도 영암군 군서면 구림로 43-14,,38,0.0,A02,A0203,A02030100,1996248,12,20150410002140,,,126.627609425,34.7607829808,6,20211013022612,3348,17,,영암 왕인촌마을 [농촌체험휴양마을],58434,"백제시대 왕인박사, 신라말 도선국사, 고려초 최지몽 선생등 역사 속 인물을 배출한 마을로500년 전통의 대동계가 현존하고 있다. 마을 내에는 유형문화자원인 회사정, 국암사, 담숙제 등 12개의 누정과 전통가옥, 돌담, 고목 등이 잘 보전되어 있어 전통의 아름다움을 느끼기에 좋은 곳이다. 마을의 안녕을 위해 매년 올리는 당산제와 구림 대동계 등 민속문화가 전승되고 있으며, 왕인촌마을의 영암도기문화센터에서는 1200년의 역사를 지닌 영암도기를 재현하고 있다."
전라남도 영암군 군서면 죽정서원길 19,,38,0.0,A02,A0201,A02010700,1957478,12,20141018013404,,,126.623140313,34.7633215107,6,20220826141724,3332,17,,죽정서원,58434,"1683년 박권(朴權, 14651506년)과 박규정(朴奎精, 14931580년), 1726년에 이만성(李晩成, 16591722년)이 추가 배향되었다. 이후 1868년 흥선대원군의 서원철폐령으로 훼철되었다가 1961년 지방유림들에 의하여 복설되면서 박승원(朴承源, 15731640년)을 추가 배향하여 총 5위를 제향하고 있다. 서원 경내에는 정면 3칸 측면 1칸  맞배지붕의 사우, 내삼문인 소원문, 강당인 강례당, 간죽정, 화수정, 조양재영당, 조양재영당사적비, 죽정서원 중건사적비, 외삼문, 간죽정 연혁비, 고직사 등이 들어서 있다.
박성건은 호가 오한 (五恨)이고 나주에서 태어났다. 이후 성종 때 문과에 급제하여 춘추관 기주관, 장수현감 등 여러 벼슬을 역임하며 선정을 베풀었다. 말년에는 벼슬을 내놓고 영암군 구림에 내려와 간죽정(間竹亭)을 짓고 후손의 교육과 향촌의 교화에 힘썼다. 국문학사상 중요한 자료가 되는 경기체가 금성별곡(錦城別曲)을 지었다."
전라남도 영암군 영암읍 교동로 73,,38,0.0,A02,A0201,A02010700,1957360,12,20141017195422,,,126.6937082673,34.7971966462,6,20220721132356,3276,17,,녹동서원,58414,"녹동서원은 존양사(存養祠)라는 이름으로 1630년(인조 8) 창건된 뒤 녹동(鹿洞)이라는 사액을 받았다. 이 서원에는 최덕지(崔德之:1384∼1455), 최충성(崔忠成:1458∼1491), 김수항(金壽恒:1629∼1689), 김창협(金昌協:1651∼1708) 등을 배향하고 있다. 녹동서원에는 많은 고문서류와 목판 등이 보존되어 있다. 이곳에 소장되어 있는 목판은 봉안 인물의 문집인 《연촌유사 26판, 《문곡집 560판, 《산당집 60판 등과 인근 지역 인물인 임억령의 《석천집(石川集), 강항의 《강감회요(綱鑑會要) 등이 보존되어 있었다. 그러나 현재 지정된 목판은 《연촌유사 26판, 《문곡집 560판, 《산당집 54판 등 총 642판에 이른다. 이 목판은 영암군 영암읍 교동리 녹동서원에 보관되어 있었으나 1868년 서원 훼철 이후 현재 보관장소인 덕진면 영보리에 있는 합경당의 목판각에 보존되어 있다. "
전라남도 영암군 삼호읍 대불로 93,,38,0.0,A02,A0204,A02041000,1853265,12,20131024200837,,,126.3857063141,34.7380843358,6,20220421132215,8569,17,,현대삼호중공업,58462,현대삼호중공업은 삼호읍 일대 330만㎡ 부지에서 세계 4위 규모의 선박 생산능력을 갖춘 조선해양 선도 기업이다. 단체를 대상으로 생산 공정 견학 프로그램을 운영 중이다.
전라남도 영암군 영암읍 무덕정길 63,,38,0.0,A02,A0201,A02010700,1624477,12,20120508034811,,,128.7392429984,36.9824570262,6,20211108222224,16457,17,,장암정,58422,"본래 이 정자의 창건은 장암대동계(長巖大同契)가 창설된 1667년(현종 8)의 이듬해인 1668년 (현縱)이었다고 하나 창설당시는 재원과 계원이 극히 엉성한 것이었으며 현재와 같은 완전한 규모로 증설된 것은 1760년(영조 36)이었다. 장암정 내부에는 현판이 총 23매 보관되어 있는데, 그 중 장암정사적을 알려주는 것으로 「장암정기」(長巖亭記, 1883년 조종운찬(曹鍾雲撰)과 장암정중수기(長巖亭重修記),1880년 문병성찬(文秉成撰))이 있고 「장암정」 편액은 명필 김이도(金履道)의 친필이라 전해진다. 한편 장암정은 비단 동약의 집합소로써만이 아니라 청계나 혼부계가 별치운영되고 있으며 향음주례나 위로연, 회갑연, 백일장 호근 국중 경조의 예상소(禮喪所)로도 이용되었다.  장암정과 관련된 유물로는 「장암대동계책 」과 1667년(현종 8) 창계이후의 「계헌」(契憲), 「계안」(契案), 「치박책」(置薄冊)등 일관된 전자료가 잘 보존되어 이 자료를 통하여 조선후기 전기간 동안의 마을 실정과 운영 모습을 알아 볼수 있다. 특히 이들 문서들은 관찬(官撰)의 연대기나 중앙 중심적인 역사기록 혹은 문집류의 한계를 벗어나 이 지방사회의 생생한 실생활 모습을 전해주고 있다. 장암정은 장암대동계가 건립한 이 지방의 대표적 향약집회소의 하나이며, 여기에 보관된 통계자료는 17∼20세기에 걸쳐 오랜 전통속에 정리된 생활기록으로서 조선후기 호남지방 향촌사회의 생활사를 반영하고 있다."
전라남도 영암군 서호면 화소길 20,,38,0.0,A02,A0201,A02010700,1624251,12,20120508020126,http://tong.visitkorea.or.kr/cms/resource/53/1609353_image2_1.jpg,http://tong.visitkorea.or.kr/cms/resource/53/1609353_image3_1.jpg,126.6042287984,34.7341494785,6,20220919174133,16771,17,,구고사 및 김완장군부조묘,58440,"부조묘는 김완장군의 신위를, 구고사는 그 영정(지방유형문화재)을 모신 건물로서, 이 두건물이 모두 정면 3간, 측면 1간, 맞배지붕의 동일한 형태이다. 초창은 김완장군이 서거한 13년(1635년)이었으나, 중간에 화재를 만나 소실되고 고종 22년(1889년)에 중건하고 1979년에 경내를 확충 정화하여 현재의 형태를 이루었다."
전라남도 영암군 영암읍 교동로 73,,38,0.0,A02,A0201,A02010700,1214029,12,20110223024234,http://tong.visitkorea.or.kr/cms/resource/32/1007932_image2_1.jpg,http://tong.visitkorea.or.kr/cms/resource/32/1007932_image3_1.jpg,126.6930305573,34.7968855591,6,20220519195753,32273,17,,영암향교,58414,"1420년(세종 2)에 현유(賢儒)의 위패를 봉안, 배향하고 지방민의 교육과 교화를 위하여 창건되었다. 임진왜란 때 소실되었다가 그 뒤 현재의 위치에 중건하였으며, 1918년에는 향교 내에 보통학교가 설립되어 운영되다가 화재로 소실되었다. 1922년에 중건하였다가 1950년 6·25동란 때 다시 전소되어 1951년 대성전, 1963년 양사재(養士齋), 1969년 명륜당 등을 중건하였으나, 원래의 모습은 찾을 길이 없다. 현존하는 건물로는 대성전·동무(東廡)·서무(西廡)·명륜당·양사재·사마재(司馬齋)·청금당(靑衿堂) 등이 있다. 대성전에는 5성(五聖), 송조2현(宋朝二賢), 우리나라 18현(十八賢)의 위패가 봉안되어 있다. 조선시대에는 국가로부터 토지와 전적·노비 등을 지급받아 교관이 정원 30명의 교생을 가르쳤으나 갑오경장 이후 신학제 실시에 따라 교육적 기능은 없어지고, 봄·가을에 석전(釋奠)을 봉행하며, 초하루·보름에 분향을 한다. 전라남도 문화재자료 제126호로 지정되어 있으며, 운영은 전교(典校) 1명과 장의(掌議) 수명이 담당하고 있다."
전라남도 영암군 시종면 남해당로 65,,38,0.0,A02,A0202,A02020100,1087619,12,20100907224830,http://tong.visitkorea.or.kr/cms/resource/54/1006654_image2_1.jpg,http://tong.visitkorea.or.kr/cms/resource/54/1006654_image3_1.jpg,126.5854265442,34.895183818,6,20220825180339,22757,17,,마한문화공원,58426,"마한문화공원은 영산강유역에 널려있는 고대 옹관고분을 이해함으로써 영산강유역의 독자성이 가득한 고대사를 조망하기 위해 만들어졌다. 고분탐사관은 난생설화를 모티브로 하여 내부에는 옹관고분의 발굴과정, 시신의 매장형태를 모형으로 복원하였다. 야간에 조명이 켜지면 우주선 모양으로 환상적인 분위기를 자아낸다. 전시관의 외형은 옹관의 형상을 이미지화 하였으며, 내부에는 각종 영상을 상영하는 영상홀과 관리 사무실이 있다. 전망대는 공원일대는 물론 월출산과 인근의 영산강 뿐만 아니라 나주, 무안까지도 한눈에 들어온다. 마한문화공원은 장차 단순한 전시복원 공간이 아니라 각종논문과 기록을 집대성하고 데이터베이스화해 나가는 등 영산강유역의마한사를 체계적으로 정리하고 종합하는 곳으로 가꾸어갈 계획이다."
전라남도 영암군 군서면 구림로 43-14,,38,0.0,A02,A0201,A02010600,894204,12,20091211193416,http://tong.visitkorea.or.kr/cms/resource/18/1005718_image2_1.jpg,http://tong.visitkorea.or.kr/cms/resource/18/1005718_image3_1.jpg,126.625562308,34.7638964859,6,20220308140214,42062,17,,영암 왕인박사마을,58434,"남한의 금강 국립공원 월출산 자락에 위치한 영암왕인박사 권역은 2200년의 역사를 가진 마을로 일본에 한자와 유학을 전한 왕인박사와 풍수지리설의 시조인 도선 국사 탄생지이며 전통기와집과 오래된 정자들, 정겨운 흙담 등 마을 전체가 살아있는 박물관과도 같다. 권역 내 구림마을에는 450여 년 동안 구림대동계가 존속되어 오고 있고 마을중심에 자리한 시유도기의 발상지 영암도기문화센터에는 다양한 전시관광 체험공방이 있어 관광객이 직접 교육을 병행한 도예체험을 할 수 있다. 남도관광의 명소인 이곳 영암 왕인박사 권역에서는 주민들(왕인촌)이 다양한 체험프로그램들을 운영하고 있으며 100여 채의 한옥 민박집마다 독특한 개별체험프로그램이 있어 여느 체험마을과는 사뭇 다르다. 월출산국립공원과 왕인박사유적지, 도기문화센터 등 주변관광지와 왕인촌 주민자치회가 네트워크화되어 전통 및 향토문화 웰빙 체험프로그램을 제공하는 것이 이 마을의 가장 큰 특징이며 우리나라 체험관광 문화를 선도해 나가는 마을로 손꼽을 만하다.  출처 : 영남 왕인박사마을"
전라남도 영암군 영암읍 기찬랜드로 41-13,,38,0.0,A02,A0202,A02020600,771686,12,20090728202520,http://tong.visitkorea.or.kr/cms/resource/40/1006040_image2_1.jpg,http://tong.visitkorea.or.kr/cms/resource/40/1006040_image3_1.jpg,126.6865868087,34.7916332648,6,20220516155931,59533,17,,월출산 기찬랜드,58420,"월출산 천황봉자락 맥반석에서 나오는 월출산의 기(氣)와 월출산 계곡을 흐르는 청정 자연수를 활용하여 새롭게 조성된 관광명소이다. 이 지역은 월출산의 정기를 받아 불후의 민족음악을 창시한 악성 김창조 선생을 비롯하여, 제헌국회의원 낭산 김준연 선생, 해병대사령관 해군대장 강기천 장군, 바둑의 황제 조훈현 등 탁월한 인물들이 태어난 곳이다."
전라남도 영암군 천황사로 280-82 대한불교법화종천황사,,38,0.0,A02,A0201,A02010800,482119,12,20080222230805,http://tong.visitkorea.or.kr/cms/resource/82/1009482_image2_1.jpg,http://tong.visitkorea.or.kr/cms/resource/82/1009482_image3_1.jpg,126.7165541,34.7716137918,6,20220510132253,20824,17,,천황사(영암),58424,"천황사는 월출산 사자봉 아래에 자리잡은 대한 불교법화종 사찰이다. 신라 말에서 고려 초에 창건되었을 것으로 추정된다. 건물로 인법당과 칠성각이 있다. 인법당은 정면 4칸, 측면 2칸의 팔작지붕 건물로, 내부에 아미타삼존불을 비롯해 아미타극락회상도·관세음보살입상도· 지장탱화·독성탱화 등이 봉안되어 있다. 법당에 붙여 지은 칠성각에는 산신과 칠성·독성을 탱화로 모시고 있다. 유물로 탑재와 부도 대좌, 석조(石槽) 등이 남아 있다. 이중 탑재는 모두 3조각이 전해지고 있으며, 석조는 가로 261cm, 세로 157cm 크기로 최근까지도 사용된 것이다. 경내 여러 곳에 흩어져 있던 것을 1960년대 후반에 지금의 자리로 옮겨놓았다.
천황사는 월출산의 가장 높은 봉우리인 천황봉(해발 804m)의 이름과 같아 월출산을 상징한다고 볼 수 있다. 현재 월출산을 중심으로 남쪽에는 무위사, 서쪽에는 도갑사 그리고 동쪽에는 천황사가 월출산을 호위하고 있다. 문헌에 의하면 월출산에는 50여개 이상의 사암(寺庵)의 이름이 전하며, 속전으로는 99암자가 있었다고 전한다. 월출산의 사자봉(해발 700m)과 장군봉이 굽어보는 위치에 자리한 천황사는 사자봉의 웅대한 흐름을 견제하는 자리에 서있는 의미 깊은 사찰이다. 화재로 단 하나의 전각이던 천황사는 소실되고, 등산객들에게 마지막으로 먹을 물을 제공하던 돌로 된 석조(石槽)만이 남아, 보는 이들로 하여금 아쉬움과 안타까움을 갖게 하고 있다. 잘 조성된 등산로 돌길에도 사지(寺址)에서 가져온듯한 석재들이 놓여있어 재건과 정리가 시급하다는 생각이 든다. 사자봉 정상에서 내려온 협곡을 따라 옆에 조성되어 있기 때문에 그 면적이 좁아 자연환경과 지형에 순응하여 대지를 조성하고 소규모 산지사찰이 설립되었다. 등산로 입구에서 약간 오르면 다소 급한 경사지에 3단의 대지가 있는데 그 맨 앞의 대지에 천황사가 있고 다른 단 위에는 건물지와 탑지가 좌 · 우에 있다.

 천황사의 창건배경 및 역사 
절은 신라 말 고려 초 무렵에 창건되었을 것으로 보고 있다. 창건에 관련된 기록은 전혀 없지만 절에 남아 있는 유적과 유물을 통해 그렇게 추정하는 것이다. 특히 1995년 12월에서 1996년 1월에 걸친 목탑지 발굴 때 사자사(獅子寺)가 새겨진 통일신라시대의 명문 기와가 발견되어 천황사의 전신인 사자사가 이곳에 있었음이 확인되었다. 고려시대의 연혁은 알 수 없지만 목탑지가 고려시대의 것으로 추정되고 있어 그 법통을 이었을 것으로 보인다.그리고 조선시대에 들어와서는 임진왜란 때 절이 폐허화되었다고 한다. 그런데 절에서 순치병술년(順治丙戌年)명문기와, 곧 1646년(인조 24)에 해당되는 연도가 새겨진 암막새 기와가 발견되어 그 해에 중창된 사실이 확인되었다. 그리고 영조 대(1725～1776)에 다시 중창되었는데 이 무렵 한 때 칠산사로 대칭되었다 한다. 그 뒤 20세기에 들어와서 1906년에 중창되면서 다시 지금의 절 이름을 갖게 되었다. 그리고 1947년에는 영암군 무궁청년단에서 지어 수련장으로 쓰던 건물을 절에 기증하여 법당으로 만들었으며, 1953년에 법당 기와 불사가 있었다."
전라남도 영암군 신북면 하정길 8,,38,0.0,A02,A0201,A02010700,319708,12,20071208003817,http://tong.visitkorea.or.kr/cms/resource/19/1008019_image2_1.jpg,http://tong.visitkorea.or.kr/cms/resource/19/1008019_image3_1.jpg,126.7042912141,34.8884559937,6,20220622111214,17801,17,,영팔정,58401," 주변 경관과 어우러짐이 좋은 정자, 영팔정   영팔정은 고려말∼조선초 문신인 하정 유관(1346∼1433)이 주위 경치에 감탄하여 아들 맹문에게 시켜 조선 태종 6년(1406)에 지은 정자이다. 처음에는 모산리의 모자와 호인 하정의 정자를 따서 모정이라고 불렀으나, 훗날 율곡 이이·고경명·남이공·유상운 등이 주변경관을 팔영시(八詠詩)로 읊어서 영팔정으로 바뀌었다. 숙종 15년(1689)에 영의정을 지낸 유상운이 건물을 고친 것 외에는 수리한 내력이 알려져 있지 않다.   영팔정의 구조와 의의   정자 규모는 앞면 3칸·옆면 2칸으로 지붕은 옆면에서 볼 때 여덟 팔(八)자 모양인 팔작지붕이다. 내부는 방이나 벽체없이 사방이 개방된 정사각형 평면이며, 마루는 우물마루이고 오른쪽에만 난간을 설치하였다. 정자 안에 제영문·기문 현판과 동계책이 보관되어 있다. 제영문은 이이·고경명· 유상운 등의 《저산팔경 《저산정기 《상계문과 주련 4개가 있다. 현판의 글씨는 남구만이 썼으며 현존하는 《저산동약은 지방사 연구의 귀중한 자료로 주목된다. 양팔정은 배움의 장소로 오랜 세월동안 많은 인물들을 배출하였으며, 마을 사람들이 모임을 갖던 건물로 그 역사적 가치가 크다.  문화재 정보 지정종목 : 시도기념물  지정현황 : 전남기념물  지정연도 : 1987년 1월 15일 시대 : 조선  종류 : 누정 "
전라남도 영암군 덕진면 영보정길 10-8,,38,0.0,A02,A0201,A02010700,319706,12,20071208003123,http://tong.visitkorea.or.kr/cms/resource/41/1007441_image2_1.jpg,http://tong.visitkorea.or.kr/cms/resource/41/1007441_image3_1.jpg,126.7325873757,34.829843619,6,20220722150004,17076,17,,영보정,58410," 연촌 최덕지 선생이 지은 정자, 영보정  영보정은 연촌 최덕지(1384∼1455) 선생이 관직을 떠난 후 영암의 영보촌에 내려가 학문 연구에 몰두하면서 사위 신후경과 함께 지은 정자이다. 15세기 중반에 창건되었으나 정확한 연대는 알 수 없으며, 당시의 규모도 명확하지 않다. 처음 있던 정자는 황폐화되어서 최정과 신천익(1592∼1661)이 지금 있는 자리로 옮겨지었다.입구에 들어서면 넓은 뜰이 잘 정리되어 있으며 전면에 영보정이 있다. 정자는 앞면 5칸·옆면 3칸 규모이며, 지붕은 옆면에서 볼 때 여덟 팔(八)자 모양인 팔작지붕이다. 네 귀에는 추녀를 찰주로 받치고 있다. 현판은 석봉(石峰) 한호(韓濩)의 친필이라고 전한다.최덕지 선생은 조선 전기 문신으로 학식이 높고 행동이 단정하여 사람들로부터 존경을 받았으며, 많은 저서를 남겼으나 불타버려서 한 권만 남아 있고 여러 현인들의 논설만 전하고 있다.   항일구국정신이 녹아있는 영보정  영보정은 일제강점기 때 청소년들에게 항일구국정신을 교육한 장소로 역사적 의미가 크다. 일제강점기인 1921년에는 이곳에 영보학원을 설립하여 청소년들에게 항일구국정신을 배양시켰다. 영암지역 청년들의 항일투쟁활동으로 꼽히는 1931년의 형제봉만세운동도 영보학원을 중심으로 졸업생과 청년 회원들이 주축이 되어 일어난 것이다. 지금도 해마다 음력 5월 5일 단옷날에 이곳에서 마을축제 풍향제(豊鄕祭)가 열린다."
