addr1,addr2,areacode,booktour,cat1,cat2,cat3,contentid,contenttypeid,createdtime,firstimage,firstimage2,mapx,mapy,mlevel,modifiedtime,readcount,sigungucode,tel,title,zipcode,overview
전남 구례군 산동면,",전북 남원시, 경남 하동군, 함양군, 산청군",38,0.0,A01,A0101,A01010500,126633,12,20031203090000,http://tong.visitkorea.or.kr/cms/resource/13/1931213_image2_1.jpg,http://tong.visitkorea.or.kr/cms/resource/13/1931213_image3_1.jpg,127.6476609265,35.3228759019,6.0,20210114022004,30082,5,,지리산 10경,"542-830,1","수십여 개의 높고 낮은 산봉우리들로 이루어진 지리산에서는 계절별로 다양한 모습들을 볼 수 있다. 지리산 등산지도를 처음으로 제작하여 배포했던 지리산 산악회는  지난 1972년 가장 대표적인 자연경관 10곳을 들어 ""지리산 10경""으로 발표하였다.

 1경  천왕일출(天王日出)
 이른 새벽 동틀 무렵 해발 1,915m 의 지리산 정상인 천왕봉에 올라보면 끝없이 펼쳐진 회색 구름바다 저 멀리 동녘 하늘에 희뿌연 서기가 어리기 시작한다. 이것도 잠깐 동녘 하늘이 오렌지빛으로 물들면서 휘황찬란한 오색구름 속에서 진홍빛 거대한 태양이 눈부신 햇살을 부채살 같이 뻗치며 불쑥 솟는다. 이 천왕봉 해돋이는 지리산 10경중 제1경으로 이 일출을 지켜볼 수 있는 사람은 삼대에 걸쳐 적선을 해야 된다는 속설도 있다.

 2경  피아골단풍(직전단풍,稷田丹楓)
10월 하순경에 절정을 이루는 피아골 단풍은 현란한 ""색(色)의 축제""다. 산도 붉게 타고, 물도 붉게 물들고, 그 가운데 선 사람도 붉게 물든다는 삼홍(三紅)의 명소. 피아골의 단풍은 가을 지리산의 백미다. 조선시대 유학자 조식 선생은  ""피아골 단풍을 보지 않은 사람은 단풍을 보았다고 말할 수 없다""라고 할 정도로 단풍이 좋다. 조식 선생은 ""온 산이 붉고 물이 붉어서 사람 마음도 붉다""는 삼홍시를 읊었다고 한다.  

 3경  노고운해(老姑雲海)
 지리산 서쪽 해발 1,507m의 높이로 솟아있는 노고단은 이 산의 수많은 봉우리들 중에서도 영봉으로 손꼽히는 곳이다. 화엄사 계곡을 따라오르는 10km의 노고단 산행코스는 중간부터 가파른 길이 이어져 숨이 턱턱 막히기도 하지만 정상에 올라 바라보는 경관은 4시간 남짓의 힘든 산행을 한층 뿌듯하게 해줄만큼 장엄하다. 특히 노고단 아래 펼쳐지는 '구름바다'의 절경은 가히 지리산을 지리산 답게 만드는 제 1경이라 불러도 손색이 없으며, 5월에 산철쭉이 고원 전체를 분홍색으로 물들이는 것을 시작으로 하여 한여름철과 가을에 걸쳐 천상의 화원을 이룬다. 화엄사 계곡의 끝머리 바위턱에 앉아 파도처럼 밀려갔다 밀려오며 계곡을 덮고, 능선을 휘감아 돌다 저 들녁까지 이르러 온통 하얀 솜이불을 깔아놓은듯 펼쳐지는 운무를 바라보고 있노라면, 잠시 인간의 세계를 벗어난 것 같은 착각을 일으킬 만큼 신비롭기 그지없다. 노고단은 지리산 종주코스의 출발점으로도 유명하다. 이곳에서 임걸령  반야봉  토끼봉  벽소령  세석평전을 거쳐 천왕봉에 이르는 지리산 능선길은 산악인이라면 누구나 한번쯤 밟아보고 싶어하는 영원한 동경의 코스다.  봄에서 초여름까지 노고단의 비경으로 빼놓을수 없는 것이 원추리 꽃이다.

 4경  반야낙조(般若落照)
 해발 1,732m의 지리산 제 2봉인 반야봉은 멀리서 바라보면, 여자의 엉덩이 같이 보인다는 봉우리로 전남과 전북의 경계지역이기도 하다. 노고단에서 바라보면 바치 여인의 젖가슴처럼 봉긋 솟아있는 봉우리다.  노고단 정상에서 능선을 따라 3시간 30분 가량의 산행코스인 반야봉은 사방이 절벽지대로 고산식물이 무성하게 자라고 있다. 반야봉에 오르는 기쁨은 낙조(落照)의 장관에서 찾는다. 여름날 해거름에 반야봉 정상에 올라 바라보는 서쪽 하늘의 황홀한 낙조는 아마도 자연이 인간을 위해 베푸는 시시각각의 축제 중에서도 가장 경건하고 가장 의미심장한 축제가 아닐까 때로는 구름바다를 검붉게 물들이며,  때로는 마지막 정염을 불사르는 선홍의 알몸으로 서서히 스러지는 태양과 마주하는 순간, 사람들은 아득히 먼 시원(始源)의 날에 시작된 한 편의 장엄한 드라마가 끝난듯한 착각에 빠져들기도 한다. 

 5경  벽소명월(碧宵明月)
 벽소령은 빼어난 경관과 지리산 등줄기 한 가운데 위치하고 있는 입지조건에서  밀림과 고사목 위에 떠오르는 달은 차갑도록 시리고 푸르다. 시인 고은씨는 ""어둑어둑한 숲 뒤의 봉우리 위에 만월이 떠오르면  그 극한의 달빛이 천지에 부스러지는 찬란한  고요는 벽소령 아니면 볼 수가 없다.""고 찬탄하였다.

 6경  세석철쭉(細石)
 봄이면 난만(爛漫)히 피어나는 철쭉으로 온통 꽃사태를 이루는 해발 1,600m의 세석평전은 30리가 넘는 드넓은 평원으로 남녘 최대의 고원이다. 이름 그대로 잔돌이 많고 시원한 샘물도 콸콸 쏟아지는 세석평전에는 수 십만 그루의 철쭉이 5월초부터 6월말까지 꽃망울을 터뜨리며 한바탕 흐드러진 잔치가 벌어진다. 피빛처럼 선연하거나, 처녀의 속살처럼 투명한 분홍빛의 철쭉이 바다처럼 드넓게 펼쳐지는 절정기에는 산악인들의 물결로 세석평전은 발 디딜 틈이 없을 정도다. 시인 김석은 세석 계곡 훈풍이 꽃 사이로  지날 때마다 꽃들의 환상적이고 화사한 흔들림, 그것은 남녘나라 눈매 고운 처녀들의 완숙한 꿈의 잔치라고 이곳의 철쭉을 노래하기도 했다. 지리산 철쭉은 조정래의 lt;태백산맥gt;의 처절하도록 서럽게,  그러나 꺾이지 않는 의지의 화신으로, 등장하는 진달래와 더불어 봄의 지리산을 단장하는 명물로,  뭇 사람들의 사랑을 받고 있다.

 7경  불일현폭(佛日顯瀑)
 청학봉(淸鶴峰과) 백학봉(白鶴峰) 사이의 험준한 골짜기 속의 깊은 낭떠러지 폭포로 오색무지개가 걸리고 백옥같은 물방울이 서린다. 60m의 높이에서 떨어지는 장쾌한 폭포 소리가 온몸을 파고드는 냉기는 몸과 마음이 얼어 붙는 긴장감마저 느끼게 한다. 

 8경  연하선경
 세석평전과 장터목 사이의 연하봉은 기암과석과 층암절벽 사이로 고사목과 어우러진 운무가 홀연히 흘러가곤 하여 이곳에 앉아 있으면 마치 신선이 된 듯한 기분을 느끼게 한다. 천왕봉을 향해 힘차게 뻗은 지리산의 크고 작은 산줄기 사이사이에는 온갖 이름 모를 기화요초가 철따라 피어 지나는 이의 마음을 향기롭게 한다. 이끼 낀 기암괴석 사이에 피어 있는 갖가지 꽃과 이름모를 풀들은 한 폭의 그림처럼 지리산과 어우러져 마치 신선의 세계에 온 것 같은 느낌을 준다. 고산준령 연하봉의 선경은 산중인을 무아의 경지로 몰고 간다.

 9경  칠선계곡(七仙溪谷)
 지리산 ""최후의 윈시림"" 지대로 자연자원의 보고이다. 계곡 전체가 청정한 선경으로 일일이 그 이름조차 명명할 수 없을만큼 아름답다.

 10경  섬진청류(蟾津淸流)
 산이 높으면 물도 맑다. 지리산을 그림자로 한 채 남서로 감돌아 남해에 이르는 섬진강은 그 물이 맑고 푸르러 한 폭의 파란 비단을 펼쳐 놓은 듯하고 앙쪽에 펼쳐진 백사장도 하얀 명주천을 깐 듯 아름답다. 급류를 타고 오르내리며 은어떼를 낚는 어부의 모습도 아름답기만 하다.  지리산 산자락을 그림자로 한 채 남해로 흘러드는 섬진강의 푸르고 맑은 강물과 하연 백사장과 더불어 이 강에 뜬 돛단배는 지리산 역사와 사연들을 들려주는 듯하다."
전라남도 구례군 마산면 화엄사로 539,,38,0.0,A02,A0202,A02020200,126632,12,20031111090000,http://tong.visitkorea.or.kr/cms/resource/83/1917883_image2_1.jpg,http://tong.visitkorea.or.kr/cms/resource/83/1917883_image3_1.jpg,127.4977425065,35.2573140182,6.0,20220404134251,25966,5,,구례 관광특구,57616,"구례 관광특구는 산악 지대를 중심으로 강과 평야가 두루 펼쳐지는 토지면과 마산면, 광의면, 산동면을 포함하는 대단위 관광 지구다. 구례군 구석구석이 관광특구라 할 만큼 볼거리가 다양하다. 예부터 기름진 평야로 이름 난 구례의 가장 큰 자연 자원은 국립공원 제1호인 지리산국립공원과 섬진강이다. 어머니의 품이라 일컬어지며 해마다 많은 등산객들이 찾는 지리산국립공원은 깊고 너른 산세와 맑은 계곡 등 때 묻지 않은 자연 경관으로 사랑 받고 있다. 등산 코스도 여러 갈래이며 곳곳에 산장이 있어서 백패킹도 가능하다.지리산 언저리를 걸어서 도는 지리산 둘레길은 지리산 등반과는 또 다른 정취를 즐기는 트레킹 코스다. 산행과 트레킹을 즐기는 동안 봄에는 산수유 군락을, 가을에는 단풍에 물든 산과 계곡을 만날 수 있다.
지리산 온천 같은 레저 시설을 비롯해 한옥 민박, 게스트하우스 등 다양한 숙박 시설을 갖추고 있는 것도 장점이다. 화엄사, 연곡사, 천은사 등 유서 깊은 사찰과 역사적 유물들도 함께 자리하고 있어 역사 탐방에도 유익하다. 곡성에서 하동까지 길게 이어지는 섬진강의 물줄기는 고즈넉한 풍경을 자아낸다. 섬진강은 국내 제일의 청정 하천으로 손꼽히며 다슬기와 은어가  많이 나기로 유명하다. 섬진강을 끼고 달리는 섬진강변도로 역시 최고의 전망을 선사하는 드라이브 코스다. 계절에 따라 산수유꽃축제, 섬진강변벚꽃축제, 피아골단풍축제 등 다양한 축제가 열린다.
 구례 관광특구 현황
1) 범위  전라남도 구례군 토지·마산·광의·산동면 지역
2) 면적  78,024,000㎡
3) 관광특구 지정일  1997년 1월 18일
 구례 관광특구 시설 현황
지리산, 섬진강, 지리산 온천 관광지, 피아골 계곡, 산수유 시목지, 화엄사, 천은사, 연곡사, 한옥 마을 등"
전라남도 구례군 광의면 노고단로 209,,38,0.0,A02,A0201,A02010800,126366,12,20031030090000,,,127.4763273198,35.2731340834,6.0,20221108175333,30393,5,,천은사(구례),57610,"천은사는 구례읍 북쪽 9km지점, 지리산 일주도로 입구에 위치하고 있으며 신라 흥덕왕 3년 (828년)에 덕운조사와 인도의 승려 '스루'가 터를 닦고 지은 절로서 화천양사라 하여 화엄사와 함께 지리산 3대 사찰로 손꼽힌다. 임진왜란 때 불타 없어진 것을 조선 광해군 2년(1610년)에 혜정선사가 다시 지었으나 숙종2년(1676년)에 불에 타버려 그 이듬해 절을 지었다가 영조49년(1773)에 화재를 당해, 영조 51년 (1775년)에 혜암선사가 다시 지어 오늘에 이르렀다. 천은사의 본래 이름은 828년 인도승려와 덕운조사가 창건할 당시 경내에 이슬처럼 맑은 차가운 샘이 있어 감로사라 했는데, 이 물을 마시면 흐렸던 정신이 맑아진다 하여 많은 스님들이 몰려 들어 한 때는 천명이 넘는 스님이 지내기도 했으며 고려 충렬왕 때는  남방제일사찰로 승격되기도 했다. 그러나 임진왜란으로 불탄 뒤 중건할  때 샘가에 큰 구렁이가 자주 타나기에 잡아죽였더니 샘이 솟아나지 않았다고 한다. 그래서 샘이 숨었다하여 조선 숙종 4년(1677년)부터 천은사라 이름을 바꾸었는데, 이상하게도 이름을 바꾼 후부터  원인모를 화재가 잦고 재화가  끊이지 않았다. 주민들도 절의 수기를 지켜주는 구렁이를 죽였기 때문이라며 두려워하였다. 이 소식을 전해들은 조선4대 명필의 한사람인 원교 이광사가 지리산 천은사라는 글씨를 물 흐르는 듯한 서체로 써서 걸었더니 이후로는 화재가  일어나지 않았다고 한다. 지금도 새벽녘 고요한 시간에는 일주문 현판 글씨에서 물흐르는 소리가 은은하게 들린다고 한다."
전라남도 구례군 토지면 피아골로 774,(토지면),38,0.0,A02,A0201,A02010800,126363,12,20031029090000,http://tong.visitkorea.or.kr/cms/resource/38/1606838_image2_1.jpg,http://tong.visitkorea.or.kr/cms/resource/38/1606838_image3_1.jpg,127.5877402048,35.2544936804,6.0,20220518165700,34966,5,,연곡사(구례),57622,"구례군 토지면 내동리에 있는 연곡사는 543년(백제 성왕 21년)에 화엄사 종주 연기조사가 창건하였으나 임진왜란 때 소실되었다가 다시 한국전쟁으로 소실되었다. 그러나 경내에는 동부도,북부도를 비롯하여 국보 2점과 보물 4점이 보존되어 있다. 1981년 3월 1일부터 당시 주지인 장숭부 스님이 정부지원과 시주로 옛날 법당을 철거하고 그 자리에 화강석과 자연석으로 축대를 쌓아 정면 5칸,  측면 3칸의 새 법당을 신축한 이후 복원 불사가 계속되고 있다. 사찰이름을 연곡사라고 한 것은 연기조사가 처음 이곳에 와서 풍수지리를 보고있을 때 현재의 법당 자리에 연못이 있었는데 그 연못을  유심히 바라보던 중 가운데 부분에서 물이 소용돌이 치더니  제비 한마리가 날아간 것을 보고 그 자리에 연못을 메우고 법당을 짓고 절 이름을 연곡사(燕谷寺)라 했다고 한다.한편 연곡사에서 눈길을 끄는 것은 의병장 고광순 순절비인데  을사늑약으로 나라의 주권이 일본에게 넘어가자 각지에서 항일 의병이 일어났는데 호남 지방에서도 의병 활동이 활발하였다. 그 대표적인 인물이 담양출신 의병장 고광순. 그는 1907년 8월 26일 지리산 연곡사에 근거를 설치하고 적극적인 의병 활동을 전개하였으나, 기습을 받아 패전하고 순절하였다. 이때 절도 불탔다. 이를 기리는 비석이 경내에 세워진 것이다."
전라남도 구례군 산동면 지리산온천로 261,,38,0.0,A02,A0202,A02020300,126476,12,20031021090000,,,127.457055639,35.3179647989,6.0,20220329102835,45029,5,,지리산온천랜드,57604," 코로나바이러스감염증19 공지사항 내용 : 임시휴업 (2020.03.30코로나 종료시까지 무기한)ua hef""https:koean.visitkoea.o.knoticenews_detail.donwsid8cdd65e159f149048c9884001e40911"" title""여행정보 변동사항 페이지로 이동""→ 코로나바이러스감염증19 여행정보 변동사항 확인하기au
지리산온천랜드는 동양 최대 규모인 4천여 평의 부지에 테마파크형 노천온천 시설을 갖췄으며, 단 1의 화학첨가물도 섞지 않은 100 천연게르마늄 온천수를 사용한다. 이 온천수는 각종 성인병을 예방하고 신진대사를 원활하게 하여 심신을 편안하고 맑게 해 줄 뿐만 아니라 면역력 또한 증강한다. 또한, 사람의 체온을 일정하게 유지해 혈액순환에 좋고 노폐물을 배출시켜 몸을 한결 가볍게 해준다. 노천온천 테마파크에는 십이지신을 형상화한 12개의 십이지신 테마 온천탕, 히노끼탕, 무릉도원을 테마로 한 무릉도원 바데풀, 폭포탕 등이 있다. 지리산온천랜드는 온천시설 뿐 아니라 대온천장, 찜질방, 약 60여 개의 최신식 객실과 부대시설을 갖춘 호텔까지 보유하고 있고, 객실에서도 이 게르마늄 온천수를 사용할 수 있다."
전라남도 구례군 토지면 피아골로,일원,38,0.0,A01,A0101,A01010900,126265,12,20030929090000,http://tong.visitkorea.or.kr/cms/resource/68/644268_image2_1.jpg,http://tong.visitkorea.or.kr/cms/resource/68/644268_image3_1.jpg,127.569247774,35.2396339226,6.0,20220526182841,72332,5,,피아골계곡,57622,"피아골은 노고단과 반야봉 사이에 자리잡은 계곡이다. 가을날의 피빛 단풍으로 지리산 10경의 반열에 든다. 기실 홍염에 불타는 단풍이 워낙 유명세를 타고 있어 그렇지 피아골은 사계절 내내 아름다운 곳이다. 봄날에 피어난 철쭉은 명경 같은 계곡에 얼굴을 비추고 여름날엔 한 올의 햇살도 허락치 않을만큼 녹음이 우거진다. 가을의 단풍은 두말할 나위 없고, 겨울엔 인적드문 호젓한 설국의 산길을 선사한다. 계곡초입에 지리산 제일의 거찰이었다는 연곡사와 국보급 문화재가 있어 찾는 이들이 많다. 피아골은 가을철을 제외하곤 찾는 이들이 많지 않아  지리산 등산로 중 호젓한 곳에 속한다.  그러나 계곡 안에 들어서면 단번에 뛰어난 흥치에 압도당한다. 연주담, 삼홍소 등 속을 알 수 없는 심연과 집채만한 바위들이 어울려 풍치가 뛰어나다. 매표소부터 피아골산장까지 6km는 그런 계곡을 건너다니며 오르는 길이라 눈이 즐겁다. 계곡 또한 가파르지 않아 누구나 쉽게 갈 수 있다. 피아골 산장에서 임걸령까지 2km는 계곡에서 멀어져 가파른 산등을 올라가야하기 때문에 소금땀을 흘려야 한다. 여름철에 물놀이 하기에  좋은 곳은 연곡사에서 직전마을까지, 직전마을에서 피아골 산장까지다. 계곡입구부터 삼홍소까지가  특히 아름다운데, 가을이면 삼홍소란 이름에 걸맞게 온 골짜기를 붉게 물들인 단풍과 붉은 빛에 젖은 계곡물과 삼홍소바닥의 바위까지 붉어 장관을 이룬다."
전라남도 구례군 수락길 73,,38,0.0,A01,A0101,A01010800,126638,12,20030925090000,http://tong.visitkorea.or.kr/cms/resource/35/1606835_image2_1.jpg,http://tong.visitkorea.or.kr/cms/resource/35/1606835_image3_1.jpg,127.4587658528,35.3468087927,6.0,20220420171835,51857,5,,수락폭포,57601,"산동면 소재지인 원촌마을에서 4km 거리인 수기리에 위치한 수락폭포는 하늘에서 은가루가 쏟아지는 듯한 아름다운 풍치를 이룬다. 높이 15m의 폭포로 여름철이면 많은 부녀자들이 낙수를  맞으며 더위를 식히는데 신경통, 근육통, 산후통에 효험이 있다하여 갈수록 많은 사람들이 이곳을 찾고 있다."
전남 구례군 마산면 사도리,상사마을,38,0.0,A01,A0101,A01011000,126767,12,20030925090000,http://tong.visitkorea.or.kr/cms/resource/08/169508_image2_1.jpg,http://tong.visitkorea.or.kr/cms/resource/08/169508_image3_1.jpg,127.4994767741,35.2151826888,6.0,20220603102006,27254,5,,당몰샘,"542-852,3","상사 마을은 구례군 간전면 양천 마을과 함께 전국 최장수 마을로 꼽힌다. 이곳 사람들은 장수의 비결로 심산유곡의 깨끗한 환경과 ""당몰샘""을 꼽는다. 당몰샘은 ""지리산 약초 뿌리 녹는 물이 다 흘러든다""는 말을 할 정도로 효능이 뛰어나다. 1986년 고려대 예방 의학팀의 수질검사 결과 대장균이 한마리도 없는 전국 최상의 물로 판명됐다. 이 마을 토박이 성씨인 의성 김씨 일가에 의하면 그 선조가 조선 말기에 명당을 찾아 전라도 고을을 헤매던 중 당몰샘을 저울로 달아보니 물 무게가 다른 곳보다 많이 나가고 수량도 풍부하여 이곳에 정착하였다고 한다."
전라남도 구례군 산동면,", 전북 남원시 산내면 덕동리",38,0.0,A01,A0101,A01010400,126636,12,20030513090000,http://tong.visitkorea.or.kr/cms/resource/96/2372096_image2_1.JPG,http://tong.visitkorea.or.kr/cms/resource/96/2372096_image2_1.JPG,127.514963588,35.3500205195,6.0,20220602142630,28191,5,,지리산 만복대,57605,"구례군 산동면과 남원시 경계에 솟은 만복대는 높이가 1,433.4m인 지리산 서부의 봉우리이다. 북으로 정령치, 남으로 성삼재 고개가 있다.  만복대는 이름만큼 복스러운 산으로 산 전체가 부드러운 구릉으로 되어 있다. '만복대'란 명칭은 풍수지리설로 볼 때 지리산 10승지 중의 하나로 인정된 명당으로 많은 사람이 복을 누리며 살 수 있다하여 만복대로 칭하였다는 설이 있다.

 지리산에서 가장 큰 억새 군락지로 가을철이면 봉우리 전체가  억새로 뒤덮여 장관을 이룬다. 이 곳에서 동남쪽으로 바라보이는 반야봉은 지리산의 웅장함을 실감케 해준다. 1990년대에 산동면에 지리산 온천 랜드가 들어서면서 온천과 연계한 등반지로 찾는 이들이 많다. 봄철 산수유꽃이 필 때면 산동면 위안리의 상위, 하위 등 산수유마을에서 노란 산수유꽃을 감상하고 만복대에 올라도 좋다. 또 가을 억새는 물론이고 겨울 설화도 멋진 곳이 만복대이다."
전라남도 구례군 문척면,일대,38,0.0,A01,A0101,A01010400,126637,12,20030513090000,,,127.4806682302,35.1798002407,6.0,20220321170900,28298,5,,오산(구례),57632,"지리산을 마주하고 있는 해발 531m의 호릿한 산으로 자라 모양을 하고 있으며, 높지도 험하지도 않고 비경이 많아 가족동반이나 단체소풍 코스로 사랑을 받아왔으며, 죽연마을에서부터 지그재그로 산길을 돌아오다 보면  발 아래 감도는 섬진강 물에 눈이 부시고 더 높이 오르면 지리산줄기를 배경으로 한 구례 일대의 전경이 한폭의 그림처럼 펼쳐진다. 정상에는 서기 582년 연기조사가 세운 것으로 알려진 암자가 있는데 원효, 도선, 진각, 의상대사 등 네 성신이 수도를 하였다하여 사성암이라 불리워지고 있으며, 이 사성암을 중심으로 풍월대, 망풍대, 배석대, 낙조대, 신선대 등 12 비경이 일품이다."
전라남도 구례군 산동면 좌사리,,38,0.0,A02,A0201,A02010700,126974,12,20020513090000,,,127.4669490998,35.3222505978,6.0,20220519103830,23293,5,,방호정(구례),57604,"지리산의 한 골짜기의 빼어난 승경지에, 당연히 정자가 앉아야 할 자리에 있는 방호정은 이 지역 유림(儒林)들이 뜻을 모아1930년에 건립하였다. 여기서 일제강점기의 암울했던 시대적 상황을 시로 달래며 소일하였다고 한다. 계곡의 거대한 암반 위에 축대를 쌓아 대지를 형성하였다. 좌우와 전면은 누마루를 깔았다. 뒷면은 심벽과 판장벽을 두었고 방의 3면은 모두 4분합 들어 열개문으로하여 걸쇠로 서까래에 걸어 매달았다. 뒷면을 제외한 3면에는 계자 난간을 돌렸는데 하엽과 두겁대 부분이 정교하게 다듬어져 있다. 정자 내부에는 기문 40여개가 걸려 있다. 방호정 건립과 함께 결성된 방호정 시사원(詩社員)은 매년 봄과 가을에 두 번의 시회(詩會)를 열어 옛 선비들이 자연을 노래하며 노는(음풍농월) 흥취를 계승하여 왔으며 1936년 정자의 왼쪽 암벽에 시사원의 이름을 새겨 두었다."
전라남도 구례군 산동면 구만제로 973-54,,38,0.0,A02,A0201,A02010700,126975,12,20020513090000,http://tong.visitkorea.or.kr/cms/resource/31/2516531_image2_1.jpg,http://tong.visitkorea.or.kr/cms/resource/31/2516531_image2_1.jpg,127.4324081026,35.3067961878,6.0,20220830091725,23955,5,,운흥정,57603,"운흥정(雲興亭)은 1926년 이 지역 유지들이 계를 조직하여 건립한 정각이라 한다. 지리산의 수많은 골짜기 중 하나인 한천(寒川) 옆의 아름다운 경승지에 위치하고 있다.정면 3칸, 측면 1칸에 전퇴를 둔 팔작 기와지붕으로 골짜기의 커다란 암반 위의 일부분에 축대를 쌓고 대지를 형성하여 정자를 얹혔다. 축대 위에는 따로이 기단을 조성하지 않고 암반위에 주춧돌을 놓고 주변을 흙과 시멘트로 다졌다. 잘 다듬어진 원형 주춧돌 위에는 다소 가느다란 원형 기둥을 세웠다. 일반적으로 중층 누각은 기둥을 누 (樓) 아래 기둥과 누(樓)위 기둥으로 별개의 부재로 나누어 조립한 것이 통례인데 하나의 부재로 처마 밑까지 올렸다. 이는 누마루가 그다지 높지 않는 까닭일 것이다. 바닥 구성은 좌우측의 툇간은 누마루를 깔았고 중앙은 뒷면 까지 방으로 꾸몄다. 방의 좌우면과 정면은 4분합 들어 열개창을 두고 걸쇠를 서까래에 걸어 매달도록 하였다. 정자내부에는 각종 기문(記文) 80여 개가 걸려 있다. 한편 이곳 일대는 조선초기에 전라감사를 지낸 하연(河演)과 용에 얽힌 전설이 있으며, 후대에 이를 기록한 비석이 있다. "
