addr1,addr2,areacode,booktour,cat1,cat2,cat3,contentid,contenttypeid,createdtime,firstimage,firstimage2,mapx,mapy,mlevel,modifiedtime,readcount,sigungucode,tel,title,zipcode,overview
전라남도 구례군 광의면 난동길 (79-33),,38,,A02,A0203,A02030100,2807331,12,20220216110729,,,127.4452464813,35.2826602464,6.0,20220407150340,0,5,,번덕뜰,57609,"전남 구례군 광의면의 지리산 중턱에 위치한 번덕뜰은 작은 호수가 있는 지초봉 중턱에서 구례를 한 눈에 내려다볼 수 있는 청정 자연을 품고 있는 힐링공간이다. 보기만 해도 심신의 피로가 풀리는 번덕뜰의 경관은 지리산 초자연의 맑고 깨끗한 공기와 함께 뭇사람들에게 알려지기 시작하여 현재, 주말에는 평균 300여 명이 찾아오고 있는 숨겨진 명소로 자리 잡아가고 있다. 농촌과 자연 속에 있는 치유적 요소(오감 및 영감)를 체험프로그램과 휴식공간으로 제공하고자 2010년부터 약 12년을 가꾸어 ""농촌문화 농장""의 콘셉트를 이루었다. 농촌형 카페와 화조원, 산책로 등이 있으며 롭이어 토끼와 같은 동물들과 교감 체험을 할 수 있다."
전남 구례군 간전면 효곡리 366-1,,38,0.0,A02,A0203,A02030600,2795244,12,20211214190128,http://tong.visitkorea.or.kr/cms/resource/42/2796442_image2_1.jpg,http://tong.visitkorea.or.kr/cms/resource/42/2796442_image2_1.jpg,127.5406334397,35.1391836349,6.0,20221129095739,0,5,,구례목재문화체험장,,"우리 생활 속 목재의 쓰임새, 목재의 생산과정, 목재의 종류 등을 한눈에 알아볼 수 있는 목재체험관이다. 다양한 전시물과 함께 목재를 활용한 생활 공예품, 놀이기구, 학습도구 등  목재품을 직접 만지고, 느끼고, 만들어 볼 수 있는 체험이 있고 전문적, 체계적, 정기적인 목공 교육을 할 수 있는 공간의 장도 마련되어 있다."
전남 구례군 토지면 문수리 74,,38,0.0,A02,A0201,A02010800,2794670,12,20211214033000,http://tong.visitkorea.or.kr/cms/resource/53/2796453_image2_1.jpg,http://tong.visitkorea.or.kr/cms/resource/53/2796453_image2_1.jpg,127.5389167756,35.2526847005,6.0,20220720151304,0,5,,문수사 (구례),,"문수사의 확실한 창건연대 기록이 전하지 않아 정확한 창건연대를 알 수 없지만 1973년에 극락실전 내에 안치된 금동여래좌상에서 발견된 발원문에서 고려 제29대 충목왕 2년(1346)이란 기록이 있어 고려 때 창건된 사찰로 추정된다. 한편 발원문 발견시에 생모시, 단수포, 쌀, 보리 등 600여 점이 함께 발견되기도 하였다. 조용한 산사분위기를 느낄 수 있으며 봄철에는 주위의 산과 목장에 벚꽃과 야생화가 어우러져 한 폭의 동양화를 연상케 한다."
전라남도 구례군 광의면 예술인길 38,,38,0.0,A02,A0201,A02010600,2794637,12,20211214031915,http://tong.visitkorea.or.kr/cms/resource/25/2796425_image2_1.jpg,http://tong.visitkorea.or.kr/cms/resource/25/2796425_image2_1.jpg,127.4492324209,35.2756944351,6.0,20211214234331,0,5,,당동마을,57609,"지리산 남악 사당이 이 마을 북쪽에 있었다고 해서 당동 마을이란 이름을 얻었다. 당동 마을은 최근 화가들이 많이 이주해와 화가마을로도 불린다. 31동의 작업실로 이루어진 화가마을은 지리산 둘레길과 화엄사, 천은사 등의 문화유적과 연계되는 문화관광 벨트를 형성하고 있다. 8만 5950㎡의 용지에 창작과 주거 기능을 갖춘 작업실들이 들어서 있다. 작업실 형태는 조각과 회화, 사진 등 장르의 성격에 맞게 화가들이 꾸밀 수 있고 별도의 전시실도 설치할 수 있도록 했다. 홍익대학교 미술대학교수, 화가, 큐레이터 등 유명 예술인들이 대거 입주해 있다. 구례의 섬진강과 지리산, 풍부한 문화자원들은 상상력을 자극하고, 겨울에도 비교적 춥지 않아 예술가들에게는 작업하기에 매력적인 장소인데다가 완주순천간고속도로의 개통으로 서울까지 3시간이면 닿을 수 있는 최적의 입지조건을 갖추고 있다."
전라남도 구례군 광의면 방광길 35,,38,0.0,A02,A0201,A02010600,2794632,12,20211214031555,http://tong.visitkorea.or.kr/cms/resource/08/2796408_image2_1.jpg,http://tong.visitkorea.or.kr/cms/resource/08/2796408_image2_1.jpg,127.4633565489,35.2612046487,6.0,20220720151826,0,5,,방광마을,57610,전라남도 구례군 광의면 방광리에 위치한 마을이다. 방광은 오래전 구례의 중심이 되는 마을이었다. 조선시대엔 전장에서 쓸 군량미를 지어 곳곳으로 보냈고 1930년대까진 남원에서 구례로 들어오는 들머리였던 이유로 지나는 나그네들로 북적였다고 한다. 방광 마을은 들 가운데 형성된 큰 마을로 마을 안에 정미소가 있다. 마을 복판에는 보호수로 지정된 느티나무가 우뚝 서서 이 마을의 오랜 역사를 말해준다. 골목길을 따라 줄지어 있는 돌담들도 볼거리다. 또한 이 마을은 천은사와 지리산 성삼재 길목 마을이다. 둘레길이 지나지는 않지만 시간이 허락하면 들렀다 가면 좋은 여행이 될 것이다.
전라남도 구례군 광의면 예술인길 38,,38,0.0,A02,A0203,A02030600,2793286,12,20211213233357,http://tong.visitkorea.or.kr/cms/resource/34/2800034_image2_1.jpg,http://tong.visitkorea.or.kr/cms/resource/34/2800034_image2_1.jpg,127.4492324209,35.2756944351,6.0,20221129141600,0,5,,구례예술인마을,57609,"화가, 도예가, 건축가 등 예술인 약 30호가 모여 마을을 이루고 있다. 현대적이고 아름다운 건축물이 멋스럽게 어우러져 있으며 갤러리, 게스트하우스, 카페, 주차장 등 편의시설이 갖추어져 있다. 매주 토요일 예술인 개인 작업실을 일반인에게 공개하는 '갤러리 오픈데이'를 운영하고 있다."
전라남도 구례군 산동면 계천리 산124-5,,38,0.0,A01,A0101,A01010400,2793278,12,20211213233211,http://tong.visitkorea.or.kr/cms/resource/41/2800041_image2_1.jpg,http://tong.visitkorea.or.kr/cms/resource/41/2800041_image2_1.jpg,127.4376232471,35.3478916368,6.0,20220720150128,0,5,,구례편백나무숲,57601,"이곳의 편백나무 숲은 40여 년 전에 조성되었다. 해방과 한국전쟁을 거치면서 우리나라의 산은 헐벗은 상태가 되었고, 이후 조림은 국가의 중대한 역점사업이기도 했다. 당시는 헐벗은 산의 거름이 되도록 하기 위해 아궁이 불을 때기 위한 낙엽 채취조차 금지되었을 정도로 산림정책은 엄격했다. 이곳의 편백나무 숲은 70년대 우리나라 숲 가꾸기 역사의 자취를 고스란히 담고 있다. 편백나무 숲 바로 아래 계곡에는 산장이 있어 편백나무로 만든 찜질방에서 등산 후의 피곤을 달랠 수 있다."
전라남도 구례군 토지면 구산길 81-4,,38,0.0,A02,A0203,A02030600,2793267,12,20211213233056,http://tong.visitkorea.or.kr/cms/resource/59/2800059_image2_1.jpg,http://tong.visitkorea.or.kr/cms/resource/59/2800059_image2_1.jpg,127.5285579616,35.1990655667,6.0,20220720151533,0,5,,구만마을,57624,"서시천이 상류에서부터 9번째로 굽이치는 곳에 위치했다고 구만리라 했다고 한다. 마을 뒤로 구만저수지가 만들어져 농업용수를 대고 있다. 최근 들어 구만저수지에 수상레저타운 시설이 들어왔다. 528,925㎡의 넓은 저수지가 주변 풍광과 어우러져 시원한 풍광을 연출한다. 서시천에는 매년 수천 마리의 철새들이 찾아온다. 비오리, 흰뺨검둥오리, 청둥오리, 큰고니 등이며 백로와 왜가리는 거의 매일 볼 수 있는 새이다. 서시천 좌우 둑방길이 있는데 이 길 좌우로 군에서 벚나무와 원추리를 심었다. 봄에는 섬진강 벚꽃 축제가 벌어지고 원추리 꽃이 피는 7, 8월이 되면 꽃길 걷기가 유행이다. 구례군에서는 매년 원추리 꽃길 건강 걷기 행사를 하고 있다. 약 3.5km 구간으로 원추리꽃이 피는 7월에 열린다."
전라남도 구례군 광의면 난동길 40,,38,0.0,A02,A0203,A02030600,2793261,12,20211213232947,http://tong.visitkorea.or.kr/cms/resource/72/2800072_image2_1.jpg,http://tong.visitkorea.or.kr/cms/resource/72/2800072_image2_1.jpg,127.4464936981,35.2786246128,6.0,20220818154912,0,5,,난동마을,57609,"난동마을에는 할아버지 당산과 할머니 당산 등 두 개의 당산이 있다. 조탑 옆에 서 있는 당산나무가 할아버지 당산나무라면, 난동마을의 할머니 당산나무는 마을 안쪽에 자리를 잡고 마을의 안녕을 지켜주고 있다. 마을에서는 매년 정월 초하루 당산제를 지내는데, 할아버지 나무가 있는 윗 당산과 할머니 나무가 있는 아랫 당산 두 곳에서 당산제를 거행한다. 지리산 생태숲이 있는 지초봉 아래에 자리하고 있으며, 당동마을처럼 산 중턱에 자리해 들판 내려보는 전망이 좋다. 지리산 둘레길은 마을의 오른쪽으로 난 길을 따라간다. 그 길 끝에 마을의 역사만큼 오래 묵은 소나무 몇 그루가 어울려 자라고 있다. 솔숲 가운데는 제당을 꾸려놨는데, 정자도 있어 쉬어가기 좋다."
전라남도 구례군 마산면 하사3길 6,,38,0.0,A02,A0203,A02030600,2793253,12,20211213232809,http://tong.visitkorea.or.kr/cms/resource/89/2800089_image2_1.jpg,http://tong.visitkorea.or.kr/cms/resource/89/2800089_image2_1.jpg,127.5064151839,35.2100528323,6.0,20221201163614,0,5,,하사마을,57621,"하사마을은 신라 흥덕왕 때부터 형성된 오래되고 큰 마을이다. 원래는 사도리로 불리던 것을 일제강점기 때 윗마을과 아랫마을을 구분해 상사리와 하사리가 되었다. 현재는 하사마을과 상사마을이 사도리를 구성하고 있다. 사도리란 이름을 글자 그대로 풀면 '모래 그림 마을'이다. 전설에 따르면 신라 말 도선국사가 이곳에서 머리를 식히고 있는데, 어디선가 도사 한 분이 나타나 모래벌판에 그림을 그려 우리나라의 풍수에 대해 알려주었다고 한다. 하사저수지를 품고 넓은 들을 바라보는 마을 정경이 아름답다. 초록 들판 너머 멀리 보이는 섬진강은 마치 한편의 그림을 보는듯하다."
전라남도 구례군 마산면 황전3길 11,,38,0.0,A02,A0203,A02030600,2793237,12,20211213232658,http://tong.visitkorea.or.kr/cms/resource/04/2800104_image2_1.jpg,http://tong.visitkorea.or.kr/cms/resource/04/2800104_image2_1.jpg,127.4884160598,35.2376077459,6.0,20220818154810,0,5,,지리산 황전마을,57616,"구례군 마산면 황전리에 있는 마을이다. 황전마을보다는 화엄사 입구 집단시설지구로 더 유명하다. 화엄사까지는 차로 15분 정도 거리이며, 화엄사지구 주차장이 있다. 그래서 항상 사람들이 끊이지 않는 마을이기도 하다. 지리산 탐방안내소가 있어 화장실을 이용할 수 있다. 또한 민박촌을 포함한 각종 숙박시설과 식당들이 즐비하다. 마을 옆으로는 화엄사계곡의 지류인 황전계곡이 흐르고 있어 여름철이면 발을 담그고 더위를 식히기에 좋다. 또한, 화엄사와의 연계 여행으로도 좋고, 어린이와 함께 반달곰 생태를 체험할 수 있는 국립공원 종 복원센터에 들러보기에도 좋다."
전라남도 구례군 토지면 용두길 54,,38,0.0,A02,A0203,A02030100,2792632,12,20211213191615,http://tong.visitkorea.or.kr/cms/resource/51/2795851_image2_1.jpg,http://tong.visitkorea.or.kr/cms/resource/51/2795851_image2_1.jpg,127.5015658529,35.2006649173,6.0,20220720145834,0,5,,용두마을,57626,"전라남도 구례읍 토지면 용두리에 위치하고 있는 용두마을은 지리산 둘레길 오미방광 구간과 오미난동 구간이 교차되는 지점에 위치해 있는 마을이다. 지리산의 용맥이 노고단 형제봉을 경유하여 내려오다가 섬진강에 이르러 머물렀는데 그곳이 용의 머리 부분이라 하여 용두라 부르게 되었다고도 하고 지리산의 줄기가 강물에 침식되어 깎아 세운 듯한 절벽이 강물에 잠기듯이 굽어보고 있는데 이 절벽의 형상이 마치 용의 머리 같다고 해서 용두라고 부르게 되었다고도 한다. 용두마을의 야트막한 언덕은 배틀재란 이름으로 불린다. 오래전 섬진강 물줄기가 이곳까지 들어왔었고 이 땅을 드나들던 사람들이 이곳에 배를 메어두었기 때문에 배틀재란 이름이 붙었다는데, 지금 이곳에선 찰랑이는 섬진강물이 아스라하게만 보인다. 하지만 물길이 멀어졌다고 해서 길손이 뜸해진 것은 아니었다. 섬진강의 배가 드나들던 곳, 구례 장을 찾던 하동 사람들의 쉼터였던 용두마을은 현재 지리산 둘레길로 또다시 사람들이 많이 찾는 공간이 되어 사랑받고 있다."
전라남도 구례군 광의면 온동1길 17,,38,0.0,A02,A0203,A02030100,2792630,12,20211213191346,http://tong.visitkorea.or.kr/cms/resource/41/2795841_image2_1.jpg,http://tong.visitkorea.or.kr/cms/resource/41/2795841_image2_1.jpg,127.4397664717,35.2802409803,6.0,20220720151554,0,5,,온동마을,57608,"온동 마을은 옛날에 온수가 난다고 해서 온수골이라고 부르면서 붙여진 이름이다. 지리산맥의 대간인 차일봉 종석대가 우측으로 뻗어와 갈미봉(간미봉)으로 이어지고, 그 갈미봉이 다시 구례재로 이어지면서 당동 마을과 난동 마을 들을 형성하였는데 그 지리산맥이 입수되어 이룬 터에 자리 잡고 있는 마을이다. 조선 말기에 전주 이씨가 이주하여 마을을 형성한 뒤 많은 주민들이 모여들어 큰 마을이 형성되었다. 마을 사람들은 단감과 고추 재배를 통해 농가 수익을 올리고 있다. 이 마을은 주변이 산으로 둘러져 있는 분지 형태로 골짜기마다 농경지가 형성되어 있다."
전라남도 구례군 광의면 연파1길 13-12,,38,0.0,A02,A0203,A02030100,2792626,12,20211213191052,http://tong.visitkorea.or.kr/cms/resource/34/2795834_image2_1.jpg,http://tong.visitkorea.or.kr/cms/resource/34/2795834_image2_1.jpg,127.4422806769,35.2593572696,6.0,20221130103017,0,5,,연파마을,57611,"전라남도 구례군 광의면 소재지의 마을이다. 농협 하나로 마트 등 각종 편의시설이 있어 쉬어가기 좋다. 광의면사무소와 마주 서있는 500년 된 입하 꽃나무가 장관이다. 입하 꽃나무는 입하가 되면 꽃이 핀다고 해서 이름 붙여진 나무다. 연파 마을은 일찍이 해남에서 서울로 이어지는 삼남대로의 주요 거점으로 많은 상인과 과거보러 가는 유생, 귀향 가는 양반 등 다양한 사람들의 왕래가 잦았던 곳이다. 특히 연파 5일장은 경남 하동포구 및 전남 순천과 전북 남원을 이어주는 중간 지점에 위치하여 1800년대부터 시장이 개장되었다고 한다. 당시에는 곡물, 어물, 축산물 그리고 장작을 비롯한 화목의 거래가 활발하여 현 우체국 앞 일대에 성시를 이루었다. 20여 개의 장옥과 부근에는 주점, 식당들이 들어섰고, 한때는 도축장이 들어서기도 하였으나 군내버스 운행 증가 등 교통의 발달과 면사무소의 신축이전 관계로 1989년 이후 5일 시장이 문을 닫게 되었다."
전라남도 구례군 광의면 수한2길 27,,38,0.0,A02,A0203,A02030100,2792624,12,20211213190909,http://tong.visitkorea.or.kr/cms/resource/23/2795823_image2_1.jpg,http://tong.visitkorea.or.kr/cms/resource/23/2795823_image2_1.jpg,127.4702533333,35.2546027356,6.0,20211214221100,0,5,,수한마을,57615,"전남 구례군 광의면에 속한 마을로 어디서나 만날 수 있는 영락없는 시골마을의 풍경을 간직한 곳이다. 마을에는 520년 수령의 느티나무가 있는데 이곳에서 매년 당산제를 지내 마을의 평안을 빌고 있다. 520년 된 나무의 잎이 일시에 피면 풍년이 들고, 23회 나누어 피면 흉년이 든다는 전설이 내려온다. 봄이면 산수유가 장관이고 마을 돌담길과 늙은 감나무들이 예스러운 분위기를 연출한다."
전라남도 구례군 마산면 장수길 22,,38,0.0,A02,A0201,A02010600,2792617,12,20211213190334,http://tong.visitkorea.or.kr/cms/resource/13/2795813_image2_1.jpg,http://tong.visitkorea.or.kr/cms/resource/13/2795813_image2_1.jpg,127.4995906358,35.2158520597,6.0,20221130103608,0,5,,상사마을,57621,"사도리 상사마을은 전국 최장수 마을로 유명한 곳이다. 장수마을에는 항상 좋은 물이 있게 마련인데 사도리의 경우 당몰샘이 장수의 비결이라고 믿는다. 지리산 약초 뿌리 녹는 물이 다 흘러든다는 말이 있을 정도로 당몰샘에서 나오는 샘물의 효능 덕분에 마을에 장수하는 사람이 많다는 뜻이다. 당몰샘 옆에 위치하고 있는 쌍산재는 사도리의 유명한 집으로 1박2일, 윤 스테이 촬영지이기도 했다. 쌍산재는 유명한 고택치고는 작은 대문을 가지고 있다. 하지만 그 문을 들어서면 밖에서 바라본 것과는 다른 풍모를 내뿜는다. 마당엔 안채와 사랑채, 건넌방이 사이좋게 모여있다. 그 옆으로는 대나무 숲과 그 숲을 오르는 계단이 있는데 그 계단을 오르면 밖에서는 상상도 못했던 들이 나온다. 그리고 후문으로 나가면 작은 저수지와 둑방길이 나타난다. 쌍산재를 돌아보면 마치 입구는 작지만 속은 넓은 호리병을 보는 듯한 느낌을 갖게 된다."
전라남도 구례군 마산면 연기암길 393,,38,0.0,A02,A0201,A02010800,2788120,12,20211208012407,http://tong.visitkorea.or.kr/cms/resource/53/2799453_image2_1.jpg,http://tong.visitkorea.or.kr/cms/resource/53/2799453_image2_1.jpg,127.5046027163,35.2688017295,6.0,20221201113624,0,5,,연기암,57616,연기암은 전남 구례군 마산면 황전리 소재 화엄사 내에 있다. 화엄사 원찰로서 백제 성왕 때 인도의 고승 연기조사가 창건했다고 전한다. 임진왜란 당시 전소되었던 것을 1989년 중창했다. 연기암에는 높이 13m에 달하는 문수보살상이 있다. 문수보살은 불교의 대승보살 가운데 하나로 삼국시대 이래 널리 전승되었다.
전라남도 구례군 토지면 금내리,,38,0.0,A02,A0203,A02030600,2788111,12,20211208012214,http://tong.visitkorea.or.kr/cms/resource/40/2791140_image2_1.jpg,http://tong.visitkorea.or.kr/cms/resource/40/2791140_image2_1.jpg,127.5144176621,35.1943380762,6.0,20221109110342,0,5,,수달관찰대,,수달관찰대는 전남 구례군 토지면 금내리에 있다. 석양이 아름답다고 알려진 2.2km 거리의 섬진강 둑길 산책로에 있다. 수달관찰대에서는 천연기념물 330호이자 환경부 멸종위기종 1종 동물로 지정된 수달을 볼 수는 없다. 하지만 수달의 생태를 확인할 수 있다. 둑길을 거닐며 강의 운치를 느낄 수도 있다. 자연과 공존하며 살아갈 수 있는 법을 체험할 수 있는 공간이다.
전라남도 구례군 간전면 간전중앙로 47,,38,0.0,A01,A0101,A01010500,2787957,12,20211208002928,http://tong.visitkorea.or.kr/cms/resource/34/2791534_image2_1.jpg,http://tong.visitkorea.or.kr/cms/resource/34/2791534_image2_1.jpg,127.5465400094,35.1874921836,6.0,20211210185511,1,5,,섬진강어류생태관,57628,"섬진강어류생태관은 전남 구례군 간전면 양천리에 있다. 2007년 35,645㎡ 부지에 지상 2층, 지하 1층 규모로 친환경 시스템을 갖춘 최신형 건물로 준공됐다. 
전시 시설의 주제는 생명의 터전, 섬진강의 강과 역사, 강과 생명, 강과 환경이다. 야외 전시 시설은 다목적 행사장, 하늘정원, 민물고기 학습장, 지피정원, 섬진강의 생태연못, 야생화 산책로, 피크닉 정원으로 구성되어 있다. 생태관은 섬진강 변에 서식하는 101종의 조류, 곤충, 식물, 파충류, 민물고기를 연구 보존하고 있다."
전라남도 구례군 토지면 내서리,,38,0.0,A02,A0203,A02030100,2787507,12,20211207222118,http://tong.visitkorea.or.kr/cms/resource/07/2790307_image2_1.jpg,http://tong.visitkorea.or.kr/cms/resource/07/2790307_image2_1.jpg,127.5733168629,35.2395395599,6.0,20221109145238,0,5,,남산마을,,"남산마을은 지리산 둘레길 가탄송정 구간에 있는 마을로 피아골 둘레길 목아재당재 구간과 합류하는 길에 있다. 내서천을 바라보고 선 남산마을은 경사가 심한 다랑논으로 삶의 터전이 형성되었고 마을 형세가 서울 남산과 비슷하여 남산마을이라 부른다고 한다. 또한, 이곳은 과거 여순사건과 6·25동란 때 반란군의 은신처를 없앤다고 하여 마을이 불탔으며 인민재판을 받아야 했던 아픔의 역사도 들어 있다. 하지만 내서리 계곡을 끼고 있으며 사시사철 수려한 경관을 즐길 수 있는 한적한 마을로 남산마을에서 내려다보는 지리산 피아골의 풍경은 장관이다."
전라남도 구례군 토지면 내동리,,38,0.0,A02,A0203,A02030100,2787500,12,20211207221813,http://tong.visitkorea.or.kr/cms/resource/27/2790327_image2_1.jpg,http://tong.visitkorea.or.kr/cms/resource/27/2790327_image2_1.jpg,127.5736438423,35.2692389941,6.0,20221109140303,0,5,,농평마을,,"농평은 도로가 갈 수 있는 가장 끝, 삼도봉에서 뻗은 능선과 10여 분 떨어진 산중의 산마을이다. 풍수지리설 노호농골(老號弄骨)의 대지 근처에 평평한 곳이라 해서 농평이라 부른다. 농평마을은 자연마을 단위로는 국내에서 손꼽히는 고산 동네로 바로 옆에 있는 지리산 능선을 타고 북쪽으로 올라서면 지리산 삼도봉에 닿고, 남쪽으로 내려서면 황장산을 지나 19번 국도까지 길이 이어진다. 2019년 폐쇄된 지리산둘레길 목아재당재​ 구간의 끝지점에 있다. 이곳에서부터 길이 끊어진다. 지금은 주로 황장산 산행을 즐기려는 등산객들이 찾고 있다."
전라남도 구례군 토지면 오미리,,38,0.0,A02,A0203,A02030100,2787485,12,20211207221348,http://tong.visitkorea.or.kr/cms/resource/18/2790318_image2_1.jpg,http://tong.visitkorea.or.kr/cms/resource/18/2790318_image2_1.jpg,127.5162171811,35.2068394759,6.0,20221110104735,0,5,,내죽마을,,"내죽마을은 대나무와 문수천의 시냇물을 따서 대내라 불렀다고도 한다. 또 대나무가 울창해서 대내라 했다고 하는데 대내 마을 중에 안쪽에 있다고 해서 안 대내, 내죽이라 불렀다고 한다. 내죽마을에 들어서면 평화로워 보이는 마을 풍경과 함께 저수지 아래쪽으로 새로 지은 집들도 속속 들어서고 있는 모습이 보인다. 노고단 아래쪽 문수골에서 발원한 토지천은 문수제 저수지에서 잠시 숨을 돌리며 이곳 사람들에게 풍부한 물을 제공하고 내죽교를 지나 섬진강에 이른다. 지리산 둘레길 송정오미 구간에 있는 마을로 내죽마을에서 오미마을로 가는 길에는 마을 빨래터가 곳곳에 눈에 띈다."
전라남도 구례군 토지면 송정리 437-8,,38,0.0,A02,A0203,A02030100,2787482,12,20211207221216,http://tong.visitkorea.or.kr/cms/resource/06/2790406_image2_1.jpg,http://tong.visitkorea.or.kr/cms/resource/06/2790406_image2_1.jpg,127.5725262954,35.1997162579,6.0,20221109105816,0,5,,송정마을,,"전남 구례군 토지면에 있는 송정마을은 임진왜란 당시 피난 온 사람들이 자리를 잡으면서 형성된 마을이다. 농지가 비좁고 협소하여 자급자족이 어려운 마을이었으나 지금은 밤나무가 많고, 매실, 고로쇠 등으로 소득을 올리고 있다. 또한, 이곳은 지리산 둘레길 가탄송정 구간과 송정오미 구간의 시·종점인 마을로 집결장소가 되어 많은 사람들이 찾고 있다. 송정오미 구간은 구례군 토지면 전경과 섬진강을 보면서 걷는 길로 농로, 임도, 숲길 등 다채로운 길들로 이어진다. 송정마을에서 출발해 약 1km의 오르막길을 제외하고는 비교적 완만하고 숲길이 많은 편이라 걷기에 좋다."
전라남도 구례군 토지면 파도리,,38,0.0,A02,A0203,A02030100,2787477,12,20211207221040,http://tong.visitkorea.or.kr/cms/resource/67/2790467_image2_1.jpg,http://tong.visitkorea.or.kr/cms/resource/67/2790467_image2_1.jpg,127.5442175363,35.205140154,6.0,20221110102923,0,5,,파도마을,,"파도마을은 지리산 둘레길 송정–오미 구간에서 구례군 노인전문 요양원에서 포장도로를 따라 나오면 19번 국도를 만나는 곳에 있다. 지역명도 파도리인데 파도리는 배들이바드리파도리의 변한 말이다. 배들이는 섬진강물이 마을 앞까지 찰랑찰랑 넘쳐흘렀고 나룻배들이 이곳에 정박한 데서 유래되었다고 한다. 이후 행정구역개편을 하느라고 한자를 차음한 것이 파도리가 된 것이다. 비교적 주민들이 많은 파도마을은 지리산 노고단에서 왕시루봉으로 이어져 끝 봉에서 낭떠러지처럼 뚝 떨어진 명당 터에 자리 잡고 있다. 섬진강변이라 안개 낀 날이 많다. 구례 군청 소재지에서 7km, 면 소재지에서 동쪽으로 1km 지점이고 경남 하동군 화개면과는 8km에 이른다."
