addr1,addr2,areacode,booktour,cat1,cat2,cat3,contentid,contenttypeid,createdtime,firstimage,firstimage2,mapx,mapy,mlevel,modifiedtime,readcount,sigungucode,tel,title,zipcode,overview
전라남도 영광군 백제문화로 67,,38,,A02,A0202,A02020700,2825937,12,20220701132404,http://tong.visitkorea.or.kr/cms/resource/80/2825880_image2_1.jpg,http://tong.visitkorea.or.kr/cms/resource/80/2825880_image3_1.jpg,126.4355366128,35.3648087939,6,20220701151603,0,16,,숲쟁이꽃동산,57009,"숲쟁이공원을 지나 백제불교최초도래지로 가는 길에 자리잡은 꽃동산으로 푸른 나무 숲과 형형색색의 꽃들이 조화를 이룬 산책로를 걸으면서 법성포의 아름다운 풍경을 볼 수 있다. 특히, 매년 봄이 되면 알록달록 피어난 푸릇푸릇한 나무들과 장관을 이루며 2022년에는 금계국 군락지를 새롭게 조성하여 6월이면 온 들판을 노랗게 물들인다. 시원한 바람을 맞으며 법성포 전경을 볼 수 있는 정자도 설치되어 있어 가족과 함께 방문할 수 있는 힐링 여행지로 추천한다."
전라남도 영광군 법성면 진내리,28-1,38,,A02,A0202,A02020700,2825936,12,20220701132047,http://tong.visitkorea.or.kr/cms/resource/78/2825878_image2_1.jpg,http://tong.visitkorea.or.kr/cms/resource/78/2825878_image3_1.jpg,126.4399112429,35.3640395093,6,20220701132059,0,16,,숲쟁이공원,57009,"조선 중종때 축조된 법성진성의 연장으로 심은 느티나무 등이 300년 이상 성장하여 성주변으로 울창하게 이루어진 숲으로 아름다운 꽃이 만발한 숲쟁이꽃동산을 거쳐 백제불교최초도래지와 연결된다. 국가지정 명승 '한국의 아름다운 숲'으로 선정되었으며, 매년 국가무형문화재 법성포단오제가 이곳에서 열려왔다. 숲쟁이 공원을 걷다가 하늘을 올려다보면 푸른 하늘과 느티나무 잎 사이로 들어오는 따사로운 햇살에 눈이 부시다. 살랑살랑 불어오는 봄바람에 느티나무잎이 사각사각 소리를 내며 이따금 노래하는 새들의 소리가 정겹다."
전라남도 영광군 영광읍 현암길 43,,38,0.0,A04,A0401,A04010700,2775333,12,20211117192837,,,126.5094683447,35.2764339291,6,20211117192837,0,16,,GB포유공방,57044,"GB포유공방은 전라남도 영광군 영광읍에 위치한 비누공방, 캔들 공예, 화장품을 제작하는 공방 주민사업체이다. 청년주민사업체로서 다양한 캔들 제품을 제작, 판매하고 원데이 클래스를 운영하는 등 다양한 활동을 하고 있다. 영광군의 로컬 스토리가 유니크한 디자인 공방 제품을 직접 제작  구매할 수 있는 공간이다. 이 외에도 난이도 별 클래스 운영, 영광군 관광 기념품, 굿즈 제품 생산을 준비하고 있다."
전라남도 영광군 영광읍 중앙로 121-2,,38,0.0,A02,A0203,A02030600,2775331,12,20211117192359,,,0.0,0.0,6,20211117192359,0,16,,놀아본(BORN),57045,"놀아본(BORN)은 영광 지역 내 소상공인(플로리스트, 비건디저트 카페 등)이 함께 관광 활성화를 위한 프리마켓 기획 및 프크닉세트 렌탈 사업을 진행 예정인 주민사업체이다. 현재 청년 주민사업체로서 자유로움 자연스러움 익숙한것에서 찾는 새로움을 추구하고 있다.관광두레 주민사업체로서 영광군 관광 활성화에 큰 영향을 미칠 것으로 기대하고 있다."
전라남도 영광군 대마면 원당길1길 8,,38,0.0,A02,A0203,A02030600,2775323,12,20211117190721,,,0.0,0.0,6,20211117190721,0,16,,서로마을,57055,"서로마을은 청년주민사업체로서 가장 젊은 마을 만들기 라는 미션을 가진 공동체이다. 영광군 대마면에 위치해있으며, 폐교를 리모델링한 장소에 트리하우스, 생태체험, 잔디밭 등이 구성되어있다. 현재는 관광두레 사업을 통한 관광체험상품을 개발하여 농가체험, 숙박, 생태체험 활성화, 전기카트장 등을 목표로 사업을 영위하고 있다."
전라남도 영광군 백수읍 대신길2길 11-3,,38,0.0,A02,A0203,A02030100,2775315,12,20211117190434,,,0.0,0.0,6,20211117190434,0,16,,다락해영어조합법인,57025,"영광군 백수읍에 위치한 다락해영어조합법인은 백수읍 대신항 주변 관광상품을 개발하며, 영광군 9경에 해당하는 영광백수해안도로를 인접한 사업장 주소지로서 다양한 해양관광 활성화를 위한 프로그램을 기획한다. 특히 국내 관광, 로컬 관광과 해양 치유관광에 대한 관심이 증가하고 있어 미래가 기대된다. 고객들에게 해양 치유, 해양관광에 대한 플랫폼을 제공하여 영광군 관광 활성화와 해양관광에 대한 대중성 증가를 토대로 지역 소상공인의 소득증대를 위한 역할을 원하는 다락해영어조합법인의 관광상품 개발을 기대해 본다."
전라남도 영광군 영광읍 현암길 43,,38,0.0,A02,A0203,A02030600,2775304,12,20211117185752,,,0.0,0.0,6,20211117190147,0,16,,아올,57044,"아올은 목공예 작가, 한지공예가, 청년 작가 등이 함께 목공을 활용한 관광기념품을 개발하여 판매하기 위한 주민사업체로 전남 영광읍 내 청꿈공방 공방거리에 있다. 젊은 인재들의 집합인 청년 주민사업체로서 목공예품에 디자인 요소를 접목시켜 다양한 상품을 개발한다. 광읍 청꿈공방 공방거리는 목공방뿐만 아니라 세라믹 공방, 캔들 공방, 금속 공방 등 다양한 분야의 공방들을 만날 수 있다."
전라남도 영광군 자비길 225,,38,0.0,A02,A0210,A02100700,2775019,12,20211117024241,,,126.5346294053,35.1881971138,6,20220811144452,0,16,,불갑다향,57058,"전남 영광군에 위치한 불갑다향은 관광두레를 통해 농촌교육, 예절교육, 다도체험 등을 개발하고 있다. 불갑다향을 이끄는 리더 강현식 대표는 군산대학교에서 산업도예를 전공했고,  국가 중요무형문화재 105호 백산 김정옥 선생의 전수자이다. 현재까지 영광군 불갑면에서 도예가로 활동하였다. 불갑면에 위치한 불갑다향 사업장 주위에는 불갑사, 권역사업 상사화피는마을, 불갑수변공원 등의 영광군 대표 관광지가 있다."
전라남도 영광군 백수읍 백수로7길 14,,38,0.0,A02,A0203,A02030600,2775018,12,20211117023705,,,0.0,0.0,6,20211117190116,0,16,,모시나라,57029,"영광군 백수읍에 위치한 모시나라는 영광군 특산품인 모싯잎송편의 원재료인 모시를 활용한 다양한 상품을 개발하는 주민사업체이다. 지역브랜드 모싯잎을 활용하는 만큼 향후 방향성이 기대된다. 모시세제, 모시샴푸, 모시를 활용한 식음료 상품개발을 주된 방향성으로 확립하였으며, 특히 마을 내 고택시설, 모싯잎떡 판매장을 활용한 판로를 구축하고 있다. 이외에도 기존의 체험프로그램과 모시를 활용한 체험프로그램을 연계한 상품의 출현을 기대해본다."
전라남도 영광군 영광읍 영대로 648,,38,0.0,A02,A0203,A02030600,2775017,12,20211117021457,,,0.0,0.0,6,20211117190022,0,16,,주식회사 하늘,57022,"주식회사 하늘은 전국 최초로 토판염보리굴비 특허를 보유하고 있는 기업이다. 토판염보리굴비는 야외 덕장에서 말리지 않고 실내 건조와 토판염을 활용한 염좌를 활용하여 굴비의 맛이 일정하고 담백하다. 특히 관광두레 사업을 통해 추후 영광굴비 브랜드를 전국에 널리 알리고 직접 개발한 건조기술, 염좌 기술을 활용한 토판염보리굴비를 판매, 체험 프로그램을 개발 중에 있다. 명절마다 바쁜 일상을 보내고 있다는 하늘굴비의 추후 성장을 기대해 본다."
전라남도 영광군 염산면 향화로5길 21-22,,38,0.0,A01,A0101,A01011400,2751333,12,20210929232833,,,126.3735709017,35.2115084707,6,20211118235844,0,16,,설도항,57066,"설도항은 전남 영광군 염산면에 위치한 작은 항구로, 염산면이라는 이름에서 유추할 수 있든 소금이 많이 생산되는 곳이다. 이런 이유로 염산면은 소금과 더불어 천일염으로 만든 젓갈도 유명해, 설도항에 위치한 설도젓갈타운이 큰 규모로 운영 중이다. 또한 바닷가로는 수산물 판매센터도 있어 영광 앞바다에서 잡힌 신선한 해산물을 구매하고 맛보려는 관광객으로 붐비는 항구이다. 계절별로 잡히는 다양한 활어와 꽃게, 낙지, 왕새우 등을 저렴하게 구매해 맛볼 수 있도록 벤치도 마련되어 있다. 설도항의 수산물과 젓갈이 신선하고 저렴해 특히 단골 손님과 관광객이 많이 찾는 곳이다."
전라남도 영광군 백수읍 해안로 565-17,,38,0.0,A02,A0205,A02050600,2751332,12,20210929232601,,,126.3788010046,35.3238708267,6,20211118235225,0,16,,백암해안전망대,57025,"백암해안전망대는 영광에서 노을을 감상하기 가장 좋은 곳 중 하나이다. 이 전망대는 영광 9경 중 하나인 백수해안도로의 중간에 자리 잡고 있어 주변 관광지와 연계해 드라이브를 즐기다 들르기 좋다. 구불구불한 해안도로를 따라가면서 비슷한 눈높이에서 바다를 봤다면, 높은 지대에 위치해 파노라마로 펼쳐진 풍경을 선사하는 이곳을 찾아보자. 바다와 해안선의 아름다운 풍경이 색다르게 보일 것이다. 가까이 보이는 작은 섬과 멀리 보이는 풍력발전기 단지가 시원하면서도 이국적인 풍경을 더한다."
전라남도 영광군 염산면 향화로 2-10,,38,0.0,A01,A0101,A01011400,2751319,12,20210929231654,,,126.3603175723,35.1686742123,6,20211209012106,0,16,,향화도선착장,57065,"과거에는 갯벌로 연결된 섬이었으나 현재는 간척지로 육지와 연결된 향화도에 있는 향화도선착장은 낚시를 즐기는 이들에게는 유명한 명소이다. 특히 붕장어와 갑오징어를 잡으러 오는 낚시인이 많다. 향화도선착장에는 영광 칠산타워가 있어 칠산대교와 인근의 섬과 바다 풍경을 한눈에 감상할 수 있다. 전남에서 가장 높은 111m의 높이를 자랑하는 전망대로, 영광군의 11개 읍면이 하나로 화합한다는 의미를 지니고 있다. 칠산대교는 영광군과 바다 건너 무안군 해제면을 잇는 다리로, 이전에는 무려 62km를 돌아서 가야 했던 거리를 단 3km로 줄여 줬다. 이로 인해 칠산대교를 이용해 무안과 신안의 구석구석을 여행하기가 편해졌다. 노을과 칠산대교의 멋진 야경을 감상하기 위해 향화도선착장을 찾는 경우도 많다."
전라남도 영광군 백수읍 대신리,,38,0.0,A02,A0205,A02050600,2715691,12,20210510185745,http://tong.visitkorea.or.kr/cms/resource/01/2814801_image2_1.jpg,http://tong.visitkorea.or.kr/cms/resource/01/2814801_image2_1.jpg,126.3875107289,35.3486403842,6,20220524181420,6,16,,백수해안도로 노을전망대,57025,"황홀한 낙조로 유명한 백수해안도로에는 노을전망대가 있다. 노을전망대에서는 공중을 걷는 아찔함과 눈 앞에 펼쳐지는 탁 트인 바다를 동시에 느낄 수 있다. 스카이 워크의 끝에는 핫 포토존인 괭이갈매기 날개 조형물(작품명『끝없는 사랑(Endless Love))이 설치되어 있다.  야간 경관조명이 더해져 밤이 되면 날개가 다채로운 색으로 빛난다. 높이 3.6m, 폭 3.2m의 크기로 백수해안도로를 찾는 모든 사람들의 아름다운 사랑과 백년해로의 기원을 담아 2021년 설치하였다. 괭이 갈매기는  칠산도의 상징이며 한번 짝을 이루면 평생을 함께하는 것으로 알려져있다."
전남 영광군 백수읍 백암리 223-2,,38,0.0,A02,A0202,A02020700,2715639,12,20210508012337,http://tong.visitkorea.or.kr/cms/resource/31/2716431_image2_1.jpg,http://tong.visitkorea.or.kr/cms/resource/31/2716431_image2_1.jpg,126.3790287188,35.3256234094,6,20220429154920,1,16,,백수해안공원,,"잔디밭으로 조성된 해안산책 공원으로 해안 따라 조성된 둘레길이 있으며 노을 전망대가 언덕 위에 자리한다. 잠시 차를 세우고 힐링 타임을 가질 수 있는 아름다운 공원이다. 백수해안공원의 산책로를 따라 걷다보면 거북바위와 모자바위도 만나볼 수 있다. 백수해안공원 및 해안도로에 있는 촛대바위, 거북바위, 모자바위는 전설에 따르면 어부가 바다에 나가 돌아오지 않자 그의 부인이 아이를 등에 업고 촛대를 들고 나가 바닷가에서 남편이 돌아오길 기다리다 돌이 됐다고 한다. 바다에서 익사한 남편은 거북이가 돼 촛불을 보고 바닷가로 돌아와 돌이 됐다는 이야기가 전해진다."
전라남도 영광군 염산면 향화로 10-28,,38,0.0,A02,A0205,A02050100,2703770,12,20210114013738,,,126.3617202295,35.16850481,6,20220519171539,0,16,,칠산대교,57065,"전남 무안군 해제면과 영광군 염산면을 잇는 1.82㎞의 해상교량이며, 2012년 12월18일에 개통된 다리다. 칠산대교 개통으로 영광군과 무안군의 거리가 62㎞에서 3㎞, 운행시간은 70분에서 5분으로 가까워졌으며, 다양한 축제와 유명 관광지와의 연계가 가능해져 관광산업 발전에 도움을 주고있는 다리다."
전라남도 영광군 백수읍,,38,0.0,A02,A0205,A02050100,2703759,12,20210114011611,,,126.419335284,35.3644807837,6,20220415153018,0,16,,영광대교,57025,"전남 영광군 백수읍과 홍농읍을 잇는 다리로 2016년 3월25일에 완공된 다리다. 주탑과 주탑 간 거리인 주경간장이 320m에 달한다. 영광대교 완공으로 지역간의 이동이 활발해 지면서 지역발전에 큰 도움을 주고 있으며, 인근 유명 관광지의 진입이 용이해져 관광 산업에도 많은 도움을 주고 있는 다리다."
전라남도 영광군 염산면 향화로 2-10,,38,0.0,A02,A0205,A02050600,2684009,12,20201119191430,http://tong.visitkorea.or.kr/cms/resource/03/2684003_image2_1.JPG,http://tong.visitkorea.or.kr/cms/resource/03/2684003_image2_1.JPG,126.3603175723,35.1686742123,6,20220426171040,0,16,,칠산타워,57065,"전남에서 가장 높은 111m의 전망대로 영광군 11개 읍면이 하나로 화합한다는 의미를 가지고 있다. 1층에는 여객대합실과 매점, 수산물판매센터, 2층에는 음식점과 회센터가 입점해있으며 3층에 하이라이트인 전망대가 있다. 전망대에 오르면 광활하게 펼쳐진 칠산 앞바다와 주변 육지가 한 눈에 들어와 절로 탄성을 지르게 한다."
전라남도 영광군 영광읍 물무로 219,,38,0.0,A01,A0101,A01010700,2675000,12,20201007051452,http://tong.visitkorea.or.kr/cms/resource/86/2825886_image2_1.jpg,http://tong.visitkorea.or.kr/cms/resource/86/2825886_image3_1.jpg,126.5167706243,35.2703736263,6,20220630175037,0,16,,물무산 행복숲,57051,"한국관광공사 비대면 관광지로 선정된 물무산 행복숲은 숲속둘레길 10km, 질퍽질퍽 맨발 황톳길 2km, 유아숲체험원, 물놀이장, 편백명상원 2개소, 소나무숲, 예술원, 가족명상원, 하늘공원, 등산로 3.5km, 운동기구가 조성되어 있는 종합산림복지숲이다. 특히 물무산 뒷편에 위치한 맨발 황톳길은 황토의 건강함과 질퍽거리는 재미를 느끼며 힐링할 수 있으며 질퍽한 황토길 0.6㎞와 마른 황톳길 1.4㎞로 구성되어 이용자의 편의에 따라 맨발로 질퍽한 길과 마른 황토 길을 선택하여 걸을 수 있다."
전라남도 영광군 영광읍 영광로7길 46-79,,38,0.0,A02,A0201,A02010700,1957467,12,20141018011422,,,126.5230315993,35.2534256497,6,20221004140100,1832,16,,이흥서원,57052,"진주강씨 강성덕, 강희안, 강희맹, 강귀손, 강학손  다섯 선생을 봉안하고 제향하는 서원이다. 경내의 건물로는 이흥사(驪興祠) 등 3칸 사우(祠宇), 내삼문景仰門 3칸 이흥서원 강당 모현당(慕賢堂), 목조와가 정면 8칸 측면4칸 팔작집과 팔룡당(八龍堂) 3칸, 외삼문崇義門 3칸과 고사(顧舍) 등이 있다. 사우에는 강석덕, 강희안, 강희맹, 강귀순, 강학손의 위패가 봉완되어 있으며 모현당과 팔룡당은 유림의 회합과 학문 강론 및 숙소로 사용하고 있다. 고사는 서원의 관리인이 기거하는 곳이다."
전라남도 영광군 영광읍 와룡로2길 16,,38,0.0,A02,A0201,A02010700,1957401,12,20141017221638,,,126.503682422,35.2895656788,6,20220926171750,1762,16,,무령서원,57035,"무령서원은 1784년(영조 24) 본향유림의 발론으로 김심언, 김해 두분의 충절을 사모하여 처음영광읍 동부면 내천에 사우를 창건하고 기천사라 하였다. 1868년(고종 5)에 대원군의 서원철폐령으로 훼철되었다. 그 후 1903년(광무 7) 설당향사해 오던 중 1933년 현재의 위치에 사우를 복건하였다. 1975년에 영광향교 전교 강길원 등 10여 인이 기천사를 무영서원으로 개칭하였다. 그 후 다시 본 서원은 정부당국의 보조로 1975년 개수를 하여 새로 단장을 마친 바 있다. 향사일은 매년 3월, 9월 중정일에 향사한다."
전라남도 영광군 묘량면 동삼로1길 21,,38,0.0,A02,A0201,A02010700,1957399,12,20141017221225,http://tong.visitkorea.or.kr/cms/resource/88/2738788_image2_1.jpg,http://tong.visitkorea.or.kr/cms/resource/88/2738788_image2_1.jpg,126.5474514968,35.2597808928,6,20210901231557,1936,16,,묘장영당,57056,"묘장서원 또는 영당사라고도 한다. 전라남도 영광군 묘량면 운당리 영당마을 중앙에 자리 잡고 있다. 2004년 2월 13일 전라남도문화재자료로 지정된 묘장영당은 조선 초의 개국공신인 양도공 이천우(李天祐 1354∼1417)의 영정을 봉안한 사당으로, 1616년에 건립되었다. 태종은 1416년 이천우가 퇴직할 때 그 공적을 치하하여 화공으로 하여금 이천우의 화상(畵像)과 이응도(二鷹圖)를 그리게 했는데 그것이 후에 묘장영당을 건립하게 된 계기가 되었다. 후손들이 대대로 영정을 보관하다가 이천우의 증손인 부사맹 이효상(李孝常)이 담양으로부터 영광 묘량면 영양리 당산마을로 이주·정착하면서 부조묘(不祧廟)를 건립하고 영정과 함께 유품(포총교지, 이응도, 공신회맹축 등)을 보존하였다고 전한다. 이후 1616년(광해군 8) 향내 유림과 함께 뜻을 모아 현 소재지에 영당(影堂)을 세우고 영정을 이안하여 배향하였다는 기록이 1747년 간행된 영당사기에 전해진다.  1868년(고종 5)에 대원군의 서원 훼철령에 의해 사우는 철거되었고, 강당은 그대로 남아 서당으로서의 기능을 했으며 1919년에는 강당에 사립영신학교를 설립하여 4년 과정의 학교를 운영하였다. 그 후 1928년 후학과 향내 유림들이 사우 복원을 추진하였고, 1934년에 이르러 옛터에 사우를 중건하였다. "
전라남도 영광군 영광읍 청보리로3길 31,,38,0.0,A02,A0201,A02010700,1957346,12,20141017191746,,,126.518919654,35.3018117683,6,20220513175558,1398,16,,계송서원,57022,"영광읍 계송리에 있는 계송서원은 1966년(병오) 향내유림의 발의로 하동 정간, 미산 정례손 등의 절의를 추모하기 위하여 현소재지에 사우를 창건하고, 처음 이를 도내사라 제액하여 제향해 오다가 후에 계송서원이라 개액하였다. 향사는 음력 춘 2월 20일, 추 8월 20일에 모신다."
전라남도 영광군 영광읍 향교길 32,,38,0.0,A02,A0201,A02010700,1954943,12,20141010182330,,,126.5200369171,35.2737482985,6,20211012195917,1867,16,,영광향교,57051,"고려 공민왕 때에 현유(賢儒)의 위패를 봉안, 배향하고 지방민의 교육과 교화를 위하여 창건되었다. 1582년에 중수하였으며, 임진왜란 때 소실되었다가 그 뒤 복원하였다. 현존하는 건물로는 정면 3칸, 측면 2칸의 맞배지붕으로 된 대성전, 정면 4칸, 측면 3칸의 전사청(典祀廳), 각 3칸의 동무(東廡)·서무(西廡), 각 3칸의 동재(東齋)·서재(西齋) 등이 있다. 대성전에는 5성(五聖), 송조2현(宋朝二賢), 우리나라 18현(十八賢)의 위패가 봉안되어 있다. 조선시대에는 국가로부터 토지와 전적·노비 등을 지급받아 교관이 정원 30명의 교생을 가르쳤으나, 갑오경장 이후 신학제 실시에 따라 교육적 기능은 없어지고, 봄·가을에 석전(釋奠)을 봉행(奉行)하며, 초하루·보름에 분향하고 있다. 전라남도 유형문화재로 지정되어 있으며, 전교(典校) 1명과 장의(掌議) 수명이 운영을 담당하고 있다."
전라남도 영광군 군남면 육창로1길 50-1,,38,0.0,A02,A0203,A02030100,1939446,12,20140806203042,,,126.4344547522,35.1965750576,6,20220920102303,2271,16,,영광 용암마을,57061," 자연이 선물해 준, 고운 빛깔 영광 용암마을   용암마을에는 백제 불교의 시작인 불갑사의 큰집이라 불리는 연흥사가 위치해 있다. 연흥사 가는 길은 다소 가파르지만 어른 걸음으로 왕복 1시간 정도의 짧은 코스로 주변 계곡의 풍경과 자연의 소리를 감상하기에 좋다. 더불어 자연물(치자, 수박목, 도토리)을 활용한 천연염색과 천연 방부제 역할도 하면서 우유보다 칼슘이 48배나 많은 모싯잎 송편도 직접 만들고 먹어 볼 수도 있다. 13년 등급제 전부문 1등급(경관․서비스, 체험, 숙박, 음식)마을이다.  먹거리 모시송편, 쑥개떡, 복분자즙 등"
전라남도 영광군 백수읍 해안로 957,,38,0.0,A01,A0101,A01010500,1874060,12,20131219233134,http://tong.visitkorea.or.kr/cms/resource/58/2647158_image2_1.jpg,http://tong.visitkorea.or.kr/cms/resource/58/2647158_image3_1.jpg,126.3960373556,35.3644998387,6,20220217110348,13122,16,061-350-5600(노을전시관),백수해안도로,57025,"영광군 백수읍 길용리에서 백암리 석구미 마을까지 16.8km에 달하는 해안도로로, 기암괴석·광활한 갯벌·불타는 석양이 만나 황홀한 풍경을 연출하는 서해안의 대표적인 드라이브 코스이다.
특히 해안도로 아래 목재 데크 산책로로 조성된 3.5km의 해안 노을길은 바다 가장 가까운 곳에서 걷기와 함께 아름다운 풍경을 감상할 수 있으며, 2006년 건설교통부의 한국의 아름다운길 100선, 2011년 국토해양부의 제 1회 대한민국 자연경관대상 최우수상을 수상하는 등 각종 평가에서도 우수한 성적을 거두었다.
국내 유일의 노을전시관을 비롯하여 다양한 펜션과 음식점 등이 갖추어져 있다."
전라남도 영광군 불갑면 방마로 151,(불갑면),38,0.0,A02,A0202,A02020100,1623859,12,20120507211356,http://tong.visitkorea.or.kr/cms/resource/35/1954535_image2_1.jpg,http://tong.visitkorea.or.kr/cms/resource/35/1954535_image3_1.jpg,126.5155135891,35.2224095911,6,20220401142314,20919,16,,불갑저수지 수변공원,57058,"광주·전남에서 최대 규모를 자랑하는 불갑저수지 주변을 관광지로 조성한 수변공원에는 철따라 잘 가꾸어진 화단과 시원한 물줄기가 일품인 인공폭포 등이 눈길을 사로잡는다. 수변도로에는 형형색색의 관광용 풍력가로등이 자연친화적으로 설치되어 가을정취를 즐기는 관광객에게 아름답고 생동감 있는 볼거리를 제공하고 있다. 불갑저수지 수변도로 2.8㎞ 구간에 바람(풍력)의 힘으로 프로펠러가 작동(회전)하여 야간에는 형형색색의 조명과 주간에는 프로펠러의 역동성을 볼 수 있는 가로등 81등이 설치되어, 빛의 고장 영광의 아름다움을 연출해 이곳을 찾은 관광객에게 좋은 호평을 받고 있다.  또한 저수지 수변을 따라 수변공원에 가면 꽃으로 공원이 조성되어 있고, 인공폭포의 분수대가 뿜어내는 모습을 볼 수 있으며, 앞쪽에는 아름다운 불갑저수지를 한눈에 볼 수 있는 전망대가 설치되어, 이곳을 찾는 지역민과 관광객에게 사랑을 받고 있다. 풍력가로등은 풍속 23.5msec에 프로펠러가 작동(회전)하여 6시간 조명분 축전기에 전력을 저장하여 가로등주에 부착된 4색전구(80와트)의 조명이 되며, 높이는 812m로 설치되어 대체에너지 대한 학생들의 견학코스로 각광을 받고 있다."
전라남도 영광군 낙월면 하낙월리,,38,0.0,A01,A0101,A01011300,1537931,12,20120114000557,,,126.1271126578,35.1946868804,6,20220907175706,2134,16,,하낙월도,57068,"동쪽으로 상낙월도와 제방으로 연결되어 있어 생활권이 상낙월도와 같다고 볼 수 있다. 상낙월도 서쪽에 위치한 섬으로 아래쪽에 위치하여 하낙월도라 하며 면적은 0.87㎢이다. 간조시에 나타나는 갯벌에는 괭이갈매기가 서식하고 있으며, 섬에서 서식하는 조류는 참새, 중부리도요, 제비, 쇠백로, 마도요 등이 있다.해안침식으로 생긴 지네꼬리바위, 할미바위와 벼락바위 등 기암괴석이 있으며, 지는 해를 보면서 집안에 우환이 없게 해달라고 기원했던 우환맞이(산능선) 터가 있다. 또한, 수석의 명산지로 석질이 다이아몬드 다음으로 강해서 애호가들의 사랑을 받고 있다. 염산면 향화도에서 출발하는 낙월도행 정기여객선이 1일 3회 운항하고 있다."
