addr1,addr2,areacode,booktour,cat1,cat2,cat3,contentid,contenttypeid,createdtime,firstimage,firstimage2,mapx,mapy,mlevel,modifiedtime,readcount,sigungucode,tel,title,zipcode,overview
강원도 양구군 양구읍 한반도섬길 76,,32,,A01,A0102,A01020100,2913879,12,20221107192507,http://tong.visitkorea.or.kr/cms/resource/37/2921437_image2_1.jpg,http://tong.visitkorea.or.kr/cms/resource/37/2921437_image3_1.jpg,127.9828295908,38.1306932194,6.0,20221125174551,0,6,,한반도섬 자연습지,24514,"한반도의 배꼽이라고 불리는 국토 정중앙 양구, 파로호 상류에 위치한 국내 최대 규모의 인공습지.양구 한반도섬은 국내 최대 규모의 인공 습지로 파로호 상류에 위치한 인공 섬입니다. 오랫동안 방치돼 있어 오염이 심각했던 땅을 생태계 복원과 수질 정화를 위해 조성한 곳으로, 탁 트인 전망을 자랑합니다. 호수 반대편 동수리에 위치한 한반도섬 전망대에서는 섬의 모습을 한눈에 바라볼 수 있습니다. 짜릿한 스릴을 즐길 수 있는 짚라인을 타고 한반도섬으로 가보는 것도 즐거운 경험을 선사합니다. 잔잔한 호수와 푸르른 숲을 동시에 누릴 수 있고 전국8도의 모습을 형상화한 한반도섬은 시원하게 쭉 뻗은 나무 데크 길을 따라 걷는 코스가 인상 깊습니다. 반려견과 함께 백두에서 한라까지, 국토 종주를 하는 기분으로 천천히 호흡하며 한반도섬을 즐겨보세요."
강원도 양구군 양구읍 함춘로 116,,32,,A01,A0101,A01011300,2913878,12,20221107192416,http://tong.visitkorea.or.kr/cms/resource/02/2921402_image2_1.jpg,http://tong.visitkorea.or.kr/cms/resource/02/2921402_image3_1.jpg,127.9890349552,38.1183725506,6.0,20221125174650,2,6,,양구꽃섬,24520,"양구 꽃섬은 메타세쿼이아 길, 상록원, 계절원, 아이리스원, 중앙정원으로 나뉘어져 섬 하나가 식물원인 듯 꾸며져 있는 곳으로 반려견과 함께 산책하기 좋은 곳입니다."
강원도 양구군 국토정중앙면 두무리 산12,,32,0.0,A02,A0203,A02030100,2788932,12,20211208185903,http://tong.visitkorea.or.kr/cms/resource/23/2793223_image2_1.jpg,http://tong.visitkorea.or.kr/cms/resource/23/2793223_image2_1.jpg,128.067671284,38.0582782644,6.0,20221117142041,0,6,,두무리산촌생태마을,,"양구군 남면 두무리는 두무동 고개와 소양강 상류에 둘러싸여 있는 전형적인 산촌마을이다. 40년 전인 1973년 소양강댐이 건설되면서 두무리와 붙어있는 인제군 남면 관대리 일원에 물이 차게 됐고 두무리는 산과 강으로 둘러싸인 오지 중의 오지로 손꼽히게 됐다. 청정 자연이 마을을 품고 있다 보니 이곳에서 생산되는 모든 농산물과 산채 등도 전국 최고의 맛과 품질을 자랑한다. 두무리에서는 주로 고추, 수박, 곰취, 오이 등이 생산 판매하고 있다."
강원도 양구군 양구읍 동수리 산1-1,,32,0.0,A02,A0205,A02050600,2778091,12,20211123195643,,,127.9711307128,38.1288682106,6.0,20211124224802,0,6,,한반도섬전망대,,"한반도의 배꼽이라고 불리는 한반도의 정중앙 양구에 떠 있는 한반도섬은, 파로호 상류에 있는 한반도 모양을 한 국내 최대 규모의 인공습지다. 전망대 주차장이 따로 있고 주차장 건너편의 나무데크로 조성된 계단을 오르면 팔각정 형태의 전망대가 나온다.  전망대에 오르면 망원경이 설치되어있고, 파로호의 한반도섬을 조망할 수 있다.  물이 가득한 계절에 가야 뚜렷한 한반도 모양을 볼 수 있다고 한다. 전망대에서 내려와 백두에서 한라까지 한반도섬을 전체 둘러보는데는 한 시간 정도 소요된다."
강원도 양구군 동면 숨골로310번길 131,,32,0.0,A01,A0101,A01010700,2714550,12,20210427003809,,,128.0740222459,38.1900297009,6.0,20220718135548,1,6,,양구 수목원,24511,"양구 수목원은 DMZ 휴전선 인근 신비의 자연생태가 펼쳐진 곳으로 희귀식물을 관찰 할 수 있다. 특히, 식물원이 있는 대암산에는 우리나라가 람사르협약에 가입하면서 최초로 등록한 습지, 용늪이 있어 식물원의 가치를 더욱 높여 주고 있다. 식물원은 149천㎡의 부지에 다양하고 많은 종의 식물들을 보유하고 있으며, 우리지역에 자생하는 희귀멸종위기식물의 보전과 증식을 통해 생태학습장으로 활용되고 있다."
강원도 양구군 동면 펀치볼로 266-60,,32,0.0,A01,A0101,A01010500,2714534,12,20210426202744,,,128.0748794087,38.2257255543,6.0,20221213153143,0,6,,산양증식복원센터,24506,"2007년 6월28일 개장한 양구산양증식복원센터는 양구군 동면 팔랑리 일대 17만5237㎡의 자연 암벽지대에 사육장과 그늘막, 치료센터 등을 갖추어 생태계 파괴와 밀렵 등으로 멸종위기에 처한 천연기념물산양 복원기술을 자체 개발하고 산양의 유전자원 보호, 증식기술 확보, 야생동물 생장모델 및 사료개발 등의 추진으로 산양의 개체수를 늘리기 위해 건립되었다. 자연 속에 있는 산양들의 모습을 만날 수 있는 산양증식복원센터에서는 환경 보호의 중요성과 생태계의 신비에 대해 다시금 한 번 생각할 수 있는 계기를 제공한다. 물 한 모금을 마시면서도 사람들을 경계하며 야생성을 잃지 않은 그들의 모습에 감탄하며, 아이들에게 자연의 소중함을 일깨워 줄 수 있는 특별한 공간이다. 철장이 아닌 들에서, 바위 위에서 살아가고 있는 산양을 바라보며 자연으로 돌아가기까지의 과정을 둘러 볼 수 있다.  (출처 : 강원도청)"
강원도 양구군 양구읍 박수근로 366-24,,32,0.0,A02,A0202,A02020100,2714079,12,20210420012845,,,127.982835919,38.1052211879,6.0,20220818111043,0,6,,청춘양구레포츠공원,24519,"이 야영장은 물놀이, 공놀이, 자전거를 좋아하는 사람들이 행복한 시간을 보낼 수 있는 장소다. 2002년부터 청소년야영장으로 이용되던 곳인데 최근 캠핑인구 급증과 함께 캠퍼들의 입소문을 타고 유명해졌다. 야영장 관리자 말에 의하면 봄이 시작되는 45월 연휴 기간부터 총 95면에 이르는 모든 사이트가 꽉 찰 정도란다. 깨끗한 시설에서 부모, 아이, 어른 모두가 자신에게 맞는 레포츠를 즐기며 캠핑을 할 수 있는 전국적으로도 흔치 않은 캠핑 공간이다.   양구 레포츠공원 야영장은 양구읍내 바로 옆을 흐르는 양구서천 변을 따라 물놀이 테마파크, 야외 수영장, 풋살장 2면, 게이트볼장, 그리고 실내 수영장이 있는 양구국민체육센터 등의 최신시설을 갖추고 남북으로 길게 자리 잡고 있다. 양구군시설관리사업단 카페(cafe.daum.netygsisul)를 방문하면 꾸준하게 이뤄지고 있는 관리 현황을 생생한 사진과 함께 파악할 수 있다. 양구 레포츠공원 야영장은 양구읍내와 가깝기 때문에 전통시장이나 대형마트를 이용하기 좋다. 서울에서 양구까지 서울춘천고속도로를 이용하면 자가용으로 1시간 30분쯤 걸린다. 그래서 양구 레포츠공원 야영장은 서울에서 찾아가기에도 부담 없는 입지조건을 갖추고 있다."
강원도 양구군 양구읍 한반도섬길 76,,32,0.0,A01,A0101,A01011300,2713392,12,20210408222417,,,127.9828295908,38.1306932194,,20220322112357,0,6,,한반도섬,24514,"파로호 한반도 섬은 파로호 상류에 163만 평방미터의 국내 최대의 습지를 조성하고 호수 한가운데에 한반도 모습으로 만들어진 인공 섬으로 섬까지 나무 데크길로 연결이 되어 있어 강변 바람을 맞으며 걷기에 좋은 산책로가 조성이 되어있다.
호수 반대편 동수리쪽에 위치한 한반도섬 전망대에 들러 전체적인 섬의 모습을 바라볼 수 있다. 전망대에 도착해서 계단을 조금만 오르면 파로호와 한반도섬을 한눈에 담을 수 있다. 하늘과 호수와 푸르른 숲을 눈에 담을 기회가 드문 요즘 눈은 물론 마음까지 탁 트이게 하는 시원함을 느낄 수 있을 것이다."
강원도 양구군 남면,,32,0.0,A02,A0205,A02050200,2702469,12,20201230223954,,,127.9877535893,38.0573185282,6.0,20220503103729,0,6,,필리핀군 전투전적비,24558,"철원평강김화를 잇는 철의 삼각지대에서 치열한 전투가 있었다. 1952년 05.18  21일과 1952.06.18.  21일 두 차례에 걸쳐 중공군과 의용군을 필리핀군 제 19, 20 전투단이 힘껏 싸웠다. 제 1차 전투 3일 동안 고지의 주인이 9차례나 바뀔 정도로 치열하였다. 험난했던 제 1차 전투는 몇 차례의 공방 끝에 고지를 탈환함으로써 종료되었다. 제 2차 전투에선 강력한 화력 지원 하에 중공군을 마주하였으나 끝끝내 고지를 사수하였다. 중공군과 의용군은 탱크 2대를 비롯한 많은 장비와 전사자를 유기한 채 퇴각하였다. 전투 이후 양구지역으로 이동하여 심포리 일대에 주둔하였고 그 기간 동안 필리핀군 전투 전적비를 세운 것으로 추정된다."
강원도 양구군 남면,,32,0.0,A02,A0205,A02050200,2702467,12,20201230220925,,,128.0465733173,38.1459232091,6.0,20220419141044,0,6,,전기필불망비,24552,흉년이 심해 마을주민들이 끼니를 잇지 못했다. 이때 전기필이라는 부자가 자신의 곡식 수백석을 구휼미로 나눠 기근을 무사히 넘겼다. 조정에서 가선대부 벼슬을 내렸으며 주민들은 공로를 기리기 위해 1840년 비석을 세웠다. 이후 1942년 목공의 후손인 전승한씨에 의해 비각이 세워졌다. 불망비란 후세 사람들이 잊지 않도록 어떤 사실을 적어 세우는 비석이다. 마을 사람들에게 많은 은덕을 베풀고 목숨을 구해주었기에 이렇게 감사의 표시로 전기필 불망비가 세워졌을 것이다. 오늘 날 전기필 불망비는 우리에게 많은 것을 시사한다. 무엇인지는 구태여 적지 않을 것이다. 직접 비석을 바라보고 주변 풍경을 보면서 스스로가 정답을 찾으면 되기 때문이다.
강원도 양구군 동면 월운리,,32,0.0,A02,A0205,A02050200,2701934,12,20201229021952,,,128.0430074477,38.2214337809,6.0,20220414105651,0,6,,피의능선전투전적비,24505,"피의 능선 전투로 북한군 1250명, 남한군 전사자를 포함하여 1030명이 피해를 보았다. 특히 하루 평균 3만 여발로 최고 5만 여발의 포탄이 쏟아지곤 했다. 빗발처럼 포탄이 쏟아지고 2천 여발의 대인지뢰가 터지는 가운데 수많은 발목 절단 부상자를 감수해가며 끝내 고지를 탈취하는 모습을 미국 기자가 Bloody Ridge Line이라는 제목으로 격전 상황을 보도하였다. 이후 피의 능선이라는 이름을 붙이게 되었다. 양구군은 피의 능선 전투 외에도 수많은 격전을 치른 지역이다. 한국전쟁의 아픔을 느끼고 평화의 소중함을 알아보는 시간을 가져보는 것은 어떨까. 피의 능선은 양구군 동면 월운리 북쪽의 능선을 뜻한다. 1951.08.18.  22일까지 총 5일간 42만여 발의 포탄이 쏟아지는 가운데 치른 격전이다. 한국군 제 5사단, 36연대가 미군 제 2사단에 배속되어 치열한 공방전을 펼쳤다. 전투 결과 한국군이 승리함으로써 북한군은 펀치볼 북쪽 능선으로 물러나게 되었다."
강원도 양구군 해안면 해안서화로 35,,32,0.0,A01,A0101,A01010500,2616554,12,20190827004230,http://tong.visitkorea.or.kr/cms/resource/37/2616537_image2_1.bmp,http://tong.visitkorea.or.kr/cms/resource/37/2616537_image2_1.bmp,128.145484876,38.2901860485,6.0,20221208162736,0,6,,해안분지 (강원평화지역 국가지질공원),24562,"해안분지는 차별침식에 의하여 형성된 우리나라의 대표적이 침식분지이다. 분지 바깥의 높은 산지는 변성퇴적암으로 이루어져 있으며, 낮은 부분은 숭생대의 화강암으로 이루어져 있다. 분지는 변성암과 화강암의 경계 부분에 균열이 생기게 되며, 이러한 균열을 따라 물이 스며들며 화강암을 부서뜨려 오목한 사발모양을 보인다. 해안이라는 지명은 돼지를 키우면서 많던 뱀이 사라지면서 돼지가 마을에 편암함을 가져왔다는 뜻에서 유래되었으며, 6.26전쟁 당시에는 분지의 독특한 생김새를 본따 UN군에서 펀치볼로도 불렀다."
강원도 양구군 방산면 평화로 5182,,32,0.0,A01,A0101,A01010500,2616524,12,20190827001644,http://tong.visitkorea.or.kr/cms/resource/19/2616519_image2_1.bmp,http://tong.visitkorea.or.kr/cms/resource/19/2616519_image2_1.bmp,127.9515051132,38.2074808928,6.0,20221208162701,0,6,,양구백토 (강원평화지역 국가지질공원),24502,"선캠브리아기의 편암과 편마암, 그리고 쥐라기 흑운모화강암이 기반암을  이루는 곳에 양구백토가 발달한다. 양구백토는 단층대와 일치하므로 단층운동에 의해 형성되었으며, 단층점토가 지표로부터 유입된 물과 반응하여 점토광물인 일라이트가 1113 정도를 이루는 백토를 형성하였다. 조선시대 백자의 백토 공급지로 사용되었으며, 태조 이성계 발원 사리구를 통해 고려 말기부터 양구 방산에서 백자가 만들어 졌음을 알려주는 중요한 역사적 사료이기도 하다."
강원도 양구군 양구읍 중앙길 53,,32,0.0,A02,A0205,A02050200,2569471,12,20181124223911,http://tong.visitkorea.or.kr/cms/resource/73/2566573_image2_1.jpg,http://tong.visitkorea.or.kr/cms/resource/73/2566573_image3_1.jpg,127.9893075573,38.105035221,6.0,20220830103352,38,6,,양구 해시계,24533,"양구군의 해시계는 무청시레기와 산나물이 넘치는 중앙시장근처에 있다. 차없는 거리가 진행되고 있어 한적하게 볼 수 있다. 문처럼 이루고 있는 해시계는 모습부터 비범하다. 시반 안에 걸쳐 있는 영침부분은 2kg이 넘는 순금과 2.3kg의 18K 금도금으로 되어있으며, 받침대 등에 사용된 청동은 무려 8.5톤에 이른다. 이 앙부일구는 총 높이 7m70cm, 총 지름 4m73cm, 총 무게 18톤으로 한국기록에 공식 등록되었다. 해시계는 세계 기네스북 기록으로 공식 인증되어 양구군의 새 랜드마크로 공식 자리매김 했다. 인구 2만 4천명의 작은 산골 도시 양구는 사실 전쟁 전에는 북쪽땅으로 구분되어 있었다고 한다. 분단선을 경계로 남한의 최 북단 도시가 된 양구의 중앙로는 '아름답고 걷고 싶은 거리'를 표방하고 있으므로, 남북의 감회를 생각하며 걸어보자."
강원도 양구군 양구읍,,32,0.0,A02,A0202,A02020700,2569470,12,20181124223604,http://tong.visitkorea.or.kr/cms/resource/81/2566581_image2_1.jpg,http://tong.visitkorea.or.kr/cms/resource/81/2566581_image3_1.jpg,127.9825048613,38.1227663592,6.0,20220906104627,43,6,,용머리 공원,24515,"용머리공원은 농림수산식품부의 공모사업에 선정되어 농업농촌의 테마공원 지원사업으로 조성되었으며, 공원 명칭은 예로부터 전래되어온 용의 머리산 이름을 따서 용머리 공원이다. 용머리 공원은 가족이나 단체가 이용할 수 있는 캠프죤과 지역 행사와 축제를 할 수 있는 대형 부지가 마련되어 있다."
강원도 양구군 양구읍 양남로7번길 13,,32,0.0,A02,A0202,A02020700,2569469,12,20181124223217,http://tong.visitkorea.or.kr/cms/resource/21/2566521_image2_1.jpg,http://tong.visitkorea.or.kr/cms/resource/21/2566521_image3_1.jpg,127.990896271,38.1060462445,6.0,20220803160946,54,6,,양구군민공원,24523,"양구읍 중심지인 양구군민회관은 대단히 큰 공원은 아니다. 자잘한 벤치들과 시원해보이는 인공폭포가 잠깐 앉아서 쉬기 좋은 곳이다. 그러나 비봉 전망 타워는 보기부터가 멋스럽다. 총 4층으로 있는 탑은 24층 전체가 유리로 되어 멋진 외관을 갖추고 있다. 엘리베이터를 타고 올라간 4층은 양구군 시내를 한 눈에 내려다볼 수 있었다. 탁드인 작은 도시의 한적한 풍경의 아기자기함은 서울의 전망대와는 또 다른 느낌으로 다가온다.3층은 엔틱으로 꾸며진 식당이 운영되고 있다.   또 비봉공원 방향의 경찰서송죽장 구간에는 노후건물 대신 소나무를 비롯한 21종에 달하는 각종 수목 300그루와 관목 7400여 그루, 초화류와 잔디밭으로 조성됐으며, 공원 앞의 교차로도 기존 Y자형에서 원형으로 설치돼 운전자들의 불편이 해소됐다. 더욱이 이곳에 시가지 일대를 조망할 수 있는 전망대는 양구지역의 새로운 관광명소로 전망된다."
강원도 양구군 양구읍 비봉로 69,,32,0.0,A02,A0206,A02061100,2569468,12,20181124223044,http://tong.visitkorea.or.kr/cms/resource/41/2566541_image2_1.jpg,http://tong.visitkorea.or.kr/cms/resource/41/2566541_image3_1.jpg,127.9868410191,38.1081986944,6.0,20220803163737,68,6,,양구돌산령지게놀이 전수관,24527,"팔랑리는 강원도 양구군 동면에 있는 리이며, 지게마을이라고도 한다. 밭농사를 주로 하는 농촌 지역이다. 전통적인 농촌경관을 가장 잘 보존하고 있는 아름다운 마을로서, 시설농업이 발달되어 있고 산채 약초와 야생화가 재배되고 있다. 특히, 바랑골 농요와 돌산령지게놀이 등 무형문화재가 잘 보존되어 있고 전수회관시설이 되어 있는 등 전통문화자원이 풍부하고, 팔랑폭포와 양수암폭포 등 관광자원이 풍부하다."
강원도 양구군 해안면 후리 621번지,,32,0.0,A02,A0201,A02011000,2569463,12,20181124034746,http://tong.visitkorea.or.kr/cms/resource/21/1841521_image2_1.jpg,http://tong.visitkorea.or.kr/cms/resource/21/1841521_image3_1.jpg,128.1454321042,38.2901249437,6.0,20220519131244,32,6,,DMZ펀치볼둘레길,24562," 숲길체험지도사 동반신분증 지참
펀치볼마을은 고려시대 이전에는 이 분지를 ""번화""라고 불렀으며 그 후 ""해안(亥安)""으로 불렀다가 해안으로 바뀌었다가 1885년 (고종32년)엔 해안면이 설치되기도 했다. 1956년 휴전 후 난민정착사업의 일환인 재건촌 조성으로 100세대씩 입주시키며 농민들의 개척에 의해 마을의 틀이 만들어졌다. 원래 동면 관할 아래 있었던 해안 출장소가 1983년 전국 행정구역 조정에 따라 동면 북부를 분리 승격시켜 현재에 이르고 있다. 또한 6.25격전중 해안을 바라본 종군기자가 이곳을 형태를 본따 펀치볼이라 부른데서 세계적으로는 펀치볼이라는 이름으로도 알려져 있다. DMZ펀치볼 지역의 특성상 숲길체험지도사를 동반하지 않으면 탐방이 이루어지지 않는다. 또한 민간인 출입통제 지역내에 조성된 숲길로, 미확인 지뢰지역과 인접된 지역으로 안내자의 안내에 따라야 한다."
강원도 양구군 양구읍 박수근로 367,,32,0.0,A02,A0201,A02011000,2569462,12,20181124034601,,,127.9811972135,38.1040990654,6.0,20220329143227,36,6,,DMZ산림두드림센터,24519,"DZM산림두드림센터는 산림실행의 주체로서 산림소유자와 임업인의 자주적인 협동 조직을 통하여 지속 가능한 산림경영을 촉진하고 산림생산력을 증진시키며 구성원의 경제적, 사회적, 문화적 지위 향상을 도모함으로서 국민 경제 발전에 기여함을 목적으로 1962년 설립되었다."
강원도 양구군 동면 팔랑리,,32,0.0,A02,A0201,A02011000,2569459,12,20181124032943,,,128.0463239786,38.2160011446,6.0,20220719092951,38,6,,펀치볼지구전투전적비,24507,"펀치볼(Punch Bowl)'이란 양구군 해안면 일대를 일컫는 별칭이다. 해안면은 6.25 전쟁 당시 주변의 고지를 중심으로 치열한 전투가 펼쳐졌던 곳이다. 당시 UN군은 해안면 일대의 모습이 화채그릇(Punch Bowl)처럼 생겼다 하며 펀치볼이라고 불렀는데 주위가 모두 해발 1,000m가 넘는 고지로 이루어져 있다. 따라서 고지전이 중심이 되었던 6.25 전쟁에서 피의 능선 전투, 도솔산 전투, 가칠봉 전투 등 처절했던 전투가 이 부근에서 이루어졌다. 이 일대에는 펀치볼 일대에서 이루어졌던 전투에서 고귀한 목숨을 희생했던 선열들의 넋을 달래기 위한 전적비들이 세워져 있는데 펀치볼지구전투 전적비도 그중 하나다. 주변으로는 제4땅굴, 을지전망대, 전쟁기념관 등의 안보 여행지들이 있으며, 많은 이들이 이곳을 찾아 순국 선열들의 고귀한 희생을 기리고 있다. 이 구역은 민간인 제한구역으로 출입시 사전 등록이 필요하다"
강원도 양구군 방산면 두타연로 8,,32,0.0,A02,A0203,A02030600,2569391,12,20181124011342,http://tong.visitkorea.or.kr/cms/resource/03/2566503_image2_1.jpg,http://tong.visitkorea.or.kr/cms/resource/03/2566503_image3_1.jpg,127.9835710384,38.226904235,6.0,20220411093125,33,6,,소지섭길,24501,"소지섭길은 강원도 DMZ일대를 배경으로 2010년 출간된 소지섭의 포토에세이집 '소지섭의 길'이 발단되었으며, 천혜의 자연을 간직한 양구의 아름다움과 따뜻함에 반한 소지섭이 이를 통해 자신의 이야기를 들려주고자 가장 좋아하는 숫자 51을 소지섭길의 총거리로 확정했다."
강원도 양구군 방산면,,32,0.0,A02,A0201,A02011000,2569384,12,20181124002750,http://tong.visitkorea.or.kr/cms/resource/81/2566481_image2_1.jpg,http://tong.visitkorea.or.kr/cms/resource/81/2566481_image3_1.jpg,127.9835710384,38.226904235,6.0,20220826134025,22,6,,두타연 평화누리길,24501,"평화누리길은 강원도 양구 두타연의 금강산 가는 길목이다. 민간인 통제구역으로 6,25전쟁 이후 50여 년간 출입이 통제되어 오다가 2004년 개방되어 원시 자연을 그대로 간직한 DMZ 생태계 보고로 청정한 자연의 신비와 아름다움을 만끽할 수 있는 자연 생태 누리길이다."
강원도 양구군 양구읍 박수근로257번길 10,,32,0.0,A02,A0203,A02030400,2568839,12,20181122201004,http://tong.visitkorea.or.kr/cms/resource/11/2566511_image2_1.jpg,http://tong.visitkorea.or.kr/cms/resource/11/2566511_image3_1.jpg,127.9829417782,38.0948918378,6.0,20220803163936,41,6,,양구공예공방,24549,"양구공예공방은 공예의 메카라 불릴만큼 많은 공예와 문화가 함께하는 공간이다.정중앙, 그 중심에 햇볕이 따뜻하게 내리쬐는 양지바른 곳에 위치한 공예 공방. 그래서 ""양지바른 공예공방""이라는 뜻의 ""양공방""이라고도 부른다. 이곳은 방짜, 생활, 목공예 작가 3인이 운영하는 곳으로 공예품 전시와 판매장이 함께 열려있다. 이곳에서 직접 체험도 하고 자연스럽게 공예에 다가가 마음에 꼭드는 작품도 구매할 수 있다.제품은 전통적인 방법으로 만들어진 것부터 현대적인 색깔이 강한 세련된 제품까지 다양하게 만날 수 있다.위치는 박수근 미술관 옆 햇볕이 따뜻하게 내리쬐는 곳에 위치하고 있으며, 하늘이 푸르고 맑은 날, 양공방에 오면 햇볕 가득하고 양지바른 공예들을 만날 수 있다."
강원도 양구군 양구읍 파로호로869번길 101,,32,0.0,A02,A0206,A02060100,2568829,12,20181122200140,http://tong.visitkorea.or.kr/cms/resource/62/2566562_image2_1.jpg,http://tong.visitkorea.or.kr/cms/resource/62/2566562_image3_1.jpg,127.98116334,38.1220025339,6.0,20210824005439,70,6,,양구인문학박물관,24515,"2012년 12월 1일 개관한 양구인문학박물관은 근현대 한국 시문학에 큰 영향을 준 10명의 시인의 족적이 담겨져 있으며 그들의 일대기를 영상으로 볼 수 있다. 이해인 수녀님의 시에 담긴 아름다운 문학적 정신과 김형석, 안병욱 선생님의 깊은 인문학적 사고를 길러내어 삶의 등불이 되고, 국토의 정중앙 양구가 문화도시로 거듭날 수 있는 중추적인 역할을 하는 공간이다."
강원도 양구군 양구읍 금강산로 439-51,,32,0.0,A02,A0206,A02060100,2568827,12,20181122195631,http://tong.visitkorea.or.kr/cms/resource/31/2566531_image2_1.jpg,http://tong.visitkorea.or.kr/cms/resource/31/2566531_image3_1.jpg,127.9903513839,38.1222387914,6.0,20220906144157,41,6,,양구근현대사박물관,24520,"양구근현대사박물관에는 북에서 건너온 다양한 기념물들이 전시되어 있다.  2012년 국내 제1호 아리랑 박사 석우(石牛) 박민일 박사와 강원도민일보 북미특파원 송광호 기자가 기증한 것으로 시베리아와 북미대륙 등을 취재하며 수집한 것들로 약 1만 5000점에 달하는 근현대사 자료가 되고 있다.북한의 고액화폐나 조선 초중기 청화백자, 분청사기들, 고종의 아들 의친왕 이강이 쓴글부터 20세기 중반의 영화포스터들, 옛날 교실의 풍경까지 다양한 전시가 구성되어 있어 누구나 즐겁게 관람할 수 있다."
