addr1,addr2,areacode,booktour,cat1,cat2,cat3,contentid,contenttypeid,createdtime,firstimage,firstimage2,mapx,mapy,mlevel,modifiedtime,readcount,sigungucode,tel,title,zipcode,overview
강원도 영월군 영월읍 동강로 426,,32,0.0,A01,A0101,A01010400,127301,12,20060509090000,http://tong.visitkorea.or.kr/cms/resource/13/1955713_image2_1.jpg,http://tong.visitkorea.or.kr/cms/resource/13/1955713_image3_1.jpg,128.5203280024,37.2122347987,6,20210824014856,24512,8,,완택산,26223.0," 천혜의 요새였던 산, 완택산 (강원)  완택산(916m)은 영월읍 삼옥리와 연하리 사이에  위치하고 있으며 산세는 동고서저 형태이다. 주능선을 경계로 동쪽 연하리 방면은  급경사에 절벽이 많고 서쪽 동강 방면은 완만한 산세를 이루고 있다. 산세가 이렇듯이,  옛날부터 완택산은 천혜의 요새로 주능선 동쪽은 대부분 수직 절벽으로서 자연 성곽을  이루고 서쪽은 동강 물줄기가 자연적인 방어선 구실을 해주었다. 그러한 이유로 이곳에는 영월군민들이 전란시 피난처로  이용하였다는 얘기가 전해지며, 능선을 따라 축성한 산성흔적이 산자락 곳곳에 조금씩  남아 있다.  완택산 등산코스는 연하리 방면에서 올라가는 코스가  일반적으로 많이 알려져 있으나 길이 가파르고 하산시에는 반대편인 삼옥리로 하산하는  불편함이 있어 교통편이 용이하지 못한 것이 흠이다.  지역 주민의 피난처, 완택산성  완택산의 정상에서 북서쪽으로 이어지는 7개 봉우리의  산정을 감싸면서 돌로 축조한 석성을 완택산성이라 한다. lt;동국여지승람gt;에  산성의 둘레는 3,477척(약 1.05km)이며, 1290년(고려 충렬왕 16) 원나라의 반군이었던  합단(哈丹)의 무리가 침입했을 때 고을사람들이 이곳으로 피신하였다는 기록이 나온다.  그밖에 lt;여지도서gt;, lt;증보문헌비고gt; 등에도 완택산성 관련 기록이 남아  있다."
강원도 영월군 무릉도원면 운학리 1111-5,,32,0.0,A01,A0101,A01010400,127302,12,20060509090000,http://tong.visitkorea.or.kr/cms/resource/54/1841554_image2_1.jpg,http://tong.visitkorea.or.kr/cms/resource/54/1841554_image3_1.jpg,128.1907402567,37.329853912,6,20220607134854,29479,8,,구룡산(강원),26200.0," 깊은 산세와 강의 아름다움이 절경을 이루는  산, 구룡산 (강원 영월)   강원도와 경상북도에 걸쳐있는 구룡산은 태백산,  청옥산, 각화산, 옥석산 등과 함께 태백산맥에서 소백산맥이 갈라져 나가는 곳에  있다. 구룡산은 영월의 서쪽 수주면 운학리와 도원리 사이에 운학천과 구절양장 굽이치는  섬안이강에 감싸여 그 아름다움을 더하고 있다. 구룡산 남쪽 산자락 끝에 위치한  '섬안'이라는 마을을 동, 남, 서쪽으로 감싸 흐르는 강줄기 이름이 서만이 강인데  옛날 명칭은 '섬안이 강'이라고 전해지고 있다.   이 산 정상에 오르면 서쪽으로는 치악산이 보이고,  북쪽으로는 백덕산과 사자산이 한눈에 들어온다. 남쪽으로는 비산 넘어 용두산이  보여 전망이 좋은 산이다.    구룡산을 맛볼 수 있는 추천 산행  산행기점인 두산약수는 육각정 건물에 거북이 입에서  물이 나오도록하여 더욱 신비스러우며 주차장과 목재화장실이 있다. 두산약수에서  동쪽 계곡길을 따라 5분 거리에 조립식 패널건물과 좌측산자락에 폐농가가 있다.    농가를 지나면 자연미가 살아있는 급경사 바위지대가  나타나고, 이곳을 지나면 구룡산 0,5km라고 쓰인 안내판이 보이고 노송과 바위지대가  있는 구룡산 서릉을 밞는다. 동쪽 급경사길을 따라 10여 분 거리의 바위지대를 좌측으로  돌아 진달래가 군락을 이룬 곳을 통과하여 30분 거리에 이르면 20여 평 넓이의 헬기장이  있는 정상에 도착한다."
강원도 영월군 중동면 응고개길 169-2,,32,0.0,A01,A0101,A01010400,127303,12,20060509090000,http://tong.visitkorea.or.kr/cms/resource/62/1955362_image2_1.jpg,http://tong.visitkorea.or.kr/cms/resource/62/1955362_image3_1.jpg,128.693928574,37.1370161965,6,20220916150813,25611,8,,목우산,26243.0," 상여봉이라 불리는 슬픈 산, 목우산(강원)    목우산은 해발 1,066m로 중동면 녹전리와 하동면 내리 사이에 부드럽게 솟은 산이다. 산의 남쪽인 내리에서 쳐다보면 암봉이 상여와 같다하여 일명 상여봉으로 불린다. 산행은 응고개마을에서 시작한다. 응고개마을 입구는  아담하게 소공원이 꾸며져 있고, 이곳에 목우산 등산로 안내판이 설치되어있다. 안내판에서  우측으로 난 콘크리트 포장도로를 따라 50미터쯤 가면 낙엽송이 서 있는 곳에서 좌측으로  올라서면 밭가를 따라 오르면 된다. 조금은 경사가 심한 오름길을 오르다보면 아름드리  노송과 신갈나무가 목우산이 큰 산임을 느끼게 한다. 지능선 오름길을 1시간여 오르면  주능선 등산로 방향표시판에 도착한다. 이 곳에서 동쪽방향으로 주능선을 따라 30여분  거리에 이르면 935봉에 올라서면 정면에 뾰족한 목우산 정상이 시야에 들어온다.   민족의 슬픔이 서려있는 산   목우산은 해방 이후 사상적 이데올로기 투쟁의 슬픈  역사를 간직하고 있는 산이다. 1949년 강동정치학원 출신인 박갑수 대대장과 사상책임자  연규백을 중심으로 이 산을 근거지 삼아 빨치산 활동을 하다 경찰의 습격으로 붕괴되고 말았다. 그때 녹전리 전투를 기념하기 위한 경찰 전적비가 녹전리 음지마을에 있다. 또한, 1968년 울진삼척 무장공비가 이 산에 숨어들어 민간인을 학살했던 집터 및 은신 아지트가 등산로에 위치하고 있다."
강원도 영월군 상동읍 선바위길 246,,32,0.0,A01,A0101,A01010400,127304,12,20060509090000,http://tong.visitkorea.or.kr/cms/resource/72/1955372_image2_1.jpg,http://tong.visitkorea.or.kr/cms/resource/72/1955372_image3_1.jpg,128.8053653501,37.1530637051,6,20220921094136,19319,8,,선바위산(영월),26248.0," 동양화의 신비로움을 담은 산, 선바위산 (강원)    선바위산(1,042m)은 영월군 상동읍 내덕리 31번  국도상에서 북으로 올려다보면 병풍을 펼쳐놓은 듯한 바위산이다. 바위와 노송군락이  동양화처럼 어우러진 비경을 자랑하고 있으며, 높이 50여 미터의 선바위가 서 있어  선바위산이라는 이름을 얻게 되었다.  산 중턱에 위치하고 있는 선바위는 이곳 주민들의  집안의 흉사가 있을 때 치성을 드리고, 자식이 없는 사람은 이곳에서 정성을 드리면  자식을 얻게 한다는 설이 있어 이곳 주민들은 신성시 모시는 바위다.   선바위산의 추천 산행   선바위산의 산행은 구래리의 반쟁이골 출입구에서  시작한다. 이곳에 선바위 산을 알리는 안내판이 서있다. 이것에서 23킬로미터 가량  들어가면 우측지계곡이 나오는데 계곡을 따라 본격적인 산행이 시작된다.  우측계류를 건너 20여 미터 거리에 우측사면으로  이어지는 길을 따라 20여분 올라서면 노송 군락지대가 나오고, 너덜지대를 힘겹게  통과하여 30여분을 올라서면 반쟁이골이 한눈에 내려다보이는 전망바위에 도착한다.  바위의 좌측 능선길을 따라 5분여 거리쯤 안부에 닿으면 좌측협곡 아래로 선바위가  보인다. 선바위를 뒤로 하고 오르막 능선길을 20여분 올라서면, 좌측 백운산에서  이어져 뻗어내린 지능선이 합치는 삼거리에서 우측 남릉을 따라 10여 선 바위중 제일  큰 소원바위 분 거리에 이르면 남쪽이 수십길 단애로 이루어진 정상에 도착한다."
강원도 영월군 중동면 태백산로 1833,,32,0.0,A01,A0101,A01010400,127305,12,20060509090000,,,128.7195484723,37.1380998941,6,20220405135243,25048,8,,단풍산,26243.0,"단풍산(1,150m)은 함백산이 서쪽으로 뻗은 능선상의  백운산에서 서남쪽으로 가지를 쳐 매봉산을 일으키고 계속 서쪽으로 이어져 직동천과  옥동천에 막혀 더 나아가지 못하고 지맥을 다한 곳에 솟은 산이다. 남쪽은 절벽으로  이루어져 있어 조망이 매우 뛰어나고 아름다운 풍광을 간직한 산이다. 

 단풍산의 추천 산행 
산행의 시작은 솔고개 마을의 청솔식당. 청솔식당  뒤편 마을로 올라가는 콘크리트로 포장된 농로를 따라 300여미터 올라가면 기와로  지붕을 올린 단층농가가 있고 농가 뒤편 주목을 심어 놓은 밭이 있다. 밭가를 가로  질러가면 잘록이 안부에 도착한다. 안부에서 북으로 바라보면 철탑 두 개가 아래위로  서 있는 능선을 따라 10여분 올라서면 송전 철탑 두 개가 서 있다. 철탑을 지나 조금  가파른 길을 계속 올라가면 주능선 절벽 앞에 도착한다. 절벽 앞에서 왼쪽으로 돌아서면 동쪽방향으로 절벽 밑을 따라 나아가는 길이 계속 이어지며 남쪽으로 뻗은 지능선을 넘어 내려서면 주능선으로 오르는 넓은 침니 형태의 길이 나타난다. 이 길을 따라 100여 미터 오르면 주능선에 오른다. 이곳에서 동쪽 능선을 따라 등산로는 이어지고 전망대 역할을 하는 절벽위 바위에서 내려다보면 발아래로 31번 국도가 실낱같이 내려다보이고 태백산에서 선달산으로 이어지는 백두대간이 하늘금을 그리며 소백산으로 달려나가는 모습이 장쾌하기 그지없다."
강원도 영월군 중동면 성황골길 127-33,,32,0.0,A01,A0101,A01010400,127824,12,20060509090000,http://tong.visitkorea.or.kr/cms/resource/36/657236_image2_1.jpg,http://tong.visitkorea.or.kr/cms/resource/36/657236_image3_1.jpg,128.632122539,37.1523632546,6,20220401133920,34385,8,,매봉산,26243.0," 노송과 숲이 어우러진 비경의 산, 매봉산   매봉산(1,268m)은 영월군의 동쪽방향에 자리하고  있는 상동읍과 중동면 사이에 솟은 산이다. 백두대간의 함백산(1,573m)에서 서쪽으로  갈라지는 능선상의 최고봉이다. 남쪽은 천혜의 절벽으로 이루어져 있고, 북쪽은 부드러운  사면으로 이루어진 산으로 기암절벽에 어우러진 노송과 울창한 숲을 간직한 비경의  산이다.  매봉산의 대표적 산행 코스   매봉산의 대표적인 산행코스는 내덕리 아시내마을을  기점으로 하는 코스이다. 아시내마을에서 멧둔골을 거치면 수렛길이 나타난다. 이  길을 따라 들어가면 산길 오른쪽으로 샘터와 제단이 나오는데, 이곳부터는 울퉁불퉁한  돌밭길로, 움막터 두 곳을 지나서 급경사길을 올라가면 북쪽으로 두위봉이 마주 보이는  주능선에 닿는다. 이곳에서 남서쪽으로 발길을 옮기면 급경사 능선을 오르게 되며,  능선의 끝이 정상이다.  정상에는 삼각점이 박혀 있다. 전망은 동쪽으로  백운산·구룡산·삼동산이 펼쳐지며, 남쪽으로는 옥동천 협곡이 내려다보이고,  목우산 줄기가 마주보인다. 또한 선달산에서부터 소백산으로 이어지는 백두대간이  시야에 들어온다. 서쪽 단풍산으로 이어지는 산릉은 온통 남쪽이 절벽을 이룬다."
강원도 정선군 신동읍 고림길,,32,0.0,A01,A0101,A01010400,127825,12,20060509090000,http://tong.visitkorea.or.kr/cms/resource/86/175586_image2_1.jpg,http://tong.visitkorea.or.kr/cms/resource/86/175586_image3_1.jpg,128.5854690604,37.2231097851,6,20210716015919,24219,8,,고고산,26136.0,"고고산은 영월군 중동면 연상리와 정선군 신동읍 고성리와 경계를 이루는 곳에 솟은 산으로 아름다운 미구(美九)마을을 품고 있다. 영월에서 석항방면 38번 국도를 따라가면 연하역을 못미쳐 철도밑으로 콘크리트 포장도로가 나오는데 이 길을 따라 다리를 건너면 복덕원 마을에 도착한다. 이 곳에서 골안으로 이어진 비포장 광산길을 따라 20여분 거리에 이르면 석회석 채광을 하였던 광산터에 도착한다.  광산터를 지나 작은 계곡 옆 북쪽으로 난 길을 따라 고도감을 높이면서 20여분 힘들 게 오르면 능선 안부에 이른다. 이 길을 넘어서면 길운 마을로 가는 길이고 좌측은 완택산으로 가는 등산로이다.  안부에서 동쪽 방면으로 난 길을 따라 작은 암봉을 올라서면 921봉이 뾰족하게 솟아 고고산으로 이어지는 주능선이 한 눈에 들어온다. 이 암봉에서 동쪽방면으로 내려서서 급경사길을 20여분 올라가면 동쪽사면이 절벽으로 이루어진 봉우리에 도착한다. 이 곳에서 좌측으로 암봉을 내려서서 절벽 밑을 우회하는 길을 따라 내려서면 입석같이 보이는 바위를 우회하여 조금은 힘들 게 20여분 올라서면 921봉에 도착한다.  921봉 동쪽으로 까마득한 절벽으로 이루어진 발아래 38번 국도와 연하천이 실날같이 내려 보인다. 921봉에서 북쪽방면으로 이어진 부드러운 능선길을 따라 30여분 가면 고고산 정상이다. 30여평 넓이의 헬기장으로 이루어진 정상은 사방나무가 가로막혀 조망이 좋지 않다. 하산길은 정상에서 동쪽 능선을 타고 잠시 벗어나면 암릉지대를 만난다.  이 암릉지대에서는 미구마을로 이어지는 능선에 헬기장이 내려보이고 목장의 초원지대로 이루어진 미구마을의 푸른 초원이 시야에 들어오고 , 멀리 고고산의 모산인 두위봉과 남쪽으로는 망경대산, 응봉산, 계족산으로 이루어지는 능선이 하늘금을 그리고 있다. 암릉지대를 벗어나 10여 분 내려서면 헬기장에 도착한다. 철쭉과 진달래나무가 군락을 이룬 능선을 따라 30여분 거리에 이르면 작은 돌탑이 서 있는 미구치에 당도한다. 미구치에서 남쪽으로 난 길로 내려서면 목장지대가 나타나고 수레길을 따라 20여분 내려서면 미구마을 계곡에 도착하고 , 이 길을 따라 30여 분 내려오면 38번 국도와 만나는 미구계곡 초입이다."
강원도 영월군 남면 국지골길,(남면) 일대,32,0.0,A01,A0101,A01010400,127826,12,20060509090000,http://tong.visitkorea.or.kr/cms/resource/67/1841567_image2_1.jpg,http://tong.visitkorea.or.kr/cms/resource/67/1841567_image3_1.jpg,128.4464006515,37.1401139206,6,20220721152646,20308,8,,국지산,26216.0," 산세가 부드러워 가족 산행으로 적합한, 국지산  국지산(626m)은 조선조 제6대 임금 단종의 유배지인  청령포 남쪽 약 5km에 솟은 산이다. 산세가 유순하고 부드러워 가족산행지로 최적의  코스이다. 정상에서의 조망은 참나무 숲에 가려 전망이 별로 좋지 않으므로 이전  망바위에서 조망을 감상하는 것이 좋다.   북으로는 영월읍을 감싸고 있는 봉래산과 계족산이  보이고, 그 사이로 완택산, 고고산 정상이 하늘금을 그리고, 계족산 오른쪽으로는  응봉산과 망경대산이 긴 능선을 그리며 이어지고 있다. 남동쪽 흥월리 건너 태화산의  모습이 병풍처럼 듬직하게 자리잡고 오른쪽 멀리 신선봉, 국망봉, 소백산으로 이어지는  소백산 주능선이 시야에 들어온다. 전망바위에서 정상에서 바라본 동남쪽 조망 50여미터  올라서면 삼각점이 있는 정상이다.    가족이 함께 가면 좋을 국지산의 추천 산행  산행의 시작은 흥월리 뒤뜰마을 상촌마을에서 시작한다.  상촌마을 계곡을 따라 500m정도 들어서면 남쪽 지능선 사면을 따라 10여분 올라서면  순천 박씨 지묘란 비석이 서있는 무덤이 있는 능선에 올라선다. 무덤 뒤 뚜렷한  능선길을 따라 약 30여분 거리에서 왼쪽 급사면으로 이어진 길을 따라 5분여 거리에  이르면 태화산으로 이어지는 능선상의 문고개에 도착한다. 문고개에서 북쪽으로 이어진  능선길을 따라 10여분 거리에 이르면 쓰러진 송전탑이 나타난다. 송전탑에서 가파른  능선길을 따라 20분 가까이 올라서면 전망대이다."
강원도 영월군 김삿갓면 영월동로 1547,,32,0.0,A01,A0101,A01010400,127827,12,20060509090000,http://tong.visitkorea.or.kr/cms/resource/44/1841544_image2_1.jpg,http://tong.visitkorea.or.kr/cms/resource/44/1841544_image3_1.jpg,128.5611214679,37.1218515249,6,20220708172210,20012,8,,덕가산,26245.0," 계곡과 폭포가 산행의 고단함을 덜어주는 산,  덕가산  덕가산(832m)은 영월군 하동면 예밀리에서 올려다보면  절리가 옥동천에 깍여서 수 십길 단애를 이루고 있는 산이다. 옥동리에서 올려다보면  병풍을 친듯한 절벽이 그림 같고 정상의 조망이 매우 뛰어난 산이다.    덕가산 산행시 볼거리, 얼쿠리 계곡과 폭포  고씨동굴을 지나 옥동천을 거슬러 이어지는 수로길을  따라 5분여 거리에 이르면 수로길은 끝나고 비탈면 숲속을 횡단하는 숲길이 강변을  따라 이어딘다. 급경사 너덜지대 세 곳을 지나 20여 분 거리에 이르면 좌측 얼쿠리  계곡 초입에 도착한다. 계곡길을 따라 67분 거리에 높이 5미터 정도의 폭포 2개가 연이어지는 2단폭에 도착하고 우측으로 난 길을 따라 5분 여 거리에 이르면 높이 10여 미터의 폭포가 나타난다. 폭포 앞에서 계곡을 건너 좌측 급경사 바위길을 따라 오르면  폭포 상단부에 도착하고 계곡 옆을 난 길을 따라 10여 분 거리에 이르면 높이 20여 미터쯤  되는 얼쿠리 폭포에 도착한다."
강원도 영월군 영월읍 보덕사길 15-2,,32,0.0,A01,A0101,A01010400,127828,12,20060509090000,http://tong.visitkorea.or.kr/cms/resource/64/1841564_image2_1.jpg,http://tong.visitkorea.or.kr/cms/resource/64/1841564_image3_1.jpg,128.455462063,37.1965353777,6,20210824195516,19423,8,1577-0545,발산,26225.0," 영월읍의 진산, 발산  발산(667m)은 영월읍의 진산이다. 영월읍에서 북쪽방향으로  올려다보면 산의 모양이 삼각형처럼 생겨 일명 삼각산이라고도 불린다. 주위에는  장릉, 영모전, 보덕사, 금몽암 등 많은 유적을 품에 안고 있으며, 정상의 조망이  매우 뛰어나 해발은 낮지만 알찬 산행의 묘미를 느낄 수 있다.   발산 산행은 단종을 추모하기 위해 세운 사당인  영모전에서 시작한다. 사당 좌측으로 난 길을 따라 5분여 이르면 작은 안부에 도착한다.  안부에서 북쪽으로 난 길을 따라 200여 미터쯤 오르면 평탄한 길이 나오고, 길은  능선 동쪽 사면으로 나 있다. 평탄한 사면길을 10여분 가면 사면길은 끝나고 길이  가팔라지고 바위지대가 나타난다. 이 바위지대 오름길은 군데군데 바위턱을 넘어서야  하는 구간이 나오지만 보조로프가 매어져 있어 쉽게 오를 수 있다. 바위지대 시작점에서  20여분을 오르면 영월읍 주민들의 텔리비젼 시청을 위한 시설물이 나오고, 이 곳에서  좌측으로 10여 미터 오르면 정상이다. 정상에서의 조망은 시원하다.   발산의 볼거리, 단종을 초모하는 곳 영모전  영모전은 단종(재위 14521455)의 영정을 모신 곳이다.  유배된 단종이 살해되자, 그를 추모하기 위해 군민의 성금을 모아서 1517년(중종  12) 영월부사 이용하(李龍夏)가 그의 영정과 위패를 모시려고 성황당이 있던 자리에  사당을 건립하였으며, 이용하의 후손 이계진이 개수하여 영모전이라는 현판을  걸었다."
강원도 영월군 무릉도원면 법흥리,,32,0.0,A01,A0101,A01010400,128798,12,20060222090000,http://tong.visitkorea.or.kr/cms/resource/90/182590_image2_1.jpg,http://tong.visitkorea.or.kr/cms/resource/90/182590_image3_1.jpg,128.2645935065,37.3708894546,6,20220624110500,19772,8,,사자산,26201.0," 네 가지의 재보가 있는 산, 사자산  사자산은 강원도 영월군 수주면과 횡성군 안흥면이  경계를 이루고 있는 높이 1,181m의 산이다. 지능인 연화봉 석굴에 많이 있었다는  꿀과 먹을 수 있는 흙인 전단포, 칠기의 도장 재료인 옻나무와 산삼 등 네 가지 재보가  많이 나기 때문에 일명 사재산(四財山)이라고 불리었다 한다. 일설에는 금. 은. 동이  많이 채굴되어 그렇게 부른다고도 한다.   절골을 사이에 두고 백덕산(1,350m)과 마주한 사자산은  남쪽 능선 끝자락으로 그림처럼 수려한 구봉대산(870m)을 위시해 곳곳에 기암과 폭포를  가지고 있으며, 골이 깊어 많은 수량과 청정함을 유지하고 있으며 5대 적멸보궁 중의  하나인 법흥사가 자리하고 있다. 사찰로 들어가는 오솔길의 소나무 숲이 장관으로  특히 겨울이면 눈이 많이 내려 산을 찾는 사람들에게 즐거움을 주는 산이다.    사자산의 볼거리, 법흥사  법흥사는 부처님의 진신사리를 봉안한 5대 보궁  중의 하나로 유명하다. 신라 진덕왕 647년경 자장율사에 의해 창건되었고 사자산사라  명칭되었으나, 1939년 중 수불사시 사자산적멸보궁이라 개칭하였다. 법흥사는 신라시대  자장율사가 부처의 진신사리를 봉안하고 창건한 흥녕사이다.   당시 징효대사는 당나라에서 문수보살의 진신사리  100과를 얻어다가 양산 통도사, 오대산 상원사, 설악산 봉정암 정선 정암사 등에  나누어 봉안하고, 이곳에 적멸보궁형 법당을 세웠다. 때문에 적멸보궁 안에는 부처의  삼존불이 없고 뒤쪽으로 뻥뚫린 창만 하나 나 있다. 이것은 산 전체가 부처의 몸이라고  전하는 법흥사 적멸보궁의 뜻이라 한다.   법흥사는 한때 2천여 명의 수도승이 운집하기도  했던 큰 가람이었으나 수차례의 화재로 인해 절간을 모두 소실하고 현재는 적멸보궁과  심우장 , 요사채, 징효대사보인탑비, 자장율사가 수도하던 토굴이 남아있다. 법흥사에서  적멸보궁으로 이어지는 소나무 숲길은 국내에서 손꼽히는 경승지 중 하나다."
강원도 영월군 수주면,(수주면),32,0.0,A01,A0101,A01010900,128754,12,20060124090000,http://tong.visitkorea.or.kr/cms/resource/04/181604_image2_1.jpg,http://tong.visitkorea.or.kr/cms/resource/04/181604_image3_1.jpg,128.2591872834,37.3159345825,6,20220324152111,46417,8,,법흥계곡,26201.0,"영월 서강의 상류이며 남한강 발원지로 이루어진 수주면의 여러 계곡은 태고의 신비를 그대로 간직하고 있으며 맑은 물에만 서식하고 있는 가재, 도롱뇽, 쉬리, 황쏘가리, 자라등 희귀 토종 어종과 멸종위기 동물로 보호받고 있는 수달이 서식하고 있는 곳으로 반드시 보호되어야 하는 천혜의 자연보고이다. 사자산(1,120m)에서 발원해 법흥사 앞을 거쳐 주천강으로 흘러드는 계곡으로, 사암봉·사자산·백덕산(1,350m) 등 해발 1,000m 이상의 고봉에서 흐르는 맑은 물이 모인 탓에 옆새우·열목어 등 1급수에서만 볼 수 있는 물고기들이 자란다. 상류는 경사가 급해 물살이 빠르다."
강원도 영월군 주천면 밧도내길 11-34,(주천면),32,0.0,A02,A0203,A02030100,128299,12,20050309090000,http://tong.visitkorea.or.kr/cms/resource/23/2494523_image2_1.jpg,http://tong.visitkorea.or.kr/cms/resource/23/2494523_image2_1.jpg,128.2351013099,37.2905398365,6,20220805132901,19287,8,,밧도내마을 [녹색관광마을],26204.0,"밧도내란 바깥으로 물이 도는 냇가의 마을이란 뜻이다.  횡성군 태기산 자락에서 발원, 안흥면과 강림면을 거친 주천강은 영월군 수주면과 주천면에 이르러 곳곳에 물도리동을 만들며서 강으로 흘러간다. 도천리를 지날 즈음 강의 이름은 잠시 서만이강으로 변모한다. 서만이강은 여름철이면 강수욕을 즐기기에 좋은 피서지 구실을 한다. 1급수가 흐르며 치악산국립공원 동쪽에 들어선 마을이니 풍치가 좋고 인심 또한 후하다.  밧도내마을에서는 계절별로 농작물 재배 및 채취체험, 짚풀공예 등을 실시하고 있다. 이 중에서도 특히 인기를 끄는 것은 메밀가루를 이용, 꼴뚜국수를 직접 만들어 먹어보는 행사이다. 주민들은 먹을거리가 궁핍하던 시절, 끼니 때마다 메밀국수를 먹었고 나중에는 꼴도 보기 싫어 '꼴뚜국수'라 이름지었다고 한다."
