addr1,addr2,areacode,booktour,cat1,cat2,cat3,contentid,contenttypeid,createdtime,firstimage,firstimage2,mapx,mapy,mlevel,modifiedtime,readcount,sigungucode,tel,title,zipcode,overview
강원도 삼척시 근덕면,,32,0.0,A01,A0101,A01010500,127381,12,20060406090000,http://tong.visitkorea.or.kr/cms/resource/59/1999059_image2_1.jpg,http://tong.visitkorea.or.kr/cms/resource/59/1999059_image3_1.jpg,129.2069746424,37.4026816736,6,20220311141243,31621,4,,맹방 벚꽃길,25932,"삼척시 맹방해수욕장 부근의 7번 국도 도로변에 벚나무 가로수가 있어 해마다 4월이면 하얀 벚꽃이 흐드러지게 피어나는 모습을 볼 수 있다. 벚꽃길은 삼척시 남쪽의 한치재를 넘어 근덕면으로 들어선 후 한치밑 마을에서부터 맹방해수욕장 입구를 지나 교가리 삼척전자공업고등학교에 이르기까지 약 4km 구간에 걸쳐 형성되어 있다.  이곳의 벚나무는 수령이 20년 정도를 조금 지난 청년기 나무들로 밑동이 그다지 굵은 편은 아니지만 일직선 상으로 쭉 뻗은 가로변에서 자라고 있어 지나는 행렬에게 환상의 벚꽃터널을 만들어준다.
이곳의 벚꽃은 대략 매년 4월 15일을 전후로 해서 활짝 핀다. 그러나 바닷가와 근접해 있어 심하게 폭풍우가 한바탕 지나가면 단 한번의 꽃비를 길 위에 뿌리고서는 가지만 남겨놓아 만발한 꽃송이를 감상할 수 있는 기간이 짧다는게 단점이다. 벚꽃 가로수길에서 바닷가로 조금만 나가면 수심이 얕고 모래가 고와 명사십리라는 별칭이 붙은 맹방해수욕장 해변이다. 삼척시에서는 벚꽃 가로수길과 맹방해변, 사랑의 설화가 담긴 해신당, 동양 최대의 석회동굴인 환선굴 내부의 ""사랑의 맹세 구역"", 정라진 해안도로 등을 묶어 ""연인들의 테마기행 코스"" 로 소개하고 있다.
 개화시기  매년 4월 중순
 맹방벚꽃길  근덕면 상맹방리(한재밑)교가리(약4㎞)
 맹방유채밭  근덕면 상맹방리(벚꽃길 옆, 약 16,529m²)"
강원도 삼척시 도계읍 문의재로 77-162,,32,0.0,A01,A0101,A01010800,125670,12,20060405090000,,,129.0476928999,37.1796236553,6,20220516130732,30591,4,,삼척 미인폭포,25952,"미인폭포는 태백시 통리와 신리의 중간지점인 도계읍 심포리 남쪽산 계곡에 있는데 심포리 우보산 계곡에서 발원하는 하천수가 흘러 절벽에 부딪치는 물방울이 적은 것은 분수와 같고, 큰 것은 설산을 연상케하는 폭포이다. 미인폭포 동북편 고원지대 및 폭포 위의 계곡에 고금을 통하여 미인 출생지역으로 전해오고 있다. 이 근처에는 미인묘가 있는데, 이 묘는 옛날 한 미인이 출가하였으나 남편이 일찍 사망하여 재가했는데, 또 다시 사망하니 그 미인은 이 폭포에서 투신자살하였다고 한다. 일설에는 남편이 죽은 후 재혼할 낭군을 찾았지만 사별한 남편 만한 사람을 찾을 수 없게 되자 자신의 신세를 비관하여 이 폭포에서 투신 자살한 일이 있었기에 미인폭포라는 이름을 갖게 되었다고도 한다. 한국판 그랜드캐년이라 불리는 미인폭포 주변의 협곡은 중생대 백악기에 퇴적된  역암층으로 신생대 초의 심한 단층 작용 속에서 강물에 침식돼 270m 깊이로 패여 내려갔다. 협곡의 전체적인 색조가 붉은색을 띠는데, 이것은 퇴적암들이 강물 속에 쌓이는 것이 아니라 건조한 기후조건으로 공기 중에서 노출된 채 산화되었기 때문이다.  주로 굵은 자갈로 된 역암과 모래로 이루어진 사암, 진흙으로 굳은 이암으로 구성되어 있다. 해발 700m 안팎의 고산지대에 위치하고 있어 안개나 구름이 끼는 날이 많으며 이때 경치가 더욱 아름답고 신비하다. 전설에 의하면, 일몰 전과 일출 전에 이 폭포에서 따뜻한 바람이 불면 풍년이요, 찬바람이 불면 흉년을 예측했다고 한다. 국토교통부의 지역개발사업 공모에 선정되어, 국비 20억원을 포함 총 42억원을 투입하여 2020년까지 탐방시설과 특화체험 시설, 주민광장 등을 갖춘다. 1.14km 데크 산책로와, 유리전망대, 유리잔도 등을 개발하며, 주민광장에는 나들장터, 푸드트럭 등 지역 특산물을 판매할 참여시설이 들어선다."
강원도 삼척시 근덕면 장호리,,32,0.0,A01,A0101,A01011200,125711,12,20060405090000,http://tong.visitkorea.or.kr/cms/resource/61/2642261_image2_1.jpg,http://tong.visitkorea.or.kr/cms/resource/61/2642261_image3_1.jpg,129.3139909058,37.2855472343,6,20221206232630,43869,4,,"장호해수욕장(장호항, 장호해변)",25938,"삼척시청에서 남쪽으로 25km 떨어진 곳에 있다. 넓은 백사장과 수심 1m 안팎, 경사도 10도의 반달형 해안을 가진 아담한 해수욕장으로, 파도가 잔잔하며 지형상 천연 바람막이가 있어 낚시터로도 안성맞춤인 곳이다. 근처 장호항에서 나오는 싱싱한 생선을 저렴한 가격으로 즐길 수 있다. 또한 주차장, 야영장, 화장실, 샤워장 등 편의시설이 비교적 잘 갖추어져 있으며, 2004년부터는 장호어촌체험마을로 지정 운영되어 각종 체험 등을 즐길 수 있다."
강원도 삼척시 미로면 준경길 333-360,(미로면),32,0.0,A02,A0201,A02010700,125778,12,20060405090000,http://tong.visitkorea.or.kr/cms/resource/93/1729093_image2_1.jpg,http://tong.visitkorea.or.kr/cms/resource/93/1729093_image3_1.jpg,129.0593194998,37.3670717786,6,20220902154513,22352,4,,삼척 준경묘,25905,"활기리 능곡에 있으며, 조선 왕조의 태동을 예언한 백우금관의 전설(백마리 소 대신 흰소와 금관 대신 보리짚으로 관을 만들어 사용)이 있는 조선 태조 이성계의  5대조 양무장군의 묘로서, 1899년에 영경묘와 같이 묘소를 수축, 비각과 목조대왕  구거지 비각을 건축하였다. 특히 이 일대는 울창한 송림과 원시림으로 산림욕이 적당하며 인근에 관광농원이 있다. 전주이씨 실존묘로서 남한에서는 최고의 시조묘이며 매년 4월 20일 전주이씨 대종 종약원 주관으로 제향을 올린다."
강원도 삼척시 신기면 환선로 800,,32,0.0,A01,A0101,A01011900,126729,12,20060405090000,http://tong.visitkorea.or.kr/cms/resource/60/2665260_image2_1.jpg,http://tong.visitkorea.or.kr/cms/resource/60/2665260_image3_1.jpg,129.0212519227,37.3264090504,6,20220506155622,250248,4,,환선굴 (대이리 동굴지대),25942,"환선굴은 약 5억 3천만년 전에 생성된 석회암 동굴로, 동양최대의 크기이다. 동굴내부에는 미인상, 거북이, 항아리 등 여러 모양의 종류석, 석순, 석주가 웅장하게 잘 발달되어 있다. 환선굴에서 발견된 동물은 모두 47종이며, 이 중에서 환선장님좀딱정벌레 등 4종이 환선굴에서만 발견되거나 환선굴이 모식산지로 기록되어 있다. 2010년 4월부터 환선굴 모노레일 운행을 시작하여 좀 더 쉽게 환선굴을 관람할 수 있게 되었다."
강원도 삼척시 근덕면 공양왕길 43-21,,32,0.0,A02,A0201,A02010700,127505,12,20060329090000,http://tong.visitkorea.or.kr/cms/resource/27/185827_image2_1.jpg,http://tong.visitkorea.or.kr/cms/resource/27/185827_image3_1.jpg,129.2663883549,37.3260583142,6,20221201113739,22153,4,,삼척공양왕릉,25937,"삼척시 근덕면 궁촌리 추천 고돌재에 있는 고분 3기, 삼척에서 남으로 약 40리 가면 동막리를 지나 ""사래재""라는 나즈막한 고개를 넘어 가면서 바다쪽을 건너다 보면 큰 소나무가 외로이 서 있고, 그 곳에 석축굽을 돌린 큰 무덤과 그 옆과 앞에 작은 무덤이 2기가 보인다. 이 고분들은 고려의 마지막 임금인 공양왕(恭讓王) 3부자의 능이라고 전해지고 있다. 삼척 공양왕릉(恭讓王陵)은 고려왕조의 마지막 임금인 공양왕(제34대, 재위기간 13891392)의 능묘이다.  공양왕은 왕조의 몰락과 함께 폐위되어 왕자 석(奭), 우(瑀)와 함께 원주와 간성을 거쳐 삼척에서 조선조 태조 3년(1394)에 교살되었다고 전한다. 왕릉은 오랜 세월이 흐르는 사이 현종 3년(1837)  정유년 가을에 삼척 부사 이규현이 개축하였으며 오늘에 이르기까지 한 많은 사연을 가슴에 품은 채 그저 천추의 한을 품고 침묵을 지키고 있다. 이 묘소는 1942년 면장 김기덕과 이 지방인사들이 다시 개축하고 1977년6월 면장 최문갑이 봉축하였다.  현재 우리 나라에는 공양왕릉이 두 군데 있는데 이 곳 궁촌리와 경기도 고양시 원당동에 남아있다. 경기도에 있는 공양왕릉은 문헌에 기록되어 있으나 이 곳 삼척의 공양왕릉은 민간에 오랫동안 구전되어 왔다.현재 강원도 기념물로 지정된 공양왕릉은 가장 규모가 크고 그 옆은 왕자 나머지는 시 녀 또는 왕이 타던 말무덤이라고 전한다. 이 곳 왕릉은 조선조 헌종 3년(1837)에 삼척부사(三陟府使) 이규헌(李奎憲)이 개축을 했으며 이후에도 여러 차례 보수를 하였다. lt;태조실록gt;과 lt;양촌집gt; 등에는 조선조 태조 4년(1395)에 고려 왕조의 왕씨를 위해  삼척, 강화, 거제에서 수륙제를 지내게 했다는 기록이 전하고 있다. 이 곳의 지명 유래에 따르면 궁촌은  임금이 유배된 속이라 하고 마을 뒷길  고돌산에 공양왕이 살해되었다는 살해재가 있다. 또한 공양왕의 맏아들 왕석이 살았다는  궁터, 말을 매던 마리방이라는 지명도 전한다.  궁촌리에서는 3년마다 해신제를 지내기 전에 반드시 왕릉에 와서 제사를 추모하고 있다."
강원도 삼척시 근덕면 궁촌해변길 65,,32,0.0,A01,A0101,A01011200,126649,12,20060324090000,http://tong.visitkorea.or.kr/cms/resource/29/185829_image2_1.jpg,http://tong.visitkorea.or.kr/cms/resource/29/185829_image3_1.jpg,129.2671938924,37.3243001987,6,20220826132823,40399,4,,궁촌해변(궁촌해수욕장),25937,"삼척에서 남쪽방향인 울진 방향 국도를 따라 가다보면 약 15km 지점에 무한히 펼쳐지는 해안의 백사장과 송림이 보이는데 이 곳이 바로 궁촌해변이다. 고개 밑 궁촌 다리 앞에서 하차하여 해안 쪽으로 200m 정도를 걸어 들어가면 천혜의 자연경관을 자랑하는 해수욕장에 진입할 수 있으며, 교통 편의를 위해 해수욕장내의 백사장까지 차량이 들어갈 수 있도록 하고 있다. 특히 해수와 민물이 교차하는 지점으로 가족이 함께 즐기기에 더없이 좋은 곳이다. 수심이 얕고 바닷물이 깨끗한 궁촌해수욕장은 여름피서객에게는 아직 잘 알려지지 않은 청정해수욕장이다."
강원도 삼척시 근덕면 장호항길 62,,32,0.0,A02,A0203,A02030100,128604,12,20050926090000,,,129.3182738399,37.286097255,6,20220224173406,37875,4,,장호어촌체험마을,25938,지도를 펼쳐보면 토끼등처럼 생긴 곳에 위치한 장호항. 해돋이가 일품인 곳으로도 이름난 장호항은 해안 절개지 바다가 어우러져 수려한 자연 경관과 화려한 해안선을 보유하고 있다. 특히 장호항은 2001년도 해양수산부가 지정한 '어촌체험관광마을'로 지정되어 다양한 어촌 체험을 할 수 있고 청정해역에서 갓잡은 싱싱한 횟감을 즐길 수도 있다.
강원도 삼척시 도계읍 문의재로 1113,,32,0.0,A02,A0203,A02030100,128295,12,20050309090000,http://tong.visitkorea.or.kr/cms/resource/68/2026468_image2_1.jpg,http://tong.visitkorea.or.kr/cms/resource/68/2026468_image3_1.jpg,129.1293965923,37.1837942045,6,20221114162410,29446,4,,삼척 너와마을,25952,"'너와'란 소나무나 참나무를 두께 45cm, 가로 2030cm, 세로 4060cm정도로 자른 널빤지를 말하고 너와집이란 이 너와를 지붕에 얹은 집이다. 강원도에서는 느에집 또는 능에집 이라고도 한다. 신리마을에 가면 점차 사라져가는 이 너와집을 만나볼 수 있다. 황토너와집 펜션에서의 숙박, 마을 부녀회가 운영하는 식당에서의 산촌 먹을거리맛보기 등은 웰빙여행의 대표적 사례이다. 산촌칼국수, 산촌 된장찌개, 칡전병, 송이백숙 등의 별미도 맛보고 떡만들기, 순두부만들기 등도 체험해 볼 수 있다. 계절에 따라 다양한 체험이 준비되어 있는데 가을에 신리 너와마을에 가면 너와집을 지어보는 체험, 송이채취 등 가족단위 산촌체험을 즐길 수 있으며, 겨울철에 가면 눈 덮인 골짜기에서 눈발구타기, 굴피집 추억만들기, 등잔불켜고 밤보내기 등 겨울 산골마을의 정취를 한껏 느낄 수 있다."
강원도 삼척시 하장면 두타로,,32,0.0,A01,A0101,A01010400,125597,12,20040226090000,http://tong.visitkorea.or.kr/cms/resource/86/217586_image2_1.jpg,http://tong.visitkorea.or.kr/cms/resource/86/217586_image3_1.jpg,129.0218137134,37.3936041065,6,20221115132836,47871,4,,두타산,25901,"높이 1357.0m의 두타산은 태백산맥의 주봉을 이루며, 쉰움정, 용소 및 주목군, 철쭉군, 잣나무군, 가을단풍 등이 유명하며 제왕운기를 저술한 이승휴의 유허지인 천은사가 산자락에 위치하고 있고 빼어난 산세와 그 속에 잠재되어 있는 문화유적 및 희귀 동식물들이 비경으로 감추어져 오고 있어 해마다 많은 등산객들이 찾고 있다. 두타산은 바람의 산이라 할 만큼 바람이 모질게 부는 곳으로, 산 이름인 두타는 불교용어로서 속세의 번뇌를 버리고 불도(弗道)수행을 닦는다는 뜻이다.

 두타산성
동북쪽 산허리 험준한 곳에 둘레 8607척의 석성이 있어, 이것을 두타산성이라고 한다."
강원도 삼척시 가곡면 덕풍길 44,,32,0.0,A01,A0101,A01010900,125641,12,20040226090000,http://tong.visitkorea.or.kr/cms/resource/87/1425587_image2_1.jpg,http://tong.visitkorea.or.kr/cms/resource/87/1425587_image3_1.jpg,129.1583542077,37.1222684932,6,20210721011551,97937,4,,덕풍계곡,25955,"자연경관이 수려하고 마을과 멀리 떨어져 있어 조용하며 경관이 뛰어난 여러 개의 폭포가 산재해 있다. 병풍처럼 둘러싸인 산세가 수려하여, 등산을 겸한 가족 단위 피서지로 적합한 곳이다. 진입로인 풍곡1리까지는 416번 지방도를 이용할 수 있다. 계곡 입구에서 계곡 안까지는 약 8㎞정도 된다. 덕풍마을은 총11가구로 이루어진 작은 부락으로  아직까지  나무를 땔감으로 사용하는 오지마을이다. 마을 앞에 흐르는 덕풍 계곡의  맑은 냇물에는  물고기가 떼지어  다니고 마을 사람들의 후한 인심은  찾는이들에게 좋은 추억거리를 제공한다. 덕풍계곡과 용소골은 도전하는 젊음을 위한 트래킹 코스로서 더할 나위 없이 좋은 곳이다.    의상대사와 나무비둘기 설화 전하는 말에 의하면 신라 진덕왕 때 의상대사가 이곳에 와서 나무로 만든 비둘기 3수를 날린 즉,  1수는 울진 불영사에 떨어지고 1수는 안동 흥제암에 날아가고 1수는 이곳 덕풍용소에 떨어졌는데,  그로 하여금 용소골일대는 천지의 대변혁이 일어나 오늘과 같은 아름다운 산수의 조화를 이룩했다고 한다."
강원도 삼척시 새천년도로 16,"(정상동, 정라동주민센터) 부근",32,0.0,A01,A0101,A01010400,125598,12,20040224090000,http://tong.visitkorea.or.kr/cms/resource/37/1813537_image2_1.jpg,http://tong.visitkorea.or.kr/cms/resource/37/1813537_image3_1.jpg,129.1844784185,37.4356552156,6,20220914104122,24630,4,,육향산,25925,"삼척시의 동쪽인 정상동에 위치하고 있으며, 옛날에는 죽관도라 했고, 지금은 육향대라고도 한다. 조선시대 삼척포진이 있었고 현재는 산 정상에 척주동해비(일명 퇴조비)와 평수토찬비 (강원도 유형문화재 제 38호 1971년 12월 16일 지정), 그리고 육향정이 있다. 이 비들은 조선 현종 2년(1661)에 삼척부사 허목이 세운 것이다.   허목(15951682년)  허목선생은 퇴계 이황 선생의 성리학을 물려받아 근기의 실학발전에 가교적 역할을 한 분으로 효종의 초상에 대한 모후의 복상기간이 논의되자 서인 송시열 등의 기년설을 반대하여 남인 선두에서 삼년설을 주장하다가 삼척부사로 좌천되었다. 당시 삼척은 해파가 심하여 조수가 읍내까지 올라오고, 홍수 때는 오십천이 범람하여 주민의 피해가 극심하였다.  이를 안타깝게 여긴 허목은 신비한 뜻이 담긴 동해송을 지어 독창적인 고전자체로 써서 정라진 앞의 만리도에 척주 동해비를 세우니 바다가 조용해 졌다. 그 후 비가 파손되어 조수가 다시 일자 숙종 36년(1710) 이를 모사하여 현재의 정상동 육향산에 세워 조수를 막았다 한다.  문장이 신비하여 퇴조비라 하는 이비는 전서체에서 동방제일의 필치라 일컬어지는 허목의 기묘한 서체로도 유명하다.   척주동해비와 조금 떨어져 있는 평수토찬비는 척주동해비와 같이 세운 것으로 비문은 중국 형산의 우제가 썼다는 전자비에서 48자를 선택하여 목판에 새기어,  군청에 보관하던 것을 고종 광무 8년(1904)에 칙사 강흥대와 삼척군수 정운석 등이 석각하여 세운 것이다."
강원도 삼척시 근덕면 내평길,,32,0.0,A01,A0101,A01010900,125639,12,20040224090000,http://tong.visitkorea.or.kr/cms/resource/34/1581534_image2_1.jpg,http://tong.visitkorea.or.kr/cms/resource/34/1581534_image3_1.jpg,129.2144540958,37.3263461536,6,20221201135133,41385,4,033-572-2011,내평계곡,25936,"마읍천의 맑고 풍부한 수량의 계곡을 중심으로 자연경관이 빼어난 크고 작은 산들이 동서로 줄기차게 뻗어 있고 곳곳에 기암괴석이 산재하고 있어 장관을 이룬다.
맹방해수욕장과 덕산해수욕장이 인접하고 있다. 신라시대에 창건된 사찰인 신흥사는 영화 '봄날은 간다' 촬영지로 사찰 규모에 비해 영화 배경지 관광을 나선 이들에게 인기를 끄는 장소가 됐다.
산과 계곡, 그리고 동해를 동시에 즐길 수 있으며,  국도 및 지방도로변에 위치하고 있어 교통이  편리하다."
강원도 삼척시 가곡면 가곡천로,,32,0.0,A01,A0101,A01010900,125640,12,20040224090000,http://tong.visitkorea.or.kr/cms/resource/58/1955358_image2_1.jpg,http://tong.visitkorea.or.kr/cms/resource/58/1955358_image3_1.jpg,129.1290670175,37.1523839142,6,20221202173822,36325,4,,동활계곡,25953,"도계읍 육백산 매방골에서 발원되는 맑고 깨끗한 물이 도계읍 마을을 지나 가곡천에 이르는 계곡이다.  산세가 빼어나고 물이 맑아 산천어 등 천연기념물을 비롯한 담수어종이 많이 살며 특히 가을철 단풍 절경을 자동차로 드라이브하며 볼 수 있는 천혜의 자연 경관을 지닌 계곡이다. 

7개의 동활교 가운데 기암괴석과 수려한 산봉우리로 둘러싸인 동활2교∼4교 사이의 경관이 가장 빼어나며 상류에는 너와집 등의 민속유물이 남아있는 신리민속마을이 있고 하류 부근에는 마을의 수호목인 황금소나무가 있다."
강원도 삼척시 미로면 동안로 816,(미로면),32,0.0,A02,A0201,A02010800,125753,12,20040224090000,http://tong.visitkorea.or.kr/cms/resource/11/1434211_image2_1.jpg,http://tong.visitkorea.or.kr/cms/resource/11/1434211_image3_1.jpg,129.0423936468,37.4445347532,6,20220322164421,27350,4,,천은사(삼척),25903,"천은사는 이승휴가 한민족의 대서사시인 제왕운기를 저술한 곳이다. 창건역사는 경덕왕 17년(738년) 인도에서 두타의 세 신선이 흰 연꽃을 가지고 와서 창건했다는 백련대까지 거슬러 올라간다. 그 뒤 흥덕왕 4년(829년)에 범일국사가 극락보전을 건립함으로써  사찰의 면모를 갖추기 시작했다. 고려 충렬왕 때 이승휴가 중수하고 이 곳에서 대장을 다 읽었다는 뜻에서 간장이라 하였고 조선 선조 때 청허 서산대사가 절을 중건하고 흑악사라 하였다. 다시 1899년 이성계 4대조의 묘인 목조릉을 미로면 활기리에 만들면서,  이 절을 원당사찰로 삼고 임금의 은혜를 입었다' 하여 천은사라 불렀다. 한국전쟁 때  큰 불을 만나 완전 폐허가 되다시피 하였는데 1983년 문일봉 스님이 중건하였다.  잔 자갈이 밟히는 오솔길을 따라 경내로 들어서게 되며 오솔길 양쪽으로 서 있는 벚꽃나무들은 봄이면 엷은 분홍색 꽃을 흐드러지게 피운다."
강원도 삼척시 근덕면 양리길 220,,32,0.0,A02,A0201,A02010800,125754,12,20040224090000,http://tong.visitkorea.or.kr/cms/resource/73/186073_image2_1.jpg,http://tong.visitkorea.or.kr/cms/resource/73/186073_image3_1.jpg,129.204977253,37.3234601892,6,20220520134357,25662,4,,신흥사(삼척),25936,"삼척시 근덕면 동막6리(양리)에 있다. 신라 민애왕 원년(838년)에 범일국사가 지흥사라 하여 북평읍 지흥리(현 동해시 소재)에서 창건했다. 현종 15년(1674년) 현 위치로 이전하여 광운사라 하였고 후에 다시 운흥사로 고쳐 불렀는데 영조 46년(1770년) 화재를 당하고, 다음 해인 영조 47년(1771년) 영담노사가 중건했다. 순조 21년 (1821년) 부사 이헌규가 많은 재원을 지원해 주고 신흥사라 개명했다. 그후 철종 14년(1863년) 7월에 중수하고 이부사의 은덕을 기리기 위하여 은중각이라 하는 생사당을 지어 일년에 한번씩 제사하였다. 또 이 절 주위에는 청련암과 반야암이 있었다."
강원도 삼척시 향교길 34,(교동),32,0.0,A02,A0201,A02010700,125797,12,20040224090000,http://tong.visitkorea.or.kr/cms/resource/86/185986_image2_1.jpg,http://tong.visitkorea.or.kr/cms/resource/86/185986_image3_1.jpg,129.1675489311,37.4501809896,6,20221111165848,24079,4,,삼척향교,25915,"1398년(태조 7) 현유(賢儒)의 위패를 봉안하고 지방민의 교육과 교화를 위해 창건되었다. 1407년(태종 7) 옥서동 월계곡(月桂谷)으로 이건하였다가 1468년(세조 14) 현재의 위치로 이건하였다. 현존하는 건물로는 정면 5칸, 측면 2칸의 맞배지붕으로 된 대성전, 정면 7칸, 측면 1칸의 명륜당을 비롯하여 동재(東齋)·서재(西齋)·동무(東廡)·서무(西廡)·숙청재(肅淸齋)·장경실(藏經室)·신삼문(神三門)·직청(直廳)·동서협문·제기고(祭器庫) 등이 있으며, 향교 밖에는 홍살문과 비군(碑群)이 있다. 대성전에는 5성(五聖), 10철(十哲), 송조6현(宋朝六賢), 우리 나라 18현(十八賢)의 위패가 봉안되어 있다. 조선시대는 국가로부터 토지와 전적·노비 등을 지급받아 교관이 교생을 가르쳤으나, 갑오개혁 이후 신학제 실시에 따라 교육적 기능은 없어졌다. 대신 봄·가을에 석전(釋奠)을 봉행(奉行)하며 초하루·보름에 분향을 하고 있다. 이 향교는 강원도 유형문화재 제102호로 지정되어 있으며, 현재 전교(典校) 1명과 장의(掌議) 두어 명이 운영을 담당하고 있다."
강원도 삼척시 근덕면 금계리,산 380번지,32,0.0,A01,A0101,A01011900,126639,12,20040224090000,,,129.1888407468,37.383366874,6,20220627165917,35383,4,,삼척초당굴,25932,"이 동굴은 총연장 700m로 추정되는 수직동굴로서 풍촌 석회암층에 형성된 동양 최대 규모의 동굴로 많은 지하수가 소한천 입구로 흘러 나온다. 이 동굴의 특징은 3층 동굴로서 하층이 가장 길며, 큰 광장이 여러 곳에 형성되어 있고, 동굴 바닥 곳곳에 연못이 있으며 피압수가 마치 분수대 모양으로 여기저기서 솟아 올라 아름다운 광경을 자아낸다. 동굴 내부에는 대규모의 종유석상이 발달되어 있어 장관을 이룬다. 이곳에는 물김, 좀딱정벌레, 장님굴새우, 화석곤충(일명 카르다층), 긴다리거미 등 희귀한 특수 생물이 서식하고 있으며, 국내 최초의 작은 석화가 발견되었던 곳이다.  특징국내 유일의 수중동굴과 자연동굴로 연장수직과 수평의 기복이 반복되는 다층적 수직동굴많은 양의 지하수를 배출하며 소한샘굴과 연결다양한 종류의 동굴생성물이 성장"
강원도 삼척시 미로면,,32,0.0,A02,A0201,A02010700,127733,12,20040224090000,http://tong.visitkorea.or.kr/cms/resource/10/1147410_image2_1.jpg,http://tong.visitkorea.or.kr/cms/resource/10/1147410_image3_1.jpg,129.077381136,37.3878808462,6,20220714151501,22057,4,,삼척 영경묘,25905,"이 곳은 조선 태조의 5대조모이며 목조의 어머니가되는 이씨의 묘이다. 고종 광무 3년(1899)에 태조의 5대조 묘인 준경묘와 함께  묘소를 수축하고 제각과 비각을 지었다. 이 일대는 울창한 송림이 있어 경관이 수려하며, 매년 4월 20일에 전주이씨 문중에서 제례를 올리고 있다. 이 곳에서 4km 떨어진 활기리에 준경묘가 있다."
