addr1,addr2,areacode,booktour,cat1,cat2,cat3,contentid,contenttypeid,createdtime,firstimage,firstimage2,mapx,mapy,mlevel,modifiedtime,readcount,sigungucode,tel,title,zipcode,overview
강원도 영월군 김삿갓면 영월동로 1117,,32,0.0,A01,A0101,A01011900,125724,12,20060509090000,http://tong.visitkorea.or.kr/cms/resource/85/483785_image2_1.jpg,http://tong.visitkorea.or.kr/cms/resource/85/483785_image3_1.jpg,128.5353790658,37.1307444591,6,20220519192601,94277,8,,고씨굴 (강원고생대 국가지질공원),26245.0,"고씨굴은 1969년 6월 4일에 천연기념물로 지정되어 국가로부터 보호를 받고 있는 학술적, 자연유산적 가치가 뛰어난 동굴이며, 1974년 5월 15일에 일반인들에게 공개되었다. 고씨굴은 여러 층으로 이루어진 다층 구조를 보이며 제일 아래층에는 지하수가 작은 하천처럼 흐른다. 주굴은 대부분 석회암 내에 발달한 절리면(석회암이 힘을 받아 깨진 부분)을 따라 형성되었으며, 가지굴은 층리면(퇴적암에 나타나는 편평한 면)을 따라 발달한다. 고씨굴 내에는 종유관, 종유석, 석순, 석주, 동굴산호, 유석, 커튼, 곡석 등이 다양한 동굴생성물이 자라며, 비공개 구간에서 자라는 흑색을 띄는 동굴생성물은 고씨굴만의 자랑이다.출처 : 강원고생대 국가지질공원"
강원도 영월군 엄둔길 38,,32,0.0,A01,A0101,A01010400,126601,12,20060509090000,http://tong.visitkorea.or.kr/cms/resource/91/175591_image2_1.jpg,http://tong.visitkorea.or.kr/cms/resource/91/175591_image2_1.jpg,128.2361869928,37.3017746722,6,20220530102707,38075,8,,구봉대산,26201.0," 각각의 봉우리에 불교의 이름이 있는 산, 구봉대산   구봉대산(870m)은 영월군 수주면 법흥리 사자산  법흥사 적멸보궁의 천하복지 명당터를 보호하는 우백호의 역할을 하는 산으로 아홉  개의 봉우리로 이루어져 있어, 구봉대산이라는 이름을 얻게 되었다. 백덕산사자산  능선의 연장선상에 있는 지능선으로 법흥리의 적멸보궁과 법흥사를 싸안으며 계속  뻗어나가 한 줄기는 주천강을 향해 가고 한 줄기는 법흥리의 버스 주차장 남쪽으로  뻗어 있다.   구봉산은 각 봉우리마다 사람이 태어나서 죽을 때까지의  과정을 봉우리 명칭으로 사용하여 이색적인 감흥을 주고 있다.   인간은 태어나 유년과  청년, 중년, 노년의 단계를 거쳐 죽어서 다시 태어나는 불교의 윤회설에 따라 9개의  봉우리마다 심오한 인생의 뜻을 담아놓은 주능선은 기암과 노송의 군락이 어우러져  동양화의 화폭에 들어와 있는 착각을 일으킬 정도로 아름다운 산이다.   산행은 클라이밍이 필요한 봉우리도 있어 모두 오르기는  어렵다. 위험한 코스일 경우 길이 바위 아래로 나 있어 별 어려움은 없다. 코스를  따라 쉽게 올라갈 수 있는 암봉들은 테라스 형이고 연화봉·백덕산 쪽은 단애를  이루고 있어 전망이 좋다.   불교의 윤회설에 따른 봉우리 이름   구봉산은 불교의 윤회설에 따라 봉우리의 이름을  지었다. 제1봉은 양이봉이다. 양이봉은 인간이 어머님 뱃속에 잉태함을 나타낸다.  제2봉 아이봉은 인간이 세상에 태어남을 나타내며, 제3봉 장생봉은 인간이  유년, 청년기를 지나는 과정을 의미한다. 제4봉 관대봉은 인간이 벼슬길에 나아감을  의미하며, 제5봉 대왕봉은 인간이 인생의 절정을 이룬 뜻을 의미한다. 제6봉  관망봉은 지친 몸을 쉬어감을 의미하며, 제7봉 쇠봉은 인간의 병들고 늙음을  의미하며, 제8봉 북망봉은 인간이 이승을 떠남을 의미한다. 마지막으로 제9봉은  윤회봉으로 인간으로 다시 태어난다는 불교의 윤회설에 근거를 둔 것이다."
강원도 영월군 영월읍 정양리 451,,32,0.0,A01,A0101,A01010400,126710,12,20060509090000,http://tong.visitkorea.or.kr/cms/resource/06/1841606_image2_1.jpg,http://tong.visitkorea.or.kr/cms/resource/06/1841606_image3_1.jpg,128.4969260372,37.1618151571,6,20210714224244,36915,8,,계족산(영월),26231.0,"계족산은 영월읍 동쪽에 병풍을 친 듯 화성(火星)의 모습으로 수석처럼 우뚝 솟은 산이다. 백두대간 함백산에서 서쪽으로 가지를 친 한개의 능선이 두위봉, 망경대산, 응봉산을 거쳐 남한강에 막혀 더 이상 뻗지 못하고 지맥을 다하여 험준한 산세를 이루고 있으며, 산자락에는 고구려의 산성인 왕검성과 정조대왕태실비 등의 유적이 있으며, 영월화력발전처가 자리하고 있다.   영월읍에서 88번 지방도를 따라 승용차로 20분 거리인 정양리에 도착하면 영월화력발전처가 있으며 발전소 담장이 끝나는 곳에 계족산 산행 안내도가 서 있고, 주차장이 마련되어 있다. 콘크리트로 포장된 길을 따라 30m 정도 북쪽으로 걸어가면 정양마을이 나타나고, 가래골 골짜기 위로 계족산 정상부근이 한 눈에 들어오고 산새를 가늠하기 쉽다.  정양마을을 뒤로 하고 가래골 계곡 좌측으로 난 오솔길을 따라 10여분 걸어가면 우측 아래로 10m 가량의 폭포가 나타난다. 폭포를 내려다보며 산길을 올라 15m 폭포 상단부에서 다시 왼쪽 계류를 건너게 된다. 고르지 못한 바위사면길을 밟으며 56분 정도 오르면 우측계곡에 2개의 폭포와 탕이 시야에 들어온다. 이곳의 폭포는 평소에 수량이 적은 것이 흠이다. 그러나 장마철에는 굉장한 볼거리를 제공한다. 폭포와 탕을 뒤로하고 15m 정도 오르면 폐허된 묵밭이 나오고 집터가 나타난다. 집터샘에서 식수를 준비하고 10여 분 오르면 계족산 서남릉묘지가 있는 안부에 닿는다."
강원도 영월군 영월읍 동강로 826,"(영월읍, 동강래프팅) 일대",32,0.0,A01,A0101,A01011800,126807,12,20060509090000,http://tong.visitkorea.or.kr/cms/resource/55/765455_image2_1.jpg,http://tong.visitkorea.or.kr/cms/resource/55/765455_image3_1.jpg,128.5128232453,37.2079990332,6,20211113011403,55260,8,,동강(영월),26223.0," 영월의 대표적인 자연관광지, 동강(영월)   동강은 남한강 수계에 속하며 정선, 평창 일대 깊은  골짜기를 흘러내린 물들이 정선읍내에 이르면 조양강이라 부르고, 이 조양강에 동남천  물줄기가 합해지는 정선읍 남쪽 가수리부터 영월에 이르기까지의 51km 구간을 '동강'이라  부른다. 산자락을 굽이굽이 헤집고 흘러내리는 동강은 마치 뱀이 기어가는 듯한 사행천(巳行川)을  이루고 있으며, 전 구간에 걸쳐 깎아지른 듯한 절벽지형을 이루고 있다.  유역은 4억 5000만 년 전에 융기되어 형성된 석회암층  지역으로, 약 2억 년 전에 단층운동과 습곡운동의 영향으로 현재의 지형이 형성되었고,  현재도 하천운동으로 인한 퇴적작용과 침식작용 등이 계속 진행되고 있다.  또 동강  유역에는 지표운동과 지하수·석회수의 용식작용 등으로 인해 많은 동굴이  형성되었는데, 2002년 현재까지 보고된 동굴만도 256개나 된다. 그 가운데 백룡동굴(白龍洞窟)은  천연기념물로 지정되어 있다.  생태계 역시 잘 보존되어 수달, 어름치·쉬리·버들치,  원앙·황조롱이·솔부엉이·소쩍새·비오리·흰꼬리독수리,  총채날개나방(미기록종)·노란누에나방, 동강할미꽃(미기록종)·백부자·꼬리겨우살이  등 미기록종을 포함해 많은 천연기념물·희귀동식물이 서식하는 생태계의 보고로  알려져 있다.   동강의 생태계를 한 눈에 볼 수 있는 곳, 동강의 생태 박물관   산림청 임업연구원들이 독자적으로 수행한 조사에는  식물의 경우 신품종 후보종 1종 뻐꾹채 와 백부자, 꼬리겨우살이  등 희귀식물 6종의 서식이 확인됐으며 포유류는 총 8종 가운데 천연기념물인 수달의  서식이 확인됐다. 조류 분야에서는 천연기념물인 원앙, 소쩍새, 까막딱따구리  의 서식지와 희귀조인 비오리도 확인됐다. 산림곤충으로는 미기록종인 총채날개나방과  노란누에나방 등 희귀종 2종이 확인됐다. 산림경관으로는 석회암 붉은벽과 흰사구  등이 발달했으며 그 중 어라연 지역이 대표적으로 평가됐다.   동강의 백미, 어라연   동강의 백미인 어라연은 뛰어난 경치로 인해 다음과  같은 전설이 전해진다. 어린 나이에 죽은 단종의 혼령이 영월에서 경치가 가장 뛰어난  이곳의 경치를 보고 여기서 신선처럼 살고자 하였는데 이때 물고기들이 줄을 지어  반겼으며 그 일대가 마치 고기비늘로 덮힌 연못과 같았다고 '어라연'이란 지명을  붙였다고 한다. 약 1km에 걸친 협곡을 따라 흐르는 동강의 중앙부에 3,000여 평의  바위섬이 위치한 어라연은 돌로 된 바위 위에 분재와 같은 소나무와 물에 잠긴 너럭바위에서  반사되는 햇살, 병풍 같은 절벽이 세상의 시름을 잊게 한다. 가끔 이곳을 찾는 외국인들은  한국의 그랜드 캐넌으로 중국의 계림에 버금가는 명승지다 라고 말하기도 한다."
강원도 영월군 김삿갓로 216-22 난고김삿삿문학원,,32,0.0,A02,A0201,A02010700,126886,12,20060509090000,http://tong.visitkorea.or.kr/cms/resource/87/2026087_image2_1.jpg,http://tong.visitkorea.or.kr/cms/resource/87/2026087_image3_1.jpg,128.6017551925,37.0795432684,6,20220506165140,30942,8,,난고 김삿갓 유적지,26246.0,"김삿갓 유적지는 강원도 영월군 하동면 와석리 노루목에 있으며, 이곳은 차령산맥과 소백산맥 준령의 북단과 남단에 위치하며, 경북 영주시와 충북 단양군과 경계를 이루는 3도 접경지역으로 산맥의 형상이 노루가 엎드려 있는 듯한 모습이라 하여 노루목이라 불려오고 있다. 또한 김삿갓 유적지내에 흐르는 '곡동천'은 여름철에는 유리알처럼 맑고 풍부한 수량이 기암괴석 사이로 넘치고 가을에는 형언각색 단풍으로 인하여 보는 이의 가슴을 평온하게 만들어 주는 신비로운 곳이다.이처럼 산자수려한 고산준령 풍운 속에 청운의 푸른 꿈을 접고 해학과 재치와 풍류로 한 세상을 살다간 조선 후기 방랑시인이자 천재시인인 김삿갓의 체취를 느낄 수 있는 난고 김병연 묘소와 주거지가 있다. 난고 김병연 선생은 원래 전라도 동복(지금의 전라도 화순군)에서 돌아가셨지만 아버지를 찾아 전국을 떠돌던 둘째 아들 익균이 주거지인 하동면 노루목 바로 이 곳 골짜기에 묻어 주었으며, 그의 묘소는 1982년 영월의 향토사학자 정암 박영국선생의 노력으로 처음으로 발견되었다.
김삿갓의 시대정신과 문화예술 魂을 추모하고 문화적 가치를 재조명 하고, 산자수명(山紫水明)한 김삿갓 계곡을 자연문화의 중심지, 문예인의 순례지, 김삿갓의 향기를 느낄 수 있는 우리나라의 대표하는 시선(時仙)으로 승화시켜 문화관광자원을 널리 알리기 위해 지난 98년도부터 매년 10월초에는 ""난고 김삿갓문화큰잔치""가 개최된다. 또한, 강원도 시책사업인 『강원의 얼 선양사업이 2001년부터 2003년까지 추진되어 유적지내 조경 및 도로포장 등 기반시설이 조성되어 쾌적한 관광지로 탈바꿈 하였으며 특히, 2003년 10월 lt;난고 김삿갓 문학관gt;이 개관되어 선생의 문학세계를 한 곳에 연구적으로 전시해 관광객들에게 교육 효과를 거양하고 있다.
김삿갓유적지내에는 소박한 서민들의 애환과 재미있는 풍자와 기교가 물씬 풍기는 조선시대 민화 500여점이 전시되어 있는 「 조선민화박물관 」과 전통 한국화가인 묵산 임상빈씨의 작품활동 공간이 동시에 150여점의 한국화와 주변 풍경을 담아 낸 수묵화가 전시되어 있는「 묵산미술관 」이 있어 가족단위 여행에 적합한 지역이며, 계곡의 맑은 물과 아기자기한 폭포수와 함께 백두대간을 등산할 수 있는 마대산(해발 1,052m)과 곰봉(해발930.3m) 등산로가 잘 정비되어 있어 등산동호인들에게 인기가 있다.

 우리나라 최고의 풍류시인 김삿갓에 대하여 
김삿갓의 본명은 병연(炳淵), 호는 난고(蘭皐)이다. 1807년(순조7년)3월 13일 경기도 양주군 회동면에서 출생한 김삿갓은 6세 때 조부 김익순이 선천부사로 있다가 홍경래 난을 진압하지 못하고 오히려 투항한 것과 관련하여 폐족을 당한 후 황해도 곡산, 경기도 가평, 광주, 강원도 평창등을 전전하다 영월 삼옥리(三玉里)에 정착하여 화전을 일구며 살게 되었다.조부의 행적을 모르고 자랐던 선생은 20세 때 영월동헌에서 열리는 백일장에서 홍경래난 때, 순절한 가산 군수 정공의 충절을 찬양하고, 항복한 김익순을 규탄하라.(論鄭嘉山忠節死 嘆金益淳罪通于天)는 시험 제목의 향시(鄕試)에서 장원을 했다. 이 소식을 들은 어머니로부터 김익순이 조부라는 것을 알게 되자 조상을 욕되게 하여 하늘을 쳐다 볼 수 없다고 삿갓을 쓰고 방랑생활을 하며 벼슬길을 포기하였다. 그후 김삿갓은 57세로 객사할 때까지 전국 각지를 떠돌아 다니면서 방랑 걸식하였다. 지친 몸으로 말년에 들른 곳이 전라남도 화순군 동복면 구암리였는데, 그곳 명소 ""적벽(赤璧)""에 매료되어 다른 곳으로 가지 않고 이 곳에서 생을 마감하였다. 훗날 그의 차남이 영월 고향 땅으로 이장하여 이곳 김삿갓묘에 안치하였다. "
강원도 영월군 김삿갓면 와석리,,32,0.0,A01,A0101,A01010900,126894,12,20060509090000,http://tong.visitkorea.or.kr/cms/resource/09/2675209_image2_1.JPG,http://tong.visitkorea.or.kr/cms/resource/09/2675209_image2_1.JPG,128.6085978126,37.1205109135,6,20220516132130,78019,8,,김삿갓 계곡,26246.0,"김삿갓 묘가 위치하여 유명해진 인근 계곡이다. 김삿갓과 관련된 유적은 강원도 남부와 충청북도 경계지대에 분산되어 있는데 남대천 (南大川)을 사이에 두고 북쪽 영월군 하동면 어둔리 선래골 (선락동)에는 집터가 있고, 근처 와석리 노루목에는 묘소가 있다. 그리고 냇물 건너 단양군 영춘면 접경에는 기념시비가 세워졌다. 최근 김삿갓에 대한 문학적, 역사적 관심이 높아지면서 이 지역을 찾는 등산객, 답사 여행객이 증가하여 대야리  인근 마대산(해발1,052m, 강원도,충북, 경북 3도의 접경을 이루는 산)  김삿갓생가터  김삿갓묘역을 연결하는 등산로가 개발되고 있으며, 곰봉 (곰의 모양을 한 봉우리)도 탐방이 잦아지고 있다. 와석리는 10여 가구가 살고 있는 조촐한 오지 마을로서 옛 시골의 정취를 간직하고 있는 마을이다.

김삿갓 계곡은 김삿갓이 생전에 ""무릉계""라 칭했을 만큼 빼어난 경치를 지녔다. 관광지로 지정되지 않았지만 오염이 안되고 보존이 잘 되어 청정지대임을 자랑한다. 인근 내리계곡의 크낙새와 법흥사 적별보궁 오르는 길의 딱따구리, 그외 동강과 서강이 기암을 돌아 흐르는 곳에 사는 수달, 수리부엉이, 비오리, 검독수리, 작은소쩍새, 올빼미, 황조롱이, 오리떼 등은 이 지역이 과연 있는 
그대로의 생태박물관임을 입증한다. 영월군은 이 계곡과 내리계곡 등 인근의 계곡을 번갈아가며 휴식년제를 취하고 있으므로 확인 후 출발해야 한다.

 우리나라 최고의 풍류시인 김삿갓에 대하여 

김삿갓의 본명은 병연(炳淵), 호는 난고(蘭皐)이다. 1807년(순조7년)3월 13일 경기도 양주군 회동면에서 출생한 김삿갓은 6세 때 조부 김익순이 선천부사로 있다가 홍경래 난을 진압하지 못하고 오히려 투항한 것과 관련하여 폐족을 당한 후 황해도 곡산, 경기도 가평, 광주, 강원도 평창등을 전전하다 영월 삼옥리(三玉里)에 정착하여 화전을 일구며 살게 되었다.

조부의 행적을 모르고 자랐던 선생은 20세 때 영월동헌에서 열리는 백일장에서 홍경래난 때, 순절한 가산 군수 정공의 충절을 찬양하고, 항복한 김익순을 규탄하라.(論鄭嘉山忠節死 嘆金益淳罪通于天)는 시험 제목의 향시(鄕試)에서 장원을 했다. 이 소식을 들은 어머니로부터 김익순이 조부라는 것을 알게 되자 조상을 욕되게 하여 하늘을 쳐다 볼 수 없다고 삿갓을 쓰고 방랑생활을 하며 벼슬길을 포기하였다. 김삿갓은 57세로 객사할 때까지 전국 각지를 떠돌아 다니면서 방랑 걸식하였다. 지친 몸으로 말년에 들른 곳이 전라남도 화순군 동복면 구암리였는데, 그곳 명소 ""적벽(赤璧)""에 매료되어 다른 곳으로 가지 않고 이 곳에서 생을 마감하였다. 훗날 그의 차남이 영월 고향 땅으로 이장하여 이곳 김삿갓묘에 안치하였다."
강원도 영월군 김삿갓면,일대,32,0.0,A01,A0101,A01010400,127297,12,20060509090000,http://tong.visitkorea.or.kr/cms/resource/01/1841601_image2_1.jpg,http://tong.visitkorea.or.kr/cms/resource/01/1841601_image3_1.jpg,128.4794816062,37.1202418309,6,20221021093822,36711,8,영월군청 문화관광과 033-370-2542,태화산(강원),26245.0," 태화산성, 고씨동굴 등 볼거리가 많은 산, 태화산(강원) 태화산(1027.5m)은 영월군과 충북 단양군과의 경계를  이루는 안산으로, 남한강이 산자락을 휘감아 흐르고 4억 년의 신비를 간직한 고씨동굴(천연기념물)을 품에 안고 사계절 변화무쌍한 부드러운 능선길은 아름다운 비경을 보여주고 가족단위 산행지로 최적의 코스이다. 태화산의 추천 등산코스 태화산의 등반은 영월화력발전소 정문 앞에서 시작한다. 이곳에서 고씨굴 방면으로 100여 미터 정도 가면 태화산 등산로를 가리키는 표시판이  있다. 팔흥교를 건너 500미터에 있는 다리를 건너면 태화산 등산로 안내판이 있다. 이곳을 지나 계곡을 따라 1시간 여 올라서면 절터에 도착한다. 이곳이 태화산성인데  좌측으로 200여 미터 올라서면 태화산성 전망대이다. 우측 산사면을 가로지르는 길을  따라 20여 분 거리에 이르면 헬기장에 도착하고, 능선길을 따라 10여 분 거리에 이르면  첫 전망대에 도착한다. 계속 능선길을 따라 군데군데 나타나는 바위지대에서 조망을  감상하며 40여 분 걸으면 정상과 높이가 비슷한 봉우리에 이른다. 이곳에서 10여 분 정도 걸으면 34평 정도의 넓이의  정상에 도착한다."
강원도 영월군 상동읍 구래리 산 1-16,,32,0.0,A01,A0101,A01010400,127298,12,20060509090000,http://tong.visitkorea.or.kr/cms/resource/35/1955735_image2_1.jpg,http://tong.visitkorea.or.kr/cms/resource/35/1955735_image3_1.jpg,128.8408790975,37.1445070355,6,20220701154734,31945,8,,장산(영월),26248.0," 사계절 따라 묘미가 있는 곳, 장산 (강원)  장산(1408.8m)은 상동읍 구래리와 천평리 사이에  위치한 산이다. 백두대간 상의 함백산이 서쪽으로 가지를 쳐 웅장하게 솟구친 산으로  남쪽과 서쪽은 바위와 절벽지대로 이루어져 경관이 매우 수려하다. 또한 북쪽과 동쪽은  완사면으로 상동에서 태백 방면으로 가다 칠랑이골에서 좌측으로 쳐다보면 성벽처럼  위용을 자랑한다. 정상에 서면 강원도 일대 산군의 파노라마를 감상할 수 있다.    산행의 묘미가 있는 장산의 추천 산행  장산의 산행은 상동읍 고두암(일명:꼴두바위)에서  시작된다. 교촌마을에서 망경사 방면으로 가다보면 망경사에 도착할 수 있다. 여기에서  잠시 쉼을 하고 너덜지대 곁의 급경사길을 올라가면 주능선 서봉사이의 안부에 도착한다.  안부에서 동쪽 주능선 길을 따라 정상으로 향하다 보면 숲길인가 싶으면 바위지대가  나타나고, 바위지대는 좋은 전망대 역할을 하며 산행의 피로를 덜어준다.   주능선은 사계절 변화무쌍한 자연의 신비를 느끼기에  더 없이 좋다. 이른 봄이면 얼레지, 노루귀, 복수초,중의 무릇등 눈속에서 피어나는  야생화가 집단군락을 이루고, 여름에는 하늘을 가리는 짙은 녹음 , 가을에는 형형색색의  단풍과 마가목의 붉은 열매는 꽃처럼 아름다우며, 겨울에는 산호초 같은 설화가 절벽과  어우러져 선경의 세계에 들어 온 듯하다."
강원도 영월군 김삿갓면 김삿갓로 216-22,,32,0.0,A01,A0101,A01010400,127299,12,20060509090000,,,128.6017607474,37.0795432685,6,20220718094942,26541,8,,마대산,26246.0," 김삿갓의 자취를 느낄 수 있는 산, 마대산 (강원) 
 마대산 백두대간이 선달산을 거쳐 고치령과 마항치  사이에 형제봉을 일으키고 북쪽으로 가지를 쳐 옥동천과 남한강에 이르는 지맥에  솟아있다. 김삿갓유적지를 산자락에 품고 있는 1,052m의 정상에서 내려다보는 동강과  햇빛을 가리는 장목수림, 그리고 계곡 가을단풍으로 유명하다. 김삿갓의 자취를 느낄  수 있는 생가터, 묘역 등을 함께 볼 수 있으며, 선낙골 계곡의 가을 단풍이 매우  아름다운 산이다.

 마대산의 또다른 볼거리, 김삿갓유적지 
 김삿갓 유적지는 강원도 영월군 하동면 와석리 노루목에  위치하고 있으며, 이곳은 차령산맥과 소백산맥 준령의 북단과 남단에 위치하며, 경북 영주시와 충북 단양군과 경계를 이루는 3도 접경지역으로 산맥의 형상이 노루가 엎드려  있는 듯한 모습이라 하여 노루목이라 불려오고 있다. 또한 김삿갓 유적지내에 흐르는  '곡동천'은 여름철에는 유리알처럼 맑고 풍부한 수량이 기암괴석 사이로 넘치고 가을에는  형언각색 단풍으로 인하여 보는 이의 가슴을 평온하게 만들어 주는 신비로운 곳이다. 이처럼 산자수려한 고산준령 풍운 속에 청운의 푸른 꿈을 접고 해학과 재치와 풍류로 한 세상을 살다간 조선 후기 방랑시인이자 천재시인인 김삿갓의 체취를 느낄 수 있는 난고 김병연 묘소와 주거지가 있다."
강원도 영월군 영월읍 어라연길 4,,32,0.0,A01,A0101,A01010400,127300,12,20060509090000,http://tong.visitkorea.or.kr/cms/resource/19/1955719_image2_1.jpg,http://tong.visitkorea.or.kr/cms/resource/19/1955719_image3_1.jpg,128.5134806881,37.2360235974,6,20220617171121,32508,8,,잣봉(영월),26222.0," 동강과 어우러져 천혜의 비경을 보여주는 산,  잣봉 (강원)     lt;잣봉(537m)은 동강에서 가장 신비로운 경치를 자랑하는  어라연을 한눈에 감상할 수 있는 전망대 역할을 하는 산으로, 봄이면 진달래가 만발하고  절벽에 자라는 노송이 굽어지는 동강과 어울려 천혜의 비경을 보여주는 산으로 짧은  등산로와 동강변을 거니는 트레킹을 겸할 수 있어 가족단위 산행과 여름철 피서지로  각광을 받고 있는 산이다.    잣봉의 볼거리 동강 비경 중 으뜸, 어라연 일원  어라연 계곡은 동강의 많은 비경 중에서도 가장  잘 알려진 곳이다. 어라연은 고기가 비단결 같이 떠오르는 연못이라는 뜻을 가지고  있다. 영월 동쪽을 흐르는 동강 윗줄기 12km 쯤에 있는 어라연은 영월에서 가장 아름답고  신비로움에 감싸인 계곡이다. 거운리 나루터에서 강줄기를 따라 걷다 보면, 물줄기가  나누어지는 어라연이 나오는데, 양쪽 기슭의 천길 낭떠러지 사이로 뿌리를 내리고  있는 늙은 소나무들이 운치를 더해준다.  어라연은 일명 삼선암이라고도 하는데 옛날 선인들이  내려와 놀던 곳이라 하여 정자암이라 부르기도 하였다고 한다. 강의 상부, 중부,  하부에 3개의 소가 형성되어 있고 그 소의 중앙에 암반이 물속으로부터 솟아있고  옥순봉과 기암괴석들이 총총히 서 있는 모습이 마치 사람같기도 하고 또 불상같기도  하며 또 짐승같기도 하여 볼 때마다 그 모양이 새로움을 자아낸다."
