addr1,addr2,areacode,booktour,cat1,cat2,cat3,contentid,contenttypeid,createdtime,firstimage,firstimage2,mapx,mapy,mlevel,modifiedtime,readcount,sigungucode,tel,title,zipcode,overview
강원도 삼척시 도계읍 문의재로 1223-9,(도계읍),32,0.0,A02,A0201,A02010600,127732,12,20061108090000,http://tong.visitkorea.or.kr/cms/resource/68/2026468_image2_1.jpg,http://tong.visitkorea.or.kr/cms/resource/68/2026468_image3_1.jpg,129.1337572152,37.187060581,6,20220530142803,26087,4,,삼척 신리 너와집과 민속유물,25952,"강봉문·김진호·윤영원 씨의 소유였던 너와집과 이들 집에 딸린 민속유물들을 가리킨다. '너와집'이란 굵은 소나무를 알맞은 크기로 잘라 지붕을 얹은 집을 말한다. 1970년대초까지 여러 종류의 집들이 있었으나, 대부분 개조되어 현재 문화재로 지정된 집만 옛 모습을 간직하고 있다. 강봉문 씨 집은 남서향으로 그 동쪽에 디딜방앗간채가 자리잡고 있다. 지붕 위는 작은 삼각형모양 구멍을 내어(까치구멍) 집 안의 연기를 밖으로 뿜게 만들었다. 앞면 가운데 대문간이 있고 대문간 왼쪽에 외양간, 오른쪽에 앞으로 돌출된 부엌이 있다. 안쪽에는 오른쪽과 왼쪽에 각각 사랑방과 안방을 만들어 놓았으며 안방 구석에는 불을 피워 난방과 조명을 겸할 수 있는 시설(코클)을 해 놓았다. 김진호 씨 집은 서향으로 자리잡고 있다. 이 집 역시 지붕에 까치구멍을 뚫었고 앞면 왼쪽에 외양간, 오른쪽에 부엌을 놓았다. 대문을 들어서 안쪽 트인 공간 중심에 마루가 있는데 마루 왼쪽이 사랑방, 오른쪽 부엌과 접해 있는 방을 안방으로 배치하여 코클을 설치하였다. 한편 외양간의 부엌 사이 공간은 집안 일을 할 수 있도록 꾸몄으며 한쪽에 불씨를 보관하던 시설(화터)이 있다. 이외에 개인 또는 나라소유의 부속문화재가 딸려있는데, 물레방아를 비롯해 '통방아', '채독'(항아리처럼 싸리로 엮어 만든 저장용구), '김치통'(김치등을 담아두던 나무로 만든 통), '설피'(눈이 쌓였을 때 짚신위에 덧신어 다니기 편리하게 만든 살피), '창', '주루막'(새끼 따위로 촘촘히 엮어 멜끈을 달아 물건을 나르는데 씀) 등이 있다. 우리나라 강원도 지역의 너와집 유형과 발달과정을 연구하는데 귀중한 자료로 평가받고 있다."
강원도 동해시 삼화로 584,,32,0.0,A01,A0101,A01010400,127737,12,20061108090000,http://tong.visitkorea.or.kr/cms/resource/00/1425900_image2_1.jpg,http://tong.visitkorea.or.kr/cms/resource/00/1425900_image3_1.jpg,129.001569201,37.4551938419,6,20220928173824,24307,4,,쉰움산,25746,"쉰움산은 삼척시 동쪽 15km 지점의 전국적 명산인 두타산의 북동쪽 상에 솟은 작은 한 봉우리다. 이 산은 태백산과 마찬가지로 무속의 성지라 이를 만한 곳이다.  산 곳곳에 치성을 드리는 제단, 돌탑 등이 즐비하다. 어느 할머니가 이곳에 놀러왔다가 그만 신이 내려 무당이 되었다는 일화도 전한다.

쉰움산은 실은 산봉의 정상이 아니라 여기저기 수많은 웅덩이가 패인 암반지대다. 쉰움이란 지명은 이처럼 오십개의 움이 팼다는 뜻으로, 한자로는 오십정산이라고도 표기를 한다. 쉰움산에는 이승휴의 제왕운기가 쓰여진 역사깊은 사찰이 있는데 천은사가 그것이다. 역사적 의미가 소중하여 사적 441호로 지정되었으며,  주변의 두 아름도 넘는 노거목 숲의 풍치가 기막히다."
강원도 삼척시 원덕읍 삼척로 1852-6,,32,0.0,A02,A0202,A02020700,128633,12,20061108090000,,,129.3273124779,37.2680078425,6,20220527155458,71062,4,,삼척 해신당공원,25956,"동해안 유일의 남근숭배민속(男根崇拜民俗)이 전해 내려오는 해신당 공원에는 어촌민의 생활을 느낄 수 있는 어촌민속전시관, 해학적인 웃음을 자아내는 남근조각공원 등으로 구성되어 있다. 또한, 공원을 따라 펼쳐지는 소나무 산책로와 푸른 신남바다가 어우러져 스트레스 해소는 물론 웃음바이러스가 넘쳐나는 동해안 최대 명소로 떠오르고 있다. 
 애바위전설 옛날 신남마을에 결혼을 약속한 처녀, 총각이 살고 있었다. 어느 날 해초작업을 위해 총각은 해변에서 조금 떨어진 바위에 처녀를 태워주고 다시 돌아올 것을 약속하고 돌아간다. 그런데 갑자기 거센 파도와 심한 강풍이 불어 처녀는 바다에 빠져 죽고 만다. 이후 이 마을에는 처녀의 원혼 때문에 고기가 잡히지 않는다는 소문이 돌게 된다. 어느 날 한 어부가 고기가 잡히지 않자 바다를 향해 오줌을 쌌더니 풍어를 이루어 돌아온다. 이후 이 마을에서는 정월대보름이 되면 나무로 실물모양의 남근을 깎아 처녀의 원혼을 달래는 제사를 지내게 되었다. 지금도 이 마을에서는 매년 정월대보름(음력 1. 15), 음력 10월 첫 오일에 남근을 깎아 매달아 제사를 지내는 풍습이 전해지고 있다."
강원도 삼척시 죽서루길 37,(성내동),32,0.0,A02,A0201,A02010700,125799,12,20061024090000,http://tong.visitkorea.or.kr/cms/resource/73/2654473_image2_1.jpg,http://tong.visitkorea.or.kr/cms/resource/73/2654473_image3_1.jpg,129.1604665182,37.4408708123,6,20220511133146,44061,4,,삼척 죽서루,25917,"오십천 절벽 위에 자리한 죽서루(보물)는 우리나라 대표누각이다.조선태종 3년(1403)에 삼척부사 김효손이 옛 터에 중창하였으며, 이후 오늘에 이르기까지 수 십 차례에 걸쳐 중수되거나 단청되었으며 증축되었다. 죽서루는 그 하층이 17개의 기둥으로 구성되어 있는데 그 중 9개는 자연석에 세웠으며, 8개는 석초(石礎)위에 건립하였다는 건축사적 특징 및 아름다움이 있으며, 그 상층에는 20개의 기둥에 팔작지붕이다."
강원도 삼척시 근덕면 초곡길 176,,32,0.0,A02,A0202,A02020700,129204,12,20060817090000,http://tong.visitkorea.or.kr/cms/resource/82/2716682_image2_1.jpg,http://tong.visitkorea.or.kr/cms/resource/82/2716682_image3_1.jpg,129.29470307,37.3072804709,6,20211220190411,22720,4,,황영조 기념공원,25937,"제 25회 바르셀로나올림픽 마라톤 경기에서 우승한 삼척 출신의 황영조 선수의 인간승리의 과정과 우승의 감격을 기리고,  자라나는 청소년들에게 용기와 꿈을 심어주기 위하여 조성된 공원이다.   공원 11,650 ㎡  기념관 987㎡ (전시관  1층, 2층)  상징조형물  동상  외부시설  도종환 시비, 오륜화단, 문주익언덕"
강원도 삼척시 근덕면 용화리,,32,0.0,A01,A0101,A01011200,125709,12,20060629090000,http://tong.visitkorea.or.kr/cms/resource/19/1434019_image2_1.jpg,http://tong.visitkorea.or.kr/cms/resource/19/1434019_image3_1.jpg,129.3020251475,37.2907269603,6,20220805100441,51124,4,,용화해변,25938,"용화해변 옆으로는 용화천이 흐르고 뒤편으로는 송림이 우거져 있다. 또한, 반달형의 아름다운 해안선은 좌우에 펼쳐진 기암괴석과 함께 장관을 이루고 있다. 개장기간에는 주변에  각종 편의시설과 민박, 횟집들이 많이 모여있어 이용하기에 편리하다. 수심 11.5m, 백사장 길이 1km 정도로  규모는 작지만 사람들이 북적거리는 다른 해수욕장 대신 한적한 어촌을 즐기려는 사람들이 많이 찾는다. 해수욕장은 밀물과 썰물이 없고, 마을쪽으로 깊숙이 들어와 있어 파도도 높지않아 아이들이 뛰어놀기에 좋고 해변 가운데로 시냇물이 흐르고 있어  담수욕도 함께 즐길 수 있다."
강원도 삼척시 새천년도로 460,"(교동, 후진항) 일대",32,0.0,B02,B0201,B02011000,129038,12,20060622090000,http://tong.visitkorea.or.kr/cms/resource/59/1813659_image2_1.jpg,http://tong.visitkorea.or.kr/cms/resource/59/1813659_image3_1.jpg,129.1714370967,37.4623629966,6,20220624154537,22652,4,,후진마을,25909,"삼척시청에서 북쪽으로 약 1.5km 거리에 위치한 후진은 송림이 우거진 연장 1.2km 폭 100m의 백사장이 걸쳐 뻗어있는 관내 최대의 해수욕장이 있는 마을이다. 남쪽 방향으로는 새천년 해안유원지(도로)에 조각공원, 소망의 탑, 호텔 등 다양한 볼거리가 조성되어 관광객들이 줄을 잇고 있다. 주말이면 청량리에서 출발하는 환상의 해안선 기차여행의 종착지로도 유명하다."
강원도 삼척시 근덕면 용화해변길 23,"(근덕면, 해양레일바이크) 일대",32,0.0,B02,B0201,B02011000,129026,12,20060621090000,http://tong.visitkorea.or.kr/cms/resource/36/1813636_image2_1.jpg,http://tong.visitkorea.or.kr/cms/resource/36/1813636_image3_1.jpg,129.3046027265,37.2897076837,6,20220922142757,22089,4,,용화마을,25938,"7번 국도변, 삼척에서 남쪽으로 24km 지점의 용화마을은 반달형 모양의 긴 백사장을 자랑하는 동해에서 유명한 피서지이다. 좌우로 펼쳐진 기암괴석 또한 장관이다."
강원도 삼척시 새천년도로 326,(교동),32,0.0,A02,A0206,A02060300,129012,12,20060620090000,http://tong.visitkorea.or.kr/cms/resource/45/2716445_image2_1.jpg,http://tong.visitkorea.or.kr/cms/resource/45/2716445_image3_1.jpg,129.1858804219,37.4567250399,6,20220308141438,28735,4,,비치조각공원,25910,"비치조각공원은 새천년해안도로변의 주요 볼거리 중의 하나이다. 여름철은 물론 4계절 관광객이 찾아와 조각작품을 감상하면서 휴식 및 더위를 식히는 장소로 인기를 높다. 또한 여름철에는 공원내에 있는 야외무대에서 작은 음악회가 열리기도 한다, 특히 지하공간에 있는 ""카페 마린데크""는 바다와 가장 가까이에서 차나 음료를 마실 수 있는  가장 아름다운 데이트 장소로도 유명하다."
강원도 삼척시 근덕면 궁촌2길 58,,32,0.0,A01,A0102,A01020100,128962,12,20060516090000,http://tong.visitkorea.or.kr/cms/resource/35/186035_image2_1.jpg,http://tong.visitkorea.or.kr/cms/resource/35/186035_image3_1.jpg,129.2614641501,37.3144817703,6,20210826002702,22760,4,,삼척 궁촌리 음나무,25937,"두릅나무과에 딸린 낙엽활엽교목으로 우리나라를 비롯하여 중국 일본 등지에 널리 분포되었다. 지금까지 알려진 음나무로서는 우리나라 최대 거목으로서  수세가 왕성하고 위용있는 수형을 갖추고 있으며 현 생태상태도 우수하다. 
수령이 천년 이상으로 추정되는 이 나무는 수고20m, 흉고주위5.2m, 근원부 주위 6.5m, 수관폭 남북 20m 동서 15m이다. 또한 지표면으로부터 2.8m 높이에서 두 갈래로 갈라진 것이 특징이라 하겠다. 
마을에서는 이 나무를 해치면 피해를 입는다하여 신성시하고  신목으로 여겨 보호해 왔으며, 매년 정월에 제사를 지내고 단오 때에는 큭 굿을 올린다고 합니다. 또한 잎이 필 때 동쪽 가지에서 먼저 피면 영동지방이, 서쪽 가지에서  먼저 피면 영서지방이 풍년든다는 이야기가 전해오고 있다. 음나무 인근에는 소나무 고욤나무 뽕나무 향나무가 각각 한그루씩 자리잡고 있어 과거 주거지로 보이는데 마을 노인들의 의하면 음나무가 서 있는 곳이  고려 공양왕이 유배되어 은거하던 집뜰이었다고 한다.

 명칭  근덕면의 음나무 (近德面의음나무)
 분류  노거수
 수량  1주(324㎡)"
강원도 삼척시 미수2길 17,,32,0.0,A02,A0205,A02050200,128963,12,20060516090000,http://tong.visitkorea.or.kr/cms/resource/50/483250_image2_1.jpg,http://tong.visitkorea.or.kr/cms/resource/50/483250_image3_1.jpg,129.1820869505,37.4361523341,6,20221114160840,22438,4,,삼척 척주동해비 및 평수토찬비,25928," 척주동해비(陟州東海碑)   척주동해비 비문은 삼척 부사 허목이 지은 것으로 비의 규모는 높이 170cm,  높이 76cm, 두께 23cm이다. 현종 3년(1662)에 건립한 '척주동해비'는 일명 '퇴조비(退潮碑)'라 불리듯이 조류(潮流)의 피해를 막기 위해 건립되었으며, 당초에는 만리도에 건립되었다. 이후 숙종 34년(1708) 풍랑으로 비석이 부러져 바다에 잠겼던 것을 동왕 35년 부사 홍만기가 문을 본떠서 다시 새겼으며,  동왕 36년  삼척 부사 박내정이 죽관도 동쪽에 다시 건립하였다가 1969년 12월 6일 현재의 위치인 육향산 산정에 이건하였다. 현재 강원도 유형문화재로 지정되어 있으며, 비각의 전면에 ""척주동해 비각"" 제액과 후면에 ""동해비각"" 제액이 게판되어 있다. 평수토찬비 비문 역시 삼척 부사 허목이 짓고 쓴 것이다. 중국형산비(衡山碑)의 대우수전(大禹手篆) 77자 가운데 48자를 가려서 새긴 것으로, 임금의 은총과 수령으로서 자신의 치적을 기린 글이다. 현종 원년(1661) 목판에 새기어 읍사(邑司)에  보관되어 오다가 240여년 후인 광무 8년(1904) 칙사(勅使) 강홍대와 삼척군수 정운철 등이 왕명에 의해 석각하여 죽관도에 건립하였다. 비의 높이는 145cm, 폭72cm,두께 22cm이며, 비각의 전면에 ""우전각(禹篆閣)"" 제액이 게판되어 있다.   대한평수토찬비(平水土讚碑)   평수토찬비 비문 역시 삼척 부사 허목이 짓고 쓴 것이다. 중국 형산비(衡山碑)의 대우수전(大禹手篆) 77자 가운데 48자를 가려서 새긴 것으로,  임금의 은총과 수령으로서 자신의 치적을 기린 글이다.  현종 원년(1661) 목판에 새기어 읍사(邑司)에 보관되어 오다가 240여년 후인 광무 8년(1904) 칙사(勅使)  강홍대와 삼척군수 정운철 등이  왕명에 의해 석각하여 죽관도에 건립하였다. 비의 높이는 145cm, 폭 72cm, 두께 22cm이며, 비각의 전면에  ""우전각(禹篆閣)"" 제액이 게판되어 있다.  ▶ 명칭  삼척척주동해비및평수토찬비 (三陟陟州東海碑및平水土讚碑) ▶ 분류  석비 ▶ 수량  1기 ▶ 시대  조선시대 ▶ 소유자  국유"
강원도 삼척시 새천년도로 233,,32,0.0,A02,A0205,A02050200,128964,12,20060516090000,http://tong.visitkorea.or.kr/cms/resource/71/2716471_image2_1.jpg,http://tong.visitkorea.or.kr/cms/resource/71/2716471_image3_1.jpg,129.1889386764,37.4504008277,6,20220617152833,24112,4,,소망의탑,25910,"새천년의 소망을 담아 2000년 시에서 건립한 탑으로, 건립 후원자 33,000명의 이름이 각인되어 있으며 3단 타원형으로 구성되어 있다.  1단은 신혼부부의 소망석이며, 2단은 청소년, 3단은 어린이의 소망석으로 되어 있으며, 탑신은 소원을 비는 양손의 형태로 표현되어 있다. 또한 새로운 천년의 시작을 기념하는 타임캡슐을 탑 아래에 묻어 두었다."
강원도 삼척시 근덕면 장호항길 103,,32,0.0,A01,A0101,A01011400,128965,12,20060516090000,,,129.3176127341,37.2878414864,6,20221206225158,76454,4,,장호항,25938,삼척 시내와 가까운 거리에 위치한 장호항은 동그랗고 새하얀 해안선이 아름답다. 흰 모래사장과 기암괴석으로 둘러싸여 있어 장관을 이룬다. 장호해수욕장과 근접해 있어 아침에는 활처럼 둥글게 위어진 백사장 일출이 근사한 장호항을 관망하고 낮에는 장호해수욕장에서 해수욕을 즐길 수 있다. 한눈에 들어오는 아담한 백사장이 정겨우니 인근에 있는 대규모 해수욕장과는  사뭇 다른 한적함이 살아있는 별천지다.
강원도 삼척시 수로부인길 401,(증산동),32,0.0,A02,A0201,A02010700,128966,12,20060516090000,http://tong.visitkorea.or.kr/cms/resource/27/215527_image2_1.jpg,http://tong.visitkorea.or.kr/cms/resource/27/215527_image3_1.jpg,129.1628625232,37.473450441,6,20220419145044,31034,4,,해가사의 터(수로부인공원),25909,"해가사터인 임해정은 『삼국유사 수로부인전에서 전하는 해가라는 설화를 토대로 복원하였으며, 문헌상 정확한 위치를 알 수 없으나 삼척해수욕장의 북쪽 와우산 끝에 위치한 것으로 추정된다. 그러나 이곳은 현재 군사보호시설지구로 개발이 불가하여 주변경관이 수려한 인접지역인 증산동 해변에 조성되었다.  임해정 좌우로의 해변은 절경을 이루고 있으며 삼척시에서 바다를 끼고 있는 유일한 정자이다.『삼국유사 수로부인전에 전하는 해가라는 설화를 토대로 복원한 임해정과 해가사 기념비가 건립되어 있고  주변 주차장 확장, 주변경관 조성등을 통해 수로부인 공원이 조성되고 있다. 06년 4월  사랑의 여의주 드래곤볼이 이곳에 설치되어 찾는이의 소원과 연인들에게는 사랑을 기원하게 하고 있어 새로운 신개념 관광명소로 급부상되고 있다. 특히, 이곳에는 동해의 일출 명소인 추암해수욕장을  가장 아름답게 바라볼 수 있는 사진촬영지로 유명하기도 하며,  갈매기떼 어우러진 청정해안 절경,  상큼한 바다내음은 관광객들의 발길을 이곳에 머무르게 한다.    배경설화  신라 성덕왕 때 순정공(純貞公)이 강릉태수(江陵太守)로 부임하는 도중, 임해정(臨海亭)이라는 것에서 점심을 먹고 있었는데 갑자기 해룡(海龍)이 나타나  부인을 끌고  바다속으로 들어가자 남편인 순정공이 마을 사람들을 동원해 막대로 언덕을 치며 해가(海歌)라는 노래를 지어 부르니 용이 수로부인을 모시고 나타났다 한다.   해가(海歌)의 내용  龜乎龜乎出水路(구호구호출수로) 거북아, 거북아 수로를 내놓아라. 掠人婦女罪何極(약인부녀죄하극) 남의 아내 앗은 죄 그 얼마나 큰가 汝若悖逆不出獻(여약패역불출현) 네 만약 어기고 바치지 않으면,  入網捕掠燔之喫(입망포략번지끽) 그물로 잡아서 구워 먹으리라."
강원도 삼척시 증산동,,32,0.0,A01,A0101,A01011200,127727,12,20060510090000,,,129.1606210205,37.4746447041,6,20220623111744,30217,4,,증산해변(증산 해수욕장),25909,삼척시내에서 4km 가량의 근거리에 위치한 조용하고 아담한 곳으로 평균수심 1∼2m 정도로 남녀노소를 막론하고 안전하게 즐길 수 있다는 장점이 있다. 동해시 소재인 추암해변과 접경하여 추암 촛대바위 일출을 한 눈에 감상할 수 있어 이곳을 한 번 다녀간 사람은 꼭 다시 찾아온다는 정다운 곳으로서 가족단위 피서객에게 권할만 하다. 또한 겨울철이면 갈매기데와 어우러진 겨울바다의 낭만과 운치를 맘껏 즐길 수 있는 곳이기도 하다.
강원 삼척시 원덕읍,,32,0.0,A01,A0101,A01011200,127730,12,20060510090000,http://tong.visitkorea.or.kr/cms/resource/70/1581570_image2_1.jpg,http://tong.visitkorea.or.kr/cms/resource/70/1581570_image3_1.jpg,129.3269348035,37.2657303197,6,20220907103911,24956,4,,신남해변,"245-800,1","삼척에서 남쪽으로 30km 거리의 7번 국도에 접하여 있으며, 규모가 작고 아담하여  가족단위 피서에는 적격이다. 해신당공원(해신당, 어촌민속 전시관 및 공원산책로 등)이 조성되어 피서와 자연관광을 함께 만끽할 수 있는 관광지로 자리매김하였다. 특히, 해신당은 처녀총각의 애절한 사연과 함께 남근의 전설이 있는 고장으로 매년 관광객이 늘어나는 추세다."
강원도 삼척시 근덕면 맹방해변로 228-239,,32,0.0,A01,A0101,A01011200,127872,12,20060510090000,,,129.2320061341,37.3898030893,6,20221206233005,44537,4,,맹방해변,25932,"삼척시내에서 7km 가량의 거리에 있는 시범해수욕장이며 맹방 관광지내에 속한 지역으로서 기반도로 시설이 잘 정비되고 관광지 조성공사가 진행 중인 곳으로 이미 청정해변의 이미지가 전국에 잘 알려져 있다. 개장기간 중에는 명사십리 달리기대회를 비롯하여 맨손 송어잡기등 다양한 해변이벤트가 개최되어 피서객의 호응도를 높이는 한편, 인접지역의 골프연습장이 스포츠 산실 역할을 하고 있다."
강원도 삼척시 근덕면 궁촌길 1162,(근덕면),32,0.0,A02,A0201,A02010800,125755,12,20060504090000,http://tong.visitkorea.or.kr/cms/resource/96/1433996_image2_1.jpg,http://tong.visitkorea.or.kr/cms/resource/96/1433996_image3_1.jpg,129.2557211872,37.2828797335,6,20220519170350,19289,4,,영은사(삼척),25937,"『삼화사사적에 의하면, ""삼화사 숲속에 삼층보탑이 있는데 약사삼불인 백·중·계 삼형제가 서역에서 돌로 만든 배를 타고 유력하다가 동해안에 이르러 제일 맏이는 흑연화(黑蓮花)를 들고 지금의 삼화사로 오니 흑연대(黑蓮臺)라 하고, 둘째는 청연(靑蓮)을 들고 지금의 지상사(지향사)로 오니 청연대(靑蓮臺)라 하고, 막내는 금연(金蓮)을 들고 지금의 영은사로 오니 금연대(金蓮臺)라 하였다.""고 하는 창건 설화가 전한다. 그러나 역사적으로는 신라 진성여왕 5년(891), 혹은 892년에 범일 국사가 궁방산 아래 마전평에 절을 창건하여 궁방사(宮房寺)로 한 것을 영은사의 최초 창건으로 보고 있다. 명종 22년(1567)에 사명대사가 궁방사와 다소 거리가 있는 현위치에 절을 옮겨지어 운망사(雲望寺)라 하였다가 임진왜란으로 전소되자, 인조 19년(1641) 벽봉 스님이 중건하고 절 이름을 영은사로 바꾸었다. 그 후 순조 5년(1805) 봄에 화재로 인해 대웅보존을 비롯한 10여동의 건물이 전소되어 다음해에 당시 삼척 부사 심공저의 지원을 받아 중건하였다. 순조 10년(1810)에 학송스님이 석가여래삼존불을 봉안하였으며, 철종 6년(1855) 서암스님이 괘불을 조성하였다. 그 뒤 고종 1년(1864)에는 심검당을 지어 오늘에 이르고 있다. 현재의 영은사는 대웅보전을 위시하여 팔상전, 심검당과 설선당, 삼성각, 칠성각, 요사채 등의 건물들과 괘불, 부도 및 비 등의 많은 문화재가 남아 있으며, 산내 암자로는 대원암·삼성암 등이 있다.   대웅보전  강원도 유형문화재 제 76호(1982.11.3 지정)  이 건물은 정면 3칸, 측면 3칸 겹처마 맞배지붕으로 공포는 다포계 양식의 외 2출목, 내 3출목을 했음이 특이하다. 외부 전면의 살미는 쇠서형인데 비하여 후면은 운공형으로 초각되었고 내부 살미는 연봉형을 하였다. 건물의 기단은 지형에 따라 거칠게 가공을 한 화강석 기단인데 근래에 변형된 듯하며 그 위에 놓인 초석은 덤벙주초이고 기둥은 민흘림이다. 내부 바닥은 우물마루를 짜았고 가운데의 2개의 고주가 대들보를 받 치고 후불벽과 불단을 형성하였다. 천정은 가운데로 우물반자를 짜고 주위는 빗천정을 이루었다. 이 건물은 가구수법과 공포형식으로 보아 조선 말기의 것으로 보인다.   팔상전 강원도 유형문화재 제 77호(1982.11.3지정) 사기에 의하면 이 건물은 조선 인조 19년(1641년)에 세웠다 하나 건물의 짜임과 두공형식으로 보아 조선 후기의 형식을 보이고 있다. 자연초석 위에 정면 3칸 측면 2칸 맞배지붕의 간결한 건물이다. 지붕의 전면은 부연을 달고 후면은 부연없이 홑처마로 처리하였다. 연화촉각한 쇠서를 전면으로 돌출시킨 조선 후기 형식이다. 건물 내부에는 팔상위의 탱화를 모셨는데 그 제작년은 건륭 25년(1760년)으로 기록되어 있다."
강원도 삼척시 근덕면 초곡2길,,32,0.0,A01,A0101,A01011200,127729,12,20060407090000,http://tong.visitkorea.or.kr/cms/resource/04/1813604_image2_1.jpg,http://tong.visitkorea.or.kr/cms/resource/04/1813604_image3_1.jpg,129.2861481811,37.3104438286,6,20220907113828,24092,4,,초곡해수욕장,25937,"삼척에서 18km 지점에 위치한 곳으로 초곡항이 있어 항구의 정취가 있고, 조용한  어촌마을로서, 바르셀로나 올림픽 마라톤 영웅 황영조의 생가와 기념관이 자리한  곳으로 몬주익 언덕의 체험과 기념관을 함께 관람할 수 있고, 전형적인 민박마을이 해변에 접하여 있어 숙박의 편리함이 있는 곳이다. 이곳은 문암해변과 연계되어 개방되는 곳이다."
강원도 삼척시 테마타운길 76,(갈천동),32,1.0,A01,A0101,A01011200,125705,12,20060406090000,http://tong.visitkorea.or.kr/cms/resource/55/2716455_image2_1.jpg,http://tong.visitkorea.or.kr/cms/resource/55/2716455_image3_1.jpg,129.1683621836,37.4684816769,6,20220609135023,52976,4,,삼척해변,25909,"삼척해변은 연장 1.2km, 폭 100m의 넓은 백사장을 보유한 관내 최대의 해변이다. 울창한 송림, 깨끗한 백사장과 수심이 얕아서 남녀노소 모두가 수영을 즐길 수 있고, 각종 부대시설 및 편의시설이 비교적 잘 갖춰져 있다. 또한, 해수사우나 및 근린시설이 완비되어 있으며, 매년 50여만 명이 웅집하는 대규모 피서지로 "" 맨손넙치잡기대회"" 등 다양한 이벤트가 개최되어 관광객들로부터 많은 인기를 끌고 있다."
