addr1,addr2,areacode,booktour,cat1,cat2,cat3,contentid,contenttypeid,createdtime,firstimage,firstimage2,mapx,mapy,mlevel,modifiedtime,readcount,sigungucode,tel,title,zipcode,overview
강원도 평창군 송정길 110,,32,,A02,A0203,A02030600,2850703,12,20220907111107,http://tong.visitkorea.or.kr/cms/resource/01/2850701_image2_1.png,http://tong.visitkorea.or.kr/cms/resource/01/2850701_image3_1.png,128.5740269334,37.6423584197,6.0,20221014164233,1,15,,평창관광택시(관광택시 플랫폼),25328.0,"관광택시는 평창군의 지원으로 넓은 평창의 자연을 즐기기에 더욱 효율적인 여행이될 수 있도록 기획된 상품이다. 패키지형 관광상품이며, 전담여행사의 사전예약제를 통해 운영되고 있다. 홈페이지를 통해 다양한 상품을 만나볼 수 있으며, 평창의 유명 관광지와 다양한 장소로 떠나 편안한 여행을 보내기에 좋은 플랫폼이다. 
 온라인 사전예약 상품으로 현장 구매 불가"
강원도 평창군 대관령면 용산리,,32,,A01,A0101,A01010500,2822727,12,20220603150121,,,128.6792257187,37.6445546346,6.0,20220603150136,0,15,,발왕수 가든,25352.0,발왕산은 강원도에 위치한 산으로 해발 1458m의 높은 산이다. 국내에서 12번째로 높은 산이지만 케이블카가 설치되어 있어서 쉽게 정상 등반이 가능하다. 발왕산의 정상에는 기 스카이워크가 자리하고 있다. 스카이워크에 올라 주변 산세를 감상하면 정말 자연이 주는 기운을 받고 있는듯한 느낌을 준다. 숲길을 따라 발왕산 정상까지 올라가면 나무데크로 깔끔하게 조성된 산책로가 있어서 풍경을 따라 걸으며 여유를 느낄 수 있다. 중간에는 발왕수 가든이 위치해있는데 걷다가 중간에 목을 축일 수 있는 천연암반수를 마셔볼 기회를 가질 수 있다.
강원도 평창군 문화택지길 41-12,,32,,A02,A0203,A02030600,2820893,12,20220520141611,http://tong.visitkorea.or.kr/cms/resource/65/2820865_image2_1.jpg,http://tong.visitkorea.or.kr/cms/resource/65/2820865_image2_1.jpg,128.4535784664,37.4909569494,6.0,20220928132420,6,15,,천지애농원(평창사랑),25356.0,"평창사랑은 귀농귀촌을 꿈꾸는 사람들에게 다양한 귀농인들의 삶을 모델로 제시하며 여러 가지 체험과 숙박, 농산물 꾸러미 판매 등 모듈형 투어 프로그램을 제공한다. 체험 예약은 전화(01049303855)로 가능하다."
강원도 평창군 마하길 41-5,,32,,A02,A0203,A02030600,2820892,12,20220520140819,http://tong.visitkorea.or.kr/cms/resource/49/2820849_image2_1.jpg,http://tong.visitkorea.or.kr/cms/resource/49/2820849_image2_1.jpg,128.5410709995,37.2917399274,6.0,20220614171727,0,15,,와우미탄(WOW:미탄),25384.0,"와우미탄은 평창군 미탄면에 거주하고 있는 5명의 청년이 구성한 협동조합이다. 산너미목장, 어름치마을, 옐로우트리 카페, 평창연화농원을 운영하고 있는 청년들은 미탄면의 잘 보존된 자연과 건강한 농특산물을 기반으로 주민여행사를 운영하고 있다."
강원도 평창군 태기로 228-33 한화리조트,,32,,A02,A0203,A02030600,2820838,12,20220520110322,http://tong.visitkorea.or.kr/cms/resource/37/2820837_image2_1.JPG,http://tong.visitkorea.or.kr/cms/resource/37/2820837_image2_1.JPG,128.331753482,37.5788278091,6.0,20220921152647,2,15,,평창캠프닉,25309.0,"평창캠프닉(주식회사 아이평창유)는 소풍 개념의 먹거리 관광 특화상품을 체험하는 청정지역 평창의 유휴공간에서 우리만의 가족, 연인들이 즐길 수 있는 프로그램을 제공하는 주민 여행 기업이다.
청정지역 강원도 평창에서의 평창캠프닉은 특별한 장비가 필요 없고 빈 몸으로 혹은 대중교통을 이용하여 즐기는 체험 프로그램으로 전화(0333366449) 또는 홈페이지(a hef""https:campnickoea.modoo.at"" taget""_lank"" title""새창 : 평창캠프닉 홈페이지로 이동""https:campnickoea.modoo.ata)로 예약이 가능하며 이외에도 다양한 감성 체험 상품들을 운영하고 있다."
강원도 평창군 진부면 오대산로 374-8,,32,0.0,A02,A0205,A02050200,2702536,12,20211231011750,,,128.5931613749,37.7317317795,6.0,20220928142842,0,15,,밀부와 밀부주머니,25318.0,"강원도 문화재자료인 밀부와 밀부주머니는 조선 예조에서 월정사 주지에게 사여한 유물로 사슴가죽 주머니와 띠로 구성되어 있다. 작은 원형 동판에 명문을 앞뒤로 새기고 나무 상자에 넣었으며, 이것을 가죽 주머니에 넣었다.  앞면에는 강원도오대산중대적멸궁수호선교병팔도석품제일도원장밀부자, 뒷면에는 예조판하 경신정월일국신교시시상언내신주급신도의 명문이 새겨져 있다. 월정사성보박물관은 강원도 남부 60여개의 사찰의 불상, 불화, 불교장엄구, 불교의식구 및 경전류의 성보를 전시, 연구, 보존, 관리를 하고 있는 불교전문박물관으로 장대한 역사를 말해주듯 국보 상원사중창권선문, 보물 월정사석조보살좌상, 보물 월정사 팔각구층석탑에서 출토 된 사리구 12점, 보물 상원사 문수동자좌상 복장유물 23점, 밀부와 밀부주머니, 강원도 유형문화재 등 620여점의 우수한 성보문화재를 소장 하고 있다."
강원도 평창군 평창읍 평창강로 1267-4,,32,0.0,A02,A0205,A02050200,2701876,12,20211229015605,,,128.3851971678,37.3497775017,6.0,20220719173301,0,15,,유동리오층석탑,25373.0,"평창읍 유동리에 있는 고려시대의 석탑으로 강원도문화재자료 제30호 지정되었다. 오층석탑은 1층 기단위에 쌓아 올린 5층의 탑신부로 구성되었고, 옥개석과 탑신이 얇고 평판적이어 전체적으로 안정감이 있으면서 경쾌한 아름다움을 보여주는 탑이다. 오층석탑은 1층 기단위에 쌓아 올린 5층의 탑신부로 구성되었는데 상당히 큼직한 기단부와 이위의 적당히 체감된 옥개석과 탑신이 얇고 평판적이어서 전체적으로 안정감이 있으면서 경쾌한 아름다움을 보여주고 있다. 단층의 기단 위에 세워진 석탑으로 장대석으로 쌓은 지대석 위에 하대석을 올렸다. 하대석은 1매의 판석으로 윗면에 복련이 각변에 6판씩 24엽이 새겨진 연화대를 놓고 그 위에 중대석을 받치고 있는 형태이다."
강원도 평창군 평창읍 고길천로 123,,32,0.0,A02,A0203,A02030100,2801724,12,20211220181405,http://tong.visitkorea.or.kr/cms/resource/46/2801346_image2_1.png,http://tong.visitkorea.or.kr/cms/resource/46/2801346_image2_1.png,128.4392722592,37.3699678646,6.0,20221208150126,0,15,,해락촌,25370.0,"노로리,이곡리,조동리,고길리,지동리의 5개의 마을로 이뤄진 해발 700m의 고산마을이다. 해락은 여러 사람이 함께 즐기다 라는 뜻인데 마을 이름처럼 이곳에서는 여러 사람이 함꼐 즐길 거리가 가득하다. 농어촌 인성학교로 지정받아 청소년들에게 다양한 농촌 체험활동을 선사한다."
강원도 평창군 진부면 오대산로 374-8,,32,0.0,A02,A0205,A02050200,2799214,12,20211215235048,http://tong.visitkorea.or.kr/cms/resource/74/2799174_image2_1.JPG,http://tong.visitkorea.or.kr/cms/resource/74/2799174_image2_1.JPG,128.5931613749,37.7317317795,6.0,20221205165113,1,15,,월정사팔각구층석탑,25318.0,"고려시대가 되면 4각형 평면에서 벗어난 다각형의 다층(多層)석탑이 우리나라 북쪽지방에서 주로 유행하게 되는데, 이 탑도 그러한 흐름 속에서 만들어진 것으로, 고려 전기 석탑을 대표하는 작품이다. 당시 불교문화 특유의 화려하고 귀족적인 면모를 잘 보여주고 있으며, 전체적인 비례와 조각수법이 착실하여 다각다층석탑을 대표할 만하다. 정영호교수는 월정사 팔각구층석탑이 지니는 특수한 양식을부재별로 다음과 같이 정리하였다. 첫째 전체적으로 석탑의 평면이 8각형을 이루고 있어 선대의 방형 평면에서 벗어났다는 것,둘째 다각이고 다층인데 그 특징이 있다. 셋째 기단부에 있어서 하층기단에 안상을 조각하고 연화대를 마련한 데에서 화사하고 장식적인 의장이었음을 알 수 있게 하고, 상단괴임대와   탑신괴임석이 끼어져 있는 것도 한 특색이라 하겠다. 넷째 탑신부에 있어서 각 옥개석 하면의 처리가 각형과 호형받침으로 특이하게 이루어져 있으며 각층의 체감률이 적으나 기단부가 안정되어 오히려 경쾌한 느낌을 주고 있다. 그리고 상륜부재의 장식은 마치 공예탑의 일면에 보이는 것으로 나아가 석탑 전체를 장식적인 형태로 보이도록 하고 있으니 이것 또한 이 석탑만의 특이성이라 하겠다.또한 청동으로 만들어진 풍경과 금동으로 만들어진 머리장식을 통해 금속공예의 수법을 살필 수 있어 중요한 자료가 되고 있다. 현재 국보 제481호로 지정 보호되고 있으며 전체 높이는 15.2m이다.기단부는 4매로 결구된 팔각형의 지대석 위에 놓였는데 하층기단의 면석도 4매의 돌로 짜여졌으며, 8각의 각 면에는 2구씩의 안상이 음각되고 하층기단의 갑석 또한 4석으로 짜여졌는데 위에는 복판의 복연이 조각되었다. 그 위에는 상층기단 중석과의 사이에 별석이 삽입되었고, 별석의 윗면에는 괴임이 얕게 마련되었다. 탑신부는 위층으로 올라 갈수록 서서히 줄어들었으나 급격히 줄지 않고 2층 옥신부터 거의 같은 높이의 옥신을 유지하고 있는데 옥신석 또는 옥개석의 크기에 따라 2개 내지 3개의 석재를 사용하였고 상층부는 1석씩이다. 상륜부는 완전한 형태를 보이고 있는데, 노반복발앙화보륜까지는 석재이고, 그 이상의 보개수연용차보주 등은 금동제로 조성되었다. 찰주는 수철제(水鐵製)로 전체길이 4.3m인데 하부는 굵으며상부로 갈수록 가늘어지는 형상으로 9층에서 8층 옥개석까지 박혀있으며, 하부는 철편으로 고정시켰다. 중적된 상륜부재는 처음 석탑을 건립하였을 때의 것으로 보여지는데, 보개만은 여러차례 수리가 가해진 것으로 보인다.1970년 10월 해체 복원시 5층 옥개석에서는 완형의 은제도금아미타여래입상(銀製鍍金阿彌陀如來立像, 높이 : 9.7㎝) 1구가, 1층 탑신 상면의 사리공에서는 각종 사리 장엄구가 발견되었다. 1층 탑신석에서 청동거울 4점, 청동합과 담홍색 사리 4과가 봉안된수정사리병, 전신사리경(全身舍利經), 금동방형향갑(金銅方形香匣), 황라니금연화수향(黃羅泥金蓮花繡香), 쌈지, 자색비단향주머니, 향초금보(香草錦褓) 및 향나무편과 향편(香片)이 출토되었다.그리고 1269층의 옥개석은 새로 조성되었다. 한편 이 석탑의 앞에는 한쪽 무릎을 꿇은 석조보살상 1구가 배치되어 있는데 이것은 강릉 신복사지 삼층석탑과 같은 형식이다. 이 석탑은 여러차례의 화재로 인하여 각 부재의 손상이 심하지만, 우수한 균형미를 구비하고 있어 고려시대 다각다층의 대표적 석탑이며, 분포면에 있어 팔각다층석탑으로는 가장 남쪽에 건립되었다는데 의의가 있다."
강원도 평창군 진부면 오대산로 182,월정사 성보박물관,32,0.0,A02,A0205,A02050200,2799166,12,20211215234356,http://tong.visitkorea.or.kr/cms/resource/47/2799147_image2_1.JPG,http://tong.visitkorea.or.kr/cms/resource/47/2799147_image2_1.JPG,128.6019970878,37.718655686,6.0,20211215234356,1,15,,월정사 육수관음상,25318.0,"신라 선덕여왕 12년(643)에 자장율사가 창건한 월정사에 모셔진 보살상으로, 현세에서 자비로 중생을 구제한다는 의미를 지닌 관음보살을 표현한 작품이다. 손이 왼쪽과 오른쪽 어깨에 각각 3개씩 모두 6개가 달려 있어 육수관음보살로 불리며 금동으로 주조되어있다. 머리에는 삼면화관(三面花冠)을 썼는데 꽃무늬와 불꽃 모양의 구슬이 새겨져 있으며, 양어깨에는 땋은 것 같은 두 가닥의 머리카락이 늘어져 있고, 노출된 가슴에는 구슬장식이 달린 목걸이가 길게 표현되었다. 6개의 손목에는 정교한 팔찌가 끼워져 있다.상체는 나형(裸形)이나 천의(天衣)가 걸려 있으며 목과 가슴에는 영락(瓔珞)이 늘어져 있다. 불상(佛像)은 양어깨에서 3개씩의 팔이 뻗어 나와 6개의 손을 만들었으며 모든 손에는 정교(精巧)한 팔찌가 조식(調飾)되어 있다. 불신(佛身)은 가냘픈 모양이며 상체에 비해 하체가 비만하여 무릎 폭이 넓고 무릎을 덮고 있는 옷 주름의 표현은 투박하고 형식화되었다. 결가부좌(結跏趺坐)한 무릎 밑에 놓인 대좌(臺座)는 불신(佛身)의 윤곽을 따라 타원형이 되었고, 윗부분에는 단판연화(單瓣蓮花)를 앙련(仰蓮)으로 아랫부분은 복련(伏蓮)으로 연결되었다. 상하 끝에 각각 연주문(聯珠紋)이 있다. 불신이 가냘프고 불상의 주조법이 빼어나다고 볼 수는 없으나 전체적으로 균형미가 있고, 6개의 손이 돌출되었지만 어색한 점이 발견되지 않는다는 점에서 조선시대의 작품으로는 걸작품이라 할 수 있다. 전체 높이는 45㎝이다."
강원도 평창군 진부면 오대산로 1211-92,동산리 산1,32,0.0,A02,A0201,A02010800,2799163,12,20211215234118,http://tong.visitkorea.or.kr/cms/resource/55/2799155_image2_1.JPG,http://tong.visitkorea.or.kr/cms/resource/55/2799155_image2_1.JPG,128.556190713,37.7899715451,6.0,20221206113939,0,15,,월정사부도군,25318.0,"부도는 승려의 무덤을 상징하여 그 유골이나 사리를 모셔두는 곳이다.이 부도밭은 월정사에서 상원사로 가는 길의 전나무 숲속에 자리하고 있는데, 모두 22기에 이르는 부도들이 흩어져 있다. 크기는 1～2m 내외의 그리 높지않은 체구로, 조선시대 중기 이후에 세웠을 것으로 추측된다.운공성관(雲空性觀), 금성당(金聖堂) 등의 호를 가진 승려들의 사리를 모시고 있는 이 부도들은 낮은 받침위로 종모양의 탑몸돌을 올린 모습들이 대부분이나, 2층 기단(基壇)과 지붕돌을 갖춘 부도의 모습도 간혹 눈에 띈다."
강원도 평창군 진부면 오대산로 1211-92,동산리 산1,32,0.0,A02,A0201,A02010800,2799143,12,20211215233935,http://tong.visitkorea.or.kr/cms/resource/76/2799076_image2_1.JPG,http://tong.visitkorea.or.kr/cms/resource/76/2799076_image2_1.JPG,128.556190713,37.7899715451,6.0,20221206131837,0,15,,월정사 적멸보궁,25318.0,"적멸보궁은 부처님 진신사리를 봉안한 곳이다. 적멸보궁은 모든 바깥 경계에 마음의 흔들림이 없고 번뇌가 없는 보배스런 궁전이라는 뜻이다.욕심과 성냄, 어리석음이 없으니 괴로울 것이 없는 부처님의 경지를 나타낸다.적멸보궁은 부처님의 진신사리가 모셔져 있어 법당 안에는 따로 부처님상을 조성하지 않고 불단만 설치하는 것이 특징이다.이 적멸보궁은 비로봉에서 흘러내린 산맥들이 주위를 병풍처럼 둘러싼 중앙에 우뚝 솟아 있는 바, 나는 용(龍)이 여의주(如意珠)를 희롱하는 형국(形局)이라고 말하는 사람도 있는 명당으로 많은 사람들의 동경의 대상이기도 하였다."
강원도 평창군 진부면 오대산로 374-8,동산리 17-5 월정사 성보박물관,32,0.0,A02,A0201,A02010800,2799104,12,20211215232918,http://tong.visitkorea.or.kr/cms/resource/28/2799028_image2_1.JPG,http://tong.visitkorea.or.kr/cms/resource/28/2799028_image2_1.JPG,128.5931613749,37.7317317795,6.0,20221206092442,0,15,,용다사동종,25318.0,"이 동종은 조선시대의 종 중에서도 극히 퇴락한 형식으로 양식적으로는 대수롭지 않지만 1787년(정조 11) 화천 용화산 용다사에서처음 주성되었다는 소위 원명과 1878년(고종 15) 양구 심곡사에 시주되었다는 추명이 있지만, 원주 구룡사에서 보관해 오던 동종이다. 이 시기에 한글 명문이 새겨진 종이 드물다는 점에서 그 가치가 크다.  1977년부터 강원도향토박물관에서 전시되다가 1999년 9월 월정사로 옮겨져 현재 성보박물관에 전시되고 있다.  종의 정상부에는 한 몸체에 용머리가 서로 반대쪽으로 있는 오메가(Ω)형一體雙頭形의 용뉴가 있다. 천판(天板)은 반구형(半球形)으로 종신(鐘身)과의 사이에는 한 줄의 띠를 돌려 구분하고 있는데, 용뉴를 중심으로 연꽃무늬를 조잡하게 돋을새김(陽刻)하였다. 종신에는 세 줄의 띠를 돌려 4개의 부분으로 구획하였을 뿐, 상, 하대와 보살입상, 유곽 등 일체의 장식을구비하지 않고 소면(素面)으로 처리하였다. 그러나 종신의 상단부와 하단부에 각각 한글과 한자로 된 명문이 있다는 점에서 중요한 의미를 갖고 있다. 이중 하단부의 한자 명문은종을 처음 주성할 때의 주종기로, 1787년(건륭乾隆 52, 정조 11) 낭천(狼川) 용화산(龍華山) 용다사(龍茶寺)에서 처음 종을 주조하였음을 알 수 있다. 낭천은 현재의 화천군이며, 용화산은 화천군과 춘천시의 경계를 이루는 산이나 용다사는 그 위치를 알 수 없다.  상단부의 한글 명문은 종을 다시 시주될 당시의 발원문으로, 한글을 굵은 글씨로 잘 새기고 붉은 칠을 하였다. 내용은 1879년(광서光緖 5, 고종 16) 경성에 거주하는 청신녀(淸信女) 황씨(黃氏, 법명 蓮池願)가 양구군 동면 팔랑리의 심곡사에 시주했다는 것으로, 이러한 사실은《건봉사본말사적(乾鳳寺本末史蹟)의 심곡사사적(深谷寺史蹟)에서도 확인된다. 이 종은 양식적으로 대수롭지는 않지만 소위 원명(原銘)과 추명(追銘)이 있으며, 이 종을 모셨던 두 절의 이름이 나오고, 한글명에대해서는 문헌에서도 확인이 되며, 이 시기에 한글명문이 새겨진 종은 그 예(例)가 드물다는 점에서 의의가 있다. "
강원도 평창군 진부면 오대산로 374-8,동산리 63-1,32,0.0,A02,A0201,A02010800,2799056,12,20211215232640,http://tong.visitkorea.or.kr/cms/resource/71/2798971_image2_1.JPG,http://tong.visitkorea.or.kr/cms/resource/71/2798971_image2_1.JPG,128.5931613749,37.7317317795,6.0,20221206133250,0,15,,오대산중대불량문,25318.0,"현재 월정사 성보박물관에는 중대 적멸보궁과 관련하여 작성시기가 다른 2종의 불량문이 소장되어 있는데 이 책은 그중의 하나다. 중대는 오대산신앙의 중심이며, 적멸보궁은 비로자나 법심불이 상주하는 장소로서 일찍부터 신성시 되어 왔다. 또한 불량이란 뜻은 문자그대로 부처님의 양식을 이르는 말이지만, 이보다는 어떤 전각이나 불상을 영구히 유지하기 위한 재정적인 후원을 의미한다. 『오대산중대불량문(五臺山中臺佛糧文)은 조선후기의 중대 적멸보궁의 중창사실과 이를 재정적으로 후원한 일반 시주자 및 인근 사찰의 시주 스님을 기록한 것이다.겉장은 황색 표지이며, 표지에는 보궁유진 중대불량문이라고 되어 있어서 적멸보궁(중대)에서 보관용으로 기록한 것임을 알 수 있다.사주단변과 계선을 검은색으로 그렸고, 반곽 8행에 글자 수는 16자25자로 불규칙하다. 모두 20장으로 이루어져 있으며, 크기는반엽 34.7㎝×26.6㎝, 반곽 27.3㎝×23.6㎝이다. 첫장의 오대산중대 적멸궁불량단록서는 재물을 출연하여 시주하는 공덕을 찬양하는 내용의 발문으로 사문경의가 작성한 것이다. 그리고 앞쪽에는 김수재를 비롯한 일반 대시주자의 이름과 소원문이 보이고이어서 본사 비구를 비롯하여 인근의 건봉사 및 경상도 은해사 스님들의 시주명이 차례로 기재되어 있으며, 권말에는 이를 증명하는 각사찰명이 지역별로 기재되어 있다.간기는 말미에 갑술육월일 적멸보궁서로 표기되어 있는데, 연호 표기가 없어 정확한 연대를 알 수 없지만, 화주 영담 스님이『오대산중대불량계원수복문(강원도 문화재자료 제 135호)의 연기에도 나타나고 있어 갑술년은 1814년(순조 14)으로 판정된다. 따라서 이 책은 1814년 화주 영담 등이 중심이 되어 사문경의가 취지문을 작성하고 각 사찰 불자의 시주명을 기재하여 책으로 만들어 적멸보궁에 보관했던 것으로, 조선 후기 적멸보궁의 중창 사실과 이를 재정적으로 후원한 일반 시주자 및 인근 사찰의 면면을 알 수 있고, 당시의 사찰 연혁을 살필 수 있는 중요한 자료이다."
강원도 평창군 대화면 가평로 181-8,,32,0.0,A01,A0101,A01010500,2799025,12,20211215232130,http://tong.visitkorea.or.kr/cms/resource/98/2798998_image2_1.JPG,http://tong.visitkorea.or.kr/cms/resource/98/2798998_image2_1.JPG,128.4586570232,37.4496840341,6.0,20221206135749,0,15,,강따라 방림 가는길,25361.0,"굽이치는 대화천과 자연 그대로의 모습을 간직하고 있는 금당계곡이 합류된 평창강을 따라 고봉과 절벽이 조화된 멋진 경관을 연출하고 있는 구간으로 주변경관을 조망하며 강변을 따라 걷는 길이다. 특히, 제3구간은 제방길과 강변길로 이루어져 있어 자전거 투어를 즐기기에 더 없이 좋은 곳이다. 주변의 산과 계곡에서 불어오는 시원한 바람을 가르며 자연의 정취와 멋진 풍경을 가슴에 담을 수 있는 길이다."
강원도 평창군 진부면 오대산로 176,동산리 17-5 월정사성보박물관,32,0.0,A02,A0201,A02010800,2798992,12,20211215231539,http://tong.visitkorea.or.kr/cms/resource/33/2798933_image2_1.JPG,http://tong.visitkorea.or.kr/cms/resource/33/2798933_image2_1.JPG,128.6029831025,37.7189028985,6.0,20221206164020,0,15,,오대산 불량계원수복문,25318.0,"현재 월정사 성보박물관에는 중대 적멸보궁과 관련하여 작성시기가 다른 2종의 불량문이 소장되어 있는데,『오대산중대불량계원수복문은 강원도 문화재자료 제134호로 지정된『오대산중대불량문과 함께 전승되어 온 또 하나의 문건이다. 오대산중대불량계원수복문의 앞부분은 1825년 서대에 소속되어 있던 논을 중대로 영원히 옮기면서 그 상세한 부동산 목록을 작성한 문건이다.이어서 취봉(鷲峯) ․ 민현(愍玹)이 쓴 「오대산적멸보궁불량연기」가 있는데, 모연(募緣)의 의의를 강조한 글이다. 그 내용은 부처의 법신이 상주하는 적멸보궁이 점차 쇠락하자 본사의 화주 영담 장로가 이를 안타깝게 여기는 것을 보고 그의 문인 신운등이 앞장서서 권선한 사실을 기록한 것이다.뒷부분에는 이와 같이 취지에 동참한 인근 각지의 사찰과 소속 승려들의 명단을 수록하였다. 겉장은 황색 표지로, 표지에는 중대불량계원수복문이라고 필서하였다.「오대산적멸보궁불량연기」를 쓴 날짜가 도광오년을유육월상한으로 되어 있어 도광 5년에 작성되었음을 알 수 있다.사주단변과 계선을 검은색으로 그렸고, 반곽 6행에 글자 수는 12자 내외로 불규칙하다. 모두 18장으로 이루어져 있으며, 크기는 반엽(半葉) 41.0㎝×29.7㎝, 반곽 31.7㎝×25.4㎝이다.이 책은 오대산 신앙의 중심인 중대 적멸보궁의 관리를 위해 사찰 내에서도 암자와 암자 사이에 부속 부동산을 옮겼다는 사실을 잘 보여 줄 뿐만 아니라 당시 적멸보궁의 세력권을 추정할 수 있는 문건이며, 또한 각 사찰에 소속되어 있는 승려들의 명단을 실었다는 점에서 조선 후기 강원도 내 사찰의 현황 등을 살 필 수 있는 중요한 자료이다. "
강원도 평창군 봉평면 태기로 254-1,,32,0.0,A02,A0203,A02030600,2798965,12,20211215230822,http://tong.visitkorea.or.kr/cms/resource/40/2798940_image2_1.JPG,http://tong.visitkorea.or.kr/cms/resource/40/2798940_image2_1.JPG,128.336278028,37.5803499411,6.0,20221205134636,0,15,,고랭길,25309.0,"고랭길은 표고 600m 이상의 높고 한랭한 고랭지인 평창의 특성을 살려 부르는 이름이다.고랭길은 휘닉스파크 앞에서 시작하여 작은 산을 넘고 숲길을 따라 걸으며 삼림욕을 즐기며 메밀꽃 피는 봉평으로 이어지는 길이다.
오르막과 내리막을 반복하는 코스로 울창한 숲으로 뒤덮여 자연과 함께하는 즐거움이있고 흙길이어서 걷기에도 무리가 없는 곳이다.고랭길 끝자락에는 이효석 문학의 숲이 조성되어 있고 소설 메밀꽃 필 무렵의 실제 무대인 봉평 효석문화마을까지 이어진다. 옛날 봉평장이 서는 날이면 면온에서 봉평까지 이 길을 넘기도 했다고 한다."
