addr1,addr2,areacode,booktour,cat1,cat2,cat3,contentid,contenttypeid,createdtime,firstimage,firstimage2,mapx,mapy,mlevel,modifiedtime,readcount,sigungucode,tel,title,zipcode,overview
광주광역시 광산구 장신로82번길 57 공원관리사무소,,5,,A02,A0202,A02020100,2822573,12,2.02206E+13,http://tong.visitkorea.or.kr/cms/resource/65/2822565_image2_1.jpg,http://tong.visitkorea.or.kr/cms/resource/65/2822565_image3_1.jpg,126.8202597,35.18798248,6,2.02206E+13,0,1,"062-960-8702, 062-960-6857",광주 수완호수공원,62225,"도시계획을 통해 성장한 수완동 안의 공원으로 위치와 접근성이 뛰어나다.
O체어, 벤치그네 등 시민들이 아이들과 함께 재밌게 접할 수 있는 조형물들이 있다.
밤이면 조형물 사이의 전구들과 조형물 자체에서 빛이 나 은은하고 따뜻한 분위기를 만끽할 수 있다.
호수를 가운데 두어 춤추는 분수를 매시 정각마다 즐길 수 있고 그 주변으로 산책길이 잘 조성되어 있다.
공원 주변으로 대형마트들을 비롯한 다양한 상가들이 있어 편의성도 갖추고 있다.
공연무대가 있어 각종 행사진행이 가능하다."
광주광역시 광산구 천동길 46,(신룡동),5,0,A02,A0201,A02010500,2790501,12,2.02112E+13,http://tong.visitkorea.or.kr/cms/resource/31/2792331_image2_1.jpg,http://tong.visitkorea.or.kr/cms/resource/31/2792331_image2_1.jpg,126.7629558,35.21131499,6,2.02112E+13,0,1,,윤상원열사 생가,62206,"5·18 민주화운동 당시 시민군 대변인으로 활동했던 윤상원 열사를 기리는 공간이다. 그는 들불야학을 열어 가난한 청년들과 노동자들에게 배움을 나누던 스승이자, 최후까지 도청에 남아 계엄군과 싸우다 서른 살의 젊은 나이로 산화한 광주의 대표적 민주열사다. 생가 내부는 자료전시관으로 사용 중인데, 윤상원 열사뿐 아니라 그와 영혼결혼식을 올렸던 박기순 열사의 고귀한 삶과 정신을 돌아볼 수 있도록 꾸며졌다. 1970년대 후반 들불야학에서 만나 인연을 쌓았던 이들은 민주항쟁과 불의의 사고로 인해 젊은 나이로 생을 마감했다. 이들의 죽음을 안타까워한 가족과 친지들이 영혼결혼식을 올리게 됐고, 이때 5·18을 상징하는 노래가 된 임을 위한 행진곡이 헌정됐다고 한다. 노래뿐 아니라 ""오늘 우리는 패배할 것이다. 그러나 내일의 역사는 우리를 승리자로 만들 것이다""라고 했던 윤상원 열사의 말은 지금도 민주화운동을 상징하는 인터뷰로 깊은 여운을 남긴다."
광주광역시 광산구 하남대로54번안길 133,(하남동),5,0,A02,A0202,A02020700,2783851,12,2.02111E+13,,,126.800095,35.17832767,6,2.02207E+13,0,1,,경암근린공원,62336,"도심 속에서 숲을 접하고 자연 속에서 힐링할 수 있는 경암근린공원은 광주 광산구 하남동에 자리 잡고 있다. 다양한 체육활동을 할 수 있는 다목적 운동장과 함께 광장, 어린이 놀이터 등이 갖추어져 있으며, 잘 정돈된 산책로와 휴게시설도 마련되어 있다. 또한, 유아숲체험원이 조성되어 있어 어린이들이 자연 속에서 다양한 놀이와 함께 자연을 직접 체험할 수 있고, 어린이들이 좋아할 만한 조형물 및 다양한 체험시설을 갖추고 있어 어린이와 함께 나들이하기에 좋다. 그뿐만 아니라 보행 약자를 위한 무장애 나눔 길이 설치되어 있어 거동이 불편한 보행 약자들도 쉽고 편하게 숲을 체험하고 안전하게 산책할 수 있다."
광주광역시 광산구 선암동 241-31,,5,0,A02,A0202,A02020700,2783810,12,2.02111E+13,,,126.7743676,35.14399779,6,2.02205E+13,0,1,,황룡친수공원,,"황룡 친수공원은 광주광역시 광산구 선암동에 있다. 광주에서 이름난 유채꽃 명소로, 봄에는 벚꽃의 분홍 물결과 함께 노란 유채꽃이 펼쳐지는 아름다운 풍광을 즐길 수 있다. 또한, 가을에는 코스모스와 억새를 볼 수 있고, 겨울에는 공원 근처를 흐르는 황룡강에 매년 다양한 오리류가 도래하여 겨울을 나고, 수달, 삵, 큰기러기, 가창오리, 황조롱이, 말똥가리 등과 같은 천연기념물과 멸종위기종들을 볼 수 있는 사계절이 아름다운 공원이다. 산책로, 놀이 시설, X게임장, 체육시설, 유실수원, 생태습지, 주차장, 화장실을 갖추고 있다. X게임장에서는 인라인스케이트, 스케이트보드, BMX 등을 즐길 수 있는데, 장비를 대여해 주는 곳은 없으니 직접 가져와야 이용할 수 있다."
광주광역시 광산구 탑동길 345,(지산동),5,0,A03,A0302,A03021700,2718673,12,2.02105E+13,,,126.7303952,35.19536346,6,2.02203E+13,0,1,010 3275 3450,광산구 국민여가 친환경 오토캠핑장,62204,"광산구 국민여가 친환경 오토캠핑장은 지산 저수지가 내려다보이는 곳에 자리잡은 휴식 공간이다. 오토캠핑장 내부는 4인용(24인 가능), 6인용 카라반이 있는 카라반존과 개인용 텐트 사용이 가능한 텐트존으로 구성되었다. 일상에 지친 사람들이 아름다운 환경에서 휴식을 즐길 수 있는 힐링공간으로, 가까운 곳에 지산유원지, 어등산 등 관광지가 있다."
광주광역시 광산구 광산로29번길,(송정동),5,0,A02,A0203,A02030600,2605353,12,2.01906E+13,http://tong.visitkorea.or.kr/cms/resource/65/2368465_image2_1.jpg,http://tong.visitkorea.or.kr/cms/resource/65/2368465_image3_1.jpg,126.7943076,35.13971527,6,2.0221E+13,0,1,,광주 송정동 떡갈비 골목,62430,"광주 송정동에는 20여 개의 떡갈비 전문점이 모인 골목이 있다. 송정동 떡갈비 골목의 음식점들은 저마다 고소하고 쫄깃한 떡갈비 맛으로 손님들의 발길을 끌고 있다. 평일과 주말을 가리지 않고 관광객이 찾아들고, 호남 지역을 방문한 외국인 관광객이라면 반드시 한 번은 들러 가곤 한다. 송정 떡갈비는 여러 가지 면에서 보통의 떡갈비와 다르다. 보통 떡갈비는 소고기를 이용하지만, 이곳은 소고기와 돼지고기를 섞어 만든다. 원래 송정 떡갈비도 소고기를 이용하다가 1990년대 후반 경제가 어려워지면서 재료비가 인상되자, 음식 값을 올리지 않기 위해 돼지고기를 섞어 메뉴로 내놓았다고 한다. 육질이 서로 다른 돼지고기와 소고기가 만나 환상의 궁합을 만들어내며 송정 떡갈비가 탄생한 셈이다. 이 외에도 떡갈비에 곁들여지는 뼛국은 송정의 독특함이 그대로 드러나는 음식이다. 돼지 뼈와 다시마, 무 등을 넣고 오랫동안 끓이는 뼛국은 이 자체만으로도 훌륭한 메뉴다. 떡갈비 한 접시에 뜨끈한 국물 한 그릇 후루룩 마시면 하루 종일 속이 든든하다."
광주광역시 광산구 어등대로 658,(소촌동),5,0,A02,A0204,A02040800,2458611,12,2.01612E+13,,,126.7913189,35.14244269,6,2.02208E+13,4065,1,,금호타이어 광주공장,62392," 승차감과 안전의 비법을 찾아라   자동차의 신발이라 하는 타이어, 타이어가 편안해야 주행이 안전하다. 금호타이어는 세계 180여 개국에 수출하는 세계 10대 타이어메이커로 대 소비자 커뮤니케이션에 적극적이다. 광주공장에서는 타이어 역사관과 함께 공장시설 견학 프로그램을 운영한다."
광주광역시 광산구 용아로 460,(흑석동),5,0,A02,A0201,A02010700,1955614,12,2.0141E+13,,,126.8052277,35.18450762,6,2.02208E+13,2771,1,,유애서원,62233,"1754년(영조 30)에 이신의(李愼儀)의 학덕(學德)과 충절(忠節)을 추모하기 위하여 호남의 유림(儒林)이 건립(建立)하였다. 1868년(고종 5) 대원군은 향호유림(鄕濠儒林)의 소굴이며 당쟁(黨爭)의 본거지인 서원이 경제적 폐단까지 겹쳐있어 그 피해가 극심함으로 서원 폐지령(廢止令)을 내려 훼철(毁撤)을 단행하였다. 1901년(고종 38) 서적과 거문고 유품을 임시로 보관하기 위해서 금서재(琴書齋)를 지었다. 서기 1919년 봄 경장각을 짓기 위하여 18년이 된 금서재(琴書齋)를 철거하였다. 서기 1919년(己未) 건립 (建立), 금서재(琴書齋)는 제도가 비천하고 풍우(風雨)와 수화(水火)가 걱정이 되어 철거하고 기미년 봄에 후손들이 의논하여 옛 사우(祠宇)가 있던 자리에 경장각(敬章閣)을 건립(建立)하였다. 서기 2000년 (庚辰) 유애사 사우건립 (遺愛祠 祠宇建立) 사우훼철 (祠宇毁撤) 後 81년 만에 敬章閣 후면에 화려한 단청 사우(祠宇)를 마련 석탄공(石灘公) 할아버지를 모시게 되었으며 2005년 6월 20일 유애서원(遺愛書院)으로 성균관(成均館)에 등록하였다."
