addr1,addr2,areacode,booktour,cat1,cat2,cat3,contentid,contenttypeid,createdtime,firstimage,firstimage2,mapx,mapy,mlevel,modifiedtime,readcount,sigungucode,tel,title,zipcode,overview
경상남도 창녕군 창녕읍 화왕산관룡사길 171,,36,0,A02,A0201,A02010800,2785626,12,20211203191255,http://tong.visitkorea.or.kr/cms/resource/78/2797478_image2_1.JPG,http://tong.visitkorea.or.kr/cms/resource/78/2797478_image2_1.JPG,128.5535506584,35.5327739823,6.0,20221123104635,0,15,,용선대,50335.0,"억새로 유명한 창녕 화왕산에는 소박한 사찰 관룡사가 있고 그곳에서 500m를 걸으면 용선대를 만날 수 있다. 석조여래 좌상으로 유명한 용선대는 천년을 이어 온 통일신라시대의 불상이다. 보물 295호로 지정돼 있으며 아래에서 보면 까마득한 벼랑 같지만 관룡사에서는 가깝게 느껴지는 곳이다. 우포늪, 화왕산 억새밭과 함께 창녕을 찾은 관광객들이라면 꼭 찾아봐야 할 용선대는 창녕의 보물이고  절벽 끝에 앉아 묵묵히 세상을 내려다보는 모습은 많은 것을 느끼게 한다."
경상남도 창녕군 영산면 서리 139-3,,36,0,A01,A0101,A01011700,2785613,12,20211203190356,http://tong.visitkorea.or.kr/cms/resource/76/2797476_image2_1.JPG,http://tong.visitkorea.or.kr/cms/resource/76/2797476_image2_1.JPG,128.5281772356,35.4546684338,6.0,20221123104923,0,15,,연지못,,"창녕의 연지못은 선조들이 영산 고을의 화재를 예방하고 농사에도 이롭게 하기 위해 만든 저수지이다. 그 모양이 벼루 모양을 닮았다 해서 연지(硯池)라 불렸으며 영산 호국공원과 인접하여 있다. 연못 가운데 다섯 개의 섬들이 떠 있어 아름답고 그중 가장 큰 섬 두 개는 다리로 연결돼 있어 산책로를 따라 들어가 볼 수 있다. 연못을 공원화하여 해마다 유등제가 열리고 있으며 놀이터와 운동기구, 건강 지압시설 등 다양한 부대시설이 마련되어 있어 사시사철 산책이나 나들이하기 좋다. 특히 수양벚꽃이 개화하는 시기엔 관광객이 붐빌 만큼 아름다운 풍경을 연출한다. 또한 반영 샷 한 장으로 핫플레이스가 된 영산만년교가 바로 앞에 있어 연지못을 한 바퀴 돌고 만년교로 이동하는 발길이 많은 곳이다."
경상남도 창녕군 창녕읍 교리159,,36,0,A02,A0202,A02020100,2782676,12,20211129195332,http://tong.visitkorea.or.kr/cms/resource/99/2795099_image2_1.jpg,http://tong.visitkorea.or.kr/cms/resource/99/2795099_image2_1.jpg,128.4989189773,35.5461714751,6.0,20220506130903,0,15,,명덕생태수변공원,50317.0,"창녕읍에 자리한 수변공원으로 주민들이 즐겨 산책하는 코스다. 과거 농업용수 공급을 위해 만들어졌던 명덕저수지를 현대적으로 공원화시켰다. 걷기 좋은 나무 데크길은 물론 저수지에 다양한 수생식물을 심어 계절마다 다채로운 풍광을 즐길 수 있다. 저수지 가운데로 아치형의 디자인이 돋보이는 구름다리가 놓였고, 그 양쪽으로 울타리를 설치해 안전하게 수변 경치를 즐길 수 있도록 했다. 구름다리 건너 팔각정에선 잠시 걸음을 쉬어가며 이야기를 나누기에도 좋다. 이처럼 낮에도 주민들의 휴식처가 되어주는 명덕 생태 수변공원은 밤이 되면 색다른 매력을 펼쳐 보인다. 구름다리에 알록달록한 조명을 설치해 로맨틱한 야경을 선사하는 것. 아름다운 야경이 저수지에 비쳐 일렁이는 모습도 눈과 마음을 사로잡는다."
경상남도 창녕군 이방면 옥천리 756,,36,0,A02,A0205,A02050100,2774931,12,20211117003711,http://tong.visitkorea.or.kr/cms/resource/45/2774945_image2_1.JPG,http://tong.visitkorea.or.kr/cms/resource/45/2774945_image2_1.JPG,128.4015193902,35.5391538284,6.0,20221201105041,0,15,,우포출렁다리,,"우포늪은 자연 습지인 우포, 사지포, 목포, 쪽지벌과 복원습지 산밖벌로 이루어져 있다. 이 중 산밖벌은 늪을 메워 농경지로 조성한 곳을 다시 습지로 복원한 곳으로 산 밖 굼 턱진 곳의 벌이란 뜻을 가진 우포늪의 막내이다. 산밖벌은 습지복원지구와 생태관찰지구로 조성돼 있다. 산밖벌과 함께 토평천 하류에 설치된 우포출렁다리는 2016년 11월에 개통, 쪽지벌과 산밖벌을 이어주는 교량으로 우포늪의 새로운 명물로 자리 잡고 있다. 가을바람 맞으며 탐방로를 거닐다 보면 산밖벌 끝머리 제방 쪽 토평천 하류에 설치된 길이 98.8m, 보행 폭 2m의 우포출렁다리(창녕군 이방면 옥천리 756번지)가 나온다. 우포늪에는 둘레길이 잘 조성되어 있는데, 우포출렁다리와 산밖벌까지 탐방하는 9.7㎞, 3시간 30분 코스 등 다양하게 구성되어 있다."
경남 창녕군 부곡면 학포리 421,,36,0,A01,A0101,A01010500,2774824,12,20211117000839,http://tong.visitkorea.or.kr/cms/resource/36/2774836_image2_1.JPG,http://tong.visitkorea.or.kr/cms/resource/36/2774836_image2_1.JPG,128.6396723451,35.3775124855,6.0,20220411104314,0,15,,학포수변생태공원,,학포수변생태공원은 창녕군 부곡면 학포리 신포마을 낙동강 변에 있는 공원으로 4대강 조성 당시 지어진 공원이다. 사방이 확 트인 초록의 풍광은 이곳을 찾는 외지인에게 창녕의 자연을 아낌없이 전해준다. 공원이 넓고 광활하게 펼쳐져 있으며 라이더들의 명소인 낙동강 자전거길이 공원을 가로질러 간다. 자전거길뿐만 아니라 산책로도 잘 조성되어 있다. 이정표와 갈림길 표지판이 곳곳에 설치되어 있어 산책이나 자전거를 즐기기에 불편함이 없다. 시원한 강바람을 맞으며 달리기 좋아 주민들의 건강한 문화생활을 영위하는 공원으로도 널리 알려져 있다.
경상남도 창녕군 창녕읍 계성화왕산로 638,,36,0,A01,A0101,A01010900,2774811,12,20211117000311,http://tong.visitkorea.or.kr/cms/resource/18/2774818_image2_1.jpg,http://tong.visitkorea.or.kr/cms/resource/18/2774818_image2_1.jpg,128.5511151405,35.5188893927,6.0,20211209003515,0,15,,옥천계곡,50335.0,창녕의 대표 계곡인 옥천계곡은 화왕산에서 시작하여 계성으로 흘러 최종적으로는 낙동강과 만난다. 산 정상 해발 757m에서 골짜기마다 굽이굽이 흘러내린 물길로 형성된 계곡은 시원하고 장쾌한 물줄기와 화왕산 숲에서 불어오는 청량한 바람으로 여름철 피서객들의 최적 휴양지로 주목받고 있다. 주차장에서 등산로를 따라가다 보면 숲과 바위가 어우러진 계곡이 나온다. 아무 곳에나 자리를 잡고 발을 담그면 그곳이 절로 피서지가 된다. 계곡 근처에는 관룡사와 용선대라는 훌륭한 볼거리가 있어 잠시 들러보기에도 좋다.
경남 창녕군 남지읍 남지리 835-25,,36,0,A02,A0202,A02020100,2750692,12,20210928223133,,,128.4715924261,35.3847586113,6.0,20220412113948,0,15,,남지체육공원,50355.0,"남지 체육공원은 창녕군 남지읍 남지리에 위치한 공원으로 64,623㎥ 면적을 가지고 있으며, 축구장, 농구, 인라인스케이트장, 배구, 족구, 게이트볼, 씨름장 등 각종 체육시설이 잘 갖추어 있어 많은 시민들이 찾는 휴식공간이다. 남지 체육공원은 낙동강과 남강이 합류하는 지점에 위치해 있으며, 강을 따라 걷기 좋은 산책로가 조성되어 있다. 이곳에서는 영화 속에나 등장할법한 아름다운 풍경의 초록빛으로 뒤덮인 드넓은 공원을 마주할 수 있으며, 봄이 되면 노란빛으로 물든 유채꽃 군락을 볼 수 있다."
경상남도 창녕군 영산면 원다리길 42,,36,0,A02,A0205,A02050100,2714735,12,20210428032013,,,128.5296521436,35.4533102803,6.0,20220302102554,0,15,,만년교,50348.0,"창녕 영산 만년교는 마을 실개천 위에 무지개 모양으로 만들어 놓은 돌다리로, 실개천이 남산에서 흘러내린다 하여 남천교(南川橋)라고도 불린다. 
 개천 양쪽의 자연 암반을 바닥돌로 삼고 그 위에 잘 다듬어진 화강암 석재를 층층이 쌓아 무지개 모양의 홍예(虹霓)를 이루고 있다. 그 위로는 둥글둥글한 자연석을 쌓아 올리고 맨 위에 얇게 흙을 깔아 다리 위로 사람이 다닐 수 있는 길을 만들어 놓았다. 노면은 곡선을 그리며 양 끝을 길게 늘이고 있어 다리의 분위기를 한결 아늑하게 해준다. 
조선 정조 4년(1780)에 처음 쌓은 것을 고종 29년(1892)에 다시 쌓아 놓은 것으로, 지금도 마을 사람들이 통행할 만큼 튼튼하여 홍수 등에도 전혀 피해가 없다고 한다.
(출처: 문화재청)"
경상남도 창녕군 이방면 이방로 623,,36,0,A02,A0203,A02030600,2713277,12,20210407232732,http://tong.visitkorea.or.kr/cms/resource/84/2534884_image2_1.jpg,http://tong.visitkorea.or.kr/cms/resource/84/2534884_image3_1.jpg,128.3836226903,35.5777908098,,20221128165628,1,15,,산토끼 노래동산,50301.0,"창녕군 이방면 이방초등학교 뒷산에 자리한 산토끼노래동산은 동요 산토끼를 모티브로 한 체험 시설이다. 동요 산토끼는 1928년 고 이일래 선생이 창녕 이방초등학교에 재직하면서 작사, 작곡한 곡으로 지금까지도 모든 사람이 아는 국민동요다. 산토끼노래동산은 이름처럼 토끼를 주로 하는 공간을 선사한다. 토끼마을, 토끼동굴, 토끼먹이체험장 등 토끼와 관련된 다양한 체험을 할 수 있다. 주차장과 안내소가 있는 입구에서부터 다양한 체험을 즐기며 들어서면 산토끼동요관이 나온다. 산토끼의 서식환경을 살펴볼 수 있는 전시장과 이일래선생 기념관, 동요감상실, 생태환경전시관을 갖췄다. 언덕 가장 위쪽에는 근래에 완공한 작은 동물원을 운영한다.지정된 먹이를 주면서 동물과 교감할 수 있고 유리창 안 동물들의 생활을 엿볼 수 있다. 곳곳에 설치된 귀여운 조형물과 바닥에 그려진 트릭아트도 소소한 볼거리와 재미를 선사한다. 미로정원과 어린이놀이터 등 아이들이 마음껏 뛰어놀 수 있는 놀이시설과 편한 휴식을 취할 수 있는 편의시설도 마련했다. 밝고 명랑한 동요 소리가 동산 가득 울려 퍼져 남녀노소 누구나 동심으로 돌아간 듯 즐거운 시간을 만들기 좋다."
경상남도 창녕군 창녕읍 술정리,,36,0,A02,A0205,A02050200,2031654,12,20151001221712,http://tong.visitkorea.or.kr/cms/resource/60/2007460_image2_1.jpg,http://tong.visitkorea.or.kr/cms/resource/60/2007460_image3_1.jpg,128.4961916176,35.5396304965,6.0,20220930135349,2293,15,,창녕 술정리 동 삼층석탑,50324.0,"탑이 세워져 있는 창녕군 지역은 삼국시대부터 신라의 영역에 속해 있던 곳이며, 진흥왕 때부터 신라의 정치·군사상의 요지가 되었다. 탑은 2단의 기단(基壇)에 3층의 탑신(塔身)을 올린 형태로, 통일신라 석탑의 일반적인 모습이다. 기단에는 위·아래층 모두 각면의 모서리와 가운데에 기둥 모양이 새겨져 있고, 탑신 역시 몸돌의 모서리마다 기둥모양을 한 조각이 있다. 지붕돌은 수평을 이루던 처마가 네 귀퉁이에서 살짝 치켜 올라가 간결한 모습이며, 밑면에는 5단의 받침을 두었다. 1965년 탑을 해체, 복원할 당시 3층 몸돌에서 뚜껑달린 청동잔형사리용기 등의 유물들이 발견되었고, 바닥돌 주위에 돌림돌을 놓았던 구조도 밝혀졌다. 8세기 중엽인 통일신라시대에 세워진 탑으로, 위로 올라가면서 적당한 비율로 줄어드는 몸돌로 인해 충분한 안정감과 아름다움이 느껴진다. 세부적인 수법도 정교하여 경주 불국사 삼층석탑(국보)과 비길만한 기품이 있으며, 삼국시대부터 신라 영역에 속해있던 창녕의 지역적인 특성으로 볼 때, 경주 중심의 탑 건립 경향이 지방으로 확산되는 과정을 보여주고 있어 중요한 가치를 지니고 있다.   출처 문화재청"
경상남도 창녕군 고암면 우천길 111,,36,0,A02,A0201,A02010700,1959829,12,20141024182100,,,128.5155781062,35.5651890785,6.0,20220826133006,2025,15,,소곡서당,50315.0,"소곡서당은 1650년경 창건된 소곡서원이 창건 200여년 후 퇴락됨에 따라 1856년(철종 7) 당초 서원 터에서 500여 미터 떨어진 북쪽 산기슭에 지금의 소곡서당을 건축하고 청민공(淸敏公) 노변소(盧抃素), 만취공(晩翠公) 참봉(參奉) 노침(盧沈), 절효공(節孝公) 진사(進士) 노홍언(盧弘彦) 3인을 합향(合享)하다가 대원군의 서원 훼철시 피해를 입었다."
경상남도 창녕군 대지면 모산1길 109-36,(대지면),36,0,A02,A0201,A02010700,1959579,12,20141024012827,,,128.4689960906,35.5650438011,6.0,20220927160141,1674,15,,물계서원,50316.0,"1712년(숙종 38) 지방 유림의 공의로 성송국(成松國), 성삼문(成三問), 성담수(成聃壽), 성수침(成守琛), 성운(成運), 성제원(成悌元), 성혼(成渾), 성윤해(成允諧) 등의 학문과 덕행을 추모하기 위해 창건하여 위패를 모셨다. 그 뒤 성여환(成汝完), 성희(成熺), 성수경(成守慶), 성문준(成文濬), 성람(成灠), 성여신(成汝信) 등을 추가 배향하고 1814년(순조 14) 성안의(成安義), 1857년(철종 8)에 성준득(成準得)을 추가 배향하였다. 선현배향과 지방교육의 일익을 담당하여 오던 중 1868년(고종 5) 대원군의 서원철폐령으로 훼철되었으나 1989년 서원을 복원하고1997년에는 영의정 문경공(文景公) 성석린(成石璘), 진사 성언충(成彦忠)을 추가배향하였다."
경상남도 창녕군 이방면 이방로 565-5,,36,0,A02,A0201,A02010700,1959569,12,20141024011011,,,128.3848588774,35.570999932,6.0,20220908102821,1897,15,,동산서당,50301.0,"사간(司諫) 노선경(盧善卿), 증 이조참판(贈 吏曹參判) 노극홍(盧克弘), 월촌 노세후(月川 盧世厚), 증 이조참의(贈 吏曹參議) 노해(盧垓)의 학덕을 기리기 위해 1829년(순조 29)에 창건하였다. 사액은 받지 못하였으며, 고종 5년(1868)에 훼철되었다. 그 후 55년이 지난 1923년에 후손과 사림들이 그 유허지에 집을 세워 동산서당이라 이름 하였다. 그 齋는 재성재(存誠齋), 당은 고경당(居敬堂), 문은 유의문(由義門), 누는 구인루(求仁樓)이다."
경상남도 창녕군 고암면 창밀로 506-30,,36,0,A02,A0201,A02010700,1959500,12,20141023220334,,,128.5249129861,35.5802403282,6.0,20211008195126,1597,15,,구니서당,50315.0,"지금으로부터 약 500년 전에 이곳 고암면 계상리 1160번지에 자리 잡은 김굉필(金宏弼)의 둘째 아들인 김언상(金彦庠)의 후손들이 약 300년 전에 봉선소로 사용하기 위해 건립되었다. 그 후 묘각(廟閣) 또는 서당으로 이용되어 오다가 1866년(고종3) 사림에서 김언상을 비롯한 3세 4현을 모시고 서원건립을 결의하고 건립하였으나, 1868년 대원군의 서원 철폐령으로 철폐되었다가 1916년 규모를 넓혀 지금의 정당을 중수하였고, 사현사(四賢祠)는 1943년에 창건한 건물을 1986년부터 9년에 걸쳐 동․서재 및 문루와 함께 중창하였다"
경상남도 창녕군 고암면 월미상월길 115,(고암면),36,0,A02,A0201,A02010700,1959487,12,20141023202737,,,128.5223079142,35.5709107777,6.0,20221122165644,1491,15,,관산서당,50315.0,"1620년(광해군 12)에 지방유림의 공의로 정구(鄭逑), 강흔(姜訢), 안여경(安餘慶)의 학문과 덕행을 추모하기 위해 창건하여 위패를 모셨다. 1711년(숙종 37)에 관산이라고 사액되어 사액서원으로 승격되었으며, 선현배향과 지방교육의 일익을 담당하였다. 그 뒤 흥선대원군의 서원철폐령으로 1868년(고종 5)에 훼철되었다."
경상남도 창녕군 부곡면 온천중앙로 77,,36,0,A02,A0202,A02020200,1957667,12,20141021012622,http://tong.visitkorea.or.kr/cms/resource/25/2687425_image2_1.jpg,http://tong.visitkorea.or.kr/cms/resource/25/2687425_image3_1.jpg,128.5955105176,35.4438403251,6.0,20220613164307,6139,15,,부곡온천 관광특구,50365.0,"부곡온천은 옛날부터 가마솥처럼 생겼다고 해서 부곡(釜谷)이라 불렸다. 전해오는 이야기에 따르면 마을에 뜨거운 물이 솟아나는 우물이 있어 옴 환자와 나병 환자들이 떼지어 몰려와 치료를 했다고 한다.부곡온천은 국내 유수의 온천들 중에서도 단연 최고의 수온인 78℃를 유지한다. 부곡온천 관광특구에는 호텔과 콘도, 골프장, 온천 분수대 등 온천을 기반으로 한 종합 휴양 시설과 다양한 온천장이 들어서 있다. 인근에는 진달래로 유명한 화왕산과 창녕 우포늪 등이 있어 다양한 여행 스케줄을 짤 수있다.

 부곡온천 관광특구 현황
1) 범위 : 경상남도 창녕군 부곡면 거문리, 사창리, 부곡리 일원
2) 면적 : 4,819,000㎡
3) 관광특구 지정일 : 1997년 1월 18일"
경상남도 창녕군 도천면 영산도천로 11-14,,36,0,A02,A0201,A02010800,1622923,12,20120505025705,,,128.5064415854,35.4055846774,6.0,20220330171542,17781,15,,관음사(창녕),50350.0,"일제강점기 때 창건되었으며 '괌음당'이라고도한다. 6.25때 전소하여 새로이 불사하여 지금을 모습을 갖추고 있다. 도지정 문화재자료 도천삼층석탑, 관음사 석등, 미륵존불상, 향토문화재 금동불상과 부도가 있다. 법화종으로 신도수는 700800명 정도이다.  구성 : 천불전, 설법보전, 산령각  도천삼층석탑  문화재 지정현황 : 도지정 문화재자료 제작 연대는 고려시대로 추정되며, 임진왜란으로 폐허가 된 옛 보광사지에 있었던 것을 1928년 관음사로 이전하였다. 원래는 삼층석탑으로 추정되나 현존상태는 기단부의 하대와 상대 갑석 일층의 옥신과 옥개석 2개가 남아 있을뿐, 상륜부는 물론 옥개서 1점, 옥신 2점, 기단부의 상대, 중대 등은 결실된 상태로서 높이 162㎝이다.  관음사석등  문화재 지정현황 : 도지정 문화재자료 통일신라말기고려 초기 것으로 추정되며, 불을 밝히기 위해 만든 것으로 삼국시대부터 법당앞에 건립했던 것이다. 보광사지의 유물로 1928년 5월 일본인 고가시게루가 소장하고 있던 것을 관음사로 옮겨 보존하게 되었다. 기중은 흰색이고, 등은 푸른색의 화강암이며, 등의 상부 무가 섬세하고 아름답다. "
경상남도 창녕군 영산면 유생길 19,(영산면),36,0,A02,A0201,A02010700,1622899,12,20120505023522,,,128.5350708949,35.4613261428,6.0,20221104132012,16419,15,,영산향교,50339.0,"조선 중종 때 현유(賢儒)의 위패를 봉안, 배향하고 지방민의 교육과 교화를 위하여 창건되었다. 창건연대는 미상이며, 임진왜란 때 소실되었다가 1604년(선조 37) 중건하였다. 1959년 대성전과 명륜당을 중수하였다. 현존하는 건물로는 6칸의 대성전, 각 5칸의 동재(東齋)와 서재(西齋), 7칸의 명륜당, 내삼문(內三門) 등이 있다. 대성전에는 5성(五聖), 송조4현(宋朝四賢), 우리나라 18현(十八賢)의 위패를 봉안하고 있다. 조선시대에는 국가로부터 토지와 전적·노비 등을 지급받아 교관 1명이 정원 30명의 교생을 가르쳤으나, 갑오개혁 이후 신학제 실시에 따라 교육적 기능은 없어지고 봄·가을에 석전을 봉행하며, 초하루·보름에 분향하고 있다. 이 향교는 경상남도 유형문화재 제213호로 지정되어 있으며, 소장 전적 가운데 『경남유안(慶南儒案)·『영산향안록(靈山鄕案錄)·『율농실기(栗儂實記)·『창녕현지(昌寧縣誌) 등은 이 지방 향토사연구에 좋은 자료가 된다. 향교의 운영은 전교(典校) 1명과 장의(掌議) 수 명이 담당하고 있다."
경상남도 창녕군 유어면 유어장마로 415,,36,0,A02,A0201,A02010700,1622793,12,20120505013255,,,128.4400256903,35.4894934617,6.0,20211008195800,15373,15,,광산서당,50305.0,"조선 시대 병자호란 때 창녕 일대의 의병을 모아 남한 산성을 포위한 청국병을 격퇴하기 위하여 종군한 양휜의 충의를 기리기 위하여 후손들이 세운 것이다. 후학을 가르치기도 했던 이 곳은 서고까지 겸비한 건물로 ""崇禎紀元 戊辰後 正回乙亥正月三十日 酉時 竪柱 二月二十日 酉時上樑""이란 묵서가 있어 1935년에 세운 것임을 알 수 있다."
경상남도 창녕군 장마면,유리 산 9,36,0,A02,A0201,A02010700,1622783,12,20120505012753,,,128.4833503727,35.4634777369,6.0,20220817103942,15892,15,,창녕지석묘,50341.0,"지석묘는 청동기시대의 대표적인 무덤으로 고인돌이라고도 부르며, 주로 경제력이 있거나 정치권력을 가진 지배층의 무덤으로 알려져 있다. 우리나라의 고인돌은 4개의 받침돌을 세워 지상에 무덤방을 만들고 그 위에 거대하고 평평한 덮개돌을 올려놓은 탁자식과, 땅속에 무덤방을 만들고 작은 받침돌을 세운 뒤 그 위에 덮개돌을 올린 바둑판식으로 구분된다. 경상남도 창녕시 장마면에 있는 이 고인돌은 바둑판식으로 원래 7기의 고인돌이 북두칠성 모양으로 무리지어 있었는데, 지금은 파괴되어 2기만 남아 있다.1기는 덮개돌이 있고 그 밑에 평평한 판석을 이용하여 길이 1m, 너비 0.3m의 돌상자 형태로 무덤방을 만들었다. 2기는 덮개돌은 없어졌고 하부구조만 남아있다. 길이 0.67m, 너비 0.27m의 돌상자 형태로 무덤방을 만들고 벽면과 바닥을 정연하게 쌓아 그 위에 2중으로 덮개돌을 올려 놓았다. 이 고인돌은 구릉의 정상부에 위치하고 있으며 구릉 밑이나 평지에 있는 고인돌과는 다른 입지조건을 보여주는 것으로 학술상 가치가 크다."
경상남도 창녕군 창녕읍,,36,0,A02,A0205,A02050200,1051766,12,20100630031251,http://tong.visitkorea.or.kr/cms/resource/12/1204612_image2_1.jpg,http://tong.visitkorea.or.kr/cms/resource/12/1204612_image3_1.jpg,128.4941027973,35.5438355398,6.0,20221004141958,28898,15,,창녕 인양사 조성비,50317.0,"일명 인양사(仁陽寺) 비상(碑像)이라고도 하는데, 인양사의 금당(金堂) 후편에 세워진 것으로 해석되고 있다. 이 일대의 전답에서 신라시대부터 고려시대로 인정되는 문양의 기와 조각이 많이 발견되고 있어 당시에는 대가람이었던 것으로 추정된다. 비각 안에 머리가 결실되고 없는 높이 55㎝가량의 석조좌상 1軀가 안치되어 있었는데, 지금은 창녕박물관에서 보관되고 있다.또 비석도 한국전쟁 때 피해를 입어 서쪽 편에 총탄흔적이 있고 북쪽 편 비상에도 총탄 흔적이 뚜렷이 생겼다. 귀부와 이수 대신에 장방형의 대석과 옥개형의 개석을 얹은 특이한 모양의 비(碑)로 불사(佛事)조성에 관하여 기록한 특수한 비석이다. 인양사(仁陽寺)를 비롯하여 이와 관련있는 여러 사찰의 범종, 탑, 불상, 금당, 요사등의 조성연대와 소요된 양식에 관하여 낱낱이 기재하였다.  앞면과 양측면은 비문(碑文)이 새겨져 있고, 뒷면 전부에는 우아한 기법으로 승상이 양각되어 있다. 앞면의 비문(碑文)은 비의 제목없이 10행으로 각(各) 행(行) 28자(字)를 자경(字徑) 4㎝의 육조체(六朝)로 새겼다. 비문(碑文)은 「조선금석총람(朝鮮金石總覽)」에 실려 있다. 뒷면의 조상(彫像)을 지장보살(地藏菩薩像)이라고도 하고, 인양사 조관(造管)의 공로자인 한 고승의 조상(彫像)이라고도 하는 두 가지 설이 있는 비(碑)이다. 금석문(金石文)으로서뿐만 아니라 연대가 확실한 불상 조각으로서도 귀중한 유물이다.  문화재 정보 지정번호 : 보물 지정연도 : 1963년 1월 21일 시대 : 통일신라 크기 : 높이 1.58m, 폭 48cm, 두께 18cm 분류 : 비"
경상남도 창녕군 대합면 닭계1길 12,,36,0,A02,A0203,A02030100,569196,12,20080603005159,http://tong.visitkorea.or.kr/cms/resource/84/2488884_image2_1.jpg,http://tong.visitkorea.or.kr/cms/resource/84/2488884_image2_1.jpg,128.4372986046,35.5749726591,6.0,20220603100345,28133,15,,창녕 우포가시연꽃마을,50309.0,"태고의 신비를 간직한 우포늪 탐방과 더불어 생태체험으로 사랑받는 창녕 우포가시연꽃 농촌체험 휴양마을은 천혜의 보고를 지닌 천연기념물 가시연꽃 군락지인 사지포 가까이 있는 마을로서 2006년 농촌전통테마, 2011년 도농교류촉진법에 의한 휴양마을로 선정, 살고싶은 마을 100곳에 속하는 마을로서, 고려말 출신 조민수 장군의 얼이 깃들어 있는 묘소가 있고, 연간 8,000여명에 달하는 수많은 방문객들이 찾아와 우포늪 탐방과 더불어 자연자원을 활용한 다양한 생태체험이 가능한 마을이다."
