addr1,addr2,areacode,booktour,cat1,cat2,cat3,contentid,contenttypeid,createdtime,firstimage,firstimage2,mapx,mapy,mlevel,modifiedtime,readcount,sigungucode,tel,title,zipcode,overview
경상남도 함안군 군북면 하림리,,36,,A01,A0101,A01010400,2891725,12,20221031173944,,,128.2932226898,35.2536395921,6.0,20221103092912,0,19,,방어산,52068,"방어산은 함안군 군북면과 진주시 지수면을 경계 짓는 산으로 웅산이라고 불려지기도 했다.
방어산은 괘방산(451m)과 능선으로 연결되어 있어 두 산을 함께 오르는 등산로가 있다. 웅산이라고도 불렀으며, 정상에 서면 지리산이 아득히 보이고, 동남쪽에는 여항산이 보인다. 정상에는 옛날 성의 자취가 남아 있다. 전설에 따르면 양쪽 겨드랑이에 날개가 달려 날아다니며, 300근짜리 활을 쏘는 묵신우(墨神祐)라는 장군이 병자호란 때 성을 쌓고 성문을 닫은 채 한 달을 버티다가 비로소 적을 물리쳤다고 한다. 그때 장군이 타던 말의 발굽 핏자국이 아직도 바위에 선연하다. 산의 7부 능선에는 보물로 지정된 높이 5m의 거대한 방어산 마애불이 있으며, 산은 높지 않으나, 군데군데 암반이 많고 능선이 제법 굴곡되어 있어 산행의 즐거움을 느낄 수 있다.

산행은 방어산만 오르는 코스와 괘방산과 함께 오르는 코스가 있다. 방어산만 오르려면 하림리 낙동마을 뒤쪽에서 시작하여 마애사, 방어산 마애불을 거쳐 정상에 오른 후 군북면 박곡리 구 남강휴게소로 하산하면 2시간 정도 소요된다. 다른 코스는 하림마을에서 마당바위를 거쳐 정상으로 가는 등산로가 있는데, 정상에서 괘방산까지 산행하려면 방어산고개와 전망대, 괘방산을 거쳐 어석재로 하산하면 5시간 30분 정도 소요된다. 정상은 큰 바위로 되어 있어 장군대라고 부르기도 하며, 이곳에서 50m 아래와 200m 아래 지점에는 마당바위와 흔들바위가 각각 있다. 흔들바위는 높이 8m, 폭6.5m의 끄덕바위라고도 부르며, 기울어진 쪽으로 부자가 난다는 전설이 있다.
(출처 : 함안문화관광)"
경상남도 함안군 산인면 입곡리,1126-1,36,,A02,A0202,A02020700,2865500,12,20221011172356,http://tong.visitkorea.or.kr/cms/resource/81/2865481_image2_1.JPG,http://tong.visitkorea.or.kr/cms/resource/81/2865481_image3_1.JPG,128.4457758312,35.2598194219,6.0,20221011172407,0,19,,입곡문화공원,52072,"함안군 산인면 입곡리에 있는 입곡 문화공원은 입곡군립공원 공설운동장 안 골짜기에 있다. 연못, 산책로, 무늬화단, 유리온실, 미로원, 박제 전시관 등 볼거리가 많다. 유리온실에는 먼나무, 녹나무, 굴거리나무, 하귤나무 등의 교목류를 비롯해 관음죽, 멀꿀, 중대 가리나무, 탐라산수국 등의 관목류와 아름다운 꽃들이 심겨 있다. 야생화 꽃밭에는 원추리, 상사화, 기린초, 쑥부쟁이, 꽃창포, 수선화 등이 식재되어 있어 사계절 내내 다양한 야생화를 볼 수 있다. 입곡 문화공원 입구에는 44종의 멸종 위기에 처한 동물의 모습을 전시해 놓은 박제 전시관도 있고, 미로공원도 있어 가족, 친구, 연인과 함께 즐거운 시간을 보낼 수 있다. 근처에 문화재로 지정된 무진정도 가까이 있어 함께 둘러보기 좋다.
 반려동물 동반 가능(목줄 착용 및 배변도구 지참)"
경상남도 함안군 가야읍 왕궁1길 38-20,,36,0.0,A01,A0101,A01010700,2754745,12,20211008000013,http://tong.visitkorea.or.kr/cms/resource/15/2755215_image2_1.JPG,http://tong.visitkorea.or.kr/cms/resource/15/2755215_image2_1.JPG,128.3949658344,35.2805661724,6.0,20221109163639,1,19,,함안연꽃테마파크,52035,"함안 연꽃 테마파크는 옛 가야 지구의 천연 늪지를 활용해 만든 자연 친화적인 테마공원이다. 공원의 탄생 배경에는 700여 년 세월을 거슬러 올라가는 이야기가 있다. 2009년 5월 함안 성산산성(사적 제67호)에서 연꽃 씨앗이 출토되었는데, 연꽃 씨앗은 연대 추정 상 700여 년 전 고려 시대 것으로 밝혀졌다. 이듬해 2010년에 함안박물관에서 파종한 씨앗이 꽃을 피우는 기염을 토하며 또 한 번 세상을 놀라게 했다. 함안군은 이 연꽃의 이름을 아라가야라는 함안 역사에서 따와 아라홍련이라 지었다. 그리고 아라홍련의 부활을 기념해 연꽃을 주제로 한 공원을 조성한 것이 바로 함안 연꽃 테마파크다. 연꽃 주제 공원답게 홍련, 백련, 수련, 가시 연까지 다양한 연꽃을 감상할 수 있다. 특히 함안에서만 볼 수 있는 아라홍련도 있다. 연꽃의 개화 시기는 7월부터 8월까지이며, 연꽃 사이로 징검다리가 있어 가까이에서 꽃을 감상할 수 있다. 또한 곳곳에 포토존과 정자 쉼터가 마련되어 있어 여유 있게 즐길 수 있다."
경상남도 함안군 가야읍 함안대로 619-1,,36,0.0,A02,A0202,A02020700,2754741,12,20211007235747,http://tong.visitkorea.or.kr/cms/resource/77/2755077_image2_1.jpg,http://tong.visitkorea.or.kr/cms/resource/77/2755077_image2_1.jpg,128.4012763189,35.2833215314,6.0,20220411174608,2,19,,함주공원,52036,"함주공원은 함안 군민들의 건강증진과 정서적 함양을 위한 공간으로 계절 따라 변하는 풍경을 오감으로 느낄 수 있는 문화 체육공원이다. 기존의 함안공설운동장 인근 부지에 추가로 다목적 잔디 구장을 만들어 지역 스포츠인들의 요람이 되고 있다. 여름에는 물놀이장으로 활용되는 어린이 놀이터와 어린이를 위한 작은 도서관도 있다. 다목적구장에는 넓은 평상이 구비되어 있어 가족 나들이하기에 안성맞춤이다. 특히 야간에 알록달록 화려한 빛을 내는 하트 터널은 인기 만점이다. 곳곳에 정성 들여 가꾼 소나무의 모습도 볼 수 있다. 공원 안쪽으로 걸어 들어가면 작은 돌다리가 있는데, 돌다리 밑으로 연못과 작은 정자가 있어 소나무와 자연스럽게 조화를 이룬다. 정자를 지나면 다양한 조각 작품이 전시되어 있어 조각 작품들을 감상하며 잠시 쉬어갈 수도 있다."
경상남도 함안군 여항면 주서1길 50-1,,36,0.0,A01,A0101,A01011800,2754715,12,20211007233140,http://tong.visitkorea.or.kr/cms/resource/75/2755175_image2_1.JPG,http://tong.visitkorea.or.kr/cms/resource/75/2755175_image2_1.JPG,128.4260345512,35.2062250886,6.0,20211008223001,0,19,,봉성저수지,52073,"봉성저수지는 경남 함안군의 자연 명물인 여항산 아래에 있다. 이곳은 함안 여항산 둘레길의 주요 지점이며, 저수지 주변에 산책로를 조성하여 방문객과 주민들에게 다양한 즐길 거리를 제공하고 있다. 봉성저수지 둘레길은 총 2.9km의 거리로 약 1시간 정도 소요된다. 저수지를 따라 걷다 보면 저수지의 시원한 풍경을 볼 수 있고 숲길이 있어 산림욕 하기에도 좋다. 둘레길을 걷다 보면 포토존이 나오는데 여항산 자락과 여항면의 집들이 모여있는 정겨운 풍경을 담을 수 있다. 여항면에서는 마을 조성 사업을 계속 펼치며 야간관광객 안전 및 볼거리 제공을 위해 봉성저수지 데크길에 경관용 태양광 조명 등을 설치했고, 수국 꽃길에 솟대 60기와 소원 기원 목간 300개 등을 설치하는 등 '금계천 솟대 거리'를 조성하기도 했다. 조명이 설치된 저수지의 야경이 특히 아름답다."
경상남도 함안군 법수면 강주4길 37,,36,0.0,A02,A0203,A02030100,2745423,12,20210915192809,,,128.3331507132,35.3213521361,6.0,20220923092913,0,19,,강주 해바라기 마을,52059,"함안군 법수면에 소재하고 있는 강주 마을은 주민들이 힘을 합쳐 자체적으로 해바라기 꽃밭을 조성했다. 전체 해바라기 식재면적은 법수면 강주리 주변 48,000㎡에 이른다. 또한 전통과 문화를 부흥시켜보자는 취지로 축제 한마당도 함께 펼쳐진다."
경상남도 함안군 법수면 악양길 43,,36,0.0,B01,B0102,B01020100,2713259,12,20210407222825,http://tong.visitkorea.or.kr/cms/resource/27/2608027_image2_1.jpg,http://tong.visitkorea.or.kr/cms/resource/27/2608027_image3_1.jpg,128.3870874192,35.33002991,6.0,20220421170808,0,19,,함안경비행장 (성우항공산업),52057,함안에서 경비행기로 하늘 드라이브를 즐기는 것은 특별한 경험이 된다. 개양귀비가 알록달록하게 수놓은 악양둑길 비행장에 모인 경비행기를 보는 것만으로도 가슴은 두근거린다. 부르릉 소리를 내며 프로펠러가 돌고 땅 위를 미끄러지던 경비행기가 하늘로 날아오른다. 비행하는 10여 분간 하늘에서 함안의 아름다운 풍경을 두 눈에 담을 수 있다.
경상남도 함안군 칠서면 삼칠로 1235-50,,36,0.0,A01,A0101,A01010500,2712922,12,20210401222018,,,128.5092306571,35.3898253912,6.0,20220426173139,0,19,,강나루생태공원,52004,"낙동강을 끼고 광활하게 펼쳐진 함안 강나루생태공원은 봄이 되면 넓은 들판에 청보리가 펼쳐진다. 생태공원의 청보리는 함안 6경에 속해 있을 정도로 장관이다. 또한 강나루생태공원 내에는 오토캠핑장이 조성되어 있는데 풍요로운 여가생활을 위해 함안군 공공 야영장이다. 캠핑장 외에도 산책로, 자전거도로, 축구장, 농구장, 인라인 스케이트장 등 체육시설이 마련되어 있다. 작약집단지가 있고 곳곳에 포토존이 마련되어 있어서 사랑하는 사람들과 즐거운 시간을 보낼 수 있다.

(출처: 함안군청)"
경상남도 함안군 대산면 하기2길 208-49,,36,0.0,A01,A0101,A01010500,2663204,12,20200711000614,,,128.3979695152,35.340567809,,20220826113331,0,19,,악양생태공원,52012,"남강의 수려한 자연경관과 더불어 전국 최장 길이의 둑방과 주변 수변 및 습지와 연계하여 자연친화적인 문화공간으로 조성하였으며, 어린이 놀이시설, 야외공연장, 방문자센터 등의 시설이 마련되어 있다. 또한 다양한 야생화 및 핑크뮬리 식재로 볼거리를 제공하여 자연속에서 힐링을 원하는 탐방객을 맞이하고 있다."
경상남도 함안군 산인면 입곡공원길 225,,36,0.0,A01,A0101,A01010500,2652451,12,20200414015025,,,128.4479060644,35.2648800029,6.0,20220713161530,1,19,,입곡 저수지 드라이브길,52072,"함안군 산인면에는 뱀이 기어가듯, 구불구불 흐르는 입곡저수지가 있다. 저수지를 중심으로 왼편에는 깍아지른 절벽에 우거진 송림이, 오른편으로는 완만한 경사지에 활엽수림과 침엽수림이 멋진 조화를 이룬다. 크고 작은 산봉우리들이 저수지를 중심으로 협곡을 이루고 있는 이곳에는 수려한 자연풍광과 함께 전설을 간직하고 있는 형형색색의 바위와 기암절벽이 그대로 보존돼 있다. 입곡저수지 주변을 도는 드라이브 코스는 신비로움과 자연 속 색다른 휴식과 여유를 제공한다.   위치 : 함안군 산인면 입곡리 11811"
경상남도 함안군 가야읍 상검길 22-35,(가야읍),36,0.0,A02,A0201,A02010700,1960083,12,20141024235033,http://tong.visitkorea.or.kr/cms/resource/22/2768222_image2_1.jpg,http://tong.visitkorea.or.kr/cms/resource/22/2768222_image2_1.jpg,128.424919137,35.2667710412,6.0,20220829142853,2233,19,,황곡서원,52049,"황곡서원은 1633년(인조 11) 창건하였으며 당초 검계(儉溪:여항천)에 검암정사(儉岩精舍)를 짓고 학문을 연구할 때 원근각지(遠近各地)에서 준수한 선비들이 경전(經典)을 가져와 가르침을 청하였다. 이에 따라 후진양성을 위해 황곡서당을 중수하여 황곡서원으로 명칭을 변경하였다. 1871년(고종 8) 음력3월20일 서원철폐령(書院撤廢令)에 의하여 훼철되었다. 1981년 다시 복원･정비하였으며, 함안향교 유림 및 각 문중대표 주관으로 낙성고유식을 거행하였다. 건물의 공간적인 구성은 풍수지리학적 지형지세에 따라 길지(吉地)위에 사당(祠堂)서원(書院)협문(夾門) 등이 배치되었다."
경상남도 함안군 칠서면 공단북안길 66,,36,0.0,A02,A0201,A02010700,1960080,12,20141024234432,,,128.4727314565,35.3758151946,6.0,20221007133517,2647,19,,홍포서원,52001,"홍포서원은 1782년(정조 6)에 윤환(尹桓), 윤자당(尹子當), 윤지(尹志), 윤석보(尹碩輔), 윤탁연(尹卓然) 등 다섯 사람을 추향하기 위하여 창건한 서원이다. 1857년에 개수(改修)하였으며 당시는 봄, 가을 일 년에 두 번 향사(享祀)를 올렸다. 1868년(고종5)에 훼철되었다가 광복 후 1974년에 복설되었으며, 1980년 7월에 현재 위치인 계내 수곡 상포재(上浦齋) 앞에 홍포서원을 중건하게 되었다."
경상남도 함안군 칠서면 청계1길 116-12,(칠서면),36,0.0,A02,A0201,A02010700,1960045,12,20141024230530,,,128.4951946024,35.3304762594,6.0,20220926181410,1717,19,,청계서원(함안),52014,"청계서원은 이삼로(李三老), 이시분(李時馩) 두 사람의 충정과 행적을 추모하기 위하여 1670년(현종 11)에 창건된 서원이다. 그러나 대원군의 서원훼철령에 의해 1868년(고종 5)훼철되었다. 그 후 1981년에 다시 건립하여 3월 10일에 향례를 행하고 있다."
경상남도 함안군 가야읍 신암로 209,,36,0.0,A02,A0201,A02010700,1959878,12,20141024190828,,,128.3870865034,35.2606321607,6.0,20220831133412,1622,19,,신암서원,52043,"신암서원은 함안군 가야읍 신음리에 있었던 서원이다. 1780년(정조 4)에 안관(安灌)을 향사하기 위하여 사(祠)와 서원강당이 건립되고 1784년(정조 8)에 승원(昇院)하였다. 1823년(순조 23)에 강당을 이건하고 1850년(철종 1)에 두 번째 중건을 행하였으나 1868년(고종 5)에 대원군의 서원철폐령으로 훼철되었다. 한동안 복원하지 못하였으나, 1990년 3월 신암서원복원추진위원회를 결성하였다. 그리하여 향내 유림의 지원과 후손들의 노력으로 1992년 10월에 착공하여 1993년10월 23일에 준공하였다."
경상남도 함안군 칠원읍 유원1길 32,(칠원읍),36,0.0,A02,A0201,A02010700,1959820,12,20141024180341,,,128.4918901565,35.3000490663,6.0,20220329110435,1251,19,,상봉서원,52019,"상봉서원은 1696년(숙종 22)에 황협(黃悏, 황열(黃悅) 등 8현을 추향하기 위하여 칠원면 유원리에 설립한 서원이다. 1868년(고종 5)에 서원훼철령으로 훼철되자 용산서당을 중건하여 석채례(釋菜禮)를 지내다가 1935년 상봉서당을 용산사(龍山祠)의 옛 터에 중건하여 석채례를 속행하였다. 광복 후 1984년 사림과 후손의 협의 하에 서원으로 중건하고 1985년에 용산사를복원하여 황협과 황열 두 사람을 배향하게 되었다."
경상남도 함안군 여항면 두곡길 145,(여항면),36,0.0,A02,A0201,A02010700,1959573,12,20141024011835,,,128.4552903236,35.206267278,6.0,20220420163206,972,19,,두릉서원,52073,두릉서원은 1832년(순조 32)에 임진왜란 때 창의 수훈한 안덕(安悳)을 향사하기 위하여 창건되었다. 처음에는 순흥의 용연서원에서 향사하고 있었으나 1832년(순조 32) 안덕의 묘소가 있는 두릉에 사원(祠院)을 지어 옮겨 향사하게 되었다. 1868년(고종 5)에 훼철되었다. 그 후 1930년 후손들이 그 옛 터에 서당으로 중건하였다.
경상남도 함안군 함안면 파수북길 35-36,,36,0.0,A02,A0201,A02010700,1959552,12,20141024003258,,,128.4024857406,35.2387571193,6.0,20220329132158,1490,19,,도계서원,52052,"도계서원은 군 서쪽 10리 지점인 파수리 원촌동에 위치하고 있었으며 이숙(李潚), 이휴복(李休復), 박진영(朴震英), 조익도(趙益道) 등 네 사람을 향사하기 위하여 1780년(정조 4)에 창건되었다. 그 후 1871년 대원군의 서원 철폐령에 의해 훼철되었는데 현재 원촌마을에 거주하는 이양숙 씨 주택 부근으로 추정된다. 유허비만 남아있다."
경상남도 함안군 군북면 소포5길 82,,36,0.0,A02,A0201,A02010700,1959521,12,20141023225036,,,128.3490671625,35.2773934795,6.0,20220831113559,1638,19,,남강서원(함안),52063,"구국공신 충열공(忠烈公) 이방실(李方實)장군의 위패를 모신 사당이다. 이방실 장군의 뜻을 기리기 위해 1842년(헌종 8) 후손들이 남강사(南岡祠)를 건립하여 매년 제를 지냈으나, 고종 때 훼철되어 이를 안타깝게 여기던 후손들이 1944년 옛 터에 복원하였다. 그 후 1998년 정부보조금으로 충렬사와 남강서원을 중건하여 현재까지 장군의 위패를 모시고 있다."
경상남도 함안군 칠원읍 무기1길 33,(칠원읍),36,0.0,A02,A0201,A02010700,1959515,12,20141023223724,,,128.5390305031,35.2990139264,6.0,20221107134501,1385,19,,기양서원,52026,"기양서원은 1701년(숙종 27)에 주세곤(周世鵾), 주선원(周善元), 주각(周珏), 주재성(周宰成), 주도복(周道復) 등 다섯 사람을 추향하기 위하여 함안군 칠원면 무기리에 창건되었다. 고종 5년(1868) 훼철되었다가 연못 남쪽에 있는 충효사(忠孝祠)는 광복 후 1971년에 중건되었다. 본래의 자리는 서원 터만 남아있다. 현존 무기연당의 동북쪽 뒤편이다. 무기연당 내에는 연못을 중심으로 동서남북 방향에 풍욕루(風浴樓), 창정각(彰幀閣), 충효사, 하환정(何煥亭)이 위치하고 있다."
경상남도 함안군 칠북면 영동2길 18-31,,36,0.0,A01,A0102,A01020100,702511,12,20090303195708,http://tong.visitkorea.or.kr/cms/resource/94/724894_image2_1.jpg,http://tong.visitkorea.or.kr/cms/resource/94/724894_image3_1.jpg,128.5314191715,35.3318350969,6.0,20220720101204,21514,19,,함안 영동리 회화나무,52016,"함안군 칠북면 영동리 901번지 내 위치한 회화나무는 오랜 세월동안 조상들의 관심과 보살핌 속에 자라왔으며, 문화적. 생물학적 자료로서 가치가 높아 천연기념물로 지정하여 보호하고 있다. 회화나무의 나이는 500년 정도로 추정되며, 나무의 크기는 높이가 26m, 가슴높이 둘레가 5.82m, 뿌리 근처의 둘레가 8.45m, 가지 밑의 높이가 4m, 가지의 길이는 동쪽이 9.6m, 서쪽이 12.76m, 남쪽이 11.00m, 북쪽이 12.00m이다. 1482년 광주 안씨의 17대조이며 성균관 훈도를 지낸 안여거가 영동리에 정착할 때 심었다고 전하여 온다.   영동리에는 장춘사란 절이 있어서 주변의 아름다운 단풍으로 잘 알려져 있는 곳의 하나이다. 옛날에는 뿌리 근처에서 수액이 많이 흘렀다. 이것을 속병 치료에 좋다고 한다. 마을사람들은 이 나무가 마을을 지켜주는 신성한 나무라고 믿고 있으며, 매년 음력 10월 1일에는 소나 돼지를 잡아놓고 동제를 지내왔다."
경상남도 함안군 함안면 함안대로 105-2,(함안면),36,0.0,A02,A0205,A02050200,702392,12,20090303194943,http://tong.visitkorea.or.kr/cms/resource/68/724668_image2_1.jpg,http://tong.visitkorea.or.kr/cms/resource/68/724668_image3_1.jpg,128.4209701606,35.241498811,6.0,20221004153057,17136,19,,함안주리사지사자석탑,52051," 통일신라시대의 석탑, 주리사지 사자석탑   함안 주리사지 사자석탑은 함안면 북촌리 10023번지 함성 중학교에 있는 통일신라시대의 석탑이다. 원래 여향면 주서리 주리사터에 있는 것을 일제강점기 때 면사무소로 이전하였다가, 광복 후 다시 이곳으로 옮겨온 것이다. 기단(基壇)에 네 마리의 사자를 배치한 것이 일반 석탑과는 다른 독특한 모습이어서, 바닥 돌 위에 얹힌 지붕모양의 돌 위로 네 마리의 사자를 올리고 그 위로 5층으로 보이는 탑신(塔身)을 쌓았는데, 탑신의 몸돌 하나가 없는 상태이다. 3층 혹은 5층일 것으로 추정되는 이 탑의 정확한 모습은 알 수 없으나, 구례 화엄사 사자삼층석탑, 회양 금장암지 사자 삼층 석탑, 제천 빈신사지 사사자석탑 등 비슷한 양식의 탑과 비교해 볼 때, 네 마리의 사자가 포함된 기단부가 있었을 거라고 추측된다.   사자는 발을 가지런히 모으고 등을 맛댄 채 앞을 보고 앉아 있는 모습으로, 조각은 단순하나 각 부의 형태가 잘 드러나 있다. 탑신의 각 몸돌에는 모서리마다 기둥 모양이 표현되고 지붕돌은 네 귀퉁이에 치켜올림이 있다. 기단부에 사자상을 배치한 경우는 드문 경우로, 원형을 간직하지 못하고 있는 것이 안타깝다. 남아있는 탑재의 양식으로 보아 통일 신라 시대에 조성된 것으로 추정되며 1972년 2월 12일 유형문화재로 지정되었다.   연혁 : 함안문화원「咸州誌」1995   문화재 정보 지정종목 : 경상남도 유형문화재  지정연도 : 1972년 2월 12일 소장 : 국유 시대 : 통일신라 종류 : 석탑 크기 : 탑 높이 130cm, 사자 높이 70cm"
경상남도 함안군 군북면 원북길 10-1,,36,0.0,A02,A0201,A02010700,702375,12,20090303193918,http://tong.visitkorea.or.kr/cms/resource/07/2487507_image2_1.jpg,http://tong.visitkorea.or.kr/cms/resource/07/2487507_image2_1.jpg,128.3253953562,35.235483878,6.0,20220804102205,19041,19,,쌍절각,52068," 조종도와 그의 부인을 기리는 곳, 쌍절각   조선 선조 31년 정유재란시 함양 황석산 싸움에서 전사한 충의공(忠義公) 조종도(趙宗道)의 공(功)과 그의 부인이 남편의 전사 비보를 듣고 자진한 절개를 후세에 길이 빛내기 위하여 1616년(광해군8년) 3월에 정려를 명(命)받아 건립한 정려각이다. 건물의 구조는 팔작지붕, 정면 2칸, 측면 1칸의 목조 다포와가이다. 정려현판은 1732년(영조8년)에 부인 정려시에 개판(板)한 것이다.   쌍절각이 있는 군북면의 볼거리   쌍절각 인근에는 다양한 볼거리가 많다. 문화재로는 도천재단서죽백(道川齋丹書竹帛:경남유형문화재), 방어산 마애불(防禦山磨崖佛:보물), 어계고택(경남유형문화재), 조안 묘소(趙安墓所:경남기념물 34), 원효암 칠성각(경남문화재자료), 함안군북 지석묘군(경남기념물), 서산서원(西山書院), 의상대(義湘臺), 금촌리(金村里) 3층석탑, 삼충사(三忠祠), 와룡정(臥龍亭), 송방사지 5층석탑(松放寺址五層石塔), 방어산성, 쌍절각(雙節閣), 원북재(院北齋), 채미정(菜薇亭) 등이 있다."
경상남도 함안군 군북면 원북길 104-1,(군북면),36,0.0,A02,A0201,A02010500,702361,12,20090303192414,http://tong.visitkorea.or.kr/cms/resource/15/2487715_image2_1.jpg,http://tong.visitkorea.or.kr/cms/resource/15/2487715_image2_1.jpg,128.3207819152,35.2338339811,6.0,20220922165940,20505,19,,어계생가,52068," 어계 조려 선생이 태어난 집, 어계생가   함안군 군북면 원북리 592번지 내 위치한 어계 고택은 조선 전기의 문신 어계 조려(1420∼1489) 선생이 태어난 집이다. 조려 선생은 생육신의 한 사람으로 단종을 위해 벼슬을 버리고 영월에서 단종의 시신을 거두어 장례를 치룬 뒤 왕의 얼을 동학사에 모셨다. 그 후 어계 선생은 이곳에서 낚시로 여생을 보냈으며 지금은 후손들의 재실로 사용하고 있다. 대체로 건물의 구조, 재료, 형태들이 조선 후기 민가의 평범한 양식을 갖추어 간결하고 검소한 느낌을 주고 있다.   어계생가의 건물 구조   어계생가는 대문채·재실·사당으로 구성되어 있는데 대문채는 3칸으로 가운데 문을 높여 세운 솟을대문을 두었고 양쪽은 방으로 만들었다. 재실은 앞면 4칸·옆면 2칸 규모로 지붕 옆면이 여덟 팔(八)자 모양인 팔작지붕집이다. 一자형 평면으로 부엌이 없이 가운데 2칸을 대청으로 하고, 양쪽은 툇마루를 둔 방을 1칸씩 만든 후 주변에는 담을 둘렀다. 사당은 3칸 一자형 평면에 지붕 옆면이 사람 인(人)자 모양과 비슷한 맞배지붕집이다. 비교적 장식이 섞인 모습을 보여주는 건물로 어계 선생과 부인에게 제를 올리는 곳이다.  대체로 건물의 구조·재료·형태들이 조선 후기 민가의 평범한 양식을 갖추어 간결하고 검소한 느낌을 주고 있다.현재는 원북재 외에도 대문채와 사당이 세워져 있는데, 대문채는 3칸으로 가운데에 솟을대문을 두었고 양쪽에는 방을 두었다. 사당은 원북재 뒤에 있으며 툇간이 있는 3칸 일자형 평면구조에 풍판(風板)을 설치한 맞배지붕집이다. 이곳은 조려와 그 부인에게 향례를 올리는 곳으로 유품인 죽장(竹杖)과 하사품인 동(銅) 향로가 보관되어 있다."
