addr1,addr2,areacode,booktour,cat1,cat2,cat3,contentid,contenttypeid,createdtime,firstimage,firstimage2,mapx,mapy,mlevel,modifiedtime,readcount,sigungucode,tel,title,zipcode,overview
경상남도 함안군 함안면 덕암길 103,(함안면),36,0.0,A02,A0201,A02010700,128687,12,20051123090000,http://tong.visitkorea.or.kr/cms/resource/26/724926_image2_1.jpg,http://tong.visitkorea.or.kr/cms/resource/26/724926_image3_1.jpg,128.4177150296,35.2362826717,6.0,20220721102541,18981,19,,함안향교,52054,"조선시대에 현유(賢儒)의 위패를 봉안, 배향하고 지방민의 교육과 교화를 위하여 창건되었다. 창건연대는 미상이며, 처음에는 파수리에 위치하였다가, 1595년(선조 28)에 정구(鄭逑)가 현재의 위치로 이건하였다. 다음해에 동무·서무와 내삼문(內三門)·명륜당·동재(東齋)·서재(西齋)·풍화루(風化樓) 등을 건립하였고, 1910년에 중수하였다. 1950년 6·25동란으로 대성전·명륜당·동재·서재 등이 소실되면서 소장되어 있던 전적도 이때 모두 타버렸다. 1955년 전교(典校) 황우석(黃禹錫)과 1957년 전교 조학래(趙學來)의 노력으로 명륜당과 동재·서재를 복구하였다. 현존하는 건물로는 4칸의 대성전, 5칸의 명륜당, 내삼문, 각 3칸의 동재와 서재, 풍화루, 외삼문, 홍살문〔紅箭門〕 등이 있다. 대성전에는 5성(五聖), 송조3현(宋朝三賢), 동무·서무에는 우리나라 18현(十八賢)의 위패가 봉안되어 있다. 조선시대에는 국가로부터 토지와 전적·노비 등을 지급받아 교관 1명이 정원 30명의 교생을 가르쳤으나, 갑오개혁 이후 신학제 실시에 따라 교육적 기능은 없어지고, 봄·가을에 석전(釋奠)을 봉행(奉行)하며, 초하루·보름에 분향을 하고 있다. 대성전은 경상남도 유형문화재로 지정되어 있으며, 1985년부터 방학기간을 통하여 학생 60여명을 대상으로 충효교육을 실시하고 있다. 현재 전교 1명과 장의(掌議) 수명이 운영을 담당하고 있다."
경상남도 함안군 산인면 모곡2길 53,,36,0.0,A02,A0201,A02010700,128688,12,20051123090000,http://tong.visitkorea.or.kr/cms/resource/19/2484419_image2_1.jpg,http://tong.visitkorea.or.kr/cms/resource/19/2484419_image2_1.jpg,128.4600491327,35.2765289124,6.0,20210827000752,18582,19,,고려동유적지,52032,"고려동유적지는 고려 후기 성균관 진사 이오(李午)선생이 고려가 망하고 조선왕조가 들어서자 고려에 대한 충절을 지키기로 결심하고 이곳에 거처를 정한 이후 대대로 그 후손들이 살아온 곳이다. 이오 선생은 이곳에 담장을 쌓고 고려 유민의 거주지임을 뜻하는 '고려동학' 이라는 비석을 세워 논과 밭을 일구어 자급자족을 하였다. 이오는 죽을 때까지 벼슬하지 않았다. 또 아들에게도 새 왕조에 벼슬하지 말 것이며, 자기가 죽은 뒤라도 자신의 위패를 다른 곳으로 옮기지 말도록 유언하였다. 자손들은 19대 600여 년 동안 이곳에서 선조의 유산을 소중히 가꾸면서 살았다. 뿐만 아니라 벼슬보다는 자녀의 훈육에 전념하여 학덕과 절의로 이름 있는 인물들을 많이 배출하였다. 이에 고려동(高麗洞)이라는 이름으로 오늘까지 이어 오고 있다.   고려동 유적지의 볼거리   현재 마을 안에는 고려동학비, 고려동담장, 고려종택, 고려전답, 자미단(紫薇壇), 고려전답 99,000㎡, 자미정(紫薇亭), 율간정(栗澗亭), 복정(鰒亭) 등이 있다. 후손들이 선조의 유산을 소중히 가꾸면서 벼슬길에 나아가기보다는 자녀의 교육에 전념함으로써 학덕과 절의로 이름있는 인물들을 많이 배출한 이곳을 1983년 8월 2일 기념물로 지정하여 보호하고 있다.  문화재 정보 지정종목 : 경상남도 기념물 지정연도 : 1983년 8월 2일 소장 : 이홍섭 시대 : 조선 종류 : 유적지 크기 : 면적 8,842㎡ "
경상남도 함안군 가야읍 본동길 114,(가야읍) 일대,36,0.0,A02,A0201,A02010700,128689,12,20051123090000,http://tong.visitkorea.or.kr/cms/resource/94/1856994_image2_1.jpg,http://tong.visitkorea.or.kr/cms/resource/94/1856994_image3_1.jpg,128.4058818057,35.2708591272,6.0,20221114091345,22457,19,,함안 말이산 고분군,52043," 아라가야 문화를 알 수 있는 유적, 함안 말이산 고분군   함안군은 남쪽이 높고, 북쪽이 낮은 분지로 북과 서는 낙동강과 남강으로 남과 동은 600m가 넘는 산으로 둘러 있다. 이 고분군은 아라가야의 도읍지였던 가야읍 도항 · 말산리 일원에 위치하며 찬란한 가야문화를 생생하게 보여주는 유적이다. 아라가야 왕들의 무덤으로 생각되는 100여기의 대형고분들은 높은 곳에 열을 지어 위치하고, 그 아래로 1,000여기나 되는 중소형의 고분들이 분포하고 있다. 이 고분군은 일제강점기에 처음 조사되었는데, 당시 제34호분은 봉토(封土)의 지름이 39.3m, 높이가 9.7m나 되는 최대 규모의 왕릉이었다. 최근에는 고분군 북쪽끝 자락에 있는 마갑총에서 고구려의 고분벽화에 그려진 것과 같은 말갑옷이 출토되었고, 다섯 사람의 순장 인골(人骨)이 확인된 제8호분의 조사로 더욱 유명해지게 되었다.   함안 말이산 고분군의 역사적 사실과 의의   현재까지의 발굴조사를 통해 알게 된 사실은 다음과 같다.첫째, 공자모양의 굽다리접시(工字形 高杯)불꽃모양의 창을 낸 굽다리접시(火焰型透窓高杯)는 아라가야가 여러 가야 중에서도 독특한 문화를 가진 독자적인 정치세력 이었음을 확인시켜 주었다.둘째, 각종의 큰칼 · 갑옷 · 말갑옷 · 새가 달린 비늘쇠(有刺利器)같은 철제품과 금·은 ·유리· 옥으로 만든 장신구들은 아라가야 왕의 강력한 위상을 보여 주었다.셋째, 기원전후부터 6세기 중반까지 만들어진 이 고분군은 아라가야의 성립 · 발전 · 멸망의 과정을 상세하게 보여주고 있다.넷째, 이 고분군의 출토품과 같은 유물은 동래 · 경주 · 일본에서도 확인되고 있다. 아라 가야의 산물이 다른 가야와 신라, 일본열도의 왜까지 수출되었음을 보여준다.다섯째, 고분군의 규모와 화려한 유물들은 6세기경의 아라가야가 남부가야의 중심으로 주변국들과 교섭하던 모습을 그려볼 수 있게 해주었다. 현재는 이 고분군이 위치한 곳을 끝 말자의 말산(末山)이라 부르고 있다. 그러나 말산은 말이산으로 불렸었다. 말이산(末伊山) 마리산은 머리산이었다. 원래는 아라가야의 시조가 등장하고, 역대 왕들이 묻혔던 우두머리의 산이었다."
경상남도 함안군 산인면 입곡공원길,,36,0.0,A01,A0101,A01010300,127970,12,20040206090000,http://tong.visitkorea.or.kr/cms/resource/04/724504_image2_1.jpg,http://tong.visitkorea.or.kr/cms/resource/04/724504_image3_1.jpg,128.45069191,35.2656827406,6.0,20220324154906,25982,19,,입곡군립공원,52072,"일제강점기에 농업용수를 마련하기 위해 만든 입곡저수지 일대에 조성한 공원이다. 저수지 왼편에 깎아지른 절벽을 따라 소나무숲이 우거지고 숲 사이로 등산로가 나 있다. 봄이면 저수지 주변 산책로의 벚꽃이 장관을 이룬다. 저수지 상류 오른쪽에는 관중석을 갖춘 운동장이 있다.입곡저수지는 일제강점기 때 농업용수로 사용하기 위하여 협곡을 가로막은 저수지로서 둘레가 약4Km나 되며 폭은 부르면 대답할 수 있는 거리이지만 길이는 뱀처럼 생겨 끝과끝을 볼 수 없는 함안에서 제일 큰 저수지이다. 저수지 왼편을 따라 깍아지른 절벽에는 송림이 우거져 있고, 송림사이 잔디나 암석이 자연 그대로의 노천 휴게소를 제공한다. 휴일이면 가족 단위 인파가 줄을 이어 주위의 인근 도시민에게도 그 소문이 자자하다. 봄이면 동편 산등성이와 암벽 사이에 진달래가 만발한다."
경상남도 함안군 삼기길 91 말이산고분군전시관,,36,0.0,A02,A0201,A02010700,126835,12,20040205090000,http://tong.visitkorea.or.kr/cms/resource/24/2487524_image2_1.jpg,http://tong.visitkorea.or.kr/cms/resource/24/2487524_image2_1.jpg,128.4044597492,35.2693148305,6.0,20220613113226,21331,19,,아라가야 고분군,52043,"함안 아라가야 고분군은 가야읍에서 함안면 방향으로 가는 지방도를 따라가면, 오른쪽 야산 구릉지대에 남북으로 2km 이상 대형 고분 40여기 등, 총 153기가 밀집되어 있는 전국 최대의 고분지역이다. 동국여지승람에 의하면 함안은 본래 아시랑국, '아라가야'라 하기도 하였으며, 가야는 신라 때 멸망당했으므로 이 고분군들은 가야 국왕들의 묘로 보인다.  도항리 고분군은 면적 41만 1340㎡로 얕은 구릉지대에 현재 약 70기 정도 산재해 있다. 봉토 높이 4m 정도, 저경(底徑) 15m 내외의 비교적 대형이며, 내부구조는 함안 말산리 고분군(末山里古墳:사적 85)의 34호분처럼 직사각형 앞트기橫口 돌덧널石槨무덤으로 추정되는데, 대부분 도굴되었다. 말산리 고분군은 면적 2만 200m2로 마산에서 진주까지 국도쪽으로 뻗은 길쭉한 구릉 위에 44기가 있다. 34호분은 봉우리의 정상 전부를 차지할 정도의 거분으로서, 봉토의 지름 40m, 높이 10m나 되어, 함안일대의 고분 가운데 가장 크다.  이 고분은 1917년에 발굴 조사되었는데, 내부구조는 남북으로 된 널방玄室의 길이 9.7m, 너비 1.72m, 높이 1.62m의 규모로, 지평선상의 야석축(野石築) 앞트기橫口식 석실이다. 네 벽은 직립, 천장은 판석(板石) 13매로 덮고 천장석 위에 진흙을 발랐는데, 널방 바닥에는 작은 돌을 깔았다. 벽에 석회칠을 하지 않았으나, 못이 박혀 있는 것으로 보아 채화장막(彩畵帳幕)을 드리운 것으로 추측된다. 널방 북부에는 많은 토기들이 놓여 있고, 유해는 입구쪽에 머리를 남침(南枕)으로 하고 눕힌 것으로 보인다.여기에서 나온 검(劍)자루에는 일본 특유의 직고문각제(直孤文角製) 장식이 있어 주목을 끌었다. 토기 가운데는 새무늬 및 수차형(水車形) 토기가 1개씩 포함되어 있어 출토지가 확실한 동물형 토기로 귀중한 가치를 지니고 있다. 한편, 말산 47호분의 한 뚜껑돌蓋石의 표면에 壽下王이라고 새겨져 있다."
