addr1,addr2,areacode,booktour,cat1,cat2,cat3,contentid,contenttypeid,createdtime,firstimage,firstimage2,mapx,mapy,mlevel,modifiedtime,readcount,sigungucode,tel,title,zipcode,overview
경상남도 창녕군 창녕읍 송현리,,36,0,A02,A0201,A02010700,128589,12,20050915090000,http://tong.visitkorea.or.kr/cms/resource/00/1954900_image2_1.jpg,http://tong.visitkorea.or.kr/cms/resource/00/1954900_image3_1.jpg,128.498227468,35.5426274178,6.0,20220831113442,22844,15,,창녕 석빙고,50325.0," 조선시대 양식을 갖춘, 창녕 석빙고(경남 창녕)   석빙고란 추운 겨울에 얼음을 채취하여 더운 여름까지 보관하여 사용하였던 선조들의 지혜가 돋보이는 얼음 창고이다. 조선시대에 중수하였다고 보는 빙고(氷庫)이다. 이는 구조양식의 측면과 장빙(藏氷)의 풍속이 그 당시에 제도화되어 성행하였던 점을 미루어 보아서이다. 이 빙고는 봉토도 거의 완전하며, 외부의 모양은 마치 거대한 고분처럼 보이고 뒤에 흐르는 개천에 직각되게 남북으로 길게 구축되었다. 빙실(氷室)의 입구는 남쪽에 시설하였는데, 좌우에 장대석(長大石)을 옆으로 건너지르며 쌓아 올려서 천정을 구성하였으며 사이의 천정에는 외부로 통하는 환기공(換氣孔)이 두 곳 설치되었다. 벽은 잡석(雜石)으로 쌓았으나 평평한 방벽(房壁)이 되게 표면(表面)을 치석(治石)하였다. 이러한 구조양식은 석빙고의 전형적인 양식을 보여주는 경주나 안동의 석빙고와 동일한데 규모에 있어 이 석빙고가 약간 작을 뿐이다. 
  석빙고의 축조 유래   빙고 우측에 남아있는 비에 의하면 崇禎紀元後再壬戌二月初一日女四月初十日畢이라 새겨져 있으며 조선 영조 18년(1742)에 현감 신서(申曙)등이 축조한 것으로 보인다.  문화재 정보 지정연도 : 1963년 1월 21일 시대 : 1742년(영조 18) 완공 크기 : 빙실 길이 11m, 폭 3.6m, 높이 3.7m 분류 : 석빙고"
경상남도 창녕군 창녕읍,,36,0,A02,A0205,A02050200,128590,12,20050915090000,,,128.4897810446,35.5405386107,6.0,20220627162303,21412,15,,창녕 술정리 서 삼층석탑,50322.0,"통일신라 석탑으로 2중기단 위에 세운 3층석탑이다. 높이 5.1ｍ, 화강석으로 된 탑으로 1970년 6월 24일 보물로 지정되었다.상층기단(上層基壇)의 면석(面石) 중앙은 별도의 석재로 문비(門扉)가 새겨져 있으며, 위에는 양 우주(隅柱)가 조각되고 옥개(屋蓋) 받침은 5단으로 구성되어 있다. 옥개석 전각의 반전은 그리 심하지 않다. 상층기단의 각 면석의 조각은 곡선의 아름다운 안상(眼象)이 새겨져 있고, 상륜부에는 노반(露盤)과 보주(寶珠)가 남아 있다. 기단은 8개의 면석으로 조립되고 탱주(撑柱)는 4매씩 되었으며 옥신(屋身)과 옥개석(屋蓋石)은 각각 1매이다. 전체적인 조각기법으로 보아 술정리 동 3층석탑보다 수준이 떨어지며 제작 시대 역시 같은 통일신라시대지만 동 삼층석탑보다는 후대로 추정된다."
경상남도 창녕군 창녕읍 시장1길 63,,36,0,A02,A0201,A02010400,128591,12,20050915090000,,,128.4961249311,35.5405581685,6.0,20210824002100,21506,15,,창녕 진양하씨 고택,50324.0,"조선시대의 가옥으로 하병수의 17대 조상인 백연(白淵)이 건립하였다 전한다. 또한 상도리(上道里)에 건륭(乾隆) 25년이라 적힌 묵서(墨書)가 있어 1760년(영조 36)에 건립된 것으로 추정된다. 조선시대의 가옥구조와 민가의 건축술을 알 수 있는 남향의 초가로 하씨(河氏)가 수대로 살아온 터이다.  가옥은 목조 초가로 일자형 홑집이다. 오른쪽 첫 칸이 부엌이고 안방, 대청, 건넌방이 차례로 각각 1칸씩인 4칸집으로 약간씩 변형되었다. 부엌 뒤로 반문을 내달아 창고를 만들었고, 남방집의 고상형(高床形) 대신 산곡간의 저상식(低床式) 집처럼 전퇴(前退)를 생략하였다. 마루판자는 윗면이 평면, 아래면은 원목 그대로이고 지붕은 쇠풀로써 덮었으며 못은 사용하지 않았다. 서까래는 구멍을 뚫어 그대로 이었고 지금 가옥의 부엌위치가 서쪽인 것에 반해 이곳은 동편으로 되어 있다. 서로부터 건넌방, 대청, 안방, 부엌순으로 되어 있고 부엌 뒤로 반문을 내달아 창고를 만들었고 지붕은 양토없이 밀대로 거꾸로 엮어 얹었다."
경상남도 창녕군 창녕읍 향교길 54,,36,0,A02,A0201,A02010700,128593,12,20050915090000,,,128.4980023474,35.5477740556,6.0,20220624145931,17470,15,,창녕향교,50317.0,"정확한 창건연대는 알 수 없으나, 효종연간에 중건되었고, 1913년 화재로 소실되었다가 이듬해 대성전과 동무(東廡)·서무(西廡)를 중건하였으며, 1926년 풍화루(風化樓)와 1959년 명륜당을 중수하였다. 1960년 화재로 풍화루가 소실되었다가 곧 재건하였고, 1972년 전사청을 옮겨지었다. 1976년 내삼문을 재건하고 1980년 동재(東齋)·서재(西齋)를 복원하였다. 현존하는 건물로는 5칸의 대성전, 각 3칸의 동무와 서무, 명륜당, 동재와 서재, 내삼문(內三門), 풍화루 등이 있다. 대성전에는 5성(五聖)의 위패가, 동무·서무에는 송조4현(宋朝四賢), 우리나라 18현(十八賢)의 위패가 봉안되어 있다. 조선시대에는 국가로부터 토지와 전적·노비 등을 지급받아 교관 1명이 정원 30명의 교생을 가르쳤으나, 갑오개혁 이후 신학제 실시에 따라 교육적 기능은 없어지고 봄·가을에 석전(釋奠)을 봉행하며 초하루와 보름에 분향을 하고 있다. 경상남도 유형문화재로 지정되어 있으며, 소장전적 가운데 ≪창녕향교직원임록 昌寧鄕校直員任錄≫·≪창녕유림노유안 昌寧儒林老儒案≫·≪창녕유안 昌寧儒案≫·≪노비안 奴婢案≫·≪교임안 校任案≫·≪향교수미교구절목 鄕校需米撟捄節目≫ 등은 이 지방의 향토사연구에 귀중한 자료이다. 현재 향교의 운영은 전교(典校) 1명과 장의(掌議) 수명이 담당하고 있다."
경상남도 창녕군 대지면 석동1길 11,,36,0,A02,A0201,A02010400,128594,12,20050915090000,,,128.4595721424,35.5568278896,6.0,20210806232409,20164,15,,창녕석리성씨고가,50316.0,"경상남도 창녕군 대지면 석리에 있는 성씨의 오래된 가옥이다. 성씨 고가는 대지 내에 안채, 사랑채, 창고 2동, 대문채, 화장실 등 총 6동의 건물이 '튼ㅁ자형'으로 배치되어 있다. 안채를 중심으로 앞에 사랑채와 중문채를 두고, 안마당 좌우에 토담집 구조의 곳간 2동을 배치했다. 이 건물의 안채와 사랑채는 공히 일제강점기 중반(1929년)에 건축 또는 이건하여 해온 것으로, 가구수법과공간구성, 입면형식 등에서 근대한옥의 특징을 볼 수 있다. 안채는 정면 6칸, 측면 1.5칸의 홑처마 팔작집이다. 창건 후 계속적으로 배면의 쪽간을 확장하여 內室化하여 평면상으로 겹집을 연상하게 한다. 평면은 좌측부터 부엌 1칸, 안방 1칸, 대청 2칸, 건너방 1칸, 마루와 화장실(1칸)이 연접된 형태이다. 건축양식은 납도리 밑에 장혀로 수장한 장혀수장집이다. 상부가구는 5량가에 처마는 홑처마 팔작지붕이다.  사랑채는 정면 4칸 측면 1.5칸 규모이며, 건축형식은 안채와 마친가지로 납도리 밑에 장혀를 둔 수장한 장혀수장집이며, 상부가구는 간단한 3량 가이며, 처마는 홑처마 팔작지붕이다. 중문채는 사랑채 정면 우측에 연결되어 건축되어 있어 평면상으로 마치한 건물처럼 보이긴 하나, 입면상으로는 구분되어 있다. 규모는 정면 2칸, 측면 1칸이며, 누마루와 중문간으로 구성되어 있다. 지붕은 홑처마 맞배지붕이다. 대문채는 정면 3칸, 측면 1칸의 규모이다. 평면은 좌측부터 대문칸 1칸, 문간방 2칸으로 구성되어 있다.장대석 외별대 기단 위에 자연석 초석을 놓고 각주를 세운 형태로, 건축형식은 납도리 밑에 장혀를 둔 장혀 수장집이다. 상부가구는 간단한 3량가 이며, 지붕은 홑처마 우진각 지붕이다."
경상남도 창녕군 창녕읍 옥천리,,36,0,A01,A0101,A01010300,126038,12,20040220090000,http://tong.visitkorea.or.kr/cms/resource/46/2687346_image2_1.jpg,http://tong.visitkorea.or.kr/cms/resource/46/2687346_image3_1.jpg,128.5431877932,35.5286187063,6.0,20220509153754,64468,15,,화왕산군립공원,50335.0,"화왕산(756.6m)과 관룡산(일명 구룡산, 739.7m)을 잇는 공원으로 많은 문화재와 수려한 자연경관을 자랑, 많은 관광객(등산객)이 찾는다. 창녕군 창녕읍과 고암면(高岩面)의 경계에 있는 화왕산(757m)을 중심으로 이루어져 있으며, 인근에 만옥정공원 내의 창녕 신라진흥왕척경비(국보)와 창녕 교동고분군(사적), 창녕 석빙고(보물) 등의 명소가 자리잡고 있다.화왕산은 용암의 분출로 형성된 화산으로, 용지(龍池)를 비롯해 3개의 분화구가 있고, 정상부에는 사적 제64호로 지정된 화왕산성이 있다. 산중에는 관룡사 대웅전(보물)과 관룡사 약사전(보물), 관룡사 석조여래좌상(보물), 관룡사 용선대 석조석가여래좌상(보물) 등 4점의 보물과 많은 문화재가 있는 관룡사(觀龍寺)가 있다.그 밖에 삼림욕장과 자하골 계곡 아래의 도성암(道成庵)을 비롯해 여러 암자와 정자가 곳곳에 흩어져 있고, 인근에 사적인 목마산성(牧馬山城)과 부곡온천, 계성고분군(桂城古墳群:경상남도기념물), 우포늪생태공원, 목포늪, 영산호국공원 등 문화유적과 볼거리가 많다."
경상남도 창녕군 창녕읍 화왕산관룡사길 171,(창녕읍),36,0,A02,A0201,A02010800,126575,12,20040217090000,http://tong.visitkorea.or.kr/cms/resource/28/2563128_image2_1.jpg,http://tong.visitkorea.or.kr/cms/resource/28/2563128_image3_1.jpg,128.5534645773,35.5319601845,6.0,20220829112208,30341,15,,관룡사,50335.0,"관룡사는 화왕산 군립공원 구룡산 병풍바위 아래 있는 고찰로 대한불교조계종 제15교구의 본사인 통도사(通度寺)의 말사이다. 신라 8대사찰의 하나로 394년(내물왕 39)에 창건되었다고 하나 확실하지는 않다. 583년(진평왕 5) 증법(證法)이 중창하고 삼국통일 후 원효가 중국 승려 1,000명에게 화엄경을 설법하여 대도량(大道)을 이루었다. 748년(경덕왕 7) 추담(秋潭)이 중건하였다. 조선시대에 들어 1401년(태종 1) 대웅전을 중건하였으나 임진왜란 때 대부분 당우(堂宇)가 소실되어 1617년(광해군 9)에 영운(靈雲)이 재건하고 1749년(영조 25)에 보수하였다. 관룡사의 볼거리 관룡사에는 대웅전(보물)과 약사전(藥師殿, 보물)을 비롯하여 석조여래좌상(石造如來坐像, 보물)과 약사전 3층석탑(지방유형문화재), 용선대(龍船臺) 석조 석가여래좌상(보물) 등이 있다. 또한 관룡사 입구에는 고려 공민왕 때 개혁정치를 주도한 신돈(辛旽   1371년)이 출가한 사찰인 옥천사지(玉泉寺址)가 있으며, 또 신돈이 태어났다는 일미사지(一味寺址)가 있다. 주변의 깊은 옥천계곡은 많은 피서객이 찾아온다."
경상남도 창녕군 유어면 우포늪길 220,,36,1,A01,A0101,A01011800,126737,12,20040204090000,http://tong.visitkorea.or.kr/cms/resource/97/1803897_image2_1.jpg,http://tong.visitkorea.or.kr/cms/resource/97/1803897_image3_1.jpg,128.4160843757,35.5539107612,6.0,20221107211844,137210,15,,창녕 우포늪,50304.0," 우리나라 최대의 자연 늪지, 우포늪(생태공원) 
우포늪은 우리나라 최대의 자연늪지이다. 늪이라고 하면 가장 규모가 큰 우포늪뿐만 아니라 목포, 사지포, 쪽지벌 등 네 개의 늪을 모두 아우른다. 이 늪지대는 경남 창녕군의 유어·이방·대합면 등 3개면에 걸쳐 있는데, 둘레는 7.5㎞에 전체면적은 2,314,060m²에 이른다. 이곳에 늪지가 처음 형성되기 시작한 것은 1억 4,000만 년전이라고 한다. 공룡시대였던 중생기 백악기 당시에 해수면(海水面)이 급격히 상승하고 낙동강 유역의 지반이 내려앉았다. 그러자 이 일대에서 낙동강으로 흘러들던 물이 고이게 되면서 곳곳에 늪지와 자연호수가 생겨났고, 새로 생긴 호수와 늪은 당시 지구의 주인이던 공룡들의 놀이터가 되었다. 현재 우포늪 인근의 유어면 세진리에는 그 당시 것으로 추정되는 공룡발자국화석이 남아있다.우포늪은 아무리 깊어도 사람의 온몸이 잠기는 데가 거의 없다. 장마철에는 수심이 5m에 이르기도 하지만 평소에는 12m를 유지하기 때문이다. 또한 늪의 바닥에는 수천만 년 전부터 숱한 생명체들이 생멸(生滅)을 거듭한 끝에 쌓인 부식층(腐植層)이 두터워서 개펄처럼 발이 푹푹 빠지지도 않는다. 억겁을 세월을 간직한 이 부식층이 있기에 우포늪은 '생태계의 고문서', 또는 '살아있는 자연사박물관'이라고 불린다. 일제강점기까지만 해도 우포늪 주변에는 가항늪·팔락늪·학암벌 등 10개의 늪이 더 있었다고 한다. 그러나 무분별한 개발과 농경지의 잠식으로 인해 모두 사라져 버렸다. 우포늪도 한때는 커다란 위기에 빠졌었다. 지난 1960년대 초에 백조도래지(천연기념물)로 지정됐다가 급격한 개발로 인해, 백조 수가 급감하자 천연기념물 지정이 취소된 것이다. 그 뒤 이곳에 개발의 광풍이 거세게 불기도 했다. 다행히도 오늘날의 우포늪은 나날이 안정을 되찾고 있다. 특히 생태계 보호지역(1997년)과 람사조약에 의한 국제보호습지(1998년)로 지정된 이후로는 예전의 생태계가 빠르게 되살아나고 있다. 2018년 10월에는 세계 최초 람사르 습지도시 인증을 받았다.  생태계의 보고, 우포늪의 생태계 우포늪은 생태계 보전지역으로 자연환경보전법 적용을 받고 있어 낚시, 논우렁 채취 등을 금지하고 있으며 위반시에는 처벌을 받게 된다. 자연생태계의 보고인 우포늪을 지키기 위해 다함께 노력해야 한다. 현재 우포늪 일대에는 800여 종의 식물이 분포하며, 건강한 수생 생태계를 갖추고 있다.이곳에서 가장 흔한 수생식물은 생이가래·마름·자라풀·개구리밥·가시연꽃 등이다. 이 식물들은 그 자체로도 귀한 생명체이지만, 늪의 수질을 정화해준다는 점에서 무엇보다 소중한 존재이기도 하다. 우포늪의 물빛이 의외로 맑고 깨끗한 것은 이 식물들 덕택이다. 조류는 쇠물닭, 논병아리 등 텃새와 천연기념물인 노랑부리저어새, 큰고니를 비롯하여 청둥오리, 쇠오리, 기러기 등 209종이 있으며 겨울철새는 매년 증가하고 있는 추세이다. 70년대 이후 국내에서 멸종된 따오기의 복원사업을 진행하여 359개체의 자연 복귀에 성공하기도 했다. 어류는 붕어, 잉어, 가물치, 피라미 등 28종이 서식하고 있으나 최근 황소개구리, 배스, 블루길 등 외래어종이 증가하여 자연생태계를 위협하고 있다. 그 외 논우렁, 말조개, 잠자리, 소금쟁이 등의 패각종 및 수서곤충이 서식하고 있으며, 17종의 포유류의 종의 기원과 관련된 생물 다양서을 지닌 지구상 생명부양력이 가장 높은 생태계를 자랑한다. 이렇듯 우포늪은 1억 4천만년 전 태고의 신비를 간직한 국내 최대 규모의 자연내륙습지라고 할 수 있다."
