addr1,addr2,areacode,booktour,cat1,cat2,cat3,contentid,contenttypeid,createdtime,firstimage,firstimage2,mapx,mapy,mlevel,modifiedtime,readcount,sigungucode,tel,title,zipcode,overview
경기도 남양주시 화도읍 묵현로 105-37,,31,0,A01,A0101,A01010300,125453,12,20030719090000,http://tong.visitkorea.or.kr/cms/resource/27/2005627_image2_1.jpg,http://tong.visitkorea.or.kr/cms/resource/27/2005627_image3_1.jpg,127.290206433,37.6666121406,6,20220510142826,75657,9,,천마산군립공원,12158," 서울 근교의 명산, 천마산 
천마산(天摩山)은 남양주시의 한가운데에 우뚝 자리 잡고 있는 높이 812m의 산이다. 남쪽에서 천마산을 보면 산세가 마치 달마대사가 어깨를 쫙 펴고 앉아있는 형상을 하고 있어 웅장하고 차분한 인상을 준다. 산이 높아 겨울에는 흰 눈으로 덮여 설산을 이루고, 봄에는 신록이 아름다우며, 여름철에는 짙푸른 녹색을 띠고 가을이면 단풍이 그림같이 물들어 사시사철 아름답다.

서울에서 가까우면서도 산세가 험하고 봉우리가 높아 과거 임꺽정이 이곳에 본거지를 두고 마치고개를 주 무대로 활동했다고 전해진다. 전설에 따르면, 고려 말 이성계가 이곳에 사냥을 나왔다가 산세를 살펴보니 산이 높고 매우 험준해 지나가는 촌부에게 이산의 이름을 물었는데 촌부는 ""소인은 무식하여 모릅니다.""라고 대답하자 이성계는 혼잣말로 ""인간이 가는 곳마다 청산은 수없이 있지만, 이 산은 매우 높아 푸른 하늘에 홀(笏, 조선시대에 관직에 있는 사람이 임금을 만날 때 조복에 갖추어 손에 들고 있던 물건)이 꽂힌 것 같아 손이 석자만 더 길었으면 가히 하늘을 만질 수 있겠다(手長三尺可摩天).""라고 한데서 천마산(하늘을 만질 수 있는 산)이라는 이름이 비롯되었다고 한다. 

 천마산의 또다른 즐길거리 
천마산 정산 서남쪽 인근에는 높은 절벽바위가 있는데, 이곳 사람들은 이 바위를 '약물바위'라고 부른다. 이 바위에서는 연중 끊이지 않고 샘물이 솟아 올라서 약물바위샘이라고 한다. 이렇듯 천마산은 숲이 울창하고 물맛 좋은 약수터가 많아 하루 산행 코스로는 안성맞춤인 산이다.

산기슭에는 천마산 야영교육장, 상명대학교 수련관 등 각종 연수원과 수련장이 들어서 있는데, 남쪽 기슭의 천마산스키장은 서울 근교 레저시설로 인기가 높다. 스키장은 슬로프 6면에 체어리프트 2기, 3인승 리프트 및 T바 2기를 갖추었으며, 모든 슬로프에 야간조명시설이 마련되어 있다. 또 북쪽 기슭에는 보광사(普光寺)가 있다. 일본잎갈나무·잣나무 등 690여 종의 식물이 자란다. 1983년 8월 29일 군립공원으로 지정되었다.

 주요 야생화  만주바람꽃, 금괭이눈, 미치광이풀, 노랑제비꽃"
경기도 남양주시 수동면 축령산로 299,,31,0,A01,A0101,A01010600,127818,12,20030701090000,http://tong.visitkorea.or.kr/cms/resource/38/2617838_image2_1.jpg,http://tong.visitkorea.or.kr/cms/resource/38/2617838_image3_1.jpg,127.3132573374,37.7548439679,6,20220510165240,136555,9,,축령산자연휴양림,12025," 자연을 벗삼아 휴양할 수 있는 공간, 축령산자연휴양림 축령산은 남양주시와 가평군에 걸쳐있는 해발 887.1m의 산으로 숲이 울창하고 계곡이 아름다운 산이다. 조선왕조를 개국한 이성계가 고려말 사냥을 왔다가 짐승을 한 마리도 잡지 못하였는데 몰이꾼이 이 산은 신령스러운 산이라 산신제를 지내야 한다고하여 산 정상에 올라 제를 지낸 후 멧돼지를 잡았다는 전설이 있다. 이때부터 고사를 올린 산이라 하여, 축령산이라고 불리게 되었다고 한다. 1995년 7월 1일 문을 열어 현재 경기도에서 직영 관리하고 있는 휴양림으로 50년생 잣나무림이 잘 가꾸어져 있고, 축령산 정상으로 오르는 등산로 입구에 있는 잣나무 산책로는 하늘이 보이지 않을 정도로, 우거져 있어 신비감마저 든다. 779ha의 넓은산림에 산림욕장, 체육시설, 물놀이장, 야영장, 자연관찰장 등이 있어 가족단위의 휴양공간으로 손색이 없으며 하루의 산행코스로도 적합한 곳이다."
경기도 남양주시 화도읍 금남리,일대,31,0,A01,A0101,A01010400,127577,12,20030623090000,http://tong.visitkorea.or.kr/cms/resource/00/1860000_image2_1.jpg,http://tong.visitkorea.or.kr/cms/resource/00/1860000_image3_1.jpg,127.3324038249,37.6238706535,6,20220419105604,30448,9,,문안산,12193," 가족 산행지로 적합한 산, 문안산   백두대간에서 갈라진 산줄기가 경기도에 이르러 화악산과 명지산 등 고산을 일구고, 운악산과 천마산으로 이어져 북한강가에 이르러 빚어놓은 산이 문안산이다. 산은 낮으나 북한강가에 자리잡고 있어 경치가 뛰어나고 등산로가 험하지 않아 어린아이를 동반한 가족 산행지로 적합한 곳이다. 문안산의 가장 큰 볼거리는 문바위이다. 산행은 금남교에서 정상에 올랐다가 북쪽의 무시울을 지나 신당재로 내려오는 제1코스와 금남교에서 정상까지 오른 다음 520봉을 넘어 능선을 따라 남쪽의 삼봉리로 하산하는 제2코스가 있다. 제1코스는 약 9㎞로, 3시간 20분 정도, 제2코스는 9.6㎞ 거리로, 약 3시간 45분 정도 소요된다. 짧은 코스에 금남교에서 출발하여 정상에 올랐다가 남쪽의 백월리로 내려오는 등산로도 있는데, 산행거리는 6㎞이며, 2시간 30분 걸린다. 산의 북쪽에는 공원묘지와 공장들이 들어서 있고, 인적이 드물다."
경기도 남양주시 수동면 축령산로 299,", 가평군 상면 행현리",31,0,A01,A0101,A01010400,125459,12,20030429090000,http://tong.visitkorea.or.kr/cms/resource/85/1702985_image2_1.jpg,http://tong.visitkorea.or.kr/cms/resource/85/1702985_image3_1.jpg,127.3132573374,37.7548439679,6,20220315162350,101551,9,,축령산,"472-850,1","축령산은 광주산맥이 가평군에 이르러 명지산과 운악산이 솟구치며 내려오다가 한강을 바짝 앞에 두고 형성된 암산으로 해발 887.1m의 숲이 울창하고 계곡이 아름다운 산이다. 조용한 숲속에서 가족과 함께 하룻밤의 좋은 정감을 느낄 기회를 가질 수 있으며, 봄에는 서리산 정상의 철쭉꽃, 여름에는 바위와 숲이 조화된 시원한 계곡, 가을의 아름다운 단풍, 겨울의 설경 등 뚜렷한 계절감각을 느낄 수 있다. 축령산의 울창한  수림과 계곡을 이용하여 자연휴양림을 조성했다. 삼림욕장, 휴게소, 체육시설, 놀이시설, 야영장 등 편의시설이 두루 갖추어진 곳이다.
산행은 자연휴양림을 통해서만 할 수 있다. 자연휴양림  관리사무소를 지나 휴양림을 벗어난 갈림길에서 왼쪽으로 능선에 올라 수리바위를  지나 30여 분 더 올라가면 남이바위가 나오고 남이바위에서 칼날 같은 바위능선을  타면 정상이다.

 축령산의 전설 
조선왕국을 개국한 태조 이성계가 고려말에 사냥을 왔다가 한마리도 잡지 못하고 그냥 돌아오는데 몰이꾼의 말이 이 산은 신령스러운  산이라 산신제를 지내야 한다고 하여 산정상에 올라 산신에게 제를 지낸 후 사냥을  하여 멧돼지를 잡았다는 전설이 있으며, 이때부터 고사를 올린 산이라 하여 축령산이라  불리게 되었다고 한다."
"경기도 남양주시 금곡동, 평내동, 와부읍, 화도읍",,31,0,A01,A0101,A01010400,127579,12,20030429090000,http://tong.visitkorea.or.kr/cms/resource/05/1860005_image2_1.jpg,http://tong.visitkorea.or.kr/cms/resource/05/1860005_image3_1.jpg,127.2578379932,37.6375927014,6,20220530133301,39236,9,,백봉산,12220," 산세와 한강이 어우러진, 백봉산 
광주산맥이 천마산을 일군 다음 마치고개로 이어진 뒤 남쪽으로 뻗어 내린 능선에 빚은 봉우리가 백봉(589.9m)이다. 높이는 낮으나 산세가 아름답고, 동쪽으로 한강을 끼고 있어 전망이 뛰어나고 교통편이 좋은 산이다.  백봉산 남쪽 골짜기에는 신라 문무왕 때 원효대사가 무술도량으로 창건하였다는 묘적사가 자리잡고 있다. 이 사찰은 조선 세종대왕 때 학열대사가 중건했으며 그 후 남북군영을 세워 무과시험을 보다가 임진왜란 때 사명대사가 승병을 훈련시켰던 곳이다. 묘적사 경내 한가운데에는 7층석탑과 2백년 수령의 보리수 나무가 서있다. "
경기도 남양주시 조안면 다산로747번길 11,(조안면),31,0,A02,A0201,A02010700,125560,12,20020510090000,http://tong.visitkorea.or.kr/cms/resource/38/2026038_image2_1.jpg,http://tong.visitkorea.or.kr/cms/resource/38/2026038_image3_1.jpg,127.2990766137,37.5162492067,6,20220602173413,40551,9,,정약용선생묘,12283," 조선 최고의 실학자, 다산 정약용묘   1972년 5월 4일 경기도기념물로 지정되었다. 능내리에 정약용을 모신 유택인 여유당(與猶堂)과 함께 공원으로 조성되었다.묘는 부인 풍산홍씨와 합장한 원형의 묘로 남향하고 있고, 묘 앞에는 비좌와 비신 및 팔작지붕 모양의 옥개석을 갖춘 비가 있다. 비신에는 2열로 문도공다산정약용 숙부인풍산홍씨 지묘(文度公茶山丁若鏞 淑夫人豊山洪氏 之墓)라고 씌어 있다. 비좌는 높이 31.5㎝, 너비 129㎝, 두께 90㎝이며, 비신은 높이 179㎝, 너비 69.5㎝, 두께 34.2㎝이고, 옥개석은 높이 62㎝, 너비 119㎝, 두께 81㎝이다. 묘역 앞에는 1959년에 세운 묘비 2기와 자연석에 여유당이라 쓴 비가 서 있다.   다산 정약용 선생에 대하여   다산 정약용은 조선후기의 대학자로서 1762년(영조38) 현재의 남양주시 조안면 능내리 마현마을에서 태어났다. 정약용은 어려서부터 이익의 학문을 접하였고, 이벽에세 서양서적을 얻어 읽기도 하여 실학과 서학적 분위기 속에서 성장하였다. 1789년(정조 13)에 문과 급제하여 예문관검열이 되었으나 천주교인이라 하여 충청도 해미로 귀양갔다가 10일 만에 용서되어 풀려났다.또한, 거중기와 녹로(도르래)를 만들어 수원서을 쌓는 공정을 단축하는데 크게 고헌하였다. 그 후 경기도 암행어사를 거쳐 동부승지·병조참의가 되었으나 주문모 신부의 변복 잠입 사건이 터지자 형 정약전과 함께 이 사건에 관련되어 충청도 금정찰방으로 좌천되기도 했다. 1801년(준조 1)신유박해 때 경상북도 포항 장기로 유배된 뒤에 황사영백서사건이 일어나 이 해 10월 다시 전라남도 강진으로 옮겨졌다. 이 후 오랜 유배생활에 들어가며 조선사회의 현실을 다각도로 분석하고 여러 사상과 학문을 검토하여 조선 후기의 실학사상을 집대성하였다. 1818(준조 18) 유배생활에서 풀려난 후 마현마을 고향집으로 돌아와 저술생활로 평생을 보냈으며 1836년(현종 2) 75세로 생을 마쳤다.  다산 정약용 선생은 18년의 유배기간 동안 경서학에 전념, 실학의 대가가되어 「목민심서 」48권, 「경세유표」49권, 「흠흠신거」30권 등을 쓰면서 정치·경제 등 제도의 개혁을 주장하였고 500여 권의 방대한 책을 저술하였다. 능내리의 다산유적지에 있는 정약용의 묘(경기도 기념물)는 발치 아래를 감싸고 돌아 흐르는 두물머리를 물끄러미 바라보는 듯한 야트막한 언덕에 자리잡고 있다. 묘 앞에는 비석상과 상석, 그리고 자우에 망주석이 배열되어 있다. 봉분은 단분이며 숙부인 풍산 홍씨와의 합장묘이다. 문화관에서는 다산 정약용의 일대기를 담은 영상물을 상영하고 있으며 다산 관련 강연회와 학술발표회가 열리고 있다. 또한, 다산문화제를 비롯한 다양한 문화행사들이 사계절 내내 이곳에서 열리고 있다."
