addr1,addr2,areacode,booktour,cat1,cat2,cat3,contentid,contenttypeid,createdtime,firstimage,firstimage2,mapx,mapy,mlevel,modifiedtime,readcount,sigungucode,tel,title,zipcode,overview
경기도 안성시 혜산로 33,(구포동),31,0.0,A02,A0201,A02010900,128273,12,20050104090000,http://tong.visitkorea.or.kr/cms/resource/44/2481544_image2_1.jpg,http://tong.visitkorea.or.kr/cms/resource/44/2481544_image2_1.jpg,127.2745458965,37.0108738963,6.0,20220523161614,28516,16,,안성 구포동성당,17588,"구포동 성당은 안성시내의 진산(鎭山)인 비봉산(飛鳳山)의 지맥인 구포동산에 서남향으로 건립되어 안성시내를 조감하는 위치에 있다. 이 성당은 3715.7m²(1,124평)의 대지에 320.66m²(97평)의 건평으로 한옥의 부재(部材)를 이용하여 1922년 건립하였다.종탑은 1955년에 본 건물에 있던 당초의 정문을 헐고 새로 부착하여 지은 것이며, 내부는 좌·우로 마루를 얹어서 2층의 공간형태를 이루고 있다. 이 성당은 근대 한국천주교 성당 건축양식의 특징인 한국과 서양의 절충식 성당으로서, 초기의 성당 건축사를 연구하는데 매우 귀중한 자료를 제공해 준다.구포동 성당은 1920년 성당 건립운동을 벌인 후 2년만인 1922년 3월에 당시 보개면 신안리 동안 마을에 있던 동안강당을 매입하여 그 곳에 건축한 것이다.본 성당의 기원은 1866년 천주교 박해가 있을때 안성, 죽산, 미리내 등지에서 많은 신자들이 순교한데서 연유된다. 그 후 천주교 파리외방 전교회 소속 선교사인 공안국(孔安國)신부(R.Antonio A.Comet)가 1900년 10월 19일 이곳에 도착하여 민가를 매입 입주한 후 1901년 2월경 정식으로 안성천주교회 본당을 창설하였다."
경기 안성시 서운면 청룡리,", 금광면 상중리, 충북 진천군 백곡면 양백리",31,0.0,A01,A0101,A01010400,125478,12,20031125090000,,,127.2968100024,36.9309807283,6.0,20220526144212,34400,16,,서운산,"456-852,5","경기도와 충청남도의 경계 지역에 위치한 서운산은 경기도 안성시에서 남쪽으로 약 12㎞ 정도 떨어진 곳에 있다. 해발 547m로 아담하고 바위도 거의 없는 유순한 산세에 푹 안겨 가족들끼리 가볍게 산행하기에 좋다. 더불어 청룡사와 석남사 등 문화 유적지가 많아 쉬엄쉬엄 역사공부 하기에도 좋고 산 주변엔 호수들까지 있어 운치 있는 산행을 즐길 수 있다. 청룡사 쪽에서 오른다면 절 왼쪽 등산로를 따라 20여분 오르면 개인농장을 지나 왼쪽에 나옹선사가 기도했다는 토굴암이 있다. 울창한 숲길을 헤치고 40분쯤 오르면 차령산맥 산등성이가 한꺼번에 내려다 보이는 좌성사가 나온다. 좌성사는 백년 정도의 역사를 지닌  비교적 근래에 기도사찰이다. 좌성사 위쪽 요사채를 지나 오솔길을 오르면 새로 지은듯한 서운정이 나온다. 다시 오솔길을 올라 토성 앞 갈림길에서 왼쪽으로 급경사를 오르면 가슴을 씻어낸다는 탕흉대가 나온다. 

탕흉대는 서운산 최고의 전망대로 손꼽힌다. 이곳은 안성, 평택, 성환, 천안까지 시야에 잡힌다. 올라온 길을 돌아나와 토성을 따라 산길을 산책하듯 걷는 기분은 오묘한 즐거움을 선사한다. 정상에서 땀을 식힌 뒤 은적음을 보고 울창한 숲길을 따라 내려오면 청룡사에서 오르던 길과 다시 만난다. 이곳 저곳 산세를 음미하며 둘러봐도 2시간이면 넉넉한 거리다. 정상에서 청룡사쪽 길을 접고 동북쪽 기슭으로 내려가면 석남사 마애여래좌상 앞쪽으로 내려갈 수 있다."
경기도 안성시 공도읍 대림동산길 36,,31,0.0,A02,A0202,A02020700,127613,12,20031120090000,http://tong.visitkorea.or.kr/cms/resource/74/757274_image2_1.jpg,http://tong.visitkorea.or.kr/cms/resource/74/757274_image3_1.jpg,127.2029689431,37.013883378,6.0,20220316164125,24568,16,,안성맞춤가족공원,17548,"안성시는 경기도 서부 평야지대와 내륙 산지를 연결하는 교통의 요지이다. 또 위치 상으로 볼 때 경기도 최남단에 자리잡고 있어 동쪽은 이천시와 충청북도 음성군, 서쪽은 평택시, 남쪽은 충청북도 진천군, 북쪽은 용인시와 접하고 있다. 안성은 옛날부터 특산물이 많기로 소문난 곳이었는데 안성 쌀과 포도를 비롯하여 안성 유기 외에도 배, 한우, 인삼 등이 안성의 6대 특산물이다. 뿐만 아니라 '안성맞춤'이라는 말도 안성 유기에서 비롯된 것이다. 안성맞춤가족공원은 전원 주택 단지 조성을 목적으로 전망 좋은 1,089,000㎡(33만평)의 구릉 지대에 쾌적하게 즐길 수 있는 여러가지 문화 시설을 완비하였으며, 중앙공원에는 분수대와 어린이 놀이터, 농구장, 배구장, 족구장 등의 시설이 갖춰져 있어 가족 단위 휴양지로도 적합하다. 이 밖에 중앙 송림 속에 죽마루와 야로정 두 정자가 있고 맑고 푸른 하천이 있으며 그 옆으로는 축구장도 마련되어 있다."
경기도 안성시 보개면 너리굴길 100,,31,0.0,A02,A0201,A02010600,127981,12,20031119090000,http://tong.visitkorea.or.kr/cms/resource/43/1954543_image2_1.jpg,http://tong.visitkorea.or.kr/cms/resource/43/1954543_image3_1.jpg,127.2788641206,37.0406483163,6.0,20220518152345,38257,16,,너리굴 문화마을,17509,"너리굴문화마을은 비봉산 자락에 자리잡고 있다. 너리굴문화마을에서 '너리굴' 이란 말은 안성 토박이 말로, 백두산 천지부터 시작된 산맥이 차령산맥의 끝부분인 비봉산 자락에서 넓은 골짜기가 되었는데 그것을 '너리굴'이라고 표현한 것이다. 너리굴문화마을은 자연과 예술이 한데 어울려 있는 마을이라고 말할 수 있다.   엄마목장 너리굴 엄마목장은 사슴이 살기 좋은 최적의 환경을 지니고 있다. 비봉산 정상에서  샘솟는 청정한 약수, 주변의 공장이나 마을, 논밭,과수원, 축사 등과 완벽하게 분리된 공간지형, 질 좋은 사료를 제공해주는 풍부한 야초들과 울팡한 나무들이 사슴우리 주변을  감싸고 있는 것, 자연방목 방식으로 자유롭게 넓고 푸른 초원을 뛰어다니는 사슴들은 일상에 지친 도시인들에게는 목가적인 풍경의 휴식처이자, 어린이들에게는 자연학습의 장이 되어 준다.   산책로 등산로가 버거운 사람들은 가벼운 기분으로 산책로를 이용할 수도 있다.  숲 사이에 가르마처럼 난 오솔길 산책로가 산을 빙 둘러 나있다.  엄마목장이 끝나는 자락에 오른쪽으로 좁은 길이 나오는데 이곳이 바로 산책로로 들어가는 입구, 무엇보다 주변경관이 뛰어나고 길이 평탄해 힘들이지 않고 가볍게 산책을 즐길 수 있다. 특히 산 중턱에서 만나게 되는 탁 트인 공간은 안성 시내의 고즈넉한 변두리 풍경을 그림처럼 펼쳐 보여준다.  너리굴 미술관은 현대적인 양식의 세련된 절제미 속에 고아한 아취를 담고 있는 미술전시공간이다. 개관 이래 작가 권용자의 lt;누드 크로키 전gt; 등 국내외에서 활발한 활동을 펼치고 있는 신진 중견작가들의 작품을 전시해왔다.  특히 예술가들의 집성촌이라고 불릴 정도로 많은 예술인들이 모여있는 안성 내에서 쓰임새 많고 특색있는 전시 발표 공간 역할을 하고 있다.  너리굴아트숍은 단순히 다양한 종류의 소품을 판매하는 장소가 아니다. 너리굴에서 행해지는 여러가지 문화 예술프로그램의 결과물들이 한데 모여있는  독특하고 이색적인 공간이다.  원하는 사람들은 저렴한 가격에 물건을 구입할 수도 있으며 도자기, 액세사리, 생활소품 뿐만 아니라 무형문화재 이경자 선생의 금속공예 작품들도 감상할 수 있다. 이 이외에도 동물농장, 입사박물관, 야외공연장, 조각공원 등 여러가지 볼거리가 많다.  또 금속공방, 조소공방, 조각공방, 도자기공방들은 여러가지 재료를 이용해서 우리생활에 사용되는 다양한 물건들을 직접 만들어 볼 수 있는 곳으로 자신이 손수 만든 여러가지 소품과 생활용품들은 세상에서 단 하나밖에 없는 특별함이 있고 귀중한 체험의 시간이 될 수 있을 것이다. 또한, 학생들에게 유익한 전통문화교실과 과학교실은 전문 선생님들의 재밌는 강의와 실습으로 이루어져 학생들에게 유익한 학습의 장 역할도 한다."
경기도 안성시 낙원길 78,,31,0.0,A02,A0202,A02020100,125524,12,20031106090000,http://tong.visitkorea.or.kr/cms/resource/08/2480308_image2_1.jpg,http://tong.visitkorea.or.kr/cms/resource/08/2480308_image2_1.jpg,127.2732572764,37.0054133917,6.0,20220513164626,19225,16,,낙원역사공원,17592,"낙원역사공원(안성공원)에는 모두 46기의 공덕비 선정비, 문인석, 송덕비가 있고, 소설가 이봉구 님의 문학비가 있다. 고려시대의 삼층석탑, 흩어져 있던 좌대 불상 광배들을 모아 만든 석불좌상, 석남사에서 출토되었다는 광배와 좌대 등이 남아 있어 많은 볼거리와 이야기거리를 전해준다. 그 중 특히 유념해서 볼 것이 오명항선생(16731728)송공비라 할 것인데,이는 원래 동본동에 있던 것으로 1969년에 이곳으로 이전, 복원하였다.선생은 영조 4년(1728)에 이인좌의 난을 평정한 4도 도순무사로 분무1등공신이 되었으며 송공비는 이를 기리기 위하여 1744년(영조20년)에 만들어진 것이다. 소설가 이봉구님은 안성출신으로 일제하에서는 농촌계몽운동을 펼치기도 하였으며 작품으로는 실명소설 명동 에레지 방가로 등이 있으며, 안성을 무대로 한 안성장날이 있다. "
경기도 안성시 죽산면 죽양대로 136-16,,31,0.0,A02,A0202,A02020400,127380,12,20031020090000,http://tong.visitkorea.or.kr/cms/resource/54/757254_image2_1.jpg,http://tong.visitkorea.or.kr/cms/resource/54/757254_image3_1.jpg,127.4368900462,37.0931117784,6.0,20220525102632,31611,16,,건강나라,17518,"건강나라는 자연 속에서 편안하고 따뜻한 마음가짐을 가지고 함께 여유롭고 차분하게 휴식을 취할 수 있는 공간이자 건강을 염두에 둔 문화 공간으로서 안성시 죽산면 매산리 부지에 문을 연 건강 체험시설이다. 매산리 야산 아래 넓은 주차장과 기와 지붕을 얹은 산뜻한 2층 건물로서 찾아오는 이들의 마음을 시작부터 편안하게 해주고 있으며 실내 또한 여러 종류의 체험실이 다양하게 마련되어 있어 기호와 취향, 특성에 맞게 각자의 건강 관리를 할 수 있다. 뿐만 아니라 체험실의 바닥은 옥돌과 황토로 깔려 있어 기 순환에 좋으며 실내 인테리어와 편의시설 등도 분위기 있고 환하게 꾸며놓았다."
경기도 안성시 양성면 미리내성지로 420,,31,0.0,A02,A0201,A02010900,127556,12,20031020090000,http://tong.visitkorea.or.kr/cms/resource/23/1589723_image2_1.jpg,http://tong.visitkorea.or.kr/cms/resource/23/1589723_image3_1.jpg,127.2586379926,37.1461885444,6.0,20220420141817,33344,16,,미리내 성지,17500,"경기도 안성에서 북쪽으로 40리쯤 떨어져 은하수라는 뜻의 아름다운 우리말로 불리우고 있는 미리내는 한국 최초의 사제 김대건 신부의 묘소와 그의 어머니 우르술라, 김신부에게 사제품을 준 조선 교구 제3대 교구장 페레올 주교 그리고 김 신부의 시신을 이곳에 안장했던  이민식 빈첸시오의 묘가 나란히 자리잡고 있는 곳이다. 성지에 들어서면 고요하면서도  편안함이 가슴에 와 닿는다. 비록 신자가 아니더라도 성지를 둘러보면 가슴이 깨끗해짐은 느낄 수  있다. 이곳이 미리내로 불리게 된 것은 천주교신자들이 신유박해(1801년)와 기해박해(1839년)를 피해 이곳으로 숨어 들어와 교우촌을 형성하면서 밤이면 집집에서 흘러나오는 불빛이  달빛 아래 비치는 냇물과 어우러져 마치 은하수처럼 보였다고 하여 붙여졌다.  본래 미리내는 경기도 광주, 시흥, 용인, 양평, 화성, 안성 일대 등 초기 천주교 선교지역을 이루었던 곳의 하나이다. 따라서 김 신부가 미리내에 묻힌 지 50년 후인 1896년 비로소 본당이 설정됐을 때 이곳에는 이미 1천6백여명의 신자가 있었다. 26세의 나이에 처형당한 김대건 신부는 조정에서 장례마저 치루지 못하게 하여 처형당한 지 40일이 지난 다음에야 이민식 빈체시오가 간신히 시신을 빼내어 남의 눈을 피하며 일주일을 등에 지고 이곳 미리내로 옮겨와 안장할 수 있었다. 미리내는 1972년부터 본격적인 성역화 작업이 시작되고 1989년에 웅장한 103위 성인 기념 대성전이 완성되었다. 성지에 들어서면 제일 먼저 눈에 들어어는 것은 성지 한 가운데 웅장하게 서있는 기념성당이다. 이 성당은 천주교 103위의 시성을 기념하기 위해 세운 것이고 기념성당 뒤쪽으로 난  십자가의 길에는 예수가 로마병사에게 붙잡혀 십자가에 매달려 고통받고, 죽으시고  무덤에 묻히기까지의 과정이 담겨져 있는 청동조각 15점이 서 있다. 김대건 신부의 무덤과 하악골(아래턱뼈)이 모셔져 있는 미리내성당, 김신부의 동상, 성모성당, 게쎄마니 동산(여기저기 나뒹구는 바위를 자연 그대로 이용한 동산)등을 돌아보는데 23시간이 소요된다.   김대건 18221846(순조22  헌종12)  우리 나라의 최초의 신부, 천주교 성인. 교명 앙드레. 본관 김해. 충청 남도 내포에서 독실한 천주교도 부모사이에서 태어났다. 천주교의 탄압을 피하여 경기도 용인의 골배마을로 이사와서 살았다. 어려서부터 할머니와 부모님에게서 천주교의 교리를 익혔다. 1836년(헌종 2) 프랑스 신부 모방한테 영세를 받고 신학생으로 선발되어 최양업, 최방제 등과 함께 중국의 마카오에  건너가, 파리 외방 전교회의 칼레리 신부로부터 신학을 비롯한 서양학문과 프랑스어. 라틴어 등 을 배웠다. 그 후 마카오에서 민란이 일어나자 1839년에 필리핀의 마닐라에 가서  공부하여 6개국어를 익히었다. 1842년(헌종 8) 프랑스 군함 제독 세실의 통역관으로 있다가 몇차례의 실패 끝에 1845년(헌종 11) 고국을 떠난 지 9년만에 돌아왔다. 사람들의 눈을 피해서  포교에 힘쓰다가 페레올 신부를 데려오기 위하여 쪽배를 타고 중국 상하이에 건너갔다.  거기서 탁덕으로 승품되어 24세의 젊은 나이에 한국 최초의 신부가 되었다.  그 후 페레올.다블뤼 두 신부를 데리고 충청남도 강경을 거쳐서 귀국하였다. 그는 지방전도에 나서 10년 만에 고향에서 어머니를 만났으나, 아버지는 순교한 뒤였다.1846년 최양업과 다른 신부의 입국을 위하여 비밀 항구를 찾다가 체포되었는데, 서울로 끌려와 40회에  걸친 문초를 받고 9월 새남터에서 순교(당시 26세)하였는데 당시의 상황으로 보아 참수하여 군문 효수할 것인데 헌종이 편법을 써서 효수하지 않고 매장하게 하였는데 매장 40일 후에  양성면 미리내에 사는 이민식 씨에 의하여 밤으로 7일에 걸쳐 운구하여 현재 미리내묘지에 안장하였으며, 1925년 7월 5일 로마교황 비오 XI세로부터 복자위에 올림을 받았고1984년 5월  6일 교황 요한 바오로 2세가 우리 나라에 와서 직접 거행한 시성식에서 카톨릭의 성인 자리에 올랐다."
경기도 안성시 일죽면 종배길 115,,31,0.0,A02,A0201,A02010900,127027,12,20031017090000,http://tong.visitkorea.or.kr/cms/resource/30/738630_image2_1.jpg,http://tong.visitkorea.or.kr/cms/resource/30/738630_image3_1.jpg,127.4496782671,37.0758639998,6.0,20211021232729,25459,16,,죽산성지(이진터성지),17531,"1866년 병인박해 당시 수많은 교우들이 살륙됐던 처형지와 교우들을 끌어다 심문과 고문을 하던 곳이다. 충청·전라·경상도로 갈라지는 주요 길목인 죽산은 지리적 조건 때문에 조선 시대에 도호부가 설치되었던 곳이다. 현재 죽산면사무소 자리에서 천주교인들이 참담한 고문 끝에 처형되었다. 여기에서 치명한 순교자들은 「치명일기」와 「증언록」에 그 이름이 밝혀진 이만해도 25명에 이른다. 하지만 척화비를 세우고 오가작통(五家作統)으로 사학 죄인을 색출,무차별하게 천주교인들을 끌어다가 처형하던 당시 상황으로 보아 순교자들이 더 있었을 것으로 보인다.이곳의 원래 이름은 이진(夷陳)터다. 고려 때 몽고군이 쳐들어와 죽주산성(竹州山城)을 공략하기 위해 진을 쳤던 자리이다. 그래서 오랑캐가 진을 친 곳이라 하여 이런 이름으로 불려왔던 것이다. 하지만 병인박해를 지나면서 이진터는 ""거기로 끌려가면 죽은 사람이니 잊으라."" 하여 잊은 터로 불리게 됐다는 것이다. 죽산에는 또 두들기라는 곳이 있다. 죽산 읍내에서 15리쯤 지금은 삼죽면 소재지로 80여호가 사는 큰 마을이지만 옛날에는 인가가 드문 작은 주막거리였다고 한다.이 주막거리는 용인, 안성, 원삼 등지에 사는 교우들이 포졸에게 잡혀 가는 호송길에 잠시 쉬어 가는 곳이 되곤 했다. 포졸들은 줄줄이 묶어둔 교우들을 툭하면 갖은 트집을 잡아 두들겨 패곤했는데 그 연유로 두들기는 두들겨 맞는 곳으로 전해지는 것이다."
경기도 안성시 죽산면 죽산리,,31,0.0,A02,A0201,A02010700,126552,12,20031014090000,,,127.4307660116,37.0784633578,6.0,20220530144352,17736,16,,안성 봉업사지,17519,"봉업사는 언제 창건되고 언제 폐사되었는지 알 수 없어  매곡리 폐사지라 불리기도 했으나 1966년 경지정리작업시 출토된 유물에서 이곳이 봉업사였음을 말해주는 명문이 발견되어 비로소 봉업사지로 알려지게 된 것이다. 이 절의 명칭이 중요한 이유는 신증동국여지승람에서 말하는 고려 태조의 진영을 모셨던 비봉산 아래의 봉업사가 바로 이곳임을 밝혀주는 것으로, 사찰의 중요성이 증명되는 일이기 때문이다. 태조의 진영을 모셨다는 것은 이곳이 진전사원이었다는 의미인데  진전사원이란 왕실의 의지에 따라 죽은 왕의 진영을 모시고 위업을 기리며  명복을 비는 사찰로 태조의 진전사원은 전국의 이름난 사찰(개성의 봉은사, 논산 개태사 등)에 두었던 것으로 보아 봉업사가 결코 만만한 사찰이 아님을 밝혀주는 것이다.  이 곳의 5층 석탑은 기단부의 둔중감, 1층탑신이 높은 점 등에서 고려시대 초기 탑의 특징을 잘 보여주고 있으며 경기도 내의 탑들 중에 가장 조형미가 뛰어난 것으로 인정되고 있다. 특히 1968년 복원공사 때는 사리장치와 유물이 발견되었다. 다음으로 살펴볼 것이 죽산리 사지의 석불입상인데 죽주산성 아래 쓰러져 있던 것을 옮겨와 세웠다고 하는데 고려초기에 유행했던 지방불상 양식의 특징을 살펴볼 수 있는 귀중한 자료로  몸체를 약간 뒤로 젖히고 가슴을 내밀어 꼿꼿하게 서 있는 모습이 매우 당당하다. 삼층석탑은 밭 한가운데 서 있는데 기단 면석아래는 땅에 묻혀 온전한 모습을 알기 어렵고, 혜소국사와 연관이 있다고 전하나 확실하지는 않다. 마을 사람들은 석불과 삼층석탑을 기자신앙의 대상으로 삼았던 듯 하니, 근거리의 태평미륵과 함께 곳곳이 기자신앙의 흔적인 셈이다."
경기도 안성시 금광면 상촌새말길 3-120,(금광면),31,0.0,A02,A0201,A02010800,127453,12,20031014090000,http://tong.visitkorea.or.kr/cms/resource/24/1221924_image2_1.jpg,http://tong.visitkorea.or.kr/cms/resource/24/1221924_image3_1.jpg,127.3064866586,36.9399354257,6.0,20220609150557,24692,16,,석남사(안성),17538,"안성시에서 12킬로미터 떨어진 서운산 동쪽 기슭에 있다. 서운산 북쪽의 석남사는 조그마한 사찰이지만 절 입구에서 대웅전까지 오르는 돌계단의 경관이 볼 만하다. 고려 광종이 아들 혜거국사가 크게 중건하는 등 이름 높은 스님들이 석남사를 거쳐갔다. 석남사는 당시 수백인의 참선승이 머물렀던 수행도량으로 알려졌다. 정면 3칸, 측면 3칸의 대웅전은 겹쳐마 맞배지붕으로 단촐하면서도 당당해 보인다. 대웅전 바로 아래 학이 나는 듯한 팔작지붕집이 영산전과 조화를 이루며, 옹기종기 터를 다스린 석남사 경내는 서운산의 풍취에 푹 빠져들게 하는 매력이 풍겨난다. 영산전은 정면 3칸, 측면 2칸의 다포계 공포를 갖춘 팔작지붕집이다. 날렵한 지붕 끝이 숲속에 살포시 가려있어 단아한 운치를 더한다. 이 건물은 공포의 짜임새가 조선 초기와 중기 사이의 특징을 갖고 있다는 점에서 건축사적 의의가 크다. 신라 문무왕 20년에 고승 담화덕사가 창건했으며 이후 고려시대 혜거국사가 크게 중수했다. 경내에는 16나한이 모셔진 영산전을 비롯해 대웅전, 마애석불 등의 도지정문화재와 석탑, 부도 등 향토유적이 있다. "
경기도 안성시 금광면 현곡길 344,(금광면),31,0.0,A02,A0204,A02040800,127888,12,20030915090000,http://tong.visitkorea.or.kr/cms/resource/69/1048969_image2_1.jpg,http://tong.visitkorea.or.kr/cms/resource/69/1048969_image3_1.jpg,127.3609006526,36.9594480435,6.0,20211215231051,20371,16,,금광관광농원,17537,"안성시 현곡리는 칠현산 서쪽 자락에 깊숙히 들어앉은 곳으로 경기도 내에서도 손꼽히는 오지다. 입구는 금광저수지가 있고 저수지 상류인 맑은 물줄기를 따라오르며 23개의 작은 부락을 지나면 계곡의 맨 끝자락이 관광농원이다. 맑고 청정하기로 견줄 데가 없는 모습이다. 원시림 같은 자연수림이 사방으로 드리웠고, 계곡물을 이용한 수영장, 그림 같은 가족 낚시터, 잔디구장,  식당 등을 고루 갖춰 놓아 평일은 중소 기업체나 대기업의 부서별 야유회, 야외행사, 향우회, 동창모임 등 크고 작은 행사장으로 줄을 잇고 주말은 가족 나들이장소로 자리를 굳히고 있다. 상설 음식점과 숙박시설을 고루 갖추고 있어 숙식의 불편 없이 야외행사를 치러낼 수 있다.   특징  중소기업체, 유치원 및 종교단체의 연수모임과 야유회, 주말 가족나들이 적합 "
경기도 안성시 양성면 덕봉리,산71-1 (일대),31,0.0,A01,A0101,A01010400,127822,12,20030623090000,,,127.1792453379,37.0407742947,7.0,20220310171422,25981,16,,고성산,17503,"높이 298m인 고성산은 만세고개에서 운수암에 이르는 등산코스가 제법 운치있다. 안성시 양성면 방신리 쪽에서 오르면 운수암을 먼저 만날 수 있다.  방신리 입구에서 서북쪽을 향해 가면 낙엽송과 송림사이로 운수암의 정취가 눈에 잡힌다. 청아한 목탁 소리가 숲길에 먼저 배웅나오는 운수암은 경기도 문화재자료 25호로 지정되어 있으며 고려시대 조성한 비로자나 불상이 있다. 운수암은 조선 영조 26년에 창건된 사찰이다. 전설에 따르면, 한 보살이 평생 부처님을 모시고 살아갈 것을  결심하고 처음에는 무산성 아래에 터를 닦고 있는데, 하루는 꿈에 성안에 절을 지으라는 부처님의 계시를 받고 성안으로 들어가 꿈에 나타난 곳을 찾아가 옛날 절터를 발견하고 그 자리에 절을 세웠다고 한다. 훗날 이 보살이 죽자 잡초가 무성한 이 절을 대원군이 중건하고 국태민안을 기원하면서 친필로 운수암이라고 쓴 친필현판을 내려 유명해진 절이다. 그러나 돌보는 사람이 없어 무너지기 직전인 것을 현암스님이 보수하고 대웅전을 불사해 오늘에 이르고 있다.

 찬찬히 운수암을 둘러봤다면, 잘 닦아진 등산로를 함주어 조금 걸으면 약수터가 나온다. 여기서 잠깐 땀을 식히고 발걸음을 옮기면 고성산 정상이 나온다. 고성산 정상에 오르면 안성 양성지역의 드넓은 들판과 평택으로 뻗은 평야가 눈에 들어온다. 정상에서 주변 경치를 감상했다면, 216고지를 향해 걸어보자. 정상에서 내려오면 비법사 쪽으로 내려가는 작은 등산로가 나오는데, 이 길 말고 216고지를 넘어 산장휴게소 뒤편으로도 하산할 수 있다.  특히 산장휴게소 맞은편에 3.1운동 기념관이 새로 조성돼 역사의 현장을 둘러볼 수도 있다."
