addr1,addr2,areacode,booktour,cat1,cat2,cat3,contentid,contenttypeid,createdtime,firstimage,firstimage2,mapx,mapy,mlevel,modifiedtime,readcount,sigungucode,tel,title,zipcode,overview
경기도 시흥시 관곡지로 93,(하중동),31,0.0,A01,A0101,A01011800,756629,12,20090624003248,http://tong.visitkorea.or.kr/cms/resource/92/760292_image2_1.jpg,http://tong.visitkorea.or.kr/cms/resource/92/760292_image3_1.jpg,126.8040692923,37.4026590567,6,20220620165603,45937,14,,관곡지,14973.0,"조선 전기의 명신이며 농학자로 널리 알려진 강희맹(14241483) 선생이 세조 9년 진헌부사가 되어 명나라에 다녀올 때 남경에 있는 전당지에서 전당연의 씨를 가지고 들어와 지금의 하중동에서 연 재배를 시작하여 점차 펴지게 되었다. 이 연못은 강희맹 선생의 사위인 권만형(사헌부감찰) 가(家)에서 대대로 관리되어 오고 있으며, 옛 지명과 연계하여 '관곡지'로 불린다. "
경기도 시흥시 동서로 287,(장곡동),31,0.0,A01,A0101,A01010500,756625,12,20090624002730,http://tong.visitkorea.or.kr/cms/resource/05/2675305_image2_1.jpg,http://tong.visitkorea.or.kr/cms/resource/05/2675305_image3_1.jpg,126.7812383963,37.3897740365,6,20221206104044,44684,14,,시흥 갯골생태공원,14971.0,"시흥갯골생태공원은 경기도 유일의 내만갯벌과 옛염전의 정취를 느낄 수 있는 아름다운 공원이다. 이곳에서는 칠면초, 나문재, 퉁퉁마디 등의 염생식물을 관찰할 수 있으며, 붉은발농게, 방게 등을 관찰할 수 있다. 시흥갯골은 아름다운 경관과 생태적 우수성으로 시흥시의 생태환경 1등급 지역이며, 2012년 2월 국가 해양습지보호지역으로 지정되었다."
경기도 시흥시 관곡지로 139,(하중동),31,0.0,A02,A0202,A02020600,710258,12,20090324235934,http://tong.visitkorea.or.kr/cms/resource/41/2524341_image2_1.jpg,http://tong.visitkorea.or.kr/cms/resource/41/2524341_image2_1.jpg,126.8083800662,37.4006815852,6,20220223105640,58475,14,,연꽃테마파크,14973.0,"시흥시에서는 관곡지가 갖는 상징성과 역사성을 기리기 위하여 관곡지 주변 19.3ha의 논에 연꽃테마파크를 조성하여 운영하고 있으며 재배단지 주위로 산책로와 자전거 도로를 조성하여 시민들이 즐겨 찾을 수 있도록 하였다. 연꽃은 7월 중순부터 피기 시작하여 8월 중, 하순경에 절정을 이루며, 9월중, 하순까지 감상이 가능하다."
경기도 시흥시 동서로 865-76,(물왕동),31,0.0,A02,A0203,A02030600,612039,12,20080820192951,http://tong.visitkorea.or.kr/cms/resource/95/2481195_image2_1.jpg,http://tong.visitkorea.or.kr/cms/resource/95/2481195_image2_1.jpg,126.8453882476,37.3849229595,6,20220324180731,18258,14,,물왕동 토속음식마을,14983.0,"1950년대 이승만 대통령의 전용낚시터로 유명하며 산과 호수가 어우러진 물왕저수지 토속음식마을은 매운탕, 오리탕, 닭백숙, 장어구이, 한식 등 향토음식을 맛볼 수 있다."
경기도 시흥시 뒷방울길 80,(정왕동),31,0.0,A02,A0203,A02030600,611529,12,20080820010523,http://tong.visitkorea.or.kr/cms/resource/61/2667361_image2_1.jpg,http://tong.visitkorea.or.kr/cms/resource/61/2667361_image3_1.jpg,126.6879759092,37.34494148,6,20221114172644,28974,14,,오이도 음식문화거리,15007.0,"오이도는 시흥시 제일의 먹거리 관광타운으로 경기도가 2005년에 음식문화 시범거리로 지정 활어회, 바지락칼국수, 조개구이 등 향토음식을 맛볼 수 있다."
경기도 시흥시 오이도로 156,,31,0.0,A02,A0203,A02030100,129328,12,20061107090000,http://tong.visitkorea.or.kr/cms/resource/19/2481419_image2_1.jpg,http://tong.visitkorea.or.kr/cms/resource/19/2481419_image2_1.jpg,126.6858122085,37.3452691817,6,20221005130924,22765,14,,시흥 오이도마을,15015.0,"시흥 오이도는 대한민국 시흥시의 최서남단에 위치한 섬으로 삼면이 바다로 본래  섬이었지만, 일제강점기인 1922년에 염전을 만들기 위해 제방을 쌓아 육지와 연결되었다. 오이도마을은 넓은 갯벌과 싱싱한 수산물을 자랑하고 있다. 시화호의 회생으로 갯벌도 다시 살아나고 있으며, 2003년 오이도 종합어시장이 문을 열면서 수산물의 유통이 활발해졌다.  포구에는 횟집들이 많이 들어서 있어 싱싱한 자연산 활어회, 조개구이를 비롯한 다양한  해산물 먹거리를 즐길 수 있으며, 저녁이면 서해로 떨어지는 낙조가 장관이다. 갯벌을 이용한 갯벌체험, 바다낚시 체험, 어촌체험, 자전거도로를 이용한 하이킹 등 다양한 체험행사를 준비되어 있다. 지리적으로 오이도마을은 대도시와 가깝고 전철 4호선과 영동고속도로 월곶IC, 편도 4차선의 지방도 84호선이 당지역을 관통하고 있어 접근이 매우 용이하다. 또한 선사유적지인 오이도 패총이 알려지면서 관광객들의 발길도 끊이지 않고 있고 가족 단위로 즐겨 찾을 수 있는 환경 친화적 옥구도 도시자연공원, 오이도 어촌체험관광마을 및  패총 선사유적공원 조성을 통해 선사유적과 해양생태가 조화되는 테마파크로 조성되어 있다."
경기도 시흥시 신천동,산14 (일대),31,0.0,A01,A0101,A01010400,129269,12,20061017090000,http://tong.visitkorea.or.kr/cms/resource/28/1855828_image2_1.jpg,http://tong.visitkorea.or.kr/cms/resource/28/1855828_image3_1.jpg,126.7798924685,37.4473978783,5,20220316163503,55132,14,,소래산,14903.0,"'소래'란 지명은 첫째 지형이 소라처럼 생겼다는 설과 둘째 냇가에 숲이 많다 즉, 솔내(松川)에서 유래되었다는 설, 셋째 지형이 좁다 즉 솔다 → 좁다 등의 이유로 비롯되었다고 한다. 전해 내려오는 이야기로는 신라 무열왕 7년(660)에 당나라 소정방이 나당연합군의 일원으로 군사를 친히 이끌고  백제를 공략하기 위하여 중국 산동성의 래주(萊州)를 출발하여 덕적도를 거쳐 이 산에 머물렀다고 한다. 그 뒤부터 소정방의 '소(蘇)' 자와 래주의 '래(萊)' 자를 합쳐 '소래산'으로 불리우기 시작했다고 한다.

휴일이면 인근의 인천, 부천 시민까지도 찾아와 즐길 정도로 자연경관이 빼어난 소래산은 바쁜 일상 속에서도 약간의 짬만 낸다면 쌓인 피로와 긴장을 기분좋게 풀어줄 휴식처로 시민들로부터  많은 사랑을 받고 있는 곳이기도 하다.날씨가 맑은 날에는 육안으로도 서울 시가지와 서해바다가 선명하게 내려다보이는 소래산 삼림욕장은 1992년에 시흥시가 시민의 보건향상과 정서생활 함양을 위해 1억 5천만원의 사업비를 투자하여 조성하였다. 내원사 입구에서 정상까지의 5km에 달하는 기존 산책로는 각종 체육시설, 독서하는 숲, 원목 로프를 이용한 힘기르는 숲으로 정비되어 있다. 

또한 소암천 약수터와 청룡 약수터 등은 양질의 물을 제공해 줌으로써 소래산 산림욕장을 찾은 모든 이들의 갈증을 해갈시켜 준다.산기슭에는 조선 세종 때 영의정을 지낸  하연의 묘소가 있고  동쪽 산중턱에는 고려 초기의 것으로 알려진 우리나라 최대의 마애보살입상이 병풍바위에 선각되어 있어 자녀들에게는 훌륭한 자연학습장이자 역사의 산실이 되기도 한다. 잣나무와 소나무 등으로 녹음이 우거진 숲을 1시간 30분 가량 걷다 보면 나무로부터 발산된 피톤치드라는 방향성 물질에 의해  심신의 안정을 찾을 수 있어 자연건강요법을 이용한 휴양지로 이만한 곳도 없다.  또한, 주말이면 가끔씩 소래산 창공을 수놓는 행글라이더의 시연은 매니아에겐 새로운 세계를 일반인들에겐 다양한 볼거리를 제공하기도 한다."
경기도 시흥시 소래산길 41,(대야동),31,0.0,A01,A0101,A01010600,129270,12,20061017090000,http://tong.visitkorea.or.kr/cms/resource/24/1855824_image2_1.jpg,http://tong.visitkorea.or.kr/cms/resource/24/1855824_image3_1.jpg,126.7855112717,37.4520335503,6,20220323093923,41179,14,,소래산산림욕장,14902.0,"소래산 삼림욕장은 1992년에 시흥시가 시민의 보건향상과 정서생활 함양을 위해 내원사 입구에서 정상까지의 5km에 달하는 기존 산책로는 각종 체육시설, 독서하는 숲, 원목 로프를 이용한 힘기르는 숲으로 정비되어 있다. 또한 소암천약수터와 청룡약수터 등은 양질의 물을 제공해 줌으로써 소래산 산림욕장을 찾은 모든 이들의 갈증을 해갈시켜 준다. 산기슭에는 조선 세종 때 영의정을 지낸 하연의 묘소가 있고 동쪽 산중턱에는 고려 초기의 것으로 알려진  우리나라 최대의 마애보살입상이 병풍바위에 선각되어 있어 자녀들에게는 훌륭한 자연학습장이자 역사의 산실이 되기도 한다. 잣나무와 소나무 등으로 녹음이 우거진 숲을 1시간 30분 가량 걷다 보면 나무로부터 발산된 피톤치드라는 방향성 물질에 의해  심신의 안정을 찾을 수 있어 자연건강요법을 이용한 휴양지로 이만한 곳도 없다. 또한, 주말이면 가끔씩 소래산 창공을 수놓는 행글라이더의 시연은 매니아에겐 새로운 세계를 일반인들에겐 다양한 볼거리를 제공하기도 한다."
경기도 시흥시 오이도로 175,,31,0.0,A01,A0101,A01011300,128109,12,20040413090000,http://tong.visitkorea.or.kr/cms/resource/12/2671612_image2_1.jpg,http://tong.visitkorea.or.kr/cms/resource/12/2671612_image3_1.jpg,126.6879259053,37.3452636639,6,20220519180951,200411,14,"031-310-2332,2901~4",오이도,15015.0,"오이도는 시흥시의 서남쪽 해변에 위치한 섬 아닌 섬으로서, 각종 어패류가 많이 나는 관광지이자, 신석기 시대를 비롯한 각 시기의 유적이 여러 차례에 걸쳐 발굴되어 국가 사적으로 지정된 중요 유적지이다.조선시대에 오질이도(吾叱耳島), 오질애도(吾叱哀島) 등으로 불린 이곳은 삼면이 바다여서 만조 때는 출렁이는 바다 내음을, 썰물 때는 살아 움직이는 바다 생물들의 생활모습을 엿볼 수 있고, 저녁에는 아름다운 낙조를 만날 수 있는 시흥의 명소이다."
경기도 시흥시 오이도로 58,(정왕동),31,0.0,A02,A0202,A02020700,127362,12,20031106090000,http://tong.visitkorea.or.kr/cms/resource/52/2431852_image2_1.jpg,http://tong.visitkorea.or.kr/cms/resource/52/2431852_image3_1.jpg,126.7115678593,37.3574543328,6,20221111104222,40557,14,,옥구공원,15013.0,"옥구도(玉鉤島)는 주변에 돌이 많다고 하여 석도(石島)석출도(石出島)석을주도(石乙注島)석옥귀도(石玉龜島)옥귀도 등의 여러 이름으로 불렸다.  인근에서는 남쪽의 오이도와 함께 옥귀도(일명 옥귀섬)라고 불렀는데 후대에 내려오면서 옥귀도의 '귀(龜)' 가 '귀'  또는 '구'가 되므로 '구' 자를 취하면서 옥구도로 불린 것으로 보인다. 또한 돌이 마치 줄을 선 형상을 하고 있어서 산 이름을 둘주리산, 마을 이름을 돌주리라고 하였으며 산 정상부가 서울을 등지고 있다고 하여 '역적섬'이란 별칭이 붙여지기도 하였다. 옥구도는 1998년 초까지만 해도 해안초소 등으로 인해 민간인들의 출입이 통제된 불모지나 다름없었던 곳인데,  시흥시가 1999년 2월부터 공공근로 참여자를 활용해 수도권 주민들이 가족 단위로 즐겨 찾을 수 있는 환경 친화적 공원으로 탈바꿈시켜 2000년 초에 개장하였다. 옥구도 일대 47,500여 평의 부지에 위치한 옥구도 도시자연공원의 주요시설은 고향동산 숲속교실해양생태공원산책로 등으로 나눠진다. 이중 고향동산은 초가 원두막 2개, 40평  규모의 민속생활도구 전시관, 30평 규모의 통나무자연교실, 연자방아와 정미시설,  수목원 등을 갖추고 있다. 수목원은 자작나무 27종 650여 그루를, 개나리와 철쭉 각 3000여 그루,  구절초 등 30여종  5,000여 그루, 한약재식물, 부처꽃 등  70여종  10만여 야생화를 재배하고 있다. 바닷가에 위치한 해양생태공원에는 180여평 규모의 습지원과 140여평 규모의 연꽃단지 등으로  이루어져 있다. 숲속교실은 30석 규모로 고향동산 인근 등 2곳에 건립돼 있다. 옥구도 도시자연공원의 가장 큰 장점은 산 정상에 올라가면 인천 앞바다, 시화방조제,  대부도 등이 한눈에 들어온다는 것이다."
경기도 시흥시 월곶동,,31,0.0,A01,A0101,A01011400,127614,12,20031105090000,http://tong.visitkorea.or.kr/cms/resource/72/2524572_image2_1.jpg,http://tong.visitkorea.or.kr/cms/resource/72/2524572_image2_1.jpg,126.740264417,37.3873430378,6,20220302142018,35540,14,031-318-4409,월곶포구,14963.0,"월곶(月串)의 '곶(串)'은 '바다를 향해 뾰족하게 내민 땅'이라고 하며 인근에서는 월곶을 통칭해 '달월'이라고 부른다. 조선시대에는 수군만호(水軍萬戶)가 설치될 만큼 군사상 중요시 되던 곳으로 1991년까지만 해도 바다와 자원의 보고로 불리는 살아있는 갯벌이었다. 바다였던 이곳이 새로운 휴식공간으로 각광을 받게 된 것은 시흥시가 면적 564,938㎡에 대한 매립사업1992.81996.12.31) 실시로 횟집과 어물전 230여 곳을 비롯하여 각종 위락시설이 조성되면서 부터이다.

월곶포구는 서해안의 특성인 조석간만의 차가 커서 주로 만조 전후로 어선이 드나들고 있다. 언제든지 갓 잡아온 횟감들을 맛볼 수 있다는 싱싱한 즐거움, 그것은 월곶이 아닌 곳에서는 쉽게 맛볼 수 있는 일이 아니다. 월곶은 뭐니뭐니 해도 포구의 특성에 따른 신선한 자연산 활어회가 자랑거리다. 그 많은 횟집 어디에 들어가 봐도 제각기 독특한 분위기가 있으며 월곶을 찾는 사람들이 언제라도 싱싱한 횟감을 사갈 수 있는 어시장이 자리잡고 있다. 물론 가격이나 신선함에서 다른 지역과는 비교되지 않을 정도이다. 때문에 '진짜 회맛'을 아는 사람들이 물어물어 찾아온다. 여의도에서 자동차로 1시간 정도만 달려가면 바다를 만날 수 있고 싱싱한 횟감의 풍성함에 취할 수 있는 곳, 월곶은 도시생활에서 쌓인 이런 저런 스트레스를 말끔히 지워버리고 새로운 생기를 충전시키고 싶은 사람이라면 누구나 부담 없이 찾을 수 있는 곳이다. "
