addr1,addr2,areacode,booktour,cat1,cat2,cat3,contentid,contenttypeid,createdtime,firstimage,firstimage2,mapx,mapy,mlevel,modifiedtime,readcount,sigungucode,tel,title,zipcode,overview
경기도 남양주시 조안면 북한강로433번길 186,,31,0,A02,A0201,A02010800,129516,12,20070418090000,http://tong.visitkorea.or.kr/cms/resource/64/2635064_image2_1.jpg,http://tong.visitkorea.or.kr/cms/resource/64/2635064_image3_1.jpg,127.3025719443,37.5711345676,6,20220512145437,46788,9,,수종사,12280," 운길산의 빼어난 풍광을 느낄 수 있는 곳, 수종사  수종사(水鍾寺)는 조안면 송촌리 운길산의 정상 부근에 위치한 봉선사의 말사이다. 광주산맥이 남서로 내려오면서 상서로운 기운이 감도는 운길산은 웅장하지 않지만 그윽함이 감도는 명산이다. 특히 수종사에서 바라본 풍광은 빼어난데 높고 낮은 산봉우리들이 솟아 있고, 한강으로 합류하기 직전의 북한강의 물길이 장관이다. 창건연대는 확실하지 않으나 범우고(梵宇攷)에 의하면 세조가 이 절에 친히 행차하여 땅을 파서 샘을 찾고, 혹은 종을 발견했다고 해서 수종사라 하였다고 전하며 1939년 석조 부도를 중수하면서 1439년(세종 21)에 조성된 부도로 확인되어 조선 초기에 창건되었을 것으로 추정하고 있다.  수종사는 여러 해를 거치면서 중창을 거듭하였는데 오랜 세월로 인해 대웅전과 요사채가 무너지고 불상 또한 그 사정이 참담하였다. 1890년(고종 27)에는 풍계혜일(楓溪慧一)화상이 고종에게서 내탕금 8000냥을 받아 3월 27일에 중창을 시작해서 6월 28일에 마쳤고, 이듬해 3월에는 4000냥을 더 받아 불상 4존(尊)과 탱화 3축(軸)을 새로 봉안하였으며, 대법당· 나한전·어향각(御香閣), 그리고 산왕각(山王閣)을 단청하였다. 1939년에는 주지 일조태욱(日照泰旭)이 대웅전·선루(禪樓)를 1940년에는 영산전(靈山殿)·독성각(獨聖閣)·산신각·어영각(御影閣) 등을 중건하였지만 한국전쟁 때 모두 소실되었다. 1975년 혜광(慧光)스님이 대웅보전을 복원하여 사세를 확장해오며 1999년 주시 동산(東山)이 선불장과 삼정헌을 중창하여 오늘에 이르고 있다. 1972년 팔각오층석탑(제22호)과 1995년 부도(제157호)가 경기도 유형문화재로 지정 보존되어 오고 있다.   수종사의 전설  수종사에는 다음과 같은 전설이 전해온다. 세조가 금강산을 유람하고 돌아오는 길에 용선(龍船)을 타고 양수만(兩水灣 : 현재 양수리)에서 하룻밤 머물고 있을 때였는데 밤에 홀연히 어디에선가 은은한 종소리가 들려왔다. 다음날 사람을 시켜 그 출처를 찾게 했더니 그곳에는 바위굴이 있었고 내부에 18나한상이 있었다. 종소리는 굴속으로 물방울이 떨어지면서 울려나온 소리로 청아하고도 명징하게 들렸던 것이다. 세조는 그것을 기이하게 여겨 이곳에 축대를 쌓고 장인(匠人)들을 불러 절을 창건하였다. 그리고 전답을 하사하고 승려를 거처하게 하였으며 절 이름을 수종사라 하였다 한다.    조선 초기 석탑의 귀중한 자료, 수종사오층석탑  1459년(세조 5년)에 건립된 조선 초기의 대표적인 석탑이다. 5층석탑이지만 높지 않고 아담하면서도 화려한 탑신의 모습이 전체적으로 기품있어 보인다. 탑의 8각 지대석의 각 면에는 안상(眼象)이 사실적으로 새겨져 있고 기단부의 각 면에는 단판, 복앙련과 안상이 화려하게 조각되어 있다. 5층탑의 옥신은 위층으로 올라가면서 점점 좁아지며, 탑신을 보호하는 옥개석의 낙수면이 심하게 숙여져 전각에 대칭하고 있다.옥개석 바닥면은 수평으로 되어 옥신이 받치고 있다. 옥개석 받침은 3단이며 옥개석의 모서리 각 끝에 요령을 매달았다. 이것은 조선 초기 경기도 일대에 유행하던 형식의 석탑으로 귀중한 연구자료이다.   수종사오층석탑의 유래와 전설  수종사는 운길산에서도 가장 전망이 좋은 곳으로 절에서 보면 양수대교를 비롯한 양수리와 북한강 일대가 확연히 한눈에 들여다보인다. 1460년에 창건되었는데 일화를 보면, 세조가 금강산을 다녀오는 뱃길에 이수두(양수리)에서 묵으면서 야경을 즐기던 중, 갑자기 종소리가 들리므로 이상하게 생각하여 다음날 주민을 불러 종소리의 출처를 물었더니 근처에 종은 없고 종소리가 날 만한 곳은 운길산 중에 오래된 절터가 한 곳 있을 뿐이라고 대답하였다. 세조가 즉시 이를 답사하게 하였는데 절터의 암굴 속에 18나한상이 열좌하고 있고, 바위 틈에서 물방울이 떨어지면서 소리를 내고 있음을 발견하고, 사찰을 만들게 하고 수종사라고 이름하였다.   동시에 나한을 봉안하기 위하여 산 중턱에 조성한 탑이 수종사 오층석탑이라고 전해진다.그후 400여 년을 지나는 동안 수종사는 퇴락하여 창건 당시의 면모를 찾아볼 수 없게 되자 1890년(고종 27)에 8천 냥의 하사금을 내려 풍계화상에게 중건하도록 하였고 이듬해 4천 냥과 금백홍사를 불전에 공상하였다. 1962년에 관리 관계로 현 위치로 이전할 때 각 탑신에서 불상, 보살상 등 18점의 유물이 발견되어 현재 국립중앙박물관에 소장되어 있다."
경기도 남양주시 조안면 운길산로 316,(조안면),31,0,A01,A0101,A01010700,128219,12,20041021090000,http://tong.visitkorea.or.kr/cms/resource/73/1556373_image2_1.jpg,http://tong.visitkorea.or.kr/cms/resource/73/1556373_image3_1.jpg,127.2824988801,37.567287427,6,20220323180044,32966,9,,아라크노피아 생태수목원·주필거미박물관,12281,"김주필 박사는 1985년 9월 1일 한국거미연구소를 설립하였으며, 전세계를 돌아다니며 거미채집, 연구를 통해 상당량의 문헌, 표본, 소품 등을 수집하게되어 이를 전시하여 거미의 생태와 생물학에 대해 널리 알리고자 설립한 공간이다. 특히 미래의 주역인 아이들에게 기초과학의 중요성을 알리고자, 몸소 체험해보고 생물과 접해 볼 수 있는 기회를 주고자 만든 공간이라고 한다. 아라크노피아 주필거미박물관은 본관 1,2층과 별관 1,2층으로 구성되어 있으며, 본관 1층에는 국내외적으로 보기 힘든 거미들의 표본 및 화석들이 전시되어 있고, 거미들 뿐만 아니라 각종 동물들을 사육하고 있다. 2층에는 세계 각국에서 수집한 나비·나방 및 각종 곤충의 표본들이 전시 되어 있으며, 별관 1층에는 세계 희귀 광물들이 수집 전시되어 있어 신비로움을 자아내고 있다. 별관 2층에는 거미의 몸구조를 직접 알아볼 수 있는 현미경 관찰실과 세계 각국의 패류가 전시 되어 있다. 주필 거미박물관에는 5천여종, 22만개체의 다양한 거미 표본이 전시되어있으며,  생태수목원이 함께 있어 체험학습 뿐만 아니라 나들이 공간으로도 활용되고 있다. "
경기도 남양주시 덕릉로1071번길 58,(별내동),31,0,A02,A0201,A02010800,125528,12,20031128090000,http://tong.visitkorea.or.kr/cms/resource/38/1206938_image2_1.jpg,http://tong.visitkorea.or.kr/cms/resource/38/1206938_image3_1.jpg,127.0985650489,37.6845288008,6,20220322152230,21800,9,,흥국사(남양주),12091,"흥국사는 남양주시 별내면 수락산의 골짜기에 자리하고 있는 대한불교 조계종 제 25교구 본사 봉선사의 말사다. 599년(진평왕 21년) 원광(圓光)법사가 창건했고 처음에는 절 이름을 수락사(水落寺)라고 했다. 그 이후의 내력은 한동안 끊겼다가, 1568년(선조 1년)에 이르러 선조가 그의 아버지인 덕흥대원군의 원당(願堂)을 이곳에 지으면서 '흥덕사(興德寺)'라는 편액을 하사했다.그 뒤 1626년(인조 4)에 절 이름이 지금의 흥국사로 바뀌었다고 한다. 흥국사는 조선중기 이후 왕실의 원당으로서 발전하였으며 1790년(정조 14)에는 봉은사, 봉선사, 용주사, 백련사 등과 함께 오규정소(五糾正所) 가운데 한 사찰로 선정되면서 사격(寺格)이 더욱 높아지기도 했다. 오규정소는 나라에서 임명한 관리들이 머물면서 왕실의 안녕을 비는 동시에 관할 사찰들을 관리하던 곳이다. 절 안에 법당 지붕보다 높은 향나무가 있어서 눈길을 끈다.   흥국사의 역사와 볼거리   1818년(순조 18) 요사채 대부분이 소실되었는데, 4년 후 왕명에 따라 기허(騎虛)가 대웅전과 법당 등을 중건했다. 1878년(고종 15)에는 다시 소실된 것을 용암(庸庵)이 중건하였는데, 이곳에 덕흥대군의 묘소가 있으므로 흔히 덕절이라고 부른다.경내에는 현재 정면 3칸, 측면 3칸인 팔작지붕의 대웅전과 영산전(靈山殿)·만월보전(滿月寶殿)·독성전(獨聖殿)·시왕전(十王殿)·산신전 등이 있다."
경기도 남양주시 진접읍 광릉수목원로 354,(진접읍),31,0,A02,A0201,A02010700,125546,12,20031128090000,http://tong.visitkorea.or.kr/cms/resource/79/2364479_image2_1.jpg,http://tong.visitkorea.or.kr/cms/resource/79/2364479_image3_1.jpg,127.1767420667,37.7528333807,6,20220308173512,29711,9,,"남양주 광릉(세조,정희왕후) [유네스코 세계문화유산]",12001," 세조와 세조비의 무덤, 광릉 유네스코 세계문화유산   조선 제7대 세조와 세조비 정희왕후 윤씨의 능으로 사적 제197호이다. 조선 왕릉 최초로 왕과 왕비의 능을 서로 다른 언덕 위에 따로 만든 동원이강릉(同原異岡陵) 형식을 취하였고, 두 능의 중간지역에 하나의 정자각(丁字閣)을 세웠다.세조의 유언에 따라 봉분 내부에 돌방을 만들지 않고 회격(灰隔; 관을 구덩이 속에 내려놓고, 그 사이를 석회로 메워서 다짐)으로 처리하였다. 무덤 둘레에 병풍석을 세우지 않았으며, 이전에 병풍석에 새겼던 12지신상은 난간석에 새겼다. 또, 능역 아래쪽에는 홍살문에서 정자각에 이르는 길인 참도(參道)가 생략되어 있다.이렇게 간소하게 능을 조성함으로써 부역인원과 조성비용을 감축하였는데 이는 조선 초기 능제(陵制)에 변혁을 이루는 계기가 되었고, 이런 상설제도는 이후의 왕릉 조성에 모범이 되었다. 능 주위에는 문인석·무인석·상석·망주석·석호(石虎)·석양(石羊) 등의 석물이 배치되어 있다.   광릉은 크낙새 서식지   광릉 주위는 30여만 평의 넓은 숲으로 100살 넘은 노목들이 울창하여 새들의 낙원을 이루고 있으며, 특히 천연기념물 제11호인 크낙새 서식지로 유명하다."
경기도 남양주시 홍유릉로 352-1,,31,0,A02,A0201,A02010700,125548,12,20031128090000,http://tong.visitkorea.or.kr/cms/resource/20/2005620_image2_1.jpg,http://tong.visitkorea.or.kr/cms/resource/20/2005620_image3_1.jpg,127.2096231122,37.6315564164,6,20220519162239,30156,9,,"남양주 홍릉(고종과 명성황후)과 유릉(순종과 순명,순정 황후) [유네스코 세계문화유산]",12238,"조선왕조 마지막 두 황제와 그 비를 모신 이곳은 사적으로 지정되어 있다. 홍릉은 대한제국 초대 고종황제와, 명성황후 민씨의 능이고, 유릉은 마지막 순종황제와 원비 순명황후 민씨 및 계비 순정황후 윤씨를 모신 능이다.원래 홍릉은 명성황후 민씨의 능으로서 서울 청량리에 있었으나 고종의 승하로 국장할 때 이곳에 옮기어 함께 모셨다. 유릉은 원래 순명황후 민씨의 능으로 양주 용마산에 있었으나 순종 인산 때 이곳에 이장하였고, 1966년 순정황후 윤씨를 또한 이곳에 함께 모셨다. 홍릉과 유릉은 종래의 왕릉과 형식이 다르며 모두 광무 이후 황제라 칭하던 왕이었던 만큼 명태조의 효릉을 본따서 조영하였다.  종래의 정자각 대신 정면 5칸, 측면 4칸의 침전을 세웠고 그 앞쪽으로 문무석을 세우고,홍살문까지 기린 코끼리 해태 사자 낙타 말의 순으로 석수를 세워 놓고 있다. 홍릉 석물이 전통적인 수법으로 만들어진데 대하여 유릉 석물은 사실적이고 개성적이며 입체감을 잘 살리고 있다. 청량리에서 경춘가도를 가다 도농동 삼거리 검문소에서 춘천쪽으로 약4km 지점 오른편에 울 창한 소나무 숲속에 위치하고 있다.  일제강점기 시절 일본은 왕·공족의 분영은  묘로 한다는 정책을 펼쳤다. 왕의 무덤인 능陵도 세자의 무덤인 원園도 아닌 일반인의  무덤인 묘墓로 격하시키겠다는 뜻이었다. 왕공가궤범을 따르자면 고종과 순종의 무덤은  왕릉이 될 수 없었는데, 이때 왕실에서 생각해낸 것이 고종의 비 명성황후의 홍릉과  순종의 비 순명효황후의 유릉이었다. 고종의 장례 때는 명성황후의 재궁을 원 홍릉(청량리)에서  현 홍릉(남양주시)으로 옮겨와 합장하였고, 순종의 장례 때에도 구 유릉(서울 능동  어린이대공원)에서 순명효황후의 재궁을 모셔와 합봉(남양주시)하였다. 새로운 능을  만드는 것이 아니라 원래 있던 능의 칭호를 가져다 쓰는 것이었기 때문에 일제로서는  이것을 막을 법적인 근거가 없었으며, 능의 이장 문제 또한 이왕직이나 총독부가  관여할수 있는 것이 아니라 왕실 내의 문제로 여겨졌기 때문에 이 문제는 별 탈 없이  처리되었다.그러나 본래 왕릉 장법에서는 왕비의 능에 왕을  합장할 경우엔 새로운 능호를 쓰게 되어 있다. 중종이 장경왕후의 능인 희릉 옆에 같이(이때의 경우 한 구역 안 두개의 능침이라 하여 동원 이강이라 한다. 봉분은 따로 떨어져 두개이지만 제사는 한 정자각에서 받는다)안장되었을 때 희릉의 능호를 같이 쓸 수 없다 해서 정릉으로 능호를 새로 올렸던 전례가 있고, 숙종은 인현왕후의 능에 묻을 것을 미리 지시했기 때문에 인현왕후의 능호인 명릉을 그대로 사용하였다(이 경우는 봉분이 붙어있어서 쌍릉이라고 한다). 원래 왕릉 장법에 따르면 새로운 능호를 써야 하는 것이 마땅하지만, 고종과 순종의 경우는 일제의 간섭으로 인하여 그렇지 못하게 된 것이다."
경기도 남양주시 진접읍 봉선사길 32,(진접읍),31,0,A02,A0201,A02010800,126539,12,20031128090000,http://tong.visitkorea.or.kr/cms/resource/84/2678584_image2_1.jpg,http://tong.visitkorea.or.kr/cms/resource/84/2678584_image3_1.jpg,127.1837471484,37.7471036189,6,20220526105556,36098,9,,봉선사(경기),12001,"봉선사는 크낙새와 수목원으로 널리 알려진 광릉에서 아주 가깝다. 광릉 매표소에서 광릉의 자랑거리 중 하나인 전나무 숲길 따라 남동쪽으로 1.5km쯤 내려가면 수십채의 식당이 영업 중인 동네가 나타난다. 여기서 오른쪽 길로 300m 가량 들어간 곳에 봉선사가 있다. 봉선사의 역사는 고려시대부터 시작된다. 원래 봉선사 자리에는 고려 광종 20년(969년) 법인 국사가 창건한 운악사라는 절이 있었는데 여러차례 난리를 겪으며 폐허가 된 것을 1469년(조선왕조 8대 임금 예종 원년) 정희왕후 윤씨(7대 세조의 왕비)가 세조의 영혼을 봉안코자 다시 일으켜 세운 뒤 봉선사라 개칭했다.  이 후 봉선사는 임진왜란, 병자호란, 한국전쟁 등을 거치면서 소실과 중건을 7차례 했다. 절에서 100m 떨어진 곳에 큰 비석 여러 개가 눈길을 끈다. 그 중 하나가 춘원 이광수선생 기념비다. 그는 일본이 제2차 세계대전에 패하기 전 4년 동안 남양주 사능 부근 작은 집에서 산적이 있는데 그때 한해 겨울을 봉선사에서 지낸 인연이 있다. 당시 주지 스님이 운허라 그런 인연을 맺은 것이다. 비석에는 그가 남긴 글중 일부를 빼곡히 새겨 놓았는데 글은 주요한이 짓고 글씨는 서예가 원곡 김기승이 써서 1975년 가을에 세웠다.  봉선사에 가면 가장 먼저 찾아볼 것이 대웅전 처마 밑에 걸린 현판이다. 대웅전이라 하지 않고 큰법당이라고 한글로 쓴 것이 이채롭다. 1970년 운허선사(춘원 이광수 팔촌 동생)가 대웅전을 세우면서 써서 달았다. 또한, 경내에 봉선사 대종(보물)이 있는데 임진왜란 이전에 만든 동종 중에서 몇 개 남지 않은 것으로 예종 원년(1469)에 왕실의 명령에 따라 만들었다. 조선왕조 전기 동종 연구에 귀중한 자료이다."
경기도 남양주시 조안면 북한강로433번길 186,,31,0,A01,A0101,A01010400,125458,12,20031124090000,http://tong.visitkorea.or.kr/cms/resource/91/738491_image2_1.jpg,http://tong.visitkorea.or.kr/cms/resource/91/738491_image3_1.jpg,127.302374742,37.5710734599,6,20220519133339,91988,9,,운길산,12280," 가벼운 주말 산행을 원한다면, 운길산  운길산(610m)은 서울에서 동쪽으로 40km, 북한강과  남한강이 합류되는 양수리에서 서북쪽으로 4km 거리에 솟아 있는 산이다. 1890년(고종  27)에 지은 《수종사중수기에는 운길로 나오고, 그보다 오래된 《동국여지승람에는  조곡산이라고 적혀 있다. 산 중턱에 있는 수종사에는 지방문화재인 팔각 5층석탑과 500년이 넘는 수령을 자랑하는 은행나무가 있다. 무엇보다도 남한강과  북한강을 한 눈에 내려다 보이는 경관이 뛰어나 해동 제일의 사찰이라 옛사람들은  전했다. 서거정, 초의선사, 정약용, 송인, 이이 등이 머물던 곳으로 시 몇 수가 전해진다. 물 맛이 좋아 차와도 인연이 깊은 곳이다.   운길산 산행의 묘미  산 아래까지 시내버스가 연결돼 교통이 편리하고, 등산로가 순탄하여 가족산행이나 가벼운 주말산행에 적합한 곳이다.  운길산 산행의 묘미는 서북 능선을 타면서부터 맛보게  된다. 수종사에서 나와 북서 능선을 타고 쉬엄쉬엄 걸어 20분 정도 오르면 정상이다.  정상에서 하산 길은 3가지로 올라온 길따라 되돌아 내려 가거나 수종사 지나 왼쪽으로  빠져 송촌리로 내려간다. 또는 정상에서 서북쪽으로 길게 뻗은 능선을 타면 463m고지새재고개고대농장을  거쳐 덕소로 빠지는 종주코스를 밟게 된다."
경기도 남양주시 수동면 비룡로 1635,,31,0,A02,A0202,A02020200,125490,12,20031104090000,http://tong.visitkorea.or.kr/cms/resource/43/220443_image2_1.jpg,http://tong.visitkorea.or.kr/cms/resource/43/220443_image3_1.jpg,127.2752384901,37.7579734649,6,20220223111231,58159,9,,수동국민관광지,12024,"남양주시 수동면의 송천리·운수리·입석리·수산리·비금리 일대는 그 지명이 말해주듯 한 폭의 그림같은 곳이다. 어디를 가나 시원한 물줄기가 흐르고 있어 '물골안'이란 이름으로도 널리 알려져 있다. 주금산과 서리산, 축령산에 둘러싸인 수동국민관광지는 울창한 숲과 깨끗한 계곡이 어우러져 여름철 피서지로는 제격이다. 특히 관리소에서 위쪽으로 1.5㎞쯤 올라간 구간은 바위가 많고 숲이 우거져 여름철에는 수많은 피서객들이 몰린다. 계곡 곳곳에 많은 유원지들이 형성되어 있으며 향토음식점과 민박집들이 많아 사람들의 발길이 끊임없이 이어지고 있다. 이 관광지는 1983년에 조성 되었으며 풍부한 산나물과 수십 여 종의 산과를 비롯, 버섯. 더덕. 고비. 도라지. 두릅 등의 토산품과 토종꿀. 밤. 잣 등이 이곳의 명물이다."
경기도 남양주시 조안면 다산로747번길 11,(조안면),31,0,A02,A0201,A02010700,126806,12,20031014090000,http://tong.visitkorea.or.kr/cms/resource/56/920056_image2_1.jpg,http://tong.visitkorea.or.kr/cms/resource/56/920056_image3_1.jpg,127.2992793643,37.5165547311,6,20220513134818,44730,9,,다산유적지(남양주),12283," 다산 정약용의 마지막 길, 마재(마현부락)의 다산유적지   양수리에서 팔당댐 방향으로 약 3km 거리에 위치한 마재(마현부락)는 경기도 기념물로 지정되어 있는 다산 정약용 선생의 산소가 위치해 있으며, 아울러 다산 정약용을 비롯한 4형제의 생가터가 있는 곳이다. 마재는 그 모양이 혹처럼 불쑥 튀어나와 있어 마치 한강물을 지키는 파수꾼 같다. 마재에서 200m거리에 있는 다산유적지에는 사당과 기념관, 생가터 등이 그대로 보존되어 있고 언덕 위에는 다산의 묘소가 있다. 이 묘소에서 내려다보면 마을과 한강을 넘어 천진암이 있는 앵자봉 계곡이 펼쳐져 있다. 마재에서는 또한 천진암 앵자봉 능선을 멀리 바라다 볼 수 있다. 그리고 지척에 천주교회의 큰 초석이 된 권철신 5형제의 집터가 있는 양근 대감 마을도 있다.    신앙과 유배, 실학 사상으로 정리되는 다산의 삶   다산 정약용은 조선 후기 실학을 집대성한 학자로 우리의 기억 속에 남아 있다. 또한, 약현의 사위가 황사영, 이들 형제의 누이가 최초의 세례자 이승훈의 부인이라는 것을 보면 정씨 형제가 얼마나 천주교와 깊은 인연을 맺고 있었는지 짐작할 수 있다. 이들 중 정다산은 그의 형 약종처럼 순교하지는 않았으나 천수를 다하면서 ""목민심서"", ""경세유표"", ""흠흠심서"" 등 수많은 저서를 남겼다. 그는 본래 요한이라는 세례명을 받고 10여 년간 열심히 신앙 생활을 했고, 신유박해(1801년) 때 배교함으로써 죽음을 면하고 전남 강진으로 유배를 갔다. 실학을 집대성한 5백여 권의 주옥 같은 저서는 바로 이 무렵 18년간의 유배 생활 동안 쓰여진 것이다. 유배 생활을 끝내고 다시 이곳 마재로 돌아온 그는 보속하는 뜻에서 기도와 고행의 삶을 살다 중국인 유방제 신부에게 병자 성사를 받고 75세를 일기로 세상을 떠났다."
경기 남양주시 수동면 내방리,(수동관광지 내),31,0,A01,A0101,A01010900,125489,12,20030806090000,http://tong.visitkorea.or.kr/cms/resource/71/219671_image2_1.jpg,http://tong.visitkorea.or.kr/cms/resource/71/219671_image3_1.jpg,127.276957791,37.7575402135,6,20221017152913,115552,9,,비금계곡,"472-850,1","비금계곡은 남양주시 수동면의 수동국민관광지 안에 자리 잡고 있는 계곡이다. 사방에 서리산, 주금산, 천마산 등이 병풍처럼 둘러싸고 있는 이 계곡은 울창한 숲 그늘이 드리워지고 맑은 물이 흘러 여름 피서지로 인기를 더해 가고 있다. 내방리에서 약 1.5km에 걸쳐 있는데, 아름다운 계곡과 함께 높이 540m의 시루봉 등산을 가볍게 즐길 수 있어 더욱 좋은 곳이다.
수동면은 물골안이라는 별명이 붙을 만큼 물이 맑고 수량이 풍부하여 주변에 물골안유원지·수동계곡·검단이계곡 등 경치  좋은 계곡들이 줄지어 있는데, 검단이계곡 입구에서 비금계곡에 이르는 지역과 비금교 부근에 있는 너래바위 일대가 가장 경관이 좋은 것으로 알려졌다."
