addr1,addr2,areacode,booktour,cat1,cat2,cat3,contentid,contenttypeid,createdtime,firstimage,firstimage2,mapx,mapy,mlevel,modifiedtime,readcount,sigungucode,tel,title,zipcode,overview
경기도 안성시 일죽면 고은리,,31,0.0,A02,A0201,A02010700,128545,12,20050527090000,,,127.4399635704,37.1355486023,6.0,20210904002130,18261,16,,영창대군묘,17525,"조선 선조의 14명 아들 중 유일하게 정비인 인목왕후가 낳은 아들로 선조의 특별한 총애를 받았던 영창대군의 묘이다. 유영경등 소북파의 지지로 이미 세자로 책봉된 광해군 대신에 세차에 책봉될 가능성도 있었으나 선조의 갑작스런 죽음으로 실현되지 못하였다. 광해군 즉위 후 이이첨 등 대북파에 의해 왕위에 위협을 주는 인물로 미움을 받았다.  박응서 등 7명의 서출들이 역모를 꾸몄다는 7서의 옥이 일어났는데, 이들로 하여금 영창대군 추대 음모를 거짓 진술케 하였다. 이 결과 영창대군은 서인으로 강등되어 강화도에 유배되었다가 강화부사가 방안에 가두고 장작불을 지펴 그 열기로 죽게 하였다. 1623년 광해군을 몰아낸 인조반정으로 관작이 복구되었다.조선 시대 왕실의 무덤은 능, 원, 묘로 구별되는데 묘란 일반적인 무덤을 가리키는 말로 왕의 자손이나 후궁, 왕의 아버지인 대원군 등의 무덤을 뜻한다. 영창대군 묘소는 원래 광주군 남한선성 아래에  있었는데 성남시 개발계획에 따라 1971년 8월에 현 위치로 이장되었다."
경기도 안성시 양성면 방신리,,31,0.0,A02,A0201,A02010200,128546,12,20050527090000,http://tong.visitkorea.or.kr/cms/resource/84/486084_image2_1.jpg,http://tong.visitkorea.or.kr/cms/resource/84/486084_image3_1.jpg,127.1699685382,37.0357747059,6.0,20220330174352,18558,16,,무양산성(무한성),17503,"이 성은 산정 고원지에 둥글게 쌓은 석성으로서 이러한 산성은 고대에 많이 축성해 온 형태이다.이 성은 일명「무한성」이라고 현지에서 불려오기도 하는데「신증동국여지승람」한성현 고적조 및 성지조에는 분명히「무양성:현」남쪽 12리 지점에 있는데, 석축이다.둘레는 1천 305척이며 성안에 못 하나가 있다」고 했고, 광무 3년(1899)에 간행한「양성읍지」에도 「무한성 남단아래 고성이 있어 속칭 옛 고을터가 완연하다」고  기록으로 미루어 무한성 또는 백운산이라는 명칭이보다 옳을 것이다.  아마도 무한성이란 이름은 무양이라는 사람이 운수암을 보호하기 위해 이 성을 쌓았다는데서 유래된 것  같이 전해오고 있으나, 이는 근거 없는 속전에 불과할 뿐이다.성곽의 길이나 하단부터의 석축규모로 보아 이 성은 개인의 힘이 아닌 관에 의해 장기간 집단적인 대규모 노역공사로 조성된 것임이 확실하다. 이 성곽의 축성연대는  정확히 알 수 없으나 대략 삼국시대로 추정된다.    연대  삼국시대   규격  길이 약 120m, 높이 2m, 폭 1m  재질  토축 "
경기도 안성시 서운면 청룡길 109-11,,31,0.0,A02,A0201,A02010400,128547,12,20050527090000,http://tong.visitkorea.or.kr/cms/resource/06/2482306_image2_1.jpg,http://tong.visitkorea.or.kr/cms/resource/06/2482306_image2_1.jpg,127.2870280864,36.9117049963,6.0,20220527132654,18337,16,,이해룡고가,17609,"경기도의 제일 남쪽 끝인 차령산맥 줄기의 산간 마을에 자리잡고 있는 조선후기 주택이다. 마을은 서운산의 남쪽 계곡에 계곡물을 앞에 두고 약간 경사진 곳에 작은 규모로 이루어져 있으며 마을의 제일 뒷쪽 약간 높은 곳에 집이 놓여 있고 집 뒤로는 경사진 언덕이 시작된다. 집은 'ㄱ'자형의 안채와 사랑채, 행랑채로 구성되어 소위 튼 'ㅁ'자를 이루고 있으며 사랑채 앞으로 약간의 빈 터가 있고 집뒤 한 단 높은 대지에는 전에 후원을 꾸민 흔적이 남아 있다. 안채 마루도리에 적힌 상량문에 가경(嘉慶)2년 즉 정조21(1797)년에 집을 지었다는 기록이 남아있는데 안채나 사랑채는 처음 지어진 원래의 모습을 그대로 유지하고 있다.   안채는 2칸의 대청을 중심으로 우측에 안방 2칸이 옆으로 이어지고 그 앞으로 부엌 2칸이 이어져 소위 곱은자집을 이루며 대청 좌측에는 건너방 1칸이 있다. 건너방 앞의 툇마루는 대청보다 한 단 높게 꾸미고 그 아래로 방에 불을 지필 수 있는 아궁이를 내었다. 사랑채는 건너방과 이어져 있으며 정면 3칸, 측면 1칸반의 ㅡ자형을 이룬다. 우측으로 2칸은 방이고 나머지 끝에 1칸이 마루가 되어 이 마루에서 뒤로 간채 건너방이 연결되며 앞에는 툇마루가 방과 마루를 이어준다. 방의 창문은 머름을 댄 띠살창으로 가공이 정교하다. 사랑채 우측으로 중문이 옆으로 이어지면서 행랑채가 되어 집의 앞쪽을 감싸도록 되어 있으나 행랑채 부분은 근래 벽돌조로 개조되었다. 집 뒤 언덕의 후원에는 자연석이 군데군데 놓이고 약간의 평지를 이루어 자연스런 맛을 남기고 있다. 2000년에 완전 멸실되었으나, 2006년 11월에 복원하였다.   李海龍 (이해룡)  조선 중기 서예가. 자는 해수, 호는 북악(北嶽). 본관은 경주(慶州). 1588년(선조 21) 사자관(寫字官)으로 통신사 황윤길(黃允吉)을 따라 일본으로 건너가 많은 필적(筆蹟)을 남겼다. 임진왜란 때는 역관(譯官)으로 일본과의 화의교섭에 힘썼다. 95년 동지중추부사, 1602년 사섬시 주부(司贍寺主簿)에 이르렀고 경천군(慶川君)에 봉해졌다. 해서(楷書)에 뛰어났으며, 당시의 대가들로부터 한석봉(韓石峰)에 필적하는 명필이라는 격찬을 받았다. 금석문으로 사현(沙峴)의 양호묘비(楊鎬墓碑)를 썼다."
경기도 안성시 원곡면 만리길 35,,31,0.0,A02,A0201,A02010700,128549,12,20050527090000,http://tong.visitkorea.or.kr/cms/resource/06/2480606_image2_1.jpg,http://tong.visitkorea.or.kr/cms/resource/06/2480606_image2_1.jpg,127.1465477874,37.0589993837,6.0,20220404140703,18137,16,,최규서어서각,17553,"조선 중기의 명신(名臣)으로 영의정을 지낸 충정공(忠正公) 최규서(崔奎瑞 16501735)선생에 내린 영조의 어서(御書)와 영정(影幀)을 모신 정각(旌閣)이다. 영조는 충정공의 공로를 높이 찬양하여 친필로 쓴 「일사부정(一絲扶鼎)」이란 어서(御書)를 하사(下賜)하고 충신정문(忠臣旌門)을 세우게 했다. 그러나 정각이 선 자리에 1915년 미국 대사관이 들어서게 되어 부득이 어서(御書)를 공의 묘소가 있는 지금의 이곳으로 옮겨 모신 것이다.현재 어서각(御書閣)에는 영조의 어서, 충정공(忠貞公)의 위패(位牌), 영정(影幀), 비망기(備忘記) 등을 봉안(奉安)해 놓았으며 매년 음력 10월 6일 후손들이 모여 제향을 올린다. 팔작(八作)지붕의 한식 골기와를 얹은 건물 앞 좌우에는「어서각(御書閣)」「백연사자(白蓮祠字)」란 현판(縣額)이 걸려있다.   최규서 (1650 ∼ 1735)  조선 현종(懸宗) 10년(1669) 진사, 숙종(肅宗) 6년(1680) 별시문과(別試文科)에 병과(丙科)로 급제한 뒤, 대사성, 대제학, 형조와 이조의 판서, 우의정, 좌의정 등을 역임하고 경종(景宗) 3년(1723)영의정에 올라 기노소(耆老所)에 들었다. 소론의 영수(領袖)로서 활약했으며, 특히 영조 4년(1728) 이인좌의 난때는 그 음모와 주동인물을 고변(告變)함으로써 난을 토평(討平)케 하는데 결정적 역할을 했다. 시호는 충정(忠貞)이며, 저서로는「민재집(民齋集)」이 있다.   규격  정면 494cm, 측면 370cm  재질  목조"
경기도 안성시 죽산면 죽산향교길 54-45,,31,0.0,A02,A0201,A02010700,128550,12,20050527090000,http://tong.visitkorea.or.kr/cms/resource/46/1593246_image2_1.jpg,http://tong.visitkorea.or.kr/cms/resource/46/1593246_image3_1.jpg,127.4235415499,37.0825155375,6.0,20210831231904,17524,16,,죽산향교,17519,"1533년(중종 28)에 현유(賢儒)의 위패를 봉안, 배향하고 지방민의 교육과 교화를 위하여 창건되었다. 그 밖에 자세한 기록은 남아 있지 않으며, 1972년에 원장(垣墻)을 신축하였다. 현존하는 건물로는 정면 3칸, 측면 2칸의 대성전, 정면 3칸, 측면 2칸의 명륜당, 동재(東齋)·서재(西齋)·내삼문(內三門) 등이 있다. 대성전에는 5성(五聖), 10철(十哲), 송조6현(宋朝六賢), 우리나라 18현(十八賢)의 위패가 봉안되어 있다. 조선시대에는 국가로부터 토지와 전적·노비 등을 지급받아 교관 1명이 정원 30명의 교생을 가르쳤으나, 갑오개혁 이후 신학제 실시에 따라 교육적 기능은 없어지고, 봄·가을에 석전(釋奠)을 봉행(奉行)하며 초하루·보름에 분향을 하고 있다. 경기도 문화재자료로 지정되어 있으며, 향교의 운영은 전교(典校) 1명과 장의(掌議) 수명이 담당하고 있다."
경기도 안성시 양성면 교동길 33-4,,31,0.0,A02,A0201,A02010700,128551,12,20050527090000,http://tong.visitkorea.or.kr/cms/resource/90/1592090_image2_1.jpg,http://tong.visitkorea.or.kr/cms/resource/90/1592090_image3_1.jpg,127.1971540717,37.0680436893,6.0,20220908131513,17253,16,,양성향교,17502,"조선 숙종 때 현유(賢儒)의 위패를 봉안, 배향하고 지방민의 교육과 교화를 위하여 창건되었다. 창건연대 및 자세한 연혁은 미상이다. 현존하는 건물로는 정면 3칸, 측면 2칸의 맞배지붕으로 된 대성전, 명륜당·내삼문·외삼문 등이 있다. 대성전에는 5성(五聖), 송조4현(宋朝四賢), 우리 나라 18현(十八賢)의 위패를 봉안하고 있다. 조선시대에는 국가로부터 토지와 전적·노비 등을 지급받아 교관이 정원 30명의 교생을 가르쳤으나, 갑오개혁 이후 신학제 실시에 따라 교육적 기능은 없어지고 봄·가을에 석전(釋奠)을 봉행하며 초하루·보름에 분향을 하고 있다. 이 향교는 경기도 문화재자료로 지정되어 있으며, 전교(典校) 1명과 장의(掌議) 수명이 운영을 담당하고 있다."
경기도 안성시 양성면 덕봉리,,31,0.0,A02,A0201,A02010700,128533,12,20050526090000,http://tong.visitkorea.or.kr/cms/resource/67/757267_image2_1.jpg,http://tong.visitkorea.or.kr/cms/resource/67/757267_image3_1.jpg,127.1787758335,37.0444683041,6.0,20211103020018,18311,16,,경앙사,17503,"경앙사(景仰祠)는 1964년 석농(石農) 오진영(吳震泳)선생의 문인들이 선생의 학덕(學德)을 기리기 위해 세운 사당으로 매년 음력 3월 10일에 춘제(春祭)를 드리고 있다고 한다. 현재 이 곳에서는 석농 오진영 선생과 그의 스승인 전우선생과 오희상 선생 등 세 분을 모시고 있다. 건물의 총 건평은 26㎡(8평)으로 겹처마 맞배 지붕의 한옥이며 홍살문, 삼문, 사당 등이 차례로 배치되어 있다. 특히 현판 액자는 석농(石農)의 제자인 월헌(月軒) 이보림(李普林)선생이 썼다고 전해지는데 여기서 경앙은 (高山仰止 景行行止) 즉, 산은 사람을 우러러 보고 길은 사람이 많이 다니므로 천하 만인에게 존경을 받는다라는 의미를 나타낸다고 한다."
경기도 안성시 양성면 덕봉리 108,,31,0.0,A02,A0201,A02010700,128535,12,20050526090000,http://tong.visitkorea.or.kr/cms/resource/42/1954542_image2_1.jpg,http://tong.visitkorea.or.kr/cms/resource/42/1954542_image3_1.jpg,127.1921690189,37.0462266745,6.0,20220617130434,18408,16,,덕봉서원,17503,"1695년(숙종 21) 지방유림의 공의로 오두인(吳斗寅)의 충절과 덕행을 추모하기 위해 창건하여 위패를 모셨다. 1697년에 德峰(덕봉)이라고 사액되어 사액서원으로 승격되었으며 1794년(정조 18) 강당을 중수하였다. 이 서원은 흥선대원군의 서원 철폐 시 훼철되지 않고 존속한 47개 서원 중의 하나이며, 선현배향과 지방교육의 일익을 담당하여왔다. 그 뒤 1979년 사우(祠宇)를 중건하고 1984년에 동재(東齋)와 서재(西齋)를 중건하여, 오늘에 이르고 있다. 경내의 건물로는 6칸의 사우(祠宇), 10칸의 정의당(正義堂), 동재·서재·외삼문(外三門)·내삼문(內三門)·홍살문［紅箭門］ 등이 있으며, 사우에는 오두인의 위패가 봉안되어 있다."
경기도 안성시 도기동 184,,31,0.0,A02,A0205,A02050200,128536,12,20050526090000,http://tong.visitkorea.or.kr/cms/resource/93/190893_image2_1.jpg,http://tong.visitkorea.or.kr/cms/resource/93/190893_image3_1.jpg,127.2641054586,37.0006026717,6.0,20220718111324,18307,16,,안성도기동삼층석탑,17595,"도기동어구 왼쪽 작은 동산에 세워져 있는 석탑이다. 기단(基壇)·탑신(塔身)·옥개(屋蓋) 등 각 부재(部材) 모두 화강암으로 조성, 중적(重積) 되었으며 석탑의 형태는 일반형을 이루고 있다. 수매의 장대석(長大石)으로 지대석을 마련하고, 현재 기단(基壇)에 해당하는 부분과  초층(初層)은 수매의 판석(板石)으로 조립되었으며 양우주(兩隅柱)가 있다.1매석으로 된 갑석(甲石)에는 부연(副椽)이 있고 그 위의 석재들은 탑신부재 또는 기단부재등으로 조립되었다. 옥개 받침이 있는 옥개석은 없으며, 현재 2층에 해당하는 옥개석만 하부에  2단의  받침을 두었을 뿐이다.  옥개는 평박(平薄)하고 추녀는 수평이며 전체적으로 둔중(鈍重)한 느낌을 준다. 현재의 위치가 원위치로 생각되나 법당지(法堂址)등은 상상하기 어렵다. 전체적인 양식으로 보아 고려시대 후기에 조성된 것으로 추정된다.   연대  고려시대   규격  총높이 3.49m  재질  화강암 "
경기도 안성시 죽산면 미륵당길 32-2,,31,0.0,A02,A0205,A02050200,128537,12,20050526090000,http://tong.visitkorea.or.kr/cms/resource/72/2480972_image2_1.jpg,http://tong.visitkorea.or.kr/cms/resource/72/2480972_image2_1.jpg,127.4349432263,37.0850737816,6.0,20210929000017,23685,16,,매산리석불입상,17518,"일죽 IC에서 빠져나와 안성시내로 향하는 길의 오른쪽에 죽산면 매산리가 있다. 여기에 비봉산이 있고, 비봉산을 등지고 서 있는 미륵불이 있는데 이것이 태평미륵이다.미륵은 미륵당이라고 불리는 누각에 모셔져 있다. 미륵의 키가 3.9m이므로, 그 미륵을 보호하는 누각의 높이도 만만치 않다. 미륵의 생김새는 그리 균형미있게 만들어지지는 않았다. 보석으로 장식한 관인 보관을 쓴 얼굴이 몸 전체의 13 이상을 차지하고 있으며, 갸름하고 길쭉한 얼굴에 이마까지 덮고 있는 꽃무늬가 부드럽게 보인다. 가로로 길쭉한 눈과 반달처럼 둥근런 눈썹이 시원스럽다. 둥근 귀가 어깨까지 닿을 정도로 긴데, 소원을 빌러 온 백성들의 목소리에 귀기울이는 미륵의 마음이 담긴 듯하다.  얼굴의 생김새가 이성적인 것에 비해서, 몸집은 당당함마저 풍긴다. 살집 두툼한 손가락과 투박한 어깨선이 그러하다. 누각의 생김새 가운데 눈길이 가는것은 나무 기둥을 받치고 있는 돌인 주초석이다. 오른쪽과 왼쪽에 각각 세개씩의 돌을 네모나게 깎아 세웠는데, 솜씨가 거칠고 투박함이 그대로 드러난다.거칠거칠한 화강암 면을 만져보면 기둥을 다듬던 망치와 정소리가 돌에서 울려나오는 것 같다. 누각 지붕에는 참새 가족이 둥지를 틀어 살며 미륵불의 은혜를 입고 있다. 수다스레 짹짹대는 참새들의 이야기를 듣고 있는 미륵불이 언뜻 웃음짓는 것 같다.미륵불이 있는 마당에는 5층석탑이 놓여 있다. 석탑의 무게가 많이 상해있긴 하지만, 미륵불과 그 모습이 서로 잘 어울린다. 나지막한 담 안에 마련되어 있는 미륵불과 석탑으로 주변 분위기가 고향처럼 편안하다.   높이 3.9m, 가슴둘레 2.1m "
경기도 안성시 고삼면 고삼호수로 141-30,,31,0.0,A02,A0201,A02010700,128539,12,20050526090000,,,127.2693553385,37.0873899728,6.0,20220915161826,19220,16,,서흥김씨삼강정문,17504,"충신 김충수와 그의 아들 함의 효행 및 열녀 두분의 행적을 높이 기려 국가에서 건립한 것으로, 김충수는 임진왜란 때 의병장으로 죽산에서 왜군과 접전하다가 적에게  붙잡히자 같이 싸우던 아들함이 부친을 구하고자 적진에 쳐들어가 적을 무찌르다가 부자가 동시에 순절하여 선조 39(1606)년 김함의 효절을 기려 효자 정문을 내렸고, 숙종 26년(1700)년 김충수의 충정을 기려 충신 정문을 내렸다. 한편 김함의 손녀인 온양 정씨는 병자호란을 당하여 이천 거마산으로 피신했으나  적의 추적으로 욕을 면키 어렵게 되자 두 딸과 함께 못에 투신자살하여 정절을 지켰다. 영조 16(1740)년 열녀정문이 내려졌고, 청주 한씨는 영조 7(1731)년에 부군인  익성(益聖)이 위독하여 손가락을 잘라 수혈을 하는 등 온갖 정성을 다하였으나 임종하니 자식 없는 것은 부도(婦道)를 다하지 못함이라하여 부군을 따라 순절하여 영조 13(1737)년 열녀정문이 내려졌다.   김충수(1549 ∼ 1592)  본관은 서흥(瑞興), 호는 창죽헌(倉竹軒)이며, 죽산부 양지현 월로동(月老洞: 현 고삼면 월향리)에서 출생했다. 6세에 서당에서 글을 깨우쳤으며 재주가 뛰어났다. 9세 때 부친상을 당하고, 이후 모친 한씨가 종창을 앓았는데 반년이 넘도록 치료를 해도 효험이 없었다.그런데 의원이 입으로 고름을 핥아내는 것이 즉효라 하자 이를 시행해 효험을 보았다. 이후에도 모친의 봉양에 열과 성을 다해 효자로서의 칭송이 자자하였다. 45세에 임진왜란이 발발하자 산속에 숨어 있던 사람들을 규합하여 의병진을 조직하고, 죽주성으로 달려가 왜적과 격전을 벌였다. 하지만 노도처럼 밀려드는 적들에 대항하기에는  중과부적이었다. 이에 그의 아들 함(涵)은 적전을 뚫고 부자가 합세하였으나 10월 말경  최후를 맞이하였다.숙종 26(1700)년 증손 후가 정충(旌忠)의 장계를 올렸으나 조정의 홍혜는 하사되지  않았다. 이후 영조 16(1740)년 5대손 대영(大榮)과 7대손 동현(東賢)이 상계하여  삼강정려(三綱旌閭)를 하사받았고 봉정대부 사헌부장령직에 추증되었다.    규격  정면 4칸, 측면 1칸   연대  조선시대  소유자  서흥김씨 종중 "
경기도 안성시 죽산면 죽산리 148-5,,31,0.0,A02,A0205,A02050200,128531,12,20050520090000,,,127.4310493261,37.078227279,6.0,20220523182809,19330,16,,안성 봉업사지 오층석탑,17519,"죽산리 오층석탑은 고려중기 이전 것으로 추정되며 높이가 6m로 여러장의 크고 넓적한 돌로 지대석을 만들고 그 위에 단층 기단을 두고 위에 5층 탑신을 올렸다. 석재  결구에서 균형을 잃지않은 거대한 작품으로 주목되고 있다.  안성시내에는 많은 석탑이 전하고 있으나 그 중에서도 죽산리 5층석탑이 가장 우수하다고 평가받고 있다. 봉업사란 말 그대로 나라를 창업하면서 받들던 절이란 뜻이며, 고려 창업을 기념한 국사찰이었으며 왕건의 영정이 봉안되어 고려가 망하기전 475년동안 고려왕실에서 한해도 빠짐없이 선왕에 대한 예를 올렸던 기록이 있다. 지금은 황량한 빈터에 5층석탑과 당간지주만이 서 있지만 그 당당한 위용에서 한 시절의 영광을 짐작할 수 있다. 특히 5층 석탑은 고구려 양식을 계승한 늠름한 탑으로 고려 초기의 문화적 특징을 잘 보여주고 있으며, 단층기단 위에 5층의 탑신을 구성한 일반형 석탑. 기단부 구성에서 둔중함을 볼 수 있고, 탑신의 양우주가 형식적으로 흐른다. 옥개석 받침이 층마다 정연하게 5단씩이며, 석재 결구에서 균형을 잃지 않은 거대한 작품으로 주목된다.    소유자  국유  재질  화강암  시대  고려시대 "
경기도 안성시 양성면 성하길 80-63,,31,0.0,A02,A0201,A02010800,128528,12,20050519090000,http://tong.visitkorea.or.kr/cms/resource/10/1592110_image2_1.jpg,http://tong.visitkorea.or.kr/cms/resource/10/1592110_image3_1.jpg,127.1697685337,37.0365746099,6.0,20220331164917,21736,16,,운수암,17503,"높이 298m인 고성산은 만세고개 창진휴게소 뒤편에서 운수암에 이르는 등 산코스가 제법 운치가 있다. 안성시 양성면 방신리 쪽에서 오르면 운수암을 먼저 만날 수 있다. 방신리 입구에서 서북쪽을 향해가면 낙엽송과 송림사이로 운수암의 정취가 눈에 잡히며, 청아한 목탁소리가 숲길에 먼저 배웅나오는 운수암은 경기도 문화재자료 25호로 지정되어  있으며, 고려시대 조성한 비로자나 불상이 있다. 운수암은 조선 영조 26년에 창건된 사찰이며, 전설에 따르면 한 보살이  평생  부처님을 모시고 살아갈 것을 결심하고 처음에는 무한성아래에 터를 닦고 있는데 하루는 꿈에  성 안에 절을 지으라는 부처님의 계시를 받고 성안으로 들어가 꿈에 나타난 곳을 찾아가 옛날 절터를 발견하고 그 자리에 절을 세웠다고 한다.  훗날 이 보살이 죽자 잡초가 무성한 이 절을 대원군이 중건하고 국태민안을  기원하면서 친필로 운수암이라고 쓴 친필현판을 내려 유명해진 절이다. 그러나 돌보는 사람이  없어 무너지기 직전인 것을 현암스님이보수하고 대웅전을 불사해 오늘에 이르고 있다."
경기도 안성시 죽산면 두현리,,31,0.0,A02,A0205,A02050200,128529,12,20050519090000,http://tong.visitkorea.or.kr/cms/resource/34/2480934_image2_1.jpg,http://tong.visitkorea.or.kr/cms/resource/34/2480934_image2_1.jpg,127.4123177998,37.0741107487,6.0,20211105190002,17498,16,,두현리 석조삼존불입상,17519,"두현리 석조삼존불상은 태봉산 아래 민가 옆 보호각 안에 봉안되어 있으며 불상은 지상에 노출된 전면에 저부조(低浮彫)로 입상의 삼존(三尊)을 조각하였다. 삼존불상은 허리 이하가 땅속에 묻혀 있어 전체 높이를 알 수 없지만 지상에 노출된 높이가 본존 118cm, 우협시보살(右挾施菩薩)이 86cm, 좌협시보살이 99cm이다.삼불상은 마모가 너무 심하여 세부적인 표현을 알 수 없는데 전체적으로 불신에 비하여 불두(佛頭)가 크게 강조된 것이 특징이다.또 본존은 높은 육계(肉桂)를 지니고 목에는 희미한 삼도(三道)가 표현되었으며 양 어깨를 덮은 통견은 밑으로 늘어져 가슴과 허리 밑으로 U자형의 옷 주름이 길게 늘어져 있다. 석불의 뒷면은 아무 조식(彫飾)을 가하지 않았다.고려시대의 작품으로 추정되지만 훼손이 너무 심하여 불상의 세부 표현을 거의 알 수 없을 정도이다. 두현리 마을 주민들이 더이상의 훼손을 방지하기 위하여 보호각을 만들어 보존하고 있다."
경기도 안성시 양성면 구장리,,31,0.0,A02,A0205,A02050200,128524,12,20050518090000,http://tong.visitkorea.or.kr/cms/resource/22/2480422_image2_1.jpg,http://tong.visitkorea.or.kr/cms/resource/22/2480422_image2_1.jpg,127.2002097247,37.0546230711,6.0,20220708174940,17353,16,,양성 석조여래입상,17502,"양성면 구장리 마을 입구에 수백년된 느티나무 옆에는 미륵불로 신봉되고 있는 '석조여래입상'이 자리하고 있다. 이것은 고려시대에 이 마을이 형성되면서 남녀 한 쌍의 미륵불이 홍수로 떠내려 가 덕봉1리 입구에 묻혀 있으며 현재는 남자 미륵만이 이 곳에 있다고 전해 오는데 풍화도(風化度)나 미륵의 도상(圖像)으로 볼 때 근대에 새로 모신 불상으로 추측된다고 한다. 양성면 석조여래입상은 화강암 판석을 다듬어 주형광배(柱形光背)를 갖춘 여래입상으로서 고부조(高浮彫)로 조각한 것으로 큰 눈과 납작한 코와 튀어나온 일자 입술, 짧은 턱, 늘어진 귀를 갖춘 다소 갸름한 얼굴에 소발(素髮)의 육계를 보이고 있다. 목에는 삼도가 뚜렷하고 각이 진 어깨와 더불어 신체에 비해 팔과 손이 유난히 가늘고 작아 왜소한 느낌을 주고 있다. 또 수인(手印)은 오른 손으로 시무외인(施無畏印)을 짓고 왼 손으로는 여원인(黎元印)을 짓고 있는데 본래 신체보다 앞으로 나와야 할 수인 자체를 신체와 붙여서 부조로 조각하여 어색해 보인다. 불신(佛身)에 결쳐진 통견의 법의는 양팔에서 계단식 주름을 형성하고 복부에서는 U자형 의문을 형성하고 있다."
