addr1,addr2,areacode,booktour,cat1,cat2,cat3,contentid,contenttypeid,createdtime,firstimage,firstimage2,mapx,mapy,mlevel,modifiedtime,readcount,sigungucode,tel,title,zipcode,overview
부산광역시 서구 남부민동 50-40,(남부민동),6,0,A02,A0205,A02050600,2788424,12,20211208022919,,,129.0203302731,35.0907988546,6,20221214142036,0,11,,누리바라기전망대,49259,"누리 바라기 쉼터는 세상을 뜻하는 순우리말인 누리와 바라본다는 의미의 바라기를 합성한 것으로 여유롭게 휴식을 취하면서 부산의 산과 바다, 하늘을 바라본다는 의미에서 붙여진 이름이다. 입구에 도착하면 하늘에서 내려온 용마(龍馬) 이야기를 간직한 천마산의 유래를 토대로 형상화한 말이 세워져 있고, 쉼터(전망대) 가운데는 구름이 나무에 걸려있는 모습을 형상화한 조형물 소리나무가 자리 잡고 있다. 또한 전망대 우측에 세워진 대형 디자인과 벽에는 송도해수욕장을 비롯해 구덕문화공원, 송도해안산책로, 천마산 조각 공원 등 서구 10경을 담고 있다."
부산광역시 서구 원양로 6,(암남동),6,0,A01,A0101,A01011400,2785306,12,20211202225158,http://tong.visitkorea.or.kr/cms/resource/08/2798108_image2_1.JPG,http://tong.visitkorea.or.kr/cms/resource/08/2798108_image2_1.JPG,129.0128152394,35.0547971892,6,20221114104409,1,11,,감천동편부두 / 감천항,49277,"부산 감천항은 북항, 남항, 다대항, 신항과 함께 부산항을 구성하는 대표적인 항만으로 동편, 서편, 중앙 부두로 나누어져 있다. 감천동편부두는 1984년 12월 착공하여 1991년 공영부두로 개장했다. 부산은 북태평양과 남태평양 어장 중간에 위치한 지리적 이점이 있어 수산물 유통 및 가공 업체 냉동냉장창고들이 밀집되어 있다. 2018년 4월 1층 주차장, 2층 화장실과 샤워실, 3층 휴게실로 구성된 편의시설을 추가로 건설했다. 주변에 부산 국제 수산물 도매시장이 들어서 있고, 감천동편부두 아래쪽에 위치한 감천항 동방파제는 사시사철 낚시가 가능한 천혜의 낚시터로 손꼽힌다. 수심과 조류가 원활하고 다양한 물고기가 많이 잡혀 낚시꾼이 많이 찾는 명소가 되었다."
부산광역시 서구 망양로170번길 17-4,(동대신동2가),6,0,A02,A0203,A02030600,2760704,12,20211021193454,,,129.0235904594,35.1143268372,6,20211021193454,2,11,,닥밭골 벽화마을,49215,"닥밭골 벽화마을은 6가지 테마를 가진 벽화마을로, 산복도로를 따라 오르다 보면 만날 수 있는 형형색색의 마을이다. 이 지역은 1953년 부산역전 대화재로 삶의 터전을 잃어버린 사람들이 정착하면서 자연스럽게 형성된 마을로, 2010년 미술작가 구본호 작가가 주민과 봉사자들과 함께 벽화를 그리기 시작하여 마을 전체가 지금의 벽화마을로 재탄생했다. 벽화골목6의 끝에서 만날 수 있는 소망계단은 192개의 계단으로 이루어져 있으며, 아코디언 계단이라고 불리기도 하고, 오르내리며 소원을 빌면 소원을 들어준다고 해서 소망계단이라고도 불린다."
부산광역시 서구 아미로 49,(아미동2가),6,0,A02,A0203,A02030600,2760699,12,20211021193100,,,129.0124473789,35.0998532521,6,20211022235436,1,11,,비석문화마을,49243,"감천문화마을 옆 아미동 비석문화마을. 아미동 비석마을은 부산의 역사를 좀 더 단적으로 보여주는 동네로, 한국전쟁때 피난 온 사람들이 마을을 꾸렸다. 그 이전에는 일제강점기에 조성된 일본인들의 공동묘지가 있어기 때문에 비석마을이라는 이름이 붙었다. 비석마을의 골목에서는 그 흔적들을 볼 수 있는데, 각진 모양의 상석이나 비석들은 가파른 계단의 디딤돌로 쓰이거나 옹벽 또는 집의 주춧돌 등으로 활용되었다. 아픈 역사와 문화를 가진 곳에서 지금의 아름다운 문화 마을로 탈바꿈하기까지 모든 과정이 고스란히 담겨있는 곳이다."
부산광역시 서구 망양로193번길 187,(동대신동2가),6,0,A02,A0202,A02020700,2755009,12,20211008200117,http://tong.visitkorea.or.kr/cms/resource/92/2754992_image2_1.jpg,http://tong.visitkorea.or.kr/cms/resource/92/2754992_image2_1.jpg,129.0279956864,35.112327142,6,20221115145644,1,11,,중앙공원,49214,"중앙공원은 부산광역시 중심지에 있으며, 6·25전쟁 때 피난민들이 판자촌을 이루고 살던 대청산을 휴식처로 가꾸기 위하여 조성된 공원으로 처음에는 '대청공원'이라 불리다가 1986년에 '중앙공원'으로 명칭이 바뀌었다. 가장 높은 곳에 있는 충혼탑은 높이 70m로 나라를 지키다 숨진 호국영령이 잠들어 있는 곳이다. 충혼탑 앞에는 넓은 광장과 야외조각공원, 중앙도서관, 해군전승비, 시민헌장비, 장건상 동상, 전승탑, 산책로 등을 갖춘 체육공원이 있다. 공원 내에 구덕민속예술관이, 예술관 동쪽으로 봉수대와 약수터가 있으며, 북쪽으로 헌장비, 자갈 마당, 협동골이 있고, 서쪽으로 영모비, 궁도장이 있고, 남쪽으로 구덕터널, 관리사무소, 구덕도서관이 있다."
부산광역시 서구 보수대로320번길 59,(서대신동3가),6,0,A02,A0202,A02020700,2744600,12,20210915004734,http://tong.visitkorea.or.kr/cms/resource/23/2744923_image2_1.jpg,http://tong.visitkorea.or.kr/cms/resource/23/2744923_image2_1.jpg,129.014810467,35.1216925172,6,20221004095723,1,11,,대신공원,49200,"부산광역시 서구 서대신동에 있는 대신공원은 1968년 낙동강이 부산광역시의 상수도 수원이 되고 나서 근린공원으로 개방되었다. 오랜 시간 수원지 보호를 위해 일반인의 출입을 금지해 왔다. 덕분에 삼나무와 편백나무, 벚나무 등 수령 70년이 넘은 나무들이 울창하게 숲을 이뤘다. 삼림욕하기에 좋아서 하루 4,000명 이상의 시민이 찾는다. 여러 가지 운동시설 외에도 궁도장, 저수지, 약수터, 산책로 등 다양한 편의 시설이 있어 시민들의 휴식 공간으로 인기가 좋다. 또한 공원 봉우리 정상에는 봉수대가 있어 매년 시민축제 때 봉화를 피워 올리며, 봉수대에서는 부산항과 영도가 한눈에 바라보여 전망이 좋다. 구덕도서관, 구덕야영장, 구덕민속예술관 등 공공시설이 공원 내에 있고 인근에는 송도해수욕장과 용두산공원 등이 있다."
부산광역시 서구 꽃마을로163번길 73,(서대신동3가),6,0,A02,A0202,A02020100,2744597,12,20210915004458,http://tong.visitkorea.or.kr/cms/resource/11/2744911_image2_1.jpg,http://tong.visitkorea.or.kr/cms/resource/11/2744911_image2_1.jpg,129.0057694569,35.1264529287,6,20221206105305,0,11,,구덕문화공원,49200,"부산광역시 서구 서대신동에 있는 구덕문화공원은 구덕산 숲 속에 있다. 부산 전통문화 체험관, 민속생활관, 교육역사관, 닥종이 공예 전시실, 목석원예관 등 다양한 전시관과 폭포, 연못, 꽃길, 산책길 등을 갖춘 자연생태 문화 공간이다. 특히 편백숲은 명상을 즐기기 좋으며, 문화공원 내에 있는 다양한 공간을 이용 후 4곳 이상 방문 스탬프를 찍으면 관리실에서 선물을 주는 행사를 진행 중이다. 또한 야외미술관도 운영 중이며 부산시 공공미술 프로젝트 '우리 동네 미술'을 진행하고 있어 지역 작가들의 개성 있는 미술작품이 곳곳에 설치되어 문화, 예술이 살아 숨 쉬는 시민 휴식공간으로 그 의미를 더하고 있다."
부산광역시 서구 해돋이로183번길 17-4,(초장동),6,0,A02,A0205,A02050600,2721158,12,20210615195015,http://tong.visitkorea.or.kr/cms/resource/12/2720812_image2_1.jpg,http://tong.visitkorea.or.kr/cms/resource/12/2720812_image3_1.jpg,129.0173415667,35.093648481,6,20220519174707,3,11,,천마산하늘전망대,49259,"천마산하늘전망대는 천마산로의 '사진 맛집'으로 불리는 곳으로 부산 원도심과 부산항 일대를 굽어볼 수 있다. 전망대에 올라가면 부부가 손을 잡고 같은 곳을 바라보고 있는 조형물을 볼 수 있는데, 그 이유는 1,400만 관객을 동원한 영화 국제시장의 무대로도 쓰였던 곳이기 때문이다. 2019년 천마산 산복마을 흔적길 조성 사업이 마무리되면서 천마산로는 더 편리하게 정비되었다. 산복도로의 옛 정취는 간직하되 말끔한 모습을 더한 것이다. 현재 천마산로 일대에는 조명과 보행 데크 등이 설치되어 있어 안전한 밤 산책이 가능하다."
부산광역시 서구 암남동 620-53,암남공원 안,6,0,A02,A0205,A02050100,2684738,12,20201123221338,,,129.0220170229,35.0619576685,6,20220311175448,1,11,,송도용궁구름다리,49277,"송도해수욕장 동쪽 송림공원에서 거북섬을 연결했던 추억 속 '송도구름다리'가 암남공원에서 동섬을 잇는 현대판 '송도용궁구름다리'로 재탄생했다. 길이 127m, 폭 2m의 송도용궁구름다리에서는 바다 위를 걷는 짜릿함을 느낌과 동시에 시원스럽게 펼쳐지는 바다 풍광, 기암절벽이 빚어내는 천혜의 경관을 감상할 수 있다."
부산광역시 서구 암남동,,6,0,A01,A0101,A01010500,2614725,12,20190809014427,http://tong.visitkorea.or.kr/cms/resource/24/2614724_image2_1.bmp,http://tong.visitkorea.or.kr/cms/resource/24/2614724_image2_1.bmp,129.019511576,35.0659655069,6,20221208165432,0,11,,송도반도 (부산 국가지질공원),49274,"87천만 년 전인 중생대 백악기말 다대포송도 지역의 동쪽에 위치한 동래단층과 서쪽의 양산단층이 움직이면서 두 단층 사이의 땅이 벌어지고 움푹 꺼져 그릇 모양의 다대포분지가 만들어졌다. 이 분지에는 큰 호수가 만들어지면서 두꺼운 퇴적층들이 쌓이게 되었고, 이 퇴적층을 다대포층이라 한다. 다대포층은 구성하고 있는 암석의 특징(붉은색층의 존재유무, 화산성 물질의 함량)과 퇴적환경의 차이에 따라 다시 하부다대포층과 상부다대포층으로 나뉜다.송도반도에서는 한국의 지질노두 150선에 선정된 다대포층이 해안가를 따라 하부부터 상부까지 연속으로 나타나며, 우리나라 제1호 해수욕장인 송도해수욕장 경관과 함께 공룡알둥지화석, 석회질고토양, 암맥, 단층 등의 지질기록을 만끽할 수 있다."
부산광역시 서구 암남동,,6,0,A01,A0101,A01011300,2614716,12,20190809012532,,,129.0148985467,35.0490923097,6,20221208165442,0,11,,두도 (부산 국가지질공원),49277,"두도는 송도반도 지질명소에서 남쪽으로 500m 떨어진 무인도로 동백나무, 비쭉이, 해송등의 다양한 자생식물과 바다산호, 부산의 상징 새인 갈매기가 서식하는 곳으로 해안절벽을 따라서는 백악기말에 퇴적된 하부다대포층과 화산암들이 절경을 이루고 있다.두도는 하위의 유천층군 화산암류와 상위의 하부다대포층의 부정합면이 잘 나타나는 곳으로 다대포층의 층서설정에 중요한 학술적 가치를 지닌 곳이다. 하부다대포층에서는 공룡알 둥지화석, 석화목, 석회질 캘크리트 등의 퇴적기록과 정단층, 주향이동단층, 암맥 등의 다양한 지질구조도 관찰된다. 육지와 가까이 위치해 낚시꾼들이 즐겨 찾는 곳이기도 하며, 무인등대가 설치되어 있어 항해하는 석박의 길잡이 역할도 하고 있다."
부산광역시 서구 송도해변로 171,(암남동),6,0,A02,A0203,A02030600,2504464,12,20170828204609,http://tong.visitkorea.or.kr/cms/resource/27/2661227_image2_1.jpg,http://tong.visitkorea.or.kr/cms/resource/27/2661227_image3_1.jpg,129.0234248332,35.0766810472,6,20220506154000,6342,11,,부산 송도해상케이블카,49269,"송도해수욕장에 위치한 송도해상케이블카는 우리나라 제1호 공설해수욕장인 송도해수욕장의 옛 명성을 되살리기 위해 29년만에 복원되었다. 부산에어크루즈는 해수욕장 동쪽 송림공원에서 서쪽 암남공원까지의 구간을 바닥이 투명한 크리스탈캐빈을 포함하여 최신기종인 캐빈 39기가 운행된다. 특히, 바다 위를 가로질러 운행함으로써 부산 송도일대의 빼어난 풍광을 즐길 수 있다. 이 밖에 국내 최초의 케이블카 뮤지엄 '송도 도펠마이어 월드', 아시아 최초의 공중그네 '스카이스윙'. 테마파크 포토서비스 등 다양한 테마시설과 볼거리를 제공한다."
부산광역시 서구 엄광산로40번길 121-22,(서대신동3가),6,0,A02,A0201,A02010800,777057,12,20090811230634,,,129.0122827767,35.1265474825,6,20220518155451,33137,11,,내원정사(부산),49200,"미륵 보살이 머무르고 있는 천상(天上)의 정토(淨土) 도솔천, 세계의 중심인 수미산(須彌山) 꼭대기에서 12만 유순(由旬)위에 있는 욕제 6천 중제 4천인 도솔천은 이상적인 불교세계로서, 내원(內院)과 외원(外院)으로 구성되어있다. 특히, 내원은 석가모니가 인도에 태어나기 직전까지 머무르면서 중생교화를 위한 하생(下生)의 때를 기다렸던 곳이며, 미래불인 미륵보살이 현재 이 내원에서 설법하며 남섬부주(南贍部洲)에 하생하여 성불할 때를 기다리고 있는 곳이기도 하다. 그러므로 이 땅에 미륵 신앙이 싹트기 시작하면서 도솔천은 자연스럽게 불교의 이상세계의 극락정토로 인식돼 온 것이다. 금정산과 백양산, 고원견산의 흐름을 천마산과 다대포의 몰운대까지 이어지는 구덕산(九德山, 565m)은 예로부터 도솔산으로 불려온 불연(佛緣)깊은 산이다.

도솔천에의 상생을 꿈꾸며 불리웠을 이 도솔산 자락에 내원정사가 존재함은 윤회를 거듭하며 혼탁한 삶 속에 존재하는 우리에게 어떤 의미를 던져주기에 충분한 것이다. 근세 격동기에 민족의 정신적 지주로서 후학들의 등불로 청백가풍(淸白家風)을 열어오면서 선(禪) 교(敎) 율(律)에 모두 달통해 후세에 길이 정신적 귀감이었던 석암당 혜수 대종사를 모시고 현 주지 정련스님의 큰 원력으로 1973년에 시작하여 10년 여의 대작불사로 조성된 가람이 오늘에 이르고 있는 내원정사는 현재 연건평 1,000평에 이르고 있다.

창건 이후 83년까지 1차 불사로 5천 평의 대지위에 60평 전통목조의 대웅전을 위시하여 112평의 관음전, 85평의 요사채, 25평 종루 등 12동의 대소당우를 조성함으로써 웅장한 가람의 위용을 드러낸 내원정사는 대웅전 내부에 주불 대신 67년 중국에서 모셔온 부처님 진신사리가 봉안된 5층 목탑을 조성하고 3면에 정엄한 목탱화를 조성, 독특한 미(美)를 자랑하며, 도심 가까이서 찾을 수 없는 천혜의 자연경관과 함께 정법구현의 도심포교도량으로서 그 역할을 다해왔다. 또한, 2차 불사로 85년 불교유치원을 설립, 1만 5천 평 부지위에 연건평 1100평 규모의 현대식 건물을 건립하고 현재까지 매기 15개반 600명의 원생들을 배출, 불교유아교육의 장으로 확고한 자리매김을 하고 있다.

 내원정사의 문화재, 내원정사수장묘법연화경 

묘법연화경은 흔히 법화경(法華經)으로 불리며, 화엄경(華嚴經)과 더불어 한국 불교의 근본 경전 중 우리나라에 유포된 불교 경전 가운데 가장 많이 간행된 경전이다. 내원정사에서 소장하고 있는 묘법연화경은 인조10년(1632) 삭령 용복사(龍腹寺)에서 간행된 7권 3책과 인조 27년(1649) 양산 통도사(通度寺)에서 간행된 7권 3책 등 총 14권 6책의 목판본으로서 간행된 연도와 간행처가 명확하여 수많은 묘법연화경의 간행 내역 등을 밝히는데 표식이 되는 자료이다."
부산 서구 암남동,,6,0,B02,B0201,B02011000,129093,12,20060629090000,http://tong.visitkorea.or.kr/cms/resource/97/1982397_image2_1.jpg,http://tong.visitkorea.or.kr/cms/resource/97/1982397_image3_1.jpg,129.0151035714,35.0679652024,6,20220525182046,21028,11,,송도마을,"602-030,1"," 바다와 송림이 아름다운 어촌마을, 송도마을  아미동의 유래가 된 아미골의 남쪽이란 의미에서 이름 붙여진 암남동은 암남반도 남쪽에 자리잡고 있으며, 천마산 남쪽 기슭에서 해변까지의 송도(松島)가 마을의 중심을 이루고 있다. 1913년 무렵 한국에서 처음으로 해수욕장이자 관광지로 개발된 송도는 소형 어선을 이용한 어선어업, 마을어업, 양식어업 등에 종사하는 전형적인 도심형 어촌으로 사계절 싱싱한 수산물이 생산되며, 배를 이용해 가족단위의 선상낚시를 즐길 수도 있다.  서구에 자리한 제1호 해수욕장, 송도 해수욕장  해수욕장 오른편에 있는 거북섬에 소나무가 자생하고 있어 송도라는 이름이 붙여졌다. 일제 강점기 때 일본 거류민이 송도 유원주식회사를 설립하고 수정이라는 휴게소를 설치한 뒤 바다 기슭의 사장을 해수욕장으로 개발하였는데, 이것이 한국에서는 처음 개발된 해수욕장이다. 옛날부터 해수욕장으로 이름을 드높였으나 바닷물이 오염되고 백사장이 줄어들어 한동안 송도 해수욕장은 침체를 겪었다. 하지만 5년 여 간 대대적인 정비사업을 통해 사계절 즐길 수 있는 해변공원으로 새롭게 태어났다."
부산광역시 서구 암남공원로 185,(암남동),6,0,A02,A0202,A02020100,128829,12,20060310090000,http://tong.visitkorea.or.kr/cms/resource/17/1783617_image2_1.jpg,http://tong.visitkorea.or.kr/cms/resource/17/1783617_image3_1.jpg,129.0151037432,35.0616492424,6,20220318170331,42337,11,,부산 암남공원,49276,"넓이는 56만 2500㎡이다. 자연공원으로 동편에 남항, 서편에 감천항, 앞쪽에 동물검역소와 인접하여 있다. 남쪽에는 한려해상국립공원이 연결된다. 부산 서구 암남동에 위치한 암남공원은 부산의 번화가인 남포동에서 불과 4㎞에 불과하다. 옛날엔 혈청소 입구로 불리던 이 길은 해안절경이 빼어난데다 송도해안과 부산 남항을 한 눈에 조망할 수 있다.1972년 12월 30일 건설부고시로 공원으로 지정되었다. 그러나 군사보호구역 내에 묶여 한동한 출입이 통제되다가 1996년 4월 5일 개방되었다. 이후 총사업비 34억원을 투자하여 전망대·구름다리·산책로·광장·야외공연무대 등의 시설과 주차장을 조성하였다. 해양성 수목이 숲을 이루고 있으며 기암절벽이 깎아지른 듯 솟아 있어 푸른 바다와 함께 절경을 이룬다. 이곳에서 빗살무늬토기·패총 등 신석기시대 유물이 발견되기도 하였다.

입구에서 오솔길을 따라 오르는 산길은 소나무가 울창하여 삼림욕을 즐길 수 있으며, 구름다리를 타고 오르는 정상에는 전망 좋은 정자가 서 있다. 군데군데 체육시설이 설치되어 있고, 바닷가 쪽으로는 바다낚시를 할 수 있는 시설이 갖추어져 있다. 앞으로는 자연학습장도 조성하여 문화와 생태학습 공간으로도 활용할 계획이다. 송도해수욕장에서 도보로 20분 거리에 있으며, 인근에 두도공원과 송림공원이 있다. 약 1억 년 전 형성된 퇴적암과 원시림, 101종의 야생화와 374종의 식물 등 도심 속에서 보기드문 자연생태가 군락을 이루고 있으며 낚시터, 전망대, 산책로 등을 갖춘 원시 자연공원이다. 입구에서 오솔길을 따라 오르는 산길은 소나무가 울창하여 삼림욕을 즐길 수 있으며, 구름다리를 타고 오르는 정상에는 전망좋은 정자가 서 있다. 군데군데 체육시설이 설치되어 있고, 바닷가 쪽으로는 바다낚시를 할 수 있는 시설이 갖추어져 있다."
부산광역시 서구 송도해변로 100,,6,0,A01,A0101,A01011200,126122,12,20031209090000,http://tong.visitkorea.or.kr/cms/resource/86/2504686_image2_1.jpg,http://tong.visitkorea.or.kr/cms/resource/86/2504686_image2_1.jpg,129.016458847,35.0739256715,6,20220628171758,46293,11,,부산 송도해수욕장,49269,"백사장 길이 800m, 너비 50m, 평균수심 11.5m. 부산 자갈치시장에서 3km 떨어진 곳에 위치하며, 부산에서 제일 먼저(1913년) 개장한 해수욕장이다. 2000년부터 5년여 간 정비사업을 펼쳐 줄어든 백사장을 확장하고 분수대 등을 설치하며 해변공원이 되었다. 주위에 수산시장과 암남공원 등이 있다.1913년 부산에서 최초로 개발된 해수욕장 구역으로, 1996년 4월, 군사보호구역에서 개방된 도시 자연공원인 암남공원과 바다낚시로 유명한 두도공원으로 연결된 송도는 울창한 원시림과 자연 그대로 보존된 기암괴석, 그리고 부산의 상징인 갈매기와 멀리 영도를 배경으로 한 조용한 바다정경이 장관인 곳이다.  주변에 다양한 숙박시설과 먹을거리를 갖추고 있으며 구름다리, 산책로, 보트장, 주차장 등 편의시설이 잘 갖추어져 있다. 송도 해안의 암남공원은 해안 생태 공원으로 송도 해안과 부산 남항을 한눈에 담을 수 있는 전망대, 3.8km의 산책로, 도로변 카페, 횟집들이 즐비한 곳이다. 부산시 서구 부민동 3가에는 한국전쟁 중 부산이 임시 수도였을 때 3년 동안 대통령 관저로 사용된 임시수도기념관이 있다. 송도는 이처럼 격변의 역사를 보낸 서구 암남동 장군반도 남단에 자리잡고 있다."
부산광역시 서구 망양로193번길 187,(동대신동2가),6,0,A02,A0202,A02020100,126856,12,20031208090000,,,129.0278123742,35.1121382707,6,20211223193244,29679,11,,부산 중앙공원,49214," 야경이 아름다운 곳, 중앙공원(대청공원)  중앙공원은 구)대청공원과 구)대신공원을 포함하여 구봉산, 엄광산 일대를 통칭하고 있으며 국가와 민족을 위해 희생한 영령의 숭고한 마음을 후손들에게 널리 알리고자 충혼탑, 4.19위령탑, 광복기념관, 각종 기념비등으로 조성된 부산의 대표적인 사적테마 공원이다. 6.25동란 때 판자촌을 이루었던 대청산을 공원으로 조성한 곳으로 부산항이 한눈에 내려다보이는 아름다운 야경을 볼 수 있어 더욱 유명한 곳이기도 하다.공원 내에는 70m 높이로 부산·경남출신 전몰장병의 영령들을 9,279위 모시고 있는 충혼탑과 해군전승비, 시민헌장비, 중앙공원비 및 대한민국 임시정부의 국무위원인 장건상 동상이 있다. 이러한 중앙(대청)공원에는 사철을 두고 언제나 꽃을 볼 수 있는 꽃동산이 가꾸어지고 있고 각종 조각들이 야외 전시되어 조각공원으로서도 시민들에게 인기가 있다. 또한 중앙공원 경내 순환도로에는 게이트볼장, 배드민턴장 등이 만들어져 있어 누구나 쉽게 운동을 즐길 수 있으며 이른 새벽에는 주로 장년층을 대상으로 한 기공체조, 에어로빅 등도 실시되어 서민들의 생활 속에 살아있는 공원이다. 부산시 도시계획공원조성 변경결정에 의거, 1986년 12월 2일자로 중앙공원으로 변경되었다."
