addr1,addr2,areacode,booktour,cat1,cat2,cat3,contentid,contenttypeid,createdtime,firstimage,firstimage2,mapx,mapy,mlevel,modifiedtime,readcount,sigungucode,tel,title,zipcode,overview
부산광역시 기장군 기장해안로 172,스타테라스건물 2층,6,,A02,A0203,A02030600,2828578,12,20220722100059,http://tong.visitkorea.or.kr/cms/resource/55/2828555_image2_1.jpg,http://tong.visitkorea.or.kr/cms/resource/55/2828555_image3_1.jpg,129.2177964393,35.1920578383,6.0,20220801090941,1,3,,부산 칠드런스 뮤지엄,46084.0,"부산 칠드런스 뮤지엄은 세계 최고 어린이 시설인 미국의 인디애나 폴리스 칠드런스 뮤지엄의 노하우로 설립된 1,100평 규모의 실내 체험형 박물관으로 기장 오시리아 관광단지에 위치해 있다. 
STEM Science(과학), Technology(미래기술), Engineeing(공학), Math(수학) 을 접목시킨 36가지의 특별한 체험을 통해 아이 스스로 문제를 인식하고, 창의적 해결방법을 설계하여 문제를 해결하는 능력을 배우고, 자연과학과 순수예술을 아우르는 여러 가지 테마관에서 놀이를 통한 교육으로 자신의 상상력과 창의력을 고취 시키고 무한한 잠재력을 발견 할 수 있어  놀이 위주의 테마파크, 키즈카페에 차별점을 두어 방문 고객들에게 큰 호응을 얻고 있다. 
여름에는 덥고 비가 많이 오는 부산의 계절과 날씨에 영향을 받지 않고 체험을 즐길 수 있고, 설계 단계에서부터 체험공간들을 격벽으로 분리하는 방식으로 접촉을 최소화해 작년 코로나19의 상황 속에도 안전하고 청결한 실내를 유지하여 다수의 어린이집, 유치원, 학교의 현장학습을 유익하고 안전하게 진행하였으며, 올해도 많은 단체 체험을 진행중이다. 단체 방문 후 어린이들이 부모님과 재방문할 정도로, 부산의 핫 플레이스로 자리매김하였다."
부산광역시 기장군 동부산관광로 42,,6,,A02,A0202,A02020600,2815627,12,20220408140251,http://tong.visitkorea.or.kr/cms/resource/19/2815719_image2_1.jpg,http://tong.visitkorea.or.kr/cms/resource/19/2815719_image3_1.jpg,129.212999524,35.1960684107,6.0,20220503175847,6,3,,부산롯데월드,46083.0,"마법과 환상의 세계 롯데월드 어드벤처가 부산에서 개장했다. 숲속의 청량함과 짜릿한 스릴감을 완벽하게 즐길 수 있도록 준비되어 있다. '놀이공원'하면 떠오르는 언제나 즐겁고 신나는 공연 그리고 퍼레이드를 경험할 수 있다. 
부산롯데월드는 대한민국 제 2의 도시라고 불리는 부산에 세워진데다 대중교통을 이용한 접근성도 편리해 개장 첫날부터 끊임없는 발길이 이어지고 있다. 롯데월드 부산은 6개의 테마존으로 꾸려져 있다. 요정 마을 팅커폴스 존 중심에 토킹트리가 있는데 이 나무는 애니매트로닉스 기술이 적용되어 파크 내 6개 테마에 대한 이야기를 들려준다. 롯데월드 내 가장 높은 곳에 위치한 로얄가든 존의 로리캐슬은 물에 떠있는 듯한 모습으로 연출되어 있으며 부산의 전경과 함께 기장 앞 바다를 한눈에 즐길 수 있다. 이외의 놀이 기구들 특히 자이언트 디거, 자이언트 스플래쉬 등 대표 어트랙션은 그 짜릿함이 벌써 입소문을 타고 있다. 
이렇게 어른들을 위한 어트랙션 뿐만 아니라 유아를 동반한 가족 이용객을 위한 놀이 기구도 준비되어 있다. 날씨와 관계 없이 아이와 안전하게 즐길 수 있도록 실내에 배치되어 있다. 놀이공원의 하이라이트라고 할 수 있는 퍼레이드는 하루에 2번, 약 30분간 진행된다."
부산광역시 기장군 기장읍 죽성리 154-21,,6,0.0,A02,A0203,A02030600,2789668,12,20211209001737,http://tong.visitkorea.or.kr/cms/resource/99/2795799_image2_1.jpg,http://tong.visitkorea.or.kr/cms/resource/99/2795799_image2_1.jpg,129.2441706504,35.2381614989,6.0,20221110113256,1,3,,월전장어구이촌,,기장 월전마을에 들어서면 장어구이집이 늘어서 있고 주차장을 낀 월전 활어판매장이 보인다. 이 근방의 장어구이 식당을 통칭하여 월전 장어 구이촌이라고 한다. 활어판매장에서는 그날 잡은 싱싱한 바닷장어(붕장어)들을 판매한다. 마음에 드는 매장에서 장어를 고르면 판매장 밖에 늘어선 포장마차들 중 구입한 매장 상호와 같은 포차에서 숯불에 구워 먹을 수 있다. 바다가 보이는 허름한 포장마차이지만 이 장어구이의 냄새와 어촌 분위기를 잊지 못해 다시 찾는 이가 많다. 상차림비만 내면 숯과 불판이 무한 제공되고 먹고 싶은 만큼 활어판매장에서 구매해 먹을 수 있다. 얼큰한 매운탕도 장어구이와 함께 먹기에 좋다.
부산광역시 기장군 철마면 개좌로 679-30,,6,0.0,A02,A0203,A02030600,2783683,12,20211130221059,http://tong.visitkorea.or.kr/cms/resource/77/2795777_image2_1.jpg,http://tong.visitkorea.or.kr/cms/resource/77/2795777_image2_1.jpg,129.1478284558,35.2590462559,6.0,20220720151114,2,3,,부산라벤더팜,46049.0,"기장군에 자리한 부산 라벤더팜은 라벤더와 로즈마리를 전문으로 재배하는 농장이다. 이곳에서 생산된 라벤더와 로즈마리는 증기증류법을 통해 에센셜오일과 플로럴워터로 생산해 판매한다. 부산 라벤더팜은 라벤더 시즌인 57월과 알밤 시즌인 910월에 농장을 개방해 방문객들에게 특별한 경험을 선물한다. 특히 라벤더 시즌에는 보랏빛 물결이 일렁이는 풍경으로 눈길을 사로잡는다. 짙푸른 산자락에 둘러싸인 라벤더밭이 마치 수채화를 보는 것처럼 싱그럽다. 곳곳에 보라색 파라솔과 테이블을 시작으로 온통 보랏빛으로 단장한 조형물들이 세워져 사진을 찍기에도 좋다. 입장료를 지불하면 그 금액만큼 라벤더 화분이나 농장에서 생산된 미스트, 오일, 방향제 등과 교환할 수 있다."
부산광역시 기장군 철마면 웅천리 254-4,,6,0.0,A01,A0101,A01010700,2782765,12,20211129222303,http://tong.visitkorea.or.kr/cms/resource/58/2794158_image2_1.jpg,http://tong.visitkorea.or.kr/cms/resource/58/2794158_image2_1.jpg,129.1695450043,35.2954092493,6.0,20211214014933,2,3,,곰내연밭,,"부산에서 여름에 가볼 만한 곳으로 인기가 많은 곳이다. 부산 기장군에 있으며, 철마중리연꽃공원이라고도 불린다. 연꽃 개화 시기는 7월부터 8월 사이라 이 시기에 방문하면 가득 핀 연꽃을 볼 수 있다. 연꽃, 연잎과 함께 개구리나 다양한 곤충들도 볼 수 있어 어린이들과 함께하기 좋다. 근처에는 산책하기 좋은 곰내재 숲속 쉼터도 있고, 연잎이나 연을 재료로 하는 식당도 있다. 공원 내 음식물 섭취 금지이며 반려동물은 동반할 수 있으나 땅이 질척한 편이라 산책 시 유의해야 한다."
부산광역시 기장군 기장읍 시랑리 62-22,,6,0.0,A01,A0101,A01010500,2782658,12,20211129195043,http://tong.visitkorea.or.kr/cms/resource/18/2795918_image2_1.jpg,http://tong.visitkorea.or.kr/cms/resource/18/2795918_image2_1.jpg,129.2294674968,35.1974852256,6.0,20220818093659,1,3,,오시리아 해안산책로,46083.0,오시리아 해안 산책로는 탁 트인 바다와 중간중간 멋스러운 풍경을 바라볼 수 있는 쉼터가 잘 갖추어져 있어 아이들과 함께 걷기에도 좋다. 계절마다 피고 지는 다양한 야생화와 그림 같은 해안 절경을 따라 걷다 보면 어느새 소나무가 우거진 숲으로 이어진다. 울창한 소나무 숲이 한낮의 뜨거운 햇살을 가려줘 여름에는 더위를 잠시 피할 수도 있다. 소나무 사이로 들리는 파도 소리도 몸과 마음을 시원하게 해준다. 해안산책로 한편에는 부산 동쪽 바다를 지키는 용왕을 모신 사당인 용왕단도 자리해 눈길을 끈다. 깎아지른 절벽 위에 세워져 웅장하면서도 경건한 분위기를 풍긴다. 용왕단이 바라보이는 자리에 흔들의자도 세워져 산책의 색다른 재미를 더한다. 이곳 산책로는 지난 2019년 대한민국 조경대상에서 문화체육부 장관상을 받기도 했다.
부산광역시 기장군 정관읍 용수공단2길 70-14,,6,0.0,A02,A0201,A02010800,2776998,12,20211122194701,,,129.1611033114,35.3229198954,6.0,20211125002110,0,3,,석탑사,46006.0,부산 기장군 정관 신도시가 내려다보이는 백운산 자락에 있는 석탑사는 도심 속 여유와 휴식이 필요할 때 찾을 수 있는 사찰이다. 원효대사와 의상대사가 정관읍 용수리 덕전마을을 지나다 동해에서 비치는 광명 속에 계시던 미륵부처님을 보고 백운산 가장 높은 봉우리에서 수도하였다는 것이 석탑사의 전설이다. 3층 석탑이 반기는 석탑사에서는 불교 기초교리 강좌와 경전 강좌를 진행하고 있어 부처님의 지혜와 자비에 대한 이해를 높일 수 있다. 작은 절이지만 파란 하늘을 향해 우뚝 솟은 소나무의 정기에 힘을 얻을 수 있다.
부산광역시 기장군 장안읍 해맞이로 253-38,,6,0.0,A02,A0201,A02010800,2776386,12,20211119191458,,,129.2662747102,35.3228663067,6.0,20221207135713,0,3,,묘관음사,46038.0,"묘관음사는 1943년 운봉(雲峯) 선사에 의해 창건된 이후 수행도량으로 자리매김했다. 일제강점기 암울하고 불행한 시기에 고통받는 중생을 제도하기 위한 일환으로 창건되었다. 일주문 계단에 올라서면 8각 9층의 구극탑과 대웅전이 보인다. 고리원자력발전소가 있는 기장에 지난 2012년 고리 원전 비리 사태 이후 평화와 안전을 기원하는 마음으로 황룡사 9층 목탑에 빗대어 조성하였다고 한다. 원자력의 평화적 이용, 개인의 부정(不正), 사회의 부조리 등의 악순환을 끊고자 하는 바람이 담겨있다. 또한 묘관음사에는 부산광역시 문화재자료로 지정된 탱화와 불자가 있으나 공개되고 있지는 않다."
부산광역시 기장군 일광면 이천리 170-8,,6,0.0,A01,A0101,A01011400,2776281,12,20211119182718,,,129.2446918963,35.2717466345,6.0,20211125021617,0,3,,이동항,46041.0,"기장 작은 어촌마을인 이동항은 주차장이 넓고 화장실도 잘 갖추어져 있어, 차박 장소로 급부상하고 있다. 차에서 누리는 피크닉인 차크닉을 통해 잔잔한 바닷가를 바라보며 고기를 구워 먹거나 라면을 끓여 먹어도 분위기가 살아난다. 아무것도 하지 않고 아무 생각을 하지 않아도 흐르는 시간 속에 아 지금 이 순간이 참 좋다는 감탄사가 절로 나오게 된다. 이동항에서는 전마선 낚시도 가능하다. 도다리, 학꽁치가 주로 잡힌다. 다른 관광객들과 거리를 둘 수 있는 언택트 관광지가 부상하면서 차박 캠핑을 찾는 이들이 많아지면서, 이동항을 찾는 이들도 점차 늘고 있다."
부산광역시 기장군 일광면 달음길 101,,6,0.0,A02,A0201,A02010800,2776276,12,20211119182301,,,129.2225232855,35.3112806782,6.0,20221206110930,0,3,,옥정사,46047.0,"옥정사(玉井寺)는 헌종 1년(1835)에 창건된 절이 절터만 남아 방치되었던 곳을 승려 박긍해(朴亘海)가 1907년에 다시 만든 사찰로 부산 달음산 기슭에 자리한 불국사의 말사이다. 달음산은 동해 해돋이의 햇살이 우리나라에서 가장 먼저 닿는 산으로 유명하다 한다. 당시 박긍해는 마을 친구에게 희사(喜捨)받은 옛 절터 부지에 작은 초가집과 토굴을 만들어 참선하는 승려들이 찾아오도록 하였다 한다. 이후 증축, 개축이 이어졌고 1994년에는 스리랑카에서 부처님의 진신사리를 모셔와 3층 석탑에 모셨다. 2020년 기장군은 옥정사 인근에 편백숲 둘레길을 조성하여 산책길과 숲속 쉼터 등의 힐링 공간을 만들어 관람객들의 힐링을 돕고 있다."
부산 기장군 기장읍 연화리 297-5,,6,0.0,A01,A0101,A01011600,2775577,12,20211118005421,,,129.2230814903,35.2138277212,6.0,20221014162443,0,3,,젖병등대,46082.0,"2009년 부산지방해양항만청에서 만든 젖병 모양의 등대다. 등대를 세운 2009년은 부산이 전국에서 출산율이 가장 낮은 도시로 10년째 선정되던 해로, 저출산 시대의 위기를 극복하고자 출산 장려를 기원하는 의미에서 만들어졌다. 부산에 사는 영·유아 144명의 발 도장과 손 도장이 양각으로 제작되어 있다. 방파제 길을 따라가면 연도별로 출산율이 어떻게 변화해왔는지도 볼 수 있다. 딸·아들 구별 말고 둘만 낳아 잘 기르자던 시대에서 잘 키운 딸 하나 열 아들 안 부럽다가 되었다가 이제는 아이가 미래라는 시대가 되었다. 이색적인 등대에서 인생 샷을 찍기 위해 전국에서 많은 관광객들이 몰려들고 있다."
부산광역시 기장군 일광면 문오성길 510,,6,0.0,A01,A0101,A01011400,2775570,12,20211118005111,,,129.2602897934,35.2986216905,6.0,20211124235513,0,3,,칠암항,46040.0,"칠암항은 방파제가 있는 항으로 야구 방망이와 글러브, 야구공을 형상화 한 야구 등대가 세워지면서 유명해진 곳이다
야구팬이라면 한 번쯤 찾아가 볼 만한 곳으로 한국 야구사에 길이길이 남을 명승부였던 2008년 베이징 올림픽에서 금메달 신화를 만든 것을 기념하여 세운 이색 등대이다
롯데 자이언츠의 무쇠팔 투수 故 최동원 선수를 기리는 추모관도 있다. 
야구등대로 가는 방파제와 탐방도로도 잘 정비돼 있다
참고로 하얀 야구등대 가까이 노란 등대와 빨간 등대도 있는데, 
빨간등대는 갈매기 등대, 노란 등대는 붕장어 등대로 불린다,
이 지역 대표 먹거리인 바닷장어를 파는 음식점도 가까이에 많다."
부산 기장군 일광면 학리 251-13,,6,0.0,A01,A0101,A01011400,2775565,12,20211118004931,,,129.2477530679,35.2599730111,6.0,20211125000303,1,3,,학리항(학리방파제),46045.0,"부산광역시 기장군 일광면 학리에 있는 어항으로 기장 해안가의 오래된 포구이다. 멸치로 유명한 대변항과 회로 유명한 칠암항 다음으로 기장군내에서는 규모가 큰 항이기 때문에 어선을 보호하기 위해 만들어진 방파제가 있다. 활어를 유통, 판매하고 있으며 어촌 마을인 학리마을, 북쪽의 일광 해수욕장과 연결된 해변로를 따라 산책할 수 있다. 전국에서 처음으로 미역과 다시마를 양식하기 위하여 기르는 종묘를 생산하고 양식에 성공을 거둔 곳이기도 하다. 크고 작은 방파제와 빨갛고 하얀 등대가 어촌의 풍경을 자아내는 포구이다."
부산광역시 기장군 기장읍 기장해안로 340,,6,0.0,A02,A0201,A02010800,2775559,12,20211118004653,,,129.22576204,35.2055759171,6.0,20221205152556,0,3,,해광사,46082.0,"해광사는 기장 해변의 오랑대 앞에 자리한 작고 소박한 사찰이다. 부처님 말씀이 바다처럼 넓고 깊다는 뜻의 해(海)와 중생의 길을 밝히는 빛의 광(光)의 의미를 담고 있다. 100여 년 전 승려 김목암이 창건하였다고 전해온다. 바다에서 인양한 목조불상을 봉안한 것이 절의 역사인데, 바닷물에 오래 잠겨있던 목조불상의 보존처리가 제대로 되지 않아 1974년 법당 언덕에 예를 다해 묻고, 절 이름을 해광사로 바꿨다 한다. 기장은 본래 한양(서울)에서 가장 멀리 유배 보낼 수 있는 지역에 해당하기 때문에 유배와 관련된 많은 이야기가 숨어있다. 특히 오랑대는 고산 윤선도가 푸른 바다와 산세의 절경에 취해 시를 읊었다는 이야기가 전해진다. 바다 위에 우뚝 서있는 용왕단이 특히  유명하다."
부산광역시 기장군 일광면 일광로 429,,6,0.0,A02,A0201,A02010800,2775495,12,20211118000027,,,129.2544185643,35.2812735257,6.0,20221207094211,0,3,,해동성취사,46041.0,"부산광역시 기장군에 있는 해동 성취사는 2000년에 창건된 사찰로 대웅전, 지장전, 요사채 그리고 동굴 형태의 산신각을 갖추고 있다. 우암 주지스님은 한국 전통 불교 계승에 앞장서기 위하여 소리를 공양하는 범음범패(梵音梵唄)를 이수하고 불교의 가르침을 전해오고 있다. 소리로 부처님 말씀을 전하는 범음범패는 입에서 입으로 전해져 오는 한국 고유의 불교음악으로 예불과 불공 의식의 시간이 맞는다면 천상의 소리도 들을 수 있다. 해변가 인근에 위치하여 스노클링, 해루질 또는 노지 캠핑 성지로 많이 알려져 있으나 실제로는 취사나 텐트 설치가 금지된 지역이다."
부산 기장군 철마면 웅천리 879-47,,6,0.0,A01,A0101,A01010800,2758652,12,20211019020503,http://tong.visitkorea.or.kr/cms/resource/44/2758644_image2_1.jpg,http://tong.visitkorea.or.kr/cms/resource/44/2758644_image2_1.jpg,129.1667035724,35.2958702558,6.0,20211019020503,1,3,,홍연폭포,,"홍연폭포는 부산 기장군의 유일한 폭포로 거문산과 옥녀봉 사이로 흐르는 폭포다. 폭포에서 떨어지는 물줄기에 햇살이 비치면 무지개를 볼 수 있다 하여 붙여진 이름이다. 부산 기장 8경 중 하나에 꼽히는 홍연폭포 인근에는 연분홍 연꽃이 가득하다. 한없이 여유롭고 한적한 오후, 햇살 가득한 어느 날 혹시 내 앞에 나타날 무지개 편린을 만나러 가보자. 도보로 5분 거리에는 수도암이 있어 마음을 차분하게 가라앉히며 산책하기 좋다. 또한 아홉산숲과 곰내연밭도 가까운 거리에 있다."
부산광역시 기장군 장안읍 고무로 271-47,,6,0.0,A02,A0201,A02010800,2758498,12,20211019013016,http://tong.visitkorea.or.kr/cms/resource/02/2759002_image2_1.jpg,http://tong.visitkorea.or.kr/cms/resource/02/2759002_image2_1.jpg,129.2765262292,35.3360483529,6.0,20211019201006,1,3,,은진사,46035.0,"은진사에는 3천여 종의 야생화와 산수화 분경, 연꽃이 가득하다. 마음의 짐을 한시름 내려놓고 소담스럽게 피어난 꽃들을 보며 심신을 정화할 수 있는 곳이다. 여름에는 주황빛 능소화가 반겨주어 알록달록 꽃들의 향연 속에 미소가 절로 피어나는 곳이다. 바다와 물을 수호하는 신이 모셔진 용왕전이 있는 연못에는 울긋불긋 잉어 떼가 가득하고, 수국, 맥문동이 반갑게 맞이한다. 보기만 해도 기분이 좋아지는 포대화상, 항상 웃는 모습으로 자비와 복을 상징하는 미륵보살 앞에서 눈을 감고 조용히 마음속 소원 하나 빌면 모든 것이 다 잘 될 것이란 믿음이 솟아난다. 규모가 큰 절은 아니지만, 연못, 폭포 등 볼거리가 많은 절이다."
부산광역시 기장군 장안읍 장안로 482,,6,0.0,A01,A0101,A01010900,2758489,12,20211019012722,http://tong.visitkorea.or.kr/cms/resource/06/2759006_image2_1.jpg,http://tong.visitkorea.or.kr/cms/resource/06/2759006_image2_1.jpg,129.2328150778,35.3744348966,6.0,20221116144020,2,3,,장안사계곡,46028.0,부산 기장군 장안사 계곡은 신라 673년 원효대사가 창건한 천년 고찰 장안사 아래 있다. 이곳은 청정지역에서만 볼 수 있다는 반딧불이가 서식하고 있어 매년 7월 말까지는 가로등을 소등한다. 장안사 주차장 인근에 계곡이 있다는 장점에 많은 관광객이 찾는다. 장안사 계곡에서는 더욱 쾌적한 환경 유지를 위하여 야영이나 취사는 금지되어 있으니 간단하게 돗자리 깔고 나무 아래서 쉬기에 좋은 곳이다. 불광산 자락의 울창한 숲에서 전해지는 맑은 공기를 만끽하며 조용히 산책도 즐겨보자.
부산광역시 기장군 일광면 일광로 582-47,,6,0.0,A02,A0202,A02020700,2758477,12,20211019012516,http://tong.visitkorea.or.kr/cms/resource/91/2758991_image2_1.jpg,http://tong.visitkorea.or.kr/cms/resource/91/2758991_image2_1.jpg,129.2600538672,35.2927167929,6.0,20221109113444,1,3,,신평소공원,46040.0,"바위에 부서지는 파도 소리 들으며 거닐 수 있는 수변공원인 신평소공원은 작고 아담한 규모의 공원이지만 리드미컬한 해안선, 암초와 갯바위, 빨간 등대들이 조화를 이루는 곳이다. 해변 위에 놓인 데크길은 부산을 대표하는 산책로인 갈맷길 중 일부다. 공원 중앙에 위풍당당하게 배 한 척이 자리 잡고 있다. 은색 방향키를 돌리면 머나먼 바다 저편으로 나를 데려다줄 것만 같다. 편하게 쉴 수 있는 정자도 있고, 식사하고 커피 한잔하면서 머물다 가도 좋고, 어린이들과 고동, 꽃게 등을 찾는 재미도 누려볼 수 있다."
부산광역시 기장군 정관읍 정관중앙로 100,,6,0.0,A02,A0202,A02020700,2758469,12,20211019012117,http://tong.visitkorea.or.kr/cms/resource/78/2758978_image2_1.jpg,http://tong.visitkorea.or.kr/cms/resource/78/2758978_image2_1.jpg,129.1817597786,35.3253311206,6.0,20221116165948,4,3,,소두방공원,46019.0,"소두방이란 명칭은 기장군 정관읍과 철마면 일대 지형이 솥뚜껑을 엎어둔 모양과 같아 붙여진 이름이다. 소두방공원은 정관 신도시 내에 위치한 공원으로 산을 끼고 산책로가 조성되어 있어 가족 단위의 시민들이 즐겨 찾는 곳이다. 어린이 놀이터, 야외무대, 야생화 공원, 축구장, 테니스장, 배드민턴장, 풋살이나 농구가 가능한 다목적 운동장 등 누구나 자연과 함께 즐길 수 있다. 정관박물관, 정관도서관도 가까이 있어 다양한 문화생활을 같이 할 수 있는 최적의 나들이 장소이다."
부산광역시 기장군 기장읍 기장해안로 268-31,,6,0.0,A02,A0203,A02030400,2733035,12,20210811221744,http://tong.visitkorea.or.kr/cms/resource/22/2733022_image2_1.jpg,http://tong.visitkorea.or.kr/cms/resource/22/2733022_image2_1.jpg,129.228925803,35.2002043557,,20221213095332,1,3,,캐비네 드 쁘아쏭(미디어 갤러리),46083.0,"캐비네 드 쁘아쏭은 아난티가 추구하는 자연에 대한 존중, 인문학을 향한 사랑 그리고 공존의 가치를 미디어 테크놀로지 아트로 표현했다. 전혀 다른 성격의 시설들이 한데 모여 지금까지 없었던 새로운 가치를 창조한다. 자연, 인간, 과거, 현재, 미래 가치가 공존하는 아난티만의 이야기를 만나보자."
부산광역시 기장군 기장읍 서부리,,6,0.0,A02,A0202,A02020700,2729918,12,20210803193508,,,129.2042100127,35.2462820674,6.0,20221114171442,1,3,,용소웰빙공원,46059.0,"용소웰빙공원은 논밭이 있던 곳에 주택단지가 들어서면서 용도를 다한 저수지를 공원화하는 사업을 진행하며 탄생 했으며, 2008년 대한민국 조경대상 장관상을 받은 공원이다. 사계절 내내 자연풍을 느끼며 숲길 산책을 하기에 좋고, 저수지의 잔잔한 물결을 바라보며 휴식하기에도 좋다. 숲으로 아늑하게 둘러싸인 아담한 호수와 다양한 수생식물을 전망대에 올라 바라보면 지친 일상도 잊게 만들어준다. 산책로를 따라 호수를 한 바퀴 도는데 약 30분 정도가 걸리며, 벤치와 흔들의자, 정자, 운동기구 등 휴식공간과 편의시설이 구비되어 있어 많은 주민들에게 사랑받고 있는 공원이다."
부산광역시 기장군 기장읍 죽성리 30-33,,6,0.0,A01,A0101,A01011400,2715654,12,20210508014506,http://tong.visitkorea.or.kr/cms/resource/54/2716554_image2_1.jpg,http://tong.visitkorea.or.kr/cms/resource/54/2716554_image3_1.jpg,129.246848071,35.2426471573,6.0,20220414110149,0,3,,죽성항(황학대),,죽성항은 부산의 다른 항구에 비해 아주 소박하고 작은 편에 속한다. 항구 주변으로는 집들이 흩어져 있으며 담벽에 고기잡이 그물이 걸려 있는데 7080년대 어촌 마을 분위기를 연출한다. 항구 곳곳에는 멸치를 말리는 모습이 흔하고 조그마한 방파제에는 작은 선박이 정박해 있다. 죽성항 해안에는 동화 같은 느낌의 죽성성당이 보인다. 실제 성당은 아니고 드라마 드림세트장이다. 죽성항의 명물로 언제나 관광객의 발길이 끊이지 않는다.
부산광역시 기장군 기장읍 월전해안길 31,,6,0.0,A01,A0101,A01011400,2715652,12,20210508014158,http://tong.visitkorea.or.kr/cms/resource/25/2716525_image2_1.jpg,http://tong.visitkorea.or.kr/cms/resource/25/2716525_image3_1.jpg,129.2451761137,35.2383253882,6.0,20220520094510,2,3,,월전포구(월전방파제),46078.0,"월전포구는 아담한 항구로 장어구이가 유명하다. 때문에 포구 주변으로 작은 횟집들과 장어구이집들이 올망졸망 몰려 있다. 월전 방파제에서는 낚시를 즐기는 낚시꾼들이 새벽부터 자리를 잡는 모습이 흔하다. 월전방파제 끝에 세워진 월전등대는 2009년 9월부터 첫 점등을 했다고 하는데 월전마음에 뜬달이라는 의미를 지닌다. 다른 등대와는 달리 1, 2층이 전망대로 구성되어 둘러보기 좋다. 인근에는 월전 꽃동산, 월전활어판매장이 위치해 있으며, 월전 꽃동산에서는 해변을 따라 걸을 수 있도록 산책로가 마련되어 있다."
