addr1,addr2,areacode,booktour,cat1,cat2,cat3,contentid,contenttypeid,createdtime,firstimage,firstimage2,mapx,mapy,mlevel,modifiedtime,readcount,sigungucode,tel,title,zipcode,overview
부산광역시 기장군 기장읍 용궁길 86,,6,0.0,A02,A0201,A02010800,126848,12,20040226090000,,,129.2235599308,35.188283368,6.0,20221005112015,176967,3,,해동 용궁사(부산),46083.0," 소원을 이루어주는 염험한 곳, 해동 용궁사(부산) 

해동 용궁사는 1376년 공민왕(恭民王)의 왕사(王師)였던 나옹대사(懶翁大師)의 창건으로 한국삼대관음성지(三大觀音聖地)의 한 곳이며 바다와 용과 관음대불이 조화를 이루어 그 어느 곳보다 신앙의 깊은 뜻을 담고 있으며, 진심으로 기도를 하면 누구나 꼭 현몽을 받고 한가지 소원을 이루는 염험한 곳으로 유명하다. 임진왜란의 병화로 소실되었다가 1930년대 초 통도사의 운강(雲崗)이 중창하였다. 1974년 정암(晸菴)스님이 이 절의 주지가 되어 관음도량으로 복원할 것을 발원하고 백일기도를 하였는데, 꿈에서 흰옷을 입은 관세음보살이 용을 타고 승천하는 것을 보았다 하여 절 이름을 해동용궁사로 바꾸었다.

현존하는 건물은 대웅전을 비롯하여 굴법당·용왕당(용궁단)·범종각·요사채 등이 있다. 대웅전은 주지 정암이 1970년대에 중창하였다. 대웅전 옆에 있는 굴법당은 미륵전이라고 하여 창건 때부터 미륵좌상 석불을 모시고 있는데 자손이 없는 사람이 기도하면 자손을 얻게 된다 하여 득남불이라고 부른다. 대웅전 앞에는 사사자 3층 석탑이 있다. 원래 이 자리에는 3m 높이의 바위(미륵바위)가 있었는데 임진왜란 때 절이 폐허가 되고 6·25전쟁 때 해안경비망 구축으로 파괴됨에 따라, 1990년에 정암이 파석을 모으고 손상된 암벽을 보축하여 이 석탑을 세우고 스리랑카에서 가져온 불사리 7과를 봉안하였다. 이밖에 단일 석재로는 한국 최대의 석상인 약 10m 높이의 해수관음대불, 동해 갓바위 부처라고도 하는 약사여래불이 있다. 절 입구에는 교통안전기원탑과 108계단이 있고, 계단 초입에 달마상이 있는데 코와 배를 만지면 득남한다는 전설이 전한다.

 해동용궁사 인근의 볼거리 
주차장에서 내려 2분만 걸어가면 동양철학의 육십갑자 십이지상이 봉안되어 있고 우리 모두의 안정운행을 기원하는 교통 안정 기원 탑이 조심운전을 당부한다. 풍광을 찬탄한 춘원 이광수의 시비와 ""청산은 나를 보고 말 없이 살라하고 창공은 나를 보고 티없이 살라하네"" 라고 노래한 저 유명한 나웅화상의 시귀는 잠시나마 나 자신을 다시 한번 돌아보게 한다. 용문석굴을 지나 108돌계단을 한 계단 한계단 내려가면 정렬된 석등군, 검푸른 넓은 바다는 실제 용궁으로 들어가는 기분으로 감탄과 환희 그 자체이다. 왼쪽으로 백호바위에 약사여래석불이 모셔져 있고 조금만 더 가면 해가 제일 먼저 뜨는 일출암이 자리하고 있다."
부산광역시 기장군 일광면 삼성3길 17,,6,0.0,A01,A0101,A01011200,126098,12,20031231090000,http://tong.visitkorea.or.kr/cms/resource/20/2557720_image2_1.jpg,http://tong.visitkorea.or.kr/cms/resource/20/2557720_image2_1.jpg,129.2336848474,35.2599699714,6.0,20220513143039,57400,3,,일광해수욕장,46044.0,"일광해수욕장은 동해 남부해안의 해수욕장 중에서 가족동반 피서객이 많이 찾는 곳으로 백사장 왼편에 소나무숲인 강송정이 있다. 또, 인근에 있는 칠암에는 횟집촌이 형성돼 싱싱한 육질의 생선회를 맛볼 수 있어 해마다 많은 피서객들이 찾는 곳이다.고려말 정몽주·이색·이숭인이 유람하였다는 삼성대(三聖臺)가 백사장 가운데 솟아 있고 왼쪽에는 강송정이 있다. 일광해수욕장의 해안선을 따라 수백 년이 된 노송들이 숲을 이루고 있었다고 전하지만 현재는 남아있지 않다. 해안선의 오른쪽 끝에 있는 학리마을에는 노송림에서 살아가는 학에서 이름이 유래된 것으로 여겨진다.  일광해수욕장의 수심은 얕고 해안선이 강송정에서 학리 어구까지 원을 이루며 펼쳐져 있어 해변이 한눈에 들어온다. 휴양지로서 기능을 할 수 있는 민박과 야영 등 숙박과 편의시설이 잘 갖추어져 있다. 해안에서 바다낚시를 즐길 수 있고 인근 칠암에서는 어항이 있어 생선횟집이 늘어서 있다. 매년 7월  8월 중에는 갯마을 축제가 열리고 있다."
