addr1,addr2,areacode,booktour,cat1,cat2,cat3,contentid,contenttypeid,createdtime,firstimage,firstimage2,mapx,mapy,mlevel,modifiedtime,readcount,sigungucode,tel,title,zipcode,overview
부산광역시 사상구 가야대로 35,(감전동),6,0,A02,A0202,A02020700,2785762,12,20211203224827,http://tong.visitkorea.or.kr/cms/resource/97/2791397_image2_1.JPG,http://tong.visitkorea.or.kr/cms/resource/97/2791397_image2_1.JPG,128.9768740479,35.1521995132,6,20220506110446,1,9,,사상근린공원,46989,"사상 근린공원은 다양한 테마공간이 마련되어 있어 아이들과 야외 활동을 하기 좋은 놀이공간이다. 동화 이상한 나라의 앨리스를 주제로 한 시계 광장을 시작으로 유아 숲 체험장인 작은 숲속 나라, 어린이 놀이터인 신비의 숲, 모험심을 기를 수 있는 모험의 성 등이 있다. 놀이장 상단부 숲속 쉼터에는 동화에 등장하는 동물들을 실제로 만나볼 수 있는 소규모 체험장도 마련되어 있어,  동화 속에 와있는 듯한 행복감을 준다.  그 외에도 바운스 돔, 짚 라인, 바닥분수대, 사상 정원, 솔밭쉼터 등 아이들이 재밌고 즐겁게 뛰어놀면서 모험심도 기르고, 꿈도 키울 수 있는 공원이다. 어른들을 위한 산책로도 있다."
부산광역시 사상구 모라동 산110-1,,6,0,A01,A0101,A01010400,2677748,12,20201021223142,,,129.0114340487,35.1843909879,6,20221019102615,1,9,,백양산 웰빙숲,46933,"부산 북구 백양산에 위치한 백양산 웰빙숲은 운수천 주변 환경을 개선하여 시민들의 휴식공간으로 재탄생된 곳으로, 자연과 사람이 공존하는 곳이다. 편백림 태교 명상숲, 숲속 테마 놀이터, 데크 쉼터, 계곡 전망대, 운수천 체험숲길, 가족이야기 숲 등 다양한 시설은 지친 몸과 마음을 휴식하기에 좋다. 피톤치드를 느끼며 데크길을 따라 산책하기에도 좋으며, 숲속 테마 놀이터에서 아이들과 함께 시간을 보내기에도 좋은 휴식 공간이다."
부산광역시 사상구 낙동대로 1231,,6,0,A01,A0101,A01010500,1338947,12,20110722230035,http://tong.visitkorea.or.kr/cms/resource/63/2488063_image2_1.jpg,http://tong.visitkorea.or.kr/cms/resource/63/2488063_image2_1.jpg,128.9732044604,35.16914477,6,20220519181549,77966,9,,삼락생태공원,46900,"삼락생태공원은 사상구 엄궁동에서부터 사상구 삼락동(강서낙동대교)까지로 낙동강하구 둔치중 가장 넓은 지역이며, 천연기념물(낙동강하구 철새도래지)로 철새를 위한 습지, 철새먹이터 및 각종 체육시설(61면)을 비롯하여 잔디광장, 야생화단지, 자전거도로, 생태 산책코스 등으로 꾸며진 체육·휴식공간이다.
삼락생태공원은 크게 세부분으로 나누어져 있는데, 첫째, 최상단부와 중앙부분에 시민들을 위한 체육시설들이 위치하고, 둘째, 상단부쪽에 갈대 및 갯버들 군락의 커다란 자연초지(일부 맹꽁이 서석지)가 형성되어 있고, 곳곳에 산책로가 조성되어 있으며, 셋째, 하단부는 갈대습지로 형성되어 있고, 겨울철에 많은 철새들이 찾아오는 곳이다.이처럼 삼락은 가장 넓은 둔치지역(4.72㎢)을 자랑하는 곳으로 다양한 자연환경과 시민들을 위한 친수공간이 조성되어 있다."
부산광역시 사상구 모라로219번길 173,(모라동),6,0,A02,A0201,A02010800,346661,12,20071221012558,,,129.0134338969,35.183582782,6,20220310130718,27445,9,,운수사(부산),46933," 문화사업에 앞장서고 있는 운수사   운수사는 부산광역시 사상구 백양산에 자리한 대한불교조계종 제14교구 본사 범어사의 말사이다. 운수사는 금정산의 일맥이 서쪽으로 내뻗쳐서 큰 봉우리를 만들어 산세 수려한 영험하고 신령한 길지에 자리 잡고 있는 천년고찰이다.전해 내려오는 말에 의하면 가야국 때 창건하였다고는 하나 이를 뒷받침 해줄 만한 사료나 유적이 남아있지 않고 몇몇 지도서 등에 나오는 정황으로 미루어 범어사, 선암사 등과 동시대에 창건되었으리라 추정되고 있다.  범어사가 문무왕 18년(678년) 의상조사에 의해 창건되었으니 운수사 역시 천삼백년의 역사를 가진 유서 깊은 고찰이라 할 수 있겠다.산이 높고 물이 깊어 운수사라는 사명이 지어졌는지는 모를 일이나 창건이래 여러 사람들의 수행처로 기도처로 자리매김하였고 최근에는 부산시민들의 정신적 의지처로 사명을 널리 드날리고 있다.세월이 흘러 오늘날 수많은 등산객과 참배객들이 줄을 잇고 있으니 운수모종에 버금가는 마음의 안식이 바로, 더불어 사는 마음임을 일찍이 깨달은 운수사 사부대중들의 선경지명이 있었기에 가능한 일임을 알 수 있다.    운수사의 아름다운 인연   어려운 이웃들과 아름다운 인연을 만들기 위한 각종 후원회를 설립, 사부대중 모두가 사회의 그늘진 곳을 향해 따뜻한 정을 나누고 있다. 예로부터 사상지역에서는 사상팔경(沙上八景)의 하나로 운수모종(雲水暮鐘)을 꼽아 왔다. 이는 운수사에서 들려오는 저녁 종소리가 이곳 사람들에게 마음의 안식을 베풀어 주었음을 미루어 짐작할 수 있을 뿐 아니라 빼어난 경치로 인해 많은 사람들이 찾았음을 시사해 주고 있다.특히, 동체대비 사상의 실현을 위해 화명종합사회복지관을 건립하여 각종 복지, 문화사업에 앞장서고 있을 뿐 아니라 신도들의 교육과 자질을 높이기 위해 불교대학을 건립, 함께 배우고 함께 실천하는 불교 대중화 운동에도 심혈을 기울이고 있다."
부산광역시 사상구 백양대로804번길 42-57 약수암,,6,0,A02,A0201,A02010800,337435,12,20071218005223,,,128.9965271813,35.1782275148,6,20220530072346,21181,9,,약수암(부산),46938," 샘물과 같은 휴식을 주는 사찰, 약수암   약수암은 부산광역시 사상구 백양산 자락에 자리한 대한불교법화종 소속 사찰이다. 청정한 약수에 부처님 영험 담은 백양산(白楊山) 약수암(藥水庵) 우리네 사찰들은 수많은 오랜 세월 깊은 수림이나 산중턱에 기거해 오면서 자연을 거스르지 않고 이를 최대한 이용해온 지혜를 터득해 왔다. 그렇기 때문에 수 천년이 흘러도 부처님의 법이 끊어지지 않고 한국의 전통적인 정신문화유산으로 전승되어왔다.그 중 불자이거나 불자가 아니거나 간에 누구든 산사에 찾아들면 꼭 감로수로 목을 축이고는 한다. 이는 사찰이 자연을 이용함과 동시에 누구에게나 개방된 공간임을 보여주는 좋은 실례이다. 약수라 불리는 감로수가 있다는 것은 그 사찰이 이미 좋은 터에 가람을 세웠음을 말해주고 있다. 언제나 사시사철 솟아나는 샘물 덕분에 사찰은 목마르지 않고 오랜 세월 산 중에서 견뎌 온 것이다.부산 사상구 약수암(藥水庵)은 사명에서 보듯 약수와 깊은 연관성을 가지고 태어난 사찰임이 분명하다. 이미 효험을 본 사람들과 현재 효험을 보고 있는 사람들의 얘기를 들어보면 이 곳 약수는 오래 전부터 사랑 받아왔고 많은 이들이 즐겨 찾는 숨은 명소이다. 관내 구청에서 그 효험을 인정하고 수질 검사를 꼼꼼하게 실시한다고 한다.   약수암의 석불 두 기   1980년대에 창건했다고 알려진 약수암은 절에서 전해 내려오는 두 분의 영험한 석불이 있는데 석고지장보살좌상과 석조여래좌상이 그것이다. 세월의 흔적으로 인해 마모가 있으나 이 두 불상은 사찰의 창건을 조사하는데 귀중한 자료가 될 뿐 아니라 우리 민중들과 함께 해온 못생겼지만 정감이 넘쳐나는 불상이다. 또 언제나 검정고무신만 신고서 평생 수행에만 일관하다 2005년 입적해 많은 이들의 표상이 됐던 청명(淸明)스님이 여기에서 55년간 주석하면서 사찰을 가꿔온 덕에 약수암은 약수 뿐 아니라 스님의 청정했던 삶으로도 알려진 사찰이다. 비록 사찰의 역사는 일천하지만 사람들을 끌어들이는 묘한 매력을 지닌 약수암은 지금도 백양산 기슭의 청명한 햇살 속에 반짝이고 있다."
